seq56-0,small,"Fortuyn verwoordde voor alles een grondig wantrouwen van de burger tegen de overheid in haar verschillende gedaanten.  Volgens Fortuyn waren burgers best veranderingsgezind, best sociaal, en niet bang voor de boze 21ste eeuw, maar twijfelden ze aan de betrouwbaarheid van de overheid, zowel in haar passieve rol  als beheerder van infrastructuur en nutsbedrijven  als in haar actieve rol, als bestrijder van criminaliteit en bevorderaar van sociale integratie","Fortuyn verwoordde voor alles een grondig wantrouwen van de burger <extra_id_0> in haar verschillende gedaanten. Volgens Fortuyn waren burgers best veranderingsgezind, best sociaal, en niet bang <extra_id_1> boze <extra_id_2> twijfelden ze aan de betrouwbaarheid van <extra_id_3> in haar <extra_id_4> beheerder van infrastructuur en nutsbedrijven <extra_id_5> actieve rol, als bestrijder van criminaliteit en bevorderaar van sociale integratie","Fortuyn verwoordde voor alles een grondig wantrouwen van de burger stand in haar verschillende gedaanten. Volgens Fortuyn waren burgers best veranderingsgezind, best sociaal, en niet bang voor de boze burger. Daarnaast twijfelden ze aan de betrouwbaarheid van de burgerlijke stand in haar functie als beheerder van infrastructuur en nutsbedrijven Fortuyn speelde een actieve rol, als bestrijder van criminaliteit en bevorderaar van sociale integratie","['tegen de overheid', 'voor de', '21ste eeuw', 'maar', 'de overheid', 'zowel', 'passieve rol als', 'als in haar']","['stand', 'voor de', 'burger. Daarnaast', 'de burgerlijke stand', 'functie als', 'Fortuyn speelde een']",17,25,1,"[0.8823529411764706, 0.0, 0.8823529411764706, 0.95, 1.0, 0.8421052631578947]",0.76
seq57-0,small,"In de meeste films waarin slechte moeders een hoofdrol spelen, zijn zij zich bewust van hun imperfecties.  Eddy en Patsy uit Absolutely Fabulous vormen de uitzondering","In de meeste films waarin slechte moeders een hoofdrol spelen, zijn zij zich bewust van hun imperfecties. Eddy <extra_id_0> Absolutely Fabulous <extra_id_1>","In de meeste films waarin slechte moeders een hoofdrol spelen, zijn zij zich bewust van hun imperfecties. Eddy - Absolutely Fabulous","['en Patsy uit', 'vormen de uitzondering']","['-', '']",6,25,1,"[1.0, 1.0]",1.0
seq58-0,small,"Tijdens het drukbezochte afscheid op Zorgvlied verwoordde vriendin Carla Delfos de brutale vechtlust en soevereine wijsheid van Cox Habbema aldus: Ze heeft een enorm avontuurlijk en afwisselend leven voor zichzelf georganiseerd.  En vergis je niet, ze had de regie stevig in handen","Tijdens het drukbezochte afscheid op Zorgvlied verwoordde vriendin <extra_id_0> brutale vechtlust en soevereine wijsheid van Cox Habbema <extra_id_1> enorm avontuurlijk en afwisselend leven <extra_id_2> En vergis je niet, ze had de regie stevig in handen","Tijdens het drukbezochte afscheid op Zorgvlied verwoordde vriendin de brutale vechtlust en soevereine wijsheid van Cox Habbema een enorm avontuurlijk en afwisselend leven En vergis je niet, ze had de regie stevig in handen","['Carla Delfos de', 'aldus: Ze heeft een', 'voor zichzelf georganiseerd.']","['de', 'een', '']",10,25,1,"[0.8666666666666667, 0.8421052631578947, 1.0]",0.9
seq59-0,small,"Nieuwe Heifetz Het aanstormende opera- en concertseizoen wordt oorverblindend.  Ivan Fischer dirigeert het Koninklijk Concertgebouworkest in Parsifal, Yannick Nzet-Sguin het Rotterdams Philharmonisch in een van zijn wonderlijk potische Bruckners, ditmaal de Achtste","Nieuwe <extra_id_0> opera- en concertseizoen wordt oorverblindend. Ivan Fischer dirigeert het Koninklijk Concertgebouworkest in Parsifal, Yannick Nzet-Sguin het Rotterdams Philharmonisch in een van <extra_id_1> potische <extra_id_2> Achtste","Nieuwe jaren opera- en concertseizoen wordt oorverblindend. Ivan Fischer dirigeert het Koninklijk Concertgebouworkest in Parsifal, Yannick Nzet-Sguin het Rotterdams Philharmonisch in een van de potische orkesten van de Achtste","['Heifetz Het aanstormende', 'zijn wonderlijk', 'Bruckners', 'ditmaal de']","['jaren', 'de', 'orkesten van de']",8,25,1,"[0.8333333333333334, 0.8666666666666667, 0.8666666666666667]",0.86
seq60-0,small,"Dossier Jihadisme De geheime gesprekken van Martin van Amerongen met prins Bernhard Bernhard, (1911-2004) zakenprins Prins Bernhard was een man die zijn leven op geheel eigen(gereide) wijze invulde.  Zijn aanwezigheid in gezelschap was zodanig dat zelfs de meest principile republikeinen zich enigszins lieten vertederen","Dossier Jihadisme De geheime gesprekken van Martin van Amerongen met prins Bernhard Bernhard, (1911-2004) zakenprins Prins Bernhard was een man die <extra_id_0> geheel eigen(gereide) wijze invulde. Zijn aanwezigheid in gezelschap <extra_id_1> dat zelfs de <extra_id_2> zich <extra_id_3>","Dossier Jihadisme De geheime gesprekken van Martin van Amerongen met prins Bernhard Bernhard, (1911-2004) zakenprins Prins Bernhard was een man die de politieke grenzen op geheel eigen(gereide) wijze invulde. Zijn aanwezigheid in gezelschap was een ontmoeting dat zelfs de man zich hield.","['zijn leven op', 'was zodanig', 'meest principile republikeinen', 'enigszins lieten vertederen']","['de politieke grenzen op', 'was een ontmoeting', 'man', 'hield.']",11,25,1,"[0.6521739130434783, 0.6111111111111112, 0.9333333333333333, 0.8888888888888888]",0.77
seq61-0,small,"Kunst & Cultuur Robby Mller  Master of Light  Dancer in the Dark, met inleiding van cameravrouw en documentairemaker Claire Pijman en haar korte documentaire Foot on the Moon.  11 juni 14","Kunst & <extra_id_0> Mller <extra_id_1> Dancer in the Dark, met inleiding van cameravrouw en documentairemaker Claire Pijman en haar <extra_id_2> on the Moon. 11 juni 14","Kunst & Fotografie Mller Dancer in the Dark, met inleiding van cameravrouw en documentairemaker Claire Pijman en haar nieuwe film Dance on the Moon. 11 juni 14","['Cultuur Robby', 'Master of Light', 'korte documentaire Foot']","['Fotografie', '', 'nieuwe film Dance']",8,25,1,"[0.8461538461538461, 1.0, 0.8260869565217391]",0.89
seq62-0,small,Gideon Ofrats tentoonstelling over Israel De Isralische cultuurfilosoof Gideon Ofrat maakte een overzichtstentoonstelling van werk waarin Isralische kunstenaars reageren op het politieke conflict.  Kan culturele harmonie de politieke disharmonie verslaan,Gideon Ofrats tentoonstelling over Israel De Isralische cultuurfilosoof Gideon Ofrat maakte <extra_id_0> van werk waarin Isralische kunstenaars reageren op het politieke <extra_id_1> harmonie de <extra_id_2>,Gideon Ofrats tentoonstelling over Israel De Isralische cultuurfilosoof Gideon Ofrat maakte deel van werk waarin Isralische kunstenaars reageren op het politieke geweld en harmonie de aarde.,"['een overzichtstentoonstelling', 'conflict. Kan culturele', 'politieke disharmonie verslaan']","['deel', 'geweld en', 'aarde.']",8,25,1,"[0.896551724137931, 0.8695652173913043, 0.9]",0.89
seq63-0,small,"Kunst & Cultuur Televisie: One Night Stand Plaatselijke folklore Herfst betekent lente voor het dramaseizoen.  Er waren al vroege bloeiers: Van God los, vierde reeks, genspireerd op echte moordzaken; de vijfde reeks van Penoza","Kunst & Cultuur Televisie: One Night <extra_id_0> Herfst <extra_id_1> voor het dramaseizoen. Er waren al vroege bloeiers: Van God los, vierde reeks, genspireerd op echte moordzaken; de vijfde <extra_id_2>","Kunst & Cultuur Televisie: One Night Stand Herfst voor het dramaseizoen. Er waren al vroege bloeiers: Van God los, vierde reeks, genspireerd op echte moordzaken; de vijfde reeks.","['Stand Plaatselijke folklore', 'betekent lente', 'reeks van Penoza']","['Stand', '', 'reeks.']",8,25,1,"[0.8148148148148148, 1.0, 0.6875]",0.83
seq64-0,small,"22 mei 2013 Jaargang 137, Nr.  21 Aukje van Roessel, 22 mei 2013 Pikant debat in het parlement van Suriname Pieter van Maele, 22 mei 2013 Casper Thomas, 22 mei 2013 CAROLIEN OMIDI, 22 mei 2013 Aai Prins, 22 mei 2013 Lex Rietman, 22 mei 2013 Radeloos in Syri Het grote vraagstuk dat in Syri op de achtergrond alle andere overheerst is de chaos van de machteloze deskundigheid","22 mei 2013 Jaargang 137, Nr. 21 Aukje van Roessel, 22 mei 2013 Pikant <extra_id_0> parlement van Suriname Pieter van Maele, 22 mei 2013 Casper <extra_id_1> mei 2013 CAROLIEN OMIDI, 22 mei 2013 <extra_id_2> mei 2013 Lex Rietman, 22 mei 2013 Radeloos in Syri Het grote vraagstuk dat in Syri op <extra_id_3> andere overheerst <extra_id_4> van <extra_id_5>","22 mei 2013 Jaargang 137, Nr. 21 Aukje van Roessel, 22 mei 2013 Pikant in het parlement van Suriname Pieter van Maele, 22 mei 2013 Casper van der Linden, 22 mei 2013 CAROLIEN OMIDI, 22 mei 2013 Pieter van Maele, 22 mei 2013 Lex Rietman, 22 mei 2013 Radeloos in Syri Het grote vraagstuk dat in Syri op een of andere overheerst van","['debat in het', 'Thomas', '22', 'Aai Prins', '22', 'de achtergrond alle', 'is de chaos', 'de machteloze deskundigheid']","['in het', 'van der Linden, 22', 'Pieter van Maele, 22', 'een of', '', '']",17,25,1,"[0.5, 1.0, 0.9, 0.8888888888888888, 1.0, 1.0]",0.88
seq65-0,small,"De teksten daarin zijn trouwens niet van het verstandsverduisterende soort.  Het bevat veel jargoneske politieke ideologie, en nogal voorspelbare aforismen en parabels, die het Chinese volk onder de Communistische Partij veeleer zelfvertrouwen en stabiliteit lijken te willen geven dan dat ze het aanzetten tot de bijna burgeroorlogachtige waanzin en terreur van de Culturele Revolutie (1966-1976)","De teksten daarin zijn trouwens niet van het verstandsverduisterende soort. <extra_id_0> jargoneske politieke <extra_id_1> voorspelbare aforismen en parabels, die het Chinese volk onder de Communistische <extra_id_2> en stabiliteit lijken te willen geven dan dat ze <extra_id_3> tot <extra_id_4> waanzin en terreur van de Culturele Revolutie (1966-1976)","De teksten daarin zijn trouwens niet van het verstandsverduisterende soort. De jargoneske politieke teksten zijn voorspelbare aforismen en parabels, die het Chinese volk onder de Communistische Revolutie nihil en stabiliteit lijken te willen geven dan dat ze leiden tot de waanzin en terreur van de Culturele Revolutie (1966-1976)","['Het bevat veel', 'ideologie', 'en nogal', 'Partij veeleer zelfvertrouwen', 'het aanzetten', 'de bijna burgeroorlogachtige']","['De', 'teksten zijn', 'Revolutie nihil', 'leiden', 'de']",14,25,1,"[0.9285714285714286, 0.9166666666666666, 0.7333333333333333, 0.8620689655172413, 0.9230769230769231]",0.87
seq66-0,small,"Hoe noodzakelijk is Borssele-2.  Kernenergie maakt lui De komst van een tweede kernreactor is lang voorbereid, met de informele hulp van de vorige staatssecretaris van Milieu","Hoe noodzakelijk <extra_id_0> maakt lui De komst van een tweede <extra_id_1> voorbereid, met de informele hulp van de vorige staatssecretaris van Milieu","Hoe noodzakelijk | De Limburgse maakt lui De komst van een tweede minister is goed voorbereid, met de informele hulp van de vorige staatssecretaris van Milieu","['is Borssele-2. Kernenergie', 'kernreactor is lang']","['| De Limburgse', 'minister is goed']",6,25,1,"[0.7692307692307693, 0.631578947368421]",0.7
seq67-0,small,"Geen wonder.  De drie ton die het Nederlandse gezin gemiddeld aan een woning besteedt, is pakweg zes maal het jaarsalaris en voor de meeste Nederlanders de grootste uitgave die ze ooit zullen doen","<extra_id_0> drie ton die het Nederlandse gezin gemiddeld aan een woning besteedt, is pakweg zes maal het jaarsalaris en <extra_id_1> Nederlanders de <extra_id_2> die ze ooit zullen doen","De drie ton die het Nederlandse gezin gemiddeld aan een woning besteedt, is pakweg zes maal het jaarsalaris en verdienen Nederlanders de dingen die ze ooit zullen doen","['Geen wonder. De', 'voor de meeste', 'grootste uitgave']","['De', 'verdienen', 'dingen']",8,25,1,"[0.8666666666666667, 0.7142857142857143, 0.875]",0.82
seq68-0,small,"Dichters & Denkers Surrealisme Dat het recyclen van afgeschreven consumptiegoederen een der wezenskenmerken van het surrealisme is blijkt eens te meer uit de tentoonstelling (een rommelmarkt) over deze kunststroming in relatie tot design.  Een van de juwelen die Meret Oppenheim ontwierp voor Elsa Schiaparelli was een brede metalen armband, afgezet met beverbont","Dichters & Denkers Surrealisme Dat het recyclen van afgeschreven consumptiegoederen een <extra_id_0> surrealisme is blijkt <extra_id_1> uit de <extra_id_2> over deze kunststroming in relatie tot design. Een van de juwelen die Meret Oppenheim ontwierp voor Elsa Schiaparelli was <extra_id_3> armband, afgezet met beverbont","Dichters & Denkers Surrealisme Dat het recyclen van afgeschreven consumptiegoederen een voorbeeld van surrealisme is blijkt niet uit de gedachte over deze kunststroming in relatie tot design. Een van de juwelen die Meret Oppenheim ontwierp voor Elsa Schiaparelli was een armband, afgezet met beverbont","['der wezenskenmerken van het', 'eens te meer', 'tentoonstelling (een rommelmarkt)', 'een brede metalen']","['voorbeeld van', 'niet', 'gedachte', 'een']",13,25,1,"[0.7777777777777778, 0.8333333333333334, 0.8787878787878788, 0.8235294117647058]",0.83
seq69-0,small,"Pop en politiek zijn een aantrekkelijke combinatie.  Net als sport en politiek, of kunst en politiek",Pop en politiek zijn een aantrekkelijke combinatie. Net als <extra_id_0> kunst en politiek,"Pop en politiek zijn een aantrekkelijke combinatie. Net als muziek, kunst en politiek","['sport en politiek', 'of']","['muziek,']",4,25,1,[0.8823529411764706],0.88
seq70-0,small,"We noemden hem de pannenkoekenpost.  Of eigenlijk: pannekoekenpost, want het was de jaren zeventig, dus je schreef het zonder tussen-n","We noemden hem de pannenkoekenpost. Of eigenlijk: pannekoekenpost, <extra_id_0> de <extra_id_1> dus je schreef het zonder tussen-n","We noemden hem de pannenkoekenpost. Of eigenlijk: pannekoekenpost, maar de koek, dus je schreef het zonder tussen-n","['want het was', 'jaren zeventig,']","['maar', 'koek,']",5,25,1,"[0.8333333333333334, 0.8666666666666667]",0.85
seq71-0,small,"Dichters & Denkers Christine Otten, De laatste dichters Iets rauws en eerlijks Atlas, 448 blz. ,  22,50 In haar vorige boek, de verhalenbundel Engel en andere muziekverhalen (2000), wijdde Christine Otten een van de verhalen aan het zalig soort onmacht dat haar bevangt als ze naar de liedjes van Nick Cave luistert","Dichters & Denkers Christine Otten, De laatste dichters Iets rauws en eerlijks Atlas, 448 blz. , <extra_id_0> boek, <extra_id_1> en andere muziekverhalen (2000), wijdde Christine Otten een van de verhalen aan het zalig soort onmacht dat <extra_id_2> ze naar de liedjes van <extra_id_3>","Dichters & Denkers Christine Otten, De laatste dichters Iets rauws en eerlijks Atlas, 448 blz. , paperback In haar boek, De laatste dichters en andere muziekverhalen (2000), wijdde Christine Otten een van de verhalen aan het zalig soort onmacht dat bracht ze naar de liedjes van de schrijver.","['22,50 In haar vorige', 'de verhalenbundel Engel', 'haar bevangt als', 'Nick Cave luistert']","['paperback In haar', 'De laatste dichters', 'bracht', 'schrijver.']",13,25,1,"[0.8, 0.8260869565217391, 0.8125, 0.7777777777777778]",0.8
seq72-0,small,"Dichters & Denkers Fik Meijer Vreemdelingen in de Oudheid In Vreemd volk beschrijft Fik Meijer de vreemdelingenproblematiek van de klassieke Oudheid.  Hij ziet verschijnselen die z op de hedendaagse werkelijkheid gelegd kunnen worden, maar constateert ook dat de ouderen voor ons onbegrijpelijke ideen hadden","Dichters & Denkers <extra_id_0> in de Oudheid In Vreemd volk beschrijft Fik Meijer de vreemdelingenproblematiek <extra_id_1> Oudheid. Hij ziet verschijnselen die z <extra_id_2> werkelijkheid gelegd kunnen worden, maar constateert ook dat de <extra_id_3> ons onbegrijpelijke ideen hadden","Dichters & Denkers Vreemd volk in de Oudheid In Vreemd volk beschrijft Fik Meijer de vreemdelingenproblematiek in de Oudheid. Hij ziet verschijnselen die z in werkelijkheid gelegd kunnen worden, maar constateert ook dat de meeste ons onbegrijpelijke ideen hadden","['Fik Meijer Vreemdelingen', 'van de klassieke', 'op de hedendaagse', 'ouderen voor']","['Vreemd volk', 'in de', 'in', 'meeste']",11,25,1,"[0.75, 0.75, 0.9411764705882353, 0.8333333333333334]",0.82
seq73-0,small,"Ruw gebonk, krijsend lachen, dan stilte, en de volgende dag groeten ze me glimlachend.  Wat speelt zich allemaal in de hoofden bij de mensen thuis en op straat af","Ruw gebonk, <extra_id_0> en de volgende <extra_id_1> me glimlachend. Wat speelt zich allemaal in de hoofden bij de mensen thuis en op straat af","Ruw gebonk, glimlachend en de volgende glimlach me glimlachend. Wat speelt zich allemaal in de hoofden bij de mensen thuis en op straat af","['krijsend lachen', 'dan stilte,', 'dag groeten ze']","['glimlachend', 'glimlach']",7,25,1,"[0.6, 0.9090909090909091]",0.75
seq74-0,small,"Toneelschrijvers zijn er steeds als de kippen bij - de Bende van Venlo, Srebrenica en Emily denderden al over de planken.  Maar waar blijven de filmmakers",Toneelschrijvers zijn er steeds als de kippen bij - de <extra_id_0> Srebrenica en Emily denderden al over de planken. Maar waar <extra_id_1>,Toneelschrijvers zijn er steeds als de kippen bij - de mannen van Srebrenica en Emily denderden al over de planken. Maar waar,"['Bende van Venlo,', 'blijven de filmmakers']","['mannen van', '']",6,25,1,"[0.6875, 1.0]",0.84
seq75-0,small,Lillo Mastino (1952-2018) De op 17 maart overleden Lillo was de jongste van de familie van visrestaurant Mastino op het strand bij Rome.  Waarom openen jullie geen eethuisje,Lillo Mastino (1952-2018) De op 17 maart overleden Lillo was de jongste van de familie van visrestaurant <extra_id_0> bij Rome. Waarom openen <extra_id_1>,Lillo Mastino (1952-2018) De op 17 maart overleden Lillo was de jongste van de familie van visrestaurant bij Rome. Waarom openen,"['Mastino op het strand', 'jullie geen eethuisje']","['', '']",7,25,1,"[1.0, 1.0]",1.0
seq76-0,small,Wat spreek jij goed Nederlands Nnenna Onwuka beeld Gorilla Welke struggle.  Het is duidelijk dat ik iets verkeerds heb gezegd,Wat spreek jij goed Nederlands Nnenna Onwuka beeld Gorilla Welke struggle. Het is <extra_id_0> iets <extra_id_1> gezegd,Wat spreek jij goed Nederlands Nnenna Onwuka beeld Gorilla Welke struggle. Het is echt iets wat beter gezegd,"['duidelijk dat ik', 'verkeerds heb']","['echt', 'wat beter']",5,25,1,"[0.875, 0.8461538461538461]",0.86
seq77-0,small,"Bidden voor het Lagerhuis Londen  Daar stond hij dan, in onze All Saints Church, een van de bekendste gezichten van het Thatcher-tijdperk: Jonathan Aitken.  De achterneef van persbaron Beaverbrook die de best denkbare opleiding had genoten (Eton College, gevolgd door Christ Church, Oxford), als oorlogscorrespondent in Vietnam was en als bewindsman op Defensie genoemd werd als toekomstig premier","Bidden voor het Lagerhuis Londen Daar stond hij dan, <extra_id_0> Saints Church, een van de bekendste gezichten van het Thatcher-tijdperk: Jonathan Aitken. <extra_id_1> van persbaron Beaverbrook die de best denkbare opleiding had <extra_id_2> gevolgd door Christ Church, Oxford), als oorlogscorrespondent <extra_id_3> en <extra_id_4> Defensie genoemd werd als toekomstig premier","Bidden voor het Lagerhuis Londen Daar stond hij dan, in Saints Church, een van de bekendste gezichten van het Thatcher-tijdperk: Jonathan Aitken. Hij was een zoon van persbaron Beaverbrook die de best denkbare opleiding had (ook gevolgd door Christ Church, Oxford), als oorlogscorrespondent en als minister van Defensie genoemd werd als toekomstig premier","['in onze All', 'De achterneef', 'genoten (Eton College,', 'in Vietnam was', 'als bewindsman op']","['in', 'Hij was een zoon', '(ook', '', 'als minister van']",14,25,1,"[0.8181818181818182, 0.8125, 0.8636363636363636, 1.0, 0.5882352941176471]",0.82
seq78-0,small,De boer mag blijven omdat ze niets bereikt Minister van Milieu zijn is eigenlijk een heel overzichtelijke klus.  In 1989 is het eerste Nationale Milieubeleidsplan aangenomen en daarin zijn voor bijna alle milieukwesties doelen vastgesteld,De boer mag blijven omdat ze niets bereikt Minister van <extra_id_0> eigenlijk een heel overzichtelijke klus. In <extra_id_1> eerste Nationale Milieubeleidsplan aangenomen <extra_id_2> voor bijna alle milieukwesties doelen vastgesteld,De boer mag blijven omdat ze niets bereikt Minister van Economische Zaken is eigenlijk een heel overzichtelijke klus. In het eerste Nationale Milieubeleidsplan aangenomen en voor bijna alle milieukwesties doelen vastgesteld,"['Milieu zijn is', '1989 is het', 'en daarin zijn']","['Economische Zaken is', 'het', 'en']",9,25,1,"[0.7, 0.7272727272727273, 0.8571428571428571]",0.76
seq79-0,small,EIGENLIJK HAD de kleine roodharige Schot dolgraag het Labour-voorzitterschap van Neil Kinnock willen overnemen.  Zijn gebrek aan classic good looks zouden hem die droom hebben ontnomen,<extra_id_0> kleine roodharige Schot dolgraag het Labour-voorzitterschap van <extra_id_1> overnemen. Zijn gebrek aan classic good looks zouden hem die droom hebben ontnomen,De kleine roodharige Schot dolgraag het Labour-voorzitterschap van de zaak overnemen. Zijn gebrek aan classic good looks zouden hem die droom hebben ontnomen,"['EIGENLIJK HAD de', 'Neil Kinnock willen']","['De', 'de zaak']",6,25,1,"[0.875, 0.8421052631578947]",0.86
seq80-0,small,Gezag heeft met macht te maken  zoveel weet ik nog wel.  En misschien komt daar wel mijn gerriteerdheid door,Gezag heeft <extra_id_0> maken zoveel weet ik nog wel. En misschien komt daar wel mijn <extra_id_1>,Gezag heeft moeten maken zoveel weet ik nog wel. En misschien komt daar wel mijn verhaal.,"['met macht te', 'gerriteerdheid door']","['moeten', 'verhaal.']",5,25,1,"[0.8333333333333334, 0.8421052631578947]",0.84
seq81-0,small,Het aantal banen speelt zoals altijd een belangrijke rol.  Iedereen is aan het rekenen maar de cijfers van de onderzoeksbureaus Buck Consultants en het Nederlands Economisch Instituut (NEI) worden het meest geciteerd,Het aantal banen speelt zoals altijd een belangrijke rol. Iedereen is aan het rekenen maar de <extra_id_0> de onderzoeksbureaus Buck <extra_id_1> Nederlands Economisch Instituut (NEI) <extra_id_2> geciteerd,Het aantal banen speelt zoals altijd een belangrijke rol. Iedereen is aan het rekenen maar de resultaten van de onderzoeksbureaus Buck en Nederlands Economisch Instituut (NEI) worden geciteerd,"['cijfers van', 'Consultants en het', 'worden het meest']","['resultaten van', 'en', 'worden']",8,25,1,"[0.7142857142857143, 0.8888888888888888, 0.625]",0.74
seq82-0,small,"In 1994 schreef professor Hans Daudt al heel terecht: er is minder reden dan ooit de VVD te onderschatten.  De club die door de journalistiek vaak als eeuwige oppositiepartij gezien wordt, zit sinds 1959 al 31 jaar in de regering","In 1994 schreef professor Hans Daudt al heel terecht: er is minder reden dan ooit de VVD <extra_id_0> die door de journalistiek vaak als eeuwige oppositiepartij gezien wordt, zit <extra_id_1> 31 jaar <extra_id_2>","In 1994 schreef professor Hans Daudt al heel terecht: er is minder reden dan ooit de VVD die door de journalistiek vaak als eeuwige oppositiepartij gezien wordt, zit in 31 jaar","['te onderschatten. De club', 'sinds 1959 al', 'in de regering']","['', 'in', '']",10,25,1,"[1.0, 0.8461538461538461, 1.0]",0.95
seq83-0,small,"It wasnt America, stupid Londens zakencentrum Canary Wharf, Docklands, 12 september 2008  Peter Hilz /HH De Britse bankenexpert Tamim Bayoumi, werkzaam in Washington bij de mondiale instelling die zich tijdens de crisis ontpopte tot een van de keurigste critici van het mondiale financile stelsel en de eraan ten grondslag liggende ideologie, vertelt aan de telefoon dat hij zich die eerste post-Lehman G20 nog als de dag van gisteren kan herinneren.  Wat hem destijds vooral frappeerde was het verschil in perceptie over de oorzaken ervan aan beide kanten van de oceaan","It wasnt America, stupid Londens zakencentrum Canary Wharf, Docklands, 12 september 2008 Peter Hilz /HH De Britse bankenexpert Tamim Bayoumi, werkzaam in Washington bij de mondiale <extra_id_0> tijdens de crisis ontpopte tot een van de keurigste critici van het mondiale financile stelsel en de eraan <extra_id_1> ideologie, vertelt aan de telefoon dat hij zich die <extra_id_2> nog als de dag van <extra_id_3> Wat hem destijds <extra_id_4> verschil in perceptie over <extra_id_5> aan <extra_id_6> de oceaan","It wasnt America, stupid Londens zakencentrum Canary Wharf, Docklands, 12 september 2008 Peter Hilz /HH De Britse bankenexpert Tamim Bayoumi, werkzaam in Washington bij de mondiale bank die tijdens de crisis ontpopte tot een van de keurigste critici van het mondiale financile stelsel en de eraan gebaseerde ideologie, vertelt aan de telefoon dat hij zich die nog als de dag van de dag voelde. Wat hem destijds een verschil in perceptie over de aan van de oceaan","['instelling die zich', 'ten grondslag liggende', 'eerste post-Lehman G20', 'gisteren kan herinneren.', 'vooral frappeerde was het', 'de oorzaken ervan', 'beide kanten van']","['bank die', 'gebaseerde', '', 'de dag voelde.', 'een', 'de', 'van']",22,25,1,"[0.7368421052631579, 0.7727272727272727, 1.0, 0.75, 0.92, 0.8823529411764706, 0.8125]",0.84
