seq226-0,large,"Rubriek TELEVISIE Nipkow 2008 Eerder al zong ik de lof van In Afrika van Adriaan van Dis, die prachtige reis door de weerbarstigheid van het zuidelijk deel van dat continent.  Een zo voortreffelijk programma kennelijk dat alle aanwezige leden van de Nipkow-jury het bij de laatste stemronde in hun top-3 zetten",Rubriek TELEVISIE Nipkow 2008 Eerder al zong ik de lof van In Afrika van <extra_id_0> prachtige reis door de weerbarstigheid van het zuidelijk deel van dat continent. Een zo voortreffelijk programma kennelijk <extra_id_1> leden van de <extra_id_2> de laatste <extra_id_3> top-3 zetten,Rubriek TELEVISIE Nipkow 2008 Eerder al zong ik de lof van In Afrika van RTL. Een prachtige reis door de weerbarstigheid van het zuidelijk deel van dat continent. Een zo voortreffelijk programma kennelijk dat de leden van de redactie het de laatste tijd in de top-3 zetten,"['Adriaan van Dis', 'die', 'dat alle aanwezige', 'Nipkow-jury het bij', 'stemronde in hun']","['RTL. Een', 'dat de', 'redactie het', 'tijd in de']",13,25,1,"[0.8666666666666667, 0.6666666666666666, 0.8333333333333334, 0.7894736842105263]",0.79
seq227-0,large,"Er is niks glamourous aan borstkanker In een kroeg in Adelaide, Australi, bedacht een groep mannen in 1999 dat ze iets wilden doen voor hun vriend met prostaatkanker.  Ze besloten geld in te zamelen voor kankeronderzoek, maar hadden geen tijd voor ingewikkelde campagnes of een sponsor- of sportevenement, waarvoor ze moesten trainen","Er is niks glamourous <extra_id_0> een kroeg in Adelaide, Australi, bedacht een groep mannen in 1999 dat ze iets wilden <extra_id_1> met prostaatkanker. Ze besloten geld in te zamelen voor kankeronderzoek, maar hadden geen tijd voor ingewikkelde campagnes of <extra_id_2> sportevenement, waarvoor <extra_id_3>","Er is niks glamourous dan dat. In een kroeg in Adelaide, Australi, bedacht een groep mannen in 1999 dat ze iets wilden doen voor mensen met prostaatkanker. Ze besloten geld in te zamelen voor kankeronderzoek, maar hadden geen tijd voor ingewikkelde campagnes of een sportevenement, waarvoor ze","['aan borstkanker In', 'doen voor hun vriend', 'een sponsor- of', 'ze moesten trainen']","['dan dat. In', 'doen voor mensen', 'een', 'ze']",13,25,1,"[0.6111111111111112, 0.35, 0.8, 0.8888888888888888]",0.66
seq228-0,large,"NU DSK weer op vrije voeten is, gaat hij met zijn vrouw van het ene luxe restaurant naar het andere om truffels te eten.  Wel steeds met een hele sleep journalisten achter zich aan","NU DSK weer op vrije voeten is, gaat hij met <extra_id_0> het ene luxe restaurant naar het andere om truffels te eten. Wel steeds met <extra_id_1> sleep journalisten <extra_id_2>","NU DSK weer op vrije voeten is, gaat hij met zijn luxe van het ene luxe restaurant naar het andere om truffels te eten. Wel steeds met een sleep journalisten mee.","['zijn vrouw van', 'een hele', 'achter zich aan']","['zijn luxe van', 'een', 'mee.']",8,25,1,"[0.35714285714285715, 0.625, 0.9333333333333333]",0.64
seq229-0,large,"Woensdag 9 december 2009, de Balie te Amsterdam Dag van de Kunstkritiek (in digitale tijden) Critics Floating in the Virtual Sphere Overleeft de kunstkritiek het internet.  Inloop & koffie vanaf 13","Woensdag 9 december 2009, de Balie te Amsterdam Dag van de Kunstkritiek <extra_id_0> tijden) Critics Floating in the Virtual Sphere Overleeft <extra_id_1> internet. <extra_id_2> vanaf 13","Woensdag 9 december 2009, de Balie te Amsterdam Dag van de Kunstkritiek (en andere tijden) Critics Floating in the Virtual Sphere Overleeft op het internet. Vrij vanaf 13","['(in digitale', 'de kunstkritiek het', 'Inloop & koffie']","['(en andere', 'op het', 'Vrij']",8,25,1,"[0.6666666666666666, 0.7894736842105263, 0.9333333333333333]",0.8
seq230-0,large,"Kunst & Cultuur Kunst: Tams Kaszs Ik ben geen neo-primitivist, zegt de Hongaarse kunstenaar Tams Kaszs in een interview dat in een boekje bij zijn tentoonstelling verschijnt, en dat is moeilijk te geloven na het zien van de vernuftig in elkaar gezette kunstwerken in de ondergrondse ruimte van De Appel.  Er is een bulletinboard waar ambachtelijk gedrukte posters  zeefdruk, houtblok, stencils  met gekleurde punaises op zijn geprikt, het doosje punaises nog in het zicht","Kunst & Cultuur Kunst: Tams Kaszs <extra_id_0> neo-primitivist, zegt de Hongaarse kunstenaar Tams Kaszs in <extra_id_1> in een boekje bij zijn tentoonstelling verschijnt, en dat is moeilijk te geloven na het zien <extra_id_2> in elkaar gezette kunstwerken in de ondergrondse ruimte van De Appel. Er is een bulletinboard waar ambachtelijk <extra_id_3> houtblok, <extra_id_4> punaises op zijn geprikt, het doosje punaises nog <extra_id_5>","Kunst & Cultuur Kunst: Tams Kaszs Ik ben een neo-primitivist, zegt de Hongaarse kunstenaar Tams Kaszs in een brief die in een boekje bij zijn tentoonstelling verschijnt, en dat is moeilijk te geloven na het zien van de in elkaar gezette kunstwerken in de ondergrondse ruimte van De Appel. Er is een bulletinboard waar ambachtelijk op een houtblok, de punaises op zijn geprikt, het doosje punaises nog donker.","['Ik ben geen', 'een interview dat', 'van de vernuftig', 'gedrukte posters zeefdruk,', 'stencils met gekleurde', 'in het zicht']","['Ik ben een', 'een brief die', 'van de', 'op een', 'de', 'donker.']",18,25,1,"[0.09090909090909091, 0.47058823529411764, 0.625, 0.8461538461538461, 0.9090909090909091, 0.9166666666666666]",0.64
seq231-0,large,"Meer eerbied voor de echte lezers.  Voor bestsellers, het woord zegt het al, zijn lezers nodig die boeken kopen, maar vaak zullen dat klanten zijn die slechts zelden een boek kopen, alleen als het moet, als de tamtam maar lang genoeg op hun schedel heeft geklopt","Meer eerbied voor de echte lezers. Voor bestsellers, het woord zegt het al, zijn lezers nodig die <extra_id_0> vaak zullen dat klanten zijn die slechts zelden een boek <extra_id_1> het moet, als <extra_id_2> lang genoeg <extra_id_3> heeft geklopt","Meer eerbied voor de echte lezers. Voor bestsellers, het woord zegt het al, zijn lezers nodig die echt zijn. En vaak zullen dat klanten zijn die slechts zelden een boek kopen als het moet, als het lang genoeg niet heeft geklopt","['boeken kopen', 'maar', 'kopen', 'alleen als', 'de tamtam maar', 'op hun schedel']","['echt zijn. En', 'kopen als', 'het', 'niet']",12,25,1,"[0.9230769230769231, 0.8888888888888888, 0.8, 0.9]",0.88
seq232-0,large,"Nairobi  Wie op een zaterdag in Nairobi de straat op gaat, passeert altijd wel ergens een ronkende bruiloftsstoet van autos.  De kunststof bloemen op de motorkap ontnemen je een blik op het bruidspaar achter de ramen","Nairobi Wie op een zaterdag in Nairobi de straat op gaat, passeert altijd wel <extra_id_0> bruiloftsstoet van autos. De kunststof bloemen <extra_id_1> ontnemen je een <extra_id_2> bruidspaar achter de ramen","Nairobi Wie op een zaterdag in Nairobi de straat op gaat, passeert altijd wel een bruiloftsstoet van autos. De kunststof bloemen van de auto’s ontnemen je een blik op het bruidspaar achter de ramen","['ergens een ronkende', 'op de motorkap', 'blik op het']","['een', 'van de auto’s', 'blik op het']",9,25,1,"[0.8421052631578947, 0.6428571428571429, 0.0]",0.49
seq233-0,large,"Hoewel, er was een stuk taart overgebleven van gisteren.  Door een vrijgevig reiziger meegebracht uit Neurenberg","Hoewel, er was een <extra_id_0> gisteren. Door een vrijgevig reiziger meegebracht uit Neurenberg","Hoewel, er was een bezoekje gisteren. Door een vrijgevig reiziger meegebracht uit Neurenberg",['stuk taart overgebleven van'],['bezoekje'],4,25,1,[0.8888888888888888],0.89
seq234-0,large,"Ajax is altijd de club geweest van het mooie voetbal, en de mooie voetballers.  Ajax, dat was altijd fragiel, technisch, subtiel, jong, ietwat arrogant, meer vedette dan waterdrager, liever moeilijk dan makkelijk, liever mooi dan effectief","Ajax is altijd de club geweest van het <extra_id_0> de mooie voetballers. Ajax, dat was altijd fragiel, technisch, subtiel, jong, ietwat <extra_id_1> dan waterdrager, liever <extra_id_2> liever mooi dan effectief","Ajax is altijd de club geweest van het mooie Ajax en de mooie voetballers. Ajax, dat was altijd fragiel, technisch, subtiel, jong, ietwat meer dan waterdrager, liever mooi dan mooi, liever mooi dan effectief","['mooie voetbal', 'en', 'arrogant', 'meer vedette', 'moeilijk dan makkelijk,']","['mooie Ajax en', 'meer', 'mooi dan mooi,']",9,25,1,"[0.5384615384615384, 0.75, 0.8571428571428571]",0.72
seq235-0,large,"Aan de picknicktafel in Greenwich Village waar ik op zondag doorgaans de krant lees, schoof onlangs een bejaarde dame aan.  Met licht wantrouwen bekeek ze mijn warme chocolademelk en dat veranderde in afgrijzen toen ik er twee klontjes suiker in deed","Aan de picknicktafel in Greenwich Village waar ik op zondag doorgaans de krant lees, schoof onlangs een bejaarde dame aan. <extra_id_0> bekeek ze mijn warme chocolademelk <extra_id_1> afgrijzen toen ik er <extra_id_2> in deed","Aan de picknicktafel in Greenwich Village waar ik op zondag doorgaans de krant lees, schoof onlangs een bejaarde dame aan. In haar stoel bekeek ze mijn warme chocolademelk met afgrijzen toen ik er een blik in deed","['Met licht wantrouwen', 'en dat veranderde in', 'twee klontjes suiker']","['In haar stoel', 'met', 'een blik']",10,25,1,"[0.75, 0.95, 0.7]",0.8
seq236-0,large,"27 oktober 2006 Jaargang 130, Nr.  43 Aart Brouwer, 27 oktober 2006 Hubert Smeets, 27 oktober 2006 Margreet Fogteloo, 27 oktober 2006 Duco Hellema, 27 oktober 2006 Peter Vermaas, 27 oktober ","27 oktober 2006 Jaargang 130, Nr. 43 Aart Brouwer, 27 <extra_id_0> Hubert Smeets, 27 oktober 2006 Margreet Fogteloo, 27 oktober 2006 <extra_id_1> oktober 2006 <extra_id_2> oktober","27 oktober 2006 Jaargang 130, Nr. 43 Aart Brouwer, 27 oktober 2006 Hubert Smeets, 27 oktober 2006 Margreet Fogteloo, 27 oktober 2006 Willem de Vries, 27 oktober 2006 Willem de Vries, 27 oktober","['oktober 2006', 'Duco Hellema', '27', 'Peter Vermaas', '27']","['oktober 2006', 'Willem de Vries, 27', 'Willem de Vries, 27']",8,25,1,"[0.0, 0.8421052631578947, 0.8947368421052632]",0.58
seq237-0,large,"Liever een geweten zonder eer, dan eer zonder geweten.  Schuld verhoudt zich tot schaamte als geweten tot eer","Liever een geweten zonder eer, dan eer zonder <extra_id_0> tot schaamte als geweten tot eer","Liever een geweten zonder eer, dan eer zonder geweten. Liever eer tot schaamte als geweten tot eer",['geweten. Schuld verhoudt zich'],['geweten. Liever eer'],4,25,1,[0.5517241379310345],0.55
seq238-0,large,We proberen het debat altijd heel snel terug te brengen tot een ethische kwestie.  3 juni 2015  verschenen in uit nr,We proberen het debat altijd heel snel terug te brengen tot een <extra_id_0> juni 2015 <extra_id_1> uit nr,"We proberen het debat altijd heel snel terug te brengen tot een oplossing. Vrijdag, 21 juni 2015 - uit nr","['ethische kwestie. 3', 'verschenen in']","['oplossing. Vrijdag, 21', '-']",5,25,1,"[0.8636363636363636, 1.0]",0.93
seq239-0,large,De bond stond erbij en keek ernaar De ziektewet is niet meer.  Waarom gaf de vakbeweging eigenlijk geen kik,De <extra_id_0> erbij en keek ernaar De ziektewet <extra_id_1> Waarom gaf de vakbeweging eigenlijk geen kik,De vakbeweging zat erbij en keek ernaar De ziektewet Waarom gaf de vakbeweging eigenlijk geen kik,"['bond stond', 'is niet meer.']","['vakbeweging zat', '']",5,25,1,"[0.9333333333333333, 1.0]",0.97
seq240-0,large,"door Robert-Jan Friele beeld Milo De verkiezingsleuzen waarmee de vvd duidelijk maakte hoe de partij over strafrecht denkt, stonden op borden langs de snelwegen, hingen overal in de steden en werden zelfs verspreid op viltjes.  Meer straf en minder begrip voor criminelen en Meeleven met slachtoffers, niet met daders, aldus de grootste partij van het land, die opnieuw de premier leverde","door Robert-Jan Friele beeld Milo De verkiezingsleuzen waarmee <extra_id_0> maakte hoe de partij over strafrecht denkt, stonden op borden langs de snelwegen, hingen overal in de steden en werden zelfs verspreid op viltjes. Meer <extra_id_1> begrip voor criminelen en Meeleven <extra_id_2> met daders, aldus de grootste <extra_id_3> land, <extra_id_4> premier leverde","door Robert-Jan Friele beeld Milo De verkiezingsleuzen waarmee de premier duidelijk maakte hoe de partij over strafrecht denkt, stonden op borden langs de snelwegen, hingen overal in de steden en werden zelfs verspreid op viltjes. Meer bescherming en begrip voor criminelen en Meeleven met daders en niet met daders, aldus de grootste partij van het land, die de premier leverde","['de vvd duidelijk', 'straf en minder', 'met slachtoffers', 'niet', 'partij van het', 'die opnieuw de']","['de premier duidelijk', 'bescherming en', 'met daders en niet', 'partij van het', 'die de']",15,25,1,"[0.35, 0.7333333333333333, 0.7777777777777778, 0.7857142857142857, 0.7857142857142857]",0.69
seq241-0,large,Pater familias: pass defini Tussen Jeruzalem en Mekka zijn niet veel bomen te vinden.  De natuur is er weinig vrijgevig,Pater familias: pass defini Tussen Jeruzalem en Mekka <extra_id_0> bomen te vinden. De natuur <extra_id_1> weinig vrijgevig,Pater familias: pass defini Tussen Jeruzalem en Mekka zijn nog veel bomen te vinden. De natuur is weinig vrijgevig,"['zijn niet veel', 'is er']","['zijn nog veel', 'is']",5,25,1,"[0.21428571428571427, 0.6]",0.41
seq242-0,large,"Essay Essay: Het algemeen belang raakt in de knel door Yvonne Zonderop beeld Milo Veel Nederlanders nemen hun cultuur nogal vanzelfsprekend, maar in de ogen van buitenlanders die met ons moeten werken zijn wij maar een bijzonder land.  Topman Spinetti van AirFrance-klm omschreef het laatst in Het Financieele Dagblad als volgt: Als de baas in Frankrijk aan tafel zit met medewerkers, voert de baas het woord en luisteren de medewerkers","Essay <extra_id_0> belang raakt in de knel door Yvonne Zonderop beeld Milo Veel Nederlanders nemen hun cultuur nogal vanzelfsprekend, maar in de ogen <extra_id_1> met <extra_id_2> zijn wij maar een bijzonder land. Topman Spinetti <extra_id_3> het <extra_id_4> Financieele Dagblad als volgt: Als de baas in Frankrijk aan tafel zit met medewerkers, voert de baas <extra_id_5> luisteren de medewerkers","Essay Het belang raakt in de knel door Yvonne Zonderop beeld Milo Veel Nederlanders nemen hun cultuur nogal vanzelfsprekend, maar in de ogen van de Fransen met een beperkte kennis zijn wij maar een bijzonder land. Topman Spinetti schrijft in het nieuwe Financieele Dagblad als volgt: Als de baas in Frankrijk aan tafel zit met medewerkers, voert de baas een gesprek. Dan luisteren de medewerkers","['Essay: Het algemeen', 'van buitenlanders die', 'ons moeten werken', 'van AirFrance-klm omschreef', 'laatst in Het', 'het woord en']","['Het', 'van de Fransen', 'een beperkte kennis', 'schrijft in', 'nieuwe', 'een gesprek. Dan']",18,25,1,"[0.8421052631578947, 0.6666666666666666, 0.6842105263157895, 0.9259259259259259, 0.8461538461538461, 0.6875]",0.78
seq243-0,large,"De slapende cellen van Europa De Amerikaanse kritiek dat Europa moslimmigranten in de watten legt en daarmee islamitisch terrorisme in de hand werkt mag dan te ver gaan, feit is dat Europa onderdak biedt aan fundamentalistische groeperingen zoals al-Qaeda.  Zijn de Europeanen soft on islam zoals ze tijdens de Koude Oorlog soft on communism waren","De slapende cellen van Europa De Amerikaanse kritiek dat Europa moslimmigranten in de watten legt en daarmee <extra_id_0> de hand werkt mag <extra_id_1> gaan, feit is dat Europa onderdak <extra_id_2> groeperingen zoals al-Qaeda. Zijn de Europeanen <extra_id_3> zoals ze tijdens de Koude Oorlog soft on <extra_id_4>","De slapende cellen van Europa De Amerikaanse kritiek dat Europa moslimmigranten in de watten legt en daarmee terrorisme in de hand werkt mag niet op gaan, feit is dat Europa onderdak biedt aan groeperingen zoals al-Qaeda. Zijn de Europeanen niet zoals ze tijdens de Koude Oorlog soft on waren?","['islamitisch terrorisme in', 'dan te ver', 'biedt aan fundamentalistische', 'soft on islam', 'communism waren']","['terrorisme in', 'niet op', 'biedt aan', 'niet', 'waren?']",14,25,1,"[0.48, 0.8, 0.6896551724137931, 0.8461538461538461, 0.7333333333333333]",0.71
seq244-0,large,"Laat een vrouw het maar proberen Wat zegt het over een land als vrouwen de macht overnemen.  In IJsland moesten aanvankelijk bij twee van de drie grote, genationaliseerde banken de falende mannelijke directeuren plaats moeten maken voor vrouwen","Laat een vrouw het maar proberen Wat zegt <extra_id_0> als vrouwen de macht overnemen. <extra_id_1> aanvankelijk bij twee van de drie grote, genationaliseerde banken de falende mannelijke directeuren plaats <extra_id_2> vrouwen","Laat een vrouw het maar proberen Wat zegt de geschiedenis als vrouwen de macht overnemen. In de VS hebben aanvankelijk bij twee van de drie grote, genationaliseerde banken de falende mannelijke directeuren plaats voor vrouwen","['het over een land', 'In IJsland moesten', 'moeten maken voor']","['de geschiedenis', 'In de VS hebben', 'voor']",10,25,1,"[0.8235294117647058, 0.6111111111111112, 0.7647058823529411]",0.73
seq245-0,large,"De sovjetdroom van het Westen hield geen stand Het Internationale Jeugdcongres, Moskou 1957.  Tienduizenden Moskovieten stonden te juichen toen op 28 juli 1957 de deelnemers aan het Internationale Jeugdfestival op vrachtwagens en in autobussen hun intrede deden in de hoofdstad van de Sovjet-Unie","De sovjetdroom van het Westen hield geen stand Het Internationale Jeugdcongres, Moskou 1957. Tienduizenden <extra_id_0> juichen toen op 28 juli 1957 de deelnemers aan het Internationale <extra_id_1> vrachtwagens en in autobussen hun <extra_id_2> de hoofdstad <extra_id_3>","De sovjetdroom van het Westen hield geen stand Het Internationale Jeugdcongres, Moskou 1957. Tienduizenden mensen juichen toen op 28 juli 1957 de deelnemers aan het Internationale Jeugdcongres in vrachtwagens en in autobussen hun bestemming de hoofdstad Moskou...","['Moskovieten stonden te', 'Jeugdfestival op', 'intrede deden in', 'van de Sovjet-Unie']","['mensen', 'Jeugdcongres in', 'bestemming', 'Moskou...']",11,25,1,"[0.7727272727272727, 0.625, 0.8125, 0.9444444444444444]",0.79
seq246-0,large,Kijkcijfers zijn niet genadig.  Elk seizoen staat er wel iemand op die roept: Er moet meer cultuur op de televisie,Kijkcijfers zijn niet genadig. Elk seizoen <extra_id_0> wel iemand <extra_id_1> Er moet meer cultuur op de televisie,Kijkcijfers zijn niet genadig. Elk seizoen is er wel iemand die kijkt. Er moet meer cultuur op de televisie,"['staat er', 'op die roept:']","['is er', 'die kijkt.']",5,25,1,"[0.625, 0.6153846153846154]",0.62
seq247-0,large,"De uitverkorenen van het College of Europe College of Europe, Brugge, april 2014.  College-rector Jrg Monar (rechts) en premier van Schotland Alex Salmond, die een lezing komt geven  Lucy Young / eyevine / HH Met zijn archasche verschijning en besnorde bovenlip heeft rector Jrg Monar iets weg van de Britse komiek John Cleese","De uitverkorenen van het College of Europe College of Europe, Brugge, april 2014. College-rector Jrg Monar (rechts) en premier van Schotland Alex Salmond, die een lezing komt geven Lucy Young / eyevine / HH <extra_id_0> verschijning en <extra_id_1> Jrg Monar iets <extra_id_2> Britse <extra_id_3>","De uitverkorenen van het College of Europe College of Europe, Brugge, april 2014. College-rector Jrg Monar (rechts) en premier van Schotland Alex Salmond, die een lezing komt geven Lucy Young / eyevine / HH Voor de verschijning en presentatie geeft Jrg Monar iets van de Britse politiek.","['Met zijn archasche', 'besnorde bovenlip heeft rector', 'weg van de', 'komiek John Cleese']","['Voor de', 'presentatie geeft', 'van de', 'politiek.']",13,25,1,"[0.8888888888888888, 0.7333333333333333, 0.4, 0.8333333333333334]",0.71
seq248-0,large,"Essay Essay Verdeeld land De boze Nederlander Dat eeuwige wachten op de tram Het maatschappelijk onbehagen dat blijkt uit de verkiezingsuitslag wordt niet alleen ingegeven door Den Haag.  Het is ook de ergernis dat men wordt gepiepeld door de school, de huisarts, de kabelmaatschappij, de woningcorporatie","Essay Essay Verdeeld land De boze <extra_id_0> wachten op de tram Het maatschappelijk onbehagen dat blijkt uit de verkiezingsuitslag <extra_id_1> ingegeven door Den Haag. Het is ook de ergernis dat men wordt gepiepeld door <extra_id_2> huisarts, de <extra_id_3>","Essay Essay Verdeeld land De boze burgers wachten op de tram Het maatschappelijk onbehagen dat blijkt uit de verkiezingsuitslag is ingegeven door Den Haag. Het is ook de ergernis dat men wordt gepiepeld door de huisarts, de politieke partij en de","['Nederlander Dat eeuwige', 'wordt niet alleen', 'de school', 'de', 'kabelmaatschappij', 'de woningcorporatie']","['burgers', 'is', 'de', 'de']",12,25,1,"[0.8695652173913043, 0.9411764705882353, 0.7777777777777778, 0.0]",0.65
seq249-0,large,"In het Noordoosten niets nieuws De Bezige Bij, 554 blz. , 19,90 De romans van John Irving (1942) zijn vol van plot, rijk aan uitweidingen en barsten uit hun voegen van avonturen en toevallige gebeurtenissen","In het Noordoosten niets nieuws De Bezige Bij, <extra_id_0> 19,90 De romans van John Irving (1942) zijn vol van plot, rijk aan <extra_id_1> uit hun voegen <extra_id_2> toevallige gebeurtenissen","In het Noordoosten niets nieuws De Bezige Bij, € 19,90 De romans van John Irving (1942) zijn vol van plot, rijk aan verhalen die uit hun voegen rijzen door toevallige gebeurtenissen","['554 blz. ,', 'uitweidingen en barsten', 'van avonturen en']","['€', 'verhalen die', 'rijzen door']",9,25,1,"[1.0, 0.782608695652174, 0.9375]",0.91
seq250-0,large,"Kunst & Cultuur Film - Song to Song van meester Malick Verlokking van een lege wereld Rooney Mara als Faye  Cinart Terrence Malick maakt films zoals een ander een sterk verhaal vertelt: met grote gebaren.  Song to Song, vol symboliek en tragische schoonheid, wordt op de valreep gered  door een lelijk realisme","Kunst & Cultuur Film - Song to Song van meester Malick Verlokking van een lege wereld Rooney Mara als Faye Cinart Terrence Malick <extra_id_0> ander een sterk verhaal vertelt: met grote gebaren. <extra_id_1> vol symboliek en tragische schoonheid, wordt op <extra_id_2> door <extra_id_3>","Kunst & Cultuur Film - Song to Song van meester Malick Verlokking van een lege wereld Rooney Mara als Faye Cinart Terrence Malick is een meester die als geen ander een sterk verhaal vertelt: met grote gebaren. Het verhaal, vol symboliek en tragische schoonheid, wordt op door","['maakt films zoals een', 'Song to Song,', 'de valreep gered', 'een lelijk realisme']","['is een meester die als geen', 'Het verhaal,', '', '']",13,25,1,"[0.6666666666666666, 0.8461538461538461, 1.0, 1.0]",0.88
seq251-0,large,"Gewiekste veroveraars DE GROTE ARABISCHE VEROVERINGEN: HET ONTSTAAN VAN HET ISLAMITISCHE RIJK VAN AFGHANISTAN TOT SPANJE (632-750) Vertaald door Guus Houtzager, Bulaaq/EPO, 489 blz. ,  34,50 De titel van dit boek zal sommige politici, columnisten en de vaste bezoekers van de islamofobe riolen van het internet ongetwijfeld de rillingen over de rug doen lopen","Gewiekste veroveraars DE GROTE ARABISCHE VEROVERINGEN: HET <extra_id_0> ISLAMITISCHE RIJK VAN AFGHANISTAN TOT SPANJE (632-750) Vertaald door Guus Houtzager, Bulaaq/EPO, 489 blz. , 34,50 De titel van dit boek zal sommige politici, columnisten en <extra_id_1> van <extra_id_2> van het internet ongetwijfeld <extra_id_3> over de <extra_id_4>","Gewiekste veroveraars DE GROTE ARABISCHE VEROVERINGEN: HET ONDERGANG VAN DE ISLAMITISCHE RIJK VAN AFGHANISTAN TOT SPANJE (632-750) Vertaald door Guus Houtzager, Bulaaq/EPO, 489 blz. , 34,50 De titel van dit boek zal sommige politici, columnisten en schrijvers van artikelen van het internet ongetwijfeld verbazen over de","['ONTSTAAN VAN HET', 'de vaste bezoekers', 'de islamofobe riolen', 'de rillingen', 'rug doen lopen']","['ONDERGANG VAN DE', 'schrijvers', 'artikelen', 'verbazen', '']",14,25,1,"[0.4375, 0.7777777777777778, 0.75, 0.6666666666666666, 1.0]",0.73
seq252-0,large,Zou pozie dan echt een minder belangwekkende kunstvorm zijn dan proza.  Misschien omdat de Nederlandstalige pozie zogenaamd gemakzuchtig zou zijn (en het Nederlandstalige proza natuurlijk enkel ambitieus en geweldig),Zou pozie dan echt een minder belangwekkende kunstvorm zijn dan proza. Misschien omdat <extra_id_0> zogenaamd <extra_id_1> het Nederlandstalige proza natuurlijk enkel ambitieus en geweldig),Zou pozie dan echt een minder belangwekkende kunstvorm zijn dan proza. Misschien omdat het zogenaamd proza is (en het Nederlandstalige proza natuurlijk enkel ambitieus en geweldig),"['de Nederlandstalige pozie', 'gemakzuchtig zou zijn (en']","['het', 'proza is (en']",7,25,1,"[0.92, 0.72]",0.82
seq253-0,large,"Sarcasme bestaat niet in Londens Nieuwe Wereld Londen  Kostos Ruffy staat met gestrekte armen op het World Square van het Olympisch Park, gelegen tussen de Megastore en de McDonalds.  Deze in paars geklede spectator assistant wijst passanten op stukjes wortel, tomaat en ui die onverhoopt op de straatstenen zijn beland","Sarcasme bestaat niet in Londens Nieuwe Wereld Londen Kostos Ruffy staat met gestrekte armen op het World Square van het Olympisch Park, gelegen tussen de <extra_id_0> McDonalds. <extra_id_1> geklede spectator assistant wijst passanten op stukjes wortel, tomaat en <extra_id_2> op <extra_id_3> beland","Sarcasme bestaat niet in Londens Nieuwe Wereld Londen Kostos Ruffy staat met gestrekte armen op het World Square van het Olympisch Park, gelegen tussen de winkels van McDonalds. Een in rood geklede spectator assistant wijst passanten op stukjes wortel, tomaat en paprika die op de borden beland","['Megastore en de', 'Deze in paars', 'ui die onverhoopt', 'de straatstenen zijn']","['winkels van', 'Een in rood', 'paprika die', 'de borden']",12,25,1,"[0.9333333333333333, 0.6153846153846154, 0.8823529411764706, 0.7]",0.78
