Sequence id,Model size,Input sequence (ground truth),Input sequence (masked),Model output sequence,Masked tokens,Filled tokens,Number of masked tokens,Masking percentage,Duplicate count,Levenshtein distances,Levenshtein distance (avg)
seq0-0,small,"Kunst & Cultuur Arrival Praten in cirkels Vormgeving is vanaf de eerste scne de drager van betekenis in Arrival, Denis Villeneuves nieuwe film over het eerste contact tussen mensen en buitenaardse wezens.  Met trage camerabewegingen en vervreemdende geluiddesigns creert de Canadese filmmaker een wereld die we nt niet kennen","Kunst & Cultuur Arrival Praten in cirkels Vormgeving is vanaf de eerste scne <extra_id_0> betekenis in Arrival, <extra_id_1> film over het eerste contact tussen mensen en buitenaardse wezens. Met trage camerabewegingen en vervreemdende geluiddesigns creert <extra_id_2> een wereld <extra_id_3> niet kennen","Kunst & Cultuur Arrival Praten in cirkels Vormgeving is vanaf de eerste scne van betekenis in Arrival, een film over het eerste contact tussen mensen en buitenaardse wezens. Met trage camerabewegingen en vervreemdende geluiddesigns creert Arrival een wereld die we niet kennen","['de drager van', 'Denis Villeneuves nieuwe', 'de Canadese filmmaker', 'die we nt']","['van', 'een', 'Arrival', 'die we']",12,25,1,"[0.7692307692307693, 0.875, 0.9047619047619048, 0.3333333333333333]",0.72
seq1-0,small,"18 november 2009 Jaargang 133, Nr.  47 Aart Brouwer, 18 november 2009 Baas in Brussel Margreet Fogteloo, 18 november 2009 Voertuig-verliesuren Bij zijn ideen voor filebestrijding gaat minister Eurlings uit van de impliciete vooronderstelling dat de automobilist gevoelig is voor de kilometerprijzen","18 november 2009 Jaargang 133, Nr. 47 Aart Brouwer, 18 november 2009 Baas in Brussel Margreet Fogteloo, 18 november 2009 Voertuig-verliesuren Bij <extra_id_0> filebestrijding gaat minister Eurlings uit <extra_id_1> dat de automobilist <extra_id_2> de kilometerprijzen","18 november 2009 Jaargang 133, Nr. 47 Aart Brouwer, 18 november 2009 Baas in Brussel Margreet Fogteloo, 18 november 2009 Voertuig-verliesuren Bij de filebestrijding gaat minister Eurlings uit dat de automobilist de kilometerprijzen","['zijn ideen voor', 'van de impliciete vooronderstelling', 'gevoelig is voor']","['de', '', '']",10,25,1,"[0.8666666666666667, 1.0, 1.0]",0.96
seq2-0,small,"Kunst & Cultuur Televisie: Vrouw op Mars Meisjes van de sigarenfabriek Fidan Ekiz presenteert Vrouw op Mars  BNNVARA Fidan Ekiz heeft haar familie- en migratiegeschiedenis behandeld in Veerboot naar Holland.  In De pen & Het zwaard was ze al tout court televisiejournalist, persvrijheid in zes landen onderzoekend (waaronder uiteraard Turkije)","Kunst <extra_id_0> Vrouw op Mars Meisjes van de sigarenfabriek Fidan Ekiz presenteert <extra_id_1> BNNVARA <extra_id_2> haar familie- en migratiegeschiedenis behandeld in Veerboot naar Holland. In De pen & Het zwaard was ze al tout court televisiejournalist, persvrijheid in <extra_id_3> (waaronder uiteraard Turkije)","Kunst Vrouw op Mars Meisjes van de sigarenfabriek Fidan Ekiz presenteert in BNNVARA 2018 haar familie- en migratiegeschiedenis behandeld in Veerboot naar Holland. In De pen & Het zwaard was ze al tout court televisiejournalist, persvrijheid in de vrije tijd (waaronder uiteraard Turkije)","['& Cultuur Televisie:', 'Vrouw op Mars', 'Fidan Ekiz heeft', 'zes landen onderzoekend']","['', 'in', '2018', 'de vrije tijd']",12,25,1,"[1.0, 1.0, 1.0, 0.782608695652174]",0.95
seq3-0,small,"Braziliaanse klassenstrijd om de fiets So Paulo  Wie fietst, die deugt niet.  Met die woorden becommentarieerde Francisco da Costa Porto (74) de geplande aanleg van een fietspad door zijn straat Honduras, in de chique Jardins (tuinwijk) van So Paulo, in de Braziliaanse pers: Dat weten we vandaag de dag toch","Braziliaanse klassenstrijd om de fiets So Paulo Wie fietst, <extra_id_0> Met die woorden becommentarieerde Francisco da Costa Porto (74) de geplande aanleg van een fietspad door zijn straat Honduras, <extra_id_1> Jardins (tuinwijk) van So Paulo, <extra_id_2> pers: Dat weten <extra_id_3> dag toch","Braziliaanse klassenstrijd om de fiets So Paulo Wie fietst, wie moet Met die woorden becommentarieerde Francisco da Costa Porto (74) de geplande aanleg van een fietspad door zijn straat Honduras, de Jardins (tuinwijk) van So Paulo, aldus de pers: Dat weten we van de dag toch","['die deugt niet.', 'in de chique', 'in de Braziliaanse', 'we vandaag de']","['wie moet', 'de', 'aldus de', 'we van de']",12,25,1,"[0.6666666666666666, 0.8333333333333334, 0.8333333333333334, 0.3076923076923077]",0.66
seq4-0,small,"Door regelmatig mee te doen aan de jaarlijkse volksafspraak op 4 mei om 20. 00 uur op de Dam in Amsterdam ontdekte ik dat verschillende mensen, generaties en nationaliteiten hun eigen volk en eigen doden herdenken",Door regelmatig mee te doen aan de jaarlijkse volksafspraak op 4 mei om <extra_id_0> op de Dam in Amsterdam ontdekte ik <extra_id_1> generaties en nationaliteiten hun <extra_id_2> eigen doden herdenken,Door regelmatig mee te doen aan de jaarlijkse volksafspraak op 4 mei om 19.30 uur op de Dam in Amsterdam ontdekte ik hoe generaties en nationaliteiten hun eigen eigen doden herdenken,"['20. 00 uur', 'dat verschillende mensen,', 'eigen volk en']","['19.30 uur', 'hoe', 'eigen']",9,25,1,"[0.4, 0.92, 0.6153846153846154]",0.65
seq5-0,small,Duitserworst en andere verhalen Laatst was ik even in Frankrijk in het dorpje waar ik altijd met mijn ouders op vakantie was.  Na veertig jaar terug,Duitserworst en andere verhalen Laatst was ik even in Frankrijk in het dorpje <extra_id_0> met mijn ouders op <extra_id_1> veertig jaar terug,Duitserworst en andere verhalen Laatst was ik even in Frankrijk in het dorpje de Provence met mijn ouders op vakantie. Ik ben veertig jaar terug,"['waar ik altijd', 'vakantie was. Na']","['de Provence', 'vakantie. Ik ben']",6,25,1,"[0.9285714285714286, 0.5]",0.71
seq6-0,small,"De doodsangst van Bill Gates Dat gaat me toch een revolutie worden, die digitale snelweg.  De rijkste man ter wereld schreef er een boek over","De <extra_id_0> Gates Dat gaat me toch een revolutie worden, die digitale snelweg. De rijkste <extra_id_1> schreef er een boek over","De rijkste - Bill Gates Dat gaat me toch een revolutie worden, die digitale snelweg. De rijkste - Bill Gates schreef er een boek over","['doodsangst van Bill', 'man ter wereld']","['rijkste - Bill', '- Bill Gates']",6,25,1,"[0.631578947368421, 0.8571428571428571]",0.74
seq7-0,small,"Serene onrust Serenity & Anxiety.  Onder dat alomvattende motto bracht het Holland Festival in 2009 veel goede voorstellingen uit Japan, India, Vietnam, Amerika, Zuid-Afrika, Frankrijk, Duitsland en uit Nederland","Serene onrust Serenity & Anxiety. <extra_id_0> motto bracht het Holland Festival <extra_id_1> voorstellingen uit Japan, India, Vietnam, Amerika, Zuid-Afrika, Frankrijk, Duitsland en uit Nederland","Serene onrust Serenity & Anxiety. Dit motto bracht het Holland Festival met voorstellingen uit Japan, India, Vietnam, Amerika, Zuid-Afrika, Frankrijk, Duitsland en uit Nederland","['Onder dat alomvattende', 'in 2009 veel goede']","['Dit', 'met']",7,25,1,"[0.9545454545454546, 0.9444444444444444]",0.95
seq8-0,small,"Kunst & Cultuur Toneel - Kings of War Bevroren kroon Ivo van Hoves bewerking van vijf histories van Shakespeare, Hendrik V, drie delen van Hendrik VI en Richard III, keert een half jaar na de premire terug in Amsterdam.  De marathon (vier uur) gaat over de schijngestalten van leiderschap","Kunst & Cultuur Toneel - Kings of War Bevroren kroon Ivo van Hoves bewerking van vijf histories <extra_id_0> V, drie delen van Hendrik VI en Richard III, keert een half jaar na de <extra_id_1> Amsterdam. De marathon <extra_id_2> over <extra_id_3> leiderschap","Kunst & Cultuur Toneel - Kings of War Bevroren kroon Ivo van Hoves bewerking van vijf histories van Richard V, drie delen van Hendrik VI en Richard III, keert een half jaar na de marathon in Amsterdam. De marathon is over het leiderschap","['van Shakespeare', 'Hendrik', 'premire terug in', '(vier uur) gaat', 'de schijngestalten van']","['van Richard', 'marathon in', 'is', 'het']",12,25,1,"[0.6, 0.9090909090909091, 0.9375, 0.8666666666666667]",0.83
seq9-0,small,"Een beproeving noemt ze het islamitische terrorisme dat op 19 december nu ook Berlijn heeft getroffen.  Merkel richt met deze benaming duidelijk geen oorlogsverklaring aan IS, zoals Franois Hollande dat deed na de aanslagen in Parijs",Een beproeving noemt ze het islamitische terrorisme dat op 19 december nu ook Berlijn heeft getroffen. Merkel richt met deze benaming duidelijk geen oorlogsverklaring aan <extra_id_0> Hollande <extra_id_1> de <extra_id_2>,Een beproeving noemt ze het islamitische terrorisme dat op 19 december nu ook Berlijn heeft getroffen. Merkel richt met deze benaming duidelijk geen oorlogsverklaring aan François Hollande de Duitse leider.,"['IS', 'zoals Franois', 'dat deed na', 'aanslagen in Parijs']","['François', '', 'leider.']",9,25,1,"[1.0, 1.0, 0.8181818181818182]",0.94
seq10-0,small,Juist of niet juist Waarom moet je alles in de politiek kunnen uitleggen.  Als interviewer spreek ik met enige regelmaat politici,Juist of niet juist Waarom moet je alles in de <extra_id_0> uitleggen. Als interviewer <extra_id_1> enige regelmaat politici,Juist of niet juist Waarom moet je alles in de praktijk uitleggen. Als interviewer moet je met enige regelmaat politici,"['politiek kunnen', 'spreek ik met']","['praktijk', 'moet je met']",5,25,1,"[0.7333333333333333, 0.5384615384615384]",0.64
seq11-0,small,"Indonesische kinderen mogen niet buiten fietsen Jakarta - De cartoonheld op Abangs mosterdgele shirt staat strak gespannen om zijn buik en wanneer hij lacht, ontbloot hij zijn zwarte tandjes.  Hij is al vier, maar krijgt nog iedere nacht twee keer een fles poedermelk, lacht zijn moeder","Indonesische kinderen mogen niet buiten fietsen Jakarta - De cartoonheld op <extra_id_0> staat strak gespannen om zijn <extra_id_1> hij lacht, ontbloot <extra_id_2> tandjes. Hij is al vier, maar krijgt nog iedere nacht twee <extra_id_3> poedermelk, lacht zijn moeder","Indonesische kinderen mogen niet buiten fietsen Jakarta - De cartoonheld op Instagram staat strak gespannen om zijn kinderen, hij lacht, ontbloot de tandjes. Hij is al vier, maar krijgt nog iedere nacht twee dagen poedermelk, lacht zijn moeder","['Abangs mosterdgele shirt', 'buik en wanneer', 'hij zijn zwarte', 'keer een fles']","['Instagram', 'kinderen,', 'de', 'dagen']",12,25,1,"[0.8333333333333334, 0.8, 0.9333333333333333, 0.8461538461538461]",0.85
seq12-0,small,Waarom ik gedaan heb wat ik heb gedaan is een zaak die niemand aangaat.  Het is mijn strikt persoonlijke verhaal,Waarom ik gedaan heb wat ik heb gedaan is een zaak die niemand aangaat. <extra_id_0> mijn <extra_id_1>,Waarom ik gedaan heb wat ik heb gedaan is een zaak die niemand aangaat. Ik heb mijn zaak,"['Het is', 'strikt persoonlijke verhaal']","['Ik heb', 'zaak']",5,25,1,"[1.0, 0.9259259259259259]",0.96
seq13-0,small,"mijn hart en mijn maag zitten in afrika, mijn verstand hier in nederland DE EERSTE JAREN in Nederland zat ik nog met veel bitterheid en woede en behoefte aan wraak.  Het ironische is dat toen ik erover begon te schrijven de behoefte aan wraak verviel","mijn hart en mijn maag zitten in afrika, mijn verstand hier <extra_id_0> EERSTE JAREN in Nederland zat ik nog met veel bitterheid en woede en behoefte aan wraak. Het ironische is dat <extra_id_1> erover <extra_id_2> de <extra_id_3> verviel","mijn hart en mijn maag zitten in afrika, mijn verstand hier in de EERSTE JAREN in Nederland zat ik nog met veel bitterheid en woede en behoefte aan wraak. Het ironische is dat ik erover in de jaren verviel","['in nederland DE', 'toen ik', 'begon te schrijven', 'behoefte aan wraak']","['in de', 'ik', 'in', 'jaren']",11,25,1,"[0.6666666666666666, 0.7142857142857143, 0.8888888888888888, 0.8888888888888888]",0.79
seq14-0,small,"Een vierkant is een vierkant Geen schilderszwier, geen artistiek evenwicht.  Sol LeWitt toont dat ondoorgrondelijk abstract ook kan ontroeren","Een vierkant is een vierkant Geen schilderszwier, geen artistiek <extra_id_0> LeWitt toont <extra_id_1> ook kan ontroeren","Een vierkant is een vierkant Geen schilderszwier, geen artistiek verhaal LeWitt toont een vierkant die ook kan ontroeren","['evenwicht. Sol', 'dat ondoorgrondelijk abstract']","['verhaal', 'een vierkant die']",5,25,1,"[0.7142857142857143, 0.8275862068965517]",0.77
seq15-0,small,De stand van zaken vlak voor het Eerste-Kamerdebat over de nieuwe zorgwet Hoogervorst toont zich arrogant Het conflict tussen de huisartsen en minis ter Hoogervorst van Volksgezondheid gaat k over het afgeven van privacy gegevens aan verzekeraars.  Een week voor het debat in de Eerste Kamer over de nieuwe Zorg verzekeringswet is het wantrouwen in de minister groter dan ooit,De stand van zaken vlak voor het Eerste-Kamerdebat over de nieuwe zorgwet Hoogervorst toont zich <extra_id_0> tussen de huisartsen en minis ter Hoogervorst van Volksgezondheid gaat k <extra_id_1> van privacy gegevens aan verzekeraars. Een week voor het debat in de Eerste <extra_id_2> nieuwe Zorg verzekeringswet is <extra_id_3> de minister <extra_id_4>,De stand van zaken vlak voor het Eerste-Kamerdebat over de nieuwe zorgwet Hoogervorst toont zich dat de samenwerking tussen de huisartsen en minis ter Hoogervorst van Volksgezondheid gaat k van privacy gegevens aan verzekeraars. Een week voor het debat in de Eerste over de nieuwe Zorg verzekeringswet is het voorstel van de minister,"['arrogant Het conflict', 'over het afgeven', 'Kamer over de', 'het wantrouwen in', 'groter dan ooit']","['dat de samenwerking', '', 'over de', 'het voorstel van', '']",15,25,1,"[0.8571428571428571, 1.0, 0.46153846153846156, 0.5882352941176471, 1.0]",0.78
seq16-0,small,Rubriek TELEVISIE China Opvallend in de golf China-documentaires is dat vaker dan je zou denken mensen op straat voor de camera kritische geluiden laten horen; waar anderen boos over worden die dan een eind aan de opnamen proberen te maken.  Elke cameraploeg lijkt gevolgd met en door argusogen van de staat,Rubriek TELEVISIE China Opvallend in de golf China-documentaires is dat vaker dan <extra_id_0> op straat voor de camera kritische geluiden laten horen; waar anderen boos over worden die dan <extra_id_1> de opnamen proberen te maken. Elke <extra_id_2> met <extra_id_3> van de staat,Rubriek TELEVISIE China Opvallend in de golf China-documentaires is dat vaker dan ook op straat voor de camera kritische geluiden laten horen; waar anderen boos over worden die dan ook de opnamen proberen te maken. Elke gelegenheid met de voorstelling van de staat,"['je zou denken mensen', 'een eind aan', 'cameraploeg lijkt gevolgd', 'en door argusogen']","['ook', 'ook', 'gelegenheid', 'de voorstelling']",13,25,1,"[0.9, 1.0, 0.76, 0.7058823529411765]",0.84
seq17-0,small,Dichters & Denkers Marianne Vogel: Baard boven baard Heren en damesromans Docente Neerlandistiek Marianne Vogel betreurt in haar proefschrift de ongelijkwaardigheid van vrouwen en mannen in de Nederlandse literatuur.  Een stap verder op weg naar extreme politieke correctheid,Dichters & <extra_id_0> boven baard Heren en damesromans Docente Neerlandistiek Marianne Vogel betreurt in haar proefschrift de ongelijkwaardigheid van vrouwen <extra_id_1> de Nederlandse <extra_id_2> verder op weg naar extreme politieke correctheid,Dichters & mannen boven baard Heren en damesromans Docente Neerlandistiek Marianne Vogel betreurt in haar proefschrift de ongelijkwaardigheid van vrouwen in de Nederlandse samenleving verder op weg naar extreme politieke correctheid,"['Denkers Marianne Vogel: Baard', 'en mannen in', 'literatuur. Een stap']","['mannen', 'in', 'samenleving']",10,25,1,"[0.8620689655172413, 0.8333333333333334, 0.9]",0.87
seq18-0,small,"26 april 2000 Jaargang 124, Nr.  17 Ger Groot, 26 april 2000 Gijs Pothof, 26 april 2000 Paul Frentrop, 26 april 2000 Onderwijsgestapo De macht van de Onderwijsinspectie neemt weer toe","26 april 2000 Jaargang <extra_id_0> Ger Groot, <extra_id_1> 2000 Gijs Pothof, 26 <extra_id_2> Frentrop, 26 april 2000 Onderwijsgestapo De macht van de Onderwijsinspectie neemt weer toe","26 april 2000 Jaargang 26 april 2000 Ger Groot, 26 april 2000 Gijs Pothof, 26 april 2000 Frentrop, 26 april 2000 Onderwijsgestapo De macht van de Onderwijsinspectie neemt weer toe","['124', 'Nr. 17', '26 april', 'april 2000 Paul']","['26 april 2000', '26 april', 'april 2000']",8,25,1,"[0.9230769230769231, 1.0, 0.8]",0.91
seq19-0,small,"Liever een luie lezer dan geen lezer, liet hoogleraar moderne letterkunde Marita Mathijsen twee jaar geleden optekenen in de Volkskrant.  Jongeren beleven geen plezier meer aan klassiekers uit de Nederlandse literatuur","Liever een luie <extra_id_0> lezer, liet hoogleraar moderne letterkunde Marita Mathijsen twee jaar geleden optekenen in de Volkskrant. <extra_id_1> geen plezier meer aan klassiekers uit <extra_id_2>","Liever een luie stoel aan de lezer, liet hoogleraar moderne letterkunde Marita Mathijsen twee jaar geleden optekenen in de Volkskrant. “Ik weet geen plezier meer aan klassiekers uit de stijl","['lezer dan geen', 'Jongeren beleven', 'de Nederlandse literatuur']","['stoel aan de', '“Ik weet', 'stijl']",8,25,1,"[0.5714285714285714, 0.8125, 0.92]",0.77
seq20-0,small,"De veerkracht van een woonbuurt ALS EEN WIJK stil is, heerst er angst.  Dan zijn de mensen bang dat ze gepakt worden als ze iets over iemand melden","De veerkracht van een woonbuurt ALS EEN WIJK stil is, heerst er angst. Dan zijn de mensen bang dat <extra_id_0> als <extra_id_1> melden","De veerkracht van een woonbuurt ALS EEN WIJK stil is, heerst er angst. Dan zijn de mensen bang dat ze als buren melden","['ze gepakt worden', 'ze iets over iemand']","['ze', 'buren']",7,25,1,"[0.875, 0.8421052631578947]",0.86
seq21-0,small,En als ik de vertrouwde aanblik tussen het geboomte mis als ik op het Amstel Station af sjees en wil weten hoeveel tijd ik nog heb: waar is de grote klok op de gevel gebleven.  En ik wil twitteren als ik me erger aan iemands tweet: nou dat weer,En als ik de vertrouwde aanblik tussen het geboomte mis als ik op het Amstel Station af sjees en wil weten hoeveel tijd ik nog heb: waar is de <extra_id_0> de gevel <extra_id_1> wil <extra_id_2> me erger <extra_id_3> nou dat weer,En als ik de vertrouwde aanblik tussen het geboomte mis als ik op het Amstel Station af sjees en wil weten hoeveel tijd ik nog heb: waar is de hoogte van de gevel en wil ik me erger nou dat weer,"['grote klok op', 'gebleven. En ik', 'twitteren als ik', 'aan iemands tweet:']","['hoogte van', 'en', 'ik', '']",12,25,1,"[0.7692307692307693, 0.8666666666666667, 0.875, 1.0]",0.88
seq22-0,small,"Inderdaad, eo: de vrouw beslist Als je aan de vooravond van je veertigste verjaardag, op de bank gezeten, aan de hand van het journaal en Nova constateert dat op de politieke agenda van vandaag abortus en softdrugs hoog genoteerd staan, ofte wel dezelfde zaken waarvoor je 25 jaar geleden je eerste schreden op het pad van de politieke participatie zette, is niet een gevoel van vertrouwdheid maar een welhaast buitenaardse vervreemding het gevolg.  Want het mag dan alom bekend zijn dat de geschiedenis zich herhaalt, de omloopsnelheid wordt wel erg hoog op deze manier","Inderdaad, eo: de vrouw beslist <extra_id_0> de vooravond van je <extra_id_1> de bank gezeten, aan de hand van het journaal en <extra_id_2> op de politieke agenda van vandaag abortus en softdrugs hoog genoteerd staan, ofte wel dezelfde zaken waarvoor je 25 jaar geleden je eerste schreden op het pad van de politieke participatie zette, is niet een gevoel van vertrouwdheid maar een welhaast <extra_id_3> gevolg. Want het mag dan <extra_id_4> dat de <extra_id_5> de omloopsnelheid <extra_id_6> hoog <extra_id_7>","Inderdaad, eo: de vrouw beslist Dat de vooravond van je eerste schreden op de bank gezeten, aan de hand van het journaal en de krant op de politieke agenda van vandaag abortus en softdrugs hoog genoteerd staan, ofte wel dezelfde zaken waarvoor je 25 jaar geleden je eerste schreden op het pad van de politieke participatie zette, is niet een gevoel van vertrouwdheid maar een welhaast positief gevolg. Want het mag dan ook niet dat de politieke politieke politiek de omloopsnelheid van de politieke politiek hoog moet houden.","['Als je aan', 'veertigste verjaardag', 'op', 'Nova constateert dat', 'buitenaardse vervreemding het', 'alom bekend zijn', 'geschiedenis zich herhaalt,', 'wordt wel erg', 'op deze manier']","['Dat', 'eerste schreden op', 'de krant', 'positief', 'ook niet', 'politieke politieke politiek', 'van de politieke politiek', 'houden.']",24,25,1,"[0.9, 0.6666666666666666, 1.0, 0.8, 0.8620689655172413, 0.7857142857142857, 0.8888888888888888, 0.7692307692307693]",0.83
seq23-0,small,"De twee crises van Oostenrijk HET BEHOORT TOT het wezen van een crisis dat ze niet met haar oplossing begint.  Net zo behoort het kennelijk tot het wezen van een crisis in haar concrete Oostenrijkse variant dat deze vanzelfsprekende premisse stomme verbazing, ja zelfs hysterie uitlokt","De twee crises van Oostenrijk HET BEHOORT TOT het wezen van <extra_id_0> ze niet met haar oplossing begint. Net zo behoort het kennelijk tot het wezen van een crisis in <extra_id_1> variant <extra_id_2> premisse stomme verbazing, <extra_id_3> uitlokt","De twee crises van Oostenrijk HET BEHOORT TOT het wezen van een crisis waarin ze niet met haar oplossing begint. Net zo behoort het kennelijk tot het wezen van een crisis in een variant De premisse stomme verbazing, die uitlokt","['een crisis dat', 'haar concrete Oostenrijkse', 'dat deze vanzelfsprekende', 'ja zelfs hysterie']","['een crisis waarin', 'een', 'De', 'die']",12,25,1,"[0.29411764705882354, 0.8846153846153846, 0.96, 0.8823529411764706]",0.76
seq24-0,small,"24 augustus 2016 Jaargang 140, Nr.  34 Opration Burkini Vroeger was het Brigitte Bardot in tweedelig zwempak, nu zijn het moslimas die het land van oe-la-la bezighouden","24 augustus 2016 Jaargang 140, Nr. 34 Opration <extra_id_0> het Brigitte Bardot in tweedelig zwempak, nu zijn het moslimas die het <extra_id_1>","24 augustus 2016 Jaargang 140, Nr. 34 Opration het Brigitte Bardot in tweedelig zwempak, nu zijn het moslimas die het meisje.","['Burkini Vroeger was', 'land van oe-la-la bezighouden']","['', 'meisje.']",7,25,1,"[1.0, 0.896551724137931]",0.95
seq25-0,small,"Vorige week, de dag nadat het overlijden van Joost Zwagerman bekend was gemaakt, schreef ik vlug een stukje voor de website van De Groene.  Het was zon typisch Ik weet nog dat-stukje, het eerste dat in me opkwam als ik aan Joost Zwagerman dacht","Vorige <extra_id_0> nadat het overlijden van Joost Zwagerman bekend was gemaakt, schreef ik vlug een stukje voor de website van De Groene. Het was zon typisch <extra_id_1> dat-stukje, <extra_id_2> in me <extra_id_3> ik aan Joost Zwagerman dacht","Vorige week, nadat het overlijden van Joost Zwagerman bekend was gemaakt, schreef ik vlug een stukje voor de website van De Groene. Het was zon typisch een dat-stukje, maar in me woorden dacht ik dat ik aan Joost Zwagerman dacht","['week', 'de dag', 'Ik weet nog', 'het eerste dat', 'opkwam als']","['week,', 'een', 'maar', 'woorden dacht ik dat']",11,25,1,"[0.2, 0.8333333333333334, 1.0, 0.65]",0.67
seq26-0,small,"Lab Europese verkiezingen Middagje vissen in Brussel In de aanloop naar de Europese verkiezingen op 22 mei beschrijft Betto van Waarden, voormalig stagiair en beleidsmedewerker bij Directoraat-Generaal Onderwijs en Cultuur van de Europese Commissie, de dagelijkse praktijk van de politieke besluitvorming in Brussel.  Ik hoop dat je een koffie hebt gepakt voor de vergadering",Lab Europese verkiezingen Middagje vissen in Brussel In de aanloop naar de Europese verkiezingen op 22 mei beschrijft <extra_id_0> voormalig stagiair en beleidsmedewerker bij Directoraat-Generaal <extra_id_1> Cultuur van de Europese <extra_id_2> praktijk van de politieke besluitvorming in Brussel. Ik <extra_id_3> een <extra_id_4> voor de vergadering,Lab Europese verkiezingen Middagje vissen in Brussel In de aanloop naar de Europese verkiezingen op 22 mei beschrijft ik als voormalig stagiair en beleidsmedewerker bij Directoraat-Generaal de Cultuur van de Europese verkiezingen de praktijk van de politieke besluitvorming in Brussel. Ik wens een kijkje voor de vergadering,"['Betto van Waarden,', 'Onderwijs en', 'Commissie', 'de dagelijkse', 'hoop dat je', 'koffie hebt gepakt']","['ik als', 'de', 'verkiezingen de', 'wens', 'kijkje']",14,25,1,"[0.8888888888888888, 0.8333333333333334, 0.8, 0.8461538461538461, 0.8181818181818182]",0.84
seq27-0,small,"Het meisje kan er niets aan doen Het universum van Eefje Wentelteefje is de wonderbaarlijke werkelijkheid van een meisje van een jaar of tien dat de hoofdrol speelt in strips, poppen kastvoorstellingen en inmiddels ook tv-films.  Haar geestelijk vader heet Jeroen de Leijer","Het meisje kan er niets aan doen Het universum van Eefje Wentelteefje is de wonderbaarlijke werkelijkheid van een meisje van een <extra_id_0> tien dat <extra_id_1> in strips, poppen kastvoorstellingen en inmiddels <extra_id_2> geestelijk <extra_id_3> de Leijer","Het meisje kan er niets aan doen Het universum van Eefje Wentelteefje is de wonderbaarlijke werkelijkheid van een meisje van een eeuw en tien dat zich in strips, poppen kastvoorstellingen en inmiddels al geestelijk geboren. Willem de Leijer","['jaar of', 'de hoofdrol speelt', 'ook tv-films. Haar', 'vader heet Jeroen']","['eeuw en', 'zich', 'al', 'geboren. Willem']",11,25,1,"[0.8571428571428571, 0.9444444444444444, 0.9444444444444444, 0.7647058823529411]",0.88
