Sequence id,Model size,Input sequence (ground truth),Input sequence (masked),Model output sequence,Masked tokens,Filled tokens,Number of masked tokens,Masking percentage,Duplicate count,Levenshtein distances,Levenshtein distance (avg)
seq0-0,small,"Kunst & Cultuur Arrival Praten in cirkels Vormgeving is vanaf de eerste scne de drager van betekenis in Arrival, Denis Villeneuves nieuwe film over het eerste contact tussen mensen en buitenaardse wezens.  Met trage camerabewegingen en vervreemdende geluiddesigns creert de Canadese filmmaker een wereld die we nt niet kennen","Kunst & Cultuur Arrival Praten <extra_id_0> is vanaf de eerste scne de drager van betekenis in Arrival, <extra_id_1> over het eerste contact tussen mensen en buitenaardse wezens. Met trage camerabewegingen en vervreemdende geluiddesigns creert de Canadese filmmaker een wereld die we nt niet kennen","Kunst & Cultuur Arrival Praten met Arrival is vanaf de eerste scne de drager van betekenis in Arrival, een film over het eerste contact tussen mensen en buitenaardse wezens. Met trage camerabewegingen en vervreemdende geluiddesigns creert de Canadese filmmaker een wereld die we nt niet kennen","['in cirkels Vormgeving', 'Denis Villeneuves nieuwe film']","['met Arrival', 'een film']",7,15.0,1,"[0.8095238095238095, 0.7241379310344828]",0.77
seq1-0,small,"18 november 2009 Jaargang 133, Nr.  47 Aart Brouwer, 18 november 2009 Baas in Brussel Margreet Fogteloo, 18 november 2009 Voertuig-verliesuren Bij zijn ideen voor filebestrijding gaat minister Eurlings uit van de impliciete vooronderstelling dat de automobilist gevoelig is voor de kilometerprijzen","18 november 2009 Jaargang 133, Nr. 47 Aart Brouwer, 18 november 2009 Baas in Brussel Margreet Fogteloo, <extra_id_0> Voertuig-verliesuren Bij zijn ideen voor filebestrijding gaat minister Eurlings uit van de impliciete vooronderstelling dat de automobilist gevoelig is <extra_id_1>","18 november 2009 Jaargang 133, Nr. 47 Aart Brouwer, 18 november 2009 Baas in Brussel Margreet Fogteloo, 18 november 2009 Voertuig-verliesuren Bij zijn ideen voor filebestrijding gaat minister Eurlings uit van de impliciete vooronderstelling dat de automobilist gevoelig is voor brandstof.","['18 november 2009', 'voor de kilometerprijzen']","['18 november 2009', 'brandstof.']",6,15.0,1,"[0.0, 0.9166666666666666]",0.46
seq2-0,small,"Kunst & Cultuur Televisie: Vrouw op Mars Meisjes van de sigarenfabriek Fidan Ekiz presenteert Vrouw op Mars  BNNVARA Fidan Ekiz heeft haar familie- en migratiegeschiedenis behandeld in Veerboot naar Holland.  In De pen & Het zwaard was ze al tout court televisiejournalist, persvrijheid in zes landen onderzoekend (waaronder uiteraard Turkije)",Kunst & Cultuur Televisie: Vrouw op Mars Meisjes van de sigarenfabriek Fidan Ekiz presenteert Vrouw op Mars BNNVARA Fidan Ekiz heeft haar familie- en migratiegeschiedenis behandeld in Veerboot naar Holland. In De <extra_id_0> zwaard was ze al tout court <extra_id_1> zes landen onderzoekend (waaronder <extra_id_2>,Kunst & Cultuur Televisie: Vrouw op Mars Meisjes van de sigarenfabriek Fidan Ekiz presenteert Vrouw op Mars BNNVARA Fidan Ekiz heeft haar familie- en migratiegeschiedenis behandeld in Veerboot naar Holland. In De in zwaard was ze al tout court in zes landen onderzoekend (waaronder de Duitse geschiedenis).,"['pen & Het', 'televisiejournalist', 'persvrijheid in', 'uiteraard Turkije)']","['in', 'in', 'geschiedenis).']",8,15.0,1,"[0.8888888888888888, 0.8947368421052632, 0.7333333333333333]",0.84
seq3-0,small,"Braziliaanse klassenstrijd om de fiets So Paulo  Wie fietst, die deugt niet.  Met die woorden becommentarieerde Francisco da Costa Porto (74) de geplande aanleg van een fietspad door zijn straat Honduras, in de chique Jardins (tuinwijk) van So Paulo, in de Braziliaanse pers: Dat weten we vandaag de dag toch","Braziliaanse klassenstrijd om de fiets So Paulo Wie fietst, die deugt <extra_id_0> woorden becommentarieerde Francisco da Costa Porto (74) de geplande aanleg van een fietspad door zijn straat Honduras, in de <extra_id_1> van So Paulo, in de Braziliaanse pers: Dat weten we vandaag de <extra_id_2>","Braziliaanse klassenstrijd om de fiets So Paulo Wie fietst, die deugt Met woorden becommentarieerde Francisco da Costa Porto (74) de geplande aanleg van een fietspad door zijn straat Honduras, in de buurt van So Paulo, in de Braziliaanse pers: Dat weten we vandaag de dag.","['niet. Met die', 'chique Jardins (tuinwijk)', 'dag toch']","['Met', 'buurt', 'dag.']",8,15.0,1,"[0.7692307692307693, 0.88, 0.625]",0.76
seq4-0,small,"Door regelmatig mee te doen aan de jaarlijkse volksafspraak op 4 mei om 20. 00 uur op de Dam in Amsterdam ontdekte ik dat verschillende mensen, generaties en nationaliteiten hun eigen volk en eigen doden herdenken","Door regelmatig mee te doen aan de jaarlijkse <extra_id_0> 4 mei om 20. 00 uur op de Dam in Amsterdam ontdekte ik dat verschillende mensen, generaties en nationaliteiten hun eigen volk <extra_id_1> herdenken","Door regelmatig mee te doen aan de jaarlijkse bijeenkomst van 4 mei om 20. 00 uur op de Dam in Amsterdam ontdekte ik dat verschillende mensen, generaties en nationaliteiten hun eigen volk kunnen herdenken","['volksafspraak op', 'en eigen doden']","['bijeenkomst van', 'kunnen']",5,15.0,1,"[1.0, 0.7857142857142857]",0.89
seq5-0,small,Duitserworst en andere verhalen Laatst was ik even in Frankrijk in het dorpje waar ik altijd met mijn ouders op vakantie was.  Na veertig jaar terug,Duitserworst en andere verhalen Laatst was ik even in Frankrijk <extra_id_0> ik altijd met mijn ouders op vakantie was. Na veertig jaar terug,Duitserworst en andere verhalen Laatst was ik even in Frankrijk waar ik altijd met mijn ouders op vakantie was. Na veertig jaar terug,['in het dorpje waar'],['waar'],4,15.0,1,[0.7777777777777778],0.78
seq6-0,small,"De doodsangst van Bill Gates Dat gaat me toch een revolutie worden, die digitale snelweg.  De rijkste man ter wereld schreef er een boek over","De doodsangst van Bill Gates Dat <extra_id_0> revolutie worden, die digitale snelweg. De rijkste man ter wereld schreef er een boek over","De doodsangst van Bill Gates Dat kan de revolutie worden, die digitale snelweg. De rijkste man ter wereld schreef er een boek over",['gaat me toch een'],['kan de'],4,15.0,1,[0.8125],0.81
seq7-0,small,"Serene onrust Serenity & Anxiety.  Onder dat alomvattende motto bracht het Holland Festival in 2009 veel goede voorstellingen uit Japan, India, Vietnam, Amerika, Zuid-Afrika, Frankrijk, Duitsland en uit Nederland","Serene onrust Serenity & Anxiety. Onder dat alomvattende motto bracht het Holland Festival in 2009 veel goede voorstellingen uit Japan, India, Vietnam, Amerika, Zuid-Afrika, <extra_id_0> Nederland","Serene onrust Serenity & Anxiety. Onder dat alomvattende motto bracht het Holland Festival in 2009 veel goede voorstellingen uit Japan, India, Vietnam, Amerika, Zuid-Afrika, China, Nederland","['Frankrijk', 'Duitsland en uit']","['China,']",4,15.0,1,[0.8888888888888888],0.89
seq8-0,small,"Kunst & Cultuur Toneel - Kings of War Bevroren kroon Ivo van Hoves bewerking van vijf histories van Shakespeare, Hendrik V, drie delen van Hendrik VI en Richard III, keert een half jaar na de premire terug in Amsterdam.  De marathon (vier uur) gaat over de schijngestalten van leiderschap","Kunst & Cultuur Toneel - Kings of War <extra_id_0> van Hoves bewerking van vijf histories van Shakespeare, Hendrik V, drie delen van Hendrik VI en Richard III, keert een half jaar na de premire terug in Amsterdam. De marathon (vier uur) gaat over <extra_id_1>","Kunst & Cultuur Toneel - Kings of War - Willem van Hoves bewerking van vijf histories van Shakespeare, Hendrik V, drie delen van Hendrik VI en Richard III, keert een half jaar na de premire terug in Amsterdam. De marathon (vier uur) gaat over de...","['Bevroren kroon Ivo', 'de schijngestalten van leiderschap']","['- Willem', 'de...']",7,15.0,1,"[0.9444444444444444, 0.9411764705882353]",0.94
seq9-0,small,"Een beproeving noemt ze het islamitische terrorisme dat op 19 december nu ook Berlijn heeft getroffen.  Merkel richt met deze benaming duidelijk geen oorlogsverklaring aan IS, zoals Franois Hollande dat deed na de aanslagen in Parijs","Een beproeving noemt ze het islamitische terrorisme dat op 19 december nu ook Berlijn heeft getroffen. Merkel richt <extra_id_0> benaming duidelijk geen oorlogsverklaring aan IS, zoals Franois Hollande dat <extra_id_1> aanslagen in Parijs","Een beproeving noemt ze het islamitische terrorisme dat op 19 december nu ook Berlijn heeft getroffen. Merkel richt de benaming duidelijk geen oorlogsverklaring aan IS, zoals Franois Hollande dat de aanslagen in Parijs","['met deze', 'deed na de']","['de', 'de']",5,15.0,1,"[0.75, 0.8]",0.78
seq10-0,small,Juist of niet juist Waarom moet je alles in de politiek kunnen uitleggen.  Als interviewer spreek ik met enige regelmaat politici,Juist <extra_id_0> Waarom moet je alles in de politiek kunnen uitleggen. Als interviewer spreek ik met enige regelmaat politici,Juist Waarom moet je alles in de politiek kunnen uitleggen. Als interviewer spreek ik met enige regelmaat politici,['of niet juist'],[''],3,15.0,1,[1.0],1.0
seq11-0,small,"Indonesische kinderen mogen niet buiten fietsen Jakarta - De cartoonheld op Abangs mosterdgele shirt staat strak gespannen om zijn buik en wanneer hij lacht, ontbloot hij zijn zwarte tandjes.  Hij is al vier, maar krijgt nog iedere nacht twee keer een fles poedermelk, lacht zijn moeder","Indonesische kinderen mogen niet buiten fietsen Jakarta - De cartoonheld op Abangs mosterdgele shirt staat strak gespannen om zijn buik en wanneer hij lacht, ontbloot hij zijn zwarte tandjes. Hij <extra_id_0> krijgt nog iedere nacht <extra_id_1> fles poedermelk, lacht zijn moeder","Indonesische kinderen mogen niet buiten fietsen Jakarta - De cartoonheld op Abangs mosterdgele shirt staat strak gespannen om zijn buik en wanneer hij lacht, ontbloot hij zijn zwarte tandjes. Hij lacht, hij krijgt nog iedere nacht een fles poedermelk, lacht zijn moeder","['is al vier', 'maar', 'twee keer een']","['lacht, hij', 'een']",7,15.0,1,"[0.9, 1.0]",0.95
seq12-0,small,Waarom ik gedaan heb wat ik heb gedaan is een zaak die niemand aangaat.  Het is mijn strikt persoonlijke verhaal,Waarom ik gedaan heb wat <extra_id_0> is een zaak die niemand aangaat. Het is mijn strikt persoonlijke verhaal,Waarom ik gedaan heb wat ik niet weet is een zaak die niemand aangaat. Het is mijn strikt persoonlijke verhaal,['ik heb gedaan'],['ik niet weet'],3,15.0,1,[0.6153846153846154],0.62
seq13-0,small,"mijn hart en mijn maag zitten in afrika, mijn verstand hier in nederland DE EERSTE JAREN in Nederland zat ik nog met veel bitterheid en woede en behoefte aan wraak.  Het ironische is dat toen ik erover begon te schrijven de behoefte aan wraak verviel","mijn hart en mijn maag zitten in afrika, mijn verstand hier in nederland DE EERSTE JAREN in Nederland zat ik nog met veel bitterheid en woede en behoefte aan <extra_id_0> is dat toen ik erover begon te schrijven <extra_id_1> verviel","mijn hart en mijn maag zitten in afrika, mijn verstand hier in nederland DE EERSTE JAREN in Nederland zat ik nog met veel bitterheid en woede en behoefte aan vrede. Het enige is dat toen ik erover begon te schrijven verviel","['wraak. Het ironische', 'de behoefte aan wraak']","['vrede. Het enige', '']",7,15.0,1,"[0.5, 1.0]",0.75
seq14-0,small,"Een vierkant is een vierkant Geen schilderszwier, geen artistiek evenwicht.  Sol LeWitt toont dat ondoorgrondelijk abstract ook kan ontroeren","Een <extra_id_0> vierkant Geen schilderszwier, geen artistiek evenwicht. Sol LeWitt toont dat ondoorgrondelijk abstract ook kan ontroeren","Een mooi vierkant Geen schilderszwier, geen artistiek evenwicht. Sol LeWitt toont dat ondoorgrondelijk abstract ook kan ontroeren",['vierkant is een'],['mooi'],3,15.0,1,[0.9333333333333333],0.93
seq15-0,small,"Essay - Hoe de nieuwe media de waarheid ontwrichten door Katharine Viner door Ewald Engelen De consensus onder zelfbenoemde kwaliteitsmedia is dat de uitdagers van de status-quo met hun leugens, hun minachting voor feiten, hun groffe politieke stijl en hun smakeloze retoriek hebben gebroken met de waarden van de Verlichting die het verschil tussen beschaafd en onbeschaafd, geschoold en ongeschoold, volwassen en pueriel, serieus en kolderiek, rationeel en emotioneel markeren.  En dus niet serieus hoeven te worden genomen","Essay - Hoe de nieuwe media de waarheid ontwrichten door Katharine Viner door Ewald Engelen De consensus onder zelfbenoemde kwaliteitsmedia is dat de uitdagers van de status-quo met hun leugens, hun minachting voor feiten, hun groffe politieke stijl en hun smakeloze retoriek hebben gebroken met de waarden van de Verlichting die het verschil tussen <extra_id_0> geschoold <extra_id_1> en pueriel, serieus en kolderiek, rationeel en <extra_id_2> dus <extra_id_3> te worden genomen","Essay - Hoe de nieuwe media de waarheid ontwrichten door Katharine Viner door Ewald Engelen De consensus onder zelfbenoemde kwaliteitsmedia is dat de uitdagers van de status-quo met hun leugens, hun minachting voor feiten, hun groffe politieke stijl en hun smakeloze retoriek hebben gebroken met de waarden van de Verlichting die het verschil tussen rationeel en geschoold rationeel en pueriel, serieus en kolderiek, rationeel en rationeel dus dienen te worden genomen","['beschaafd en onbeschaafd,', 'en ongeschoold', 'volwassen', 'emotioneel markeren. En', 'niet serieus hoeven']","['rationeel en', 'rationeel', 'rationeel', 'dienen']",12,15.0,1,"[0.84, 0.7857142857142857, 0.8888888888888888, 0.8260869565217391]",0.84
seq16-0,small,De stand van zaken vlak voor het Eerste-Kamerdebat over de nieuwe zorgwet Hoogervorst toont zich arrogant Het conflict tussen de huisartsen en minis ter Hoogervorst van Volksgezondheid gaat k over het afgeven van privacy gegevens aan verzekeraars.  Een week voor het debat in de Eerste Kamer over de nieuwe Zorg verzekeringswet is het wantrouwen in de minister groter dan ooit,De stand van zaken vlak voor het Eerste-Kamerdebat over de <extra_id_0> toont zich arrogant Het <extra_id_1> huisartsen en minis ter Hoogervorst van Volksgezondheid gaat k over het afgeven van privacy gegevens aan verzekeraars. Een <extra_id_2> debat in de Eerste Kamer over de nieuwe Zorg verzekeringswet is het wantrouwen in de minister groter dan ooit,De stand van zaken vlak voor het Eerste-Kamerdebat over de nieuwe Zorgverzekeringswet toont zich arrogant Het debat tussen huisartsen en minis ter Hoogervorst van Volksgezondheid gaat k over het afgeven van privacy gegevens aan verzekeraars. Een reactie erop. Na het debat in de Eerste Kamer over de nieuwe Zorg verzekeringswet is het wantrouwen in de minister groter dan ooit,"['nieuwe zorgwet Hoogervorst', 'conflict tussen de', 'week voor het']","['nieuwe Zorgverzekeringswet', 'debat tussen', 'reactie erop. Na het']",9,15.0,1,"[0.5, 0.5555555555555556, 0.65]",0.57
seq17-0,small,Rubriek TELEVISIE China Opvallend in de golf China-documentaires is dat vaker dan je zou denken mensen op straat voor de camera kritische geluiden laten horen; waar anderen boos over worden die dan een eind aan de opnamen proberen te maken.  Elke cameraploeg lijkt gevolgd met en door argusogen van de staat,Rubriek TELEVISIE China Opvallend in de golf China-documentaires is dat vaker dan je zou denken mensen op straat voor de camera <extra_id_0> laten horen; waar <extra_id_1> worden die dan een eind <extra_id_2> proberen te maken. Elke cameraploeg lijkt gevolgd met en door argusogen van de staat,Rubriek TELEVISIE China Opvallend in de golf China-documentaires is dat vaker dan je zou denken mensen op straat voor de camera te laten horen; waar er mensen worden die dan een eind aan de regels proberen te maken. Elke cameraploeg lijkt gevolgd met en door argusogen van de staat,"['kritische geluiden', 'anderen boos over', 'aan de opnamen']","['te', 'er mensen', 'aan de regels']",8,15.0,1,"[0.8888888888888888, 0.7058823529411765, 0.5]",0.7
seq18-0,small,Dichters & Denkers Marianne Vogel: Baard boven baard Heren en damesromans Docente Neerlandistiek Marianne Vogel betreurt in haar proefschrift de ongelijkwaardigheid van vrouwen en mannen in de Nederlandse literatuur.  Een stap verder op weg naar extreme politieke correctheid,Dichters & Denkers Marianne Vogel: Baard boven baard Heren en damesromans Docente Neerlandistiek Marianne Vogel betreurt in haar proefschrift de ongelijkwaardigheid van vrouwen en mannen <extra_id_0> literatuur. Een stap <extra_id_1> naar extreme politieke correctheid,Dichters & Denkers Marianne Vogel: Baard boven baard Heren en damesromans Docente Neerlandistiek Marianne Vogel betreurt in haar proefschrift de ongelijkwaardigheid van vrouwen en mannen in de literatuur. Een stap naar extreme politieke correctheid,"['in de Nederlandse', 'verder op weg']","['in de', '']",6,15.0,1,"[0.7058823529411765, 1.0]",0.85
seq19-0,small,"26 april 2000 Jaargang 124, Nr.  17 Ger Groot, 26 april 2000 Gijs Pothof, 26 april 2000 Paul Frentrop, 26 april 2000 Onderwijsgestapo De macht van de Onderwijsinspectie neemt weer toe","26 april <extra_id_0> Nr. 17 Ger Groot, 26 april 2000 Gijs Pothof, 26 april 2000 Paul Frentrop, 26 april 2000 Onderwijsgestapo De macht van de <extra_id_1> weer toe","26 april 2000 Nr. 17 Ger Groot, 26 april 2000 Gijs Pothof, 26 april 2000 Paul Frentrop, 26 april 2000 Onderwijsgestapo De macht van de universiteit weer toe","['2000 Jaargang 124,', 'Onderwijsinspectie neemt']","['2000', 'universiteit']",5,15.0,1,"[0.7777777777777778, 0.7083333333333334]",0.74
seq20-0,small,"Liever een luie lezer dan geen lezer, liet hoogleraar moderne letterkunde Marita Mathijsen twee jaar geleden optekenen in de Volkskrant.  Jongeren beleven geen plezier meer aan klassiekers uit de Nederlandse literatuur","Liever een luie lezer dan geen lezer, liet hoogleraar moderne letterkunde <extra_id_0> twee jaar geleden optekenen in de Volkskrant. Jongeren beleven <extra_id_1> aan klassiekers uit de Nederlandse literatuur","Liever een luie lezer dan geen lezer, liet hoogleraar moderne letterkunde zich twee jaar geleden optekenen in de Volkskrant. Jongeren beleven behoefte aan klassiekers uit de Nederlandse literatuur","['Marita Mathijsen', 'geen plezier meer']","['zich', 'behoefte']",5,15.0,1,"[0.875, 0.8235294117647058]",0.85
seq21-0,small,"De veerkracht van een woonbuurt ALS EEN WIJK stil is, heerst er angst.  Dan zijn de mensen bang dat ze gepakt worden als ze iets over iemand melden","De veerkracht van een woonbuurt ALS EEN WIJK stil is, heerst er angst. Dan zijn de mensen bang dat ze gepakt <extra_id_0> over iemand melden","De veerkracht van een woonbuurt ALS EEN WIJK stil is, heerst er angst. Dan zijn de mensen bang dat ze gepakt worden. Laat zich over iemand melden",['worden als ze iets'],['worden. Laat zich'],4,15.0,1,[0.5],0.5
seq22-0,small,En als ik de vertrouwde aanblik tussen het geboomte mis als ik op het Amstel Station af sjees en wil weten hoeveel tijd ik nog heb: waar is de grote klok op de gevel gebleven.  En ik wil twitteren als ik me erger aan iemands tweet: nou dat weer,En als ik de vertrouwde aanblik tussen het geboomte mis als ik op het Amstel Station af sjees en wil weten hoeveel tijd ik nog heb: waar is de grote klok op de <extra_id_0> wil <extra_id_1> me erger aan iemands tweet: nou dat weer,En als ik de vertrouwde aanblik tussen het geboomte mis als ik op het Amstel Station af sjees en wil weten hoeveel tijd ik nog heb: waar is de grote klok op de rails? Ik wil niet me erger aan iemands tweet: nou dat weer,"['gevel gebleven. En ik', 'twitteren als ik']","['rails? Ik', 'niet']",7,15.0,1,"[0.8571428571428571, 0.875]",0.87
seq23-0,small,"Inderdaad, eo: de vrouw beslist Als je aan de vooravond van je veertigste verjaardag, op de bank gezeten, aan de hand van het journaal en Nova constateert dat op de politieke agenda van vandaag abortus en softdrugs hoog genoteerd staan, ofte wel dezelfde zaken waarvoor je 25 jaar geleden je eerste schreden op het pad van de politieke participatie zette, is niet een gevoel van vertrouwdheid maar een welhaast buitenaardse vervreemding het gevolg.  Want het mag dan alom bekend zijn dat de geschiedenis zich herhaalt, de omloopsnelheid wordt wel erg hoog op deze manier","Inderdaad, eo: de vrouw beslist Als je aan de vooravond van je veertigste verjaardag, op de bank gezeten, aan <extra_id_0> het journaal en Nova constateert dat op de politieke agenda van vandaag abortus en softdrugs hoog <extra_id_1> wel <extra_id_2> je 25 jaar geleden je eerste schreden op het pad van de politieke participatie zette, is niet een gevoel van vertrouwdheid maar een welhaast buitenaardse vervreemding het gevolg. Want het mag dan alom bekend zijn dat de geschiedenis <extra_id_3> de omloopsnelheid wordt <extra_id_4> op deze manier","Inderdaad, eo: de vrouw beslist Als je aan de vooravond van je veertigste verjaardag, op de bank gezeten, aan de universiteit van het journaal en Nova constateert dat op de politieke agenda van vandaag abortus en softdrugs hoog wel staan. Als je 25 jaar geleden je eerste schreden op het pad van de politieke participatie zette, is niet een gevoel van vertrouwdheid maar een welhaast buitenaardse vervreemding het gevolg. Want het mag dan alom bekend zijn dat de geschiedenis van de omloopsnelheid wordt bereikt op deze manier","['de hand van', 'genoteerd staan', 'ofte', 'dezelfde zaken waarvoor', 'zich herhaalt,', 'wel erg hoog']","['de universiteit van', '', 'staan. Als', 'van', 'bereikt']",14,15.0,1,"[0.631578947368421, 1.0, 1.0, 0.9130434782608695, 0.7857142857142857]",0.87
seq24-0,small,"De twee crises van Oostenrijk HET BEHOORT TOT het wezen van een crisis dat ze niet met haar oplossing begint.  Net zo behoort het kennelijk tot het wezen van een crisis in haar concrete Oostenrijkse variant dat deze vanzelfsprekende premisse stomme verbazing, ja zelfs hysterie uitlokt",De twee crises van Oostenrijk HET BEHOORT TOT het wezen van een crisis dat ze niet met haar oplossing begint. Net zo behoort het kennelijk tot het wezen van een crisis in haar concrete Oostenrijkse variant dat <extra_id_0> stomme <extra_id_1> uitlokt,De twee crises van Oostenrijk HET BEHOORT TOT het wezen van een crisis dat ze niet met haar oplossing begint. Net zo behoort het kennelijk tot het wezen van een crisis in haar concrete Oostenrijkse variant dat ze stomme handen uitlokt,"['deze vanzelfsprekende premisse', 'verbazing', 'ja zelfs hysterie']","['ze', 'handen']",7,15.0,1,"[0.9333333333333333, 0.8888888888888888]",0.91
seq25-0,small,"24 augustus 2016 Jaargang 140, Nr.  34 Opration Burkini Vroeger was het Brigitte Bardot in tweedelig zwempak, nu zijn het moslimas die het land van oe-la-la bezighouden","24 augustus 2016 Jaargang 140, Nr. 34 Opration Burkini Vroeger was het Brigitte <extra_id_0> nu zijn het moslimas die het land van oe-la-la bezighouden","24 augustus 2016 Jaargang 140, Nr. 34 Opration Burkini Vroeger was het Brigitte nu zijn het moslimas die het land van oe-la-la bezighouden","['Bardot in tweedelig zwempak,']",[''],4,15.0,1,[1.0],1.0
seq26-0,small,"Vorige week, de dag nadat het overlijden van Joost Zwagerman bekend was gemaakt, schreef ik vlug een stukje voor de website van De Groene.  Het was zon typisch Ik weet nog dat-stukje, het eerste dat in me opkwam als ik aan Joost Zwagerman dacht","Vorige week, de <extra_id_0> overlijden van Joost Zwagerman bekend was gemaakt, schreef ik vlug een stukje voor de website van De Groene. Het was zon typisch Ik weet <extra_id_1> dat in me opkwam als ik aan Joost Zwagerman dacht","Vorige week, de verklaring dat het overlijden van Joost Zwagerman bekend was gemaakt, schreef ik vlug een stukje voor de website van De Groene. Het was zon typisch Ik weet niet of dat in me opkwam als ik aan Joost Zwagerman dacht","['dag nadat het', 'nog dat-stukje', 'het eerste']","['verklaring dat het', 'niet of']",7,15.0,1,"[0.5, 0.8571428571428571]",0.68
seq27-0,small,"Lab Europese verkiezingen Middagje vissen in Brussel In de aanloop naar de Europese verkiezingen op 22 mei beschrijft Betto van Waarden, voormalig stagiair en beleidsmedewerker bij Directoraat-Generaal Onderwijs en Cultuur van de Europese Commissie, de dagelijkse praktijk van de politieke besluitvorming in Brussel.  Ik hoop dat je een koffie hebt gepakt voor de vergadering","Lab Europese verkiezingen Middagje vissen in Brussel In de aanloop naar de Europese verkiezingen op 22 mei beschrijft Betto van Waarden, voormalig stagiair en beleidsmedewerker bij Directoraat-Generaal Onderwijs <extra_id_0> van de Europese Commissie, de dagelijkse praktijk van de politieke besluitvorming in Brussel. Ik hoop <extra_id_1> koffie <extra_id_2> de vergadering","Lab Europese verkiezingen Middagje vissen in Brussel In de aanloop naar de Europese verkiezingen op 22 mei beschrijft Betto van Waarden, voormalig stagiair en beleidsmedewerker bij Directoraat-Generaal Onderwijs de voorzitter van de Europese Commissie, de dagelijkse praktijk van de politieke besluitvorming in Brussel. Ik hoop dat er koffie in de vergadering","['en Cultuur', 'dat je een', 'hebt gepakt voor']","['de voorzitter', 'dat er', 'in']",8,15.0,1,"[0.7692307692307693, 0.5, 1.0]",0.76
