seq57-0,small,"Essay Essay: Wereldgeluk is een hoogst wankelbare zaak Heil en onheil in de geschiedenis Geluk in de wereldgeschiedenis is een hoogst wankelbare zaak.  In haar streven naar heil voor iedereen heeft de mensheid in de afgelopen 250 jaar indrukwekkende prestaties geleverd, maar ook veel onheil over zich afgeroepen","Essay Essay: Wereldgeluk is een hoogst wankelbare zaak Heil en onheil in de geschiedenis <extra_id_0> wereldgeschiedenis is een hoogst wankelbare zaak. In haar <extra_id_1> iedereen heeft de mensheid in de afgelopen 250 jaar indrukwekkende prestaties geleverd, maar ook veel onheil over zich afgeroepen","Essay Essay: Wereldgeluk is een hoogst wankelbare zaak Heil en onheil in de geschiedenis De wereldgeschiedenis is een hoogst wankelbare zaak. In haar geschiedenis en iedereen heeft de mensheid in de afgelopen 250 jaar indrukwekkende prestaties geleverd, maar ook veel onheil over zich afgeroepen","['Geluk in de', 'streven naar heil voor']","['De', 'geschiedenis en']",7,15.0,1,"[0.9090909090909091, 0.8636363636363636]",0.89
seq58-0,small,"Fortuyn verwoordde voor alles een grondig wantrouwen van de burger tegen de overheid in haar verschillende gedaanten.  Volgens Fortuyn waren burgers best veranderingsgezind, best sociaal, en niet bang voor de boze 21ste eeuw, maar twijfelden ze aan de betrouwbaarheid van de overheid, zowel in haar passieve rol  als beheerder van infrastructuur en nutsbedrijven  als in haar actieve rol, als bestrijder van criminaliteit en bevorderaar van sociale integratie","Fortuyn verwoordde voor alles een grondig wantrouwen van de burger tegen de overheid in haar verschillende gedaanten. Volgens Fortuyn waren burgers best veranderingsgezind, best sociaal, en niet bang voor de boze 21ste eeuw, maar twijfelden ze aan de betrouwbaarheid van de overheid, zowel in haar passieve rol als beheerder van <extra_id_0> als in haar actieve rol, <extra_id_1> criminaliteit <extra_id_2> integratie","Fortuyn verwoordde voor alles een grondig wantrouwen van de burger tegen de overheid in haar verschillende gedaanten. Volgens Fortuyn waren burgers best veranderingsgezind, best sociaal, en niet bang voor de boze 21ste eeuw, maar twijfelden ze aan de betrouwbaarheid van de overheid, zowel in haar passieve rol als beheerder van de burger als in haar actieve rol, zoals criminaliteit en integratie","['infrastructuur en nutsbedrijven', 'als bestrijder van', 'en bevorderaar van sociale']","['de burger', 'zoals', 'en']",10,15.0,1,"[0.8387096774193549, 0.9444444444444444, 0.9230769230769231]",0.9
seq59-0,small,"In de meeste films waarin slechte moeders een hoofdrol spelen, zijn zij zich bewust van hun imperfecties.  Eddy en Patsy uit Absolutely Fabulous vormen de uitzondering",In de meeste films waarin slechte <extra_id_0> zijn zij zich bewust van hun imperfecties. Eddy en Patsy uit Absolutely Fabulous vormen de uitzondering,In de meeste films waarin slechte stijl spelen zijn zij zich bewust van hun imperfecties. Eddy en Patsy uit Absolutely Fabulous vormen de uitzondering,"['moeders een hoofdrol spelen,']",['stijl spelen'],4,15.0,1,[0.6785714285714286],0.68
seq60-0,small,"Tijdens het drukbezochte afscheid op Zorgvlied verwoordde vriendin Carla Delfos de brutale vechtlust en soevereine wijsheid van Cox Habbema aldus: Ze heeft een enorm avontuurlijk en afwisselend leven voor zichzelf georganiseerd.  En vergis je niet, ze had de regie stevig in handen","Tijdens het drukbezochte afscheid op Zorgvlied verwoordde vriendin Carla Delfos de brutale vechtlust en soevereine wijsheid van Cox Habbema aldus: <extra_id_0> enorm avontuurlijk en afwisselend leven voor zichzelf georganiseerd. En vergis je niet, ze <extra_id_1> stevig in handen","Tijdens het drukbezochte afscheid op Zorgvlied verwoordde vriendin Carla Delfos de brutale vechtlust en soevereine wijsheid van Cox Habbema aldus: Ik heb een enorm avontuurlijk en afwisselend leven voor zichzelf georganiseerd. En vergis je niet, ze hebben ze stevig in handen","['Ze heeft een', 'had de regie']","['Ik heb een', 'hebben ze']",6,15.0,1,"[0.5, 0.75]",0.62
seq61-0,small,"Nieuwe Heifetz Het aanstormende opera- en concertseizoen wordt oorverblindend.  Ivan Fischer dirigeert het Koninklijk Concertgebouworkest in Parsifal, Yannick Nzet-Sguin het Rotterdams Philharmonisch in een van zijn wonderlijk potische Bruckners, ditmaal de Achtste","Nieuwe Heifetz Het aanstormende opera- en concertseizoen wordt oorverblindend. Ivan Fischer dirigeert <extra_id_0> in Parsifal, Yannick Nzet-Sguin het Rotterdams Philharmonisch <extra_id_1> van zijn wonderlijk potische Bruckners, ditmaal de Achtste","Nieuwe Heifetz Het aanstormende opera- en concertseizoen wordt oorverblindend. Ivan Fischer dirigeert in Parsifal, Yannick Nzet-Sguin het Rotterdams Philharmonisch Orkest van zijn wonderlijk potische Bruckners, ditmaal de Achtste","['het Koninklijk Concertgebouworkest', 'in een']","['', 'Orkest']",5,15.0,1,"[1.0, 0.8333333333333334]",0.92
seq62-0,small,"Dossier Jihadisme De geheime gesprekken van Martin van Amerongen met prins Bernhard Bernhard, (1911-2004) zakenprins Prins Bernhard was een man die zijn leven op geheel eigen(gereide) wijze invulde.  Zijn aanwezigheid in gezelschap was zodanig dat zelfs de meest principile republikeinen zich enigszins lieten vertederen","Dossier Jihadisme De geheime gesprekken van Martin van Amerongen met prins Bernhard Bernhard, (1911-2004) zakenprins Prins Bernhard was een <extra_id_0> op geheel <extra_id_1> Zijn aanwezigheid in gezelschap was zodanig dat zelfs de meest principile republikeinen zich enigszins lieten vertederen","Dossier Jihadisme De geheime gesprekken van Martin van Amerongen met prins Bernhard Bernhard, (1911-2004) zakenprins Prins Bernhard was een geheim op geheel nationale politieke zaken. Zijn aanwezigheid in gezelschap was zodanig dat zelfs de meest principile republikeinen zich enigszins lieten vertederen","['man die zijn leven', 'eigen(gereide) wijze invulde.']","['geheim', 'nationale politieke zaken.']",7,15.0,1,"[0.8888888888888888, 0.8275862068965517]",0.86
seq63-0,small,"Kunst & Cultuur Robby Mller  Master of Light  Dancer in the Dark, met inleiding van cameravrouw en documentairemaker Claire Pijman en haar korte documentaire Foot on the Moon.  11 juni 14","Kunst & Cultuur Robby Mller Master of Light Dancer in the Dark, met inleiding van cameravrouw en documentairemaker Claire Pijman en haar <extra_id_0> on the Moon. 11 <extra_id_1>","Kunst & Cultuur Robby Mller Master of Light Dancer in the Dark, met inleiding van cameravrouw en documentairemaker Claire Pijman en haar nieuwe film The Walking Dead on the Moon. 11 oktober","['korte documentaire Foot', 'juni 14']","['nieuwe film The Walking Dead', 'oktober']",5,15.0,1,"[0.7857142857142857, 1.0]",0.89
seq64-0,small,Gideon Ofrats tentoonstelling over Israel De Isralische cultuurfilosoof Gideon Ofrat maakte een overzichtstentoonstelling van werk waarin Isralische kunstenaars reageren op het politieke conflict.  Kan culturele harmonie de politieke disharmonie verslaan,Gideon Ofrats tentoonstelling over Israel De Isralische cultuurfilosoof Gideon Ofrat maakte een overzichtstentoonstelling van werk waarin Isralische kunstenaars <extra_id_0> conflict. Kan culturele harmonie de politieke disharmonie verslaan,Gideon Ofrats tentoonstelling over Israel De Isralische cultuurfilosoof Gideon Ofrat maakte een overzichtstentoonstelling van werk waarin Isralische kunstenaars zich voorbereiden op het conflict. Kan culturele harmonie de politieke disharmonie verslaan,['reageren op het politieke'],['zich voorbereiden op het'],4,15.0,1,[0.92],0.92
seq65-0,small,"Kunst & Cultuur Televisie: One Night Stand Plaatselijke folklore Herfst betekent lente voor het dramaseizoen.  Er waren al vroege bloeiers: Van God los, vierde reeks, genspireerd op echte moordzaken; de vijfde reeks van Penoza","Kunst & Cultuur Televisie: One Night Stand Plaatselijke <extra_id_0> betekent lente voor het dramaseizoen. Er waren <extra_id_1> Van God los, vierde reeks, genspireerd op echte moordzaken; de vijfde reeks van Penoza","Kunst & Cultuur Televisie: One Night Stand Plaatselijke reeks betekent lente voor het dramaseizoen. Er waren twee seizoenen: Van God los, vierde reeks, genspireerd op echte moordzaken; de vijfde reeks van Penoza","['folklore Herfst', 'al vroege bloeiers:']","['reeks', 'twee seizoenen:']",5,15.0,1,"[0.7333333333333333, 0.7368421052631579]",0.74
seq66-0,small,"22 mei 2013 Jaargang 137, Nr.  21 Aukje van Roessel, 22 mei 2013 Pikant debat in het parlement van Suriname Pieter van Maele, 22 mei 2013 Casper Thomas, 22 mei 2013 CAROLIEN OMIDI, 22 mei 2013 Aai Prins, 22 mei 2013 Lex Rietman, 22 mei 2013 Radeloos in Syri Het grote vraagstuk dat in Syri op de achtergrond alle andere overheerst is de chaos van de machteloze deskundigheid","22 mei 2013 Jaargang 137, Nr. 21 Aukje van Roessel, 22 mei 2013 Pikant <extra_id_0> van Suriname Pieter van Maele, 22 mei 2013 Casper Thomas, 22 mei 2013 CAROLIEN OMIDI, 22 mei 2013 Aai Prins, 22 mei 2013 Lex Rietman, 22 mei 2013 Radeloos in Syri <extra_id_1> dat in Syri op de achtergrond <extra_id_2> is de chaos van de machteloze deskundigheid","22 mei 2013 Jaargang 137, Nr. 21 Aukje van Roessel, 22 mei 2013 Pikant verslag van Suriname Pieter van Maele, 22 mei 2013 Casper Thomas, 22 mei 2013 CAROLIEN OMIDI, 22 mei 2013 Aai Prins, 22 mei 2013 Lex Rietman, 22 mei 2013 Radeloos in Syri Het enige dat in Syri op de achtergrond is is de chaos van de machteloze deskundigheid","['debat in het parlement', 'Het grote vraagstuk', 'alle andere overheerst']","['verslag', 'Het enige', 'is']",10,15.0,1,"[0.9090909090909091, 0.6842105263157895, 0.9545454545454546]",0.85
seq67-0,small,"De teksten daarin zijn trouwens niet van het verstandsverduisterende soort.  Het bevat veel jargoneske politieke ideologie, en nogal voorspelbare aforismen en parabels, die het Chinese volk onder de Communistische Partij veeleer zelfvertrouwen en stabiliteit lijken te willen geven dan dat ze het aanzetten tot de bijna burgeroorlogachtige waanzin en terreur van de Culturele Revolutie (1966-1976)","De teksten daarin zijn trouwens niet van het verstandsverduisterende soort. Het <extra_id_0> jargoneske politieke ideologie, en nogal voorspelbare aforismen en parabels, <extra_id_1> volk onder de Communistische Partij veeleer zelfvertrouwen en stabiliteit lijken te willen geven dan dat ze het aanzetten tot de bijna burgeroorlogachtige waanzin en terreur <extra_id_2> Revolutie (1966-1976)","De teksten daarin zijn trouwens niet van het verstandsverduisterende soort. Het is een jargoneske politieke ideologie, en nogal voorspelbare aforismen en parabels, die het volk onder de Communistische Partij veeleer zelfvertrouwen en stabiliteit lijken te willen geven dan dat ze het aanzetten tot de bijna burgeroorlogachtige waanzin en terreur Revolutie (1966-1976)","['bevat veel', 'die het Chinese', 'van de Culturele']","['is een', 'die het', '']",8,15.0,1,"[0.7, 0.5333333333333333, 1.0]",0.74
seq68-0,small,"Hoe noodzakelijk is Borssele-2.  Kernenergie maakt lui De komst van een tweede kernreactor is lang voorbereid, met de informele hulp van de vorige staatssecretaris van Milieu","Hoe noodzakelijk is Borssele-2. Kernenergie maakt lui De komst van een tweede kernreactor is lang voorbereid, met <extra_id_0> de vorige staatssecretaris van Milieu","Hoe noodzakelijk is Borssele-2. Kernenergie maakt lui De komst van een tweede kernreactor is lang voorbereid, met dank aan de vorige staatssecretaris van Milieu",['de informele hulp van'],['dank aan'],4,15.0,1,[0.7619047619047619],0.76
seq69-0,small,"Geen wonder.  De drie ton die het Nederlandse gezin gemiddeld aan een woning besteedt, is pakweg zes maal het jaarsalaris en voor de meeste Nederlanders de grootste uitgave die ze ooit zullen doen","Geen wonder. De drie ton die het Nederlandse gezin gemiddeld aan een woning besteedt, is pakweg zes maal het jaarsalaris en voor <extra_id_0> Nederlanders de grootste uitgave die ze <extra_id_1>","Geen wonder. De drie ton die het Nederlandse gezin gemiddeld aan een woning besteedt, is pakweg zes maal het jaarsalaris en voor de Nederlanders de grootste uitgave die ze verdienen.","['de meeste', 'ooit zullen doen']","['de', 'verdienen.']",5,15.0,1,"[0.7777777777777778, 0.8125]",0.8
seq70-0,small,"Dichters & Denkers Surrealisme Dat het recyclen van afgeschreven consumptiegoederen een der wezenskenmerken van het surrealisme is blijkt eens te meer uit de tentoonstelling (een rommelmarkt) over deze kunststroming in relatie tot design.  Een van de juwelen die Meret Oppenheim ontwierp voor Elsa Schiaparelli was een brede metalen armband, afgezet met beverbont","Dichters & Denkers Surrealisme Dat het recyclen van afgeschreven consumptiegoederen een der wezenskenmerken <extra_id_0> is blijkt eens te meer uit de tentoonstelling (een rommelmarkt) over deze <extra_id_1> tot design. Een van de juwelen die Meret Oppenheim ontwierp voor Elsa Schiaparelli was een <extra_id_2> armband, afgezet met beverbont","Dichters & Denkers Surrealisme Dat het recyclen van afgeschreven consumptiegoederen een der wezenskenmerken van Surrealisme is blijkt eens te meer uit de tentoonstelling (een rommelmarkt) over deze relatie tot design. Een van de juwelen die Meret Oppenheim ontwierp voor Elsa Schiaparelli was een nieuwe armband, afgezet met beverbont","['van het surrealisme', 'kunststroming in relatie', 'brede metalen']","['van Surrealisme', 'relatie', 'nieuwe']",8,15.0,1,"[0.2631578947368421, 0.7083333333333334, 0.8461538461538461]",0.61
seq71-0,small,"Pop en politiek zijn een aantrekkelijke combinatie.  Net als sport en politiek, of kunst en politiek","Pop en politiek zijn een aantrekkelijke combinatie. Net als sport en politiek, of <extra_id_0> politiek","Pop en politiek zijn een aantrekkelijke combinatie. Net als sport en politiek, of politiek",['kunst en'],[''],2,15.0,1,[1.0],1.0
seq72-0,small,"We noemden hem de pannenkoekenpost.  Of eigenlijk: pannekoekenpost, want het was de jaren zeventig, dus je schreef het zonder tussen-n","We noemden hem <extra_id_0> eigenlijk: pannekoekenpost, want het was de jaren zeventig, dus je schreef het zonder tussen-n","We noemden hem ook eigenlijk: pannekoekenpost, want het was de jaren zeventig, dus je schreef het zonder tussen-n",['de pannenkoekenpost. Of'],['ook'],3,15.0,1,[0.9130434782608695],0.91
seq73-0,small,"Dichters & Denkers Christine Otten, De laatste dichters Iets rauws en eerlijks Atlas, 448 blz. ,  22,50 In haar vorige boek, de verhalenbundel Engel en andere muziekverhalen (2000), wijdde Christine Otten een van de verhalen aan het zalig soort onmacht dat haar bevangt als ze naar de liedjes van Nick Cave luistert","Dichters & Denkers Christine <extra_id_0> laatste dichters <extra_id_1> eerlijks Atlas, 448 blz. , 22,50 In haar vorige boek, de verhalenbundel Engel en andere muziekverhalen (2000), wijdde Christine Otten een van de <extra_id_2> zalig soort onmacht dat haar bevangt als ze naar de liedjes van Nick Cave luistert","Dichters & Denkers Christine Otten, laatste dichters & denkers eerlijks Atlas, 448 blz. , 22,50 In haar vorige boek, de verhalenbundel Engel en andere muziekverhalen (2000), wijdde Christine Otten een van de verhalen van het zalig soort onmacht dat haar bevangt als ze naar de liedjes van Nick Cave luistert","['Otten', 'De', 'Iets rauws en', 'verhalen aan het']","['Otten,', '& denkers', 'verhalen van het']",8,15.0,1,"[0.16666666666666666, 0.8888888888888888, 0.8125]",0.62
seq74-0,small,"Dichters & Denkers Fik Meijer Vreemdelingen in de Oudheid In Vreemd volk beschrijft Fik Meijer de vreemdelingenproblematiek van de klassieke Oudheid.  Hij ziet verschijnselen die z op de hedendaagse werkelijkheid gelegd kunnen worden, maar constateert ook dat de ouderen voor ons onbegrijpelijke ideen hadden","Dichters & Denkers Fik Meijer Vreemdelingen <extra_id_0> Vreemd volk beschrijft Fik Meijer de vreemdelingenproblematiek <extra_id_1> Oudheid. Hij ziet verschijnselen die z op de hedendaagse werkelijkheid gelegd kunnen worden, maar constateert ook dat de ouderen voor ons onbegrijpelijke ideen hadden","Dichters & Denkers Fik Meijer Vreemdelingen | Vreemd volk beschrijft Fik Meijer de vreemdelingenproblematiek van de Oudheid. Hij ziet verschijnselen die z op de hedendaagse werkelijkheid gelegd kunnen worden, maar constateert ook dat de ouderen voor ons onbegrijpelijke ideen hadden","['in de Oudheid In', 'van de klassieke']","['|', 'van de']",7,15.0,1,"[1.0, 0.625]",0.81
seq75-0,small,"Ruw gebonk, krijsend lachen, dan stilte, en de volgende dag groeten ze me glimlachend.  Wat speelt zich allemaal in de hoofden bij de mensen thuis en op straat af","Ruw gebonk, krijsend lachen, dan stilte, en de volgende dag groeten ze me glimlachend. Wat speelt zich allemaal in <extra_id_0> mensen thuis en op straat af","Ruw gebonk, krijsend lachen, dan stilte, en de volgende dag groeten ze me glimlachend. Wat speelt zich allemaal in de buurt? Hoe mensen thuis en op straat af",['de hoofden bij de'],['de buurt? Hoe'],4,15.0,1,[0.7058823529411765],0.71
seq76-0,small,"Toneelschrijvers zijn er steeds als de kippen bij - de Bende van Venlo, Srebrenica en Emily denderden al over de planken.  Maar waar blijven de filmmakers","Toneelschrijvers zijn er steeds als de kippen <extra_id_0> van Venlo, Srebrenica en Emily denderden al over de planken. Maar waar blijven de filmmakers","Toneelschrijvers zijn er steeds als de kippen De mannen van Venlo, Srebrenica en Emily denderden al over de planken. Maar waar blijven de filmmakers",['bij - de Bende'],['De mannen'],4,15.0,1,[0.7857142857142857],0.79
seq77-0,small,Lillo Mastino (1952-2018) De op 17 maart overleden Lillo was de jongste van de familie van visrestaurant Mastino op het strand bij Rome.  Waarom openen jullie geen eethuisje,Lillo Mastino (1952-2018) De op 17 maart overleden Lillo was de jongste <extra_id_0> visrestaurant Mastino op het strand bij Rome. Waarom openen jullie geen eethuisje,Lillo Mastino (1952-2018) De op 17 maart overleden Lillo was de jongste van visrestaurant Mastino op het strand bij Rome. Waarom openen jullie geen eethuisje,['van de familie van'],['van'],4,15.0,1,[0.8333333333333334],0.83
seq78-0,small,Wat spreek jij goed Nederlands Nnenna Onwuka beeld Gorilla Welke struggle.  Het is duidelijk dat ik iets verkeerds heb gezegd,Wat spreek jij goed Nederlands Nnenna Onwuka beeld Gorilla <extra_id_0> is duidelijk dat ik iets verkeerds heb gezegd,Wat spreek jij goed Nederlands Nnenna Onwuka beeld Gorilla - Het is duidelijk dat ik iets verkeerds heb gezegd,['Welke struggle. Het'],['- Het'],3,15.0,1,[0.7894736842105263],0.79
seq79-0,small,"Bidden voor het Lagerhuis Londen  Daar stond hij dan, in onze All Saints Church, een van de bekendste gezichten van het Thatcher-tijdperk: Jonathan Aitken.  De achterneef van persbaron Beaverbrook die de best denkbare opleiding had genoten (Eton College, gevolgd door Christ Church, Oxford), als oorlogscorrespondent in Vietnam was en als bewindsman op Defensie genoemd werd als toekomstig premier","Bidden voor het <extra_id_0> stond hij dan, in onze All Saints Church, een van de bekendste gezichten van het Thatcher-tijdperk: Jonathan Aitken. De achterneef van persbaron Beaverbrook die de best denkbare opleiding had genoten (Eton College, gevolgd door <extra_id_1> als oorlogscorrespondent in Vietnam was en <extra_id_2> Defensie genoemd werd als toekomstig premier","Bidden voor het einde van de oorlog stond hij dan, in onze All Saints Church, een van de bekendste gezichten van het Thatcher-tijdperk: Jonathan Aitken. De achterneef van persbaron Beaverbrook die de best denkbare opleiding had genoten (Eton College, gevolgd door Jonathan Aitken) als oorlogscorrespondent in Vietnam was en in Defensie genoemd werd als toekomstig premier","['Lagerhuis Londen Daar', 'Christ Church', 'Oxford),', 'als bewindsman op']","['einde van de oorlog', 'Jonathan Aitken)', 'in']",9,15.0,1,"[0.8571428571428571, 0.9375, 1.0]",0.93
seq80-0,small,De boer mag blijven omdat ze niets bereikt Minister van Milieu zijn is eigenlijk een heel overzichtelijke klus.  In 1989 is het eerste Nationale Milieubeleidsplan aangenomen en daarin zijn voor bijna alle milieukwesties doelen vastgesteld,De boer mag blijven omdat ze niets bereikt Minister van Milieu zijn is eigenlijk <extra_id_0> klus. In 1989 is het eerste Nationale Milieubeleidsplan <extra_id_1> daarin zijn voor bijna alle milieukwesties doelen vastgesteld,De boer mag blijven omdat ze niets bereikt Minister van Milieu zijn is eigenlijk een klus. In 1989 is het eerste Nationale Milieubeleidsplan vastgesteld en daarin zijn voor bijna alle milieukwesties doelen vastgesteld,"['een heel overzichtelijke', 'aangenomen en']","['een', 'vastgesteld en']",5,15.0,1,"[0.875, 0.5714285714285714]",0.72
seq81-0,small,EIGENLIJK HAD de kleine roodharige Schot dolgraag het Labour-voorzitterschap van Neil Kinnock willen overnemen.  Zijn gebrek aan classic good looks zouden hem die droom hebben ontnomen,EIGENLIJK HAD de kleine roodharige Schot dolgraag het Labour-voorzitterschap van Neil Kinnock willen overnemen. Zijn gebrek aan classic <extra_id_0> die droom hebben ontnomen,EIGENLIJK HAD de kleine roodharige Schot dolgraag het Labour-voorzitterschap van Neil Kinnock willen overnemen. Zijn gebrek aan classic en die droom hebben ontnomen,['good looks zouden hem'],['en'],4,15.0,1,[0.9047619047619048],0.9
seq82-0,small,Gezag heeft met macht te maken  zoveel weet ik nog wel.  En misschien komt daar wel mijn gerriteerdheid door,Gezag heeft met macht <extra_id_0> weet ik nog wel. En misschien komt daar wel mijn gerriteerdheid door,Gezag heeft met macht verloren weet ik nog wel. En misschien komt daar wel mijn gerriteerdheid door,['te maken zoveel'],['verloren'],3,15.0,1,[0.8],0.8
seq83-0,small,Het aantal banen speelt zoals altijd een belangrijke rol.  Iedereen is aan het rekenen maar de cijfers van de onderzoeksbureaus Buck Consultants en het Nederlands Economisch Instituut (NEI) worden het meest geciteerd,Het aantal banen speelt zoals altijd een belangrijke rol. Iedereen is aan het rekenen <extra_id_0> van de onderzoeksbureaus Buck Consultants en het Nederlands Economisch <extra_id_1> worden het meest geciteerd,Het aantal banen speelt zoals altijd een belangrijke rol. Iedereen is aan het rekenen Onderzoekers van de onderzoeksbureaus Buck Consultants en het Nederlands Economisch Bureau worden het meest geciteerd,"['maar de cijfers', 'Instituut (NEI)']","['Onderzoekers', 'Bureau']",5,15.0,1,"[0.6666666666666666, 0.9333333333333333]",0.8
seq84-0,small,"In 1994 schreef professor Hans Daudt al heel terecht: er is minder reden dan ooit de VVD te onderschatten.  De club die door de journalistiek vaak als eeuwige oppositiepartij gezien wordt, zit sinds 1959 al 31 jaar in de regering",In 1994 schreef professor Hans Daudt al heel terecht: er is minder reden dan ooit de VVD te onderschatten. <extra_id_0> door de journalistiek vaak als eeuwige oppositiepartij gezien <extra_id_1> 1959 al 31 jaar in de regering,In 1994 schreef professor Hans Daudt al heel terecht: er is minder reden dan ooit de VVD te onderschatten. De VVD is door de journalistiek vaak als eeuwige oppositiepartij gezien In 1959 al 31 jaar in de regering,"['De club die', 'wordt', 'zit sinds']","['De VVD is', 'In']",6,15.0,1,"[0.5454545454545454, 1.0]",0.77
seq85-0,small,"It wasnt America, stupid Londens zakencentrum Canary Wharf, Docklands, 12 september 2008  Peter Hilz /HH De Britse bankenexpert Tamim Bayoumi, werkzaam in Washington bij de mondiale instelling die zich tijdens de crisis ontpopte tot een van de keurigste critici van het mondiale financile stelsel en de eraan ten grondslag liggende ideologie, vertelt aan de telefoon dat hij zich die eerste post-Lehman G20 nog als de dag van gisteren kan herinneren.  Wat hem destijds vooral frappeerde was het verschil in perceptie over de oorzaken ervan aan beide kanten van de oceaan","<extra_id_0> America, stupid Londens zakencentrum Canary Wharf, Docklands, 12 september 2008 Peter Hilz /HH De Britse bankenexpert Tamim Bayoumi, werkzaam in Washington bij de mondiale instelling die zich tijdens de crisis ontpopte tot een van de keurigste critici van het mondiale financile stelsel en de eraan ten grondslag liggende ideologie, vertelt aan de telefoon dat hij zich die eerste post-Lehman G20 <extra_id_1> dag <extra_id_2> herinneren. Wat hem destijds vooral frappeerde was het verschil <extra_id_3> de oorzaken ervan aan <extra_id_4> de oceaan","America, stupid Londens zakencentrum Canary Wharf, Docklands, 12 september 2008 Peter Hilz /HH De Britse bankenexpert Tamim Bayoumi, werkzaam in Washington bij de mondiale instelling die zich tijdens de crisis ontpopte tot een van de keurigste critici van het mondiale financile stelsel en de eraan ten grondslag liggende ideologie, vertelt aan de telefoon dat hij zich die eerste post-Lehman G20 dag kon herinneren. Wat hem destijds vooral frappeerde was het verschil dat de oorzaken ervan aan de bodem van de oceaan","['It wasnt', 'nog als de', 'van gisteren kan', 'in perceptie over', 'beide kanten van']","['', '', 'kon', 'dat', 'de bodem van']",14,15.0,1,"[1.0, 1.0, 0.875, 0.9411764705882353, 0.5]",0.86
