seq228-0,small,"We kunnen het ons nauwelijks meer voorstellen wat het betekent als er landelijk een zeer besmettelijke infectieziekte uitbreekt.  Kinderen kregen bij bosjes difterie, kinkhoest, de bof, rode hond, polio, mazelen, tetanus en waterpokken","We kunnen het ons nauwelijks meer voorstellen wat <extra_id_0> als er landelijk een zeer besmettelijke infectieziekte uitbreekt. Kinderen kregen bij bosjes difterie, <extra_id_1> rode hond, polio, mazelen, tetanus en waterpokken","We kunnen het ons nauwelijks meer voorstellen wat er gebeurt als er landelijk een zeer besmettelijke infectieziekte uitbreekt. Kinderen kregen bij bosjes difterie, honden, rode hond, polio, mazelen, tetanus en waterpokken","['het betekent', 'kinkhoest', 'de bof,']","['er gebeurt', 'honden,']",5,15.0,1,"[0.5833333333333334, 0.7777777777777778]",0.68
seq229-0,small,Intens tragische kunst In Albees Wie is bang voor Virginia Woolf.  staan gast Nick en gastheer George voor een schilderij,Intens tragische kunst In Albees Wie <extra_id_0> Virginia Woolf. staan gast Nick en gastheer George voor een schilderij,Intens tragische kunst In Albees Wie Virginia Woolf. staan gast Nick en gastheer George voor een schilderij,['is bang voor'],[''],3,15.0,1,[1.0],1.0
seq230-0,small,De opkomst van de kleuterconcurrentie Het helpt dus allemaal niet.  Gelijke kansen bevorderen via het onderwijs,De opkomst van de <extra_id_0> helpt dus allemaal niet. Gelijke kansen bevorderen via het onderwijs,De opkomst van de universiteit helpt dus allemaal niet. Gelijke kansen bevorderen via het onderwijs,['kleuterconcurrentie Het'],['universiteit'],2,15.0,1,[0.7391304347826086],0.74
seq231-0,small,"This Cant Go On (Stay with Me) in Museum Boijmans Van Beuningen geeft een overzicht van het werk dat beroepschaoot Erik van Lieshout in de afgelopen zes jaar produceerde.  De tentoonstelling brengt Van Lieshouts schilderijen, tekeningen en videowerken samen en geeft een centrale plaats aan zijn laatste project, de video-installatie Rock","This Cant Go On (Stay with Me) in Museum Boijmans Van Beuningen geeft een overzicht van het werk dat beroepschaoot Erik van Lieshout <extra_id_0> zes jaar produceerde. De tentoonstelling brengt <extra_id_1> tekeningen en videowerken samen en geeft <extra_id_2> plaats aan zijn laatste project, de video-installatie Rock","This Cant Go On (Stay with Me) in Museum Boijmans Van Beuningen geeft een overzicht van het werk dat beroepschaoot Erik van Lieshout al zes jaar produceerde. De tentoonstelling brengt diverse tekeningen en videowerken samen en geeft hierbij plaats aan zijn laatste project, de video-installatie Rock","['in de afgelopen', 'Van Lieshouts schilderijen,', 'een centrale']","['al', 'diverse', 'hierbij']",8,15.0,1,"[0.8666666666666667, 0.8518518518518519, 0.8333333333333334]",0.85
seq232-0,small,"Rubriek TELEVISIE Nipkow 2008 Eerder al zong ik de lof van In Afrika van Adriaan van Dis, die prachtige reis door de weerbarstigheid van het zuidelijk deel van dat continent.  Een zo voortreffelijk programma kennelijk dat alle aanwezige leden van de Nipkow-jury het bij de laatste stemronde in hun top-3 zetten","Rubriek TELEVISIE Nipkow 2008 Eerder al zong ik de lof van In Afrika van Adriaan van Dis, die prachtige reis door de weerbarstigheid van het <extra_id_0> van dat continent. Een zo voortreffelijk programma <extra_id_1> aanwezige leden <extra_id_2> het bij de laatste stemronde in hun top-3 zetten","Rubriek TELEVISIE Nipkow 2008 Eerder al zong ik de lof van In Afrika van Adriaan van Dis, die prachtige reis door de weerbarstigheid van het land van dat continent. Een zo voortreffelijk programma dat aanwezige leden van het bij de laatste stemronde in hun top-3 zetten","['zuidelijk deel', 'kennelijk dat alle', 'van de Nipkow-jury']","['land', 'dat', 'van']",8,15.0,1,"[0.8571428571428571, 0.8333333333333334, 0.8333333333333334]",0.84
seq233-0,small,"Er is niks glamourous aan borstkanker In een kroeg in Adelaide, Australi, bedacht een groep mannen in 1999 dat ze iets wilden doen voor hun vriend met prostaatkanker.  Ze besloten geld in te zamelen voor kankeronderzoek, maar hadden geen tijd voor ingewikkelde campagnes of een sponsor- of sportevenement, waarvoor ze moesten trainen","Er is niks glamourous aan borstkanker In een kroeg in Adelaide, Australi, bedacht <extra_id_0> in 1999 dat ze iets <extra_id_1> voor hun vriend met prostaatkanker. Ze besloten geld in te zamelen voor kankeronderzoek, maar hadden geen tijd <extra_id_2> of een sponsor- of sportevenement, waarvoor ze moesten trainen","Er is niks glamourous aan borstkanker In een kroeg in Adelaide, Australi, bedacht ze in 1999 dat ze iets hadden voor hun vriend met prostaatkanker. Ze besloten geld in te zamelen voor kankeronderzoek, maar hadden geen tijd om te winnen of een sponsor- of sportevenement, waarvoor ze moesten trainen","['een groep mannen', 'wilden doen', 'voor ingewikkelde campagnes']","['ze', 'hadden', 'om te winnen']",8,15.0,1,"[0.9375, 0.6363636363636364, 0.7777777777777778]",0.78
seq234-0,small,"NU DSK weer op vrije voeten is, gaat hij met zijn vrouw van het ene luxe restaurant naar het andere om truffels te eten.  Wel steeds met een hele sleep journalisten achter zich aan","NU DSK weer op vrije voeten is, gaat hij met zijn vrouw van het ene luxe restaurant naar het andere om truffels te eten. Wel <extra_id_0> een hele sleep <extra_id_1> aan","NU DSK weer op vrije voeten is, gaat hij met zijn vrouw van het ene luxe restaurant naar het andere om truffels te eten. Wel is een hele sleep aan","['steeds met', 'journalisten achter zich']","['is', '']",5,15.0,1,"[0.9, 1.0]",0.95
seq235-0,small,"Woensdag 9 december 2009, de Balie te Amsterdam Dag van de Kunstkritiek (in digitale tijden) Critics Floating in the Virtual Sphere Overleeft de kunstkritiek het internet.  Inloop & koffie vanaf 13","Woensdag 9 december 2009, de Balie te <extra_id_0> de Kunstkritiek (in digitale tijden) Critics Floating in the Virtual Sphere Overleeft <extra_id_1> het internet. Inloop & koffie vanaf 13","Woensdag 9 december 2009, de Balie te Amsterdam. de Kunstkritiek (in digitale tijden) Critics Floating in the Virtual Sphere Overleeft zich op het internet. Inloop & koffie vanaf 13","['Amsterdam Dag van', 'de kunstkritiek']","['Amsterdam.', 'zich op']",5,15.0,1,"[0.47058823529411764, 1.0]",0.74
seq236-0,small,"Kunst & Cultuur Kunst: Tams Kaszs Ik ben geen neo-primitivist, zegt de Hongaarse kunstenaar Tams Kaszs in een interview dat in een boekje bij zijn tentoonstelling verschijnt, en dat is moeilijk te geloven na het zien van de vernuftig in elkaar gezette kunstwerken in de ondergrondse ruimte van De Appel.  Er is een bulletinboard waar ambachtelijk gedrukte posters  zeefdruk, houtblok, stencils  met gekleurde punaises op zijn geprikt, het doosje punaises nog in het zicht","Kunst & Cultuur Kunst: Tams Kaszs Ik ben geen neo-primitivist, zegt de Hongaarse kunstenaar Tams Kaszs in een interview dat in een boekje bij zijn tentoonstelling <extra_id_0> is moeilijk te geloven na het zien van de vernuftig in elkaar gezette kunstwerken in de ondergrondse <extra_id_1> De Appel. Er is een bulletinboard waar ambachtelijk gedrukte <extra_id_2> stencils met gekleurde punaises op zijn geprikt, <extra_id_3> nog in het zicht","Kunst & Cultuur Kunst: Tams Kaszs Ik ben geen neo-primitivist, zegt de Hongaarse kunstenaar Tams Kaszs in een interview dat in een boekje bij zijn tentoonstelling staat. Het is moeilijk te geloven na het zien van de vernuftig in elkaar gezette kunstwerken in de ondergrondse tentoonstelling De Appel. Er is een bulletinboard waar ambachtelijk gedrukte teksten en stencils met gekleurde punaises op zijn geprikt, maar nog in het zicht","['verschijnt', 'en dat', 'ruimte van', 'posters zeefdruk', 'houtblok,', 'het doosje punaises']","['staat. Het', 'tentoonstelling', 'teksten en', 'maar']",11,15.0,1,"[0.9, 0.8, 0.7, 0.9375]",0.83
seq237-0,small,"Meer eerbied voor de echte lezers.  Voor bestsellers, het woord zegt het al, zijn lezers nodig die boeken kopen, maar vaak zullen dat klanten zijn die slechts zelden een boek kopen, alleen als het moet, als de tamtam maar lang genoeg op hun schedel heeft geklopt","Meer eerbied voor de echte lezers. Voor bestsellers, het woord zegt het <extra_id_0> die boeken kopen, maar vaak <extra_id_1> zijn die slechts zelden een boek kopen, alleen als het moet, als de tamtam maar lang genoeg op hun schedel heeft geklopt","Meer eerbied voor de echte lezers. Voor bestsellers, het woord zegt het niet die boeken kopen, maar vaak schrijvers zijn die slechts zelden een boek kopen, alleen als het moet, als de tamtam maar lang genoeg op hun schedel heeft geklopt","['al', 'zijn lezers nodig', 'zullen dat klanten']","['niet', 'schrijvers']",7,15.0,1,"[1.0, 0.8235294117647058]",0.91
seq238-0,small,"Nairobi  Wie op een zaterdag in Nairobi de straat op gaat, passeert altijd wel ergens een ronkende bruiloftsstoet van autos.  De kunststof bloemen op de motorkap ontnemen je een blik op het bruidspaar achter de ramen","Nairobi Wie op een zaterdag in Nairobi de straat op gaat, passeert altijd wel ergens een ronkende bruiloftsstoet van autos. De <extra_id_0> op de motorkap ontnemen je een blik op het <extra_id_1> ramen","Nairobi Wie op een zaterdag in Nairobi de straat op gaat, passeert altijd wel ergens een ronkende bruiloftsstoet van autos. De ramen op de motorkap ontnemen je een blik op het publiek. De ramen","['kunststof bloemen', 'bruidspaar achter de']","['ramen', 'publiek. De']",5,15.0,1,"[0.8235294117647058, 0.85]",0.84
seq239-0,small,"Hoewel, er was een stuk taart overgebleven van gisteren.  Door een vrijgevig reiziger meegebracht uit Neurenberg","Hoewel, er was <extra_id_0> taart overgebleven van gisteren. Door een vrijgevig reiziger meegebracht uit Neurenberg","Hoewel, er was geen taart overgebleven van gisteren. Door een vrijgevig reiziger meegebracht uit Neurenberg",['een stuk'],['geen'],2,15.0,1,[0.75],0.75
seq240-0,small,"Ajax is altijd de club geweest van het mooie voetbal, en de mooie voetballers.  Ajax, dat was altijd fragiel, technisch, subtiel, jong, ietwat arrogant, meer vedette dan waterdrager, liever moeilijk dan makkelijk, liever mooi dan effectief","Ajax is altijd de club geweest van het mooie voetbal, en de mooie <extra_id_0> was altijd fragiel, technisch, subtiel, jong, ietwat arrogant, meer <extra_id_1> waterdrager, liever moeilijk dan makkelijk, liever mooi dan effectief","Ajax is altijd de club geweest van het mooie voetbal, en de mooie voetballer was altijd fragiel, technisch, subtiel, jong, ietwat arrogant, meer dan een waterdrager, liever moeilijk dan makkelijk, liever mooi dan effectief","['voetballers. Ajax', 'dat', 'vedette dan']","['voetballer', 'dan een']",5,15.0,1,"[0.4117647058823529, 0.7142857142857143]",0.56
seq241-0,small,"Aan de picknicktafel in Greenwich Village waar ik op zondag doorgaans de krant lees, schoof onlangs een bejaarde dame aan.  Met licht wantrouwen bekeek ze mijn warme chocolademelk en dat veranderde in afgrijzen toen ik er twee klontjes suiker in deed","Aan de picknicktafel in Greenwich Village waar <extra_id_0> doorgaans de krant lees, schoof onlangs een bejaarde dame aan. Met licht wantrouwen bekeek ze mijn warme chocolademelk en <extra_id_1> afgrijzen toen ik er twee klontjes suiker in deed","Aan de picknicktafel in Greenwich Village waar ik doorgaans de krant lees, schoof onlangs een bejaarde dame aan. Met licht wantrouwen bekeek ze mijn warme chocolademelk en wilde ik afgrijzen toen ik er twee klontjes suiker in deed","['ik op zondag', 'dat veranderde in']","['ik', 'wilde ik']",6,15.0,1,"[0.8333333333333334, 0.7647058823529411]",0.8
seq242-0,small,"27 oktober 2006 Jaargang 130, Nr.  43 Aart Brouwer, 27 oktober 2006 Hubert Smeets, 27 oktober 2006 Margreet Fogteloo, 27 oktober 2006 Duco Hellema, 27 oktober 2006 Peter Vermaas, 27 oktober ","27 oktober 2006 Jaargang 130, Nr. 43 Aart Brouwer, 27 oktober 2006 <extra_id_0> 27 oktober 2006 Margreet Fogteloo, 27 <extra_id_1> Hellema, 27 oktober 2006 Peter Vermaas, 27 oktober","27 oktober 2006 Jaargang 130, Nr. 43 Aart Brouwer, 27 oktober 2006 Marius Willemsen, 27 oktober 2006 Margreet Fogteloo, 27 oktober 2006 Marius Hellema, 27 oktober 2006 Peter Vermaas, 27 oktober","['Hubert Smeets,', 'oktober 2006 Duco']","['Marius Willemsen,', 'oktober 2006 Marius']",5,15.0,1,"[0.7647058823529411, 0.3157894736842105]",0.54
seq243-0,small,"Liever een geweten zonder eer, dan eer zonder geweten.  Schuld verhoudt zich tot schaamte als geweten tot eer","<extra_id_0> zonder eer, dan eer zonder geweten. Schuld verhoudt zich tot schaamte als geweten tot eer","eer zonder eer, dan eer zonder geweten. Schuld verhoudt zich tot schaamte als geweten tot eer",['Liever een geweten'],['eer'],3,15.0,1,[0.8333333333333334],0.83
seq244-0,small,We proberen het debat altijd heel snel terug te brengen tot een ethische kwestie.  3 juni 2015  verschenen in uit nr,We proberen het debat altijd <extra_id_0> te brengen tot een ethische kwestie. 3 juni 2015 verschenen in uit nr,We proberen het debat altijd in kaart te brengen tot een ethische kwestie. 3 juni 2015 verschenen in uit nr,['heel snel terug'],['in kaart'],3,15.0,1,[0.8666666666666667],0.87
seq245-0,small,De bond stond erbij en keek ernaar De ziektewet is niet meer.  Waarom gaf de vakbeweging eigenlijk geen kik,De bond stond erbij en keek <extra_id_0> is niet meer. Waarom gaf de vakbeweging eigenlijk geen kik,De bond stond erbij en keek is niet meer. Waarom gaf de vakbeweging eigenlijk geen kik,['ernaar De ziektewet'],[''],3,15.0,1,[1.0],1.0
seq246-0,small,"door Robert-Jan Friele beeld Milo De verkiezingsleuzen waarmee de vvd duidelijk maakte hoe de partij over strafrecht denkt, stonden op borden langs de snelwegen, hingen overal in de steden en werden zelfs verspreid op viltjes.  Meer straf en minder begrip voor criminelen en Meeleven met slachtoffers, niet met daders, aldus de grootste partij van het land, die opnieuw de premier leverde","door Robert-Jan Friele beeld Milo De verkiezingsleuzen waarmee de vvd duidelijk maakte hoe de partij over strafrecht denkt, stonden op borden <extra_id_0> hingen overal in de steden en werden zelfs verspreid op viltjes. Meer straf en minder begrip voor criminelen en Meeleven met <extra_id_1> daders, aldus de grootste partij van <extra_id_2> opnieuw de premier leverde","door Robert-Jan Friele beeld Milo De verkiezingsleuzen waarmee de vvd duidelijk maakte hoe de partij over strafrecht denkt, stonden op borden hingen overal in de steden en werden zelfs verspreid op viltjes. Meer straf en minder begrip voor criminelen en Meeleven met andere daders, aldus de grootste partij van de VVD die opnieuw de premier leverde","['langs de snelwegen,', 'slachtoffers', 'niet met', 'het land', 'die']","['', 'andere', 'de VVD die']",9,15.0,1,"[1.0, 0.75, 0.9]",0.88
seq247-0,small,Pater familias: pass defini Tussen Jeruzalem en Mekka zijn niet veel bomen te vinden.  De natuur is er weinig vrijgevig,Pater familias: pass defini Tussen Jeruzalem en Mekka zijn niet veel bomen te vinden. <extra_id_0> er weinig vrijgevig,Pater familias: pass defini Tussen Jeruzalem en Mekka zijn niet veel bomen te vinden. Er zijn er weinig vrijgevig,['De natuur is'],['Er zijn'],3,15.0,1,[0.9166666666666666],0.92
seq248-0,small,"Essay Essay: Het algemeen belang raakt in de knel door Yvonne Zonderop beeld Milo Veel Nederlanders nemen hun cultuur nogal vanzelfsprekend, maar in de ogen van buitenlanders die met ons moeten werken zijn wij maar een bijzonder land.  Topman Spinetti van AirFrance-klm omschreef het laatst in Het Financieele Dagblad als volgt: Als de baas in Frankrijk aan tafel zit met medewerkers, voert de baas het woord en luisteren de medewerkers","Essay Essay: Het algemeen belang raakt in de knel door Yvonne Zonderop beeld Milo Veel Nederlanders nemen hun cultuur nogal vanzelfsprekend, maar in de <extra_id_0> met ons moeten werken zijn wij maar een bijzonder <extra_id_1> van AirFrance-klm omschreef het laatst in <extra_id_2> als volgt: Als de baas in Frankrijk aan tafel zit met medewerkers, voert de baas het woord en luisteren de medewerkers","Essay Essay: Het algemeen belang raakt in de knel door Yvonne Zonderop beeld Milo Veel Nederlanders nemen hun cultuur nogal vanzelfsprekend, maar in de problemen die met ons moeten werken zijn wij maar een bijzonder zaak. De directeur van AirFrance-klm omschreef het laatst in de krant als volgt: Als de baas in Frankrijk aan tafel zit met medewerkers, voert de baas het woord en luisteren de medewerkers","['ogen van buitenlanders die', 'land. Topman Spinetti', 'Het Financieele Dagblad']","['problemen die', 'zaak. De directeur', 'de krant']",10,15.0,1,"[0.7307692307692307, 0.7619047619047619, 0.8260869565217391]",0.77
seq249-0,small,"De slapende cellen van Europa De Amerikaanse kritiek dat Europa moslimmigranten in de watten legt en daarmee islamitisch terrorisme in de hand werkt mag dan te ver gaan, feit is dat Europa onderdak biedt aan fundamentalistische groeperingen zoals al-Qaeda.  Zijn de Europeanen soft on islam zoals ze tijdens de Koude Oorlog soft on communism waren","De slapende cellen van Europa De Amerikaanse kritiek dat Europa moslimmigranten in de watten legt en daarmee islamitisch terrorisme in de <extra_id_0> mag dan te ver gaan, feit is dat Europa onderdak biedt aan fundamentalistische groeperingen zoals <extra_id_1> Europeanen <extra_id_2> zoals ze tijdens de Koude Oorlog soft on communism waren","De slapende cellen van Europa De Amerikaanse kritiek dat Europa moslimmigranten in de watten legt en daarmee islamitisch terrorisme in de weg zet mag dan te ver gaan, feit is dat Europa onderdak biedt aan fundamentalistische groeperingen zoals de Europeanen zoals ze tijdens de Koude Oorlog soft on communism waren","['hand werkt', 'al-Qaeda. Zijn de', 'soft on islam']","['weg zet', 'de', '']",8,15.0,1,"[0.7, 0.8823529411764706, 1.0]",0.86
seq250-0,small,"Laat een vrouw het maar proberen Wat zegt het over een land als vrouwen de macht overnemen.  In IJsland moesten aanvankelijk bij twee van de drie grote, genationaliseerde banken de falende mannelijke directeuren plaats moeten maken voor vrouwen","Laat een vrouw het maar proberen Wat zegt het over een land als vrouwen de macht overnemen. In IJsland moesten aanvankelijk bij twee van de drie grote, genationaliseerde <extra_id_0> mannelijke directeuren plaats moeten <extra_id_1>","Laat een vrouw het maar proberen Wat zegt het over een land als vrouwen de macht overnemen. In IJsland moesten aanvankelijk bij twee van de drie grote, genationaliseerde landen mannelijke directeuren plaats moeten vinden.","['banken de falende', 'maken voor vrouwen']","['landen', 'vinden.']",6,15.0,1,"[0.7058823529411765, 0.8888888888888888]",0.8
seq251-0,small,"De sovjetdroom van het Westen hield geen stand Het Internationale Jeugdcongres, Moskou 1957.  Tienduizenden Moskovieten stonden te juichen toen op 28 juli 1957 de deelnemers aan het Internationale Jeugdfestival op vrachtwagens en in autobussen hun intrede deden in de hoofdstad van de Sovjet-Unie","De sovjetdroom van het Westen hield geen stand Het Internationale Jeugdcongres, Moskou 1957. Tienduizenden Moskovieten stonden te juichen toen op <extra_id_0> de deelnemers aan het Internationale Jeugdfestival op vrachtwagens en in autobussen hun <extra_id_1> de hoofdstad van de Sovjet-Unie","De sovjetdroom van het Westen hield geen stand Het Internationale Jeugdcongres, Moskou 1957. Tienduizenden Moskovieten stonden te juichen toen op de deelnemers aan het Internationale Jeugdfestival op vrachtwagens en in autobussen hun kinderen. Moskou was de hoofdstad van de Sovjet-Unie","['28 juli 1957', 'intrede deden in']","['', 'kinderen. Moskou was']",6,15.0,1,"[1.0, 0.7]",0.85
seq252-0,small,Kijkcijfers zijn niet genadig.  Elk seizoen staat er wel iemand op die roept: Er moet meer cultuur op de televisie,Kijkcijfers zijn niet genadig. Elk seizoen staat er wel iemand <extra_id_0> Er moet meer cultuur op de televisie,Kijkcijfers zijn niet genadig. Elk seizoen staat er wel iemand op de hoogte. Er moet meer cultuur op de televisie,['op die roept:'],['op de hoogte.'],3,15.0,1,[0.46153846153846156],0.46
seq253-0,small,"De uitverkorenen van het College of Europe College of Europe, Brugge, april 2014.  College-rector Jrg Monar (rechts) en premier van Schotland Alex Salmond, die een lezing komt geven  Lucy Young / eyevine / HH Met zijn archasche verschijning en besnorde bovenlip heeft rector Jrg Monar iets weg van de Britse komiek John Cleese","De uitverkorenen van het College of Europe College of Europe, Brugge, <extra_id_0> Jrg Monar (rechts) en premier van Schotland Alex <extra_id_1> lezing komt geven Lucy Young / eyevine / HH Met zijn archasche <extra_id_2> besnorde bovenlip heeft rector Jrg Monar iets weg van de Britse komiek John Cleese","De uitverkorenen van het College of Europe College of Europe, Brugge, rector Jrg Monar (rechts) en premier van Schotland Alex Murray lezing komt geven Lucy Young / eyevine / HH Met zijn archasche en besnorde bovenlip heeft rector Jrg Monar iets weg van de Britse komiek John Cleese","['april 2014. College-rector', 'Salmond', 'die een', 'verschijning en']","['rector', 'Murray', 'en']",8,15.0,1,"[0.7692307692307693, 1.0, 0.7142857142857143]",0.83
seq254-0,small,"Essay Essay Verdeeld land De boze Nederlander Dat eeuwige wachten op de tram Het maatschappelijk onbehagen dat blijkt uit de verkiezingsuitslag wordt niet alleen ingegeven door Den Haag.  Het is ook de ergernis dat men wordt gepiepeld door de school, de huisarts, de kabelmaatschappij, de woningcorporatie","Essay Essay <extra_id_0> Nederlander Dat eeuwige wachten op de tram Het maatschappelijk onbehagen dat blijkt uit de verkiezingsuitslag wordt niet alleen ingegeven door Den Haag. Het is ook de ergernis dat men wordt gepiepeld door de school, de <extra_id_1> de woningcorporatie","Essay Essay - Nederlander Dat eeuwige wachten op de tram Het maatschappelijk onbehagen dat blijkt uit de verkiezingsuitslag wordt niet alleen ingegeven door Den Haag. Het is ook de ergernis dat men wordt gepiepeld door de school, de universiteit en de woningcorporatie","['Verdeeld land De boze', 'huisarts', 'de kabelmaatschappij,']","['-', 'universiteit en']",7,15.0,1,"[1.0, 0.8]",0.9
seq255-0,small,"In het Noordoosten niets nieuws De Bezige Bij, 554 blz. , 19,90 De romans van John Irving (1942) zijn vol van plot, rijk aan uitweidingen en barsten uit hun voegen van avonturen en toevallige gebeurtenissen","In het Noordoosten niets <extra_id_0> Bezige Bij, 554 blz. , 19,90 De romans van John Irving (1942) zijn vol van plot, rijk aan uitweidingen <extra_id_1> hun voegen van avonturen en toevallige gebeurtenissen","In het Noordoosten niets Bezige Bij, 554 blz. , 19,90 De romans van John Irving (1942) zijn vol van plot, rijk aan uitweidingen hun voegen van avonturen en toevallige gebeurtenissen","['nieuws De', 'en barsten uit']","['', '']",5,15.0,1,"[1.0, 1.0]",1.0
seq256-0,small,"Kunst & Cultuur Film - Song to Song van meester Malick Verlokking van een lege wereld Rooney Mara als Faye  Cinart Terrence Malick maakt films zoals een ander een sterk verhaal vertelt: met grote gebaren.  Song to Song, vol symboliek en tragische schoonheid, wordt op de valreep gered  door een lelijk realisme","Kunst & Cultuur Film - Song to Song van meester Malick Verlokking van een lege wereld Rooney Mara als Faye Cinart Terrence Malick maakt films zoals een ander een sterk verhaal <extra_id_0> gebaren. Song <extra_id_1> symboliek en tragische schoonheid, wordt op de <extra_id_2> door een lelijk realisme","Kunst & Cultuur Film - Song to Song van meester Malick Verlokking van een lege wereld Rooney Mara als Faye Cinart Terrence Malick maakt films zoals een ander een sterk verhaal en gebaren. Song to Song, een film met symboliek en tragische schoonheid, wordt op de film door een lelijk realisme","['vertelt: met grote', 'to Song', 'vol', 'valreep gered']","['en', 'to Song, een film met', 'film']",8,15.0,1,"[0.9444444444444444, 0.6666666666666666, 0.75]",0.79
seq257-0,small,"Gewiekste veroveraars DE GROTE ARABISCHE VEROVERINGEN: HET ONTSTAAN VAN HET ISLAMITISCHE RIJK VAN AFGHANISTAN TOT SPANJE (632-750) Vertaald door Guus Houtzager, Bulaaq/EPO, 489 blz. ,  34,50 De titel van dit boek zal sommige politici, columnisten en de vaste bezoekers van de islamofobe riolen van het internet ongetwijfeld de rillingen over de rug doen lopen","Gewiekste veroveraars DE GROTE ARABISCHE <extra_id_0> VAN HET <extra_id_1> VAN AFGHANISTAN TOT SPANJE (632-750) Vertaald door Guus Houtzager, Bulaaq/EPO, 489 blz. , 34,50 De <extra_id_2> boek zal sommige politici, columnisten en de vaste bezoekers van de islamofobe riolen van het internet ongetwijfeld de rillingen over de rug doen lopen","Gewiekste veroveraars DE GROTE ARABISCHE UITGEVENS VAN HET INTERNET VAN AFGHANISTAN TOT SPANJE (632-750) Vertaald door Guus Houtzager, Bulaaq/EPO, 489 blz. , 34,50 De auteur van dit boek zal sommige politici, columnisten en de vaste bezoekers van de islamofobe riolen van het internet ongetwijfeld de rillingen over de rug doen lopen","['VEROVERINGEN: HET ONTSTAAN', 'ISLAMITISCHE RIJK', 'titel van dit']","['UITGEVENS', 'INTERNET', 'auteur van dit']",8,15.0,1,"[0.7692307692307693, 0.7647058823529411, 0.2857142857142857]",0.61
seq258-0,small,Zou pozie dan echt een minder belangwekkende kunstvorm zijn dan proza.  Misschien omdat de Nederlandstalige pozie zogenaamd gemakzuchtig zou zijn (en het Nederlandstalige proza natuurlijk enkel ambitieus en geweldig),Zou pozie dan echt een minder belangwekkende kunstvorm zijn dan proza. Misschien omdat <extra_id_0> gemakzuchtig zou zijn (en het Nederlandstalige proza natuurlijk enkel ambitieus en geweldig),Zou pozie dan echt een minder belangwekkende kunstvorm zijn dan proza. Misschien omdat het gemakzuchtig zou zijn (en het Nederlandstalige proza natuurlijk enkel ambitieus en geweldig),['de Nederlandstalige pozie zogenaamd'],['het'],4,15.0,1,[0.9428571428571428],0.94
