seq1-0,base,"Was aan de lijn is een levend kunstwerk. De was heeft een vaste volgorde, groot bij groot, soort bij soort, sok bij sok, kleur bij kleur. Daarbinnen kan alles. Een jurk in de wind heeft het drukdrukdruk, een overall spartelt of hij wordt gekieteld, een laken speelt spookje. Wasgoed heeft lust tot leven.","Was aan de lijn is een levend kunstwerk. De was heeft een <extra_id_0> bij groot, soort bij soort, sok bij <extra_id_1> kleur. Daarbinnen kan alles. Een jurk <extra_id_2> heeft het drukdrukdruk, een overall spartelt of hij wordt <extra_id_3> spookje. <extra_id_4> tot leven.","Was aan de lijn is een levend kunstwerk. De was heeft een groot bij groot, soort bij soort, sok bij sok, kleur bij kleur. Daarbinnen kan alles. Een jurk heeft het drukdrukdruk, een overall spartelt of hij wordt een spookje. De was komt tot leven.","['vaste volgorde', 'groot', 'sok', 'kleur bij', 'in de wind', 'gekieteld', 'een laken speelt', 'Wasgoed heeft lust']","['groot', 'sok, kleur bij', '', 'een', 'De was komt']",16,30,1,"[0.8571428571428571, 0.9285714285714286, 1.0, 0.8888888888888888, 0.8181818181818182]",0.9,volkskrant
seq2-0,base,"Sinds Raemon Sluiter de Oekraense Elina Svitolina coacht, heeft zijn baan een andere betekenis. Voor ons geldt: wij ontkomen er niet aan, de oorlog en de verdere wereld is dagelijkse realiteit.","Sinds Raemon Sluiter de Oekraense Elina Svitolina coacht, <extra_id_0> een andere <extra_id_1> geldt: wij ontkomen er niet aan, <extra_id_2> de verdere wereld is dagelijkse realiteit.","Sinds Raemon Sluiter de Oekraense Elina Svitolina coacht, is er een andere filosofie die geldt: wij ontkomen er niet aan, maar de verdere wereld is dagelijkse realiteit.","['heeft zijn baan', 'betekenis. Voor ons', 'de oorlog en']","['is er', 'filosofie die', 'maar']",9,30,1,"[0.8666666666666667, 0.8947368421052632, 0.9166666666666666]",0.89,volkskrant
seq3-0,base,"Was aan de lijn is een levend kunstwerk. De was heeft een vaste volgorde, groot bij groot, soort bij soort, sok bij sok, kleur bij kleur.","Was aan de lijn is <extra_id_0> De was heeft een vaste volgorde, groot bij groot, soort bij soort, <extra_id_1> sok, <extra_id_2>","Was aan de lijn is De was heeft een vaste volgorde, groot bij groot, soort bij soort, soort bij sok, soort bij sok.","['een levend kunstwerk.', 'sok bij', 'kleur bij kleur.']","['', 'soort bij', 'sok.']",8,30,1,"[1.0, 0.3333333333333333, 0.875]",0.74,volkskrant
seq4-0,base,"Vanaf deze zomer kan er gesurft worden in een gracht, in hartje Rotterdam. Al kwam Rif010 niet zonder slag of stoot tot stand.","Vanaf deze zomer kan er <extra_id_0> gracht, in hartje Rotterdam. Al <extra_id_1> zonder slag of stoot tot stand.","Vanaf deze zomer kan er toch een gracht, in hartje Rotterdam. Al snel komt alles zonder slag of stoot tot stand.","['gesurft worden in een', 'kwam Rif010 niet']","['toch een', 'snel komt alles']",7,30,1,"[0.7142857142857143, 0.875]",0.79,volkskrant
seq5-0,base,"Theo Heuft, oprichter van Yab Yum, de roemruchte Amsterdamse seksclub in een 17e-eeuws grachtenpand, is op 89-jarige leeftijd overleden.","Theo Heuft, oprichter <extra_id_0> de roemruchte Amsterdamse seksclub in <extra_id_1> is op 89-jarige leeftijd overleden.","Theo Heuft, oprichter van de roemruchte Amsterdamse seksclub in Eindhoven is op 89-jarige leeftijd overleden.","['van Yab Yum,', 'een 17e-eeuws grachtenpand,']","['van', 'Eindhoven']",6,30,1,"[0.75, 0.8888888888888888]",0.82,volkskrant
seq6-0,base,"OpenAI, het bedrijf achter ChatGPT, schort een AI-stem op die sterk aan de stem van actrice Scarlett Johansson doet denken.","OpenAI, het <extra_id_0> schort een AI-stem op die sterk aan de stem van actrice <extra_id_1> denken.","OpenAI, het nieuwe platform schort een AI-stem op die sterk aan de stem van actrice Michelle Obama denken.","['bedrijf achter ChatGPT,', 'Scarlett Johansson doet']","['nieuwe platform', 'Michelle Obama']",6,30,1,"[0.782608695652174, 0.8695652173913043]",0.83,volkskrant
seq7-0,base,"Voor het eerst sinds hij twee jaar geleden de troon besteeg, kunnen Britten de hand leggen op een papieren koning Charles III van het Verenigd Koninkrijk.","Voor het eerst <extra_id_0> twee <extra_id_1> troon besteeg, <extra_id_2> hand leggen op een papieren koning Charles III van het Verenigd Koninkrijk.","Voor het eerst dat de twee koning van de troon besteeg, kon hij zijn hand leggen op een papieren koning Charles III van het Verenigd Koninkrijk.","['sinds hij', 'jaar geleden de', 'kunnen Britten de']","['dat de', 'koning van de', 'kon hij zijn']",8,30,1,"[0.8888888888888888, 0.6666666666666666, 0.7647058823529411]",0.77,volkskrant
seq8-0,base,"Film- en serieliefhebbers zijn steeds meer geld kwijt aan streamingdiensten als Netflix, Videoland en Disney Plus. Nu de diensten een plek op de Nederlandse markt veroverd hebben, zoeken ze naar andere manieren om hun inkomsten op te krikken.","Film- en serieliefhebbers zijn steeds meer geld kwijt aan <extra_id_0> Videoland <extra_id_1> Plus. Nu de diensten een plek op de Nederlandse markt veroverd hebben, zoeken <extra_id_2> manieren om <extra_id_3> te krikken.","Film- en serieliefhebbers zijn steeds meer geld kwijt aan de diensten van Videoland en Plus. Nu de diensten een plek op de Nederlandse markt veroverd hebben, zoeken we naar manieren om de winst in te krikken.","['streamingdiensten als Netflix,', 'en Disney', 'ze naar andere', 'hun inkomsten op']","['de diensten van', 'en', 'we naar', 'de winst in']",11,30,1,"[0.6666666666666666, 0.7777777777777778, 0.5714285714285714, 0.6875]",0.68,volkskrant
seq9-0,base,"De formerende partijen hebben een akkoord bereikt over de verdeling van de ministerposten in het kabinet-Schoof. Dat laat PVV-leider Geert Wilders dinsdag weten: We zijn eruit. Goed nieuws, de rest horen jullie later. Naar verwachting begint formateur Richard van Zwol nog deze week met het ontvangen van de kandidaat-bewindslieden.","De formerende partijen hebben een akkoord bereikt over de verdeling van de ministerposten in het kabinet-Schoof. Dat <extra_id_0> Wilders dinsdag weten: We zijn eruit. Goed nieuws, <extra_id_1> jullie later. Naar verwachting begint formateur Richard <extra_id_2> deze <extra_id_3> ontvangen <extra_id_4>","De formerende partijen hebben een akkoord bereikt over de verdeling van de ministerposten in het kabinet-Schoof. Dat liet Wilders dinsdag weten: We zijn eruit. Goed nieuws, dat horen jullie later. Naar verwachting begint formateur Richard Bos deze week met het ontvangen van een brief.","['laat PVV-leider Geert', 'de rest horen', 'van Zwol nog', 'week met het', 'van de kandidaat-bewindslieden.']","['liet', 'dat horen', 'Bos', 'week met het', 'brief.']",15,30,1,"[0.8095238095238095, 0.38461538461538464, 0.9166666666666666, 0.0, 0.8709677419354839]",0.6,volkskrant
seq10-0,base,"Ze zorgen al lange tijd voor grote problemen op verschillende plekken in Utrecht: drugsgebruikers op straat. Vorig jaar zorgden zon 120 verslaafden op het Lucasbolwerk voor overlast, maar nadat daar maatregelen werden genomen, verplaatste de groep zich naar Park Lepelenburg.",Ze zorgen al lange tijd voor grote problemen op verschillende plekken in Utrecht: drugsgebruikers op straat. Vorig jaar zorgden zon 120 <extra_id_0> Lucasbolwerk <extra_id_1> nadat daar maatregelen werden <extra_id_2> groep <extra_id_3> Lepelenburg.,Ze zorgen al lange tijd voor grote problemen op verschillende plekken in Utrecht: drugsgebruikers op straat. Vorig jaar zorgden zon 120 mensen voor een drugsprobleem in Lucasbolwerk nadat daar maatregelen werden genomen tegen een groep in Lepelenburg.,"['verslaafden op het', 'voor overlast', 'maar', 'genomen', 'verplaatste de', 'zich naar Park']","['mensen voor een drugsprobleem in', '', 'genomen tegen een', 'in']",12,30,1,"[0.78125, 1.0, 0.9411764705882353, 0.8571428571428571]",0.89,volkskrant
seq11-0,base,"Het campagneteam van de Amerikaanse president Joe Biden heeft een nieuwe vacature: een meme-manager, die moet zorgen dat filmpjes en fotos die Biden aantrekkelijk maken voor jongeren viraal gaan.","Het campagneteam van de Amerikaanse president Joe Biden <extra_id_0> vacature: een meme-manager, die moet zorgen dat filmpjes en fotos <extra_id_1> maken <extra_id_2> gaan.","Het campagneteam van de Amerikaanse president Joe Biden heeft een vacature: een meme-manager, die moet zorgen dat filmpjes en fotos die mensen maken viral gaan.","['heeft een nieuwe', 'die Biden aantrekkelijk', 'voor jongeren viraal']","['heeft een', 'die mensen', 'viral']",9,30,1,"[0.4375, 0.6956521739130435, 0.75]",0.63,volkskrant
seq12-0,base,"Hoe weet je of je bij de groep hoort die te veel betaalt voor een zorgverzekering? Meer dan de helft van de Nederlanders betaalt namelijk onnodig veel, blijkt uit onderzoek. Wat kun je hier tegen doen? Vijf veelgestelde vragen en antwoorden. ,,Veel mensen kiezen voor gemak en komen dan op een dure polis uit.","Hoe weet je of je bij de groep hoort die te veel betaalt voor een zorgverzekering? Meer <extra_id_0> van de Nederlanders betaalt namelijk onnodig veel, blijkt <extra_id_1> kun je hier tegen <extra_id_2> en antwoorden. ,,Veel mensen kiezen <extra_id_3> komen <extra_id_4> dure polis uit.","Hoe weet je of je bij de groep hoort die te veel betaalt voor een zorgverzekering? Meer dan de helft van de Nederlanders betaalt namelijk onnodig veel, blijkt uit onderzoek. Hoe kun je hier tegen kijken en antwoorden. ,,Veel mensen kiezen voor een komen dure polis uit.","['dan de helft', 'uit onderzoek. Wat', 'doen? Vijf veelgestelde vragen', 'voor gemak en', 'dan op een']","['dan de helft', 'uit onderzoek. Hoe', 'kijken', 'voor een', '']",16,30,1,"[0.0, 0.16666666666666666, 0.8666666666666667, 0.38461538461538464, 1.0]",0.48,volkskrant
seq13-0,base,"OpenAI, het bedrijf achter ChatGPT, schort een AI-stem op die sterk aan de stem van actrice Scarlett Johansson doet denken. Het bedrijf lijkt iets te veel inspiratie te hebben geput uit de film Her, waarvoor Johansson de stem van computersysteem Samantha insprak.","OpenAI, het bedrijf achter ChatGPT, schort <extra_id_0> die sterk aan de <extra_id_1> Scarlett Johansson doet <extra_id_2> iets te veel inspiratie te hebben geput uit de film Her, waarvoor <extra_id_3> van computersysteem Samantha insprak.","OpenAI, het bedrijf achter ChatGPT, schort de zaken die sterk aan de achtergrond. Scarlett Johansson doet er echter niet aan iets te veel inspiratie te hebben geput uit de film Her, waarvoor de maker van computersysteem Samantha insprak.","['een AI-stem op', 'stem van actrice', 'denken. Het bedrijf lijkt', 'Johansson de stem']","['de zaken', 'achtergrond.', 'er echter niet aan', 'de maker']",13,30,1,"[0.7857142857142857, 0.9375, 0.76, 0.8235294117647058]",0.83,volkskrant
seq14-0,base,"De voorgenomen verhoging van de belasting toegevoegde waarde (btw) op cultuur, recreatie, boeken en periodieken maakt veel los bij de lezers. Vooral de hogere belasting op sportclubs en sportscholen roept veel vragen op. Economieredacteur Peet Vogels geeft antwoord.","<extra_id_0> van de belasting toegevoegde waarde (btw) op cultuur, recreatie, <extra_id_1> maakt veel los bij de lezers. Vooral de hogere belasting op sportclubs en <extra_id_2> veel vragen op. Economieredacteur <extra_id_3> antwoord.","De hoogte van de belasting toegevoegde waarde (btw) op cultuur, recreatie, sport en sportaccommodaties maakt veel los bij de lezers. Vooral de hogere belasting op sportclubs en cultuur levert veel vragen op. Economieredacteur antwoord.","['De voorgenomen verhoging', 'boeken en periodieken', 'sportscholen roept', 'Peet Vogels geeft']","['De hoogte', 'sport en sportaccommodaties', 'cultuur levert', '']",11,30,1,"[0.7083333333333334, 0.7037037037037037, 0.7222222222222222, 1.0]",0.78,volkskrant
seq15-0,base,"Sinds Raemon Sluiter de Oekraense Elina Svitolina coacht, heeft zijn baan een andere betekenis. Voor ons geldt: wij ontkomen er niet aan, de oorlog en de verdere wereld is dagelijkse realiteit.","Sinds Raemon Sluiter de Oekraense Elina Svitolina coacht, heeft zijn baan een andere betekenis. Voor ons geldt: <extra_id_0> niet aan, de <extra_id_1> verdere wereld <extra_id_2>","Sinds Raemon Sluiter de Oekraense Elina Svitolina coacht, heeft zijn baan een andere betekenis. Voor ons geldt: neem het niet aan, de winst is de verdere wereld","['wij ontkomen er', 'oorlog en de', 'is dagelijkse realiteit.']","['neem het', 'winst is de', '']",9,30,1,"[0.8, 0.6666666666666666, 1.0]",0.82,volkskrant
seq16-0,base,"De Amerikaanse regering start een aantal mededingingsonderzoeken naar OpenAI, Nvidia en Microsoft vanwege mogelijk te vergaande dominantie van de markt van kunstmatige intelligentie (AI). Dat meldt de Amerikaanse krant The New York Times donderdag.","<extra_id_0> start een aantal mededingingsonderzoeken naar OpenAI, Nvidia en Microsoft vanwege mogelijk <extra_id_1> van de markt van kunstmatige intelligentie (AI). Dat meldt de Amerikaanse krant The <extra_id_2>","start een aantal mededingingsonderzoeken naar OpenAI, Nvidia en Microsoft vanwege mogelijk problemen met de regulering van de markt van kunstmatige intelligentie (AI). Dat meldt de Amerikaanse krant The Verge.","['De Amerikaanse regering', 'te vergaande dominantie', 'New York Times donderdag.']","['', 'problemen met de regulering', 'Verge.']",10,30,1,"[1.0, 0.8518518518518519, 0.84]",0.9,volkskrant
seq17-0,base,"De pro-Palestijnse demonstrant die bij een protest op de Amsterdamse Roeterseilandcampus op televisieschermen insloeg, heeft een gevangenisstraf van 2 maanden gekregen, waarvan 1 maand voorwaardelijk.","De pro-Palestijnse demonstrant die bij een <extra_id_0> Amsterdamse Roeterseilandcampus op televisieschermen <extra_id_1> een gevangenisstraf van 2 maanden gekregen, waarvan <extra_id_2>","De pro-Palestijnse demonstrant die bij een protest op de Amsterdamse Roeterseilandcampus op televisieschermen demonstreerde een gevangenisstraf van 2 maanden gekregen, waarvan","['protest op de', 'insloeg', 'heeft', '1 maand voorwaardelijk.']","['protest op de', 'demonstreerde', '']",8,30,1,"[0.0, 0.7692307692307693, 1.0]",0.59,volkskrant
seq18-0,base,"Wie wint Ronald Garros? Novak Djokovic, Jannik Sinner en Carlos Alcaraz zijn niet in vorm, om over Rafael Nadal maar te zwijgen. Mooie kans voor Daniil Medvedev, alleen houdt hij niet van gravel.","Wie wint Ronald Garros? Novak Djokovic, Jannik Sinner en Carlos Alcaraz <extra_id_0> om over Rafael Nadal maar te zwijgen. <extra_id_1> Daniil Medvedev, <extra_id_2> niet van gravel.","Wie wint Ronald Garros? Novak Djokovic, Jannik Sinner en Carlos Alcaraz En om over Rafael Nadal maar te zwijgen. Over Daniil Medvedev, maar niet van gravel.","['zijn niet in vorm,', 'Mooie kans voor', 'alleen houdt hij']","['En', 'Over', 'maar']",10,30,1,"[0.9444444444444444, 0.8666666666666667, 1.0]",0.94,volkskrant
seq19-0,base,Onder de Nederlandse bevolking is weinig steun voor Israls oorlog in Gaza. Slechts eenvijfde van de bevolking vindt dat de Isralische bombardementen in Gaza nodig zijn om Hamas uit te schakelen.,Onder de Nederlandse bevolking is <extra_id_0> Israls oorlog in Gaza. Slechts eenvijfde <extra_id_1> vindt <extra_id_2> bombardementen in Gaza nodig zijn om Hamas uit te schakelen.,Onder de Nederlandse bevolking is het sterkste oordeel over Israls oorlog in Gaza. Slechts eenvijfde Nederlanders vindt dat bombardementen in Gaza nodig zijn om Hamas uit te schakelen.,"['weinig steun voor', 'van de bevolking', 'dat de Isralische']","['het sterkste oordeel over', 'Nederlanders', 'dat']",9,30,1,"[0.76, 0.875, 0.8235294117647058]",0.82,volkskrant
seq20-0,base,In duizenden boeken over drugshandelaar Janus van Wesenbeeck moeten fotos worden zwartgemaakt. De afgelopen jaren kwam Van Wesenbeeck onder de aandacht vanwege de Netflix-hitserie Undercover.,In duizenden boeken over drugshandelaar Janus van <extra_id_0> fotos worden zwartgemaakt. De afgelopen jaren <extra_id_1> onder de aandacht <extra_id_2> Undercover.,In duizenden boeken over drugshandelaar Janus van der Meulen zijn fotos worden zwartgemaakt. De afgelopen jaren is Janus onder de aandacht van Undercover.,"['Wesenbeeck moeten', 'kwam Van Wesenbeeck', 'vanwege de Netflix-hitserie']","['der Meulen zijn', 'is Janus', 'van']",8,30,1,"[0.8235294117647058, 0.7894736842105263, 0.8888888888888888]",0.83,volkskrant
seq21-0,base,Ook in het Caribische deel van het Nederlands Koninkrijk is GroenLinks-PvdA de grote winnaar geworden bij de Europese Parlementsverkiezingen.,Ook in het <extra_id_0> het Nederlands Koninkrijk is <extra_id_1> winnaar geworden bij de Europese Parlementsverkiezingen.,Ook in het parlement van het Nederlands Koninkrijk is er een winnaar geworden bij de Europese Parlementsverkiezingen.,"['Caribische deel van', 'GroenLinks-PvdA de grote']","['parlement van', 'er een']",6,30,1,"[0.5789473684210527, 0.875]",0.73,volkskrant
seq22-0,base,"De terugroepactie van bakfietsfabrikant Babboe verloopt uiterst moeizaam. Van de 22.000 onveilige bakfietsen zijn er slechts 6000 opgehaald, waarvan ruim de helft in ons land. Pas 500 gedupeerde eigenaren ontvingen een nieuw exemplaar. Nog tienduizenden inspecties aan mogelijk onveilige bakfietsen moeten worden uitgevoerd. Babboe erkent alle problemen.","De terugroepactie van bakfietsfabrikant <extra_id_0> uiterst moeizaam. Van de 22.000 onveilige bakfietsen <extra_id_1> 6000 opgehaald, waarvan ruim de helft in <extra_id_2> 500 gedupeerde eigenaren ontvingen een <extra_id_3> tienduizenden <extra_id_4> onveilige bakfietsen moeten worden uitgevoerd. Babboe erkent alle problemen.","De terugroepactie van bakfietsfabrikant Babboe verliep uiterst moeizaam. Van de 22.000 onveilige bakfietsen werden 6000 opgehaald, waarvan ruim de helft in Nederland. 500 gedupeerde eigenaren ontvingen een vergoeding. De tienduizenden nieuwe onveilige bakfietsen moeten worden uitgevoerd. Babboe erkent alle problemen.","['Babboe verloopt', 'zijn er slechts', 'ons land. Pas', 'nieuw exemplaar. Nog', 'inspecties aan mogelijk']","['Babboe verliep', 'werden', 'Nederland.', 'vergoeding. De', 'nieuwe']",14,30,1,"[0.2, 0.8, 0.6923076923076923, 0.8, 0.8260869565217391]",0.66,volkskrant
seq23-0,base,Niet eerder werden er in Nederland zo veel drugslabs ontmanteld als vorig jaar. Voor de Engelse drugsonderzoeker Steve Rolles is het opnieuw een aanwijzing dat het drugsbeleid radicaal op de schop moet.,Niet eerder werden er in Nederland zo veel drugslabs <extra_id_0> jaar. Voor de Engelse drugsonderzoeker Steve Rolles <extra_id_1> aanwijzing dat <extra_id_2> op de schop moet.,Niet eerder werden er in Nederland zo veel drugslabs geproduceerd als vorig jaar. Voor de Engelse drugsonderzoeker Steve Rolles is er aanwijzing dat het op de schop moet.,"['ontmanteld als vorig', 'is het opnieuw een', 'het drugsbeleid radicaal']","['geproduceerd als vorig', 'is er', 'het']",10,30,1,"[0.45454545454545453, 0.7777777777777778, 0.875]",0.7,volkskrant
seq24-0,base,Na uit de hand gelopen protesten werd de campus van de Universiteit van Amsterdam voor twee dagen ten dele gesloten. Nu lijkt de rust terug te keren.,Na uit de <extra_id_0> protesten werd de campus van de Universiteit <extra_id_1> twee dagen ten dele gesloten. Nu <extra_id_2> terug te keren.,Na uit de vele protesten werd de campus van de Universiteit voor twee dagen ten dele gesloten. Nu is het tijd om terug te keren.,"['hand gelopen', 'van Amsterdam voor', 'lijkt de rust']","['vele', 'voor', 'is het tijd om']",8,30,1,"[0.75, 0.7777777777777778, 0.8571428571428571]",0.79,volkskrant
seq25-0,base,"Het COA, dat kampt met een structureel tekort aan opvangplekken, is zeer te spreken over de stap naar voren van Arnhem.","Het COA, dat kampt met een structureel tekort aan opvangplekken, is <extra_id_0> over de stap naar <extra_id_1>","Het COA, dat kampt met een structureel tekort aan opvangplekken, is klaar over de stap naar de rechter.","['zeer te spreken', 'voren van Arnhem.']","['klaar', 'rechter.']",6,30,1,"[0.9333333333333333, 0.7647058823529411]",0.85,volkskrant
seq26-0,base,Na een kletsnatte maandag volgt een veelal wisselvallige en frisse week. Aangezien we midden in de piek van het hooikoortsseizoen zitten is dat goed nieuws voor hooikoortspatinten.,Na een kletsnatte <extra_id_0> veelal wisselvallige en frisse week. Aangezien <extra_id_1> de piek van het hooikoortsseizoen <extra_id_2> dat goed nieuws voor hooikoortspatinten.,"Na een kletsnatte week is het een veelal wisselvallige en frisse week. Aangezien het de piek van het hooikoortsseizoen is, is dat goed nieuws voor hooikoortspatinten.","['maandag volgt een', 'we midden in', 'zitten is']","['week is het een', 'het', 'is, is']",8,30,1,"[0.6470588235294118, 0.9166666666666666, 0.5555555555555556]",0.71,volkskrant
seq27-0,base,"Fabrikanten halen geneesmiddelen van de Nederlandse markt, waardoor er steeds minder alternatieven beschikbaar zijn om de aanhoudende medicijntekorten op te lossen. Dat blijkt uit onderzoek van de NOS.","Fabrikanten halen geneesmiddelen van de Nederlandse markt, waardoor er steeds <extra_id_0> zijn om de aanhoudende medicijntekorten op te <extra_id_1> uit onderzoek <extra_id_2> NOS.","Fabrikanten halen geneesmiddelen van de Nederlandse markt, waardoor er steeds meer mogelijkheden zijn om de aanhoudende medicijntekorten op te lossen, blijkt uit onderzoek van NOS.","['minder alternatieven beschikbaar', 'lossen. Dat blijkt', 'van de']","['meer mogelijkheden', 'lossen, blijkt', 'van']",8,30,1,"[0.75, 0.2777777777777778, 0.5]",0.51,volkskrant
seq28-0,base,"Dubbele seksuele moraal is achterhaald, laat vrouwen ook kinderen hebben bij verschillende mensen","Dubbele seksuele moraal is achterhaald, laat vrouwen ook <extra_id_0> mensen","Dubbele seksuele moraal is achterhaald, laat vrouwen ook leiden durch mensen",['kinderen hebben bij verschillende'],['leiden durch'],4,30,1,[0.7878787878787878],0.79,volkskrant
seq29-0,base,"Kabosu, de Japanse Shiba Inu wier beeltenis de wereld overging als meme, is vrijdagochtend overleden. De hond was het symbool van de als grap bedoelde cryptomunt dogecoin, waarvan het totaal aantal munten in 2021 ruim 80 miljard euro waard was.","Kabosu, de Japanse Shiba Inu wier beeltenis de wereld <extra_id_0> is vrijdagochtend overleden. De <extra_id_1> symbool van <extra_id_2> bedoelde cryptomunt dogecoin, waarvan het totaal aantal munten in <extra_id_3> miljard euro waard was.","Kabosu, de Japanse Shiba Inu wier beeltenis de wereld in het water stak, is vrijdagochtend overleden. De als symbool van de bedoelde cryptomunt dogecoin, waarvan het totaal aantal munten in totaal 1 miljard euro waard was.","['overging als meme,', 'hond was het', 'de als grap', '2021 ruim 80']","['in het water stak,', 'als', 'de', 'totaal 1']",12,30,1,"[0.8888888888888888, 0.9166666666666666, 0.8181818181818182, 0.9166666666666666]",0.89,volkskrant
seq30-0,base,Het Openbaar Ministerie heeft een nieuwe kroongetuige gepresenteerd. Het gaat om de 29-jarige Dominique K.,Het Openbaar Ministerie <extra_id_0> gepresenteerd. Het gaat om de 29-jarige Dominique K.,Het Openbaar Ministerie heeft gepresenteerd. Het gaat om de 29-jarige Dominique K.,['heeft een nieuwe kroongetuige'],['heeft'],4,30,1,[0.8275862068965517],0.83,volkskrant
seq31-0,base,Daan en het ongelijk van de rommelmarktheks Uren samen spelen is verruild voor me-time op eigen kamers. Daan Rot schrijft in weekendmagazine Mezza wekelijks over zijn persoonlijk leven,Daan en het ongelijk van <extra_id_0> samen spelen is verruild voor me-time op eigen kamers. Daan <extra_id_1> in <extra_id_2> over zijn persoonlijk leven,Daan en het ongelijk van de maatschappij. De manier waarop we samen spelen is verruild voor me-time op eigen kamers. Daan vertelt in deze over zijn persoonlijk leven,"['de rommelmarktheks Uren', 'Rot schrijft', 'weekendmagazine Mezza wekelijks']","['de maatschappij. De manier waarop we', 'vertelt', 'deze']",8,30,1,"[0.8055555555555556, 0.8333333333333334, 0.8709677419354839]",0.84,volkskrant
seq32-0,base,Het Eindhovense KMWE ziet als toeleverancier van het snelgroeiende ASML de orders binnenstromen. Al levert dat ook een probleem op: technisch personeel ligt niet voor het oprapen.,<extra_id_0> ziet als toeleverancier <extra_id_1> ASML de orders binnenstromen. Al levert dat ook een probleem op: technisch personeel ligt niet voor <extra_id_2>,De concurrent ziet als toeleverancier van ASML de orders binnenstromen. Al levert dat ook een probleem op: technisch personeel ligt niet voor de deur.,"['Het Eindhovense KMWE', 'van het snelgroeiende', 'het oprapen.']","['De concurrent', 'van', 'deur.']",8,30,1,"[0.75, 0.8571428571428571, 0.75]",0.79,volkskrant
seq33-0,base,Vijf jaar geleden trad de Europese Commissie onder leiding van Ursula von der Leyen aan. Het werd een periode van grote crises en onverwachte gebeurtenissen die een ferme reactie vereisten. Hoe deed de Commissie het?,Vijf jaar geleden trad de Europese Commissie onder leiding van Ursula von der Leyen aan. Het werd een periode <extra_id_0> en onverwachte <extra_id_1> reactie vereisten. <extra_id_2> Commissie het?,Vijf jaar geleden trad de Europese Commissie onder leiding van Ursula von der Leyen aan. Het werd een periode waarin nieuwe en onverwachte vormen van reactie vereisten. Hoe doet de Commissie het?,"['van grote crises', 'gebeurtenissen die een ferme', 'Hoe deed de']","['waarin nieuwe', 'vormen van', 'Hoe doet de']",10,30,1,"[0.8125, 0.8214285714285714, 0.18181818181818182]",0.61,volkskrant
seq34-0,base,Cees Dekker | hoogleraar biofysica Hoe is het leven ontstaan? Synthetische cellen maken dat inzichtelijk. Als je zoiets zelf bouwt ga je begrijpen hoe het werkt.,Cees Dekker | hoogleraar biofysica Hoe <extra_id_0> ontstaan? Synthetische <extra_id_1> inzichtelijk. Als je zoiets zelf bouwt ga je <extra_id_2> het werkt.,Cees Dekker | hoogleraar biofysica Hoe kan een molecule ontstaan? Synthetische processen inzichtelijk. Als je zoiets zelf bouwt ga je zien hoe het werkt.,"['is het leven', 'cellen maken dat', 'begrijpen hoe']","['kan een molecule', 'processen', 'zien hoe']",8,30,1,"[0.6875, 0.8125, 0.46153846153846156]",0.65,volkskrant
