Sequence id,Model size,Input sequence (ground truth),Input sequence (masked),Model output sequence,Masked tokens,Filled tokens,Number of masked tokens,Masking percentage,Duplicate count,Levenshtein distances,Levenshtein distance (avg),Title
seq0-0,small,Miljoenen Afghanen leven onder de armoedegrens. Buitenlandse donoren bieden weinig hulp omdat de Taliban vrouwenrechten drastisch beperkten. Vermindering van de internationale hulp zal dezelfde Afghaanse vrouwen die we hopen te steunen alleen maar meer laten lijden.,Miljoenen Afghanen leven onder de armoedegrens. <extra_id_0> weinig hulp omdat de <extra_id_1> drastisch beperkten. Vermindering van de internationale hulp zal dezelfde <extra_id_2> we hopen te steunen alleen <extra_id_3> lijden.,Miljoenen Afghanen leven onder de armoedegrens. We krijgen weinig hulp omdat de problemen drastisch beperkten. Vermindering van de internationale hulp zal dezelfde situatie zijn als we hopen te steunen alleen maar lijden.,"['Buitenlandse donoren bieden', 'Taliban vrouwenrechten', 'Afghaanse vrouwen die', 'maar meer laten']","['We krijgen', 'problemen', 'situatie zijn als', 'maar']",11,30,1,"[0.7777777777777778, 0.7727272727272727, 0.7619047619047619, 0.7333333333333333]",0.76,ad
seq1-0,small,Defensie voert de druk op om te dienen bij de krijgsmacht. Jongeren reageren verdeeld.,Defensie voert de druk op om te dienen bij de <extra_id_0>,Defensie voert de druk op om te dienen bij de crisis.,['krijgsmacht. Jongeren reageren verdeeld.'],['crisis.'],4,30,1,[0.9],0.9,ad
seq2-0,small,"Netbeheerder Tennet heeft met de aanleg van een stroomkabel mogelijk onomkeerbare schade aangebracht aan kwetsbare natuur op landgoed Twickel, concludeerde de provincie Overijssel donderdag.","Netbeheerder Tennet heeft met de aanleg van <extra_id_0> onomkeerbare schade aangebracht aan kwetsbare natuur op landgoed Twickel, <extra_id_1> donderdag.","Netbeheerder Tennet heeft met de aanleg van de onomkeerbare schade aangebracht aan kwetsbare natuur op landgoed Twickel, bekend donderdag.","['een stroomkabel mogelijk', 'concludeerde de provincie Overijssel']","['de', 'bekend']",7,30,1,"[0.9583333333333334, 0.9166666666666666]",0.94,ad
seq3-0,small,Noord-Korea is weer begonnen met het versturen van ballonnen met afval naar Zuid-Korea. In en rond Seoul en in de grensstreek werden zondagochtend tientallen ballonnen gevonden. In reactie zet Zuid-Korea de grote luidsprekers bij de grens weer aan en zullen nieuwsuitzendingen en popmuziek de grens over schallen.,Noord-Korea is weer begonnen met het <extra_id_0> ballonnen <extra_id_1> Zuid-Korea. In en rond <extra_id_2> de grensstreek werden zondagochtend tientallen ballonnen gevonden. In reactie zet Zuid-Korea de grote <extra_id_3> grens weer aan en zullen nieuwsuitzendingen en <extra_id_4> over schallen.,Noord-Korea is weer begonnen met het zoeken van ballonnen in Zuid-Korea. In en rond de grensstreek werden zondagochtend tientallen ballonnen gevonden. In reactie zet Zuid-Korea de grote strijd tegen de grens weer aan en zullen nieuwsuitzendingen en evenementen over schallen.,"['versturen van', 'met afval naar', 'Seoul en in', 'luidsprekers bij de', 'popmuziek de grens']","['zoeken van', 'in', '', 'strijd tegen de', 'evenementen']",14,30,1,"[0.5384615384615384, 0.9285714285714286, 1.0, 0.7368421052631579, 0.7777777777777778]",0.8,ad
seq4-0,small,"Voor de energietransitie zijn grote hoeveelheden metalen nodig, zoals nikkel. Planten kunnen daarbij helpen. Er worden steeds meer soorten ontdekt die zulke metalen uit de grond opnemen.","Voor de energietransitie zijn grote hoeveelheden metalen nodig, zoals nikkel. Planten kunnen daarbij helpen. Er worden steeds <extra_id_0> ontdekt <extra_id_1> uit <extra_id_2>","Voor de energietransitie zijn grote hoeveelheden metalen nodig, zoals nikkel. Planten kunnen daarbij helpen. Er worden steeds meer planten ontdekt die uit de planten moeten worden.","['meer soorten', 'die zulke metalen', 'de grond opnemen.']","['meer planten', 'die', 'worden.']",8,30,1,"[0.3333333333333333, 0.8235294117647058, 0.7058823529411765]",0.62,ad
seq5-0,small,De eindexamens in het voortgezet onderwijs zijn begonnen. De Volkskrant doet de komende weken verslag. Historicus Maarten van Rossem buigt zich over het vwo-examen geschiedenis.,De eindexamens in het voortgezet onderwijs zijn begonnen. De Volkskrant <extra_id_0> weken verslag. <extra_id_1> van Rossem buigt <extra_id_2> vwo-examen geschiedenis.,De eindexamens in het voortgezet onderwijs zijn begonnen. De Volkskrant gaat over de afgelopen weken verslag. Willem van Rossem buigt de vwo-examen geschiedenis.,"['doet de komende', 'Historicus Maarten', 'zich over het']","['gaat over de afgelopen', 'Willem', 'de']",8,30,1,"[0.6363636363636364, 0.8888888888888888, 0.9230769230769231]",0.82,ad
seq6-0,small,"Ik sta op zaterdagmiddag rond 13.00 uur midden op de Amsterdamse Kalverstraat. Het moet een van de drukste plekken van het land zijn, en ik kijk door de lens van de camera van een professional, die allerlei lenzen tevoorschijn kan toveren.","Ik sta op zaterdagmiddag rond 13.00 uur midden op de Amsterdamse Kalverstraat. Het moet een van de drukste <extra_id_0> land zijn, en ik kijk door de lens <extra_id_1> van <extra_id_2> allerlei lenzen <extra_id_3>","Ik sta op zaterdagmiddag rond 13.00 uur midden op de Amsterdamse Kalverstraat. Het moet een van de drukste plekken in het land zijn, en ik kijk door de lens van de allerlei lenzen","['plekken van het', 'van de camera', 'een professional', 'die', 'tevoorschijn kan toveren.']","['plekken in het', '', 'de', '']",12,30,1,"[0.13333333333333333, 1.0, 0.9375, 1.0]",0.77,ad
seq7-0,small,"Carlos Alcaraz heeft voor het eerst in zijn carrire Roland Garros gewonnen. De 21-jarige Spanjaard won de bloedstollende vijfsetter (3-6, 6-2, 7-5, 1-6, 2-6) van Alexander Zverev en trok daarmee de ongeslagen reeks in finales door.","<extra_id_0> voor het eerst in zijn <extra_id_1> gewonnen. De 21-jarige Spanjaard won de bloedstollende vijfsetter (3-6, 6-2, 7-5, 1-6, 2-6) van Alexander Zverev <extra_id_2> de <extra_id_3> in finales door.","hebben voor het eerst in zijn competitie gewonnen. De 21-jarige Spanjaard won de bloedstollende vijfsetter (3-6, 6-2, 7-5, 1-6, 2-6) van Alexander Zverev de eerste keer in finales door.","['Carlos Alcaraz heeft', 'carrire Roland Garros', 'en trok daarmee', 'ongeslagen reeks']","['hebben', 'competitie', '', 'eerste keer']",11,30,1,"[0.95, 0.9047619047619048, 1.0, 0.6875]",0.89,ad
seq8-0,small,Met een spectaculaire reddingsoperatie wist het Isralische leger zaterdag vier gijzelaars te bevrijden. De prijs aan Palestijnse zijde is echter ongekend hoog. Wat betekent deze actie voor de ongeveer 120 gijzelaars die nog vastzitten?,Met een spectaculaire reddingsoperatie wist het Isralische leger zaterdag vier gijzelaars te bevrijden. De <extra_id_0> zijde is <extra_id_1> betekent deze actie voor de ongeveer 120 gijzelaars <extra_id_2>,Met een spectaculaire reddingsoperatie wist het Isralische leger zaterdag vier gijzelaars te bevrijden. De eerste zijde is echter zeer sterk. Wat betekent deze actie voor de ongeveer 120 gijzelaars,"['prijs aan Palestijnse', 'echter ongekend hoog. Wat', 'die nog vastzitten?']","['eerste', 'echter zeer sterk. Wat', '']",10,30,1,"[0.8571428571428571, 0.44, 1.0]",0.77,ad
seq9-0,small,"Het hoofdlijnenakkoord van het kabinet-in-wording begint met een gedicht. Nederland is een prachtig land./ Een land om trots op te zijn. En zo gaat het nog een beetje door, totdat er onverwacht een lange zin volgt.","Het hoofdlijnenakkoord van het kabinet-in-wording begint met een gedicht. Nederland is een prachtig land./ Een land <extra_id_0> op <extra_id_1> zo gaat <extra_id_2> beetje door, totdat er <extra_id_3> zin volgt.","Het hoofdlijnenakkoord van het kabinet-in-wording begint met een gedicht. Nederland is een prachtig land./ Een land dat op de grond staat, zo gaat het een beetje door, totdat er een zin volgt.","['om trots', 'te zijn. En', 'het nog een', 'onverwacht een lange']","['dat', 'de grond staat,', 'het een', 'een']",11,30,1,"[0.875, 0.7333333333333333, 0.36363636363636365, 0.85]",0.71,ad
seq10-0,small,"En nog zijn PVV, VVD, NSC en BBB het niet eens over de verdeling van de ministersposten. Zo maken de vier partijen het het aanstaande kabinet wel heel lastig. Want als de nieuwe premier niet op de volgende Europese top van 27 juni verschijnt, staat hij al meteen 1-0 achter, schrijft politiek verslaggever Hans van Soest in dit commentaar.","En nog zijn PVV, VVD, NSC en BBB het niet eens over de verdeling van de ministersposten. Zo maken de vier partijen het <extra_id_0> wel heel lastig. Want als de nieuwe premier <extra_id_1> volgende Europese top van <extra_id_2> staat hij al <extra_id_3> schrijft politiek <extra_id_4> Soest <extra_id_5>","En nog zijn PVV, VVD, NSC en BBB het niet eens over de verdeling van de ministersposten. Zo maken de vier partijen het toch wel heel lastig. Want als de nieuwe premier de volgende Europese top van de staat hij al klaar, schrijft politiek Soest","['het aanstaande kabinet', 'niet op de', '27 juni verschijnt,', 'meteen 1-0 achter,', 'verslaggever Hans van', 'in dit commentaar.']","['toch', 'de', 'de', 'klaar,', '', '']",18,30,1,"[0.9545454545454546, 0.8, 0.9473684210526315, 0.8333333333333334, 1.0, 1.0]",0.92,ad
seq11-0,small,Zon 22.000 kinderen worden jaarlijks voor korte of langere periode opgevangen door pleegouders. Een uitgebreide screening moet ervoor zorgen dat ze geschikt zijn om deze zorg te dragen. Hoe kon het in Vlaardingen dan toch zo misgaan?,Zon 22.000 kinderen worden jaarlijks voor korte <extra_id_0> opgevangen door pleegouders. Een uitgebreide screening moet ervoor zorgen dat ze <extra_id_1> deze <extra_id_2> dragen. Hoe kon het in <extra_id_3> zo misgaan?,Zon 22.000 kinderen worden jaarlijks voor korte termijn opgevangen door pleegouders. Een uitgebreide screening moet ervoor zorgen dat ze zich deze kinderen dragen. Hoe kon het in de wijk zo misgaan?,"['of langere periode', 'geschikt zijn om', 'zorg te', 'Vlaardingen dan toch']","['termijn', 'zich', 'kinderen', 'de wijk']",11,30,1,"[0.8333333333333334, 0.875, 0.875, 0.85]",0.86,ad
seq12-0,small,"Garry Conille, nog geen twee weken geleden als tijdelijke premier van Hati aangesteld, is zaterdag in het ziekenhuis in Port-au-Prince opgenomen.","Garry Conille, nog geen twee weken geleden als tijdelijke premier <extra_id_0> is zaterdag <extra_id_1> in Port-au-Prince opgenomen.","Garry Conille, nog geen twee weken geleden als tijdelijke premier is zaterdag in Port-au-Prince opgenomen.","['van Hati aangesteld,', 'in het ziekenhuis']","['', '']",6,30,1,"[1.0, 1.0]",1.0,ad
seq13-0,small,Inbrekers hebben afgelopen nacht voor ongeveer een half miljoen euro aan juwelen buitgemaakt bij de luxe juwelier Bulgari in Rome.,Inbrekers hebben afgelopen nacht voor ongeveer <extra_id_0> euro aan juwelen buitgemaakt bij <extra_id_1> Bulgari in Rome.,Inbrekers hebben afgelopen nacht voor ongeveer 30.000 euro aan juwelen buitgemaakt bij een vestiging van Bulgari in Rome.,"['een half miljoen', 'de luxe juwelier']","['30.000', 'een vestiging van']",6,30,1,"[1.0, 0.8823529411764706]",0.94,ad
seq14-0,small,De van televisie bekende Henritte Momma is eind vorige maand op 90-jarige leeftijd overleden. Miljoenen Nederlanders leerden haar de afgelopen jaren kennen als de liefdevolle en zorgzame moeder van de autistische kunstenaar Kees Momma.,De van televisie bekende Henritte Momma is eind <extra_id_0> 90-jarige leeftijd overleden. Miljoenen Nederlanders <extra_id_1> jaren kennen als de liefdevolle en zorgzame <extra_id_2> autistische kunstenaar Kees Momma.,De van televisie bekende Henritte Momma is eind vorige 90-jarige leeftijd overleden. Miljoenen Nederlanders leren de komende jaren kennen als de liefdevolle en zorgzame autistische kunstenaar Kees Momma.,"['vorige maand op', 'leerden haar de afgelopen', 'moeder van de']","['vorige', 'leren de komende', '']",10,30,1,"[0.6, 0.56, 1.0]",0.72,ad
seq15-0,small,"Naar aanleiding van de grote hoeveelheid pfas in eieren rond de fabriek van Chemours in Dordrecht, start het RIVM een nieuw onderzoek. Het rijksinstituut wil weten of nog meer eieren van hobbykippen schadelijke hoeveelheden van de chemische stoffen bevatten.","Naar aanleiding van de grote hoeveelheid <extra_id_0> rond <extra_id_1> Chemours in Dordrecht, start <extra_id_2> nieuw onderzoek. <extra_id_3> weten of nog meer eieren van hobbykippen schadelijke hoeveelheden van de chemische stoffen bevatten.","Naar aanleiding van de grote hoeveelheid eieren rond Chemours in Dordrecht, start nieuw onderzoek. We weten of nog meer eieren van hobbykippen schadelijke hoeveelheden van de chemische stoffen bevatten.","['pfas in eieren', 'de fabriek van', 'het RIVM een', 'Het rijksinstituut wil']","['eieren', '', '', 'We']",12,30,1,"[0.5714285714285714, 1.0, 1.0, 0.9545454545454546]",0.88,ad
seq16-0,small,Voor deze rubriek sturen lezers fotos in van hun ouders. Deze keer stuurde Peter Boomsma (1960) een door F.C.D. Popken gemaakte foto in van zijn ouders Hennie Boomsma-Wieten (1932-1999) en Jelle Boomsma (1927-2010).,Voor deze <extra_id_0> fotos in van hun ouders. Deze keer stuurde Peter Boomsma (1960) een door F.C.D. Popken gemaakte foto <extra_id_1> ouders Hennie <extra_id_2> Boomsma (1927-2010).,Voor deze foto stuurde hij fotos in van hun ouders. Deze keer stuurde Peter Boomsma (1960) een door F.C.D. Popken gemaakte foto van haar ouders Hennie van Boomsma (1927-2010).,"['rubriek sturen lezers', 'in van zijn', 'Boomsma-Wieten (1932-1999) en Jelle']","['foto stuurde hij', 'van haar', 'van']",10,30,1,"[0.7619047619047619, 0.6363636363636364, 0.9428571428571428]",0.78,ad
seq17-0,small,De Luxemburgse Vicky Krieps is een van de meest gewilde actrices van Europa. Ze is gespecialiseerd in personages die alleen hun blik hebben en zo mannen een spiegel voorhouden.,De Luxemburgse Vicky Krieps is <extra_id_0> meest gewilde actrices van Europa. Ze is gespecialiseerd in personages die alleen hun blik <extra_id_1> mannen <extra_id_2>,De Luxemburgse Vicky Krieps is een van de meest gewilde actrices van Europa. Ze is gespecialiseerd in personages die alleen hun blik op mannen,"['een van de', 'hebben en zo', 'een spiegel voorhouden.']","['een van de', 'op', '']",9,30,1,"[0.0, 1.0, 1.0]",0.67,ad
seq18-0,small,"Het Nederlandse poststelsel moet op de schop omdat PostNL wettelijke normen structureel niet haalt, volgens de minister.","Het Nederlandse poststelsel moet op <extra_id_0> PostNL <extra_id_1> structureel niet haalt, volgens de minister.","Het Nederlandse poststelsel moet op PostNL moeten werken, dat structureel niet haalt, volgens de minister.","['de schop omdat', 'wettelijke normen']","['', 'moeten werken, dat']",5,30,1,"[1.0, 0.7777777777777778]",0.89,ad
seq19-0,small,Is dit fascisme? Het is de vraag die telkens terugkomt. Baudets opmerking over homeopathische verdunning: is dit fascisme? De bestorming van het Capitool: is dit fascisme? Poetins strijd tegen -lhbti-activisten: is dit fascisme?,Is dit fascisme? Het is de vraag die <extra_id_0> opmerking over homeopathische <extra_id_1> fascisme? De bestorming van het Capitool: is dit fascisme? Poetins strijd <extra_id_2> fascisme?,Is dit fascisme? Het is de vraag die vraagt. De opmerking over homeopathische middelen: is dit fascisme? De bestorming van het Capitool: is dit fascisme? Poetins strijd tegen fascisme?,"['telkens terugkomt. Baudets', 'verdunning: is dit', 'tegen -lhbti-activisten: is dit']","['vraagt. De', 'middelen: is dit', 'tegen']",10,30,1,"[0.8076923076923077, 0.4444444444444444, 0.8387096774193549]",0.7,ad
seq20-0,small,"China plant een golf aan nieuwe ruimtemissies naar planetoden. Voor de wetenschap en om grondstoffen te winnen. Maar hoe leg je daar aan? Met borende pootjes, lassos of toch weer een harpoen?","China plant een golf aan nieuwe ruimtemissies <extra_id_0> de wetenschap en om <extra_id_1> Maar hoe leg <extra_id_2> borende pootjes, lassos of toch weer een harpoen?","China plant een golf aan nieuwe ruimtemissies in de wetenschap en om gebieden. Maar hoe leg je borende pootjes, lassos of toch weer een harpoen?","['naar planetoden. Voor', 'grondstoffen te winnen.', 'je daar aan? Met']","['in', 'gebieden.', 'je']",10,30,1,"[0.9523809523809523, 0.7391304347826086, 0.875]",0.86,ad
seq21-0,small,Vier grote zonnepanelenbedrijven van Booking.com-miljonair Kees Koolen zijn failliet. Dat heeft grote gevolgen voor duizenden klanten. Hoe heeft dit kunnen gebeuren?,Vier grote <extra_id_0> Kees Koolen zijn failliet. Dat heeft grote gevolgen voor duizenden klanten. Hoe <extra_id_1> gebeuren?,Vier grote bedrijven van Kees Koolen zijn failliet. Dat heeft grote gevolgen voor duizenden klanten. Hoe gaat dat gebeuren?,"['zonnepanelenbedrijven van Booking.com-miljonair', 'heeft dit kunnen']","['bedrijven van', 'gaat dat']",6,30,1,"[0.723404255319149, 0.75]",0.74,ad
seq22-0,small,"Door het eindeloos lange premierschap van Mark Rutte zaten tekenaars jarenlang aan de politicus vast. Wat hebben zij over Rutte als tekenobject te zeggen, nu hij bijna vertrekt? Vooruitstekende kin, spleetoogjes: je zet hem relatief makkelijk neer.","Door <extra_id_0> premierschap van Mark Rutte zaten tekenaars jarenlang aan de politicus <extra_id_1> hebben zij over Rutte als tekenobject te zeggen, nu hij bijna vertrekt? Vooruitstekende <extra_id_2> zet hem <extra_id_3>","Door het premierschap van Mark Rutte zaten tekenaars jarenlang aan de politicus Hoe hebben zij over Rutte als tekenobject te zeggen, nu hij bijna vertrekt? Vooruitstekende woorden zet hem in de politiek.","['het eindeloos lange', 'vast. Wat', 'kin', 'spleetoogjes: je', 'relatief makkelijk neer.']","['het', 'Hoe', 'woorden', 'politiek.']",11,30,1,"[0.8421052631578947, 1.0, 0.8571428571428571, 0.8125]",0.88,ad
seq23-0,small,"Voor zijn kinderboekje over klimaatverandering kreeg lector Kees Klomp de Over Hoop Prijs. Scholen knnen het niet weghouden bij kinderen, het onderwerp is overal.","Voor <extra_id_0> klimaatverandering kreeg lector Kees Klomp <extra_id_1> Scholen knnen het niet weghouden bij kinderen, het onderwerp is overal.","Voor de klimaatverandering kreeg lector Kees Klomp Scholen knnen het niet weghouden bij kinderen, het onderwerp is overal.","['zijn kinderboekje over', 'de Over Hoop Prijs.']","['de', '']",7,30,1,"[0.9090909090909091, 1.0]",0.95,ad
seq24-0,small,PSV heeft als verrassing vrijdag voor de ingang van het Philips Stadion een bronzen beeld onthuld om de jarenlange samenwerking met Guus Meeuwis passend af te sluiten. Volgende week begint de zanger aan zijn laatste reeks Groots-concerten.,PSV heeft als verrassing <extra_id_0> de ingang van het Philips Stadion een bronzen beeld <extra_id_1> jarenlange samenwerking met <extra_id_2> af <extra_id_3> week begint de zanger aan zijn laatste reeks Groots-concerten.,PSV heeft als verrassing in de ingang van het Philips Stadion een bronzen beeld van de jarenlange samenwerking met de af Deze week begint de zanger aan zijn laatste reeks Groots-concerten.,"['vrijdag voor', 'onthuld om de', 'Guus Meeuwis passend', 'te sluiten. Volgende']","['in', 'van de', 'de', 'Deze']",11,30,1,"[0.9166666666666666, 0.7692307692307693, 0.95, 0.9]",0.88,ad
seq25-0,small,In 2015 was het onmogelijk dat Barack Obama de hand van William Ruto zou schudden. Op zoek naar nieuwe partners in Afrika maken de Amerikanen de president van Kenia nu het hof.,In 2015 was het onmogelijk dat Barack Obama de hand van William Ruto <extra_id_0> zoek naar <extra_id_1> Afrika maken de <extra_id_2> Kenia nu het hof.,In 2015 was het onmogelijk dat Barack Obama de hand van William Ruto op zoek naar politieke zaken. Afrika maken de plannen van Kenia nu het hof.,"['zou schudden. Op', 'nieuwe partners in', 'Amerikanen de president van']","['op', 'politieke zaken.', 'plannen van']",10,30,1,"[0.875, 0.8888888888888888, 0.6666666666666666]",0.81,ad
seq26-0,small,Ilya Sutskever vertrekt bij OpenAI. De mede-oprichter was lange tijd het geweten van het AI-bedrijf. Vorig jaar stond hij lijnrecht tegenover topman Sam Altman. Sutskevers afscheid overschaduwt alle opwinding over de nieuwe superchatbot van OpenAI.,Ilya Sutskever vertrekt bij OpenAI. De mede-oprichter was lange tijd het geweten van <extra_id_0> jaar stond hij lijnrecht tegenover topman Sam <extra_id_1> overschaduwt alle opwinding over <extra_id_2> OpenAI.,Ilya Sutskever vertrekt bij OpenAI. De mede-oprichter was lange tijd het geweten van de nieuwe concurrent. In het jaar stond hij lijnrecht tegenover topman Sam Hij overschaduwt alle opwinding over de OpenAI.,"['het AI-bedrijf. Vorig', 'Altman. Sutskevers afscheid', 'de nieuwe superchatbot van']","['de nieuwe concurrent. In het', 'Hij', 'de']",10,30,1,"[0.8214285714285714, 0.9629629629629629, 0.9230769230769231]",0.9,ad
seq27-0,small,"Het hoofdlijnenakkoord van het kabinet-in-wording begint met een gedicht. Nederland is een prachtig land./ Een land om trots op te zijn. En zo gaat het nog een beetje door, totdat er onverwacht een lange zin volgt.","Het hoofdlijnenakkoord van het kabinet-in-wording begint met een <extra_id_0> is een prachtig land./ <extra_id_1> trots op <extra_id_2> zo gaat het <extra_id_3> door, totdat er onverwacht een lange zin volgt.","Het hoofdlijnenakkoord van het kabinet-in-wording begint met een nieuwe versie. Het is een prachtig land./ Maar trots op het nieuwe voorstel, zo gaat het niet door, totdat er onverwacht een lange zin volgt.","['gedicht. Nederland', 'Een land om', 'te zijn. En', 'nog een beetje']","['nieuwe versie. Het', 'Maar', 'het nieuwe voorstel,', 'niet']",11,30,1,"[0.8888888888888888, 0.9090909090909091, 0.8, 0.7857142857142857]",0.85,ad
seq28-0,small,"Stoelen, banken, pallets, fietsen  de barricades die zijn opgeworpen door de demonstranten die het universiteitsgebouw in de Amsterdamse binnenstad hebben bezet, blijken weinig partij voor de ME.","Stoelen, banken, pallets, fietsen <extra_id_0> die zijn opgeworpen door de demonstranten <extra_id_1> in de Amsterdamse <extra_id_2> blijken weinig partij voor de ME.","Stoelen, banken, pallets, fietsen en vliegtuigen die zijn opgeworpen door de demonstranten van de ME in de Amsterdamse stad. Er blijken weinig partij voor de ME.","['de barricades', 'die het universiteitsgebouw', 'binnenstad hebben bezet,']","['en vliegtuigen', 'van de ME', 'stad. Er']",8,30,1,"[0.8571428571428571, 0.8888888888888888, 0.7916666666666666]",0.85,ad
seq29-0,small,"Was aan de lijn is een levend kunstwerk. De was heeft een vaste volgorde, groot bij groot, soort bij soort, sok bij sok, kleur bij kleur.","Was aan de lijn <extra_id_0> kunstwerk. De <extra_id_1> vaste volgorde, groot bij groot, soort bij soort, sok <extra_id_2> kleur bij kleur.","Was aan de lijn van het kunstwerk. De voorstelling is in vaste volgorde, groot bij groot, soort bij soort, sok bij sok, kleur bij kleur.","['is een levend', 'was heeft een', 'bij sok,']","['van het', 'voorstelling is in', 'bij sok,']",8,30,1,"[0.7692307692307693, 0.8333333333333334, 0.0]",0.53,ad
seq30-0,small,In 2015 was het onmogelijk dat Barack Obama de hand van William Ruto zou schudden.,In 2015 was het onmogelijk dat <extra_id_0> van William Ruto zou schudden.,In 2015 was het onmogelijk dat het het van William Ruto zou schudden.,['Barack Obama de hand'],['het het'],4,30,1,[0.9],0.9,ad
seq31-0,small,"Nederlanders douchen steeds meer, liefst twee keer per dag, met warm water en veel sop. Volgens dermatologen is dat echt te veel voor onze huid.","Nederlanders douchen steeds meer, liefst twee keer per dag, met warm <extra_id_0> sop. Volgens <extra_id_1> echt te <extra_id_2> onze huid.","Nederlanders douchen steeds meer, liefst twee keer per dag, met warm sop. Volgens onze experts, we hebben echt te maken met onze huid.","['water en veel', 'dermatologen is dat', 'veel voor']","['', 'onze experts, we hebben', 'maken met']",8,30,1,"[1.0, 0.8695652173913043, 0.8888888888888888]",0.92,ad
seq32-0,small,"Nog nooit kregen zo weinig babys borstvoeding. Er wordt te weinig ruimte voor gegeven, zeggen jonge moeders in Lelystad. Ik doe het meestal in de auto, de ramen zijn geblindeerd.","Nog nooit kregen zo weinig <extra_id_0> wordt te weinig ruimte voor gegeven, zeggen jonge moeders in Lelystad. <extra_id_1> meestal <extra_id_2> de ramen zijn geblindeerd.","Nog nooit kregen zo weinig ruimte. Er wordt te weinig ruimte voor gegeven, zeggen jonge moeders in Lelystad. Ze zijn meestal niet klaar, de ramen zijn geblindeerd.","['babys borstvoeding. Er', 'Ik doe het', 'in de auto,']","['ruimte. Er', 'Ze zijn', 'niet klaar,']",9,30,1,"[0.7272727272727273, 0.9, 0.8181818181818182]",0.82,ad
seq33-0,small,"Zelden zo weinig gedubd over mijn stem als bij deze Europese verkiezingen; er moet een flink tegenwicht komen tegen Europees radicaal- en extreemrechts, en de fractie van de socialisten en democraten is daar, ook getalsmatig het best toe uitgerust.","Zelden zo weinig gedubd over mijn stem als <extra_id_0> verkiezingen; er moet een flink tegenwicht komen tegen <extra_id_1> extreemrechts, en de <extra_id_2> socialisten en democraten is <extra_id_3> het best toe uitgerust.","Zelden zo weinig gedubd over mijn stem als ik dacht van de verkiezingen; er moet een flink tegenwicht komen tegen de extreemrechts, en de strijd tegen socialisten en democraten is toch het best toe uitgerust.","['bij deze Europese', 'Europees radicaal- en', 'fractie van de', 'daar', 'ook getalsmatig']","['ik dacht van de', 'de', 'strijd tegen', 'toch']",12,30,1,"[0.7647058823529411, 0.9047619047619048, 0.9285714285714286, 1.0]",0.9,ad
