seq21-0,xl,Vier grote zonnepanelenbedrijven van Booking.com-miljonair Kees Koolen zijn failliet. Dat heeft grote gevolgen voor duizenden klanten. Hoe heeft dit kunnen gebeuren?,Vier grote <extra_id_0> Kees Koolen zijn failliet. Dat heeft grote gevolgen voor duizenden klanten. Hoe <extra_id_1> gebeuren?,Vier grote bedrijven van Kees Koolen zijn failliet. Dat heeft grote gevolgen voor duizenden klanten. Hoe kan dat gebeuren?,"['zonnepanelenbedrijven van Booking.com-miljonair', 'heeft dit kunnen']","['bedrijven van', 'kan dat']",6,30,1,"[0.723404255319149, 0.8125]",0.77,ad
seq22-0,xl,"Door het eindeloos lange premierschap van Mark Rutte zaten tekenaars jarenlang aan de politicus vast. Wat hebben zij over Rutte als tekenobject te zeggen, nu hij bijna vertrekt? Vooruitstekende kin, spleetoogjes: je zet hem relatief makkelijk neer.","Door <extra_id_0> premierschap van Mark Rutte zaten tekenaars jarenlang aan de politicus <extra_id_1> hebben zij over Rutte als tekenobject te zeggen, nu hij bijna vertrekt? Vooruitstekende <extra_id_2> zet hem <extra_id_3>","Door het premierschap van Mark Rutte zaten tekenaars jarenlang aan de politicus vast. Wat hebben zij over Rutte als tekenobject te zeggen, nu hij bijna vertrekt? Vooruitstekende tekeningen zet hem niet uit","['het eindeloos lange', 'vast. Wat', 'kin', 'spleetoogjes: je', 'relatief makkelijk neer.']","['het', 'vast. Wat', 'tekeningen', 'uit']",11,30,1,"[0.8421052631578947, 0.0, 0.7, 0.9375]",0.62,ad
seq23-0,xl,"Voor zijn kinderboekje over klimaatverandering kreeg lector Kees Klomp de Over Hoop Prijs. Scholen knnen het niet weghouden bij kinderen, het onderwerp is overal.","Voor <extra_id_0> klimaatverandering kreeg lector Kees Klomp <extra_id_1> Scholen knnen het niet weghouden bij kinderen, het onderwerp is overal.","Voor de klimaatverandering kreeg lector Kees Klomp een mooie opdracht. Scholen knnen het niet weghouden bij kinderen, het onderwerp is overal.","['zijn kinderboekje over', 'de Over Hoop Prijs.']","['de', 'een mooie opdracht.']",7,30,1,"[0.9090909090909091, 0.7894736842105263]",0.85,ad
seq24-0,xl,PSV heeft als verrassing vrijdag voor de ingang van het Philips Stadion een bronzen beeld onthuld om de jarenlange samenwerking met Guus Meeuwis passend af te sluiten. Volgende week begint de zanger aan zijn laatste reeks Groots-concerten.,PSV heeft als verrassing <extra_id_0> de ingang van het Philips Stadion een bronzen beeld <extra_id_1> jarenlange samenwerking met <extra_id_2> af <extra_id_3> week begint de zanger aan zijn laatste reeks Groots-concerten.,PSV heeft als verrassing bij de ingang van het Philips Stadion een bronzen beeld aangericht voor de jarenlange samenwerking met Andr Hazes. De af van de week begint de zanger aan zijn laatste reeks Groots-concerten.,"['vrijdag voor', 'onthuld om de', 'Guus Meeuwis passend', 'te sluiten. Volgende']","['bij', 'aangericht voor de', 'Andr Hazes. De', 'van de']",11,30,1,"[0.8333333333333334, 0.6666666666666666, 0.9, 0.8]",0.8,ad
seq25-0,xl,In 2015 was het onmogelijk dat Barack Obama de hand van William Ruto zou schudden. Op zoek naar nieuwe partners in Afrika maken de Amerikanen de president van Kenia nu het hof.,In 2015 was het onmogelijk dat Barack Obama de hand van William Ruto <extra_id_0> zoek naar <extra_id_1> Afrika maken de <extra_id_2> Kenia nu het hof.,In 2015 was het onmogelijk dat Barack Obama de hand van William Ruto zou pakken. Op zoek naar de ware leider van Afrika maken de leiders van Kenia nu het hof.,"['zou schudden. Op', 'nieuwe partners in', 'Amerikanen de president van']","['zou pakken. Op', 'de ware leider van', 'leiders van']",10,30,1,"[0.375, 0.7222222222222222, 0.6296296296296297]",0.58,ad
seq26-0,xl,Ilya Sutskever vertrekt bij OpenAI. De mede-oprichter was lange tijd het geweten van het AI-bedrijf. Vorig jaar stond hij lijnrecht tegenover topman Sam Altman. Sutskevers afscheid overschaduwt alle opwinding over de nieuwe superchatbot van OpenAI.,Ilya Sutskever vertrekt bij OpenAI. De mede-oprichter was lange tijd het geweten van <extra_id_0> jaar stond hij lijnrecht tegenover topman Sam <extra_id_1> overschaduwt alle opwinding over <extra_id_2> OpenAI.,Ilya Sutskever vertrekt bij OpenAI. De mede-oprichter was lange tijd het geweten van de organisatie. Vorig jaar stond hij lijnrecht tegenover topman Sam Harris. Het nieuws overschaduwt alle opwinding over de toekomst van OpenAI.,"['het AI-bedrijf. Vorig', 'Altman. Sutskevers afscheid', 'de nieuwe superchatbot van']","['de organisatie. Vorig', 'Harris. Het nieuws', 'de toekomst van']",10,30,1,"[0.6190476190476191, 0.8148148148148148, 0.6153846153846154]",0.68,ad
seq27-0,xl,"Het hoofdlijnenakkoord van het kabinet-in-wording begint met een gedicht. Nederland is een prachtig land./ Een land om trots op te zijn. En zo gaat het nog een beetje door, totdat er onverwacht een lange zin volgt.","Het hoofdlijnenakkoord van het kabinet-in-wording begint met een <extra_id_0> is een prachtig land./ <extra_id_1> trots op <extra_id_2> zo gaat het <extra_id_3> door, totdat er onverwacht een lange zin volgt.","Het hoofdlijnenakkoord van het kabinet-in-wording begint met een mooie zin./ Nederland is een prachtig land./ Ik ben er trots op En zo gaat het verhaal door, totdat er onverwacht een lange zin volgt.","['gedicht. Nederland', 'Een land om', 'te zijn. En', 'nog een beetje']","['mooie zin./ Nederland', 'Ik ben er', 'En', 'verhaal']",11,30,1,"[0.42857142857142855, 0.7272727272727273, 0.8181818181818182, 0.9285714285714286]",0.73,ad
seq28-0,xl,"Stoelen, banken, pallets, fietsen  de barricades die zijn opgeworpen door de demonstranten die het universiteitsgebouw in de Amsterdamse binnenstad hebben bezet, blijken weinig partij voor de ME.","Stoelen, banken, pallets, fietsen <extra_id_0> die zijn opgeworpen door de demonstranten <extra_id_1> in de Amsterdamse <extra_id_2> blijken weinig partij voor de ME.","Stoelen, banken, pallets, fietsen en boten die zijn opgeworpen door de demonstranten bij de stenen muur in de Amsterdamse grachten blijken weinig partij voor de ME.","['de barricades', 'die het universiteitsgebouw', 'binnenstad hebben bezet,']","['en boten', 'bij de stenen muur', 'grachten']",8,30,1,"[0.7692307692307693, 0.7037037037037037, 0.8333333333333334]",0.77,ad
seq29-0,xl,"Was aan de lijn is een levend kunstwerk. De was heeft een vaste volgorde, groot bij groot, soort bij soort, sok bij sok, kleur bij kleur.","Was aan de lijn <extra_id_0> kunstwerk. De <extra_id_1> vaste volgorde, groot bij groot, soort bij soort, sok <extra_id_2> kleur bij kleur.","Was aan de lijn een kunstwerk. De lijnen staan in vaste volgorde, groot bij groot, soort bij soort, sok bij sok, kleur bij kleur.","['is een levend', 'was heeft een', 'bij sok,']","['een', 'lijnen staan in', 'bij sok,']",8,30,1,"[0.7692307692307693, 0.8666666666666667, 0.0]",0.55,ad
seq30-0,xl,In 2015 was het onmogelijk dat Barack Obama de hand van William Ruto zou schudden.,In 2015 was het onmogelijk dat <extra_id_0> van William Ruto zou schudden.,In 2015 was het onmogelijk dat de politiek de positie van William Ruto zou schudden.,['Barack Obama de hand'],['de politiek de positie'],4,30,1,[0.8636363636363636],0.86,ad
seq31-0,xl,"Nederlanders douchen steeds meer, liefst twee keer per dag, met warm water en veel sop. Volgens dermatologen is dat echt te veel voor onze huid.","Nederlanders douchen steeds meer, liefst twee keer per dag, met warm <extra_id_0> sop. Volgens <extra_id_1> echt te <extra_id_2> onze huid.","Nederlanders douchen steeds meer, liefst twee keer per dag, met warm water en sop. Volgens onderzoekers is dit echt te veel voor onze huid.","['water en veel', 'dermatologen is dat', 'veel voor']","['water en', 'onderzoekers is dit', 'veel voor']",8,30,1,"[0.38461538461538464, 0.5789473684210527, 0.0]",0.32,ad
seq32-0,xl,"Nog nooit kregen zo weinig babys borstvoeding. Er wordt te weinig ruimte voor gegeven, zeggen jonge moeders in Lelystad. Ik doe het meestal in de auto, de ramen zijn geblindeerd.","Nog nooit kregen zo weinig <extra_id_0> wordt te weinig ruimte voor gegeven, zeggen jonge moeders in Lelystad. <extra_id_1> meestal <extra_id_2> de ramen zijn geblindeerd.","Nog nooit kregen zo weinig ramen. Daar wordt te weinig ruimte voor gegeven, zeggen jonge moeders in Lelystad. De ramen zijn meestal zo klein dat de ramen zijn geblindeerd.","['babys borstvoeding. Er', 'Ik doe het', 'in de auto,']","['ramen. Daar', 'De ramen zijn', 'zo klein dat']",9,30,1,"[0.8181818181818182, 0.7692307692307693, 0.8333333333333334]",0.81,ad
seq33-0,xl,"Zelden zo weinig gedubd over mijn stem als bij deze Europese verkiezingen; er moet een flink tegenwicht komen tegen Europees radicaal- en extreemrechts, en de fractie van de socialisten en democraten is daar, ook getalsmatig het best toe uitgerust.","Zelden zo weinig gedubd over mijn stem als <extra_id_0> verkiezingen; er moet een flink tegenwicht komen tegen <extra_id_1> extreemrechts, en de <extra_id_2> socialisten en democraten is <extra_id_3> het best toe uitgerust.","Zelden zo weinig gedubd over mijn stem als bij deze verkiezingen; er moet een flink tegenwicht komen tegen het extreemrechts, en de coalitie van socialisten en democraten is daar het best toe uitgerust.","['bij deze Europese', 'Europees radicaal- en', 'fractie van de', 'daar', 'ook getalsmatig']","['bij deze', 'het', 'coalitie van', 'daar']",12,30,1,"[0.5294117647058824, 0.9523809523809523, 0.5, 0.0]",0.5,ad
seq34-0,xl,In Maastricht zijn drie studenten al zeven dagen in hongerstaking om het universiteitsbestuur te dwingen alle banden met Isral te verbreken. Hongerstaker Alex verloor al 6 kilo aan gewicht. We zagen geen andere oplossing.,In Maastricht zijn drie <extra_id_0> dagen in hongerstaking om het universiteitsbestuur te dwingen alle banden met <extra_id_1> Alex verloor al 6 kilo <extra_id_2> zagen geen andere oplossing.,In Maastricht zijn drie studenten al drie dagen in hongerstaking om het universiteitsbestuur te dwingen alle banden met de universiteit te verbreken. Alex verloor al 6 kilo en de studenten zagen geen andere oplossing.,"['studenten al zeven', 'Isral te verbreken. Hongerstaker', 'aan gewicht. We']","['studenten al drie', 'de universiteit te verbreken.', 'en de studenten']",10,30,1,"[0.2222222222222222, 0.71875, 0.8]",0.58,ad
seq35-0,xl,Noord-Korea is weer begonnen met het versturen van ballonnen met afval naar Zuid-Korea. In en rond Seoul en in de grensstreek werden zondagochtend tientallen ballonnen gevonden.,Noord-Korea is weer begonnen met het versturen van ballonnen met afval <extra_id_0> en rond Seoul en <extra_id_1> grensstreek werden zondagochtend <extra_id_2>,Noord-Korea is weer begonnen met het versturen van ballonnen met afval In en rond Seoul en de grensstreek werden zondagochtend ballonnen...,"['naar Zuid-Korea. In', 'in de', 'tientallen ballonnen gevonden.']","['In', 'de', 'ballonnen...']",8,30,1,"[0.8947368421052632, 0.6, 0.6666666666666666]",0.72,ad
seq36-0,xl,"In de steden duiken cokelabs op in appartementen, garageboxen of zelfs boven een kinderdagverblijf. Midden in de dichtbevolkte wijken, zoals in Rotterdam waar een flat explodeerde.","In de steden duiken cokelabs op in appartementen, garageboxen of <extra_id_0> een kinderdagverblijf. Midden in de dichtbevolkte wijken, <extra_id_1> waar <extra_id_2>","In de steden duiken cokelabs op in appartementen, garageboxen of zelfs in een kinderdagverblijf. Midden in de dichtbevolkte wijken, dus waar de...","['zelfs boven', 'zoals in Rotterdam', 'een flat explodeerde.']","['zelfs in', 'dus', 'de...']",8,30,1,"[0.36363636363636365, 0.9444444444444444, 0.8571428571428571]",0.72,ad
seq37-0,xl,Eerder deze maand kondigde French Gates aan dat ze de Bill & Melinda Gates Foundation (BMGF) ging verlaten.,Eerder deze maand kondigde French Gates aan dat <extra_id_0> Bill & Melinda <extra_id_1> ging verlaten.,Eerder deze maand kondigde French Gates aan dat hij de Bill & Melinda Gates Foundation ging verlaten.,"['ze de', 'Gates Foundation (BMGF)']","['hij de', 'Gates Foundation']",5,30,1,"[0.5, 0.30434782608695654]",0.4,ad
seq38-0,xl,"Stoelen, banken, pallets, fietsen  de barricades die zijn opgeworpen door de demonstranten die het universiteitsgebouw in de Amsterdamse binnenstad hebben bezet, blijken weinig partij voor de ME.","Stoelen, banken, pallets, fietsen de barricades die zijn opgeworpen door de demonstranten die <extra_id_0> in de Amsterdamse <extra_id_1> blijken weinig partij <extra_id_2>","Stoelen, banken, pallets, fietsen de barricades die zijn opgeworpen door de demonstranten die zich in de Amsterdamse grachten blijken weinig partij te...","['het universiteitsgebouw', 'binnenstad hebben bezet,', 'voor de ME.']","['zich', 'grachten', 'te...']",8,30,1,"[0.9565217391304348, 0.8333333333333334, 0.8181818181818182]",0.87,ad
seq39-0,xl,"Wonen in een comfortabel verwarmd huis van steen met een pannendak: dat was voor het gros van de mensen in het verleden een utopie. Het zag er wellicht romantisch uit zon lieflijk huisje, maar er werd bittere armoede geleden.",Wonen in een comfortabel verwarmd huis <extra_id_0> een pannendak: dat was voor <extra_id_1> de mensen in het verleden een utopie. Het zag er wellicht romantisch uit zon lieflijk <extra_id_2> werd <extra_id_3>,"Wonen in een comfortabel verwarmd huis met een pannendak: dat was voor veel van de mensen in het verleden een utopie. Het zag er wellicht romantisch uit zon lieflijk huis, maar het werd","['van steen met', 'het gros van', 'huisje', 'maar er', 'bittere armoede geleden.']","['met', 'veel van', 'huis, maar het', '']",12,30,1,"[0.7692307692307693, 0.5833333333333334, 0.6428571428571429, 1.0]",0.75,ad
seq40-0,xl,"Griekenland stuurt asielzoekers die al aan land zijn terug de zee op en laat hen achter in rubberbootjes, hebben ngos en journalisten gedocumenteerd.",Griekenland stuurt asielzoekers die al aan land zijn <extra_id_0> en laat hen achter <extra_id_1> ngos en journalisten gedocumenteerd.,Griekenland stuurt asielzoekers die al aan land zijn naar Duitsland en laat hen achter Dat hebben ngos en journalisten gedocumenteerd.,"['terug de zee op', 'in rubberbootjes', 'hebben']","['naar Duitsland', 'Dat hebben']",7,30,1,"[0.9333333333333333, 0.8125]",0.87,ad
seq41-0,xl,De elfde editie van de Willem IV Rally was een groot succes. Dat meldt Arne Verwoert van de organisatie. Dit jaar is er ruim 11.500 euro opgehaald voor het Ronald McDonald Huis Sophia Rotterdam.,<extra_id_0> de Willem IV Rally was <extra_id_1> Dat meldt Arne Verwoert van de organisatie. Dit <extra_id_2> ruim 11.500 euro opgehaald voor het Ronald McDonald Huis Sophia Rotterdam.,De opbrengst van de Willem IV Rally was zeer mooi. Dat meldt Arne Verwoert van de organisatie. Dit jaar werd ruim 11.500 euro opgehaald voor het Ronald McDonald Huis Sophia Rotterdam.,"['De elfde editie van', 'een groot succes.', 'jaar is er']","['De opbrengst van', 'zeer mooi.', 'jaar werd']",10,30,1,"[0.5263157894736842, 0.7058823529411765, 0.4]",0.54,ad
seq42-0,xl,Een groep hardnekkige verslaafden heeft het toiletgebouw in een Utrechts park gekaapt en daar hun eigen drugshol ingericht. Ze omzeilen zo ongestoord en onbestraft het verbod om drugs op straat te gebruiken.,Een groep hardnekkige verslaafden heeft het toiletgebouw in een Utrechts park gekaapt <extra_id_0> drugshol ingericht. Ze omzeilen zo ongestoord en onbestraft <extra_id_1> drugs <extra_id_2> gebruiken.,Een groep hardnekkige verslaafden heeft het toiletgebouw in een Utrechts park gekaapt en als drugshol ingericht. Ze omzeilen zo ongestoord en onbestraft de wettelijke regels om drugs te gebruiken.,"['en daar hun eigen', 'het verbod om', 'op straat te']","['en als', 'de wettelijke regels om', 'te']",10,30,1,"[0.7647058823529411, 0.6956521739130435, 0.8333333333333334]",0.76,ad
seq43-0,xl,Cees Dekker | hoogleraar biofysica Hoe is het leven ontstaan? Synthetische cellen maken dat inzichtelijk. Als je zoiets zelf bouwt ga je begrijpen hoe het werkt.,Cees Dekker | hoogleraar biofysica Hoe is het leven ontstaan? Synthetische <extra_id_0> inzichtelijk. <extra_id_1> zelf bouwt ga <extra_id_2> hoe het werkt.,Cees Dekker | hoogleraar biofysica Hoe is het leven ontstaan? Synthetische modellen maken dat inzichtelijk. Hoe je het leven zelf bouwt ga inzicht in hoe het werkt.,"['cellen maken dat', 'Als je zoiets', 'je begrijpen']","['modellen maken dat', 'Hoe je het leven', 'inzicht in']",8,30,1,"[0.16666666666666666, 0.6875, 0.9166666666666666]",0.59,ad
seq44-0,xl,De herdenking van de landing van de geallieerden in Normandi roept vragen op over waar het Westen anno 2024 staat.,De herdenking van <extra_id_0> de geallieerden in Normandi roept vragen op over waar het Westen <extra_id_1>,De herdenking van de landing van de geallieerden in Normandi roept vragen op over waar het Westen,"['de landing van', 'anno 2024 staat.']","['de landing van', '']",6,30,1,"[0.0, 1.0]",0.5,ad
seq45-0,xl,Politiek verslaggever Hans van Soest schrijft wekelijks over Haagse zaken die ons allemaal aangaan. In deze aflevering: Nog altijd is er geen regeling voor zware beroepen.,Politiek verslaggever Hans van <extra_id_0> over <extra_id_1> die ons allemaal aangaan. In deze aflevering: Nog altijd is er geen regeling <extra_id_2>,Politiek verslaggever Hans van der Wal over onderwerpen die ons allemaal aangaan. In deze aflevering: Nog altijd is er geen regeling,"['Soest schrijft wekelijks', 'Haagse zaken', 'voor zware beroepen.']","['der Wal', 'onderwerpen', '']",8,30,1,"[0.8333333333333334, 0.8333333333333334, 1.0]",0.89,ad
seq46-0,xl,Na eerdere problemen rond de vergunning mag de bouw van een boorplatform in de Noordzee worden hervat. Milieuorganisaties hadden een rechtszaak aangespannen om de bouw tegen te houden.,Na eerdere problemen rond de vergunning mag <extra_id_0> van een boorplatform in de Noordzee worden hervat. <extra_id_1> rechtszaak aangespannen <extra_id_2> tegen te houden.,Na eerdere problemen rond de vergunning mag nu de bouw van een boorplatform in de Noordzee worden hervat. De minister heeft een rechtszaak aangespannen om dat tegen te houden.,"['de bouw', 'Milieuorganisaties hadden een', 'om de bouw']","['nu de bouw', 'De minister heeft een', 'om dat']",8,30,1,"[0.3, 0.5862068965517241, 0.6]",0.5,ad
seq47-0,xl,Daan en het ongelijk van de rommelmarktheks Uren samen spelen is verruild voor me-time op eigen kamers. Daan Rot schrijft in weekendmagazine Mezza wekelijks over zijn persoonlijk leven,Daan en het ongelijk van <extra_id_0> Uren samen spelen is verruild voor me-time op eigen <extra_id_1> schrijft in weekendmagazine Mezza wekelijks <extra_id_2> leven,Daan en het ongelijk van de ouders. Uren samen spelen is verruild voor me-time op eigen wijze. Daan schrijft in weekendmagazine Mezza wekelijks over zijn leven,"['de rommelmarktheks', 'kamers. Daan Rot', 'over zijn persoonlijk']","['de ouders.', 'wijze. Daan', 'over zijn']",8,30,1,"[0.6666666666666666, 0.625, 0.5714285714285714]",0.62,ad
seq48-0,xl,Inwoners van het Friese Waadhoeke hebben tot maandochtend moeten wachten op de verkiezingsuitslag van de Europese verkiezingen. Die lag veilig opgeborgen in een kluis in het gemeentehuis waar in het weekend een tijdslot op zit.,Inwoners van het Friese Waadhoeke hebben tot maandochtend moeten wachten <extra_id_0> van de Europese verkiezingen. Die lag <extra_id_1> kluis <extra_id_2> waar in het weekend een tijdslot op zit.,Inwoners van het Friese Waadhoeke hebben tot maandochtend moeten wachten op de uitslag van de Europese verkiezingen. Die lag in een kluis waar in het weekend een tijdslot op zit.,"['op de verkiezingsuitslag', 'veilig opgeborgen in een', 'in het gemeentehuis']","['op de uitslag', 'in een', '']",10,30,1,"[0.4583333333333333, 0.75, 1.0]",0.74,ad
seq49-0,xl,Een beruchte hackersgroep stelt gevoelige informatie van in totaal 560 miljoen klanten van Ticketmaster te hebben gestolen. De groep eist omgerekend zon 460 duizend euro losgeld van het Amerikaanse kaartverkoopbedrijf.,Een beruchte <extra_id_0> informatie van in totaal 560 miljoen <extra_id_1> te hebben gestolen. De groep eist omgerekend zon 460 duizend euro <extra_id_2> Amerikaanse kaartverkoopbedrijf.,Een beruchte groep stelt informatie van in totaal 560 miljoen kaarthouders te hebben gestolen. De groep eist omgerekend zon 460 duizend euro van het Amerikaanse kaartverkoopbedrijf.,"['hackersgroep stelt gevoelige', 'klanten van Ticketmaster', 'losgeld van het']","['groep stelt', 'kaarthouders', 'van het']",9,30,1,"[0.6071428571428571, 0.7916666666666666, 0.5333333333333333]",0.64,ad
seq50-0,xl,"Honderden paginas aan ambtelijk commentaar op het Hoofdlijnenakkoord van PVV, VVD, NSC en BBB zijn vrijgegeven. Er zijn grote vraagtekens op allerlei terreinen, van het buitenlandbeleid en defensie tot landbouw en sociale zekerheid.","Honderden paginas aan ambtelijk commentaar op het Hoofdlijnenakkoord <extra_id_0> NSC en BBB zijn vrijgegeven. Er <extra_id_1> op allerlei terreinen, <extra_id_2> defensie tot landbouw en sociale zekerheid.","Honderden paginas aan ambtelijk commentaar op het Hoofdlijnenakkoord NSC en BBB zijn vrijgegeven. Er zijn afspraken gemaakt op allerlei terreinen, van defensie tot landbouw en sociale zekerheid.","['van PVV', 'VVD,', 'zijn grote vraagtekens', 'van het buitenlandbeleid en']","['', 'zijn afspraken gemaakt', 'van']",10,30,1,"[1.0, 1.0, 0.8636363636363636]",0.95,ad
seq51-0,xl,"Naar aanleiding van de grote hoeveelheid pfas in eieren rond de fabriek van Chemours in Dordrecht, start het RIVM een nieuw onderzoek.",Naar aanleiding van de grote hoeveelheid pfas in eieren rond de fabriek van Chemours <extra_id_0> RIVM <extra_id_1>,Naar aanleiding van de grote hoeveelheid pfas in eieren rond de fabriek van Chemours meldt het RIVM,"['in Dordrecht', 'start het', 'een nieuw onderzoek.']","['meldt het', '']",7,30,1,"[0.8333333333333334, 1.0]",0.92,ad
seq52-0,xl,De gemeente Voorne aan Zee wil dat er over de huisvesting van arbeidsmigranten goede afspraken komen.,De gemeente Voorne aan Zee wil dat er over de <extra_id_0> goede <extra_id_1>,De gemeente Voorne aan Zee wil dat er over de dijk goede,"['huisvesting van arbeidsmigranten', 'afspraken komen.']","['dijk', '']",5,30,1,"[0.9375, 1.0]",0.97,ad
seq53-0,xl,Aan het veluweplein in Den Haag zijn zondagochtend drie personen aangehouden na een crash met een gesloten motor. De kruising was langere tijd afgesloten vanwege politieonderzoek.,Aan het veluweplein in Den Haag zijn zondagochtend drie personen aangehouden na een <extra_id_0> gesloten motor. De <extra_id_1> tijd <extra_id_2> politieonderzoek.,Aan het veluweplein in Den Haag zijn zondagochtend drie personen aangehouden na een ongeval met een gesloten motor. De drie personen zijn tijd meegenomen voor politieonderzoek.,"['crash met een', 'kruising was langere', 'afgesloten vanwege']","['ongeval met een', 'drie personen zijn', 'meegenomen voor']",8,30,1,"[0.4666666666666667, 0.85, 0.6666666666666666]",0.66,ad
seq54-0,xl,"Door middel van misleiding kunnen legers zich groter maken dan ze zijn. Het concept was bij het Westen wat uit de gratie geraakt, maar is door de oorlog in Oekrane weer terug.",Door middel van <extra_id_0> zich groter maken dan ze <extra_id_1> was bij het Westen wat uit de gratie <extra_id_2> de oorlog in Oekrane weer terug.,Door middel van propaganda wilde ze zich groter maken dan ze waren. Dat was bij het Westen wat uit de gratie maar kwam door de oorlog in Oekrane weer terug.,"['misleiding kunnen legers', 'zijn. Het concept', 'geraakt', 'maar is door']","['propaganda wilde ze', 'waren. Dat', 'maar kwam door']",10,30,1,"[0.8333333333333334, 0.8235294117647058, 0.8571428571428571]",0.84,ad
seq55-0,xl,"Eerder deze maand kondigde French Gates aan dat ze de Bill & Melinda Gates Foundation (BMGF) ging verlaten. Ze zei al dat ze actief wilde blijven als filantroop, maar dat ze later zou aankondigen op welke manier.","Eerder deze <extra_id_0> Gates aan dat ze de Bill & Melinda Gates Foundation (BMGF) ging <extra_id_1> zei al dat ze actief wilde blijven als filantroop, <extra_id_2> later zou <extra_id_3> manier.","Eerder deze week kondigde Gates aan dat ze de Bill & Melinda Gates Foundation (BMGF) ging verlaten. Ze zei al dat ze actief wilde blijven als filantroop, maar later zou dat op een andere manier.","['maand kondigde French', 'verlaten. Ze', 'maar dat ze', 'aankondigen op welke']","['week kondigde', 'verlaten. Ze', 'maar', 'dat op een andere']",11,30,1,"[0.5714285714285714, 0.0, 0.6363636363636364, 0.65]",0.46,ad
seq56-0,xl,Een groep hardnekkige verslaafden heeft het toiletgebouw in een Utrechts park gekaapt en daar hun eigen drugshol ingericht. Ze omzeilen zo ongestoord en onbestraft het verbod om drugs op straat te gebruiken. Normale bezoekers van het park worden door de verslaafden geweerd bij het toilet.,Een groep hardnekkige verslaafden heeft het <extra_id_0> Utrechts <extra_id_1> daar hun eigen drugshol ingericht. Ze omzeilen zo ongestoord en onbestraft het verbod om drugs <extra_id_2> gebruiken. Normale bezoekers van <extra_id_3> worden door de verslaafden geweerd <extra_id_4>,Een groep hardnekkige verslaafden heeft het Oude Utrechts Bezoekerscentrum bestormd en daar hun eigen drugshol ingericht. Ze omzeilen zo ongestoord en onbestraft het verbod om drugs te gebruiken. Normale bezoekers van het centrum worden door de verslaafden geweerd,"['toiletgebouw in een', 'park gekaapt en', 'op straat te', 'het park', 'bij het toilet.']","['Oude', 'Bezoekerscentrum bestormd en', 'te', 'het centrum', '']",14,30,1,"[0.8947368421052632, 0.7857142857142857, 0.8333333333333334, 0.5454545454545454, 1.0]",0.81,ad
