seq250-0,large,"Diederik Samsom was in het dorp om ons aan de zonnepanelen te praten.  In de huis-aan-huis-verspreide uitnodiging stond hij groots geafficheerd als d groene energieadviseur bij HVC, een afval- en energiebedrijf in Alkmaar","Diederik Samsom was in het dorp om ons aan de zonnepanelen te praten. In de <extra_id_0> hij groots geafficheerd <extra_id_1> bij HVC, een afval- en energiebedrijf in Alkmaar","Diederik Samsom was in het dorp om ons aan de zonnepanelen te praten. In de showroom heeft hij groots geafficheerd Hij werkt bij HVC, een afval- en energiebedrijf in Alkmaar","['huis-aan-huis-verspreide uitnodiging stond', 'als d groene energieadviseur']","['showroom heeft', 'Hij werkt']",7,20,1,"[0.8809523809523809, 0.8928571428571429]",0.89
seq251-0,large,De schandalen rond Facebook stapelen zich snel op.  Kort geleden kwam de onderneming weer in opspraak door een livestream van de terrorist in Christchurch,De schandalen rond Facebook stapelen zich snel op. Kort geleden kwam <extra_id_0> weer in opspraak door een <extra_id_1> terrorist in Christchurch,De schandalen rond Facebook stapelen zich snel op. Kort geleden kwam Facebook weer in opspraak door een melding van een terrorist in Christchurch,"['de onderneming', 'livestream van de']","['Facebook', 'melding van een']",5,20,1,"[0.9285714285714286, 0.6470588235294118]",0.79
seq252-0,large,"Vraag 2: Is uw voorstel om naar keuze van de ouders euthanasie toe te staan op ernstig gehandicapte jonggeborenen, niet strijdig met uw geluksethiek als we stellen dat miljoenen Nederlanders iets ongelukkiger zouden worden bij uitvoering van dit idee.  Antwoord op vraag 1","Vraag 2: Is uw voorstel om naar keuze van de ouders euthanasie toe te staan op ernstig gehandicapte jonggeborenen, <extra_id_0> uw geluksethiek als we stellen dat miljoenen Nederlanders iets ongelukkiger <extra_id_1> uitvoering van dit idee. <extra_id_2> 1","Vraag 2: Is uw voorstel om naar keuze van de ouders euthanasie toe te staan op ernstig gehandicapte jonggeborenen, echt uw geluksethiek als we stellen dat miljoenen Nederlanders iets ongelukkiger worden bij uitvoering van dit idee. Vraag 1","['niet strijdig met', 'zouden worden bij', 'Antwoord op vraag']","['echt', 'worden bij', 'Vraag']",9,20,1,"[0.8823529411764706, 0.4117647058823529, 0.7647058823529411]",0.69
seq253-0,large,Populaire en pathetische kunst Video-still uit Where is Where (2008) van Eija-Liisa Ahtila.  Wat een weemoed en beklemming,Populaire en pathetische kunst Video-still uit Where is Where (2008) van Eija-Liisa Ahtila. Wat <extra_id_0>,Populaire en pathetische kunst Video-still uit Where is Where (2008) van Eija-Liisa Ahtila. Wat is Where?,['een weemoed en beklemming'],['Where?'],4,20,1,[0.92],0.92
seq254-0,large,Het Spaanse parlement tijdens de stemming van zondag.  Foto Pierre-Philippe Marcou/AFP De linkse Spaanse coalitie tussen de partijen PSOE en Unidas Podemos heeft zoals verwacht bij ,Het Spaanse parlement tijdens de stemming van zondag. Foto Pierre-Philippe Marcou/AFP De linkse Spaanse coalitie tussen de partijen <extra_id_0> Unidas Podemos heeft <extra_id_1>,Het Spaanse parlement tijdens de stemming van zondag. Foto Pierre-Philippe Marcou/AFP De linkse Spaanse coalitie tussen de partijen van Unidas Podemos heeft zondag een nieuwe...,"['PSOE en', 'zoals verwacht bij']","['van', 'nieuwe...']",5,20,1,"[0.8571428571428571, 0.8888888888888888]",0.87
seq255-0,large,"Philips wijst op risico's van miskraam NIJMEGEN, 15 OKT.  Achttien vrouwen, werkzaam op de lithografische afdeling van Philips Nijmegen, is dringend aangeraden op een andere afdeling te gaan werken","Philips wijst op risico's van miskraam NIJMEGEN, 15 OKT. <extra_id_0> op de lithografische afdeling van Philips <extra_id_1> aangeraden op een andere afdeling te gaan werken","Philips wijst op risico's van miskraam NIJMEGEN, 15 OKT. - Werkenden op de lithografische afdeling van Philips worden aangeraden op een andere afdeling te gaan werken","['Achttien vrouwen', 'werkzaam', 'Nijmegen', 'is dringend']","['- Werkenden', 'worden']",6,20,1,"[0.75, 0.75]",0.75
seq256-0,large,`Ik dank mijn macht aan de bevolking' In Den Haag onderhandelt de coalitie over de gekozen burgemeester.  In het buitenland bestaan ze al,`Ik dank mijn macht aan <extra_id_0> Den Haag onderhandelt de coalitie <extra_id_1> gekozen burgemeester. In het buitenland bestaan ze al,`Ik dank mijn macht aan de stad.` In Den Haag onderhandelt de coalitie met een gekozen burgemeester. In het buitenland bestaan ze al,"['""de bevolking\' In""', 'over de']","['de stad.` In', 'met een']",5,20,1,"[0.6666666666666666, 0.7142857142857143]",0.69
seq257-0,large,Nederland moet niet op de knien voor Rusland Het gist tussen Nederland en Rusland.  Maar wie provoceert hier nu wie,<extra_id_0> de knien voor Rusland Het gist tussen Nederland en Rusland. Maar wie provoceert hier nu wie,in de knien voor Rusland Het gist tussen Nederland en Rusland. Maar wie provoceert hier nu wie,['Nederland moet niet op'],['in'],4,20,1,[0.9545454545454546],0.95
seq258-0,large,`Verdenking rond Boonstra ruimer' Oud-Philipstopman C.  Boonstra heeft mogelijk met voorkennis gehandeld in aandelen van bedrijven waarmee het elektronicaconcern een relatie onderhield,`Verdenking rond Boonstra ruimer' Oud-Philipstopman C. Boonstra heeft mogelijk met voorkennis gehandeld in aandelen van bedrijven waarmee het <extra_id_0>,`Verdenking rond Boonstra ruimer' Oud-Philipstopman C. Boonstra heeft mogelijk met voorkennis gehandeld in aandelen van bedrijven waarmee het Philips-concern...,['elektronicaconcern een relatie onderhield'],['Philips-concern...'],4,20,1,[0.8292682926829268],0.83
seq259-0,large,'Polen is voor 100% een democratie' Van de tien landen die vandaag toetreden tot de Europese Unie is Polen met 38 miljoen inwoners het grootste.  En een van de armste,'Polen is voor 100% een democratie' Van de tien landen die vandaag toetreden <extra_id_0> Unie is Polen met 38 miljoen inwoners <extra_id_1> een van de armste,'Polen is voor 100% een democratie' Van de tien landen die vandaag toetreden tot de Europese Unie is Polen met 38 miljoen inwoners nog steeds een van de armste,"['tot de Europese', 'het grootste. En']","['tot de Europese', 'nog steeds']",6,20,1,"[0.0, 0.75]",0.38
seq260-0,large,"'Regering oordeelt harder over Hamas dan over Isral' Vriendschap met Isral is goed, zegt Femke Halsema.  Maar daar hoort ook kritisch vermogen bij","'Regering oordeelt harder over Hamas dan <extra_id_0> Vriendschap met Isral is goed, <extra_id_1> Maar daar hoort ook kritisch vermogen bij","'Regering oordeelt harder over Hamas dan over BDS' Vriendschap met Isral is goed, dat is zeker. Maar daar hoort ook kritisch vermogen bij","['""over Isral\'""', 'zegt Femke Halsema.']","[""over BDS'"", 'dat is zeker.']",5,20,1,"[0.5384615384615384, 0.7368421052631579]",0.64
seq261-0,large,"Alcatel wint tijd Alcatel maakt het beste van een slechte markt.  Ondanks een omzetdaling van 19 procent in het derde kwartaal, mr dan wat het nog geen maand geleden voorspelde, is de Franse producent van telecomapparatuur erin geslaagd zijn bruto winstmarge met twee procentpunt te verhogen","Alcatel wint tijd Alcatel maakt het beste van <extra_id_0> Ondanks een omzetdaling van 19 procent <extra_id_1> kwartaal, mr dan wat het nog geen maand geleden voorspelde, is de Franse producent van telecomapparatuur erin <extra_id_2> winstmarge met twee procentpunt te verhogen","Alcatel wint tijd Alcatel maakt het beste van zichzelf. Ondanks een omzetdaling van 19 procent in het vierde kwartaal, mr dan wat het nog geen maand geleden voorspelde, is de Franse producent van telecomapparatuur erin geslaagd zijn winstmarge met twee procentpunt te verhogen","['een slechte markt.', 'in het derde', 'geslaagd zijn bruto']","['zichzelf.', 'in het vierde', 'geslaagd zijn']",9,20,1,"[0.7777777777777778, 0.15384615384615385, 0.3157894736842105]",0.42
seq262-0,large,"Merkel wil `gesamtdeutsch' zijn CDU-kandidaat Angela Merkel (CDU) heeft, op campagne in het oosten van Duitsland, iets uit te leggen.  Simone Waltemate heeft een probleem","Merkel wil `gesamtdeutsch' zijn CDU-kandidaat Angela Merkel (CDU) heeft, op campagne in het oosten van <extra_id_0> uit <extra_id_1> Waltemate heeft een probleem","Merkel wil `gesamtdeutsch' zijn CDU-kandidaat Angela Merkel (CDU) heeft, op campagne in het oosten van Duitsland, uit dat de Waltemate heeft een probleem","['Duitsland', 'iets', 'te leggen. Simone']","['Duitsland,', 'dat de']",5,20,1,"[0.1, 0.8333333333333334]",0.47
seq263-0,large,Paranode spookbeelden Afgelopen zaterdag verscheen in de Volkskrant een verontrustend artikel over virtuele Jodenhaat onder aanhangers van het Forum voor Democratie (FvD).  Zo werd uit chatgroepen van FvD-volgelingen duidelijk dat antisemitisme een vast bestanddeel vormt in de uitwisseling van ideen over politiek en samenleving,Paranode spookbeelden Afgelopen zaterdag verscheen in de <extra_id_0> artikel over virtuele Jodenhaat onder aanhangers van het Forum voor Democratie (FvD). <extra_id_1> chatgroepen van FvD-volgelingen duidelijk dat antisemitisme <extra_id_2> vormt in de uitwisseling van ideen over politiek en samenleving,Paranode spookbeelden Afgelopen zaterdag verscheen in de Volkskrant een artikel over virtuele Jodenhaat onder aanhangers van het Forum voor Democratie (FvD). In het artikel werd in chatgroepen van FvD-volgelingen duidelijk dat antisemitisme een belangrijke rol vormt in de uitwisseling van ideen over politiek en samenleving,"['Volkskrant een verontrustend', 'Zo werd uit', 'een vast bestanddeel']","['Volkskrant een', 'In het artikel werd in', 'een belangrijke rol']",9,20,1,"[0.5, 0.7272727272727273, 0.75]",0.66
seq264-0,large,"Toename vrouwen in top van ministerie Het percentage vrouwelijke topambtenaren is de afgelopen zeven jaar gestegen van 9 (2000) naar 18,2 (2007).  Dat hebben ministers Ter Horst (Binnenlandse Zaken, PvdA) en Plasterk (Onderwijs, PvdA) gisteren in antwoord op Kamervragen geschreven","Toename <extra_id_0> top van ministerie Het percentage vrouwelijke topambtenaren is de afgelopen zeven jaar gestegen van 9 (2000) <extra_id_1> Dat hebben ministers Ter Horst (Binnenlandse Zaken, PvdA) en Plasterk (Onderwijs, PvdA) <extra_id_2> op Kamervragen geschreven","Toename vrouwelijke ambtenaren in top van ministerie Het percentage vrouwelijke topambtenaren is de afgelopen zeven jaar gestegen van 9 (2000) naar 15 (2015). Dat hebben ministers Ter Horst (Binnenlandse Zaken, PvdA) en Plasterk (Onderwijs, PvdA) in antwoorden op Kamervragen geschreven","['vrouwen in', 'naar 18,2 (2007).', 'gisteren in antwoord']","['vrouwelijke ambtenaren in', 'naar 15 (2015).', 'in antwoorden']",8,20,1,"[0.6, 0.29411764705882354, 0.55]",0.48
seq265-0,large,Irak bederft zijn nalatenschap Tony Blair treedt op 27 juni af als premier van het Verenigd Koninkrijk.  Wat is zijn politieke erfenis,Irak bederft zijn nalatenschap Tony Blair treedt op 27 juni af als premier van het Verenigd <extra_id_0> politieke erfenis,Irak bederft zijn nalatenschap Tony Blair treedt op 27 juni af als premier van het Verenigd Koninkrijk. Zijn politieke erfenis,['Koninkrijk. Wat is zijn'],['Koninkrijk. Zijn'],4,20,1,[0.34782608695652173],0.35
seq266-0,large,"Turkse parlementarirs komen toedracht dood Kksal onderzoeken ROTTERDAM, 6 FEBR.  Een delegatie van zes Turkse parlementsleden komt maandag naar Nederland om met drie bewindslieden en justitie te praten over de omstandigheden rond het overlijden van Husseyin Kksal op 8 januari in een ziekenhuis in Venray","Turkse parlementarirs komen toedracht dood Kksal onderzoeken ROTTERDAM, 6 FEBR. Een delegatie van zes <extra_id_0> maandag naar Nederland om met drie bewindslieden en justitie te praten over de omstandigheden <extra_id_1> van Husseyin Kksal <extra_id_2> in een ziekenhuis in Venray","Turkse parlementarirs komen toedracht dood Kksal onderzoeken ROTTERDAM, 6 FEBR. Een delegatie van zes Turkse parlementarirs komt maandag naar Nederland om met drie bewindslieden en justitie te praten over de omstandigheden rond de dood van Husseyin Kksal die vrijdag is overleden in een ziekenhuis in Venray","['Turkse parlementsleden komt', 'rond het overlijden', 'op 8 januari']","['Turkse parlementarirs komt', 'rond de dood', 'die vrijdag is overleden']",9,20,1,"[0.2222222222222222, 0.5789473684210527, 0.8333333333333334]",0.54
seq267-0,large,"Ik wil markten creren, niet beperken Eurocommissaris Bulc (Transport) weigert de Golfstaten stevig aan te spreken op oneerlijke concurrentie door hun luchtvaartmaatschappijen.  Er zijn zo veel geruchten, moet ik daar allemaal naar handelen","Ik wil markten creren, niet beperken Eurocommissaris Bulc (Transport) weigert de Golfstaten stevig aan te spreken op oneerlijke concurrentie door hun luchtvaartmaatschappijen. Er <extra_id_0> moet <extra_id_1> naar handelen","Ik wil markten creren, niet beperken Eurocommissaris Bulc (Transport) weigert de Golfstaten stevig aan te spreken op oneerlijke concurrentie door hun luchtvaartmaatschappijen. Er zouden meer mogelijkheden moet zijn naar handelen","['zijn zo veel geruchten,', 'ik daar allemaal']","['zouden meer mogelijkheden', 'zijn']",7,20,1,"[0.68, 1.0]",0.84
seq268-0,large,"Nederlandse fysici meten superlubriciteit in grafiet Twee grafietoppervlakken kunnen vrijwel wrijvingsloos over elkaar heen glijden, hebben Leidse, Delftse en Amsterdamse onderzoekers ontdekt, maar niet onder iedere hoek.  Aan dit verschijnsel, superlubriciteit genoemd, dankt grafiet zijn goede eigenschappen als smeermiddel voor sloten en fijnmechanica (Physical Review Letters, 26 maart)","Nederlandse fysici meten superlubriciteit in grafiet Twee grafietoppervlakken kunnen vrijwel wrijvingsloos over <extra_id_0> Leidse, Delftse en Amsterdamse onderzoekers ontdekt, maar niet onder iedere hoek. Aan dit verschijnsel, superlubriciteit genoemd, dankt grafiet <extra_id_1> als smeermiddel voor sloten en <extra_id_2> Letters, 26 maart)","Nederlandse fysici meten superlubriciteit in grafiet Twee grafietoppervlakken kunnen vrijwel wrijvingsloos over Dat hebben Leidse, Delftse en Amsterdamse onderzoekers ontdekt, maar niet onder iedere hoek. Aan dit verschijnsel, superlubriciteit genoemd, dankt grafiet zijn populariteit als smeermiddel voor sloten en leidingen. (Science Letters, 26 maart)","['elkaar heen glijden', 'hebben', 'zijn goede eigenschappen', 'fijnmechanica (Physical Review']","['Dat hebben', 'zijn populariteit', 'leidingen. (Science']",10,20,1,"[0.6842105263157895, 0.9411764705882353, 0.75]",0.79
seq269-0,large,"Stones repeteren ergens in Amsterdam De Rolling Stones zijn het afgelopen weekeinde in Amsterdam neergestreken.  De leden van de `Grootste Rock and Rollband ter Wereld' verblijven in het Amstel Hotel, hun favoriete logeeradres in de Benelux, en oefenen op een geheime locatie voor het laatste gedeelte van hun Bridges tot Babylon Tour","Stones repeteren ergens in Amsterdam De Rolling Stones zijn het <extra_id_0> Amsterdam neergestreken. <extra_id_1> de `Grootste Rock and Rollband ter Wereld' verblijven in het Amstel Hotel, hun favoriete logeeradres in de Benelux, en <extra_id_2> locatie voor het laatste gedeelte van hun Bridges tot Babylon Tour","Stones repeteren ergens in Amsterdam De Rolling Stones zijn het afgelopen weekend in Amsterdam neergestreken. De leden van de `Grootste Rock and Rollband ter Wereld' verblijven in het Amstel Hotel, hun favoriete logeeradres in de Benelux, en zoeken een locatie voor het laatste gedeelte van hun Bridges tot Babylon Tour","['afgelopen weekeinde in', 'De leden van', 'oefenen op een geheime']","['afgelopen weekend in', 'De leden van', 'zoeken een']",10,20,1,"[0.09090909090909091, 0.0, 0.6818181818181818]",0.26
seq270-0,large,Wekelijks stuit Karel Knip in de alledaagse werkelijkheid op onverwachte raadsels en onbegrijpelijke verschijnselen.  Deze week: vliegtuigen in het Oekraense luchtruim,Wekelijks stuit Karel Knip in de alledaagse werkelijkheid op onverwachte raadsels en onbegrijpelijke verschijnselen. Deze <extra_id_0> Oekraense luchtruim,Wekelijks stuit Karel Knip in de alledaagse werkelijkheid op onverwachte raadsels en onbegrijpelijke verschijnselen. Deze keer in het Oekraense luchtruim,['week: vliegtuigen in het'],['keer in het'],4,20,1,[0.5833333333333334],0.58
seq271-0,large,Netwerk.  Exclusief gesprek met de huidige Indonesische president Habibi in zijn presidentieel paleis in Jakarta over zijn tijd met voorganger Suharto en de toekomst van Indonesie,Netwerk. Exclusief <extra_id_0> de huidige Indonesische president Habibi in zijn presidentieel paleis in Jakarta over zijn <extra_id_1> Suharto en de toekomst van Indonesie,Netwerk. Exclusief interview met de huidige Indonesische president Habibi in zijn presidentieel paleis in Jakarta over zijn relatie met Suharto en de toekomst van Indonesie,"['gesprek met', 'tijd met voorganger']","['interview met', 'relatie met']",5,20,1,"[0.5384615384615384, 0.8421052631578947]",0.69
seq272-0,large,"Republikeinen stemmen in met belastingverhoging voor allerrijksten epa03507408 Speaker of the House John Boehner speaks during a press conference at the US Capitol in Washington DC, USA, 13 December 2012.  Boehner addressed questions on the fiscal cliff and reportedly suggested that spending is the problem, not revenue","Republikeinen stemmen in met belastingverhoging voor allerrijksten epa03507408 Speaker of the House John <extra_id_0> a press conference at the US <extra_id_1> DC, USA, 13 December 2012. Boehner addressed questions on the fiscal cliff and reportedly <extra_id_2> is the problem, not revenue","Republikeinen stemmen in met belastingverhoging voor allerrijksten epa03507408 Speaker of the House John Boehner speaks at a press conference at the US in Washington, DC, USA, 13 December 2012. Boehner addressed questions on the fiscal cliff and reportedly said that debt is the problem, not revenue","['Boehner speaks during', 'Capitol in Washington', 'suggested that spending']","['Boehner speaks at', 'in Washington,', 'said that debt']",9,20,1,"[0.2857142857142857, 0.42857142857142855, 0.6086956521739131]",0.44
seq273-0,large,"Spaanse vakbonden dreigen regering met staking MADRID, 15 sept.  De Spaanse vakbonden zijn op geen enkele manier van plan mee te werken aan het door de regering voorgestelde matigingsbeleid ter bestrijding van de gevolgen van de crisis in de Golf","Spaanse <extra_id_0> met staking MADRID, 15 sept. De Spaanse vakbonden zijn op geen enkele manier van plan mee te werken aan het door de regering voorgestelde matigingsbeleid ter bestrijding van <extra_id_1> van <extra_id_2> de Golf","Spaanse vakbonden niet bezig met staking MADRID, 15 sept. De Spaanse vakbonden zijn op geen enkele manier van plan mee te werken aan het door de regering voorgestelde matigingsbeleid ter bestrijding van de crisis van de crisis op de Golf","['vakbonden dreigen regering', 'de gevolgen', 'de crisis in']","['vakbonden niet bezig', 'de crisis', 'de crisis op']",8,20,1,"[0.38461538461538464, 0.7272727272727273, 0.16666666666666666]",0.43
seq274-0,large,Huisartsen stemmen niet in met het elektronisch patintendossier De doorstart van het elektronisch patintendossier (EPD) heeft opnieuw met tegenslag te ,Huisartsen stemmen niet in met het elektronisch patintendossier De doorstart van het <extra_id_0> opnieuw met tegenslag te,Huisartsen stemmen niet in met het elektronisch patintendossier De doorstart van het elektronisch patintendossier lijkt opnieuw met tegenslag te,['elektronisch patintendossier (EPD) heeft'],['elektronisch patintendossier lijkt'],4,20,1,[0.25],0.25
seq275-0,large,Beursinflatie is k inflatie Monetaire stabiliteit en financile stabiliteit gaan niet per definitie samen.  Langzaam begint het te dagen dat centrale bankiers moeten letten op de prijzen van komkommers n van aandelen KPN,Beursinflatie is k inflatie <extra_id_0> financile stabiliteit gaan niet per <extra_id_1> het te dagen dat centrale bankiers moeten letten op de prijzen van komkommers n van aandelen KPN,Beursinflatie is k inflatie en financile stabiliteit gaan niet per se om het te dagen dat centrale bankiers moeten letten op de prijzen van komkommers n van aandelen KPN,"['Monetaire stabiliteit en', 'definitie samen. Langzaam begint']","['en', 'se om']",7,20,1,"[0.9166666666666666, 0.875]",0.9
seq276-0,large,"Weense Burgtheater speelt Thomas Bernhard met brille en intelligentie; Menuet van eenzaamheid en wrok Nog twee dagen is in De Singel in Antwerpen Ritter, Dene, Voss te zien, gespeeld door het Burgtheater uit Wenen in de regie van Claus Peymann.  Thomas Bernhard schreef het stuk voor de drie intelligente acteurs uit de titel","Weense Burgtheater speelt Thomas Bernhard met brille en intelligentie; Menuet van eenzaamheid en wrok Nog twee dagen is in De <extra_id_0> Antwerpen Ritter, Dene, Voss te zien, gespeeld door het Burgtheater uit Wenen <extra_id_1> van Claus Peymann. Thomas Bernhard schreef het stuk <extra_id_2> intelligente <extra_id_3> titel","Weense Burgtheater speelt Thomas Bernhard met brille en intelligentie; Menuet van eenzaamheid en wrok Nog twee dagen is in De Passage in Antwerpen Ritter, Dene, Voss te zien, gespeeld door het Burgtheater uit Wenen in regie van Claus Peymann. Thomas Bernhard schreef het stuk met brille en intelligente onder de titel","['Singel in', 'in de regie', 'voor de drie', 'acteurs uit de']","['Passage in', 'in regie', 'met brille en', 'onder de']",11,20,1,"[0.6, 0.2727272727272727, 0.9230769230769231, 0.6428571428571429]",0.61
seq277-0,large,Onverdoofde slacht binnen 40 seconden Na de verhitte discussie over de rituele slacht is er een compromis.  In joodse kring wordt gesproken van een herbevestiging,Onverdoofde slacht <extra_id_0> seconden Na de verhitte discussie over de rituele slacht is er een compromis. In joodse kring wordt gesproken <extra_id_1>,Onverdoofde slacht in 30 seconden Na de verhitte discussie over de rituele slacht is er een compromis. In joodse kring wordt gesproken over een...,"['binnen 40', 'van een herbevestiging']","['in 30', 'een...']",5,20,1,"[0.5555555555555556, 0.8636363636363636]",0.71
seq278-0,large,"Rellen in Tourcoing na dood van Algerijnse jongen LILLE, 10 APRIL.  Na de dood van een jongen van Algerijnse afkomst die eerder was getroffen door een politiekogel hebben vanacht in de Noordfranse stad Tourcoing ernstige rellen plaatsgehad","Rellen in Tourcoing na dood van Algerijnse jongen LILLE, 10 APRIL. Na de dood van een jongen van Algerijnse afkomst die eerder was getroffen <extra_id_0> hebben vanacht in <extra_id_1> ernstige rellen plaatsgehad","Rellen in Tourcoing na dood van Algerijnse jongen LILLE, 10 APRIL. Na de dood van een jongen van Algerijnse afkomst die eerder was getroffen door een vliegtuig hebben vanacht in Touring ernstige rellen plaatsgehad","['door een politiekogel', 'de Noordfranse stad Tourcoing']","['door een vliegtuig', 'Touring']",7,20,1,"[0.42857142857142855, 0.7586206896551724]",0.59
seq279-0,large,Jood tegen wil en dank De recente bloedige aanslag op een Russische disco in Tel Aviv veranderde de positie van de Russische immigranten in Isral.  Een groot deel van de maatschappij omhelst de voormalige `stinkrussen' plotseling als echte joden,Jood tegen wil en dank De recente bloedige aanslag op een Russische disco in Tel Aviv veranderde de positie van de Russische immigranten in Isral. <extra_id_0> van de <extra_id_1> de voormalige <extra_id_2> echte joden,Jood tegen wil en dank De recente bloedige aanslag op een Russische disco in Tel Aviv veranderde de positie van de Russische immigranten in Isral. De slachtoffers van de aanslag in de voormalige disco werden echte joden,"['Een groot deel', 'maatschappij omhelst', '""`stinkrussen\' plotseling als""']","['De slachtoffers', 'aanslag in', 'disco werden']",8,20,1,"[0.8, 0.75, 0.8333333333333334]",0.79
seq280-0,large,"Rien Zilvold / NRC Nelson Mandela met Yasser Arafat in het Catshuis, Den Haag, op 18 februari 1994.  Mandela logeerde in het Catshuis en zou ontbijten met Arafat","Rien Zilvold / NRC Nelson Mandela met Yasser Arafat <extra_id_0> Den Haag, op 18 februari 1994. Mandela logeerde in het Catshuis en <extra_id_1> Arafat","Rien Zilvold / NRC Nelson Mandela met Yasser Arafat in Den Haag, op 18 februari 1994. Mandela logeerde in het Catshuis en sprak met Arafat","['in het Catshuis,', 'zou ontbijten met']","['in', 'sprak met']",6,20,1,"[0.875, 0.7647058823529411]",0.82
seq281-0,large,"Twist over bedrijvenpark en golfbaan bij haven Amsterdam HAARLEMMERLIEDE, 24 AUG.  De gemeente Haarlemmerliede wil een ""hoogwaardig bedrijvenpark' met een internationale golfbaan aanleggen op een deel van het braakliggende terrein Ruigoord, eigendom van het Amsterdamse Havenbedrijf","Twist over bedrijvenpark en golfbaan bij haven Amsterdam HAARLEMMERLIEDE, 24 AUG. De gemeente Haarlemmerliede wil een ""hoogwaardig bedrijvenpark' met een internationale golfbaan aanleggen op <extra_id_0> het braakliggende terrein <extra_id_1> Amsterdamse Havenbedrijf","Twist over bedrijvenpark en golfbaan bij haven Amsterdam HAARLEMMERLIEDE, 24 AUG. De gemeente Haarlemmerliede wil een ""hoogwaardig bedrijvenpark' met een internationale golfbaan aanleggen op en rond het braakliggende terrein van het Amsterdamse Havenbedrijf","['een deel van', 'Ruigoord', 'eigendom van het']","['en rond', 'van het']",7,20,1,"[0.75, 1.0]",0.88
