seq192-0,large,Van den Ende verhoogt prijzen niet Het bedrijf van Joop van den Ende zal de btw-verhoging op kaartjes voor musicals in de eigen theaters en de grote reizende musical niet doorberekenen aan het publiek.  Daarmee gaat het in tegen de trend bij podia om de belastingverhoging van 6 naar 19 procent wel door te berekenen in de kaartjes,Van den Ende verhoogt prijzen niet Het bedrijf van Joop van den Ende zal de btw-verhoging op kaartjes voor musicals in de eigen theaters en de grote reizende musical niet doorberekenen aan het publiek. Daarmee gaat het in tegen <extra_id_0> podia om de belastingverhoging <extra_id_1> 19 <extra_id_2> te <extra_id_3> kaartjes,Van den Ende verhoogt prijzen niet Het bedrijf van Joop van den Ende zal de btw-verhoging op kaartjes voor musicals in de eigen theaters en de grote reizende musical niet doorberekenen aan het publiek. Daarmee gaat het in tegen de wens van de podia om de belastingverhoging van 19 procent te compenseren. De verhoging op kaartjes,"['de trend bij', 'van 6 naar', 'procent wel door', 'berekenen in de']","['de wens van de', 'van', 'procent', 'compenseren. De verhoging op']",12,20,1,"[0.6428571428571429, 0.7, 0.5625, 0.7142857142857143]",0.65
seq193-0,large,"Rescuers and relatives stop a woman from committing suicide by jumping off a building in Zhanjiang, Guangdong province August 14, 2012.  The woman was rescued as she tried to commit suicide after killing her nephew following a family dispute, local media reported","Rescuers and relatives stop a woman from committing suicide by jumping <extra_id_0> in Zhanjiang, Guangdong province <extra_id_1> 2012. The woman was rescued as she tried <extra_id_2> after killing her nephew following a family dispute, local media reported","Rescuers and relatives stop a woman from committing suicide by jumping from a tree in Zhanjiang, Guangdong province China, June 2012. The woman was rescued as she tried to escape after killing her nephew following a family dispute, local media reported","['off a building', 'August 14,', 'to commit suicide']","['from a tree', 'China, June', 'to escape']",8,20,1,"[0.8571428571428571, 0.9090909090909091, 0.6470588235294118]",0.8
seq194-0,large,"Het laatste walvisschip komt aan in de haven van Shimonoseki.  Foto Jiji Press / AFP De Japanse walvisvloot heeft dit jaar 333 dwergvinvissen gevangen, inclusief enkele zwangere vrouwtjes","Het laatste walvisschip komt aan in de haven van Shimonoseki. Foto Jiji Press / AFP De Japanse walvisvloot <extra_id_0> 333 dwergvinvissen gevangen, <extra_id_1> vrouwtjes","Het laatste walvisschip komt aan in de haven van Shimonoseki. Foto Jiji Press / AFP De Japanse walvisvloot heeft inmiddels 333 dwergvinvissen gevangen, waaronder zes vrouwtjes","['heeft dit jaar', 'inclusief enkele zwangere']","['heeft inmiddels', 'waaronder zes']",6,20,1,"[0.6, 0.8]",0.7
seq195-0,large,"Als een Ferrari: luxueus en comfortabel Doordat Haagse politici ambivalente en gebrekkige informatie over Europa verstrekken, lopen burgers niet warm voor de Europese Unie.  Den Haag wil niet dat we van Brussel houden Het is deze ambivalentie die Nederlandse politici continu over de mensen heen storten, waardoor Lenssen gelooft dat de Nederlandse politiek de macht eigenlijk niet wil delen met de Europese Unie Den Haag wil niet dat we van Brussel houden, zegt hij","Als een Ferrari: luxueus en comfortabel Doordat Haagse politici ambivalente en gebrekkige informatie over Europa verstrekken, lopen burgers <extra_id_0> de Europese Unie. Den Haag wil niet dat we van Brussel houden Het is deze ambivalentie die Nederlandse politici continu over de mensen heen storten, waardoor Lenssen gelooft dat de Nederlandse <extra_id_1> eigenlijk niet wil delen met de <extra_id_2> Haag wil niet <extra_id_3> Brussel <extra_id_4>","Als een Ferrari: luxueus en comfortabel Doordat Haagse politici ambivalente en gebrekkige informatie over Europa verstrekken, lopen burgers achter met hun mening over de Europese Unie. Den Haag wil niet dat we van Brussel houden Het is deze ambivalentie die Nederlandse politici continu over de mensen heen storten, waardoor Lenssen gelooft dat de Nederlandse politiek Europa eigenlijk niet wil delen met de buitenwereld. Den Haag wil niet dat we van Brussel houden","['niet warm voor', 'politiek de macht', 'Europese Unie Den', 'dat we van', 'houden', 'zegt hij']","['achter met hun mening over', 'politiek Europa', 'buitenwereld. Den', 'dat we van', 'houden']",15,20,1,"[0.7692307692307693, 0.47058823529411764, 0.6470588235294118, 0.0, 0.0]",0.38
seq196-0,large,PKK: `gevaarlijkste groep' in Duitsland Haar straffe organisatie maakt de PKK tot gevaarlijkste extremistische bedreiging in Duitsland.  Er is een gewapende harde kern van zo'n 6,PKK: `gevaarlijkste groep' in Duitsland Haar straffe organisatie maakt <extra_id_0> gevaarlijkste extremistische bedreiging in <extra_id_1> is een gewapende harde kern van zo'n 6,PKK: `gevaarlijkste groep' in Duitsland Haar straffe organisatie maakt PKK de gevaarlijkste extremistische bedreiging in Duitsland. Het is een gewapende harde kern van zo'n 6,"['de PKK tot', 'Duitsland. Er']","['PKK de', 'Duitsland. Het']",5,20,1,"[0.6, 0.21428571428571427]",0.41
seq197-0,large,"Portretten van Andy Warhol.  20 okt t/m 24 nov in Galerie Wouter van Leeuwen, Hazenstraat 27, Amsterdam","Portretten van <extra_id_0> okt t/m 24 nov in Galerie Wouter van Leeuwen, Hazenstraat 27, Amsterdam","Portretten van 24 okt t/m 24 nov in Galerie Wouter van Leeuwen, Hazenstraat 27, Amsterdam",['Andy Warhol. 20'],['24'],3,20,1,[0.9333333333333333],0.93
seq198-0,large,Te veel uren schrijven De meeste zakenbankiers zijn het stadium voorbij dat ze hun concurrenten ellende toewensen.  Dat komt doordat niemand is ontkomen aan de smet van belangenverstrengeling of het inzakken van de adviesmarkt,Te veel uren schrijven De meeste zakenbankiers zijn het stadium voorbij dat ze hun concurrenten ellende toewensen. Dat komt <extra_id_0> aan de smet van belangenverstrengeling of het <extra_id_1> adviesmarkt,Te veel uren schrijven De meeste zakenbankiers zijn het stadium voorbij dat ze hun concurrenten ellende toewensen. Dat komt niet aan de smet van belangenverstrengeling of het slechte imago van de adviesmarkt,"['doordat niemand is ontkomen', 'inzakken van de']","['niet', 'slechte imago van de']",7,20,1,"[0.8518518518518519, 0.6]",0.73
seq199-0,large,"Dertig dagen offline Het modelabel van Joline Jolink, dat vooral via haar webshop wordt verkocht, bestaat vijf jaar.  Ze viert het met een tijdelijke winkel in Amsterdam","Dertig dagen offline Het modelabel van Joline Jolink, dat vooral <extra_id_0> wordt verkocht, bestaat vijf jaar. Ze viert het met een tijdelijke <extra_id_1> Amsterdam","Dertig dagen offline Het modelabel van Joline Jolink, dat vooral in Nederland wordt verkocht, bestaat vijf jaar. Ze viert het met een tijdelijke offline. Amsterdam","['via haar webshop', 'winkel in']","['in Nederland', 'offline.']",5,20,1,"[0.8125, 0.8888888888888888]",0.85
seq200-0,large,Complexe opera `Raaff' sterk en intrigerend Verwondering over het verschijnsel `opera' is dit jaar het gemakkelijk herkenbare `geheime thema' in de muziekprogrammering van het Holland Festival.  Gesualdo considered as a murderer van Luca Francesconi was muziektheater over de vraag waarom componisten toch behoefte hebben aan een zichtbare handeling bij hun muziek,Complexe opera `Raaff' sterk <extra_id_0> over het verschijnsel `opera' is dit jaar het gemakkelijk herkenbare `geheime thema' in de muziekprogrammering van het <extra_id_1> as a murderer van Luca Francesconi was muziektheater over de vraag waarom componisten toch behoefte hebben aan een zichtbare handeling <extra_id_2>,Complexe opera `Raaff' sterk gericht over het verschijnsel `opera' is dit jaar het gemakkelijk herkenbare `geheime thema' in de muziekprogrammering van het festival. De opera Born as a murderer van Luca Francesconi was muziektheater over de vraag waarom componisten toch behoefte hebben aan een zichtbare handeling,"['en intrigerend Verwondering', 'Holland Festival. Gesualdo considered', 'bij hun muziek']","['gericht', 'festival. De opera Born', '']",10,20,1,"[0.8888888888888888, 0.6486486486486487, 1.0]",0.85
seq201-0,large,"Action boekte over 2018 een recordomzet van 4,2 miljard euro.  Foto Pieterjan Luyten Waar veel winkelketens in de detailhandel het zwaar hebben, heeft Action over 2018 fors meer omzet geboekt dan een jaar eerder","Action boekte <extra_id_0> van 4,2 miljard <extra_id_1> Luyten Waar veel winkelketens in de detailhandel het zwaar hebben, heeft Action over 2018 fors meer omzet geboekt dan een jaar eerder","Action boekte in 2018 een omzet van 4,2 miljard euro. Foto: ANP Luyten Waar veel winkelketens in de detailhandel het zwaar hebben, heeft Action over 2018 fors meer omzet geboekt dan een jaar eerder","['over 2018 een recordomzet', 'euro. Foto Pieterjan']","['in 2018 een omzet', 'euro. Foto: ANP']",7,20,1,"[0.4, 0.5]",0.45
seq202-0,large,"Rusland stopt lozing van kernafval in zee bij Japan TOKIO, 21 OKT.  Rusland heeft onder sterke internationale druk bakzeil gehaald en afgezien van zijn voornemen een tweede lading radioactief afval te lozen in de Zee van Japan","Rusland stopt lozing van kernafval in zee bij Japan TOKIO, 21 OKT. Rusland heeft onder sterke internationale druk <extra_id_0> afgezien <extra_id_1> tweede lading radioactief afval te lozen in de Zee van Japan","Rusland stopt lozing van kernafval in zee bij Japan TOKIO, 21 OKT. Rusland heeft onder sterke internationale druk vandaag afgezien van de wens om een tweede lading radioactief afval te lozen in de Zee van Japan","['bakzeil gehaald en', 'van zijn voornemen een']","['vandaag', 'van de wens om een']",7,20,1,"[0.8333333333333334, 0.5454545454545454]",0.69
seq203-0,large,"Cultuurfilosoof: Kamer is naar binnen gekeerde wereld Maandag werd een nakende kabinetscrisis over de inkomensverhoudingen ternauwernood afgewend, gisteren debatteerde de Kamer erover.  Cultuurfilosoof Paul Kuypers over de taal en de gedragingen van bestuurders in tijden van politieke crisis en publieke apathie","Cultuurfilosoof: Kamer is naar binnen gekeerde wereld <extra_id_0> nakende kabinetscrisis <extra_id_1> ternauwernood afgewend, gisteren debatteerde de Kamer erover. Cultuurfilosoof Paul Kuypers over de taal en de <extra_id_2> bestuurders in tijden van politieke crisis en publieke apathie","Cultuurfilosoof: Kamer is naar binnen gekeerde wereld De nakende kabinetscrisis is ternauwernood afgewend, gisteren debatteerde de Kamer erover. Cultuurfilosoof Paul Kuypers over de taal en de houding van bestuurders in tijden van politieke crisis en publieke apathie","['Maandag werd een', 'over de inkomensverhoudingen', 'gedragingen van']","['De', 'is', 'houding van']",8,20,1,"[0.9375, 0.9285714285714286, 0.5333333333333333]",0.8
seq204-0,large,"Vijf Turkse extremisten aangehouden DEN HAAG, 8 DEC.  De politie heeft begin deze week in Rotterdam vijf Turkse mannen aangehouden die worden verdacht van afpersing in de Turkse gemeenschap","Vijf Turkse extremisten aangehouden DEN HAAG, 8 DEC. De politie heeft begin deze week in Rotterdam vijf Turkse mannen aangehouden <extra_id_0> van afpersing <extra_id_1> gemeenschap","Vijf Turkse extremisten aangehouden DEN HAAG, 8 DEC. De politie heeft begin deze week in Rotterdam vijf Turkse mannen aangehouden op verdenking van afpersing van leden van de Turkse gemeenschap","['die worden verdacht', 'in de Turkse']","['op verdenking', 'van leden van de Turkse']",6,20,1,"[0.7368421052631579, 0.5217391304347826]",0.63
seq205-0,large,"Wijnaendts beschuldigt leger; Den Haag stelt sancties tegen Servirs voor DEN HAAG-ZAGREB-PARIJS, 30 AUG.  Nederland zal zijn partners in de Europese Gemeenschap op een extra vergadering aanstaande dinsdag voorstellen politieke en economische maatregelen tegen Servi te treffen als het blijft weigeren EG-waarnemers toe te laten tot de conflictgebieden in Kroati","Wijnaendts beschuldigt leger; Den Haag stelt sancties tegen Servirs voor DEN HAAG-ZAGREB-PARIJS, 30 AUG. Nederland zal zijn partners in de Europese Gemeenschap op een extra vergadering aanstaande dinsdag voorstellen politieke en economische maatregelen tegen Servi te treffen <extra_id_0> EG-waarnemers toe <extra_id_1> de <extra_id_2>","Wijnaendts beschuldigt leger; Den Haag stelt sancties tegen Servirs voor DEN HAAG-ZAGREB-PARIJS, 30 AUG. Nederland zal zijn partners in de Europese Gemeenschap op een extra vergadering aanstaande dinsdag voorstellen politieke en economische maatregelen tegen Servi te treffen Dat voegden EG-waarnemers toe aan de verklaring.","['als het blijft weigeren', 'te laten tot', 'conflictgebieden in Kroati']","['Dat voegden', 'aan', 'verklaring.']",10,20,1,"[0.7391304347826086, 0.8333333333333334, 0.8846153846153846]",0.82
seq206-0,large,"Vrij koude nachten Tot en met woensdag verlopen de nachten vrij koud met kans op een klein beetje vorst in het binnenland, maar overdag wordt het ver boven nul.  Dankzij de nabijheid van een hogedrukgebied is het op de meeste dagen droog","Vrij koude nachten Tot en met woensdag verlopen de nachten vrij koud met kans op <extra_id_0> vorst in het binnenland, maar overdag wordt het <extra_id_1> nul. <extra_id_2> van een hogedrukgebied is het op de meeste dagen droog","Vrij koude nachten Tot en met woensdag verlopen de nachten vrij koud met kans op lichte vorst in het binnenland, maar overdag wordt het droog tot rond nul. Door de vorming van een hogedrukgebied is het op de meeste dagen droog","['een klein beetje', 'ver boven', 'Dankzij de nabijheid']","['lichte', 'droog tot rond', 'Door de vorming']",8,20,1,"[0.75, 0.7857142857142857, 0.75]",0.76
seq207-0,large,"Mager verslag van Indi-herdenking in de krant Op 15 augustus 1945 vond de capitulatie van Japan plaats.  Dat betekende het einde van de oorlog in Indi voor ons die onder Japanse bezetting hadden geleefd, in kampen en daarbuiten","Mager verslag van Indi-herdenking in de krant Op 15 augustus 1945 vond de <extra_id_0> plaats. Dat betekende het <extra_id_1> de <extra_id_2> voor ons die onder Japanse bezetting hadden geleefd, in kampen en daarbuiten","Mager verslag van Indi-herdenking in de krant Op 15 augustus 1945 vond de Indi-herdenking plaats. Dat betekende het einde van de oorlog voor ons die onder Japanse bezetting hadden geleefd, in kampen en daarbuiten","['capitulatie van Japan', 'einde van', 'oorlog in Indi']","['Indi-herdenking', 'einde van', 'oorlog']",8,20,1,"[0.8571428571428571, 0.0, 0.5714285714285714]",0.48
seq208-0,large,"Burgemeesters aan bevolking: samen gaan we het fiksen Crisiscommunicatie Meerdere burgemeesters schreven de afgelopen dagen hun inwoners een brief.  Verlies elkaar niet uit het oog, is de boodschap","Burgemeesters aan bevolking: samen gaan we het <extra_id_0> burgemeesters schreven de afgelopen dagen hun inwoners <extra_id_1> elkaar niet uit het oog, is de boodschap","Burgemeesters aan bevolking: samen gaan we het winnen De burgemeesters schreven de afgelopen dagen hun inwoners een brief. We verliezen elkaar niet uit het oog, is de boodschap","['fiksen Crisiscommunicatie Meerdere', 'een brief. Verlies']","['winnen De', 'een brief. We verliezen']",6,20,1,"[0.8529411764705882, 0.30434782608695654]",0.58
seq209-0,large,"Zaterdagavond dacht SGP-Kamerlid Elbert Dijkgraaf een belastingdruk van maar liefst 98,6 procent op het spoor te zijn.  Een paar dagen langer studeren op de kabinetsplannen resulteerde in een lagere maar nog altijd aanzienlijke belastingdruk van 85 procent","Zaterdagavond dacht SGP-Kamerlid Elbert Dijkgraaf een belastingdruk van maar liefst 98,6 procent op <extra_id_0> zijn. Een <extra_id_1> op de kabinetsplannen resulteerde in een lagere maar nog altijd aanzienlijke belastingdruk van 85 procent","Zaterdagavond dacht SGP-Kamerlid Elbert Dijkgraaf een belastingdruk van maar liefst 98,6 procent op te zijn. Een reactie op de kabinetsplannen resulteerde in een lagere maar nog altijd aanzienlijke belastingdruk van 85 procent","['het spoor te', 'paar dagen langer studeren']","['te', 'reactie']",7,20,1,"[0.8333333333333334, 0.8076923076923077]",0.82
seq210-0,large,Opereren en detoxen met uitzicht op een Alp Zwitserse huisartsen rekenen af per minuut.  Onze correspondenten beschrijven deze zomer eigenaardigheden van de gezondheidszorg in hun land,Opereren en detoxen met uitzicht op een Alp Zwitserse huisartsen rekenen af per minuut. Onze correspondenten beschrijven deze zomer <extra_id_0> de gezondheidszorg <extra_id_1>,Opereren en detoxen met uitzicht op een Alp Zwitserse huisartsen rekenen af per minuut. Onze correspondenten beschrijven deze zomer de veranderingen in de gezondheidszorg,"['eigenaardigheden van', 'in hun land']","['de veranderingen in', '']",5,20,1,"[0.65, 1.0]",0.82
seq211-0,large,"LEYLA ZANA; Koningin der Koerden ANKARA, 10 NOV.  Leyla Zana is het symbool van de Koerdische strijd voor politieke vrijheid en culturele identiteit binnen Turkije","LEYLA ZANA; Koningin der Koerden ANKARA, 10 NOV. Leyla Zana is het symbool van de Koerdische strijd <extra_id_0> vrijheid en <extra_id_1> Turkije","LEYLA ZANA; Koningin der Koerden ANKARA, 10 NOV. Leyla Zana is het symbool van de Koerdische strijd voor vrijheid en gelijkheid in Turkije","['voor politieke', 'culturele identiteit binnen']","['voor', 'gelijkheid in']",5,20,1,"[0.7142857142857143, 0.7037037037037037]",0.71
seq212-0,large,"Het NHM is geschiedenis Met het Nationaal Historisch Museum ging het net als met een paar andere reusachtige projecten.  Geestdriftig verzonnen, veel bijval gekregen, een plan kreeg vorm, er ontstond een tegenplan, discussies werden onoverzichtelijk en langzamerhand verloor dit magnifieke project zijn geloofwaardigheid","Het NHM is geschiedenis Met het Nationaal Historisch Museum ging het net als met een paar andere reusachtige <extra_id_0> veel bijval gekregen, een <extra_id_1> er ontstond een tegenplan, discussies <extra_id_2> langzamerhand verloor dit magnifieke project zijn geloofwaardigheid","Het NHM is geschiedenis Met het Nationaal Historisch Museum ging het net als met een paar andere reusachtige projecten. Het had veel bijval gekregen, een publiek, er ontstond een tegenplan, discussies en langzamerhand verloor dit magnifieke project zijn geloofwaardigheid","['projecten. Geestdriftig verzonnen,', 'plan kreeg vorm,', 'werden onoverzichtelijk en']","['projecten. Het had', 'publiek,', 'en']",9,20,1,"[0.5882352941176471, 0.8125, 0.9230769230769231]",0.77
seq213-0,large,"Mexico gist naar omvang moordkomplot tegen Colosio MEXICO-STAD, 6 APRIL.  Wat velen in Mexico dachten en steeds lui der zeiden is nu door een officieel onderzoek bevestigd: de moord op presidentskandidaat Lus Donaldo Colosio, twee weken geleden, was een samenzwering","Mexico gist naar omvang moordkomplot tegen Colosio MEXICO-STAD, 6 APRIL. Wat velen in Mexico dachten en <extra_id_0> zeiden is <extra_id_1> officieel onderzoek bevestigd: de moord op presidentskandidaat <extra_id_2> Colosio, twee weken geleden, was een samenzwering","Mexico gist naar omvang moordkomplot tegen Colosio MEXICO-STAD, 6 APRIL. Wat velen in Mexico dachten en velen zeiden is na officieel onderzoek bevestigd: de moord op presidentskandidaat Luis Colosio, twee weken geleden, was een samenzwering","['steeds lui der', 'nu door een', 'Lus Donaldo']","['velen', 'na', 'Luis']",8,20,1,"[0.7857142857142857, 0.9090909090909091, 0.8181818181818182]",0.84
seq214-0,large,Staatsschuld Rusland moet eigenlijk zwaar bezuinigen.  Uit oogpunt van verkiezingen leent de regering toch liever bij om te voldoen aan sociale verplichtingen,Staatsschuld Rusland moet eigenlijk zwaar bezuinigen. Uit oogpunt van verkiezingen leent de regering <extra_id_0> te voldoen aan sociale verplichtingen,Staatsschuld Rusland moet eigenlijk zwaar bezuinigen. Uit oogpunt van verkiezingen leent de regering zich voor de gelegenheid om te voldoen aan sociale verplichtingen,['toch liever bij om'],['zich voor de gelegenheid om'],4,20,1,[0.6666666666666666],0.67
seq215-0,large,"Utrechtse Jaarbeurs heeft topresultaat behaald over 1995 UTRECHT, 1 MAART.  De Jaarbeurs in Utrecht heeft in 1995 met een omzet van 147 miljoen gulden en een winst vr belasting van 10 miljoen gulden topresultaten behaald","Utrechtse Jaarbeurs heeft topresultaat behaald over 1995 UTRECHT, 1 MAART. De Jaarbeurs <extra_id_0> 1995 met een <extra_id_1> miljoen gulden en een winst vr belasting van 10 miljoen gulden topresultaten behaald","Utrechtse Jaarbeurs heeft topresultaat behaald over 1995 UTRECHT, 1 MAART. De Jaarbeurs heeft over 1995 met een omzet van 13,8 miljoen gulden en een winst vr belasting van 10 miljoen gulden topresultaten behaald","['in Utrecht heeft in', 'omzet van 147']","['heeft over', 'omzet van 13,8']",7,20,1,"[0.7894736842105263, 0.21428571428571427]",0.5
seq216-0,large,Racines Andromache is een museumstuk De zeventiende-eeuwse klassieke taal van de Franse toneelschrijver Jean Racine is een monument.  De ,Racines Andromache is een museumstuk De zeventiende-eeuwse klassieke taal <extra_id_0> Jean Racine is een monument. De,Racines Andromache is een museumstuk De zeventiende-eeuwse klassieke taal Jean Racine is een monument. De,['van de Franse toneelschrijver'],[''],4,20,1,[1.0],1.0
seq217-0,large,Terreurdreiging Brugge rekende een euro extra voor koffie om toeristen af te schrikken.  Sinds de aanslagen in Brussel is het opeens rustig,Terreurdreiging Brugge rekende <extra_id_0> koffie om toeristen af te schrikken. Sinds de aanslagen in Brussel is het opeens rustig,Terreurdreiging Brugge rekende de koffie om toeristen af te schrikken. Sinds de aanslagen in Brussel is het opeens rustig,['een euro extra voor'],['de'],4,20,1,[0.9473684210526315],0.95
seq218-0,large,"Opnieuw Haren, burgers blijven lastig 14 september 2013  Volgende week, een jaar geleden, was Haren wereldnieuws.  De Facebook-rellen van toen verlammen de Groningse gemeente nog steeds","Opnieuw Haren, burgers blijven lastig 14 september 2013 Volgende week, <extra_id_0> was <extra_id_1> De Facebook-rellen van toen verlammen de Groningse gemeente nog steeds","Opnieuw Haren, burgers blijven lastig 14 september 2013 Volgende week, opnieuw Haren, was het weer anders. De Facebook-rellen van toen verlammen de Groningse gemeente nog steeds","['een jaar geleden,', 'Haren wereldnieuws.']","['opnieuw Haren,', 'het weer anders.']",5,20,1,"[0.7058823529411765, 0.5789473684210527]",0.64
seq219-0,large,"Duitse telescoop van kunststof op Mount Graham Op Mount Graham, een 3250 meter hoge berg in Arizona, is een Duitse telescoop in gebruik genomen.  Met zijn antennereflector van 10 meter diameter is het de eerste telescoop van deze grootte die straling uit het heelal kan opvangen met een kleinste golflengte van 0,35 millimeter","Duitse telescoop van kunststof op Mount Graham Op Mount Graham, een 3250 meter hoge berg in Arizona, is een Duitse telescoop in gebruik genomen. Met zijn <extra_id_0> meter diameter is het de eerste <extra_id_1> grootte die straling uit het heelal <extra_id_2> met een kleinste <extra_id_3> millimeter","Duitse telescoop van kunststof op Mount Graham Op Mount Graham, een 3250 meter hoge berg in Arizona, is een Duitse telescoop in gebruik genomen. Met zijn kleine zes meter diameter is het de eerste van deze grootte die straling uit het heelal kan opvangen met een kleinste diameter van een millimeter","['antennereflector van 10', 'telescoop van deze', 'kan opvangen', 'golflengte van 0,35']","['kleine zes', 'van deze', 'kan opvangen', 'diameter van een']",11,20,1,"[0.8260869565217391, 0.5555555555555556, 0.0, 0.631578947368421]",0.5
seq220-0,large,Vader grijpt de macht; Kiddesk geeft iedereen een eigen plek in de computer Kiddesk is er op diskettes (ISBN 90 229 3903 0) of ,Vader <extra_id_0> macht; Kiddesk geeft iedereen een eigen plek in <extra_id_1> is er op diskettes (ISBN 90 229 3903 0) of,Vader heeft macht; Kiddesk geeft iedereen een eigen plek in het leven. Het boek is er op diskettes (ISBN 90 229 3903 0) of,"['grijpt de', 'de computer Kiddesk']","['heeft', 'het leven. Het boek']",5,20,1,"[0.8888888888888888, 0.8421052631578947]",0.87
seq221-0,large,"Madam Koo fleemt, fluistert, sist en zingt jazzy Kameropera Madam Koo brengt in slimme regie zware themas als wantrouwen en angst op een lichtvoetige, bevreemdende manier in beeld.  Robert Benschop Photography Madam Koo van Meri Arta door Diamantfabriek","Madam Koo fleemt, <extra_id_0> zingt jazzy Kameropera Madam Koo brengt in slimme regie zware themas als wantrouwen en angst op een lichtvoetige, bevreemdende manier <extra_id_1> Benschop Photography Madam Koo van Meri Arta <extra_id_2>","Madam Koo fleemt, lacht en zingt jazzy Kameropera Madam Koo brengt in slimme regie zware themas als wantrouwen en angst op een lichtvoetige, bevreemdende manier in beeld. Foto: Benschop Photography Madam Koo van Meri Arta","['fluistert', 'sist en', 'in beeld. Robert', 'door Diamantfabriek']","['lacht en', 'in beeld. Foto:', '']",8,20,1,"[0.7777777777777778, 0.9333333333333333, 1.0]",0.9
