seq140-0,large,"Het wordt steeds duidelijker hoe Europa de oren laat hangen naar Big Brother Amerika.  De Britten tappen hun Europese bondgenoten af, Zwitserse softwarebedrijven geven de beveiligingssleutels van hun klanten af bij de Amerikanen","Het wordt steeds duidelijker <extra_id_0> oren laat hangen naar <extra_id_1> Britten tappen hun Europese bondgenoten af, Zwitserse softwarebedrijven geven de beveiligingssleutels van hun klanten af bij de Amerikanen","Het wordt steeds duidelijker wie zijn oren laat hangen naar de Amerikanen. De Britten tappen hun Europese bondgenoten af, Zwitserse softwarebedrijven geven de beveiligingssleutels van hun klanten af bij de Amerikanen","['hoe Europa de', 'Big Brother Amerika. De']","['wie zijn', 'de Amerikanen. De']",7,20,1,"[0.8461538461538461, 0.5652173913043478]",0.71
seq141-0,large,Freud en de nieuwe afgodsbeelden Shrinking Idols Sigmund Freud zou gefascineerd zijn geweest door Big Brother en De gouden kooi.  In 1927 schreef hij: De massas zijn lui en verstoken van inzicht,Freud en de nieuwe afgodsbeelden Shrinking Idols Sigmund Freud <extra_id_0> geweest door Big Brother en De gouden kooi. In 1927 schreef hij: De massas zijn lui <extra_id_1> inzicht,Freud en de nieuwe afgodsbeelden Shrinking Idols Sigmund Freud is bekend geweest door Big Brother en De gouden kooi. In 1927 schreef hij: De massas zijn lui Een nieuw inzicht,"['zou gefascineerd zijn', 'en verstoken van']","['is bekend', 'Een nieuw']",6,20,1,"[0.8095238095238095, 0.8125]",0.81
seq142-0,large,"Kunst & Cultuur Serie: De nalatenschap van Versace Op 15 juli 1997, een broeierige zomerochtend, loopt de vijftigjarige Giovanni (Gianni) Maria Versace zijn roemruchte villa in Miami uit.  De woning  tegenwoordig na Graceland en het Witte Huis het meest gefotografeerde huis in Amerika  heeft iets van een kasteel: een enorm pand, grotendeels van glimmend marmer, met aan alle kanten hekken en in het midden een imposante toegangspoort","Kunst & Cultuur Serie: <extra_id_0> Versace Op 15 juli 1997, een broeierige zomerochtend, loopt de vijftigjarige Giovanni (Gianni) Maria Versace zijn roemruchte villa in Miami uit. De woning tegenwoordig na Graceland en het Witte Huis het meest gefotografeerde huis in Amerika <extra_id_1> een kasteel: een enorm pand, grotendeels van glimmend marmer, met aan alle kanten <extra_id_2> midden <extra_id_3>","Kunst & Cultuur Serie: Gianni Versace Op 15 juli 1997, een broeierige zomerochtend, loopt de vijftigjarige Giovanni (Gianni) Maria Versace zijn roemruchte villa in Miami uit. De woning tegenwoordig na Graceland en het Witte Huis het meest gefotografeerde huis in Amerika is een kasteel: een enorm pand, grotendeels van glimmend marmer, met aan alle kanten een toren in het midden Gianni...","['De nalatenschap van', 'heeft iets van', 'hekken en in het', 'een imposante toegangspoort']","['Gianni', 'is', 'een toren in het', 'Gianni...']",13,20,1,"[0.8947368421052632, 0.8571428571428571, 0.375, 0.8518518518518519]",0.74
seq143-0,large,"Ooit probeerde Naema Tahir, soeverein, glorieus, Jeroen Pauw te verleiden met haar voorleeskunst.  Nu zat ze aan tafel bij hem en Paul Witteman, een stuk minder zelfbewust, ingesnoerd naast een man die de geur van zijn vroegere rivaal in de neusgaten had, getuige de aanblik die hij bood","Ooit probeerde Naema Tahir, <extra_id_0> te verleiden met haar voorleeskunst. Nu zat ze aan <extra_id_1> en Paul Witteman, een stuk minder zelfbewust, ingesnoerd naast een <extra_id_2> geur van zijn vroegere rivaal in de neusgaten had, getuige de aanblik die hij bood","Ooit probeerde Naema Tahir, een meisje van achttien, te verleiden met haar voorleeskunst. Nu zat ze aan tafel en Paul Witteman, een stuk minder zelfbewust, ingesnoerd naast een man die de geur van zijn vroegere rivaal in de neusgaten had, getuige de aanblik die hij bood","['soeverein', 'glorieus', 'Jeroen Pauw', 'tafel bij hem', 'man die de']","['een meisje van achttien,', 'tafel', 'man die de']",10,20,1,"[0.7916666666666666, 0.875, 1.0]",0.89
seq144-0,large,"Dichters & Denkers Fleur Bourgonje, Nevelpaarden Nevelpaarden Atlas, 127 blz. ,  13,50 Van Fleur Bourgonje verschenen tot nu toe achttien boeken: verhalen, romans en pozie","Dichters & Denkers Fleur Bourgonje, Nevelpaarden Nevelpaarden Atlas, 127 blz. , 13,50 Van Fleur <extra_id_0> tot nu toe achttien boeken: <extra_id_1> pozie","Dichters & Denkers Fleur Bourgonje, Nevelpaarden Nevelpaarden Atlas, 127 blz. , 13,50 Van Fleur Bourgonje zijn er tot nu toe achttien boeken: Deze pozie","['Bourgonje verschenen', 'verhalen', 'romans en']","['Bourgonje zijn er', 'Deze']",5,20,1,"[0.45, 0.75]",0.6
seq145-0,large,"Drama in Europees Parlement Straatsburg - Toen de oud-PVV'er Daniel van der Stoep op een regenachtige woensdagochtend in februari zijn kantoor in het Europees Parlement in Straatsburg binnenliep, blaakte hij van zelfvertrouwen.  De dag ervoor had hij zich voorgesteld aan de leden van Europa van Vrijheid en Democratie, de Europese fractie van onder meer de SGP, geleid door Nigel Farage, leider van de UK Independence Party, berucht om zijn bevlogen toespraken en roze overhemden","Drama in Europees <extra_id_0> Toen de oud-PVV'er Daniel van der Stoep op een regenachtige woensdagochtend in februari zijn kantoor in het Europees Parlement in Straatsburg binnenliep, blaakte hij van zelfvertrouwen. De dag ervoor had <extra_id_1> aan de leden van Europa van Vrijheid en Democratie, de Europese fractie van onder <extra_id_2> geleid door Nigel Farage, leider van de UK Independence <extra_id_3> zijn bevlogen <extra_id_4> overhemden","Drama in Europees Parlement Toen de oud-PVV'er Daniel van der Stoep op een regenachtige woensdagochtend in februari zijn kantoor in het Europees Parlement in Straatsburg binnenliep, blaakte hij van zelfvertrouwen. De dag ervoor had hij een brief geschreven aan de leden van Europa van Vrijheid en Democratie, de Europese fractie van onder meer de Verenigde Staten geleid door Nigel Farage, leider van de UK Independence Party. In zijn bevlogen witte overhemden","['Parlement Straatsburg -', 'hij zich voorgesteld', 'meer de SGP,', 'Party', 'berucht om', 'toespraken en roze']","['Parlement', 'hij een brief geschreven', 'meer de Verenigde Staten', 'Party. In', 'witte']",15,20,1,"[0.6086956521739131, 0.6666666666666666, 0.625, 0.4444444444444444, 0.9]",0.65
seq146-0,large,Iljin de jong kattenvanger SOMS NEMEN ze je vreselijk te grazen.  Moet je mijn hand zien: helemaal opgezwollen,Iljin de jong kattenvanger SOMS NEMEN <extra_id_0> grazen. Moet je mijn hand zien: helemaal opgezwollen,Iljin de jong kattenvanger SOMS NEMEN gaat grazen. Moet je mijn hand zien: helemaal opgezwollen,['ze je vreselijk te'],['gaat'],4,20,1,[0.9444444444444444],0.94
seq147-0,large,"door Joeri Boom en beeld Jeroen Oerlemans De uitvoering van ons plan laat even op zich wachten.  Vandaag moeten we naar de tweede stad van het land, Herat, niet ver van de Iraanse grens, n uur vliegen van Kaboel","door Joeri Boom en beeld Jeroen Oerlemans De uitvoering van ons <extra_id_0> op zich wachten. Vandaag moeten we naar de <extra_id_1> het land, Herat, niet ver van de Iraanse grens, n uur vliegen <extra_id_2>","door Joeri Boom en beeld Jeroen Oerlemans De uitvoering van ons missie blijft op zich wachten. Vandaag moeten we naar de hoofdstad van het land, Herat, niet ver van de Iraanse grens, n uur vliegen","['plan laat even', 'tweede stad van', 'van Kaboel']","['missie blijft', 'hoofdstad van', '']",8,20,1,"[1.0, 0.4, 1.0]",0.8
seq148-0,large,"Leporello, de keuze van Carel Blotkamp uit het bezit van het Stedelijk Museum Carel Blotkamp, hoogleraar kunstgeschiedenis aan de Vrije Universiteit, kunstcriticus van de Volkskrant en schrijver van mono gra fien over Mondriaan, Carel Visser en Ad Dekkers, koos voor zijn tentoonstelling Leporello in het Stedelijk Museum te Amsterdam een werk uit elk jaar dat de stedelijke collectie bestaat.  Grote meesters hangen naast onbekende namen, Nederlanders naast buitenlanders, schilderijen naast designmeubels","Leporello, de keuze van Carel Blotkamp uit het bezit van het Stedelijk Museum Carel Blotkamp, hoogleraar kunstgeschiedenis aan de Vrije Universiteit, kunstcriticus van de Volkskrant <extra_id_0> van mono gra fien over Mondriaan, <extra_id_1> Ad Dekkers, koos voor zijn tentoonstelling Leporello in het Stedelijk Museum te Amsterdam een werk uit elk <extra_id_2> stedelijke collectie bestaat. Grote meesters <extra_id_3> namen, Nederlanders naast buitenlanders, <extra_id_4>","Leporello, de keuze van Carel Blotkamp uit het bezit van het Stedelijk Museum Carel Blotkamp, hoogleraar kunstgeschiedenis aan de Vrije Universiteit, kunstcriticus van de Volkskrant en auteur van mono gra fien over Mondriaan, Leporello en Ad Dekkers, koos voor zijn tentoonstelling Leporello in het Stedelijk Museum te Amsterdam een werk uit elk van de collecties waaruit de stedelijke collectie bestaat. Grote meesters naast namen, Nederlanders naast buitenlanders,","['en schrijver', 'Carel Visser en', 'jaar dat de', 'hangen naast onbekende', 'schilderijen naast designmeubels']","['en auteur', 'Leporello en', 'van de collecties waaruit de', 'naast', '']",14,20,1,"[0.6666666666666666, 0.7333333333333333, 0.75, 0.7727272727272727, 1.0]",0.78
seq149-0,large,Financile netwerken ook in Nederland Ken uw klant is een gevleugeld gezegde in de Nederlandse bankwereld.  Toezichthouder de Nederlandsche Bank wil graag weten met wie de financile instituten in ons land zaken doen,Financile netwerken ook in Nederland Ken uw klant is een gevleugeld gezegde in de Nederlandse bankwereld. Toezichthouder de Nederlandsche Bank wil graag <extra_id_0> financile <extra_id_1> land zaken doen,Financile netwerken ook in Nederland Ken uw klant is een gevleugeld gezegde in de Nederlandse bankwereld. Toezichthouder de Nederlandsche Bank wil graag met financile netwerken in ons land zaken doen,"['weten met wie de', 'instituten in ons']","['met', 'netwerken in ons']",7,20,1,"[0.8125, 0.35294117647058826]",0.58
seq150-0,large,"Waarheid blijft geheim Behalve een emotionele gebeurtenis is een herdenking ook een vorm van inventarisering.  Zoveel jaar geleden, een getal dat op een nul of een vijf eindigt, zijn we een groot geluk deelachtig geworden of heeft zich een verschrikkelijke ramp voltrokken","Waarheid blijft geheim Behalve een emotionele gebeurtenis is een herdenking ook een vorm van inventarisering. Zoveel jaar geleden, een getal dat op een <extra_id_0> een vijf eindigt, zijn we een groot geluk deelachtig <extra_id_1> zich <extra_id_2> voltrokken","Waarheid blijft geheim Behalve een emotionele gebeurtenis is een herdenking ook een vorm van inventarisering. Zoveel jaar geleden, een getal dat op een acht of een vijf eindigt, zijn we een groot geluk deelachtig geraakt. Een droom die zich heeft voltrokken","['nul of', 'geworden of heeft', 'een verschrikkelijke ramp']","['acht of', 'geraakt. Een droom die', 'heeft']",8,20,1,"[0.5714285714285714, 0.7272727272727273, 0.88]",0.73
seq151-0,large,Kunst & Cultuur Film: Fahrenheit 11/9 Huilende paljas Michael Moore in Fahrenheit 11/9  Splendid film 26 september 2018  verschenen in uit nr.  39 We zijn ,Kunst & Cultuur Film: Fahrenheit 11/9 Huilende paljas Michael Moore in Fahrenheit <extra_id_0> film 26 september 2018 verschenen in uit nr. <extra_id_1>,Kunst & Cultuur Film: Fahrenheit 11/9 Huilende paljas Michael Moore in Fahrenheit 11/9 film 26 september 2018 verschenen in uit nr. 88,"['11/9 Splendid', '39 We zijn']","['11/9', '88']",5,20,1,"[0.6923076923076923, 1.0]",0.85
seq152-0,large,Waarin stond dat er in het jaar 1855 bij een delicatessenhandel in New York achttienduizend duiven over de toonbank gingen.  Levenloos,Waarin stond dat er in het jaar 1855 bij een delicatessenhandel <extra_id_0> duiven over de toonbank gingen. Levenloos,Waarin stond dat er in het jaar 1855 bij een delicatessenhandel in Antwerpen duiven over de toonbank gingen. Levenloos,['in New York achttienduizend'],['in Antwerpen'],4,20,1,[0.7407407407407407],0.74
seq153-0,large,"Schop de mensen een geweten Leon de Winter, Serenade, Boekenweekgeschenk van de Stichting Collectieve Propaganda van het Nederlandse Boek, ter gelegenheid van de Boekenweek 1995; 93 blz. , gratis","<extra_id_0> een <extra_id_1> Winter, Serenade, Boekenweekgeschenk van de Stichting Collectieve Propaganda van het Nederlandse Boek, ter gelegenheid van de Boekenweek 1995; 93 blz. , gratis","geschenk van een schrijver: Willem Winter, Serenade, Boekenweekgeschenk van de Stichting Collectieve Propaganda van het Nederlandse Boek, ter gelegenheid van de Boekenweek 1995; 93 blz. , gratis","['Schop de mensen', 'geweten Leon de']","['geschenk van', 'schrijver: Willem']",6,20,1,"[0.8666666666666667, 0.9411764705882353]",0.9
seq154-0,large,"Evert de Vos beeld Milo Als je wilt dat je kind omhoog klimt, moet je er vooral niet bovenop gaan zitten.  De inmiddels beroemde en beruchte Juf Ank probeert aan het eind van een aflevering van de tv-dramaserie De Luizenmoeder de paniek bij de ouders te temperen","Evert de Vos beeld Milo Als je wilt dat <extra_id_0> klimt, moet je er vooral niet bovenop gaan zitten. De inmiddels beroemde en <extra_id_1> probeert aan het <extra_id_2> aflevering van de tv-dramaserie De Luizenmoeder de paniek bij de ouders te temperen","Evert de Vos beeld Milo Als je wilt dat de boel klimt, moet je er vooral niet bovenop gaan zitten. De inmiddels beroemde en bekende schrijver Milo probeert aan het eind van de eerste aflevering van de tv-dramaserie De Luizenmoeder de paniek bij de ouders te temperen","['je kind omhoog', 'beruchte Juf Ank', 'eind van een']","['de boel', 'bekende schrijver Milo', 'eind van de eerste']",9,20,1,"[0.7857142857142857, 0.7727272727272727, 0.3888888888888889]",0.65
seq155-0,large,Het zeventiende Theaterfestival Theater onder curatele Het afgelopen weekend eindigde het zeventiende Theaterfestival met de bekendmaking van enkele prijzen.  En van de namen van twee curatoren die met ingang van heden gaan bepalen welke toneelvoorstellingen uit het komend seizoen belangwekkend genoeg zijn om in de nazomer van 2004 op Het Theaterfestival geprogrammeerd te worden,Het zeventiende <extra_id_0> curatele Het <extra_id_1> eindigde het zeventiende Theaterfestival met de bekendmaking van enkele prijzen. En van de namen van twee curatoren die met ingang van heden gaan bepalen welke toneelvoorstellingen uit het komend seizoen belangwekkend genoeg zijn om in de nazomer <extra_id_2> Het <extra_id_3> worden,Het zeventiende Theaterfestival onder curatele Het weekend eindigde het zeventiende Theaterfestival met de bekendmaking van enkele prijzen. En van de namen van twee curatoren die met ingang van heden gaan bepalen welke toneelvoorstellingen uit het komend seizoen belangwekkend genoeg zijn om in de nazomer van Het Theaterfestival te worden,"['Theaterfestival Theater onder', 'afgelopen weekend', 'van 2004 op', 'Theaterfestival geprogrammeerd te']","['Theaterfestival onder', 'weekend', 'van', 'Theaterfestival te']",11,20,1,"[0.27586206896551724, 0.5882352941176471, 0.7272727272727273, 0.45454545454545453]",0.51
seq156-0,large,"De ontdekking van een verloren werk van een beroemde componist is altijd spannend, zeker als de componist Felix Mendelssohn Bartholdy heet en een paar van de meest populaire stukken van de complete muziekliteratuur van het avondland geschreven heeft.  Toen, dus, enige tijd geleden in de kunstfeuilletons de mare ging dat de lang verloren gewaande komische opera Der Onkel aus Boston uit 1822 teruggevonden was, zou je verwacht hebben dat het enthousiasme op de internationale muziekmarkt groot was en men zich onverwijld had gezet aan een uitvoering van het stuk bij een groot platenlabel met een sterrenbezetting","De ontdekking van een verloren werk van een beroemde componist is altijd spannend, zeker als de componist Felix Mendelssohn Bartholdy heet <extra_id_0> van de meest populaire stukken van de complete muziekliteratuur van het avondland geschreven heeft. Toen, dus, enige tijd geleden in <extra_id_1> mare ging dat de lang verloren gewaande <extra_id_2> Onkel aus Boston uit 1822 teruggevonden was, zou je verwacht hebben dat het enthousiasme op de internationale muziekmarkt groot was en <extra_id_3> had gezet aan een <extra_id_4> bij een <extra_id_5> een sterrenbezetting","De ontdekking van een verloren werk van een beroemde componist is altijd spannend, zeker als de componist Felix Mendelssohn Bartholdy heet die een van de meest populaire stukken van de complete muziekliteratuur van het avondland geschreven heeft. Toen, dus, enige tijd geleden in de mare ging dat de lang verloren gewaande Beethovens Onkel aus Boston uit 1822 teruggevonden was, zou je verwacht hebben dat het enthousiasme op de internationale muziekmarkt groot was en dat men zich al vast had gezet aan een bezoek bij een orkest met een sterrenbezetting","['en een paar', 'de kunstfeuilletons de', 'komische opera Der', 'men zich onverwijld', 'uitvoering van het stuk', 'groot platenlabel met']","['die een', 'de', 'Beethovens', 'dat men zich al vast', 'bezoek', 'orkest met']",19,20,1,"[0.7272727272727273, 0.9090909090909091, 0.8333333333333334, 0.7, 0.8695652173913043, 0.7142857142857143]",0.79
seq157-0,large,"Tijd voor een nieuwe vrouwenstrijd Zodra het woord vrouwenemancipatie valt, volgt in de media en de literatuur steevast een beschrijving van het hectische bestaan van de moderne werkende moeder.  Het verhaal dat de afgelopen jaren telkens opdook in de tientallen damesbladen en de vele romans, zoals de onlangs in vertaling verschenen Britse bestseller Hoe krijgt ze het voor elkaar van schrijfster Allison Paerson, gaat als volgt: sinds de tweede feministische golf hebben vrouwen massaal de arbeidsmarkt veroverd","Tijd voor een nieuwe <extra_id_0> woord vrouwenemancipatie valt, volgt in de media en de literatuur steevast een beschrijving <extra_id_1> bestaan van de moderne werkende moeder. Het verhaal dat de afgelopen <extra_id_2> in de tientallen damesbladen en de vele romans, zoals de onlangs in vertaling verschenen Britse bestseller Hoe krijgt ze <extra_id_3> van schrijfster Allison Paerson, gaat als volgt: <extra_id_4> feministische golf hebben vrouwen massaal de arbeidsmarkt veroverd","Tijd voor een nieuwe koers Als het woord vrouwenemancipatie valt, volgt in de media en de literatuur steevast een beschrijving van het bestaan van de moderne werkende moeder. Het verhaal dat de afgelopen jaren wordt verteld in de tientallen damesbladen en de vele romans, zoals de onlangs in vertaling verschenen Britse bestseller Hoe krijgt ze het van schrijfster Allison Paerson, gaat als volgt: sinds de eerste feministische golf hebben vrouwen massaal de arbeidsmarkt veroverd","['vrouwenstrijd Zodra het', 'van het hectische', 'jaren telkens opdook', 'het voor elkaar', 'sinds de tweede']","['koers Als het', 'van het', 'jaren wordt verteld', 'het', 'sinds de eerste']",15,20,1,"[0.6521739130434783, 0.5882352941176471, 0.7, 0.8, 0.3333333333333333]",0.61
seq158-0,large,"Rubriek week 7 Wankelende reputatie (x2) Parijs  Een boek van de onderzoeksjournalist Pierre Pan staat in Frankrijk garant voor een geschonden reputatie.  Zo onthulde hij in Une jeunesse franaise (1993) het Vichy-verleden van toenmalig president Mitterrand en in TF1, un pouvoir (1997) bood hij een ontluisterend kijkje in de coulissen van Frankrijks grootste televisiezender",Rubriek week 7 Wankelende reputatie (x2) Parijs Een boek van de onderzoeksjournalist Pierre Pan staat in Frankrijk garant voor een geschonden reputatie. Zo onthulde hij in Une jeunesse <extra_id_0> Vichy-verleden <extra_id_1> Mitterrand en <extra_id_2> pouvoir (1997) bood hij een ontluisterend kijkje in de coulissen <extra_id_3> grootste televisiezender,Rubriek week 7 Wankelende reputatie (x2) Parijs Een boek van de onderzoeksjournalist Pierre Pan staat in Frankrijk garant voor een geschonden reputatie. Zo onthulde hij in Une jeunesse  lre Mitterrand het Vichy-verleden In Mitterrand en son pouvoir (1997) bood hij een ontluisterend kijkje in de coulissen van de grootste televisiezender,"['franaise (1993) het', 'van toenmalig president', 'in TF1', 'un', 'van Frankrijks']","[' lre Mitterrand het', 'In', 'son', 'van de']",11,20,1,"[0.7727272727272727, 0.9565217391304348, 1.0, 0.8333333333333334]",0.89
seq159-0,large,Blog Worstelende Wetenschap #10 Wetenschappers moeten vaker te rade gaan bij hun geweten Herman Paul onderzoekt wat men in de negentiende eeuw verstond onder een goede wetenschapper.  In discussies over samenwerking met de industrie kwam destijds een felle afkeer van geldzucht naarvoren  geld en toewijding aan de waarheid zouden niet samengaan,Blog Worstelende Wetenschap #10 Wetenschappers moeten vaker te rade gaan bij hun geweten Herman Paul onderzoekt wat men in de negentiende eeuw verstond onder een goede wetenschapper. In discussies over samenwerking met <extra_id_0> een felle afkeer van <extra_id_1> en toewijding aan <extra_id_2> niet samengaan,Blog Worstelende Wetenschap #10 Wetenschappers moeten vaker te rade gaan bij hun geweten Herman Paul onderzoekt wat men in de negentiende eeuw verstond onder een goede wetenschapper. In discussies over samenwerking met de politiek kan een felle afkeer van de wetenschap en toewijding aan de wetenschap niet samengaan,"['de industrie kwam destijds', 'geldzucht naarvoren geld', 'de waarheid zouden']","['de politiek kan', 'de wetenschap', 'de wetenschap']",10,20,1,"[0.6923076923076923, 0.8333333333333334, 0.7222222222222222]",0.75
seq160-0,large,"Dichters & Denkers Virgillius Ibant obscuri sola sub nocte per umbram  deze zin heeft mij, sinds mijn eerste kennismaking met Vergilius, altijd achtervolgd.  Het is niet alleen de wisseling van de bijvoeglijke naamwoorden maar de mirage van duisternis die deze zin is: drie verschillende soorten duisternis naast elkaar","Dichters & Denkers Virgillius Ibant obscuri <extra_id_0> umbram <extra_id_1> mij, sinds mijn eerste kennismaking met <extra_id_2> Het is niet alleen de wisseling van de bijvoeglijke naamwoorden maar de mirage van duisternis die deze zin is: drie verschillende soorten duisternis naast elkaar","Dichters & Denkers Virgillius Ibant obscuri umbram obscurae. Voor mij, sinds mijn eerste kennismaking met de zin. Het is niet alleen de wisseling van de bijvoeglijke naamwoorden maar de mirage van duisternis die deze zin is: drie verschillende soorten duisternis naast elkaar","['sola sub nocte per', 'deze zin heeft', 'Vergilius', 'altijd achtervolgd.']","['', 'obscurae. Voor', 'de zin.']",10,20,1,"[1.0, 1.0, 0.7777777777777778]",0.93
seq161-0,large,"Er is, zoals ik vorige week schreef, ook die glazen blik in zijn ogen.  Ogen die niettemin lijken te branden, een blik waarmee je geen contact krijgt maar die iets broeierigs verbergt, en er is die houding van m, die kaarsrechte houding, die houding van een jongen die wel ergens staat of loopt, wel ergens is, maar of dat nu op het schoolplein is of op de gang of op de noordpool, dat valt niet van m af te lezen, en dat valt ook niet op te maken uit die glazen blik: de houding en de blik van een jongen die niets met zijn omgeving heeft","Er is, zoals ik vorige week schreef, ook die glazen blik in zijn ogen. Ogen die niettemin lijken te branden, een blik waarmee je geen contact krijgt <extra_id_0> broeierigs verbergt, en er is die houding van m, die kaarsrechte houding, die houding van een jongen die wel ergens staat of loopt, wel ergens is, maar of dat nu op het schoolplein is of op de <extra_id_1> de noordpool, dat valt niet van m af te lezen, en dat <extra_id_2> op te maken <extra_id_3> blik: <extra_id_4> de <extra_id_5> jongen <extra_id_6> zijn omgeving heeft","Er is, zoals ik vorige week schreef, ook die glazen blik in zijn ogen. Ogen die niettemin lijken te branden, een blik waarmee je geen contact krijgt die iets broeierigs verbergt, en er is die houding van m, die kaarsrechte houding, die houding van een jongen die wel ergens staat of loopt, wel ergens is, maar of dat nu op het schoolplein is of op de noordpool of op de noordpool, dat valt niet van m af te lezen, en dat valt op te maken uit die glazen blik: dat is de blik die de jongen in zijn omgeving heeft","['maar die iets', 'gang of op', 'valt ook niet', 'uit die glazen', 'de houding en', 'blik van een', 'die niets met']","['die iets', 'noordpool of op', 'valt', 'uit die glazen', 'dat is', 'blik die de', 'in']",21,20,1,"[0.38461538461538464, 0.6, 0.6923076923076923, 0.0, 0.8461538461538461, 0.4166666666666667, 0.8461538461538461]",0.54
seq162-0,large,"Hoe schrijvers en hun critici belangrijk worden Met zijn bundel over literatuurkritiek heeft hoogleraar letterkunde Jos Joosten niet wat de criticus moet, maar wat hij doet voor ogen.  En wat doet Joosten zelf",Hoe schrijvers en hun critici belangrijk worden Met zijn bundel over literatuurkritiek heeft hoogleraar letterkunde Jos Joosten niet wat de <extra_id_0> wat hij doet voor <extra_id_1> Joosten zelf,Hoe schrijvers en hun critici belangrijk worden Met zijn bundel over literatuurkritiek heeft hoogleraar letterkunde Jos Joosten niet wat de schrijvers willen. Het is wat hij doet voor Jos Joosten zelf,"['criticus moet', 'maar', 'ogen. En wat doet']","['schrijvers willen. Het is', 'Jos']",7,20,1,"[0.72, 1.0]",0.86
