seq222-0,large,"De corrupte agenten van Zimbabwe Harare  De Zimbabwaanse premier Morgan Tsvangirai denkt dat de parlements- en presidentsverkiezingen, die hij in juli verwacht, niet opnieuw gewelddadig zullen verlopen.  Hij zei dat op een bijeenkomst in Harare waar de nieuwe grondwet werd besproken, waarover op 16 maart in Zimbabwe een referendum wordt gehouden","De corrupte agenten van Zimbabwe Harare De Zimbabwaanse premier Morgan Tsvangirai denkt dat <extra_id_0> presidentsverkiezingen, die hij in juli verwacht, niet opnieuw <extra_id_1> Hij zei dat op een bijeenkomst in <extra_id_2> grondwet werd besproken, waarover op 16 maart in Zimbabwe een referendum wordt gehouden","De corrupte agenten van Zimbabwe Harare De Zimbabwaanse premier Morgan Tsvangirai denkt dat de presidentsverkiezingen, die hij in juli verwacht, niet opnieuw worden gehouden. Hij zei dat op een bijeenkomst in Harare de grondwet werd besproken, waarover op 16 maart in Zimbabwe een referendum wordt gehouden","['de parlements- en', 'gewelddadig zullen verlopen.', 'Harare waar de nieuwe']","['de', 'worden gehouden.', 'Harare de']",10,20,1,"[0.8823529411764706, 0.6785714285714286, 0.5714285714285714]",0.71
seq223-0,large,"Jagen op mensen De Poolse regisseur Jerzy Skolimowski groeide op in Praag waar hij naar school ging met onder anderen Milos Forman en Ivan Passer, die later sleutelwerken van de jaren-zeventigcinema maakten.  Zelf was de jonge macho Skolimowski meer genteresseerd in boksen en pozie, maar hij belandde uiteindelijk toch op de prestigieuze filmschool in Lodz, zijn geboortestad, waar hij de kans kreeg mee te werken aan het script voor Roman Polanskis Knife in the Water (1962)","Jagen op <extra_id_0> regisseur Jerzy Skolimowski groeide op in Praag waar <extra_id_1> ging met onder anderen Milos Forman en Ivan Passer, die later sleutelwerken van de jaren-zeventigcinema maakten. Zelf was de jonge macho <extra_id_2> in boksen en pozie, maar hij belandde uiteindelijk toch op de prestigieuze filmschool in Lodz, zijn geboortestad, waar hij de kans <extra_id_3> werken <extra_id_4> voor Roman Polanskis Knife in the Water (1962)","Jagen op de bodem De regisseur Jerzy Skolimowski groeide op in Praag waar hij naar school ging met onder anderen Milos Forman en Ivan Passer, die later sleutelwerken van de jaren-zeventigcinema maakten. Zelf was de jonge macho sterk in boksen en pozie, maar hij belandde uiteindelijk toch op de prestigieuze filmschool in Lodz, zijn geboortestad, waar hij de kans kreeg te werken aan een scenario voor Roman Polanskis Knife in the Water (1962)","['mensen De Poolse', 'hij naar school', 'Skolimowski meer genteresseerd', 'kreeg mee te', 'aan het script']","['de bodem De', 'hij naar school', 'sterk', 'kreeg te', 'aan een scenario']",15,20,1,"[0.8125, 0.0, 0.8666666666666667, 0.3333333333333333, 0.4375]",0.49
seq224-0,large,"Esi Edugyan thuis in Victoria, British Columbia, Canada  creChad Hipolito / The Canadian Press / HH Toen ik begin 2017 de Amerikaanse auteur Colson Whitehead sprak naar aanleiding van zijn bekroonde slavernijroman The Underground Railroad, leek hij vooral uitgeteld door alle aandacht en zei hij meermaals dat hij verlangde naar een dutje op zijn hotelkamer  tot het gesprek op slavernij kwam.  Direct ging hij iets meer rechtop zitten, in mijn herinnering werd zijn stem ook prompt een stuk harder","Esi Edugyan thuis in Victoria, British Columbia, Canada creChad Hipolito / The Canadian Press / HH Toen ik begin 2017 de Amerikaanse auteur Colson Whitehead sprak naar aanleiding van zijn bekroonde slavernijroman The Underground Railroad, leek hij vooral uitgeteld door alle aandacht en zei hij meermaals dat hij verlangde naar <extra_id_0> zijn <extra_id_1> op slavernij kwam. Direct ging hij iets meer rechtop <extra_id_2> herinnering werd <extra_id_3> prompt <extra_id_4>","Esi Edugyan thuis in Victoria, British Columbia, Canada creChad Hipolito / The Canadian Press / HH Toen ik begin 2017 de Amerikaanse auteur Colson Whitehead sprak naar aanleiding van zijn bekroonde slavernijroman The Underground Railroad, leek hij vooral uitgeteld door alle aandacht en zei hij meermaals dat hij verlangde naar de tijd dat hij in zijn jeugd op slavernij kwam. Direct ging hij iets meer rechtop staan en zijn herinnering werd hem prompt iets sterker.","['een dutje op', 'hotelkamer tot het gesprek', 'zitten', 'in mijn', 'zijn stem ook', 'een stuk harder']","['de tijd dat hij in', 'jeugd', 'staan en zijn', 'hem', 'sterker.']",16,20,1,"[0.7222222222222222, 0.9230769230769231, 0.8461538461538461, 0.8571428571428571, 0.7692307692307693]",0.82
seq225-0,large,"De recensenten gerecenseerd Verdomme, die t Hart.  Christiaan Weijts recenseert vijf Nederlandse recensenten, gangmakers van het literaire debat, naar hun eigen maatstaven","De recensenten gerecenseerd Verdomme, die t Hart. Christiaan Weijts recenseert vijf <extra_id_0> het literaire debat, naar hun eigen maatstaven","De recensenten gerecenseerd Verdomme, die t Hart. Christiaan Weijts recenseert vijf mannen die het literaire debat, naar hun eigen maatstaven","['Nederlandse recensenten', 'gangmakers van']",['mannen die'],4,20,1,[0.782608695652174],0.78
seq226-0,large,"Kunst & Cultuur Het verbluffende aanpassingsvermogen van dieren Wat ik kan doen is verbazing creren Stadse kikkers zijn sexyer dan hun soortgenoten in het bos.  Of althans, de lokroep van mannetjes is daar aantrekkelijker voor vrouwtjes","<extra_id_0> Het verbluffende aanpassingsvermogen van dieren Wat <extra_id_1> verbazing creren Stadse kikkers zijn sexyer dan hun soortgenoten in het bos. Of althans, de lokroep van mannetjes is daar aantrekkelijker voor vrouwtjes","Het verbluffende aanpassingsvermogen van dieren Wat dieren doen die verbazing creren Stadse kikkers zijn sexyer dan hun soortgenoten in het bos. Of althans, de lokroep van mannetjes is daar aantrekkelijker voor vrouwtjes","['Kunst & Cultuur', 'ik kan doen is']","['', 'dieren doen die']",7,20,1,"[1.0, 0.4666666666666667]",0.73
seq227-0,large,"Je kunt je natuurlijk afvragen of de opzet van de Binnale van Veneti nog wel van deze tijd is, zegt Birgit Donker, maar ik vind het traditionele ervan juist iets moois hebben.  Donker is directeur van het Mondriaan Fonds, het stimuleringsfonds voor beeldende kunst dat om het jaar bepaalt wie Nederland in Veneti mag vertegenwoordigen","Je <extra_id_0> afvragen of de opzet van de Binnale van Veneti nog wel van deze tijd is, zegt Birgit Donker, maar ik vind het traditionele ervan juist iets moois hebben. Donker is <extra_id_1> het Mondriaan Fonds, het stimuleringsfonds voor beeldende kunst dat om het <extra_id_2> Nederland <extra_id_3> vertegenwoordigen","Je kunt je afvragen of de opzet van de Binnale van Veneti nog wel van deze tijd is, zegt Birgit Donker, maar ik vind het traditionele ervan juist iets moois hebben. Donker is directeur van het Mondriaan Fonds, het stimuleringsfonds voor beeldende kunst dat om het podium in Nederland gaat. Zij wil de kunst vertegenwoordigen","['kunt je natuurlijk', 'directeur van', 'jaar bepaalt wie', 'in Veneti mag']","['kunt je', 'directeur van', 'podium in', 'gaat. Zij wil de kunst']",11,20,1,"[0.6111111111111112, 0.0, 0.875, 0.8636363636363636]",0.59
seq228-0,large,"We kunnen het ons nauwelijks meer voorstellen wat het betekent als er landelijk een zeer besmettelijke infectieziekte uitbreekt.  Kinderen kregen bij bosjes difterie, kinkhoest, de bof, rode hond, polio, mazelen, tetanus en waterpokken","We kunnen het ons nauwelijks meer voorstellen wat <extra_id_0> landelijk een zeer besmettelijke infectieziekte uitbreekt. Kinderen kregen bij bosjes difterie, kinkhoest, de bof, <extra_id_1> mazelen, tetanus en waterpokken","We kunnen het ons nauwelijks meer voorstellen wat er gebeurt als er landelijk een zeer besmettelijke infectieziekte uitbreekt. Kinderen kregen bij bosjes difterie, kinkhoest, de bof, ziekte van Crohn, mazelen, tetanus en waterpokken","['het betekent als er', 'rode hond', 'polio,']","['er gebeurt als er', 'ziekte van Crohn,']",7,20,1,"[0.3684210526315789, 0.7647058823529411]",0.57
seq229-0,large,Intens tragische kunst In Albees Wie is bang voor Virginia Woolf.  staan gast Nick en gastheer George voor een schilderij,Intens tragische kunst In Albees Wie is bang voor Virginia <extra_id_0> en gastheer George voor een schilderij,Intens tragische kunst In Albees Wie is bang voor Virginia en gastheer George voor een schilderij,['Woolf. staan gast Nick'],[''],4,20,1,[1.0],1.0
seq230-0,large,De opkomst van de kleuterconcurrentie Het helpt dus allemaal niet.  Gelijke kansen bevorderen via het onderwijs,De opkomst van de kleuterconcurrentie Het helpt dus allemaal niet. Gelijke kansen bevorderen <extra_id_0>,De opkomst van de kleuterconcurrentie Het helpt dus allemaal niet. Gelijke kansen bevorderen is beter,['via het onderwijs'],['beter'],3,20,1,[0.7647058823529411],0.76
seq231-0,large,"This Cant Go On (Stay with Me) in Museum Boijmans Van Beuningen geeft een overzicht van het werk dat beroepschaoot Erik van Lieshout in de afgelopen zes jaar produceerde.  De tentoonstelling brengt Van Lieshouts schilderijen, tekeningen en videowerken samen en geeft een centrale plaats aan zijn laatste project, de video-installatie Rock",This Cant Go On (Stay with Me) in Museum Boijmans Van Beuningen geeft een overzicht van het werk dat beroepschaoot Erik van Lieshout in de afgelopen zes jaar produceerde. De tentoonstelling brengt <extra_id_0> en videowerken samen en geeft een <extra_id_1> zijn <extra_id_2> video-installatie Rock,This Cant Go On (Stay with Me) in Museum Boijmans Van Beuningen geeft een overzicht van het werk dat beroepschaoot Erik van Lieshout in de afgelopen zes jaar produceerde. De tentoonstelling brengt zijn foto- en videowerken samen en geeft een beeld van zijn nieuwe video-installatie Rock,"['Van Lieshouts schilderijen', 'tekeningen', 'centrale plaats aan', 'laatste project', 'de']","['zijn foto-', 'beeld van', 'nieuwe']",10,20,1,"[0.8846153846153846, 0.7, 0.8947368421052632]",0.83
seq232-0,large,"Rubriek TELEVISIE Nipkow 2008 Eerder al zong ik de lof van In Afrika van Adriaan van Dis, die prachtige reis door de weerbarstigheid van het zuidelijk deel van dat continent.  Een zo voortreffelijk programma kennelijk dat alle aanwezige leden van de Nipkow-jury het bij de laatste stemronde in hun top-3 zetten","Rubriek TELEVISIE Nipkow 2008 <extra_id_0> ik de lof van In Afrika van Adriaan van Dis, die prachtige reis door de weerbarstigheid van <extra_id_1> dat continent. Een zo voortreffelijk programma kennelijk dat alle aanwezige leden van de Nipkow-jury het <extra_id_2> stemronde in hun top-3 zetten","Rubriek TELEVISIE Nipkow 2008 - Vrijdag - Vrijdag - Vrijdag - Vrijdag - Vrijdag - Vrijdag - Vrijdag - Deel ik de lof van In Afrika van Adriaan van Dis, die prachtige reis door de weerbarstigheid van de mensen op dat continent. Een zo voortreffelijk programma kennelijk dat alle aanwezige leden van de Nipkow-jury het in de stemronde in hun top-3 zetten","['Eerder al zong', 'het zuidelijk deel van', 'bij de laatste']","['- Vrijdag - Vrijdag - Vrijdag - Vrijdag - Vrijdag - Vrijdag - Vrijdag - Deel', 'de mensen op', 'in de']",10,20,1,"[0.9078947368421053, 0.7727272727272727, 0.7142857142857143]",0.8
seq233-0,large,"Er is niks glamourous aan borstkanker In een kroeg in Adelaide, Australi, bedacht een groep mannen in 1999 dat ze iets wilden doen voor hun vriend met prostaatkanker.  Ze besloten geld in te zamelen voor kankeronderzoek, maar hadden geen tijd voor ingewikkelde campagnes of een sponsor- of sportevenement, waarvoor ze moesten trainen","Er is niks glamourous aan <extra_id_0> kroeg in Adelaide, Australi, bedacht een groep mannen in 1999 dat ze iets wilden doen voor hun vriend met prostaatkanker. Ze besloten geld in te zamelen voor <extra_id_1> geen tijd voor ingewikkelde campagnes of een sponsor- of <extra_id_2> trainen","Er is niks glamourous aan In een kroeg in Adelaide, Australi, bedacht een groep mannen in 1999 dat ze iets wilden doen voor hun vriend met prostaatkanker. Ze besloten geld in te zamelen voor zijn behandeling. Er was geen tijd voor ingewikkelde campagnes of een sponsor- of reclamecampagne. Ze trainen","['borstkanker In een', 'kankeronderzoek', 'maar hadden', 'sportevenement', 'waarvoor ze moesten']","['In een', 'zijn behandeling. Er was', 'reclamecampagne. Ze']",10,20,1,"[0.6666666666666666, 0.75, 0.8421052631578947]",0.75
seq234-0,large,"NU DSK weer op vrije voeten is, gaat hij met zijn vrouw van het ene luxe restaurant naar het andere om truffels te eten.  Wel steeds met een hele sleep journalisten achter zich aan","NU DSK weer op vrije voeten is, gaat hij met zijn vrouw van het ene luxe restaurant <extra_id_0> om <extra_id_1> steeds met een hele sleep journalisten achter zich aan","NU DSK weer op vrije voeten is, gaat hij met zijn vrouw van het ene luxe restaurant naar het andere om nog steeds met een hele sleep journalisten achter zich aan","['naar het andere', 'truffels te eten. Wel']","['naar het andere', 'nog']",7,20,1,"[0.0, 0.9523809523809523]",0.48
seq235-0,large,"Woensdag 9 december 2009, de Balie te Amsterdam Dag van de Kunstkritiek (in digitale tijden) Critics Floating in the Virtual Sphere Overleeft de kunstkritiek het internet.  Inloop & koffie vanaf 13","Woensdag 9 december 2009, <extra_id_0> Amsterdam Dag van de Kunstkritiek <extra_id_1> Critics Floating in the Virtual Sphere Overleeft de kunstkritiek het internet. Inloop & koffie vanaf 13","Woensdag 9 december 2009, Vrijthof Amsterdam Dag van de Kunstkritiek Critics Floating in the Virtual Sphere Overleeft de kunstkritiek het internet. Inloop & koffie vanaf 13","['de Balie te', '(in digitale tijden)']","['Vrijthof', '']",6,20,1,"[1.0, 1.0]",1.0
seq236-0,large,"Kunst & Cultuur Kunst: Tams Kaszs Ik ben geen neo-primitivist, zegt de Hongaarse kunstenaar Tams Kaszs in een interview dat in een boekje bij zijn tentoonstelling verschijnt, en dat is moeilijk te geloven na het zien van de vernuftig in elkaar gezette kunstwerken in de ondergrondse ruimte van De Appel.  Er is een bulletinboard waar ambachtelijk gedrukte posters  zeefdruk, houtblok, stencils  met gekleurde punaises op zijn geprikt, het doosje punaises nog in het zicht","Kunst & Cultuur Kunst: Tams Kaszs Ik ben geen neo-primitivist, zegt de <extra_id_0> Kaszs in een interview dat in een boekje bij zijn tentoonstelling verschijnt, en dat is <extra_id_1> na het zien van de vernuftig in elkaar gezette kunstwerken in de ondergrondse ruimte van De Appel. Er is een bulletinboard waar ambachtelijk gedrukte posters zeefdruk, houtblok, stencils <extra_id_2> op <extra_id_3> doosje punaises nog <extra_id_4>","Kunst & Cultuur Kunst: Tams Kaszs Ik ben geen neo-primitivist, zegt de kunstenaar Tams Kaszs in een interview dat in een boekje bij zijn tentoonstelling verschijnt, en dat is ook niet na het zien van de vernuftig in elkaar gezette kunstwerken in de ondergrondse ruimte van De Appel. Er is een bulletinboard waar ambachtelijk gedrukte posters zeefdruk, houtblok, stencils en op een doosje punaises nog eens iets anders tonen.","['Hongaarse kunstenaar Tams', 'moeilijk te geloven', 'met gekleurde punaises', 'zijn geprikt', 'het', 'in het zicht']","['kunstenaar Tams', 'ook niet', 'en', 'een', 'tonen.']",15,20,1,"[0.4, 0.7894736842105263, 0.9090909090909091, 0.9166666666666666, 0.8333333333333334]",0.77
seq237-0,large,"Meer eerbied voor de echte lezers.  Voor bestsellers, het woord zegt het al, zijn lezers nodig die boeken kopen, maar vaak zullen dat klanten zijn die slechts zelden een boek kopen, alleen als het moet, als de tamtam maar lang genoeg op hun schedel heeft geklopt","Meer eerbied <extra_id_0> lezers. Voor bestsellers, het woord zegt het al, zijn lezers nodig die boeken kopen, maar vaak zullen dat klanten zijn die slechts zelden een <extra_id_1> als het moet, als de tamtam maar lang genoeg <extra_id_2> heeft geklopt","Meer eerbied voor lezers. Voor bestsellers, het woord zegt het al, zijn lezers nodig die boeken kopen, maar vaak zullen dat klanten zijn die slechts zelden een boek kopen als het moet, als de tamtam maar lang genoeg op de muur heeft geklopt","['voor de echte', 'boek kopen', 'alleen', 'op hun schedel']","['voor', 'boek kopen', 'op de muur']",9,20,1,"[0.6923076923076923, 0.0, 0.9]",0.53
seq238-0,large,"Nairobi  Wie op een zaterdag in Nairobi de straat op gaat, passeert altijd wel ergens een ronkende bruiloftsstoet van autos.  De kunststof bloemen op de motorkap ontnemen je een blik op het bruidspaar achter de ramen","Nairobi Wie op een zaterdag in Nairobi de straat op gaat, passeert altijd wel ergens <extra_id_0> van autos. De kunststof bloemen op <extra_id_1> een blik op het bruidspaar achter de ramen","Nairobi Wie op een zaterdag in Nairobi de straat op gaat, passeert altijd wel ergens een bloemenkraam van autos. De kunststof bloemen op de ramen geven een blik op het bruidspaar achter de ramen","['een ronkende bruiloftsstoet', 'de motorkap ontnemen je']","['een bloemenkraam', 'de ramen geven']",7,20,1,"[0.7407407407407407, 0.6086956521739131]",0.67
seq239-0,large,"Hoewel, er was een stuk taart overgebleven van gisteren.  Door een vrijgevig reiziger meegebracht uit Neurenberg","Hoewel, er was een stuk taart overgebleven van gisteren. Door <extra_id_0> meegebracht uit Neurenberg","Hoewel, er was een stuk taart overgebleven van gisteren. Door de buren meegebracht uit Neurenberg",['een vrijgevig reiziger'],['de buren'],3,20,1,[0.8181818181818182],0.82
seq240-0,large,"Ajax is altijd de club geweest van het mooie voetbal, en de mooie voetballers.  Ajax, dat was altijd fragiel, technisch, subtiel, jong, ietwat arrogant, meer vedette dan waterdrager, liever moeilijk dan makkelijk, liever mooi dan effectief","Ajax is altijd de club geweest van het mooie voetbal, en de mooie <extra_id_0> altijd fragiel, technisch, <extra_id_1> arrogant, meer vedette dan waterdrager, liever moeilijk dan makkelijk, liever mooi dan effectief","Ajax is altijd de club geweest van het mooie voetbal, en de mooie voetballers zijn altijd fragiel, technisch, liever mooi dan arrogant, meer vedette dan waterdrager, liever moeilijk dan makkelijk, liever mooi dan effectief","['voetballers. Ajax', 'dat was', 'subtiel', 'jong', 'ietwat']","['voetballers zijn', 'liever mooi dan']",7,20,1,"[0.29411764705882354, 0.8666666666666667]",0.58
seq241-0,large,"Aan de picknicktafel in Greenwich Village waar ik op zondag doorgaans de krant lees, schoof onlangs een bejaarde dame aan.  Met licht wantrouwen bekeek ze mijn warme chocolademelk en dat veranderde in afgrijzen toen ik er twee klontjes suiker in deed","Aan de picknicktafel in Greenwich Village waar ik op zondag doorgaans de krant lees, schoof onlangs een bejaarde dame aan. Met licht wantrouwen bekeek ze mijn warme <extra_id_0> dat <extra_id_1> toen ik er twee <extra_id_2> deed","Aan de picknicktafel in Greenwich Village waar ik op zondag doorgaans de krant lees, schoof onlangs een bejaarde dame aan. Met licht wantrouwen bekeek ze mijn warme blik, dat was toen ik er twee keer aan deed","['chocolademelk en', 'veranderde in afgrijzen', 'klontjes suiker in']","['blik,', 'was', 'keer aan']",8,20,1,"[0.875, 0.9565217391304348, 0.7222222222222222]",0.85
seq242-0,large,"27 oktober 2006 Jaargang 130, Nr.  43 Aart Brouwer, 27 oktober 2006 Hubert Smeets, 27 oktober 2006 Margreet Fogteloo, 27 oktober 2006 Duco Hellema, 27 oktober 2006 Peter Vermaas, 27 oktober ","<extra_id_0> Jaargang 130, Nr. 43 Aart Brouwer, 27 oktober 2006 Hubert Smeets, 27 oktober 2006 Margreet Fogteloo, 27 oktober 2006 Duco Hellema, 27 oktober <extra_id_1> 27 oktober","2006 Jaargang 130, Nr. 43 Aart Brouwer, 27 oktober 2006 Hubert Smeets, 27 oktober 2006 Margreet Fogteloo, 27 oktober 2006 Duco Hellema, 27 oktober 2006 Willem de Vries, 27 oktober","['27 oktober 2006', '2006 Peter Vermaas,']","['2006', '2006 Willem de Vries,']",6,20,1,"[0.7333333333333333, 0.5238095238095238]",0.63
seq243-0,large,"Liever een geweten zonder eer, dan eer zonder geweten.  Schuld verhoudt zich tot schaamte als geweten tot eer",Liever een geweten <extra_id_0> zonder geweten. Schuld verhoudt zich tot schaamte als geweten tot eer,Liever een geweten dan een schuld zonder geweten. Schuld verhoudt zich tot schaamte als geweten tot eer,"['zonder eer', 'dan eer']",['dan een schuld'],4,20,1,[0.7857142857142857],0.79
seq244-0,large,We proberen het debat altijd heel snel terug te brengen tot een ethische kwestie.  3 juni 2015  verschenen in uit nr,<extra_id_0> altijd heel snel terug te brengen tot een ethische kwestie. 3 juni 2015 verschenen in uit nr,niet altijd heel snel terug te brengen tot een ethische kwestie. 3 juni 2015 verschenen in uit nr,['We proberen het debat'],['niet'],4,20,1,[0.8571428571428571],0.86
seq245-0,large,De bond stond erbij en keek ernaar De ziektewet is niet meer.  Waarom gaf de vakbeweging eigenlijk geen kik,De bond stond erbij en keek ernaar De ziektewet is niet meer. Waarom <extra_id_0> geen kik,De bond stond erbij en keek ernaar De ziektewet is niet meer. Waarom stond erbij en geen kik,['gaf de vakbeweging eigenlijk'],['stond erbij en'],4,20,1,[0.75],0.75
seq246-0,large,"door Robert-Jan Friele beeld Milo De verkiezingsleuzen waarmee de vvd duidelijk maakte hoe de partij over strafrecht denkt, stonden op borden langs de snelwegen, hingen overal in de steden en werden zelfs verspreid op viltjes.  Meer straf en minder begrip voor criminelen en Meeleven met slachtoffers, niet met daders, aldus de grootste partij van het land, die opnieuw de premier leverde","door Robert-Jan Friele beeld Milo De verkiezingsleuzen waarmee de vvd duidelijk maakte hoe de partij over strafrecht denkt, stonden op borden langs de snelwegen, hingen overal in de steden en werden zelfs verspreid op viltjes. Meer straf <extra_id_0> voor criminelen en Meeleven met slachtoffers, niet <extra_id_1> de grootste <extra_id_2> land, <extra_id_3> premier leverde","door Robert-Jan Friele beeld Milo De verkiezingsleuzen waarmee de vvd duidelijk maakte hoe de partij over strafrecht denkt, stonden op borden langs de snelwegen, hingen overal in de steden en werden zelfs verspreid op viltjes. Meer straf voor criminelen en Meeleven met slachtoffers, niet alleen in de grootste steden van het land, waren de leuzen die de premier leverde","['en minder begrip', 'met daders', 'aldus', 'partij van het', 'die opnieuw de']","['', 'alleen in', 'steden van het', 'waren de leuzen die de']",12,20,1,"[1.0, 1.0, 0.9285714285714286, 0.7272727272727273]",0.91
seq247-0,large,Pater familias: pass defini Tussen Jeruzalem en Mekka zijn niet veel bomen te vinden.  De natuur is er weinig vrijgevig,Pater familias: pass defini Tussen Jeruzalem en Mekka zijn niet veel bomen <extra_id_0> is er weinig vrijgevig,Pater familias: pass defini Tussen Jeruzalem en Mekka zijn niet veel bomen en daardoor is er weinig vrijgevig,['te vinden. De natuur'],['en daardoor'],4,20,1,[0.8],0.8
seq248-0,large,"Essay Essay: Het algemeen belang raakt in de knel door Yvonne Zonderop beeld Milo Veel Nederlanders nemen hun cultuur nogal vanzelfsprekend, maar in de ogen van buitenlanders die met ons moeten werken zijn wij maar een bijzonder land.  Topman Spinetti van AirFrance-klm omschreef het laatst in Het Financieele Dagblad als volgt: Als de baas in Frankrijk aan tafel zit met medewerkers, voert de baas het woord en luisteren de medewerkers","Essay Essay: Het algemeen belang raakt in de knel door Yvonne Zonderop beeld Milo Veel Nederlanders nemen hun cultuur nogal vanzelfsprekend, maar in <extra_id_0> buitenlanders die met ons moeten werken zijn wij <extra_id_1> land. Topman Spinetti van AirFrance-klm <extra_id_2> laatst in <extra_id_3> als volgt: Als de baas in Frankrijk aan <extra_id_4> medewerkers, voert de baas het woord en luisteren de medewerkers","Essay Essay: Het algemeen belang raakt in de knel door Yvonne Zonderop beeld Milo Veel Nederlanders nemen hun cultuur nogal vanzelfsprekend, maar in gesprek met buitenlanders die met ons moeten werken zijn wij een ander land. Topman Spinetti van AirFrance-klm zei laatst in een interview als volgt: Als de baas in Frankrijk aan het woord is bij zijn medewerkers, voert de baas het woord en luisteren de medewerkers","['de ogen van', 'maar een bijzonder', 'omschreef het', 'Het Financieele Dagblad', 'tafel zit met']","['gesprek met', 'een ander', 'zei', 'een interview', 'het woord is bij zijn']",14,20,1,"[0.7272727272727273, 0.5555555555555556, 0.9230769230769231, 0.782608695652174, 0.8095238095238095]",0.76
seq249-0,large,"De slapende cellen van Europa De Amerikaanse kritiek dat Europa moslimmigranten in de watten legt en daarmee islamitisch terrorisme in de hand werkt mag dan te ver gaan, feit is dat Europa onderdak biedt aan fundamentalistische groeperingen zoals al-Qaeda.  Zijn de Europeanen soft on islam zoals ze tijdens de Koude Oorlog soft on communism waren","De slapende cellen van Europa De Amerikaanse kritiek dat Europa moslimmigranten in de watten legt en daarmee islamitisch terrorisme in de hand werkt mag dan te ver gaan, <extra_id_0> Europa onderdak biedt aan fundamentalistische groeperingen zoals al-Qaeda. <extra_id_1> soft on islam zoals ze tijdens <extra_id_2> soft on <extra_id_3>","De slapende cellen van Europa De Amerikaanse kritiek dat Europa moslimmigranten in de watten legt en daarmee islamitisch terrorisme in de hand werkt mag dan te ver gaan, het is niet zo dat Europa onderdak biedt aan fundamentalistische groeperingen zoals al-Qaeda. Het is soft on islam zoals ze tijdens de soft on islam-campagne","['feit is dat', 'Zijn de Europeanen', 'de Koude Oorlog', 'communism waren']","['het is niet zo dat', 'Het is', 'de', 'islam-campagne']",11,20,1,"[0.5555555555555556, 0.9444444444444444, 0.8666666666666667, 0.8666666666666667]",0.81
