seq34-0,small,"De prijs voor Hollandse garnalen is zo hoog opgelopen dat restaurants garnalencocktails en kroketten van de menukaart halen. Het is exemplarisch voor de situatie van de Nederlandse visserij. De sector maakte in 2023 een verlies van 3,1 miljoen euro, aldus onderzoekers van Universiteit Wageningen.","De prijs voor <extra_id_0> zo <extra_id_1> garnalencocktails en kroketten van de menukaart halen. Het is exemplarisch voor de situatie van de Nederlandse visserij. De sector maakte in 2023 een verlies van 3,1 miljoen euro, aldus onderzoekers van Universiteit Wageningen.","De prijs voor de producten zo garnalencocktails en kroketten van de menukaart halen. Het is exemplarisch voor de situatie van de Nederlandse visserij. De sector maakte in 2023 een verlies van 3,1 miljoen euro, aldus onderzoekers van Universiteit Wageningen.","['Hollandse garnalen is', 'hoog opgelopen dat restaurants']","['de producten', '']",7,15,1,"[0.8095238095238095, 1.0]",0.9
seq35-0,small,Uitvoeringsinstanties zoals de Belastingdienst en het UWV moeten een rode kaart kunnen trekken als ze worden gedwongen beleid uit te voeren dat burgers in de knel brengt.,<extra_id_0> en het UWV moeten een rode kaart kunnen trekken als ze worden gedwongen beleid uit te voeren dat burgers in de knel brengt.,De CDU en het UWV moeten een rode kaart kunnen trekken als ze worden gedwongen beleid uit te voeren dat burgers in de knel brengt.,['Uitvoeringsinstanties zoals de Belastingdienst'],['De CDU'],4,15,1,[0.9565217391304348],0.96
seq36-0,small,Het Nederlands elftal begint maandag aan een reis die idealiter zondag 14 juli eindigt met de EK finale in Berlijn.,Het Nederlands elftal begint maandag aan een reis die idealiter zondag 14 juli <extra_id_0> EK finale in Berlijn.,Het Nederlands elftal begint maandag aan een reis die idealiter zondag 14 juli starten met de EK finale in Berlijn.,['eindigt met de'],['starten met de'],3,15,1,[0.5],0.5
seq37-0,small,"Garry Conille, nog geen twee weken geleden als tijdelijke premier van Hati aangesteld, is zaterdag in het ziekenhuis in Port-au-Prince opgenomen.","Garry Conille, nog geen twee weken geleden als tijdelijke premier van <extra_id_0> zaterdag in het ziekenhuis in Port-au-Prince opgenomen.","Garry Conille, nog geen twee weken geleden als tijdelijke premier van de nationale verkiezingen, zaterdag in het ziekenhuis in Port-au-Prince opgenomen.","['Hati aangesteld', 'is']","['de nationale verkiezingen,']",3,15,1,[0.7692307692307693],0.77
seq38-0,small,"Op amper 3 minuten van de grens bij Enschede, in Gronau, runt Gerhard Becker (58) zijn nieuwe winkel Tabak XXL. Een paradijs voor rokers die hoge accijnzen willen ontwijken. Twentse supermarkten balen, Duitse ondernemers profiteren. Ze halen winkelkarren vol shag.","Op amper 3 minuten van de grens bij Enschede, in Gronau, runt Gerhard Becker (58) zijn nieuwe winkel Tabak XXL. Een paradijs voor rokers <extra_id_0> willen ontwijken. Twentse supermarkten <extra_id_1> profiteren. Ze halen winkelkarren vol shag.","Op amper 3 minuten van de grens bij Enschede, in Gronau, runt Gerhard Becker (58) zijn nieuwe winkel Tabak XXL. Een paradijs voor rokers die zich willen ontwijken. Twentse supermarkten gaan profiteren. Ze halen winkelkarren vol shag.","['die hoge accijnzen', 'balen', 'Duitse ondernemers']","['die zich', 'gaan']",6,15,1,"[0.7222222222222222, 0.6]",0.66
seq39-0,small,Primoz Roglic heeft Critrium du Dauphin op zijn naam geschreven. De Sloveen van BORA-hansgrohe sloot de Franse rittenkoers af met een voorsprong van acht seconden ten opzichte van Matteo Jorgensen van Visma-Lease a Bike. Carlos Rodriguez won de laatste etappe.,Primoz Roglic heeft Critrium du Dauphin <extra_id_0> geschreven. De Sloveen van BORA-hansgrohe sloot de Franse rittenkoers af met een voorsprong van acht seconden ten opzichte <extra_id_1> van Visma-Lease a Bike. Carlos Rodriguez won de laatste etappe.,Primoz Roglic heeft Critrium du Dauphin geschreven. De Sloveen van BORA-hansgrohe sloot de Franse rittenkoers af met een voorsprong van acht seconden ten opzichte van de Duitsers van Visma-Lease a Bike. Carlos Rodriguez won de laatste etappe.,"['op zijn naam', 'van Matteo Jorgensen']","['', 'van de Duitsers']",6,15,1,"[1.0, 0.65]",0.82
seq40-0,small,"De eindexamens in het voortgezet onderwijs zijn op stoom. De komende weken doet de Volkskrant verslag. Debbie de Jong, deelnemer aan het reality programma B&B Vol Liefde, buigt zich over het examen Spaans voor vmbo gl/tl, de gemengde en theoretische leerweg.","De eindexamens in het voortgezet onderwijs zijn op stoom. De komende weken doet de Volkskrant verslag. Debbie de Jong, deelnemer aan het reality programma B&B <extra_id_0> zich over het examen Spaans <extra_id_1> de gemengde en theoretische leerweg.","De eindexamens in het voortgezet onderwijs zijn op stoom. De komende weken doet de Volkskrant verslag. Debbie de Jong, deelnemer aan het reality programma B&B spreekt zich over het examen Spaans en de gemengde en theoretische leerweg.","['Vol Liefde', 'buigt', 'voor vmbo gl/tl,']","['spreekt', 'en']",6,15,1,"[0.9, 1.0]",0.95
seq41-0,small,"Iedereen was enthousiast over de methode-Laurentien voor de compensatie van toeslagenouders, totdat de uitgekeerde bedragen bekend werden  gemiddeld ruim 120 duizend euro per gedupeerde.","Iedereen was enthousiast over de methode-Laurentien voor de compensatie van toeslagenouders, totdat <extra_id_0> werden gemiddeld ruim 120 duizend euro per gedupeerde.","Iedereen was enthousiast over de methode-Laurentien voor de compensatie van toeslagenouders, totdat we werden gemiddeld ruim 120 duizend euro per gedupeerde.",['de uitgekeerde bedragen bekend'],['we'],4,15,1,[0.9666666666666667],0.97
seq42-0,small,"De gemeente Zundert schitterde dinsdag bij de Raad van State door afwezigheid, terwijl rechter Jan van Breda heel wat vragen wilde stellen over het campingbeleid van de gemeente.","De gemeente Zundert schitterde dinsdag bij de Raad van State door afwezigheid, terwijl rechter Jan van Breda heel wat vragen wilde stellen over het <extra_id_0>","De gemeente Zundert schitterde dinsdag bij de Raad van State door afwezigheid, terwijl rechter Jan van Breda heel wat vragen wilde stellen over het nieuwe besluit.",['campingbeleid van de gemeente.'],['besluit.'],4,15,1,[0.8333333333333334],0.83
seq43-0,small,Nigerianen tonen opvallend veel begrip voor de staking die het hele land in het donker heeft gezet.,Nigerianen tonen opvallend veel begrip <extra_id_0> die het hele land in het donker heeft gezet.,Nigerianen tonen opvallend veel begrip van de situatie die het hele land in het donker heeft gezet.,['voor de staking'],['van de situatie'],3,15,1,[0.5333333333333333],0.53
seq44-0,small,Deze donderdagmiddag neemt de Europese Centrale Bank 99 procent zeker een besluit waar de financile markten al maanden smachtend naar uitkijken: een renteverlaging. Maar loopt de ECB daarmee niet het gevaar dat de inflatie weer de lucht in schiet?,Deze donderdagmiddag neemt de Europese Centrale Bank 99 procent zeker een besluit waar de financile markten al maanden smachtend naar uitkijken: een renteverlaging. Maar loopt <extra_id_0> niet het gevaar dat de inflatie weer de <extra_id_1>,Deze donderdagmiddag neemt de Europese Centrale Bank 99 procent zeker een besluit waar de financile markten al maanden smachtend naar uitkijken: een renteverlaging. Maar loopt is niet het gevaar dat de inflatie weer de hoogte houden.,"['de ECB daarmee', 'lucht in schiet?']","['is', 'houden.']",6,15,1,"[1.0, 0.875]",0.94
seq45-0,small,"Bente van de Wouw (29) leefde jaren als extravert, terwijl ze toch echt heel introvert is.","Bente van de Wouw (29) leefde jaren als extravert, terwijl ze toch <extra_id_0> introvert is.","Bente van de Wouw (29) leefde jaren als extravert, terwijl ze toch al introvert is.",['echt heel'],['al'],2,15,1,[0.8888888888888888],0.89
seq46-0,small,Na eerdere problemen rond de vergunning mag de bouw van een boorplatform in de Noordzee worden hervat.,Na eerdere problemen rond de vergunning mag de bouw van een <extra_id_0> Noordzee worden hervat.,Na eerdere problemen rond de vergunning mag de bouw van een nieuwe wijk in de Noordzee worden hervat.,['boorplatform in de'],['nieuwe wijk in de'],3,15,1,[0.6666666666666666],0.67
seq47-0,small,"Nederlanders douchen steeds meer, liefst twee keer per dag, met warm water en veel sop. Volgens dermatologen is dat echt te veel voor onze huid.","Nederlanders douchen steeds <extra_id_0> per dag, met warm water en veel sop. Volgens dermatologen is dat echt te veel voor onze huid.","Nederlanders douchen steeds beter per dag, met warm water en veel sop. Volgens dermatologen is dat echt te veel voor onze huid.","['meer', 'liefst twee keer']",['beter'],4,15,1,[0.4],0.4
seq48-0,small,"Griekenland stuurt asielzoekers die al aan land zijn terug de zee op en laat hen achter in rubberbootjes, hebben ngos en journalisten gedocumenteerd.","Griekenland stuurt asielzoekers die al aan land zijn terug de zee op <extra_id_0> achter in rubberbootjes, hebben ngos en journalisten gedocumenteerd.","Griekenland stuurt asielzoekers die al aan land zijn terug de zee op en achter in rubberbootjes, hebben ngos en journalisten gedocumenteerd.",['en laat hen'],['en'],3,15,1,[0.8181818181818182],0.82
seq49-0,small,"De Haagse buurttuin van Janneke Vreugdenhil is een democratie: iedereen heeft een zegje, iedereen een taak. En vervolgens loopt alles altijd anders.","De Haagse buurttuin van Janneke Vreugdenhil is een democratie: iedereen heeft een zegje, iedereen een <extra_id_0> loopt alles altijd anders.","De Haagse buurttuin van Janneke Vreugdenhil is een democratie: iedereen heeft een zegje, iedereen een voorbeeld. Dan loopt alles altijd anders.",['taak. En vervolgens'],['voorbeeld. Dan'],3,15,1,[0.8947368421052632],0.89
seq50-0,small,"Juichen, incasseren of beleefd applaudiseren: de aanhang van de verschillende partijen reageert op de exitpoll. Met n zetel meer was het feest compleet geweest.","Juichen, incasseren of beleefd applaudiseren: de aanhang van de verschillende partijen reageert op de exitpoll. Met <extra_id_0> het feest compleet geweest.","Juichen, incasseren of beleefd applaudiseren: de aanhang van de verschillende partijen reageert op de exitpoll. Met de app is het feest compleet geweest.",['n zetel meer was'],['de app is'],4,15,1,[0.75],0.75
seq51-0,small,Vijf jaar geleden trad de Europese Commissie onder leiding van Ursula von der Leyen aan. Het werd een periode van grote crises en onverwachte gebeurtenissen die een ferme reactie vereisten.,Vijf jaar geleden trad de Europese Commissie onder leiding van Ursula von der Leyen aan. Het werd een periode van grote crises en onverwachte gebeurtenissen <extra_id_0> vereisten.,Vijf jaar geleden trad de Europese Commissie onder leiding van Ursula von der Leyen aan. Het werd een periode van grote crises en onverwachte gebeurtenissen die de EU vereisten.,['die een ferme reactie'],['die de EU'],4,15,1,[0.7142857142857143],0.71
seq52-0,small,De aankondiging van een kabinet met de PVV verdeelt de toch al gesegregeerde Vrijheidswijk in Leeuwarden nog verder.,De aankondiging van een kabinet met de PVV verdeelt de toch al gesegregeerde Vrijheidswijk <extra_id_0> verder.,De aankondiging van een kabinet met de PVV verdeelt de toch al gesegregeerde Vrijheidswijk verder.,['in Leeuwarden nog'],[''],3,15,1,[1.0],1.0
seq53-0,small,"Stoelen, banken, pallets, fietsen  de barricades die zijn opgeworpen door de demonstranten die het universiteitsgebouw in de Amsterdamse binnenstad hebben bezet, blijken weinig partij voor de ME.","Stoelen, banken, pallets, fietsen de barricades die zijn opgeworpen door de demonstranten die het universiteitsgebouw <extra_id_0> hebben bezet, blijken weinig partij voor de ME.","Stoelen, banken, pallets, fietsen de barricades die zijn opgeworpen door de demonstranten die het universiteitsgebouw in de wijk hebben bezet, blijken weinig partij voor de ME.",['in de Amsterdamse binnenstad'],['in de wijk'],4,15,1,[0.75],0.75
seq54-0,small,"Opgegeten slablaadjes, hostas met grote gaten erin en jonggestorven stekjes. Voor de naaktslak is het een buitengewoon goed jaar. Op slakkenjacht met zussen Claudette en Mavis in hun Duivendrechtse volkstuin. Vorige week zaten we op vijfduizend slakken, nu op meer dan zesduizend.","Opgegeten slablaadjes, hostas met grote gaten erin en jonggestorven stekjes. Voor <extra_id_0> het een buitengewoon goed jaar. Op slakkenjacht met zussen Claudette en <extra_id_1> Duivendrechtse volkstuin. Vorige week zaten we op vijfduizend slakken, nu op meer dan zesduizend.","Opgegeten slablaadjes, hostas met grote gaten erin en jonggestorven stekjes. Voor voor kinderen is het een buitengewoon goed jaar. Op slakkenjacht met zussen Claudette en Gerard in de Duivendrechtse volkstuin. Vorige week zaten we op vijfduizend slakken, nu op meer dan zesduizend.","['de naaktslak is', 'Mavis in hun']","['voor kinderen is', 'Gerard in de']",6,15,1,"[0.8125, 0.75]",0.78
seq55-0,small,Tallon Griekspoor neemt het dinsdag in de eerste ronde van Roland Garros op tegen de Amerikaan MacKenzie McDonald.,Tallon Griekspoor neemt het dinsdag in de eerste ronde van Roland Garros op tegen <extra_id_0> McDonald.,Tallon Griekspoor neemt het dinsdag in de eerste ronde van Roland Garros op tegen de McDonald.,['de Amerikaan MacKenzie'],['de'],3,15,1,[0.9090909090909091],0.91
seq56-0,small,De luchthaven mag volgend jaar toch meer vluchten uitvoeren dan de regering twee jaar geleden aankondigde. De geluidshinder van de luchthaven wil het kabinet nu bestrijden met extra operationele maatregelen.,De luchthaven mag volgend jaar toch meer vluchten uitvoeren dan de regering twee jaar geleden aankondigde. De <extra_id_0> wil het kabinet nu bestrijden met extra operationele maatregelen.,De luchthaven mag volgend jaar toch meer vluchten uitvoeren dan de regering twee jaar geleden aankondigde. De vluchten wil het kabinet nu bestrijden met extra operationele maatregelen.,['geluidshinder van de luchthaven'],['vluchten'],4,15,1,[0.7419354838709677],0.74
seq57-0,small,"De methode van prinses Laurentien om de aanvullende schade van toeslagenouders te compenseren, mag van het ministerie alleen doorgaan als haar stichting bereid is de door het kabinet gewenste aanpassingen door te voeren.",De methode van prinses Laurentien om de aanvullende schade van toeslagenouders te <extra_id_0> van het ministerie alleen doorgaan als haar stichting bereid is de <extra_id_1> gewenste aanpassingen door te voeren.,De methode van prinses Laurentien om de aanvullende schade van toeslagenouders te voorkomen kan van het ministerie alleen doorgaan als haar stichting bereid is de door haar gewenste aanpassingen door te voeren.,"['compenseren', 'mag', 'door het kabinet']","['voorkomen kan', 'door haar']",5,15,1,"[0.7692307692307693, 0.8888888888888888]",0.83
seq58-0,small,"De prijzen van woningen in Nederland zullen tot en met 2026 jaarlijks met 4 procent stijgen. Dat meldt De Nederlandsche Bank (DNB) bij de presentatie van de Voorjaarsramingen, de halfjaarlijkse voorspellingen voor de Nederlandse economie.",De prijzen van woningen in Nederland zullen tot en met 2026 jaarlijks met 4 procent stijgen. Dat meldt De Nederlandsche Bank (DNB) <extra_id_0> van <extra_id_1> de halfjaarlijkse voorspellingen voor de Nederlandse economie.,De prijzen van woningen in Nederland zullen tot en met 2026 jaarlijks met 4 procent stijgen. Dat meldt De Nederlandsche Bank (DNB) in een van de resultaten van de halfjaarlijkse voorspellingen voor de Nederlandse economie.,"['bij de presentatie', 'de Voorjaarsramingen,']","['in een', 'de resultaten van']",5,15,1,"[0.7222222222222222, 0.7142857142857143]",0.72
seq59-0,small,"Honderden paginas aan ambtelijk commentaar op het Hoofdlijnenakkoord van PVV, VVD, NSC en BBB zijn vrijgegeven. Er zijn grote vraagtekens op allerlei terreinen, van het buitenlandbeleid en defensie tot landbouw en sociale zekerheid.","Honderden paginas aan ambtelijk commentaar op het Hoofdlijnenakkoord van PVV, VVD, NSC en BBB zijn vrijgegeven. Er zijn grote vraagtekens op allerlei terreinen, van het <extra_id_0> tot landbouw en <extra_id_1>","Honderden paginas aan ambtelijk commentaar op het Hoofdlijnenakkoord van PVV, VVD, NSC en BBB zijn vrijgegeven. Er zijn grote vraagtekens op allerlei terreinen, van het publiek tot landbouw en politieke samenwerking.","['buitenlandbeleid en defensie', 'sociale zekerheid.']","['publiek', 'samenwerking.']",5,15,1,"[0.8214285714285714, 0.6666666666666666]",0.74
seq60-0,small,"De herdenking van de landing van de geallieerden in Normandi roept vragen op over waar het Westen anno 2024 staat. De meest prangende is of westerse landen, twee jaar na de invasie in Oekrane, de wil en moed hebben om agressors te bestrijden.","De herdenking van de landing van de geallieerden in Normandi roept vragen op over waar het Westen anno <extra_id_0> meest prangende is of westerse landen, twee jaar <extra_id_1> in Oekrane, de wil en moed hebben om agressors te bestrijden.","De herdenking van de landing van de geallieerden in Normandi roept vragen op over waar het Westen anno 2020 de meest prangende is of westerse landen, twee jaar geleden in Oekrane, de wil en moed hebben om agressors te bestrijden.","['2024 staat. De', 'na de invasie']","['2020 de', 'geleden']",6,15,1,"[0.6428571428571429, 0.8461538461538461]",0.74
seq61-0,small,Tijdens de eerste twee dagen van festival Best Kept Secret was het de New Yorkse St.,Tijdens de eerste twee dagen van <extra_id_0> Kept Secret was het de New Yorkse St.,Tijdens de eerste twee dagen van het Kept Secret was het de New Yorkse St.,['festival Best'],['het'],2,15,1,[0.8461538461538461],0.85
seq62-0,small,Vijf jaar na de stikstofuitspraak van de Raad van State is een oplossing van het probleem nog lang niet in zicht.,Vijf jaar na de stikstofuitspraak van de Raad van State is een oplossing van <extra_id_0> lang niet in zicht.,Vijf jaar na de stikstofuitspraak van de Raad van State is een oplossing van de zaak lang niet in zicht.,['het probleem nog'],['de zaak'],3,15,1,[0.875],0.88
seq63-0,small,Miljoenen Afghanen leven onder de armoedegrens. Buitenlandse donoren bieden weinig hulp omdat de Taliban vrouwenrechten drastisch beperkten. Vermindering van de internationale hulp zal dezelfde Afghaanse vrouwen die we hopen te steunen alleen maar meer laten lijden.,Miljoenen Afghanen leven onder de armoedegrens. Buitenlandse donoren bieden weinig hulp omdat de <extra_id_0> drastisch beperkten. Vermindering van de internationale hulp zal dezelfde Afghaanse vrouwen die we hopen te steunen alleen maar <extra_id_1>,Miljoenen Afghanen leven onder de armoedegrens. Buitenlandse donoren bieden weinig hulp omdat de armoedegrens zich drastisch beperkten. Vermindering van de internationale hulp zal dezelfde Afghaanse vrouwen die we hopen te steunen alleen maar verminderen.,"['Taliban vrouwenrechten', 'meer laten lijden.']","['armoedegrens zich', 'verminderen.']",5,15,1,"[0.8181818181818182, 0.6666666666666666]",0.74
seq64-0,small,"Een jong meisje werd door drie jongens meegenomen naar een huis en daar de hele nacht misbruikt. Maar het beeld van deze zaak, die eerst helder leek, begon te kantelen toen de politie de telefoons doorzocht.","Een jong meisje werd door drie jongens meegenomen naar een huis en <extra_id_0> nacht misbruikt. Maar het beeld van deze zaak, die eerst helder leek, begon te kantelen toen de <extra_id_1> telefoons doorzocht.","Een jong meisje werd door drie jongens meegenomen naar een huis en werd in de nacht misbruikt. Maar het beeld van deze zaak, die eerst helder leek, begon te kantelen toen de jongens telefoons doorzocht.","['daar de hele', 'politie de']","['werd in de', 'jongens']",5,15,1,"[0.75, 0.8]",0.78
seq65-0,small,"Het rioolwater van huishoudens en bedrijven is een complexe cocktail van medicijnresten, cosmetische producten en chemische stoffen. Zuiveringsinstallaties krijgen het moeilijk weer schoon. Daarom moet het systeem op de schop, vindt de Europese Unie.","Het rioolwater van huishoudens en bedrijven is een complexe cocktail van medicijnresten, cosmetische producten en chemische stoffen. Zuiveringsinstallaties krijgen <extra_id_0> weer schoon. Daarom moet het systeem op de schop, <extra_id_1> Unie.","Het rioolwater van huishoudens en bedrijven is een complexe cocktail van medicijnresten, cosmetische producten en chemische stoffen. Zuiveringsinstallaties krijgen het weer schoon. Daarom moet het systeem op de schop, aldus de Europese Unie.","['het moeilijk', 'vindt de Europese']","['het', 'aldus de Europese']",5,15,1,"[0.75, 0.29411764705882354]",0.52
seq66-0,small,Een wetsvoorstel moet gegevensuitwisselingen tussen de overheidsdiensten en onder meer banken legaliseren. Tegenstanders van het voorstel vrezen een herhaling van de Toeslagenaffaire. Dinsdag buigt de Eerste Kamer zich erover.,Een wetsvoorstel moet gegevensuitwisselingen tussen de overheidsdiensten en onder meer banken legaliseren. Tegenstanders van het voorstel vrezen een herhaling van de Toeslagenaffaire. Dinsdag <extra_id_0> zich erover.,Een wetsvoorstel moet gegevensuitwisselingen tussen de overheidsdiensten en onder meer banken legaliseren. Tegenstanders van het voorstel vrezen een herhaling van de Toeslagenaffaire. Dinsdag meldde de wet zich erover.,['buigt de Eerste Kamer'],['meldde de wet'],4,15,1,[0.7142857142857143],0.71
seq67-0,small,"Voor het eerst in de geschiedenis is er tijdens het aardbeienfeest geen koningin, maar een koning. Hein Gommers (22) is de trotse koning tijdens de veertigste editie van het aardbeienfeest in Zundert. ,,Ik heb het altijd heel leuk gevonden.","Voor het eerst in de geschiedenis is er tijdens het aardbeienfeest geen koningin, maar een koning. Hein Gommers (22) is de <extra_id_0> de veertigste editie van het aardbeienfeest in <extra_id_1> het altijd heel leuk gevonden.","Voor het eerst in de geschiedenis is er tijdens het aardbeienfeest geen koningin, maar een koning. Hein Gommers (22) is de leider van de veertigste editie van het aardbeienfeest in Nederland. Maar ook hier is het altijd heel leuk gevonden.","['trotse koning tijdens', 'Zundert. ,,Ik heb']","['leider van', 'Nederland. Maar ook hier is']",6,15,1,"[0.8571428571428571, 0.7037037037037037]",0.78
seq68-0,small,Ook op studie- en schoolboeken gaat de btw omhoog. Scholen en universiteiten reageren teleurgesteld,Ook op studie- en schoolboeken gaat de btw <extra_id_0> en universiteiten reageren teleurgesteld,Ook op studie- en schoolboeken gaat de btw Studenten en universiteiten reageren teleurgesteld,['omhoog. Scholen'],['Studenten'],2,15,1,[0.8666666666666667],0.87
seq69-0,small,"Als het aan Componist des Vaderlands Anne-Maartje Lemereis ligt, wordt muziekonderwijs toegankelijk voor elk kind in Nederland: Onderwijs in muziek kan een kind creatiever, slimmer en gelukkiger maken.","Als het aan Componist des Vaderlands Anne-Maartje Lemereis ligt, wordt muziekonderwijs toegankelijk voor <extra_id_0> Onderwijs in muziek kan een kind creatiever, slimmer en gelukkiger maken.","Als het aan Componist des Vaderlands Anne-Maartje Lemereis ligt, wordt muziekonderwijs toegankelijk voor kinderen. Onderwijs in muziek kan een kind creatiever, slimmer en gelukkiger maken.",['elk kind in Nederland:'],['kinderen.'],4,15,1,[0.6818181818181818],0.68
seq70-0,small,"Lieke Martens kon met een overwinning afscheid van het thuispubliek. Maar ze laat een kwetsbaar team achter, waarvan niemand vooralsnog kan inschatten waartoe het in staat is.","Lieke Martens <extra_id_0> afscheid van het thuispubliek. Maar ze laat een kwetsbaar team achter, waarvan niemand vooralsnog kan inschatten waartoe het in staat is.","Lieke Martens neemt afscheid van het thuispubliek. Maar ze laat een kwetsbaar team achter, waarvan niemand vooralsnog kan inschatten waartoe het in staat is.",['kon met een overwinning'],['neemt'],4,15,1,[0.8695652173913043],0.87
seq71-0,small,Planbureau voor de Leefomgeving Het PBL roept provincies en Rijk op meer samen te werken om het nieuwe nationaal omgevingsbeleid van de grond te krijgen. En daarnaast schiet de uitvoeringscapaciteit enorm tekort.,Planbureau voor de Leefomgeving Het PBL roept <extra_id_0> op meer samen te werken om het nieuwe nationaal omgevingsbeleid <extra_id_1> grond te krijgen. En daarnaast schiet de uitvoeringscapaciteit enorm tekort.,Planbureau voor de Leefomgeving Het PBL roept organisaties op meer samen te werken om het nieuwe nationaal omgevingsbeleid op de grond te krijgen. En daarnaast schiet de uitvoeringscapaciteit enorm tekort.,"['provincies en Rijk', 'van de']","['organisaties', 'op de']",5,15,1,"[0.7222222222222222, 0.5]",0.61
seq72-0,small,"Door middel van misleiding kunnen legers zich groter maken dan ze zijn. Het concept was bij het Westen wat uit de gratie geraakt, maar is door de oorlog in Oekrane weer terug.","Door middel van misleiding kunnen legers zich groter maken <extra_id_0> Het concept was bij het Westen wat uit de gratie geraakt, maar is door de oorlog in <extra_id_1> terug.","Door middel van misleiding kunnen legers zich groter maken Het concept was bij het Westen wat uit de gratie geraakt, maar is door de oorlog in de jaren terug.","['dan ze zijn.', 'Oekrane weer']","['', 'de jaren']",5,15,1,"[1.0, 0.75]",0.88
seq73-0,small,"India zucht onder de extreme hitte. Maar klimaatverandering was nauwelijks een thema bij de verkiezingen, waarvan dinsdag de uitslag wordt verwacht.",India zucht onder de extreme hitte. Maar klimaatverandering was nauwelijks een thema bij <extra_id_0> dinsdag de uitslag wordt verwacht.,"India zucht onder de extreme hitte. Maar klimaatverandering was nauwelijks een thema bij de veranderingen, waarvan dinsdag de uitslag wordt verwacht.","['de verkiezingen', 'waarvan']","['de veranderingen, waarvan']",3,15,1,[0.52],0.52
