Sequence id,Model size,Input sequence (ground truth),Input sequence (masked),Model output sequence,Masked tokens,Filled tokens,Number of masked tokens,Masking percentage,Duplicate count,Levenshtein distances,Levenshtein distance (avg)
seq0-0,small,"In de rubriek Aan de grens bericht De Groene over de laatste cijfers en ontwikkelingen op het gebied van vluchtelingen, migranten en grensbeleid. Deze week:","In de rubriek Aan de grens bericht De <extra_id_0> laatste cijfers <extra_id_1> het <extra_id_2> vluchtelingen, migranten en grensbeleid. Deze week:","In de rubriek Aan de grens bericht De laatste cijfers De laatste cijfers van het nieuwe beleid vluchtelingen, migranten en grensbeleid. Deze week:","['Groene over de', 'en ontwikkelingen op', 'gebied van']","['laatste cijfers De', 'van', 'nieuwe beleid']",8,30.0,24,"[0.6666666666666666, 0.95, 0.8461538461538461]",0.82
seq1-0,small,In zijn Kleine encyclopedie schetst Herman Vuijsje nieuwe inzichten over Nederland aan de hand van neologismen. Deze week:,In zijn Kleine encyclopedie schetst Herman Vuijsje <extra_id_0> over Nederland aan de hand van <extra_id_1>,In zijn Kleine encyclopedie schetst Herman Vuijsje de verhalen over Nederland aan de hand van de verhalen.,"['nieuwe inzichten', 'neologismen. Deze week:']","['de verhalen', 'verhalen.']",5,30.0,17,"[0.75, 0.8260869565217391]",0.79
seq2-0,small, altijd meer dan ze kan of wil bespreken. Hier doet ze verslag van haar bevindingen en overwegingen bij de boeken die ze leest. Deze week:,altijd meer dan ze kan of wil bespreken. <extra_id_0> verslag van haar bevindingen <extra_id_1> bij <extra_id_2> ze leest. Deze week:,altijd meer dan ze kan of wil bespreken. Een verslag van haar bevindingen is bij iets wat ze leest. Deze week:,"['Hier doet ze', 'en overwegingen', 'de boeken die']","['Een', 'is', 'iets wat']",8,30.0,14,"[0.9166666666666666, 0.9333333333333333, 0.8461538461538461]",0.9
seq3-0,small,"De zomerslaap is voorbij, het politieke seizoen is begonnen. De enige die gedurende de lange, landerige zomer nog voor politieke opwinding wist te zorgen, was Frits Bolkestein. Of het nu een tv-optreden bij de VPRO was of een toespraak op een theaterfestival, de VVD-leider stond steeds weer in het nieuws. Met hem opent De Groene daarom het nieuwe politieke jaar.","De zomerslaap is voorbij, het politieke seizoen is begonnen. De enige die gedurende de lange, landerige zomer nog voor politieke opwinding wist te zorgen, <extra_id_0> Of het nu een tv-optreden bij de VPRO was <extra_id_1> op een theaterfestival, de VVD-leider <extra_id_2> in <extra_id_3> hem opent <extra_id_4> het <extra_id_5>","De zomerslaap is voorbij, het politieke seizoen is begonnen. De enige die gedurende de lange, landerige zomer nog voor politieke opwinding wist te zorgen, was politiek. Of het nu een tv-optreden bij de VPRO was of op een theaterfestival, de VVD-leider in de politieke strijd hem opent het politieke seizoen is begonnen.","['was Frits Bolkestein.', 'of een toespraak', 'stond steeds weer', 'het nieuws. Met', 'De Groene daarom', 'nieuwe politieke jaar.']","['was politiek.', 'of', '', 'de politieke strijd', '', 'begonnen.']",18,30.0,12,"[0.6190476190476191, 0.875, 1.0, 0.7894736842105263, 1.0, 0.8181818181818182]",0.85
seq4-0,small,Groene-redacteur Casper Thomas schrijft vanuit Washington over het Amerika van Donald Trump. In aflevering,Groene-redacteur Casper <extra_id_0> over het Amerika van Donald Trump. In aflevering,Groene-redacteur Casper van der Valk over het Amerika van Donald Trump. In aflevering,['Thomas schrijft vanuit Washington'],['van der Valk'],4,30.0,11,[0.8484848484848485],0.85
seq5-0,small,De vaste kunstcritici van De Groene Amsterdammer selecteerden de meest in het oog springende cultuur van het nieuwe kunstseizoen. Tip,De vaste kunstcritici van De Groene <extra_id_0> meest in <extra_id_1> cultuur van het nieuwe kunstseizoen. Tip,De vaste kunstcritici van De Groene Limburger is de meest in in de cultuur van het nieuwe kunstseizoen. Tip,"['Amsterdammer selecteerden de', 'het oog springende']","['Limburger is de', 'in de']",6,30.0,11,"[0.75, 0.7777777777777778]",0.76
seq6-0,small,. Onze podcast is elke vrijdagochtend gratis beschikbaar via groene.nl/podcasts en via de andere bekende podcastkanalen,. Onze podcast is elke <extra_id_0> beschikbaar via groene.nl/podcasts en via <extra_id_1> podcastkanalen,. Onze podcast is elke dag beschikbaar via groene.nl/podcasts en via de podcastkanalen,"['vrijdagochtend gratis', 'de andere bekende']","['dag', 'de']",5,30.0,10,"[0.8571428571428571, 0.8823529411764706]",0.87
seq7-0,small,Mira Feticu ziet overeenkomsten tussen de quarantaine ten tijde van de coronacrisis en haar leven in dictatoriaal Roemeni. Hoe hield ze zich staande onder het bewind van Ceauescu? Deel,Mira Feticu ziet overeenkomsten tussen de quarantaine ten tijde van de coronacrisis en haar leven <extra_id_0> Hoe hield ze <extra_id_1> het bewind <extra_id_2>,Mira Feticu ziet overeenkomsten tussen de quarantaine ten tijde van de coronacrisis en haar leven Hoe hield ze van het bewind -,"['in dictatoriaal Roemeni.', 'zich staande onder', 'van Ceauescu? Deel']","['', 'van', '-']",9,30.0,10,"[1.0, 0.8888888888888888, 1.0]",0.96
seq8-0,small,"Frans Verhagen is lid geworden van de PvdA, want op dit moment in de geschiedenis kun je niet meer blijven toekijken. Deze week:","<extra_id_0> geworden van de PvdA, <extra_id_1> moment in de geschiedenis kun je niet meer blijven toekijken. Deze week:","voorzitter geworden van de PvdA, dit moment in de geschiedenis kun je niet meer blijven toekijken. Deze week:","['Frans Verhagen is lid', 'want op dit']","['voorzitter', 'dit']",7,30.0,9,"[0.9047619047619048, 0.7272727272727273]",0.82
seq9-0,small,De komende weken zal Menno Grootveld stukken selecteren en vertalen van denkers over corona in de internationale pers. In aflevering,De komende weken zal Menno Grootveld stukken selecteren en vertalen van denkers <extra_id_0> de <extra_id_1> aflevering,De komende weken zal Menno Grootveld stukken selecteren en vertalen van denkers in de laatste aflevering,"['over corona in', 'internationale pers. In']","['in', 'laatste']",6,30.0,9,"[0.8571428571428571, 0.8695652173913043]",0.86
seq10-0,small,"Terwijl de pest op de deur klopte, vertelden de Florentijnse jongeren van Giovanni Boccaccio elkaar sterke verhalen over verliefdheid, waanzin en bedrog om de verveling van hun quarantaine te doorbreken. Nu, zevenhonderd jaar later, kunnen we die traditie voortzetten. Verteller nummer","Terwijl de <extra_id_0> deur klopte, vertelden <extra_id_1> van Giovanni Boccaccio elkaar sterke verhalen over verliefdheid, waanzin en bedrog <extra_id_2> van hun quarantaine te doorbreken. Nu, zevenhonderd jaar later, kunnen we <extra_id_3> Verteller nummer","Terwijl de de deur klopte, vertelden de verhalen van Giovanni Boccaccio elkaar sterke verhalen over verliefdheid, waanzin en bedrog om de geschiedenis van hun quarantaine te doorbreken. Nu, zevenhonderd jaar later, kunnen we onze Verteller nummer","['pest op de', 'de Florentijnse jongeren', 'om de verveling', 'die traditie voortzetten.']","['de', 'de verhalen', 'om de geschiedenis', 'onze']",12,30.0,8,"[0.8, 0.75, 0.5, 0.88]",0.73
seq11-0,small,Groene-redacteur Casper Thomas schrijft de komende tijd regelmatig vanuit Washington over het Amerika van Donald Trump. In aflevering,Groene-redacteur Casper Thomas schrijft de komende tijd regelmatig vanuit <extra_id_0> Amerika van Donald Trump. <extra_id_1>,Groene-redacteur Casper Thomas schrijft de komende tijd regelmatig vanuit de ambassade in Amerika van Donald Trump. -,"['Washington over het', 'In aflevering']","['de ambassade in', '-']",5,30.0,8,"[0.8947368421052632, 1.0]",0.95
seq12-0,small,De komende maanden onderzoeken journalisten Hidde Boersma en Janno Lanjouw hoe de Nederlandse landbouw de stap probeert te zetten naar een milieuvriendelijkere toekomst. Deze week:,De komende maanden onderzoeken journalisten <extra_id_0> en Janno <extra_id_1> Nederlandse landbouw de stap probeert te zetten naar een <extra_id_2> week:,De komende maanden onderzoeken journalisten Gerard en Janno de Nederlandse landbouw de stap probeert te zetten naar een nieuwe vraag. Vorige week:,"['Hidde Boersma', 'Lanjouw hoe de', 'milieuvriendelijkere toekomst. Deze']","['Gerard', 'de', 'nieuwe vraag. Vorige']",8,30.0,8,"[0.8461538461538461, 0.8571428571428571, 0.8]",0.83
seq13-0,small,"getelde doden en vermisten op de Middellandse Zee was deze week, volgens het Missing Migrants Project (IOM):","<extra_id_0> en vermisten op de Middellandse Zee was deze week, volgens <extra_id_1> Project (IOM):","en vermisten op de Middellandse Zee was deze week, volgens de IOM, een nieuwe bestemming. IOM Project (IOM):","['getelde doden', 'het Missing Migrants']","['', 'de IOM, een nieuwe bestemming. IOM']",5,30.0,7,"[1.0, 0.8235294117647058]",0.91
seq14-0,small,Ter gelegenheid van het verschijnen van het volledige vertaalde oeuvre van Sigmund Freud in Nederland herleest Hans Driessen,Ter gelegenheid van <extra_id_0> het volledige vertaalde oeuvre van Sigmund Freud in <extra_id_1> Hans Driessen,Ter gelegenheid van de uitvoering van het volledige vertaalde oeuvre van Sigmund Freud in het Duits door Hans Driessen,"['het verschijnen van', 'Nederland herleest']","['de uitvoering van', 'het Duits door']",5,30.0,7,"[0.631578947368421, 0.8888888888888888]",0.76
seq15-0,small,"de aflevering van Boeken FM, de literatuurpodcast van De Groene en uitgeverij Das Mag, bespreken Joost de Vries en Ellen Deckwitz onder leiding van Peter Buurman","de aflevering van Boeken FM, de literatuurpodcast van <extra_id_0> uitgeverij <extra_id_1> bespreken Joost de Vries en Ellen <extra_id_2> van Peter Buurman","de aflevering van Boeken FM, de literatuurpodcast van de uitgeverij van RTL, bespreken Joost de Vries en Ellen van der Velden van Peter Buurman","['De Groene en', 'Das Mag,', 'Deckwitz onder leiding']","['de', 'van RTL,', 'van der Velden']",8,30.0,7,"[0.9166666666666666, 0.625, 0.6363636363636364]",0.73
seq16-0,small,"Voor de blog Terug naar Welkom reist journalist Margalith Kleijwegt terug naar het Zuid-Afrikaanse Welkom, een mijnstadje dat ze 27 jaar geleden voor het eerst bezocht samen met fotograaf Ad van Denderen. In deel","Voor de blog Terug naar Welkom reist journalist Margalith Kleijwegt terug naar het Zuid-Afrikaanse Welkom, een <extra_id_0> 27 jaar geleden voor het <extra_id_1> met <extra_id_2> In deel","Voor de blog Terug naar Welkom reist journalist Margalith Kleijwegt terug naar het Zuid-Afrikaanse Welkom, een evenement dat 27 jaar geleden voor het eerst met publiek. In deel","['mijnstadje dat ze', 'eerst bezocht samen', 'fotograaf Ad van Denderen.']","['evenement dat', 'eerst', 'publiek.']",10,30.0,7,"[0.7058823529411765, 0.7368421052631579, 0.9230769230769231]",0.79
seq17-0,small,cultuurtips voor dit weekend (en de komende week)  De Groene Amsterdammer Kunst & Cultuur Aanbevolen,cultuurtips voor dit weekend (en de komende week) De Groene <extra_id_0> Aanbevolen,cultuurtips voor dit weekend (en de komende week) De Groene Gemeente Aanbevolen,['Amsterdammer Kunst & Cultuur'],['Gemeente'],4,30.0,6,[0.8214285714285714],0.82
seq18-0,small,"zit vol problemen die niemand lijkt te kunnen oplossen. Wie niet goed begrijpt hoe die wereld werkt, is niet gek of dom. Want de wereld s ook complexer, chaotischer en moeilijker te besturen dan voorheen. In een serie interviews laat De Groene","zit vol problemen die niemand <extra_id_0> Wie niet goed <extra_id_1> wereld werkt, is <extra_id_2> dom. Want de wereld s ook complexer, chaotischer en moeilijker te besturen dan voorheen. In een serie <extra_id_3> Groene","zit vol problemen die niemand kan begrijpen. Wie niet goed met de wereld werkt, is niet dom. Want de wereld s ook complexer, chaotischer en moeilijker te besturen dan voorheen. In een serie reportage over de Groene","['lijkt te kunnen oplossen.', 'begrijpt hoe die', 'niet gek of', 'interviews laat De']","['kan begrijpen.', 'met de', 'niet', 'reportage over de']",13,30.0,6,"[0.76, 0.6875, 0.6363636363636364, 0.7777777777777778]",0.72
seq19-0,small,"In aanloop naar de gemeenteraadsverkiezingen in Rotterdam, waar zowel alle landelijke politieke partijen als vele nieuwkomers aan deelnemen, bloggen Guido van Eijck en Saskia Naafs over de belangrijkste verkiezingsthemas in de Maasstad.","In aanloop <extra_id_0> in Rotterdam, waar zowel <extra_id_1> partijen als vele nieuwkomers aan deelnemen, bloggen Guido van Eijck en Saskia Naafs over de belangrijkste <extra_id_2>","In aanloop van de bijeenkomst in Rotterdam, waar zowel de partijen als vele nieuwkomers aan deelnemen, bloggen Guido van Eijck en Saskia Naafs over de belangrijkste onderwerpen.","['naar de gemeenteraadsverkiezingen', 'alle landelijke politieke', 'verkiezingsthemas in de Maasstad.']","['van de bijeenkomst', 'de', 'onderwerpen.']",10,30.0,6,"[0.7272727272727273, 0.92, 0.8787878787878788]",0.84
seq20-0,small,"virtuele rondleidingen door musea, spontane optredens op Instagram en een enkele all-time favourite van een van onze kunstcritici.","virtuele rondleidingen door musea, spontane <extra_id_0> Instagram en een <extra_id_1> van een van onze kunstcritici.","virtuele rondleidingen door musea, spontane gesprekken op Instagram en een presentatie van een van onze kunstcritici.","['optredens op', 'enkele all-time favourite']","['gesprekken op', 'presentatie']",5,30.0,6,"[0.5384615384615384, 0.76]",0.65
seq21-0,small,"Iedere maand selecteert de boekenredactie van De Groene, uit alle in de voorafgaande maand besproken boeken, d","Iedere maand selecteert <extra_id_0> van De <extra_id_1> in de voorafgaande maand besproken boeken, d","Iedere maand selecteert de schrijver van De boeken in de voorafgaande maand besproken boeken, d","['de boekenredactie', 'Groene', 'uit alle']","['de schrijver', 'boeken']",5,30.0,6,"[0.7647058823529411, 0.6666666666666666]",0.72
seq22-0,small,Marja Pruis leest altijd meer dan ze kan of wil bespreken. Hier doet ze verslag van haar bevindingen en overwegingen bij de boeken die ze leest. Deze week:,Marja Pruis leest altijd meer dan ze kan of wil <extra_id_0> ze verslag van haar bevindingen en overwegingen bij de <extra_id_1> ze <extra_id_2>,Marja Pruis leest altijd meer dan ze kan of wil Hier krijgt ze verslag van haar bevindingen en overwegingen bij de problemen die ze moet.,"['bespreken. Hier doet', 'boeken die', 'leest. Deze week:']","['Hier krijgt', 'problemen die', 'moet.']",8,30.0,6,"[0.8, 0.38461538461538464, 0.8235294117647058]",0.67
seq23-0,small,"- ZEER GEHEIM. MINISTERRAAD NR. 15616. Notulen van de vergadering gehouden dinsdag 11 juli 1995 op het ministerie van Defensie, aangevangen s avonds om half acht. pag.","- ZEER GEHEIM. MINISTERRAAD NR. 15616. Notulen van de vergadering gehouden dinsdag 11 juli 1995 <extra_id_0> van Defensie, aangevangen <extra_id_1> half <extra_id_2>","- ZEER GEHEIM. MINISTERRAAD NR. 15616. Notulen van de vergadering gehouden dinsdag 11 juli 1995 door de minister van Defensie, aangevangen in de half van de vergadering.","['op het ministerie', 's avonds om', 'acht. pag.']","['door de minister', 'in de', 'vergadering.']",8,30.0,6,"[0.4117647058823529, 0.8181818181818182, 0.8333333333333334]",0.69
