seq579-0,small,"VS). Mislukt sentimentele, bovendien ongeloofwaardige schoolbankfilm lijkt bedoeld als humanistische tragikomedie over de zegeningen van goed onderwijs.","VS). Mislukt sentimentele, bovendien ongeloofwaardige schoolbankfilm <extra_id_0> humanistische tragikomedie over de zegeningen van goed onderwijs.","VS). Mislukt sentimentele, bovendien ongeloofwaardige schoolbankfilm een humanistische tragikomedie over de zegeningen van goed onderwijs.",['lijkt bedoeld als'],['een'],3,15,6,[0.8823529411764706],0.88
seq580-0,small,"zomer door Europa op zoek naar de oostgrens van het continent. In een serie reisverhalen proberen Marc Hannemann, Sjoerd Keulen en Ronald Kroeze te ontdekken wat Europa nu eigenlijk is. Aflevering","zomer door Europa <extra_id_0> oostgrens van het continent. In een serie reisverhalen proberen Marc Hannemann, Sjoerd Keulen en Ronald Kroeze te ontdekken wat Europa nu eigenlijk is. Aflevering","zomer door Europa en de oostgrens van het continent. In een serie reisverhalen proberen Marc Hannemann, Sjoerd Keulen en Ronald Kroeze te ontdekken wat Europa nu eigenlijk is. Aflevering",['op zoek naar de'],['en de'],5,15,6,[0.6666666666666666],0.67
seq581-0,small,voor een nieuwe tranche van financile steun ter waarde van 12 miljard door Europese partners en het Internationaal Monetair Fonds.,voor een nieuwe tranche van financile steun ter waarde van 12 miljard <extra_id_0> en het Internationaal Monetair Fonds.,voor een nieuwe tranche van financile steun ter waarde van 12 miljard euro en het Internationaal Monetair Fonds.,['door Europese partners'],['euro'],3,15,6,[0.8636363636363636],0.86
seq582-0,small,zelfcensuur en beperking van diversiteit van perspectieven in de wetenschap in Nederland een rol spelen,zelfcensuur en beperking <extra_id_0> van perspectieven in de wetenschap in Nederland een rol spelen,zelfcensuur en beperking van perspectieven in de wetenschap in Nederland een rol spelen,['van diversiteit'],[''],2,15,6,[1.0],1.0
seq583-0,small,over de generatiekloof. Kinderen verklaren de oorlog aan hun belachelijke ouders Peter Faber en Geert de Jong.,over de <extra_id_0> de oorlog aan hun belachelijke ouders Peter Faber en Geert de Jong.,over de oorlog en de oorlog aan hun belachelijke ouders Peter Faber en Geert de Jong.,['generatiekloof. Kinderen verklaren'],['oorlog en'],3,15,6,[0.8235294117647058],0.82
seq584-0,small,"s Loaded Weapon I (Gene Quintano, 1993, VS). Grappen zijn dun gezaaid in parodie op de politiefilm Lethal Weapon. Met Emilio Estevez als Mel Gibson en Samuel L. Jackson als Danny Glover. Ook de ondervragingsscne uit Basic Instinct wordt gepersifleerd.","s Loaded Weapon I (Gene Quintano, 1993, VS). Grappen zijn dun gezaaid in parodie op de politiefilm Lethal Weapon. Met Emilio Estevez als Mel Gibson en <extra_id_0> als Danny Glover. Ook de ondervragingsscne uit <extra_id_1> gepersifleerd.","s Loaded Weapon I (Gene Quintano, 1993, VS). Grappen zijn dun gezaaid in parodie op de politiefilm Lethal Weapon. Met Emilio Estevez als Mel Gibson en Danny als Danny Glover. Ook de ondervragingsscne uit de film is gepersifleerd.","['Samuel L. Jackson', 'Basic Instinct wordt']","['Danny', 'de film is']",6,15,6,"[0.9411764705882353, 0.85]",0.9
seq585-0,small,verschillen gekleurd machtsspel in verfilming van roman van Yukio Mishima over relatie tussen welgestelde zakenvrouw (Isabelle Huppert) e,verschillen gekleurd machtsspel <extra_id_0> roman van Yukio Mishima over relatie tussen welgestelde zakenvrouw (Isabelle Huppert) e,verschillen gekleurd machtsspel in de roman van Yukio Mishima over relatie tussen welgestelde zakenvrouw (Isabelle Huppert) e,['in verfilming van'],['in de'],3,15,6,[0.7647058823529411],0.76
seq586-0,small,". The Golden Child (Michael Ritchie, 1986, VS). Brutaaltje Eddie Murphy is een kwieke welzijnswerker in sprookjesavontuur. Hij moet een Tibetaans knulletje, de personificatie van het Goede, beschermen tegen duivelse schurk Charles Dance.",". The Golden Child (Michael Ritchie, <extra_id_0> Murphy is een kwieke welzijnswerker in sprookjesavontuur. Hij moet een Tibetaans knulletje, de personificatie van het Goede, beschermen tegen duivelse schurk Charles Dance.",". The Golden Child (Michael Ritchie, 1985) Murphy is een kwieke welzijnswerker in sprookjesavontuur. Hij moet een Tibetaans knulletje, de personificatie van het Goede, beschermen tegen duivelse schurk Charles Dance.","['1986', 'VS). Brutaaltje Eddie']",['1985)'],5,15,6,[0.4],0.4
seq587-0,small,echtelieden Port (John Malkovich) en Pit (Debra Winger) proberen elkaar terug te vinden in het nihilisme van het reizigersschap. Ademstokkende beelden,echtelieden Port (John Malkovich) en Pit (Debra Winger) proberen elkaar terug te vinden <extra_id_0> van het reizigersschap. Ademstokkende beelden,echtelieden Port (John Malkovich) en Pit (Debra Winger) proberen elkaar terug te vinden in de geschiedenis van het reizigersschap. Ademstokkende beelden,['in het nihilisme'],['in de geschiedenis'],3,15,6,[0.6666666666666666],0.67
seq588-0,small,"de veiligheidsdiensten denken dat ze lid zijn van een terreurgroep, zelf het Nederlanderschap kunnen ontnemen. Nu kan dat alleen na uitspraak van een strafrechter.","de veiligheidsdiensten denken dat ze lid zijn van een terreurgroep, zelf <extra_id_0> Nu kan dat alleen na uitspraak van een strafrechter.","de veiligheidsdiensten denken dat ze lid zijn van een terreurgroep, zelf Nu kan dat alleen na uitspraak van een strafrechter.",['het Nederlanderschap kunnen ontnemen.'],[''],4,15,6,[1.0],1.0
seq589-0,small,"ster Maggie Cheung zichzelf speelt n Irma Vep, de leidster van een dievenbende uit de serie stomme films Les vampires van Louis Feuillade, die door een Franse regisseur op zijn retour (Jean-Pierre Laud), voor de televisie overgemaakt wordt. Uitgelaten en uitgekookt laat Assayas de liefde voor films, mensen en sterren in elkaar overlopen.","ster Maggie Cheung zichzelf speelt n Irma Vep, de <extra_id_0> uit de serie stomme films Les vampires van Louis Feuillade, die <extra_id_1> op zijn retour (Jean-Pierre Laud), voor de televisie overgemaakt wordt. Uitgelaten en uitgekookt laat Assayas de liefde voor films, mensen en sterren in elkaar overlopen.","ster Maggie Cheung zichzelf speelt n Irma Vep, de nieuwe ster uit de serie stomme films Les vampires van Louis Feuillade, die zich op zijn retour (Jean-Pierre Laud), voor de televisie overgemaakt wordt. Uitgelaten en uitgekookt laat Assayas de liefde voor films, mensen en sterren in elkaar overlopen.","['leidster van een dievenbende', 'door een Franse regisseur']","['nieuwe ster', 'zich']",8,15,6,"[0.8214285714285714, 0.96]",0.89
seq590-0,small,die rock en soul samenbracht in een flamboyante mix van stijlen waarin zijn muzikale genie op alle fronten naar boven kwam.,die rock en soul samenbracht in een flamboyante mix van stijlen waarin zijn muzikale genie op <extra_id_0> boven kwam.,die rock en soul samenbracht in een flamboyante mix van stijlen waarin zijn muzikale genie op de hoogte boven kwam.,['alle fronten naar'],['de hoogte'],3,15,6,[0.7058823529411765],0.71
seq591-0,small,DreamWorks is een heerlijk tegendraadse versie van het klassieke sprookje van het schone meisje en het lelijke beest.,DreamWorks is een heerlijk tegendraadse versie van het klassieke sprookje <extra_id_0> meisje en het lelijke beest.,DreamWorks is een heerlijk tegendraadse versie van het klassieke sprookje van het meisje en het lelijke beest.,['van het schone'],['van het'],3,15,6,[0.5],0.5
seq592-0,small,"Kale, overdonderende film van de Waalse broers Dardenne over Rosetta, een meisje dat alleen aan werk waardigheid kan ontlenen. In een losse, handheld stijl zit de camera de heldin in haar eenzame wereld dicht op de huid.","Kale, overdonderende film van de Waalse broers Dardenne over Rosetta, een meisje dat alleen aan werk waardigheid kan ontlenen. In een losse, handheld stijl <extra_id_0> de heldin in haar eenzame wereld <extra_id_1> huid.","Kale, overdonderende film van de Waalse broers Dardenne over Rosetta, een meisje dat alleen aan werk waardigheid kan ontlenen. In een losse, handheld stijl de heldin in haar eenzame wereld en haar huid.","['zit de camera', 'dicht op de']","['', 'en haar']",6,15,6,"[1.0, 0.9090909090909091]",0.95
seq593-0,small,". Correspondent Gert van Langendonck reist deze zomer met een groep Syrische vluchtelingen mee naar Europa. Hun leider Mazen Ismail (die zelf 1,5 jaar gevangen zat in Syri) probeert ze naar Duitsland te brengen.",". Correspondent Gert van Langendonck reist deze zomer met een groep Syrische vluchtelingen mee naar Europa. Hun leider Mazen Ismail (die zelf 1,5 jaar gevangen zat in Syri) probeert ze naar <extra_id_0>",". Correspondent Gert van Langendonck reist deze zomer met een groep Syrische vluchtelingen mee naar Europa. Hun leider Mazen Ismail (die zelf 1,5 jaar gevangen zat in Syri) probeert ze naar Europa te trekken.",['Duitsland te brengen.'],['trekken.'],5,15,6,[0.7142857142857143],0.71
seq594-0,small,"bombardementen uit op de Houthis, die een groot deel van Jemen controleren van het uiterste noorden tot en met het gebied onder hoofdstad Sana","bombardementen uit op de Houthis, die een <extra_id_0> controleren van het uiterste noorden tot en met het gebied onder hoofdstad Sana","bombardementen uit op de Houthis, die een controleren van het uiterste noorden tot en met het gebied onder hoofdstad Sana",['groot deel van Jemen'],[''],4,15,6,[1.0],1.0
seq595-0,small,verklaard dat de militaire interventie niet zal stoppen voor Jemen weer veilig is en de Houthi-rebellen een halt toe is geroepen.,verklaard dat de militaire interventie niet zal stoppen voor <extra_id_0> is en de Houthi-rebellen een halt toe is geroepen.,verklaard dat de militaire interventie niet zal stoppen voor de vrede is en de Houthi-rebellen een halt toe is geroepen.,['Jemen weer veilig'],['de vrede'],3,15,6,[0.7647058823529411],0.76
seq596-0,small,", waarin een jeugdige broer en zus niet alleen de wereld van de ondergang redden, maar ook hun beide ouders, spionnen in ruste. Wervelende montage, sterke humor en innemend amusement voor alle leeftijden.",", waarin <extra_id_0> zus niet alleen de wereld van de ondergang redden, maar ook hun beide ouders, spionnen in ruste. Wervelende montage, sterke humor en innemend amusement voor alle leeftijden.",", waarin de zus niet alleen de wereld van de ondergang redden, maar ook hun beide ouders, spionnen in ruste. Wervelende montage, sterke humor en innemend amusement voor alle leeftijden.",['een jeugdige broer en'],['de'],5,15,6,[0.9047619047619048],0.9
seq597-0,small,"gezamenlijk zullen overleggen wanneer, in de ogen van een van hen, de territoriale integriteit, politieke onafhankelijkheid of veiligheid van een van de partijen wordt bedreigd","gezamenlijk zullen overleggen wanneer, in de ogen van een van hen, de territoriale integriteit, politieke onafhankelijkheid of veiligheid van een van <extra_id_0>","gezamenlijk zullen overleggen wanneer, in de ogen van een van hen, de territoriale integriteit, politieke onafhankelijkheid of veiligheid van een van hen.",['de partijen wordt bedreigd'],['hen.'],4,15,6,[0.9230769230769231],0.92
seq598-0,small,"vanmiddag in NRC Handelsblad. U kunt hier een los nummer van deze krant kopen, abonnees kunnen het artikel gratis lezen.","vanmiddag in NRC Handelsblad. U kunt hier een los nummer van deze krant kopen, abonnees <extra_id_0> gratis lezen.","vanmiddag in NRC Handelsblad. U kunt hier een los nummer van deze krant kopen, abonnees sturen of gratis lezen.",['kunnen het artikel'],['sturen of'],3,15,6,[0.8333333333333334],0.83
seq599-0,small,In deze variant van Aischylos' Oresteia keert de moraal zich tegen het leven: leden van een puriteinse familie moorden elkaar uit,In deze variant van Aischylos' Oresteia keert de moraal zich tegen het leven: leden van een puriteinse <extra_id_0> uit,In deze variant van Aischylos' Oresteia keert de moraal zich tegen het leven: leden van een puriteinse tempel uit,['familie moorden elkaar'],['tempel'],3,15,6,[0.8181818181818182],0.82
seq600-0,small,Wilhelmina: je maintiendrai Anne-Wil Blankers schittert in fraai gekostumeerde en geregisseerde voorstelling als koningin Wilhelmina,Wilhelmina: je maintiendrai Anne-Wil Blankers schittert <extra_id_0> gekostumeerde en geregisseerde voorstelling als koningin Wilhelmina,Wilhelmina: je maintiendrai Anne-Wil Blankers schittert met een gekostumeerde en geregisseerde voorstelling als koningin Wilhelmina,['in fraai'],['met een'],2,15,6,[1.0],1.0
seq601-0,small,"Meeslepende, filmische roman waarin 9/11 grote gevolgen heeft voor het oppervlakkige, decadente bestaan van upperclass-New Yorkers Corinne en Russel Calloway uit Brightness Falls (1993). Of niet?","Meeslepende, filmische roman waarin 9/11 grote gevolgen <extra_id_0> decadente bestaan van upperclass-New Yorkers Corinne en Russel Calloway uit Brightness Falls (1993). Of niet?","Meeslepende, filmische roman waarin 9/11 grote gevolgen heeft voor het decadente bestaan van upperclass-New Yorkers Corinne en Russel Calloway uit Brightness Falls (1993). Of niet?","['heeft voor het oppervlakkige,']",['heeft voor het'],4,15,6,[0.5172413793103449],0.52
seq602-0,small,"Begin dit jaar stuurden vier rapporteurs inzake mensenrechten, culturele rechten, minderhedenrechten en racisme een brief aan Nederland","Begin dit jaar stuurden <extra_id_0> mensenrechten, culturele rechten, minderhedenrechten en racisme een brief aan Nederland","Begin dit jaar stuurden de mensenrechten, culturele rechten, minderhedenrechten en racisme een brief aan Nederland",['vier rapporteurs inzake'],['de'],3,15,6,[0.9565217391304348],0.96
seq603-0,small,"u. Red Heat (Walter Hill, 1988, VS). Actiethriller volgens beproefde formule waarbij twee volstrekt verschillende naturen er toch in slagen samen een karwei te klaren. Russische politieman Arnold Schwarzenegger en zijn Amerikaanse collega James Belushi versus cocanedealer in Chicago.","u. Red Heat (Walter Hill, 1988, VS). Actiethriller volgens beproefde formule waarbij twee volstrekt <extra_id_0> toch in slagen samen een karwei te klaren. Russische politieman Arnold Schwarzenegger en zijn Amerikaanse collega James Belushi versus <extra_id_1>","u. Red Heat (Walter Hill, 1988, VS). Actiethriller volgens beproefde formule waarbij twee volstrekt moeilijke figuren toch in slagen samen een karwei te klaren. Russische politieman Arnold Schwarzenegger en zijn Amerikaanse collega James Belushi versus FBI","['verschillende naturen er', 'cocanedealer in Chicago.']","['moeilijke figuren', 'FBI']",6,15,6,"[0.6666666666666666, 1.0]",0.83
seq604-0,small,Wilt u kans maken op een prijs? Stuur een stuk van maximaal 250 woorden vr vrijdag 30 december naar boeken@nrc.nl o.v.v. Beter Boek.,<extra_id_0> maken op een prijs? Stuur een stuk van maximaal 250 woorden vr vrijdag 30 december naar boeken@nrc.nl o.v.v. Beter Boek.,te maken op een prijs? Stuur een stuk van maximaal 250 woorden vr vrijdag 30 december naar boeken@nrc.nl o.v.v. Beter Boek.,['Wilt u kans'],['te'],3,15,6,[0.9090909090909091],0.91
seq605-0,small,"Clear and Present Danger (Philip Noyce, 1994, VS). Na Patriot Games de tweede verfilming van een boek van Tom Clancy waarin Harrison Ford de rol speelt van CIA-agent Jack Ryan. Uitstekend gemaakte actiethriller betreft de strijd tegen Colombiaanse drugsbaronnen.","Clear and Present Danger (Philip Noyce, 1994, <extra_id_0> Games de tweede verfilming van een boek van Tom Clancy waarin Harrison Ford <extra_id_1> van CIA-agent Jack Ryan. Uitstekend gemaakte actiethriller betreft de strijd tegen Colombiaanse drugsbaronnen.","Clear and Present Danger (Philip Noyce, 1994, paperback) is in de Games de tweede verfilming van een boek van Tom Clancy waarin Harrison Ford handelt van CIA-agent Jack Ryan. Uitstekend gemaakte actiethriller betreft de strijd tegen Colombiaanse drugsbaronnen.","['VS). Na Patriot', 'de rol speelt']","['paperback) is in de', 'handelt']",6,15,6,"[0.8947368421052632, 0.7692307692307693]",0.83
seq606-0,small,"Wie wil weten waar de kerk staat heeft genoeg aan een reisgids. Maar wie een land echt wil leren kennen kan er beter een roman, een thriller of geschiedenisboek over lezen. We maakten een selectie voor populaire vakantiebestemmingen.","Wie wil <extra_id_0> genoeg aan een reisgids. Maar wie een land echt wil leren kennen kan er beter een roman, een thriller of geschiedenisboek over lezen. We maakten een selectie voor populaire vakantiebestemmingen.","Wie wil leren kennen is genoeg aan een reisgids. Maar wie een land echt wil leren kennen kan er beter een roman, een thriller of geschiedenisboek over lezen. We maakten een selectie voor populaire vakantiebestemmingen.",['weten waar de kerk staat heeft'],['leren kennen is'],6,15,6,[0.7666666666666667],0.77
seq607-0,small,betaald aan buitenlandse overheidsambtenaren ter verkrijging van buitenlandse (overheids)opdrachten.,betaald aan buitenlandse <extra_id_0> ter verkrijging van buitenlandse (overheids)opdrachten.,betaald aan buitenlandse opdrachten ter verkrijging van buitenlandse (overheids)opdrachten.,['overheidsambtenaren'],['opdrachten'],1,15,6,[0.6842105263157895],0.68
seq608-0,small,"-17u; Theo van Doesburg, architect, schilder, dichter in het Centraal Museum, Nicolaaskerkhof 1, Utrecht. Di t/m zo 11-17u en in het Krller-Mller Museum te Otterlo. Di-zo 10-17u. Beide exposities t/m 18 juni. De Madonna's van Jan van Scorel t/m 2 juli in het Centraal Museum, Nicolaaskerkhof 10, Utrecht. Di","-17u; Theo van Doesburg, architect, schilder, dichter in het Centraal Museum, Nicolaaskerkhof 1, Utrecht. Di t/m zo 11-17u en in het Krller-Mller Museum te Otterlo. Di-zo 10-17u. Beide <extra_id_0> juni. <extra_id_1> van Scorel t/m 2 juli in het Centraal Museum, Nicolaaskerkhof 10, Utrecht. Di","-17u; Theo van Doesburg, architect, schilder, dichter in het Centraal Museum, Nicolaaskerkhof 1, Utrecht. Di t/m zo 11-17u en in het Krller-Mller Museum te Otterlo. Di-zo 10-17u. Beide werken tot en met 1 juni. Theo van Scorel t/m 2 juli in het Centraal Museum, Nicolaaskerkhof 10, Utrecht. Di","['exposities t/m 18', '""De Madonna\'s van Jan""']","['werken tot en met 1', 'Theo']",7,15,6,"[0.7368421052631579, 0.9090909090909091]",0.82
seq609-0,small,"The Craft (Andrew Fleming, 1996, VS). Aardige, betrekkelijk genuanceerde tienergriezelkomedie over puberaal lief en leed en de kracht van meisjesvriendschap.","The Craft (Andrew Fleming, 1996, VS). Aardige, <extra_id_0> over puberaal lief en leed en de kracht van meisjesvriendschap.","The Craft (Andrew Fleming, 1996, VS). Aardige, enthousiaste verhalen over puberaal lief en leed en de kracht van meisjesvriendschap.",['betrekkelijk genuanceerde tienergriezelkomedie'],['enthousiaste verhalen'],3,15,6,[0.8043478260869565],0.8
seq610-0,small,"ldson, 1994, VS). Risicoloze, gladde remake van gelijknamige actieklassieker van Sam Peckinpah uit 1972. Alec Baldwin en Kim Basinger vervingen Steve McQueen en Ali MacGraw als echtpaar dat, na een uit de hand gelopen bankoverval, op de vlucht slaat.","ldson, 1994, VS). Risicoloze, gladde remake van gelijknamige actieklassieker van Sam Peckinpah uit 1972. Alec Baldwin en <extra_id_0> Steve McQueen en Ali MacGraw als echtpaar dat, <extra_id_1> de hand gelopen bankoverval, op de vlucht slaat.","ldson, 1994, VS). Risicoloze, gladde remake van gelijknamige actieklassieker van Sam Peckinpah uit 1972. Alec Baldwin en Tony Parker, Steve McQueen en Ali MacGraw als echtpaar dat, met de hand gelopen bankoverval, op de vlucht slaat.","['Kim Basinger vervingen', 'na een uit']","['Tony Parker,', 'met']",6,15,6,"[0.8181818181818182, 0.8]",0.81
seq611-0,small,in de jaren dertig in conflict komen met onredelijke autoriteiten en per ongeluk zijn moeder vermoorden.,in de jaren dertig in <extra_id_0> met onredelijke autoriteiten en per ongeluk zijn moeder vermoorden.,in de jaren dertig in verband met onredelijke autoriteiten en per ongeluk zijn moeder vermoorden.,['conflict komen'],['verband'],2,15,6,[1.0],1.0
seq612-0,small,". Dunston Checks in (Ken Kwapis, 1996, VS). Voor kinderen onweerstaanbare klucht waarin dievenhulpje annex orang-oetan Dunston een chique New","<extra_id_0> in (Ken Kwapis, 1996, VS). Voor kinderen onweerstaanbare klucht waarin dievenhulpje annex orang-oetan Dunston een chique New","kinderen in (Ken Kwapis, 1996, VS). Voor kinderen onweerstaanbare klucht waarin dievenhulpje annex orang-oetan Dunston een chique New",['. Dunston Checks'],['kinderen'],3,15,6,[0.875],0.88
seq613-0,small,"orks hotel op stelten zet, maar zich beschermd weet door het verwaarloosde zoontje van de hotelmanager. Met Faye Dunaway als ambitieuze oudere dame.","orks hotel op stelten zet, maar zich beschermd weet door het verwaarloosde zoontje van de hotelmanager. <extra_id_0> als ambitieuze oudere dame.","orks hotel op stelten zet, maar zich beschermd weet door het verwaarloosde zoontje van de hotelmanager. En als ambitieuze oudere dame.",['Met Faye Dunaway'],['En'],3,15,6,[0.9375],0.94
seq614-0,small,"Paul Hogan zich met zijn opzichtige laarzen, zijn enorme hoed en zijn grijnzende naviteit door Hollywood. Van een bewonderenswaardige simpelheid.",Paul Hogan zich met zijn opzichtige <extra_id_0> hoed en zijn grijnzende naviteit door Hollywood. Van een bewonderenswaardige simpelheid.,Paul Hogan zich met zijn opzichtige handen hoed en zijn grijnzende naviteit door Hollywood. Van een bewonderenswaardige simpelheid.,"['laarzen', 'zijn enorme']",['handen'],3,15,6,[0.5714285714285714],0.57
seq615-0,small,Die zelfportretten van Rembrandt hadden een aantal functies. Het leverde een goedkoop en makkelijk model.,Die zelfportretten van Rembrandt hadden een aantal functies. Het leverde een <extra_id_0> makkelijk model.,Die zelfportretten van Rembrandt hadden een aantal functies. Het leverde een zeer makkelijk model.,['goedkoop en'],['zeer'],2,15,6,[0.8181818181818182],0.82
seq616-0,small,". En het zelfportret was een zeer gewild object bij kunstliefhebbers, omdat die zo de hand konden leggen op een proeve van 's mans meesterschap",". En het zelfportret was een zeer gewild object bij kunstliefhebbers, omdat <extra_id_0> konden leggen op een proeve van 's mans meesterschap",". En het zelfportret was een zeer gewild object bij kunstliefhebbers, omdat we het konden leggen op een proeve van 's mans meesterschap",['die zo de hand'],['we het'],4,15,6,[0.7857142857142857],0.79
seq617-0,small,"; The Beatles, populaire stof, t/m 24 sep, Nederlands Textielmuseum, Tilburg; De Magie van Disney, t/m 3 sep, Noordbrabants Museum, 's-Hertogenbosch","; The Beatles, populaire stof, t/m 24 sep, Nederlands Textielmuseum, Tilburg; De Magie van Disney, t/m <extra_id_0> Museum, 's-Hertogenbosch","; The Beatles, populaire stof, t/m 24 sep, Nederlands Textielmuseum, Tilburg; De Magie van Disney, t/m 24 sep, Nederlands Textiel Museum, 's-Hertogenbosch","['3 sep', 'Noordbrabants']","['24 sep, Nederlands Textiel']",3,15,6,[0.8461538461538461],0.85
seq618-0,small,". Stop! Or My Mom Will Shoot (Roger Spottiswoode, 1992, VS). Pretentieloze komedie waarin rechercheur Sylvester Stallone bezoek krijgt van zijn bemoeizieke moeder",". Stop! Or My Mom Will Shoot (Roger Spottiswoode, 1992, VS). Pretentieloze komedie waarin rechercheur Sylvester <extra_id_0> van zijn bemoeizieke moeder",". Stop! Or My Mom Will Shoot (Roger Spottiswoode, 1992, VS). Pretentieloze komedie waarin rechercheur Sylvester Stallone zich afvragen van zijn bemoeizieke moeder",['Stallone bezoek krijgt'],['Stallone zich afvragen'],3,15,6,[0.5454545454545454],0.55
seq619-0,small,schildert subtiel de onderhuidse strijd om elkaars affectie van een eenzame boer (Jaap Spijkers) en een weggelopen Poolse prostituee tegen wil en dank (Monic Hendrickx) op het Groningse platteland.,schildert subtiel de onderhuidse strijd om elkaars affectie van een eenzame boer (Jaap Spijkers) en een weggelopen Poolse prostituee tegen wil en dank (Monic Hendrickx) <extra_id_0>,schildert subtiel de onderhuidse strijd om elkaars affectie van een eenzame boer (Jaap Spijkers) en een weggelopen Poolse prostituee tegen wil en dank (Monic Hendrickx),['op het Groningse platteland.'],[''],4,15,6,[1.0],1.0
seq620-0,small,"en. Die ene leraar die je interesse wekte, de eerste baas die je de kneepjes van het vak bijbracht of de wijsgeer die je inspireerde met zijn boeken. Elke carrire kent wel zon leermeester (m/v). Voor","en. Die ene <extra_id_0> wekte, de eerste baas die je de kneepjes van het vak bijbracht of de wijsgeer die je inspireerde met zijn boeken. Elke carrire kent wel zon leermeester (m/v). Voor","en. Die ene die je wekte, de eerste baas die je de kneepjes van het vak bijbracht of de wijsgeer die je inspireerde met zijn boeken. Elke carrire kent wel zon leermeester (m/v). Voor",['leraar die je interesse'],['die je'],5,15,6,[0.7391304347826086],0.74
seq621-0,small,"Wekelijks verklaart een Bekende Nederlander in de Boekenbijlage van NRC Handelsblad de liefde aan een boek. Deze week, in de rubriek Boekdelen,","Wekelijks verklaart een Bekende Nederlander in de Boekenbijlage van NRC <extra_id_0> aan een boek. Deze week, in de rubriek Boekdelen,","Wekelijks verklaart een Bekende Nederlander in de Boekenbijlage van NRC Deel aan een boek. Deze week, in de rubriek Boekdelen,",['Handelsblad de liefde'],['Deel'],3,15,6,[0.8571428571428571],0.86
seq622-0,small,Van de straat Van de catwalk naar onze kledingkast. Voor welke modetrends wij vallen en waarom. Deze keer:,Van de straat Van de catwalk naar onze kledingkast. Voor welke modetrends wij vallen en <extra_id_0>,Van de straat Van de catwalk naar onze kledingkast. Voor welke modetrends wij vallen en wat wij dragen.,['waarom. Deze keer:'],['dragen.'],3,15,6,[0.8888888888888888],0.89
