seq350-0,small,"waarin de koning van Thebe weigert zeven gesneuvelde soldaten van de vijand te begraven. Hun moeders, de smekelingen, roepen de hulp in van de Atheense koning","waarin de koning van Thebe weigert zeven gesneuvelde soldaten van de vijand te begraven. Hun moeders, de <extra_id_0> in van de Atheense koning","waarin de koning van Thebe weigert zeven gesneuvelde soldaten van de vijand te begraven. Hun moeders, de vaders in van de Atheense koning","['smekelingen', 'roepen de hulp']",['vaders'],4,15,6,[0.9090909090909091],0.91
seq351-0,small,John (The Firm) Grisham door de in samenzweringen op hoog niveau gespecialiseerde vakman Pakula (All the President,John (The Firm) Grisham <extra_id_0> samenzweringen op hoog niveau gespecialiseerde vakman Pakula (All the President,John (The Firm) Grisham is een samenzweringen op hoog niveau gespecialiseerde vakman Pakula (All the President,['door de in'],['is een'],3,15,6,[0.7],0.7
seq352-0,small,"s Men). Studente Julia Roberts, die theorie ontwikkelde over de moord op twee rechters, wordt belaagd door alom","s Men). Studente Julia Roberts, <extra_id_0> over de moord op twee rechters, wordt belaagd door alom","s Men). Studente Julia Roberts, die vertelt over de moord op twee rechters, wordt belaagd door alom",['die theorie ontwikkelde'],['die vertelt'],3,15,6,[0.6086956521739131],0.61
seq353-0,small,". Congo (Frank Marshall, 1995, VS). Door Spielbergproducent geregisseerde verfilming van boek van Michael Crichton",". <extra_id_0> Marshall, 1995, VS). Door Spielbergproducent geregisseerde verfilming van boek van Michael Crichton",". (John Marshall, 1995, VS). Door Spielbergproducent geregisseerde verfilming van boek van Michael Crichton",['Congo (Frank'],['(John'],2,15,6,[0.8333333333333334],0.83
seq354-0,small,een armzalige Tarantino-epigoon: stripachtig geweld en een imitatie van clichs uit de spaghettiwestern en de nouvelle,een armzalige Tarantino-epigoon: stripachtig geweld en een <extra_id_0> clichs uit de spaghettiwestern en de nouvelle,een armzalige Tarantino-epigoon: stripachtig geweld en een reeks clichs uit de spaghettiwestern en de nouvelle,['imitatie van'],['reeks'],2,15,6,[0.9166666666666666],0.92
seq355-0,small,. De voormalig president van de Verenigde Staten Bill Clinton komt er vandaag een bibliotheek openen.,. De voormalig president <extra_id_0> Verenigde Staten Bill Clinton komt er vandaag een bibliotheek openen.,. De voormalig president van de Verenigde Staten Bill Clinton komt er vandaag een bibliotheek openen.,['van de'],['van de'],2,15,6,[0.0],0.0
seq356-0,small,"SEX Verrassend nieuw persiflage-cabaret: de Vliegende Panters, drie beginnende twintigers met brutaal talent, trekken een lange neus tegen alles wat leugenachtig is.","<extra_id_0> persiflage-cabaret: de Vliegende Panters, drie beginnende twintigers met brutaal talent, trekken een lange neus tegen alles wat leugenachtig is.","Een persiflage-cabaret: de Vliegende Panters, drie beginnende twintigers met brutaal talent, trekken een lange neus tegen alles wat leugenachtig is.",['SEX Verrassend nieuw'],['Een'],3,15,6,[0.85],0.85
seq357-0,small,"Deelnemers aan het webcongres, het online discussieplatform op www.nrc.nl/webcongres bogen zich over de stelling","Deelnemers aan het webcongres, het online discussieplatform op www.nrc.nl/webcongres bogen zich <extra_id_0> stelling","Deelnemers aan het webcongres, het online discussieplatform op www.nrc.nl/webcongres bogen zich op de stelling",['over de'],['op de'],2,15,6,[0.42857142857142855],0.43
seq358-0,small,- NRC Opgevoed Elke week legt Annemiek Leclaire een lezersvraag voor aan deskundigen. Deze week: een,- NRC Opgevoed Elke week legt Annemiek Leclaire een lezersvraag voor aan <extra_id_0> week: een,- NRC Opgevoed Elke week legt Annemiek Leclaire een lezersvraag voor aan van de week: een,['deskundigen. Deze'],['van de'],2,15,6,[0.8235294117647058],0.82
seq359-0,small,"Foto: ARTE France Honorarfreie Verwendung nur im Zusammenhang mit genannter Sendung und bei folgender Nennung ""Bild: Sendeanstalt/Copyright"". Andere Verwendungen nur nach vorheriger Absprache: ARTE-Bildredaktion, Tel.: Carine Haggiag +33 3 88 14 21 37 und Silke W","Foto: ARTE France Honorarfreie Verwendung nur im Zusammenhang mit genannter Sendung und bei folgender Nennung ""Bild: Sendeanstalt/Copyright"". Andere Verwendungen nur nach vorheriger Absprache: ARTE-Bildredaktion, Tel.: Carine Haggiag <extra_id_0> 21 37 und Silke W","Foto: ARTE France Honorarfreie Verwendung nur im Zusammenhang mit genannter Sendung und bei folgender Nennung ""Bild: Sendeanstalt/Copyright"". Andere Verwendungen nur nach vorheriger Absprache: ARTE-Bildredaktion, Tel.: Carine Haggiag Tel.: 069 / 069 / 21 37 und Silke W",['+33 3 88 14'],['Tel.: 069 / 069 /'],5,15,6,[0.8823529411764706],0.88
seq360-0,small,- NRC Menu Grand Hotel Janneke Vreugdenhil gaat in het kielzog van Grand Hotel Europa van Ilja Leonard Pfeijffer op zoek naar de lekkerste recepten. Deze week:,- NRC Menu Grand Hotel Janneke Vreugdenhil gaat in het kielzog van Grand Hotel Europa van Ilja <extra_id_0> naar de lekkerste recepten. Deze week:,- NRC Menu Grand Hotel Janneke Vreugdenhil gaat in het kielzog van Grand Hotel Europa van Ilja op zoek naar de lekkerste recepten. Deze week:,['Leonard Pfeijffer op zoek'],['op zoek'],4,15,6,[0.72],0.72
seq361-0,small,"The Man Who Knew Too Little (Jon Amiel, 1997, VS). Melige spionagekomedie met Bill Murray als onnozele Amerikaan die in Londen","The Man Who Knew Too Little (Jon Amiel, 1997, <extra_id_0> met Bill Murray als onnozele Amerikaan die in Londen","The Man Who Knew Too Little (Jon Amiel, 1997, Paperback) met Bill Murray als onnozele Amerikaan die in Londen",['VS). Melige spionagekomedie'],['Paperback)'],3,15,6,[0.8888888888888888],0.89
seq362-0,small,het Wetenschappelijk Onderzoek- en Documentatiecentrum van het ministerie van Veiligheid en Justitie,het Wetenschappelijk Onderzoek- en Documentatiecentrum <extra_id_0> ministerie van Veiligheid en Justitie,het Wetenschappelijk Onderzoek- en Documentatiecentrum het ministerie van Veiligheid en Justitie,['van het'],['het'],2,15,6,[0.5714285714285714],0.57
seq363-0,small,", Voltaire, expressionisme, Michelangelo, Chanel, de Engelse tuin, Plato, de Romantiek, Tolstoj, Blaeu, Magnum, De Stijl, Bach, Faberg,","<extra_id_0> Michelangelo, Chanel, de Engelse tuin, Plato, de Romantiek, Tolstoj, Blaeu, Magnum, De Stijl, Bach, Faberg,","Michelangelo, Chanel, de Engelse tuin, Plato, de Romantiek, Tolstoj, Blaeu, Magnum, De Stijl, Bach, Faberg,","['', 'Voltaire', 'expressionisme,']",[''],3,15,6,[None],
seq364-0,small,Janine Janssen is hoofd onderzoek van het Landelijk Expertise Centrum Eer Gerelateerd Geweld van de,Janine Janssen is hoofd <extra_id_0> het Landelijk Expertise Centrum Eer Gerelateerd Geweld van de,Janine Janssen is hoofd van het Landelijk Expertise Centrum Eer Gerelateerd Geweld van de,['onderzoek van'],['van'],2,15,6,[0.7692307692307693],0.77
seq365-0,small,". Dirty Dancing (Emile Ardolino, 1987, VS). Voor een grijpstuiver vervaardigde tienermusical werd onverwacht kassucces. In de zomer van 1963 verliest bleu meisje van goede komaf",". <extra_id_0> 1987, VS). Voor een grijpstuiver vervaardigde tienermusical werd onverwacht kassucces. In de zomer van 1963 verliest bleu meisje van goede komaf",". 1987, VS). Voor een grijpstuiver vervaardigde tienermusical werd onverwacht kassucces. In de zomer van 1963 verliest bleu meisje van goede komaf","['Dirty Dancing (Emile Ardolino,']",[''],4,15,6,[1.0],1.0
seq366-0,small,". Sniper (Luis Llosa, 1993, VS). In Panamese jungle gesitueerde actiethriller biedt psychologisch vlak portret van de vijandigheid tussen militaire scherpschutter Tom Berenger en diens assistent: de ambitieuze nieuwkomer Billy Zane.",". Sniper (Luis Llosa, 1993, VS). In Panamese jungle gesitueerde actiethriller biedt psychologisch vlak portret van de vijandigheid tussen militaire scherpschutter Tom Berenger en diens assistent: de ambitieuze <extra_id_0>",". Sniper (Luis Llosa, 1993, VS). In Panamese jungle gesitueerde actiethriller biedt psychologisch vlak portret van de vijandigheid tussen militaire scherpschutter Tom Berenger en diens assistent: de ambitieuze thriller.",['nieuwkomer Billy Zane.'],['thriller.'],5,15,6,[0.7727272727272727],0.77
seq367-0,small,eren in karikaturale satirische komedie als onwetende proefkonijnen in sociaal experiment: kan een louche bedelaar zich ontpoppen tot briljante beursspeculant en andersom? Met Jamie Lee Curtis als hoertje-met-een-hartje-van-goud.,eren in karikaturale satirische komedie als onwetende proefkonijnen in sociaal experiment: <extra_id_0> zich ontpoppen tot briljante beursspeculant en andersom? Met Jamie Lee Curtis als hoertje-met-een-hartje-van-goud.,eren in karikaturale satirische komedie als onwetende proefkonijnen in sociaal experiment: hoe kan men zich ontpoppen tot briljante beursspeculant en andersom? Met Jamie Lee Curtis als hoertje-met-een-hartje-van-goud.,['kan een louche bedelaar'],['hoe kan men'],4,15,6,[0.8260869565217391],0.83
seq368-0,small,"Enerverende actiefilm, waarvan de expliciete hardheid, de spectaculaire vormgeving en de cynische toon school zouden maken in Hollywood. Op","Enerverende actiefilm, waarvan de <extra_id_0> spectaculaire vormgeving en de cynische toon school zouden maken in Hollywood. Op","Enerverende actiefilm, waarvan de film de spectaculaire vormgeving en de cynische toon school zouden maken in Hollywood. Op","['expliciete hardheid', 'de']",['film de'],3,15,6,[0.7894736842105263],0.79
seq369-0,small,"advocaat. Rechtbankjurylid Dennis Quaid helpt haar de onschuld te bewijzen van de dakloze, dove Vietnamveteraan Liam Neeson.","advocaat. Rechtbankjurylid Dennis Quaid <extra_id_0> onschuld te bewijzen van de dakloze, dove Vietnamveteraan Liam Neeson.","advocaat. Rechtbankjurylid Dennis Quaid onschuld te bewijzen van de dakloze, dove Vietnamveteraan Liam Neeson.",['helpt haar de'],[''],3,15,6,[1.0],1.0
seq370-0,small,"; Chinees Porselein uit het Rijksmuseum t/m 23 juni in de Zuidvleugel Rijksmuseum, Hobbemastraat 19, Amsterdam;","<extra_id_0> Porselein uit het Rijksmuseum t/m 23 juni in de Zuidvleugel Rijksmuseum, Hobbemastraat 19, Amsterdam;","- Porselein uit het Rijksmuseum t/m 23 juni in de Zuidvleugel Rijksmuseum, Hobbemastraat 19, Amsterdam;",['; Chinees'],['-'],2,15,6,[1.0],1.0
seq371-0,small,"The Sound of Music (Robert Wise, 1965, VS). Onsterfelijke musical en een van de succesvolste films ooit gemaakt. Iedereen weet dat Julie Andrews als gouvernante het gezin van Christopher Plummer opvrolijkt.","The Sound of Music (Robert Wise, 1965, VS). Onsterfelijke musical en een van de succesvolste films ooit gemaakt. Iedereen weet dat Julie Andrews <extra_id_0> van Christopher Plummer opvrolijkt.","The Sound of Music (Robert Wise, 1965, VS). Onsterfelijke musical en een van de succesvolste films ooit gemaakt. Iedereen weet dat Julie Andrews de soundtrack van Christopher Plummer opvrolijkt.",['als gouvernante het gezin'],['de soundtrack'],5,15,6,[0.8],0.8
seq372-0,small,levensverhaal van de Argentijnse First Lady Eva Pern werd een filmisch ballet vol aansprekende bijna,<extra_id_0> de Argentijnse First Lady Eva Pern werd een filmisch ballet vol aansprekende bijna,Volgend jaar de Argentijnse First Lady Eva Pern werd een filmisch ballet vol aansprekende bijna,['levensverhaal van'],['Volgend jaar'],2,15,6,[0.8235294117647058],0.82
seq373-0,small,"Speciaal voor jonge lezers met dyslexie geeft uitgeverij Kluitman een aantal populaire jeugdboeken opnieuw uit, gezet","Speciaal voor jonge lezers met dyslexie geeft uitgeverij <extra_id_0> aantal populaire jeugdboeken opnieuw uit, gezet","Speciaal voor jonge lezers met dyslexie geeft uitgeverij een aantal populaire jeugdboeken opnieuw uit, gezet",['Kluitman een'],['een'],2,15,6,[0.75],0.75
seq374-0,small,"e veroordeelde hasjhandelaar op bankrekeningen in Luxemburg had staan, zou worden overgeboekt naar een Nederlandse rekening. H","e veroordeelde hasjhandelaar op bankrekeningen in Luxemburg had staan, zou worden overgeboekt <extra_id_0> rekening. H","e veroordeelde hasjhandelaar op bankrekeningen in Luxemburg had staan, zou worden overgeboekt op mijn rekening. H",['naar een Nederlandse'],['op mijn'],3,15,6,[0.9],0.9
seq375-0,small,In deze rubriek bespreekt Martijn Kleppe maandelijks het gebruik van een opmerkelijke nieuwsfoto. Vandaag: de,In deze rubriek bespreekt Martijn Kleppe <extra_id_0> gebruik van een opmerkelijke nieuwsfoto. Vandaag: de,In deze rubriek bespreekt Martijn Kleppe gebruik van een opmerkelijke nieuwsfoto. Vandaag: de,['maandelijks het'],[''],2,15,6,[1.0],1.0
seq376-0,small,". Minou Bosua en Ingrid Werner, alias de Bloeiende Maagden, spelen cabaret over de zin van het leven, als een spannende quiz met diverse kandidaten en harde vragen. 2",". Minou Bosua en Ingrid Werner, <extra_id_0> spelen cabaret over de zin van het leven, als een spannende quiz met diverse kandidaten en harde vragen. 2",". Minou Bosua en Ingrid Werner, de kandidaten spelen cabaret over de zin van het leven, als een spannende quiz met diverse kandidaten en harde vragen. 2","['alias de Bloeiende Maagden,']",['de kandidaten'],4,15,6,[0.7037037037037037],0.7
seq377-0,small,autodief (David Caruso) die onder druk van de politie (Samuel L. Jackson) een gangsterkoning (Nicolas Cage) verraadt.,autodief (David Caruso) die onder druk van de politie <extra_id_0> een gangsterkoning (Nicolas Cage) verraadt.,autodief (David Caruso) die onder druk van de politie van een gangsterkoning (Nicolas Cage) verraadt.,['(Samuel L. Jackson)'],['van'],3,15,6,[0.8947368421052632],0.89
seq378-0,small,wordt in Nederland vervolgd omdat hij in het Medisch Spectrum Twente jarenlang opzettelijk verkeerde diagnoses van ziektes als alzheimer en parkinson stelde. Ook werden mogelijk onnodig hersenoperaties uitgevoerd als gevolg van zijn diagnoses.,wordt in Nederland vervolgd omdat hij in het Medisch Spectrum <extra_id_0> diagnoses van ziektes als alzheimer en parkinson stelde. Ook werden mogelijk onnodig hersenoperaties uitgevoerd als gevolg van zijn diagnoses.,wordt in Nederland vervolgd omdat hij in het Medisch Spectrum Dubbel diagnoses van ziektes als alzheimer en parkinson stelde. Ook werden mogelijk onnodig hersenoperaties uitgevoerd als gevolg van zijn diagnoses.,['Twente jarenlang opzettelijk verkeerde'],['Dubbel'],5,15,6,[0.9473684210526315],0.95
seq379-0,small,De Hollandse kant van Friesland t/m 31 dec; Levenslijnen t/m 31 dec; Kunstland t/m 31 dec; Mata Hari t/m 31 dec; Claudy Jongstra in het Eysingahuis t/m 31 dec;,De Hollandse kant van Friesland t/m 31 dec; Levenslijnen t/m 31 dec; Kunstland t/m 31 dec; <extra_id_0> dec; Claudy Jongstra in het Eysingahuis t/m 31 dec;,De Hollandse kant van Friesland t/m 31 dec; Levenslijnen t/m 31 dec; Kunstland t/m 31 dec; t/m 31 dec; Claudy Jongstra in het Eysingahuis t/m 31 dec;,['Mata Hari t/m 31'],['t/m 31'],4,15,6,[0.625],0.62
seq380-0,small,"De stad door de jaren, de geschiedenis van Amsterdam 1880-1998 t/m 1 nov en Beroep Huisvrouw. 1898-1998: 100 jaar huisvrouwenleven in de grote stad t/m 16 aug in het Amsterdams Historisch Museum, Kalverstraat 92. Ma t/m vr 10-17u, za/zo 11-17u","De stad door de jaren, de geschiedenis van Amsterdam 1880-1998 t/m 1 nov en Beroep Huisvrouw. 1898-1998: 100 jaar huisvrouwenleven in de grote stad t/m 16 aug in <extra_id_0> Museum, Kalverstraat <extra_id_1> vr 10-17u, za/zo 11-17u","De stad door de jaren, de geschiedenis van Amsterdam 1880-1998 t/m 1 nov en Beroep Huisvrouw. 1898-1998: 100 jaar huisvrouwenleven in de grote stad t/m 16 aug in Amsterdam Museum, Kalverstraat vr 10-17u, za/zo 11-17u","['het Amsterdams Historisch', '92. Ma t/m']","['Amsterdam', '']",6,15,6,"[0.64, 1.0]",0.82
seq381-0,small,een pijnlijke boodschap verteerbaar voor een breed publiek: over het morele faillissement van het traditionele gezin en de materialistische schijnwereld van,een pijnlijke boodschap verteerbaar voor een breed publiek: over het morele faillissement <extra_id_0> gezin en de materialistische schijnwereld van,een pijnlijke boodschap verteerbaar voor een breed publiek: over het morele faillissement van een gezin en de materialistische schijnwereld van,['van het traditionele'],['van een'],3,15,6,[0.7],0.7
seq382-0,small,man (Kevin Spacey) mondt uit in een serene oefening in spiritualiteit en een troostrijke verkenning van,man (Kevin Spacey) mondt uit in een serene oefening in <extra_id_0> een troostrijke verkenning van,man (Kevin Spacey) mondt uit in een serene oefening in de eerste minuut van een troostrijke verkenning van,['spiritualiteit en'],['de eerste minuut van'],2,15,6,[0.7],0.7
seq383-0,small,". Russell Crowe is een onkreukbare, tot gladiator gedegradeerde generaal die het opneemt tegen de corrupte keizer Joaquin Phoenix.",". Russell Crowe is een onkreukbare, tot gladiator gedegradeerde generaal die het <extra_id_0> corrupte keizer Joaquin Phoenix.",". Russell Crowe is een onkreukbare, tot gladiator gedegradeerde generaal die het verhaal van de corrupte keizer Joaquin Phoenix.",['opneemt tegen de'],['verhaal van de'],3,15,6,[0.6875],0.69
seq384-0,small,"u. Ransom (Ron Howard, 1996, VS). Door en door Amerikaans vehikel voor Mel Gibson levert het zoveelste bewijs dat de burger beter het recht in eigen hand kan nemen. Luchtvaart","u. Ransom (Ron Howard, 1996, VS). Door en door Amerikaans vehikel voor Mel Gibson <extra_id_0> dat de burger beter het recht in eigen hand kan nemen. Luchtvaart","u. Ransom (Ron Howard, 1996, VS). Door en door Amerikaans vehikel voor Mel Gibson Het is logisch dat de burger beter het recht in eigen hand kan nemen. Luchtvaart",['levert het zoveelste bewijs'],['Het is logisch'],4,15,6,[0.7777777777777778],0.78
seq385-0,small,t/m 16 sept in The National Gallery 00-442077472865 & www.nationalgallery.org.uk; t/m 12 aug Take one picture in de National Gallery 00-442077472885 & nationalgallery.org.uk; t,t/m 16 sept in The National Gallery 00-442077472865 & www.nationalgallery.org.uk; t/m 12 aug Take one picture in de National Gallery <extra_id_0>,t/m 16 sept in The National Gallery 00-442077472865 & www.nationalgallery.org.uk; t/m 12 aug Take one picture in de National Gallery,['00-442077472885 & nationalgallery.org.uk; t'],[''],4,15,6,[1.0],1.0
seq386-0,small,"-neutraal. En dus minder belastend voor het milieu dan produkten uit aardolie. Tot voor kort had de industrie er weinig belangstelling voor, maar nu is er een doorbraak.","-neutraal. En dus minder belastend voor het milieu dan produkten uit aardolie. Tot voor kort had de industrie er weinig belangstelling voor, maar <extra_id_0> doorbraak.","-neutraal. En dus minder belastend voor het milieu dan produkten uit aardolie. Tot voor kort had de industrie er weinig belangstelling voor, maar toch waren er problemen met de doorbraak.",['nu is er een'],['toch waren er problemen met de'],4,15,6,[0.7333333333333333],0.73
seq387-0,small,"Interart, onder de rook van Den Bosch, heeft zich de afgelopen jaren een speciale plaats onder de Nederlandse beeldentuinen verworven.","Interart, onder de rook van <extra_id_0> zich de afgelopen jaren een speciale plaats onder de Nederlandse beeldentuinen verworven.","Interart, onder de rook van de kunstenaars, zich de afgelopen jaren een speciale plaats onder de Nederlandse beeldentuinen verworven.","['Den Bosch', 'heeft']","['de kunstenaars,']",3,15,6,[0.8666666666666667],0.87
seq388-0,small,oor seksuele honger gevoede relatie tussen serveerster Jessica Lange en oplichter Jack Nicholson leidt tot,oor seksuele honger gevoede relatie tussen <extra_id_0> Lange en oplichter Jack Nicholson leidt tot,oor seksuele honger gevoede relatie tussen acteur Kevin Lange en oplichter Jack Nicholson leidt tot,['serveerster Jessica'],['acteur Kevin'],2,15,6,[0.7368421052631579],0.74
seq389-0,small,satirische komedie met een voor de Edwards-aanhangers onweerstaanbaar geestige mengeling van hoogstaande slapstick en terloopse subtiliteiten.,satirische komedie met een voor de Edwards-aanhangers onweerstaanbaar geestige mengeling van <extra_id_0> en terloopse subtiliteiten.,satirische komedie met een voor de Edwards-aanhangers onweerstaanbaar geestige mengeling van mysterieuze en terloopse subtiliteiten.,['hoogstaande slapstick'],['mysterieuze'],2,15,6,[0.8571428571428571],0.86
seq390-0,small,zien? Mail je suggestie naar nextcheckt@nrc.nl of tip de redactie via Twitter met hashtag #nextcheckt.,zien? Mail je suggestie naar nextcheckt@nrc.nl <extra_id_0> de redactie via Twitter met hashtag #nextcheckt.,zien? Mail je suggestie naar nextcheckt@nrc.nl of de redactie via Twitter met hashtag #nextcheckt.,['of tip'],['of'],2,15,6,[0.6666666666666666],0.67
seq391-0,small,die zich in de Britse jaren dertig zo volmaakt als butler heeft opgesteld dat hij in 1958 nog steeds niet weet hoe hij moet leven.,die zich in de Britse jaren dertig zo volmaakt als butler heeft opgesteld dat hij in 1958 nog steeds <extra_id_0> moet leven.,die zich in de Britse jaren dertig zo volmaakt als butler heeft opgesteld dat hij in 1958 nog steeds in de jaren dertig moet leven.,['niet weet hoe hij'],['in de jaren dertig'],4,15,6,[0.7222222222222222],0.72
seq392-0,small,. De Britse wijnjournalist Oz Clarke probeert zijn collega van het autoprogramma Top Gear de beginselen van de oenologie bij te brengen.,. De Britse wijnjournalist Oz Clarke probeert zijn collega van het autoprogramma <extra_id_0> beginselen van de oenologie bij te brengen.,. De Britse wijnjournalist Oz Clarke probeert zijn collega van het autoprogramma de beginselen van de oenologie bij te brengen.,['Top Gear de'],['de'],3,15,6,[0.8181818181818182],0.82
seq393-0,small,"over Curaao waar vijftig etnische groepen, waaronder Portugezen, Surinamers, joden, Indirs, Arabieren, Nederlanders en Colombianen naast elkaar leven.","over Curaao waar vijftig etnische groepen, waaronder Portugezen, Surinamers, <extra_id_0> Nederlanders en Colombianen naast elkaar leven.","over Curaao waar vijftig etnische groepen, waaronder Portugezen, Surinamers, Fransen, Nederlanders en Colombianen naast elkaar leven.","['joden', 'Indirs', 'Arabieren,']","['Fransen,']",3,15,6,[0.75],0.75
seq394-0,small,". Liz Snoijink en Peter Tuinman in een suggestieve toneelversie van de film van Theo van Gogh, als het hulpeloze paar dat na de dood van het dochtertje alleen nog maar kan praten via een pijnlijk rollenspel.",. Liz Snoijink en Peter Tuinman in een suggestieve toneelversie van de film van Theo van <extra_id_0> hulpeloze paar dat na de dood van <extra_id_1> nog maar kan praten via een pijnlijk rollenspel.,. Liz Snoijink en Peter Tuinman in een suggestieve toneelversie van de film van Theo van den Berg. Het hulpeloze paar dat na de dood van de moordenaar nog maar kan praten via een pijnlijk rollenspel.,"['Gogh', 'als het', 'het dochtertje alleen']","['den Berg. Het', 'de moordenaar']",6,15,6,"[0.9230769230769231, 0.9230769230769231]",0.92
seq395-0,small,zijn de examenexposities van de kunstacademies weer te bezoeken. In een serie eerste indrukken per school,zijn de examenexposities van de kunstacademies weer <extra_id_0> In een serie eerste indrukken per school,zijn de examenexposities van de kunstacademies weer bekend. In een serie eerste indrukken per school,['te bezoeken.'],['bekend.'],2,15,6,[0.5833333333333334],0.58
seq396-0,small,"u. Color of Night (Richard Rush, 1994, VS). Psychologische thriller wekt onbedoeld de lachlust. Getraumatiseerde psychiater Bruce Willis neemt de praktijk van een vermoorde collega over.","u. Color of Night (Richard Rush, 1994, VS). Psychologische thriller wekt <extra_id_0> psychiater Bruce Willis neemt de praktijk van een vermoorde collega over.","u. Color of Night (Richard Rush, 1994, VS). Psychologische thriller wekt een thriller en psychiater Bruce Willis neemt de praktijk van een vermoorde collega over.",['onbedoeld de lachlust. Getraumatiseerde'],['een thriller en'],4,15,6,[0.7948717948717948],0.79
seq397-0,small,"Marathon Man (John Schlesinger, 1976, VS). Opwindende thriller waarin Dustin Hoffman slachtoffer wordt van de uit Uruguay afkomstige ex-nazi Laurence Olivier. Ingewikkelde plot","Marathon Man (John Schlesinger, 1976, <extra_id_0> waarin Dustin Hoffman slachtoffer wordt van de uit Uruguay afkomstige ex-nazi Laurence Olivier. Ingewikkelde plot","Marathon Man (John Schlesinger, 1976, paperback), waarin Dustin Hoffman slachtoffer wordt van de uit Uruguay afkomstige ex-nazi Laurence Olivier. Ingewikkelde plot",['VS). Opwindende thriller'],"['paperback),']",3,15,6,[0.9166666666666666],0.92
seq398-0,small,Het Verhaal Deze zomer verkent de wetenschapsredactie de relatie tussen de mens en zijn verhalen. Deze week:,Het Verhaal Deze <extra_id_0> wetenschapsredactie de relatie tussen de mens en zijn verhalen. Deze week:,Het Verhaal Deze week: De wetenschapsredactie de relatie tussen de mens en zijn verhalen. Deze week:,['zomer verkent de'],['week: De'],3,15,6,[0.6875],0.69
seq399-0,small,e oorlogsfilm over de mislukte slag om Arnhem (september 1944) werd goeddeels in en om Deventer opgenomen.,e oorlogsfilm over de mislukte slag om Arnhem <extra_id_0> goeddeels in en om Deventer opgenomen.,e oorlogsfilm over de mislukte slag om Arnhem is goeddeels in en om Deventer opgenomen.,['(september 1944) werd'],['is'],3,15,6,[0.9523809523809523],0.95
seq400-0,small,". Criminelen, onder wie psychopaat John Malkovich en seriemoordenaar Steve Buscemi, maken zich meester van het vliegtuig dat hen",". <extra_id_0> psychopaat John Malkovich en seriemoordenaar Steve Buscemi, maken zich meester van het vliegtuig dat hen",". psychopaat John Malkovich en seriemoordenaar Steve Buscemi, maken zich meester van het vliegtuig dat hen","['Criminelen', 'onder wie']",[''],3,15,6,[1.0],1.0
