Sequence id,Model size,Input sequence (ground truth),Input sequence (masked),Model output sequence,Masked tokens,Filled tokens,Number of masked tokens,Masking percentage,Duplicate count,Levenshtein distances,Levenshtein distance (avg)
seq0-0,small,"In de rubriek Aan de grens bericht De Groene over de laatste cijfers en ontwikkelingen op het gebied van vluchtelingen, migranten en grensbeleid. Deze week:","In de <extra_id_0> grens bericht De Groene over de laatste cijfers en ontwikkelingen op het gebied van vluchtelingen, migranten en <extra_id_1>","In de gaten voor de grens bericht De Groene over de laatste cijfers en ontwikkelingen op het gebied van vluchtelingen, migranten en jongeren.","['rubriek Aan de', 'grensbeleid. Deze week:']","['gaten voor de', 'jongeren.']",6,25.0,24,"[0.7142857142857143, 0.8260869565217391]",0.77
seq1-0,small,In zijn Kleine encyclopedie schetst Herman Vuijsje nieuwe inzichten over Nederland aan de hand van neologismen. Deze week:,In zijn Kleine encyclopedie schetst Herman Vuijsje nieuwe <extra_id_0> de hand van neologismen. Deze week:,In zijn Kleine encyclopedie schetst Herman Vuijsje nieuwe termen aan de hand van neologismen. Deze week:,['inzichten over Nederland aan'],['termen aan'],4,25.0,17,[0.6785714285714286],0.68
seq2-0,small, altijd meer dan ze kan of wil bespreken. Hier doet ze verslag van haar bevindingen en overwegingen bij de boeken die ze leest. Deze week:,altijd meer dan ze kan <extra_id_0> Hier <extra_id_1> van haar bevindingen en overwegingen bij de boeken die ze leest. Deze week:,altijd meer dan ze kan Hier een overzicht van haar bevindingen en overwegingen bij de boeken die ze leest. Deze week:,"['of wil bespreken.', 'doet ze verslag']","['', 'een overzicht']",6,25.0,14,"[1.0, 0.7333333333333333]",0.87
seq3-0,small,"De zomerslaap is voorbij, het politieke seizoen is begonnen. De enige die gedurende de lange, landerige zomer nog voor politieke opwinding wist te zorgen, was Frits Bolkestein. Of het nu een tv-optreden bij de VPRO was of een toespraak op een theaterfestival, de VVD-leider stond steeds weer in het nieuws. Met hem opent De Groene daarom het nieuwe politieke jaar.","De zomerslaap is voorbij, het politieke seizoen is begonnen. De enige die gedurende de lange, landerige zomer nog voor politieke <extra_id_0> zorgen, was Frits Bolkestein. Of het nu een tv-optreden bij de <extra_id_1> een toespraak op een theaterfestival, de VVD-leider stond steeds weer <extra_id_2> Met <extra_id_3> Groene daarom <extra_id_4> jaar.","De zomerslaap is voorbij, het politieke seizoen is begonnen. De enige die gedurende de lange, landerige zomer nog voor politieke problemen kwamen te zorgen, was Frits Bolkestein. Of het nu een tv-optreden bij de CDA-leider was of een toespraak op een theaterfestival, de VVD-leider stond steeds weer op de Met de Groene daarom al een jaar.","['opwinding wist te', 'VPRO was of', 'in het nieuws.', 'hem opent De', 'het nieuwe politieke']","['problemen kwamen te', 'CDA-leider was of', 'op de', 'de', 'al een']",15,25.0,12,"[0.7368421052631579, 0.5882352941176471, 0.8571428571428571, 0.9166666666666666, 0.85]",0.79
seq4-0,small,Groene-redacteur Casper Thomas schrijft vanuit Washington over het Amerika van Donald Trump. In aflevering,Groene-redacteur Casper Thomas schrijft vanuit Washington over het <extra_id_0> In aflevering,Groene-redacteur Casper Thomas schrijft vanuit Washington over het verhaal. In aflevering,['Amerika van Donald Trump.'],['verhaal.'],4,25.0,11,[0.76],0.76
seq5-0,small,De vaste kunstcritici van De Groene Amsterdammer selecteerden de meest in het oog springende cultuur van het nieuwe kunstseizoen. Tip,De vaste kunstcritici van De Groene Amsterdammer selecteerden de meest in het oog springende <extra_id_0> het <extra_id_1>,De vaste kunstcritici van De Groene Amsterdammer selecteerden de meest in het oog springende beelden van het publiek.,"['cultuur van', 'nieuwe kunstseizoen. Tip']","['beelden van', 'publiek.']",5,25.0,11,"[0.6363636363636364, 0.8333333333333334]",0.73
seq6-0,small,. Onze podcast is elke vrijdagochtend gratis beschikbaar via groene.nl/podcasts en via de andere bekende podcastkanalen,. Onze <extra_id_0> gratis beschikbaar via groene.nl/podcasts en via de andere bekende podcastkanalen,. Onze podcasts zijn gratis beschikbaar via groene.nl/podcasts en via de andere bekende podcastkanalen,['podcast is elke vrijdagochtend'],['podcasts zijn'],4,25.0,10,[0.6],0.6
seq7-0,small,Mira Feticu ziet overeenkomsten tussen de quarantaine ten tijde van de coronacrisis en haar leven in dictatoriaal Roemeni. Hoe hield ze zich staande onder het bewind van Ceauescu? Deel,Mira Feticu ziet overeenkomsten tussen de quarantaine ten tijde van de coronacrisis en haar leven in dictatoriaal Roemeni. <extra_id_0> zich staande onder <extra_id_1> Deel,Mira Feticu ziet overeenkomsten tussen de quarantaine ten tijde van de coronacrisis en haar leven in dictatoriaal Roemeni. De crisis voelt zich staande onder de coronacrisis. Deel,"['Hoe hield ze', 'het bewind van Ceauescu?']","['De crisis voelt', 'de coronacrisis.']",7,25.0,10,"[0.7333333333333333, 0.7916666666666666]",0.76
seq8-0,small,"Frans Verhagen is lid geworden van de PvdA, want op dit moment in de geschiedenis kun je niet meer blijven toekijken. Deze week:","Frans Verhagen is lid geworden van de PvdA, <extra_id_0> moment in de geschiedenis <extra_id_1> meer blijven toekijken. Deze week:","Frans Verhagen is lid geworden van de PvdA, maar blijft op dit moment in de geschiedenis niet meer blijven toekijken. Deze week:","['want op dit', 'kun je niet']","['maar blijft op dit', 'niet']",6,25.0,9,"[0.5, 0.6363636363636364]",0.57
seq9-0,small,De komende weken zal Menno Grootveld stukken selecteren en vertalen van denkers over corona in de internationale pers. In aflevering,De komende weken zal Menno Grootveld stukken selecteren en vertalen <extra_id_0> over <extra_id_1> internationale pers. In aflevering,De komende weken zal Menno Grootveld stukken selecteren en vertalen naar over internationale pers. In aflevering,"['van denkers', 'corona in de']","['naar', '']",5,25.0,9,"[0.8181818181818182, 1.0]",0.91
seq10-0,small,"Terwijl de pest op de deur klopte, vertelden de Florentijnse jongeren van Giovanni Boccaccio elkaar sterke verhalen over verliefdheid, waanzin en bedrog om de verveling van hun quarantaine te doorbreken. Nu, zevenhonderd jaar later, kunnen we die traditie voortzetten. Verteller nummer","Terwijl de pest op de deur klopte, vertelden de Florentijnse jongeren van Giovanni Boccaccio elkaar sterke verhalen <extra_id_0> en bedrog om de verveling <extra_id_1> doorbreken. <extra_id_2> later, kunnen we die traditie voortzetten. Verteller nummer","Terwijl de pest op de deur klopte, vertelden de Florentijnse jongeren van Giovanni Boccaccio elkaar sterke verhalen over de angst en bedrog om de verveling te doorbreken. Nog later, kunnen we die traditie voortzetten. Verteller nummer","['over verliefdheid', 'waanzin', 'van hun quarantaine te', 'Nu', 'zevenhonderd jaar']","['over de angst', 'te', 'Nog']",10,25.0,8,"[0.6470588235294118, 1.0, 1.0]",0.88
seq11-0,small,Groene-redacteur Casper Thomas schrijft de komende tijd regelmatig vanuit Washington over het Amerika van Donald Trump. In aflevering,Groene-redacteur Casper Thomas schrijft de komende tijd regelmatig vanuit Washington over <extra_id_0> Trump. In aflevering,Groene-redacteur Casper Thomas schrijft de komende tijd regelmatig vanuit Washington over Donald Trump. In aflevering,['het Amerika van Donald'],['Donald'],4,25.0,8,[0.7272727272727273],0.73
seq12-0,small,De komende maanden onderzoeken journalisten Hidde Boersma en Janno Lanjouw hoe de Nederlandse landbouw de stap probeert te zetten naar een milieuvriendelijkere toekomst. Deze week:,De komende maanden onderzoeken journalisten Hidde Boersma en Janno Lanjouw hoe de Nederlandse landbouw de stap probeert te <extra_id_0> milieuvriendelijkere <extra_id_1>,De komende maanden onderzoeken journalisten Hidde Boersma en Janno Lanjouw hoe de Nederlandse landbouw de stap probeert te zetten om milieuvriendelijkere producten te bieden,"['zetten naar een', 'toekomst. Deze week:']","['zetten om', 'bieden']",6,25.0,8,"[0.5333333333333333, 0.9]",0.72
seq13-0,small,"getelde doden en vermisten op de Middellandse Zee was deze week, volgens het Missing Migrants Project (IOM):","getelde doden en vermisten op de Middellandse Zee was deze week, <extra_id_0> Project (IOM):","getelde doden en vermisten op de Middellandse Zee was deze week, IOM International Project (IOM):",['volgens het Missing Migrants'],['IOM International'],4,25.0,7,[0.8214285714285714],0.82
seq14-0,small,Ter gelegenheid van het verschijnen van het volledige vertaalde oeuvre van Sigmund Freud in Nederland herleest Hans Driessen,Ter gelegenheid <extra_id_0> het volledige vertaalde oeuvre van Sigmund Freud in Nederland herleest Hans Driessen,Ter gelegenheid van het volledige vertaalde oeuvre van Sigmund Freud in Nederland herleest Hans Driessen,['van het verschijnen van'],['van'],4,25.0,7,[0.8695652173913043],0.87
seq15-0,small,"de aflevering van Boeken FM, de literatuurpodcast van De Groene en uitgeverij Das Mag, bespreken Joost de Vries en Ellen Deckwitz onder leiding van Peter Buurman","de aflevering van Boeken FM, de literatuurpodcast van De Groene en <extra_id_0> bespreken Joost de <extra_id_1> Deckwitz onder leiding van Peter Buurman","de aflevering van Boeken FM, de literatuurpodcast van De Groene en het bespreken Joost de Jong en Deckwitz onder leiding van Peter Buurman","['uitgeverij Das Mag,', 'Vries en Ellen']","['het', 'Jong en']",6,25.0,7,"[0.9473684210526315, 0.7857142857142857]",0.87
seq16-0,small,"Voor de blog Terug naar Welkom reist journalist Margalith Kleijwegt terug naar het Zuid-Afrikaanse Welkom, een mijnstadje dat ze 27 jaar geleden voor het eerst bezocht samen met fotograaf Ad van Denderen. In deel","Voor de blog Terug naar Welkom reist journalist Margalith Kleijwegt terug naar het Zuid-Afrikaanse Welkom, een mijnstadje dat ze <extra_id_0> voor het eerst bezocht <extra_id_1> fotograaf <extra_id_2> In deel","Voor de blog Terug naar Welkom reist journalist Margalith Kleijwegt terug naar het Zuid-Afrikaanse Welkom, een mijnstadje dat ze inmiddels voor het eerst bezocht is. De fotograaf gaat In deel","['27 jaar geleden', 'samen met', 'Ad van Denderen.']","['inmiddels', 'is. De', 'gaat']",8,25.0,7,"[0.8666666666666667, 0.7777777777777778, 0.9375]",0.86
seq17-0,small,cultuurtips voor dit weekend (en de komende week)  De Groene Amsterdammer Kunst & Cultuur Aanbevolen,cultuurtips <extra_id_0> de komende week) De Groene Amsterdammer Kunst & Cultuur Aanbevolen,cultuurtips (voor de komende week) De Groene Amsterdammer Kunst & Cultuur Aanbevolen,['voor dit weekend (en'],['(voor'],4,25.0,6,[0.85],0.85
seq18-0,small,"zit vol problemen die niemand lijkt te kunnen oplossen. Wie niet goed begrijpt hoe die wereld werkt, is niet gek of dom. Want de wereld s ook complexer, chaotischer en moeilijker te besturen dan voorheen. In een serie interviews laat De Groene","<extra_id_0> niemand lijkt te kunnen oplossen. Wie niet goed begrijpt hoe die wereld werkt, is niet gek of dom. Want de wereld s ook complexer, chaotischer en moeilijker te besturen <extra_id_1> een serie <extra_id_2> Groene","niemand lijkt te kunnen oplossen. Wie niet goed begrijpt hoe die wereld werkt, is niet gek of dom. Want de wereld s ook complexer, chaotischer en moeilijker te besturen En een serie Groene","['zit vol problemen die', 'dan voorheen. In', 'interviews laat De']","['', 'En', '']",10,25.0,6,"[1.0, 0.9375, 1.0]",0.98
seq19-0,small,"In aanloop naar de gemeenteraadsverkiezingen in Rotterdam, waar zowel alle landelijke politieke partijen als vele nieuwkomers aan deelnemen, bloggen Guido van Eijck en Saskia Naafs over de belangrijkste verkiezingsthemas in de Maasstad.","In aanloop naar de gemeenteraadsverkiezingen in Rotterdam, waar zowel alle landelijke politieke partijen als vele nieuwkomers aan deelnemen, bloggen Guido van <extra_id_0> Naafs <extra_id_1> verkiezingsthemas in <extra_id_2>","In aanloop naar de gemeenteraadsverkiezingen in Rotterdam, waar zowel alle landelijke politieke partijen als vele nieuwkomers aan deelnemen, bloggen Guido van der Naafs met verkiezingsthemas in de krant.","['Eijck en Saskia', 'over de belangrijkste', 'de Maasstad.']","['der', 'met', 'krant.']",8,25.0,6,"[0.9333333333333333, 0.9047619047619048, 0.75]",0.86
seq20-0,small,"virtuele rondleidingen door musea, spontane optredens op Instagram en een enkele all-time favourite van een van onze kunstcritici.","virtuele rondleidingen door musea, spontane optredens op Instagram en een <extra_id_0> een van onze kunstcritici.","virtuele rondleidingen door musea, spontane optredens op Instagram en een bezoek aan een van onze kunstcritici.",['enkele all-time favourite van'],['bezoek aan'],4,25.0,6,[0.8275862068965517],0.83
seq21-0,small,"Iedere maand selecteert de boekenredactie van De Groene, uit alle in de voorafgaande maand besproken boeken, d","Iedere maand selecteert de boekenredactie van De Groene, uit alle <extra_id_0> besproken boeken, d","Iedere maand selecteert de boekenredactie van De Groene, uit alle boeken besproken boeken, d",['in de voorafgaande maand'],['boeken'],4,25.0,6,[0.875],0.88
seq22-0,small,Marja Pruis leest altijd meer dan ze kan of wil bespreken. Hier doet ze verslag van haar bevindingen en overwegingen bij de boeken die ze leest. Deze week:,Marja Pruis leest altijd <extra_id_0> kan of wil bespreken. Hier doet ze verslag van haar bevindingen en overwegingen bij de boeken <extra_id_1> week:,Marja Pruis leest altijd wat ik kan of wil bespreken. Hier doet ze verslag van haar bevindingen en overwegingen bij de boeken van deze week:,"['meer dan ze', 'die ze leest. Deze']","['wat ik', 'van deze']",7,25.0,6,"[0.8181818181818182, 0.7777777777777778]",0.8
seq23-0,small,"- ZEER GEHEIM. MINISTERRAAD NR. 15616. Notulen van de vergadering gehouden dinsdag 11 juli 1995 op het ministerie van Defensie, aangevangen s avonds om half acht. pag.",- ZEER GEHEIM. MINISTERRAAD NR. 15616. Notulen van de vergadering gehouden dinsdag 11 juli 1995 op het ministerie <extra_id_0> s avonds <extra_id_1>,- ZEER GEHEIM. MINISTERRAAD NR. 15616. Notulen van de vergadering gehouden dinsdag 11 juli 1995 op het ministerie van Defensie s avonds,"['van Defensie', 'aangevangen', 'om half acht. pag.']","['van Defensie', '']",7,25.0,6,"[0.0, 1.0]",0.5
