Sequence id,Model size,Input sequence (ground truth),Input sequence (masked),Model output sequence,Masked tokens,Filled tokens,Number of masked tokens,Masking percentage,Duplicate count,Levenshtein distances,Levenshtein distance (avg)
seq0-0,xl,"In de rubriek Aan de grens bericht De Groene over de laatste cijfers en ontwikkelingen op het gebied van vluchtelingen, migranten en grensbeleid. Deze week:","In de <extra_id_0> grens bericht De Groene over de laatste cijfers en ontwikkelingen op het gebied van vluchtelingen, migranten en <extra_id_1>","In de rubriek Over de grens bericht De Groene over de laatste cijfers en ontwikkelingen op het gebied van vluchtelingen, migranten en asiel","['rubriek Aan de', 'grensbeleid. Deze week:']","['rubriek Over de', 'asiel']",6,25,24,"[0.26666666666666666, 0.8695652173913043]",0.57
seq1-0,xl,In zijn Kleine encyclopedie schetst Herman Vuijsje nieuwe inzichten over Nederland aan de hand van neologismen. Deze week:,In zijn Kleine encyclopedie schetst Herman Vuijsje nieuwe <extra_id_0> de hand van neologismen. Deze week:,In zijn Kleine encyclopedie schetst Herman Vuijsje nieuwe woorden aan de hand van neologismen. Deze week:,['inzichten over Nederland aan'],['woorden aan'],4,25,17,[0.6785714285714286],0.68
seq2-0,xl, altijd meer dan ze kan of wil bespreken. Hier doet ze verslag van haar bevindingen en overwegingen bij de boeken die ze leest. Deze week:,altijd meer dan ze kan <extra_id_0> Hier <extra_id_1> van haar bevindingen en overwegingen bij de boeken die ze leest. Deze week:,altijd meer dan ze kan lezen. Hier een overzicht van haar bevindingen en overwegingen bij de boeken die ze leest. Deze week:,"['of wil bespreken.', 'doet ze verslag']","['lezen.', 'een overzicht']",6,25,14,"[0.7058823529411765, 0.7333333333333333]",0.72
seq3-0,xl,"De zomerslaap is voorbij, het politieke seizoen is begonnen. De enige die gedurende de lange, landerige zomer nog voor politieke opwinding wist te zorgen, was Frits Bolkestein. Of het nu een tv-optreden bij de VPRO was of een toespraak op een theaterfestival, de VVD-leider stond steeds weer in het nieuws. Met hem opent De Groene daarom het nieuwe politieke jaar.","De zomerslaap is voorbij, het politieke seizoen is begonnen. De enige die gedurende de lange, landerige zomer nog voor politieke <extra_id_0> zorgen, was Frits Bolkestein. Of het nu een tv-optreden bij de <extra_id_1> een toespraak op een theaterfestival, de VVD-leider stond steeds weer <extra_id_2> Met <extra_id_3> Groene daarom <extra_id_4> jaar.","De zomerslaap is voorbij, het politieke seizoen is begonnen. De enige die gedurende de lange, landerige zomer nog voor politieke activiteit kon zorgen, was Frits Bolkestein. Of het nu een tv-optreden bij de NOS was of een toespraak op een theaterfestival, de VVD-leider stond steeds weer in de krant. Met de Groene daarom gaat het over een jaar.","['opwinding wist te', 'VPRO was of', 'in het nieuws.', 'hem opent De', 'het nieuwe politieke']","['activiteit kon', 'NOS was of', 'in de krant.', 'de', 'gaat het over een']",15,25,12,"[0.7647058823529411, 0.36363636363636365, 0.5714285714285714, 0.9166666666666666, 0.75]",0.67
seq4-0,xl,Groene-redacteur Casper Thomas schrijft vanuit Washington over het Amerika van Donald Trump. In aflevering,Groene-redacteur Casper Thomas schrijft vanuit Washington over het <extra_id_0> In aflevering,Groene-redacteur Casper Thomas schrijft vanuit Washington over het nieuwe verkiezingsprogramma. In aflevering,['Amerika van Donald Trump.'],['nieuwe verkiezingsprogramma.'],4,25,11,[0.7857142857142857],0.79
seq5-0,xl,De vaste kunstcritici van De Groene Amsterdammer selecteerden de meest in het oog springende cultuur van het nieuwe kunstseizoen. Tip,De vaste kunstcritici van De Groene Amsterdammer selecteerden de meest in het oog springende <extra_id_0> het <extra_id_1>,De vaste kunstcritici van De Groene Amsterdammer selecteerden de meest in het oog springende werken uit het,"['cultuur van', 'nieuwe kunstseizoen. Tip']","['werken uit', '']",5,25,11,"[0.9090909090909091, 1.0]",0.95
seq6-0,xl,. Onze podcast is elke vrijdagochtend gratis beschikbaar via groene.nl/podcasts en via de andere bekende podcastkanalen,. Onze <extra_id_0> gratis beschikbaar via groene.nl/podcasts en via de andere bekende podcastkanalen,. Onze podcasts zijn gratis beschikbaar via groene.nl/podcasts en via de andere bekende podcastkanalen,['podcast is elke vrijdagochtend'],['podcasts zijn'],4,25,10,[0.6],0.6
seq7-0,xl,Mira Feticu ziet overeenkomsten tussen de quarantaine ten tijde van de coronacrisis en haar leven in dictatoriaal Roemeni. Hoe hield ze zich staande onder het bewind van Ceauescu? Deel,Mira Feticu ziet overeenkomsten tussen de quarantaine ten tijde van de coronacrisis en haar leven in dictatoriaal Roemeni. <extra_id_0> zich staande onder <extra_id_1> Deel,Mira Feticu ziet overeenkomsten tussen de quarantaine ten tijde van de coronacrisis en haar leven in dictatoriaal Roemeni. Ze hield zich staande onder de dictatuur. Deel,"['Hoe hield ze', 'het bewind van Ceauescu?']","['Ze hield', 'de dictatuur.']",7,25,10,"[0.4166666666666667, 0.7916666666666666]",0.6
seq8-0,xl,"Frans Verhagen is lid geworden van de PvdA, want op dit moment in de geschiedenis kun je niet meer blijven toekijken. Deze week:","Frans Verhagen is lid geworden van de PvdA, <extra_id_0> moment in de geschiedenis <extra_id_1> meer blijven toekijken. Deze week:","Frans Verhagen is lid geworden van de PvdA, een moment in de geschiedenis van de partij. De VVD kan niet meer blijven toekijken. Deze week:","['want op dit', 'kun je niet']","['een', 'van de partij. De VVD kan niet']",6,25,9,"[0.9090909090909091, 0.7]",0.8
seq9-0,xl,De komende weken zal Menno Grootveld stukken selecteren en vertalen van denkers over corona in de internationale pers. In aflevering,De komende weken zal Menno Grootveld stukken selecteren en vertalen <extra_id_0> over <extra_id_1> internationale pers. In aflevering,De komende weken zal Menno Grootveld stukken selecteren en vertalen uit de over internationale pers. In aflevering,"['van denkers', 'corona in de']","['uit de', '']",5,25,9,"[0.7272727272727273, 1.0]",0.86
seq10-0,xl,"Terwijl de pest op de deur klopte, vertelden de Florentijnse jongeren van Giovanni Boccaccio elkaar sterke verhalen over verliefdheid, waanzin en bedrog om de verveling van hun quarantaine te doorbreken. Nu, zevenhonderd jaar later, kunnen we die traditie voortzetten. Verteller nummer","Terwijl de pest op de deur klopte, vertelden de Florentijnse jongeren van Giovanni Boccaccio elkaar sterke verhalen <extra_id_0> en bedrog om de verveling <extra_id_1> doorbreken. <extra_id_2> later, kunnen we die traditie voortzetten. Verteller nummer","Terwijl de pest op de deur klopte, vertelden de Florentijnse jongeren van Giovanni Boccaccio elkaar sterke verhalen over geweld en bedrog om de verveling te doorbreken. Nu, veertig jaar later, kunnen we die traditie voortzetten. Verteller nummer","['over verliefdheid', 'waanzin', 'van hun quarantaine te', 'Nu', 'zevenhonderd jaar']","['over geweld', 'te', 'Nu, veertig jaar']",10,25,8,"[0.5294117647058824, 1.0, 0.8181818181818182]",0.78
seq11-0,xl,Groene-redacteur Casper Thomas schrijft de komende tijd regelmatig vanuit Washington over het Amerika van Donald Trump. In aflevering,Groene-redacteur Casper Thomas schrijft de komende tijd regelmatig vanuit Washington over <extra_id_0> Trump. In aflevering,Groene-redacteur Casper Thomas schrijft de komende tijd regelmatig vanuit Washington over de verkiezingscampagne van Donald Trump. In aflevering,['het Amerika van Donald'],['de verkiezingscampagne van Donald'],4,25,8,[0.5454545454545454],0.55
seq12-0,xl,De komende maanden onderzoeken journalisten Hidde Boersma en Janno Lanjouw hoe de Nederlandse landbouw de stap probeert te zetten naar een milieuvriendelijkere toekomst. Deze week:,De komende maanden onderzoeken journalisten Hidde Boersma en Janno Lanjouw hoe de Nederlandse landbouw de stap probeert te <extra_id_0> milieuvriendelijkere <extra_id_1>,De komende maanden onderzoeken journalisten Hidde Boersma en Janno Lanjouw hoe de Nederlandse landbouw de stap probeert te maken naar een milieuvriendelijkere voeding.,"['zetten naar een', 'toekomst. Deze week:']","['maken naar een', 'voeding.']",6,25,8,"[0.26666666666666666, 0.85]",0.56
seq13-0,xl,"getelde doden en vermisten op de Middellandse Zee was deze week, volgens het Missing Migrants Project (IOM):","getelde doden en vermisten op de Middellandse Zee was deze week, <extra_id_0> Project (IOM):","getelde doden en vermisten op de Middellandse Zee was deze week, volgens de International Maritime Project (IOM):",['volgens het Missing Migrants'],['volgens de International Maritime'],4,25,7,[0.5757575757575758],0.58
seq14-0,xl,Ter gelegenheid van het verschijnen van het volledige vertaalde oeuvre van Sigmund Freud in Nederland herleest Hans Driessen,Ter gelegenheid <extra_id_0> het volledige vertaalde oeuvre van Sigmund Freud in Nederland herleest Hans Driessen,Ter gelegenheid van de vertaling van het volledige vertaalde oeuvre van Sigmund Freud in Nederland herleest Hans Driessen,['van het verschijnen van'],['van de vertaling van'],4,25,7,[0.34782608695652173],0.35
seq15-0,xl,"de aflevering van Boeken FM, de literatuurpodcast van De Groene en uitgeverij Das Mag, bespreken Joost de Vries en Ellen Deckwitz onder leiding van Peter Buurman","de aflevering van Boeken FM, de literatuurpodcast van De Groene en <extra_id_0> bespreken Joost de <extra_id_1> Deckwitz onder leiding van Peter Buurman","de aflevering van Boeken FM, de literatuurpodcast van De Groene en de Volkskrant. We bespreken Joost de Vries en Willem Deckwitz onder leiding van Peter Buurman","['uitgeverij Das Mag,', 'Vries en Ellen']","['de Volkskrant. We', 'Vries en Willem']",6,25,7,"[0.9473684210526315, 0.2]",0.57
seq16-0,xl,"Voor de blog Terug naar Welkom reist journalist Margalith Kleijwegt terug naar het Zuid-Afrikaanse Welkom, een mijnstadje dat ze 27 jaar geleden voor het eerst bezocht samen met fotograaf Ad van Denderen. In deel","Voor de blog Terug naar Welkom reist journalist Margalith Kleijwegt terug naar het Zuid-Afrikaanse Welkom, een mijnstadje dat ze <extra_id_0> voor het eerst bezocht <extra_id_1> fotograaf <extra_id_2> In deel","Voor de blog Terug naar Welkom reist journalist Margalith Kleijwegt terug naar het Zuid-Afrikaanse Welkom, een mijnstadje dat ze in 2009 voor het eerst bezocht De fotograaf van de eerste editie van de blog In deel","['27 jaar geleden', 'samen met', 'Ad van Denderen.']","['in 2009', 'De', 'van de eerste editie van de blog']",8,25,7,"[0.9333333333333333, 0.8888888888888888, 0.78125]",0.87
seq17-0,xl,cultuurtips voor dit weekend (en de komende week)  De Groene Amsterdammer Kunst & Cultuur Aanbevolen,cultuurtips <extra_id_0> de komende week) De Groene Amsterdammer Kunst & Cultuur Aanbevolen,cultuurtips voor de komende week) De Groene Amsterdammer Kunst & Cultuur Aanbevolen,['voor dit weekend (en'],['voor'],4,25,6,[0.8],0.8
seq18-0,xl,"zit vol problemen die niemand lijkt te kunnen oplossen. Wie niet goed begrijpt hoe die wereld werkt, is niet gek of dom. Want de wereld s ook complexer, chaotischer en moeilijker te besturen dan voorheen. In een serie interviews laat De Groene","<extra_id_0> niemand lijkt te kunnen oplossen. Wie niet goed begrijpt hoe die wereld werkt, is niet gek of dom. Want de wereld s ook complexer, chaotischer en moeilijker te besturen <extra_id_1> een serie <extra_id_2> Groene","die niemand lijkt te kunnen oplossen. Wie niet goed begrijpt hoe die wereld werkt, is niet gek of dom. Want de wereld s ook complexer, chaotischer en moeilijker te besturen dan een serie probleem. Groene","['zit vol problemen die', 'dan voorheen. In', 'interviews laat De']","['die', 'dan', 'probleem.']",10,25,6,"[0.8571428571428571, 0.8125, 0.8888888888888888]",0.85
seq19-0,xl,"In aanloop naar de gemeenteraadsverkiezingen in Rotterdam, waar zowel alle landelijke politieke partijen als vele nieuwkomers aan deelnemen, bloggen Guido van Eijck en Saskia Naafs over de belangrijkste verkiezingsthemas in de Maasstad.","In aanloop naar de gemeenteraadsverkiezingen in Rotterdam, waar zowel alle landelijke politieke partijen als vele nieuwkomers aan deelnemen, bloggen Guido van <extra_id_0> Naafs <extra_id_1> verkiezingsthemas in <extra_id_2>","In aanloop naar de gemeenteraadsverkiezingen in Rotterdam, waar zowel alle landelijke politieke partijen als vele nieuwkomers aan deelnemen, bloggen Guido van der Naafs over de verkiezingsthemas in de Rotterdamse politiek.","['Eijck en Saskia', 'over de belangrijkste', 'de Maasstad.']","['der', 'over de', 'politiek.']",8,25,6,"[0.9333333333333333, 0.6666666666666666, 0.9166666666666666]",0.84
seq20-0,xl,"virtuele rondleidingen door musea, spontane optredens op Instagram en een enkele all-time favourite van een van onze kunstcritici.","virtuele rondleidingen door musea, spontane optredens op Instagram en een <extra_id_0> een van onze kunstcritici.","virtuele rondleidingen door musea, spontane optredens op Instagram en een gesprek met een van onze kunstcritici.",['enkele all-time favourite van'],['gesprek met'],4,25,6,[0.8620689655172413],0.86
seq21-0,xl,"Iedere maand selecteert de boekenredactie van De Groene, uit alle in de voorafgaande maand besproken boeken, d","Iedere maand selecteert de boekenredactie van De Groene, uit alle <extra_id_0> besproken boeken, d","Iedere maand selecteert de boekenredactie van De Groene, uit alle eerder besproken boeken, d",['in de voorafgaande maand'],['eerder'],4,25,6,[0.8333333333333334],0.83
seq22-0,xl,Marja Pruis leest altijd meer dan ze kan of wil bespreken. Hier doet ze verslag van haar bevindingen en overwegingen bij de boeken die ze leest. Deze week:,Marja Pruis leest altijd <extra_id_0> kan of wil bespreken. Hier doet ze verslag van haar bevindingen en overwegingen bij de boeken <extra_id_1> week:,Marja Pruis leest altijd boeken die ze met anderen kan of wil bespreken. Hier doet ze verslag van haar bevindingen en overwegingen bij de boeken van de week:,"['meer dan ze', 'die ze leest. Deze']","['boeken die ze met anderen', 'van de']",7,25,6,"[0.72, 0.8888888888888888]",0.8
seq23-0,xl,"- ZEER GEHEIM. MINISTERRAAD NR. 15616. Notulen van de vergadering gehouden dinsdag 11 juli 1995 op het ministerie van Defensie, aangevangen s avonds om half acht. pag.",- ZEER GEHEIM. MINISTERRAAD NR. 15616. Notulen van de vergadering gehouden dinsdag 11 juli 1995 op het ministerie <extra_id_0> s avonds <extra_id_1>,- ZEER GEHEIM. MINISTERRAAD NR. 15616. Notulen van de vergadering gehouden dinsdag 11 juli 1995 op het ministerie van Justitie s avonds omstreeks,"['van Defensie', 'aangevangen', 'om half acht. pag.']","['van Justitie', 'omstreeks']",7,25,6,"[0.5, 1.0]",0.75
