seq37-0,base,Eerder deze maand kondigde French Gates aan dat ze de Bill & Melinda Gates Foundation (BMGF) ging verlaten.,Eerder deze maand kondigde French Gates <extra_id_0> de Bill & Melinda Gates Foundation (BMGF) ging verlaten.,Eerder deze maand kondigde French Gates aan de Bill & Melinda Gates Foundation (BMGF) ging verlaten.,['aan dat ze'],['aan'],3,15,1,[0.7],0.7
seq38-0,base,"Stoelen, banken, pallets, fietsen  de barricades die zijn opgeworpen door de demonstranten die het universiteitsgebouw in de Amsterdamse binnenstad hebben bezet, blijken weinig partij voor de ME.","Stoelen, banken, pallets, fietsen de barricades die zijn opgeworpen door de demonstranten die het universiteitsgebouw in de Amsterdamse binnenstad hebben bezet, blijken <extra_id_0> ME.","Stoelen, banken, pallets, fietsen de barricades die zijn opgeworpen door de demonstranten die het universiteitsgebouw in de Amsterdamse binnenstad hebben bezet, blijken ME.",['weinig partij voor de'],[''],4,15,1,[1.0],1.0
seq39-0,base,"Wonen in een comfortabel verwarmd huis van steen met een pannendak: dat was voor het gros van de mensen in het verleden een utopie. Het zag er wellicht romantisch uit zon lieflijk huisje, maar er werd bittere armoede geleden.","Wonen in een comfortabel verwarmd huis van steen met een pannendak: dat was voor het gros van de mensen in het verleden <extra_id_0> zag er wellicht romantisch uit zon lieflijk huisje, <extra_id_1> bittere armoede geleden.","Wonen in een comfortabel verwarmd huis van steen met een pannendak: dat was voor het gros van de mensen in het verleden Het zag er wellicht romantisch uit zon lieflijk huisje, maar het was in bittere armoede geleden.","['een utopie. Het', 'maar er werd']","['Het', 'maar het was in']",6,15,1,"[0.8, 0.4666666666666667]",0.63
seq40-0,base,"Griekenland stuurt asielzoekers die al aan land zijn terug de zee op en laat hen achter in rubberbootjes, hebben ngos en journalisten gedocumenteerd.","Griekenland stuurt asielzoekers die al aan land zijn terug de zee op en <extra_id_0> in rubberbootjes, hebben ngos en journalisten gedocumenteerd.","Griekenland stuurt asielzoekers die al aan land zijn terug de zee op en schippen ze in rubberbootjes, hebben ngos en journalisten gedocumenteerd.",['laat hen achter'],['schippen ze'],3,15,1,[0.7333333333333333],0.73
seq41-0,base,De elfde editie van de Willem IV Rally was een groot succes. Dat meldt Arne Verwoert van de organisatie. Dit jaar is er ruim 11.500 euro opgehaald voor het Ronald McDonald Huis Sophia Rotterdam.,De elfde editie van de Willem IV Rally was een groot succes. Dat meldt Arne Verwoert <extra_id_0> organisatie. Dit jaar <extra_id_1> 11.500 euro opgehaald voor het Ronald McDonald Huis Sophia Rotterdam.,De elfde editie van de Willem IV Rally was een groot succes. Dat meldt Arne Verwoert van de organisatie. Dit jaar werd er 11.500 euro opgehaald voor het Ronald McDonald Huis Sophia Rotterdam.,"['van de', 'is er ruim']","['van de', 'werd er']",5,15,1,"[0.0, 0.8]",0.4
seq42-0,base,Een groep hardnekkige verslaafden heeft het toiletgebouw in een Utrechts park gekaapt en daar hun eigen drugshol ingericht. Ze omzeilen zo ongestoord en onbestraft het verbod om drugs op straat te gebruiken.,Een groep hardnekkige <extra_id_0> toiletgebouw in een Utrechts park gekaapt <extra_id_1> hun eigen drugshol ingericht. Ze omzeilen zo ongestoord en onbestraft het verbod om drugs op straat te gebruiken.,Een groep hardnekkige jongeren heeft een toiletgebouw in een Utrechts park gekaapt en hun eigen drugshol ingericht. Ze omzeilen zo ongestoord en onbestraft het verbod om drugs op straat te gebruiken.,"['verslaafden heeft het', 'en daar']","['jongeren heeft een', 'en']",5,15,1,"[0.5238095238095238, 0.7142857142857143]",0.62
seq43-0,base,Cees Dekker | hoogleraar biofysica Hoe is het leven ontstaan? Synthetische cellen maken dat inzichtelijk. Als je zoiets zelf bouwt ga je begrijpen hoe het werkt.,Cees Dekker | hoogleraar biofysica Hoe is <extra_id_0> cellen maken dat inzichtelijk. Als je zoiets zelf bouwt ga je begrijpen hoe het werkt.,Cees Dekker | hoogleraar biofysica Hoe is dat? De cellen maken dat inzichtelijk. Als je zoiets zelf bouwt ga je begrijpen hoe het werkt.,['het leven ontstaan? Synthetische'],['dat? De'],4,15,1,[0.875],0.88
seq44-0,base,De herdenking van de landing van de geallieerden in Normandi roept vragen op over waar het Westen anno 2024 staat.,De herdenking van de landing van de geallieerden in Normandi roept vragen <extra_id_0> het Westen anno 2024 staat.,De herdenking van de landing van de geallieerden in Normandi roept vragen op waar het Westen anno 2024 staat.,['op over waar'],['op waar'],3,15,1,[0.4166666666666667],0.42
seq45-0,base,Politiek verslaggever Hans van Soest schrijft wekelijks over Haagse zaken die ons allemaal aangaan. In deze aflevering: Nog altijd is er geen regeling voor zware beroepen.,Politiek verslaggever Hans van Soest schrijft wekelijks over Haagse zaken die <extra_id_0> deze aflevering: Nog altijd is er geen regeling voor zware beroepen.,Politiek verslaggever Hans van Soest schrijft wekelijks over Haagse zaken die In deze aflevering: Nog altijd is er geen regeling voor zware beroepen.,['ons allemaal aangaan. In'],['In'],4,15,1,[0.9166666666666666],0.92
seq46-0,base,Na eerdere problemen rond de vergunning mag de bouw van een boorplatform in de Noordzee worden hervat. Milieuorganisaties hadden een rechtszaak aangespannen om de bouw tegen te houden.,Na eerdere problemen rond de vergunning mag de bouw van een boorplatform in de Noordzee worden hervat. Milieuorganisaties hadden een rechtszaak aangespannen om de <extra_id_0>,Na eerdere problemen rond de vergunning mag de bouw van een boorplatform in de Noordzee worden hervat. Milieuorganisaties hadden een rechtszaak aangespannen om de vergunning te wijzigen,['bouw tegen te houden.'],['wijzigen'],4,15,1,[0.8571428571428571],0.86
seq47-0,base,Daan en het ongelijk van de rommelmarktheks Uren samen spelen is verruild voor me-time op eigen kamers. Daan Rot schrijft in weekendmagazine Mezza wekelijks over zijn persoonlijk leven,Daan en het ongelijk van de rommelmarktheks Uren samen spelen is <extra_id_0> eigen kamers. Daan Rot schrijft in weekendmagazine Mezza wekelijks over zijn persoonlijk leven,Daan en het ongelijk van de rommelmarktheks Uren samen spelen is een droom in eigen kamers. Daan Rot schrijft in weekendmagazine Mezza wekelijks over zijn persoonlijk leven,['verruild voor me-time op'],['een droom in'],4,15,1,[0.75],0.75
seq48-0,base,Inwoners van het Friese Waadhoeke hebben tot maandochtend moeten wachten op de verkiezingsuitslag van de Europese verkiezingen. Die lag veilig opgeborgen in een kluis in het gemeentehuis waar in het weekend een tijdslot op zit.,Inwoners van het Friese Waadhoeke hebben tot maandochtend moeten wachten op de verkiezingsuitslag <extra_id_0> Europese verkiezingen. Die lag veilig opgeborgen in een kluis in het gemeentehuis waar in het weekend <extra_id_1> zit.,Inwoners van het Friese Waadhoeke hebben tot maandochtend moeten wachten op de verkiezingsuitslag van de Europese verkiezingen. Die lag veilig opgeborgen in een kluis in het gemeentehuis waar in het weekend de verkiezingsuitslag zit.,"['van de', 'een tijdslot op']","['van de', 'de verkiezingsuitslag']",5,15,1,"[0.0, 0.7619047619047619]",0.38
seq49-0,base,Een beruchte hackersgroep stelt gevoelige informatie van in totaal 560 miljoen klanten van Ticketmaster te hebben gestolen. De groep eist omgerekend zon 460 duizend euro losgeld van het Amerikaanse kaartverkoopbedrijf.,Een beruchte hackersgroep stelt gevoelige informatie van in <extra_id_0> van Ticketmaster te hebben gestolen. De groep eist omgerekend zon 460 duizend euro losgeld van het Amerikaanse kaartverkoopbedrijf.,Een beruchte hackersgroep stelt gevoelige informatie van in kaarten van Ticketmaster te hebben gestolen. De groep eist omgerekend zon 460 duizend euro losgeld van het Amerikaanse kaartverkoopbedrijf.,['totaal 560 miljoen klanten'],['kaarten'],4,15,1,[0.8076923076923077],0.81
seq50-0,base,"Honderden paginas aan ambtelijk commentaar op het Hoofdlijnenakkoord van PVV, VVD, NSC en BBB zijn vrijgegeven. Er zijn grote vraagtekens op allerlei terreinen, van het buitenlandbeleid en defensie tot landbouw en sociale zekerheid.","Honderden paginas aan ambtelijk commentaar <extra_id_0> van PVV, VVD, NSC en BBB zijn vrijgegeven. Er zijn <extra_id_1> op allerlei terreinen, van het buitenlandbeleid en defensie tot landbouw en sociale zekerheid.","Honderden paginas aan ambtelijk commentaar over de activiteiten van PVV, VVD, NSC en BBB zijn vrijgegeven. Er zijn analyses gemaakt op allerlei terreinen, van het buitenlandbeleid en defensie tot landbouw en sociale zekerheid.","['op het Hoofdlijnenakkoord', 'grote vraagtekens']","['over de activiteiten', 'analyses gemaakt']",5,15,1,"[0.84, 0.9411764705882353]",0.89
seq51-0,base,"Naar aanleiding van de grote hoeveelheid pfas in eieren rond de fabriek van Chemours in Dordrecht, start het RIVM een nieuw onderzoek.","Naar aanleiding van de grote hoeveelheid pfas in eieren rond de fabriek <extra_id_0> Dordrecht, start het RIVM een nieuw onderzoek.","Naar aanleiding van de grote hoeveelheid pfas in eieren rond de fabriek in Dordrecht, start het RIVM een nieuw onderzoek.",['van Chemours in'],['in'],3,15,1,[0.8666666666666667],0.87
seq52-0,base,De gemeente Voorne aan Zee wil dat er over de huisvesting van arbeidsmigranten goede afspraken komen.,De gemeente Voorne aan Zee wil dat er over de huisvesting van arbeidsmigranten <extra_id_0> komen.,De gemeente Voorne aan Zee wil dat er over de huisvesting van arbeidsmigranten zou komen.,['goede afspraken'],['zou'],2,15,1,[0.9333333333333333],0.93
seq53-0,base,Aan het veluweplein in Den Haag zijn zondagochtend drie personen aangehouden na een crash met een gesloten motor. De kruising was langere tijd afgesloten vanwege politieonderzoek.,Aan het veluweplein in Den Haag zijn zondagochtend drie personen aangehouden na een crash met een gesloten <extra_id_0> langere tijd afgesloten vanwege politieonderzoek.,Aan het veluweplein in Den Haag zijn zondagochtend drie personen aangehouden na een crash met een gesloten wachtkamer langere tijd afgesloten vanwege politieonderzoek.,['motor. De kruising was'],['wachtkamer'],4,15,1,[0.9090909090909091],0.91
seq54-0,base,"Door middel van misleiding kunnen legers zich groter maken dan ze zijn. Het concept was bij het Westen wat uit de gratie geraakt, maar is door de oorlog in Oekrane weer terug.","Door middel van misleiding kunnen legers zich <extra_id_0> dan ze zijn. Het concept was bij het Westen wat uit de gratie geraakt, maar is door de oorlog in <extra_id_1>","Door middel van misleiding kunnen legers zich anders voelen dan ze zijn. Het concept was bij het Westen wat uit de gratie geraakt, maar is door de oorlog in de VS...","['groter maken', 'Oekrane weer terug.']","['anders voelen', 'VS...']",5,15,1,"[0.6923076923076923, 0.9473684210526315]",0.82
seq55-0,base,"Eerder deze maand kondigde French Gates aan dat ze de Bill & Melinda Gates Foundation (BMGF) ging verlaten. Ze zei al dat ze actief wilde blijven als filantroop, maar dat ze later zou aankondigen op welke manier.","Eerder deze maand kondigde French <extra_id_0> ze de Bill & Melinda Gates Foundation (BMGF) ging verlaten. Ze zei al dat ze actief wilde blijven als filantroop, <extra_id_1> later zou aankondigen op welke manier.","Eerder deze maand kondigde French aan dat ze de Bill & Melinda Gates Foundation (BMGF) ging verlaten. Ze zei al dat ze actief wilde blijven als filantroop, maar later zou aankondigen op welke manier.","['Gates aan dat', 'maar dat ze']","['aan dat', 'maar']",6,15,1,"[0.46153846153846156, 0.6363636363636364]",0.55
seq56-0,base,Een groep hardnekkige verslaafden heeft het toiletgebouw in een Utrechts park gekaapt en daar hun eigen drugshol ingericht. Ze omzeilen zo ongestoord en onbestraft het verbod om drugs op straat te gebruiken. Normale bezoekers van het park worden door de verslaafden geweerd bij het toilet.,Een groep hardnekkige verslaafden heeft het toiletgebouw in een Utrechts park gekaapt en daar hun eigen drugshol ingericht. Ze <extra_id_0> en onbestraft het verbod om drugs op straat te gebruiken. Normale bezoekers van <extra_id_1> de verslaafden geweerd bij het toilet.,Een groep hardnekkige verslaafden heeft het toiletgebouw in een Utrechts park gekaapt en daar hun eigen drugshol ingericht. Ze onderschrijven en onbestraft het verbod om drugs op straat te gebruiken. Normale bezoekers van het park worden door de verslaafden geweerd bij het toilet.,"['omzeilen zo ongestoord', 'het park worden door']","['onderschrijven', 'het park worden door']",7,15,1,"[0.8636363636363636, 0.0]",0.43
seq57-0,base,"Door middel van misleiding kunnen legers zich groter maken dan ze zijn. Het concept was bij het Westen wat uit de gratie geraakt, maar is door de oorlog in Oekrane weer terug.","Door middel van misleiding kunnen legers zich groter maken dan <extra_id_0> Het concept was bij het Westen wat uit de gratie geraakt, <extra_id_1> de oorlog in Oekrane weer terug.","Door middel van misleiding kunnen legers zich groter maken dan burgers. Het concept was bij het Westen wat uit de gratie geraakt, maar kwam na de oorlog in Oekrane weer terug.","['ze zijn.', 'maar is door']","['burgers.', 'maar kwam na']",5,15,1,"[0.875, 0.5833333333333334]",0.73
seq58-0,base,"Een nieuwbouwwoning die in een ochtendje op zijn plek wordt gezet. Met vloerverwarming, badkamer en al. n voor een scherpe prijs.","Een nieuwbouwwoning die <extra_id_0> op zijn plek wordt gezet. Met vloerverwarming, badkamer en al. n voor een scherpe prijs.","Een nieuwbouwwoning die altijd op zijn plek wordt gezet. Met vloerverwarming, badkamer en al. n voor een scherpe prijs.",['in een ochtendje'],['altijd'],3,15,1,[0.875],0.88
seq59-0,base,"Dubbele seksuele moraal is achterhaald, laat vrouwen ook kinderen hebben bij verschillende mensen",Dubbele seksuele moraal <extra_id_0> laat vrouwen ook kinderen hebben bij verschillende mensen,Dubbele seksuele moraal in Duitsland laat vrouwen ook kinderen hebben bij verschillende mensen,"['is achterhaald,']",['in Duitsland'],2,15,1,[0.6666666666666666],0.67
seq60-0,base,"Bij het St. Antonius Ziekenhuis in Nieuwegein stortte een deel van een parkeergarage in. Het ongeval doet denken aan een soortgelijk incident in Eindhoven, zeven jaar geleden. Volgens experts schiet het toezicht in de bouwsector tekort: er is een vacum waar het op constructiecontroles aankomt.","Bij het St. Antonius Ziekenhuis in Nieuwegein stortte een deel van een parkeergarage <extra_id_0> denken aan een soortgelijk incident in Eindhoven, zeven jaar <extra_id_1> schiet het toezicht in de bouwsector tekort: er is een vacum waar het op constructiecontroles aankomt.","Bij het St. Antonius Ziekenhuis in Nieuwegein stortte een deel van een parkeergarage in. Dat doet denken aan een soortgelijk incident in Eindhoven, zeven jaar geleden. Toch schiet het toezicht in de bouwsector tekort: er is een vacum waar het op constructiecontroles aankomt.","['in. Het ongeval doet', 'geleden. Volgens experts']","['in. Dat doet', 'geleden. Toch']",7,15,1,"[0.5, 0.5833333333333334]",0.54
seq61-0,base,"Het Amsterdamse Waternet, verantwoordelijk voor schoon drinkwater n het onderhoud van dijken en gemalen in het grootste waterschap van Nederland, moet worden opgesplitst. Er komen aparte organisaties voor beide taken.","Het Amsterdamse Waternet, verantwoordelijk voor schoon drinkwater n het onderhoud van dijken en gemalen in het grootste waterschap <extra_id_0> opgesplitst. Er komen aparte organisaties voor beide taken.","Het Amsterdamse Waternet, verantwoordelijk voor schoon drinkwater n het onderhoud van dijken en gemalen in het grootste waterschap van Nederland, is opgesplitst. Er komen aparte organisaties voor beide taken.","['van Nederland', 'moet worden']","['van Nederland, is']",4,15,1,[0.23529411764705882],0.24
seq62-0,base,Op de laatste dag van de competitie heeft het door problemen geteisterde Vitesse goed nieuws te melden. Supporters hebben bijna 2 miljoen euro ingezameld met een crowdfundingsactie.,Op de laatste dag van de competitie heeft het door problemen geteisterde Vitesse <extra_id_0> Supporters hebben bijna 2 miljoen euro ingezameld met een crowdfundingsactie.,Op de laatste dag van de competitie heeft het door problemen geteisterde Vitesse Supporters hebben bijna 2 miljoen euro ingezameld met een crowdfundingsactie.,['goed nieuws te melden.'],[''],4,15,1,[1.0],1.0
seq63-0,base,Deze donderdagmiddag neemt de Europese Centrale Bank 99 procent zeker een besluit waar de financile markten al maanden smachtend naar uitkijken: een renteverlaging.,Deze donderdagmiddag neemt de Europese Centrale Bank 99 procent zeker een besluit waar de financile markten al maanden smachtend <extra_id_0> renteverlaging.,Deze donderdagmiddag neemt de Europese Centrale Bank 99 procent zeker een besluit waar de financile markten al maanden smachtend op reageren over de renteverlaging.,['naar uitkijken: een'],['op reageren over de'],3,15,1,[0.8947368421052632],0.89
seq64-0,base,"Novak Djokovic heeft zich geplaatst voor de vierde ronde (achtste finales) op Roland Garros, maar de nummer 1 van de wereld moest er lang op wachten. Het publiek ook: de laatste bal vloog pas zondagnacht om 6 minuten over 3 over het net.",Novak Djokovic heeft zich geplaatst voor de vierde <extra_id_0> op <extra_id_1> de nummer 1 van de wereld moest er lang op wachten. Het publiek ook: de laatste bal vloog pas zondagnacht om 6 minuten over 3 over het net.,"Novak Djokovic heeft zich geplaatst voor de vierde finale op het WK in Frankrijk, maar de nummer 1 van de wereld moest er lang op wachten. Het publiek ook: de laatste bal vloog pas zondagnacht om 6 minuten over 3 over het net.","['ronde (achtste finales)', 'Roland Garros', 'maar']","['finale', 'het WK in Frankrijk, maar']",6,15,1,"[0.7391304347826086, 0.88]",0.81
seq65-0,base,Een groep hardnekkige verslaafden heeft het toiletgebouw in een Utrechts park gekaapt en daar hun eigen drugshol ingericht. Ze omzeilen zo ongestoord en onbestraft het verbod om drugs op straat te gebruiken. Normale bezoekers van het park worden door de verslaafden geweerd bij het toilet.,Een groep hardnekkige verslaafden heeft het toiletgebouw in een Utrechts park gekaapt en daar hun eigen drugshol ingericht. Ze omzeilen zo ongestoord en onbestraft het verbod om drugs op straat te gebruiken. <extra_id_0> park worden door de verslaafden <extra_id_1> toilet.,Een groep hardnekkige verslaafden heeft het toiletgebouw in een Utrechts park gekaapt en daar hun eigen drugshol ingericht. Ze omzeilen zo ongestoord en onbestraft het verbod om drugs op straat te gebruiken. In het park worden door de verslaafden drugs opgeslagen op het toilet.,"['Normale bezoekers van het', 'geweerd bij het']","['In het', 'drugs opgeslagen op het']",7,15,1,"[0.8, 0.7391304347826086]",0.77
seq66-0,base,"OpenAI, het bedrijf achter ChatGPT, schort een AI-stem op die sterk aan de stem van actrice Scarlett Johansson doet denken. Het bedrijf lijkt iets te veel inspiratie te hebben geput uit de film Her, waarvoor Johansson de stem van computersysteem Samantha insprak.","OpenAI, het bedrijf achter ChatGPT, schort een AI-stem op die sterk aan de stem van actrice Scarlett Johansson doet denken. Het bedrijf <extra_id_0> veel inspiratie te hebben <extra_id_1> film Her, waarvoor Johansson de stem van computersysteem Samantha insprak.","OpenAI, het bedrijf achter ChatGPT, schort een AI-stem op die sterk aan de stem van actrice Scarlett Johansson doet denken. Het bedrijf schijnt veel inspiratie te hebben voor de film Her, waarvoor Johansson de stem van computersysteem Samantha insprak.","['lijkt iets te', 'geput uit de']","['schijnt', 'voor de']",6,15,1,"[0.8461538461538461, 0.75]",0.8
seq67-0,base,"De volgverkeerslichten kunnen persoonlijke gegevens van mensen verzamelen, onder meer via apps op smartphones. De Autoriteit Persoonsgegevens maakt zich zorgen.","De volgverkeerslichten kunnen persoonlijke gegevens van mensen verzamelen, onder meer via apps op smartphones. De Autoriteit Persoonsgegevens <extra_id_0>","De volgverkeerslichten kunnen persoonlijke gegevens van mensen verzamelen, onder meer via apps op smartphones. De Autoriteit Persoonsgegevens heeft een...",['maakt zich zorgen.'],['een...'],3,15,1,[0.9444444444444444],0.94
seq68-0,base,Miljoenen Afghanen leven onder de armoedegrens. Buitenlandse donoren bieden weinig hulp omdat de Taliban vrouwenrechten drastisch beperkten. Vermindering van de internationale hulp zal dezelfde Afghaanse vrouwen die we hopen te steunen alleen maar meer laten lijden.,Miljoenen Afghanen leven onder de armoedegrens. Buitenlandse donoren bieden weinig hulp omdat de Taliban vrouwenrechten drastisch beperkten. Vermindering van <extra_id_0> zal dezelfde Afghaanse vrouwen die we hopen te steunen alleen maar <extra_id_1> lijden.,Miljoenen Afghanen leven onder de armoedegrens. Buitenlandse donoren bieden weinig hulp omdat de Taliban vrouwenrechten drastisch beperkten. Vermindering van vrouwenrechten zal dezelfde Afghaanse vrouwen die we hopen te steunen alleen maar erger lijden.,"['de internationale hulp', 'meer laten']","['vrouwenrechten', 'erger']",5,15,1,"[0.8181818181818182, 0.7]",0.76
seq69-0,base,"Na de dood van de achttienjarige Ryan al Najjar kregen De Telegraaf en Leeuwarder Courant mails namens de vader, waarin de moord werd bekend.",Na de dood van de achttienjarige Ryan al Najjar kregen De Telegraaf en Leeuwarder Courant mails <extra_id_0> de moord werd bekend.,Na de dood van de achttienjarige Ryan al Najjar kregen De Telegraaf en Leeuwarder Courant mails De datum van de moord werd bekend.,"['namens de vader', 'waarin']",['De datum van'],4,15,1,[0.8],0.8
seq70-0,base,"Hoewel Donald Trumps veroordeling uniek is in de geschiedenis, geldt dat niet voor het onderliggende schandaal: een buitenechtelijke affaire.","Hoewel Donald Trumps veroordeling uniek is in de geschiedenis, geldt dat <extra_id_0> onderliggende schandaal: een buitenechtelijke affaire.","Hoewel Donald Trumps veroordeling uniek is in de geschiedenis, geldt dat voor het onderliggende schandaal: een buitenechtelijke affaire.",['niet voor het'],['voor het'],3,15,1,[0.38461538461538464],0.38
seq71-0,base,"Het hoofdlijnenakkoord van het kabinet-in-wording begint met een gedicht. Nederland is een prachtig land./ Een land om trots op te zijn. En zo gaat het nog een beetje door, totdat er onverwacht een lange zin volgt.","Het hoofdlijnenakkoord van het kabinet-in-wording begint met een gedicht. Nederland <extra_id_0> land./ Een land om trots op te zijn. En zo gaat het nog een beetje door, totdat er onverwacht een lange <extra_id_1>","Het hoofdlijnenakkoord van het kabinet-in-wording begint met een gedicht. Nederland is een land./ Een land om trots op te zijn. En zo gaat het nog een beetje door, totdat er onverwacht een lange deadline komt.","['is een prachtig', 'zin volgt.']","['is een', 'komt.']",5,15,1,"[0.6, 0.7]",0.65
seq72-0,base,Tijdens de eerste twee dagen van festival Best Kept Secret was het de New Yorkse St.,Tijdens de eerste <extra_id_0> van festival Best Kept Secret was het de New Yorkse St.,Tijdens de eerste editie van festival Best Kept Secret was het de New Yorkse St.,['twee dagen'],['editie'],2,15,1,[0.8],0.8
seq73-0,base,Verwachtingen voor een staakt-het-vuren zijn dit weekend flink getemperd. Ultrarechtse leden van de Isralische regering dreigen met opstappen als Isral instemt met voorstel van de VS.,Verwachtingen voor een staakt-het-vuren zijn dit weekend flink getemperd. Ultrarechtse leden van <extra_id_0> met opstappen als Isral instemt met voorstel van de VS.,Verwachtingen voor een staakt-het-vuren zijn dit weekend flink getemperd. Ultrarechtse leden van de PLO moeten met opstappen als Isral instemt met voorstel van de VS.,['de Isralische regering dreigen'],['de PLO moeten'],4,15,1,[0.7666666666666667],0.77
seq74-0,base,Een beetje geluk in het casino en een loterij kan iedereen overkomen natuurlijk. Maar Cayetano Canto lijkt zijn hand te hebben overspeeld. In achttien maanden won hij 260 keer in het casino en vijf keer de lokale loterij. Genoeg reden voor de Argentijnse politie om de oud-burgemeester mogelijk te vervolgen.,Een beetje geluk in het casino en <extra_id_0> kan iedereen overkomen natuurlijk. Maar Cayetano Canto lijkt zijn hand te hebben overspeeld. In achttien maanden won hij 260 keer in het casino en vijf keer de lokale loterij. <extra_id_1> de Argentijnse politie <extra_id_2> mogelijk te vervolgen.,Een beetje geluk in het casino en de lokale loterij kan iedereen overkomen natuurlijk. Maar Cayetano Canto lijkt zijn hand te hebben overspeeld. In achttien maanden won hij 260 keer in het casino en vijf keer de lokale loterij. Hij vraagt de Argentijnse politie om hem zo snel mogelijk te vervolgen.,"['een loterij', 'Genoeg reden voor', 'om de oud-burgemeester']","['de lokale loterij', 'Hij vraagt', 'om hem zo snel']",8,15,1,"[0.47058823529411764, 0.9411764705882353, 0.7272727272727273]",0.71
seq75-0,base,Het Belgische cordon sanitaire staat al meer dan dertig jaar als een huis. Is dat bij de komende verkiezingen  de extreem-rechtse partij Vlaams Belang is grootste in de peilingen  nog wel vol te houden?,Het Belgische <extra_id_0> staat al meer dan dertig jaar als een huis. Is dat bij de komende verkiezingen de extreem-rechtse partij Vlaams Belang is grootste in <extra_id_1> wel vol te houden?,Het Belgische parlement staat al meer dan dertig jaar als een huis. Is dat bij de komende verkiezingen de extreem-rechtse partij Vlaams Belang is grootste in de lijst wel vol te houden?,"['cordon sanitaire', 'de peilingen nog']","['parlement', 'de lijst']",5,15,1,"[0.8125, 0.6875]",0.75
