,text,text_count
1061,"Hongkong wordt hipper Met instemming van zijn bewoners knapt Hongkong historische gebouwen op.  Je kunt er slapen in voormalige ziekenhuizen of politiebureaus, films kijken op daken en winkelen in gesubsidieerde ateliers",1
1066,"Profiel Adam Tooze ‘Het kapitalisme is een slecht getemd paard.  Hoe goed je ook kunt rijden, af en toe schopt het paard je eraf’ Lovend is de Britse historicus Adam Tooze over de wijze waarop de Amerikanen de financiële crisis hebben aangepakt",1
1071,Wat levert volledige fusie van Nederland en Duitsland eigenlijk op.  Robert Giebels en Gijs Herderscheê waren in het bezit gekomen van een menukaart vol bezuinigingen van het ministerie van Financiën en ze maakten daar in de Volkskrant van gisteren een interessant verhaal van,1
1076,"Nieuws Aanhalen banden Paus Franciscus komt zondagavond aan op het vliegveld van Abu Dhabi, de hoofdstad van de Verenigde Arabische Emiraten.  Beeld Andrew Medichini / AFP Rob Vreeken 3 februari 2019, 21:17 Toch werd het bezoek ingeluid met een kritische noot",1
1081,We kennen de Bosnische hoofdstad Sarajevo vooral van de Balkanoorlog.  Of van de moord op aartshertog Frans Ferdinand waarmee honderd jaar geleden de Eerste Wereldoorlog uitbrak,1
1090,"Toon Hermans in pocketformaat Patrick van den Hanenberg 23 november 2010, 0:00 hoofddorp Het is misschien wat bedenkelijk om het tamelijk tuttige jarenzeventigduo Saskia & Serge filosofische kwaliteiten toe te dichten.  Toch is Joep Onderdelinden niet de eerste die zich helemaal kan vinden in hun hartekreet om vooral op de kleine details van het leven te letten",1
1095,"Recensie Nieuwjaar De wereld door de ogen van een 6-jarige is meeslepend beschreven, maar stelt wat teleur ★★★☆☆ Juli Zeh verlaat in haar nieuwe roman de grote maatschappelijke thema’s en beperkt zich tot klein, persoonlijk leed.  Dat stelt wat teleur, al beschrijft ze knap de wereld door de ogen van een 6-jarige",1
1099,"Nieuws Mossack Fonseca Redactie 3 april 2019, 8:00 De parlementaire ondervragingscommissie Fiscale constructies deed naar aanleiding van de Panama Papers onderzoek naar belastingontwijking in Nederland.  Beeld ANP Er lopen nog honderden onderzoeken naar geld dat door het advieskantoor voor rijke klanten werd weggezet in belastingparadijzen",1
1104,"Over de slakkenraapjager die Evert Santegoeds heet Eva Posthuma de Boer 29 oktober 2019, 14:09 Door de affaire-Borsato moest ik ineens denken aan slakken.  Van die overheerlijke wijngaardslakken die zo lekker bourgondisch in de knoflookboter kunnen drijven",1
1115,"Epidemie eist vooral in Afrika veel slachtoffers Aids is steeds meer voor de armen Terwijl in de rijke landen en enkele ontwikkelingslanden de aids-epidemie langzaam tot stilstand komt of soms zelfs op haar retour lijkt, grijpt zij in de rest van de wereld met onverminderde kracht om zich heen. ",1
1119,'Leger moet Russen in Kirgizië beschermen' MOSKOU De Russische president Dmitri Medvedev heeft Russische strijdkrachten de opdracht gegeven staatsburgers in Kirgizië te beschermen.  Hij waarschuwde voor de ernstige gevolgen van anarchie voor ‘het Kirgizische volk en zijn buren’,1
1124,"Scheppen en hozen tot de goede woorden overblijven Waar Anna Achmatova het scheppingsproces met drama verwoordde, doet debutant Rosa Schogt dat met prettige lichtvoetigheid, vindt Arjan Peters.  Arjan Peters 6 september 2019, 15:00 Aan ontzag voor Anna Achmatova (1889-1966) ontbreekt het mij echt niet, ze had een ",1
1129,"Zelfs twee nachtjes slapen kost een zak patat aan energie De verslaggeefster leek haar misprijzen nauwelijks te kunnen onderdrukken.  'De patatten,' schreef zij deze zomer, 'worden langzaam week onder de sauzen",1
1134,Bern zet Clinton onder druk over nazigoud Of de regering-Clinton maar wil verhinderen dat Amerikaanse staten en gemeenten Zwitserse banken gaan boycotten vanwege allerlei omstreden tegoeden uit de Tweede Wereldoorlog. ,1
1139,"Mazelenprik, hiphop en het Facebookfilter Dit is het wetenschapsnieuws van deze week.  Door onze wetenschapsredactie 9 mei 2015, 2:00 Een kindje wordt ingeënt tegen de mazelen",1
1144,"De Iraniërs hebben nog maar net gehoord dat de Nederlandse minister van Buitenlandse Zaken geen Halbe Zijlstra meer heet, of daar stapt woensdag zijn vrouwelijke vervanger Sigrid Kaag al uit een colonne van zwarte Mercedessen.  Ze bezoekt president Hassan Rohani in zijn paleis in Teheran",1
1149,Door een ongeval tijdens het werk liepen vorig jaar 458. 000 werknemers lichamelijk letsel of geestelijke schade op,1
1154,"Thomas van der Kolk 18 februari 2015, 11:37 In 2014 was Facebook nog altijd het bekendste en populairste sociale netwerk.  Opvallend is dat vooral 'oudere jongeren', van 18 tot 34 jaar, zeggen te verwachten dat ze dit jaar minder zullen gaan Facebooken",1
1159,"Door David Sneek 19 februari 2005, 0:00 Ghostbusters (Ivan Reitman, 1984).  Een vrolijke komedie rond een spokenopruimteam bestaande uit Bill Murray, Dan Aykroyd en Harold Ramis",1
1164,"PortrettenMiddelbare scholieren Na de zomer terug naar de middelbare school: ‘Alsof ik een heel lang weekend heb gehad sinds maart’ Een deel van de leerlingen snakt naar de heropening van de middelbare scholen, vermoedelijk na de zomer.  ‘Ik mis het kletsen in de pauze",1
1169,Half IJsselmeer aan regen: 'Dit komt zelden voor' De overvloedige regenval afgelopen weekeinde zorgde in grote delen van het land voor veel overlast.  Op sommige plekken viel zondag net zo veel regen als normaal in de hele maand oktober,1
1179,"'Mijn zoon keek 's ochtends al naar zo'n Telsell-programma' Nico Pluijmers' vier kinderen zaten dagelijks urenlang voor de tv.  De Eindhovenaar ergerde zich zo aan hun kijkgedrag dat hij het 'televisieslot' bedacht, dat hij meteen maar verkoopt via zijn website",1
1184,"Bert Lanting 5 februari 2018, 23:52 President Trump maandag in Ohio.  Beeld reuters 'Kunnen we dat verraad noemen",1
1189,"'Gewone Zaankanter blijft trots op zijn Appie' Van onze verslaggeefster Kim van Keken 12 september 2003, 2:26 De filiaalmanager van de Albert Heijn aan het Ankersmidplein in Zaandam wil eveneens niet antwoorden.  Ook wil hij zijn naam niet geven",1
1194,Record aan nieuwe fiets- en looproutes Het tempo waarmee nieuwe fiets- en wandelroutes worden geopend breekt dit voorjaar een record.  Grootste klapper is de opening van de Stedenroute (LF2) tussen Amsterdam en Brussel,1
1199,Interview Frans Lieshout Frans Lieshout: ‘Papoea blijft een etterende wond in Indonesië. ’ Beeld Linelle Deunk Pater Frans Lieshout is ooggetuige van een tijdperk op Nieuw-Guinea,1
1209,"Totaalvisie op periode 1789-1848 De slag bij Waterloo is bijna jarig, en twee boeken weten daar nog een bijzondere visie aan toe te voegen: een over Nederlandse herdenkingscultuur, en een over de Slag als ijkpunt voor hysterisch aangewakkerde revolutievrees.  Lotte Jensen 6 juni 2015, 2:00 Op 18 juni 2015 is het precies tweehonderd jaar geleden dat Napoleon zijn definitieve nederlaag leed bij Waterloo",1
1214,"56,6 procent van de gevangenen in Nederland heeft een psychische stoornis.  Dit blijkt uit een onderzoek van de Nijmeegse Pompestichting",1
1219,"Interview Bong Joon-ho Beeld Sangsuk Sylvia Kang Bor Beekman 27 november 2019, 14:30 Bong Joon-ho, prille vijftiger met zwart T-shirt, zwarte broek en vrolijk gezicht, staat op het dakterras van een hotel in Cannes en wijst naar het zwembad.  ‘Voor mijn film hadden we een armenwijk gebouwd rond zo’n bassin",1
1224,Louise Fresco levert doorwrochte ideeënroman als afsluiting van trilogie over engagement.  Ze onderzoekt de houdbaarheid en geloofwaardigheid van diverse soorten idealisme,1
1229,"ReportageSluiting dagopvang Het Wereldhuis Daklozen wachten donderdag in het Wereldhuis op een maaltijd, voorlopig hun laatste.  Beeld Guus Dubbelman / de Volkskrant Arnout le Clercq 19 maart 2020, 21:36 ‘Ik ben bang’, zegt Kahasit (28) uit Eritrea, terwijl ze zich een beetje verbergt in haar grijze hoody",1
1233,"Waarom gaan de debatten te veel over tutonderwerpen.  Marjan Slob 13 maart 2017, 2:00 Verbaasd constateren politieke analisten na elk verkiezingsdebat dat de kiezer maar blijft zweven",1
1238,"Laatste restje Vendex KBB verkocht Maxeda, het restant van wat ooit Vendex KBB was en waar nu alleen nog doe-het-zelfketens als Praxis en Formido in zitten, is verkocht.  Net als de verkopers zijn de nieuwe eigenaren twee investeringsmaatschappijen van het type private equity: Ardian en Goldentree",1
1248,"Molukse dominee Metiary (89) overleden 4 maart 2007, 22:55 ASSEN (ANP) - De Zuid-Molukse dominee Samuel Metiary is zondag in ",1
1253,Pronk blij met zelfverzekerdheid van regering-Wijdenbosch; Suriname wil belastingexperts Nederland kwijt Dinsdagochtend legde minister Pronk in stilte bloemen bij het monument van de vijftien slachtoffers van de decembermoorden in 1982.  Het was de eerste keer dat hij zich een dergelijk gebaar veroorloofde ter nagedachtenis van 'een aantal mensen die ik toen tot mijn vrienden kon rekenen',1
1258,"Nieuwe partij op markt pensioen APG, de uitvoeringsorganisatie van het pensioenfonds ABP, wil pensioenregelingen van andere pensioenfondsen gaan uitvoeren.  Dit maakte APG-bestuursvoorzitter Dick Sluimers donderdag bekend bij de toelichting op de fusie van APG met Cordares, de pensioenuitvoeringsorganisatie van de bouw",1
1263,Onbevangen en nieuwsgierig beschreef Gérard de Nerval het Midden-Oosten van 150 jaar geleden.  Door Hans Driessen Nerval noemt zichzelf een 'voyageur enthousiaste'; hij had zichzelf evengoed een 'voyageur curieux' ,1
1268,"Het vitale hart van het voetbal klopt altijd door – zelfs bij de dood Willem Vissers 23 september 2018, 20:30 Dit stukje gaat over het grote hart van het voetbal, en ook over het kwetsbare hart.  Mijn vriend Piet de Visser, scout van talent tot de dood erop volgt, werd zondag 84 jaar",1
1273,"21 juni 2013, 08:00 Duitse psychiater en psycholoog Manfred Spitzer Computers zouden volgens de Duitse geheugenonderzoeker Manfred Spitzer een bijsluiter moeten krijgen: pas op, niet geschikt voor de ontwikkelende hersenen van jonge kinderen, groot risico op verslaving en slechte schoolprestaties. Spitzer, directeur van de psychiatrische universiteitskliniek in Ulm, is kort in Amsterdam om te spreken over zijn boek Digitale dementie, dat volgende week in Nederland verschijnt",1
1278,"Kampioen Thijssen slaat slag in 11de ronde Gisteren eindigde in Soest het toernooi om het Nederlands kampioenschap.  En hoewel mij, op het moment dat ik deze regels schrijf, de resultaten van de slotdag nog niet bekend zijn, is het – op grond van allerlei reglementsbepalingen die ik u verder zal besparen – nu al zeker dat Kees",1
1288,"Chinees betaalt 2,1 miljoen euro voor lunch met miljardair Buffett Redactie 7 juni 2015, 8:36 Miljardair Warren Buffett tijdens een bijeenkomst in Omaha hoe je snel rijk kan worden.  Beeld ",1
1293,Is de staatssecretaris gezwicht.  Na een week van scholierenacties versoepelde staatssecretaris Van Bijsterveldt de urennorm in het onderwijs,1
1298,'Andere vrouw weerhoudt hem niet mij op te zoeken' Na haar scheiding rolt Lauren (59) van de ene verbazing in de andere.  Vooral een romance met een PVV'er had ze nooit verwacht,1
1303,"Op het het gebruikersforum van Apple klagen enkele consumenten die een nieuwe iPhone 4S hebben gekocht over gele tinten op het scherm.  'Toen ik hem naast mijn oude iPhone 4 legde, merkte ik dat het scherm veel 'mooier' was op de oude iPhone', schrijft een klant onder de naam 'Snowglider'",1
1308,"Het duurde zeventien dagen voordat bevestigd kon worden dat vlucht MH370 van Malaysia Airlines in de Indische Oceaan is gestort.  De zoektocht wordt een race tegen de klok; de batterij van de zwarte doos in de Boeing 777 gaat dertig dagen mee, dat betekent nu nog krap twee weken",1
1313,"Bereidt u zich voor: Schiphol wordt alleen maar drukker Drukte groeit met de economie, 'infrastructuur piept en kraakt' Het gaat beter met de economie, dus de Nederlanders vliegen meer.  Zaterdag liep hun toestroom Schiphol over de schoenen",1
1321,Na de aanvaring van de stuw bij Grave werd de sluis bij Heumen veel te laat gesloten.  Een fout die tot gevolg had dat het waterpeil zo ver daalde dat de scheepvaart op het belangrijke Maas-Waalkanaal momenteel onmogelijk is,1
1323,"Geen spektakel maar stratego VAN ONZE VERSLAGGEVER CHARLES BROMET 23 april 2014, 0:00 AMSTERDAM - Atletico Madrid - Chelsea 0-0 Een internationaal miljoenenpubliek zou Atletico Madrid - Chelsea het liefst hebben teruggestuurd naar de keuken, vanwege het ontbreken van smaak aan deze met veel aplomb aangekondigde maaltijd.  Na het zien van deze zouteloze eerste halve finale van de Champions League bleef je achter met een onbevredigend gevoel",1
1333,"Dai Dai Ntab is slechts een van de vele beloftes voor het sportjaar 2020 Willem Vissers Beeld de Volkskrant Willem Vissers 29 december 2019, 22:14 Mathieu, Max, Memphis.  Frenkie, ",1
1343,"Voorbeeld voor Nederland.  'We hebben hier ook zo'n succesverhaal' 4 april 2014, 0:00 JAN VAN ZIJL, voorzitter MBO-raad: 'Wat ik las in het verhaal, herkende ik van het werkbezoek dat ik vorig jaar aan vakopleidingen in Zwitserland bracht",1
1348,"Drie tips Over de VAR ‘De scheidsrechter is een soort opsporingsambtenaar, de videoscheidsrechter is de rechter’ Bij Ajax - PSV verrichtte videoscheidsrechter Pol van Boekel uitstekend werk.  Maar nog te vaak ontstaat er discussie over de VAR",1
1353,Waarom bericht de krant over sportvrouwen anders dan over sportmannen.  Een hardnekkige klacht: de krant bericht over sportvrouwen heel anders dan over sportmannen,1
1358,"In de modeblote basten De blote bast is terug van weggeweest De echte waaghals viert het nieuwe modeseizoen door zijn nek uit te steken en met blote borst vooruit te lopen.  Me Jane, you Tarzan",1
1364,"De kunst, zij moet weer veel Waarom zouden kunst en cultuur eigenlijk met belastinggeld overeind gehouden moeten ",1
1368,Wat moet er nu gebeuren met de collectie-Gurlitt.  Ongeloof en verbazing toen vorige week bekend werd dat bij een 80-jarige kluizenaar in München 1,1
1373,"Wat Ruud en Onno zouden doen Wat het kabinet niet voor elkaar krijgt, lukte Ruud Lubbers en Onno Ruding begin jaren tachtig wel: het economisch tij keren.  Robert Giebels en Gijs Herderscheê stellen zich voor wat er zou gebeuren als Mark Rutte en Jeroen Dijsselbloem hun voorgangers zouden inzetten in de crisisstrijd",1
1378,"Hoe een olifant om te leggen Berg Erik 8 september 2009, 0:00 Het lot van de jager van Wilbur Smith is een ouderwets avonturenepos, met booswichten, fatale vrouwen en een hoofdrol voor de Afrikaanse wildernis.  Wie een nacht moet doorbrengen in Bangkok kan het slechter treffen dan het Mandarin Oriental Hotel",1
1387,Dorpsleven langs een plutoniumriool Tot ver in de jaren vijftig loosde het nucleaire Majak-complex in de Oeral radioactief afval rechtstreeks in het riviertje de Tetsja. ,1
1392,"Lijst van fraudepublicaties Stapel blijft groeien De lijst met publicaties waarin oud-hoogleraar Diederik Stapel gefraudeerd heeft, blijft groeien.  De commissies-Noorten -Levelt, die onderzoek doen naar het werk van de gevallen hoogleraar sociale psychologie, hebben weer een update gepubliceerd",1
1399,Het De Young Museum in het Amerikaanse San Francisco biedt mensen met een zware lichamelijke handicap de mogelijkheid het museum te verkennen met mobiele robots.  De bezoeker kan thuis inloggen en zelf een wagentje met camera dirigeren door de tentoonstellingszalen met Amerikaanse kunst,1
1402,"TheaterrecensieMa Ma door Eric Corton is geen heiligverklaring van een moeder door haar zoon, maar wel een oprechte liefdesverklaring ★★★★☆ Hein Janssen 9 juli 2020, 14:45 ",1
1407,"De vorstin en het vluchtige volk In de dertig jaar dat Beatrix koningin is, is het populisme in Nederland een belangrijke stroming geworden.  En voor de populistische partijen is de monarchie allang niet meer heilig; voor een aantal andere partijen trouwens ook niet",1
1412,"Voetbalfan mag bij goal ‘hoera’ fluisteren: ‘Dat kun je niet verwachten van supporters’ De Nederlandse voetbalstadions gaan weer open, maar de fans moeten onderling afstand houden en mogen niet schreeuwen.  Kun je voorkomen dat een supporter gaat juichen bij zoiets emotioneels als voetbal",1
1417,Haagse politie hield 613 kinderen jonger dan 12 aan De politie Haaglanden heeft vorig jaar 613 kinderen van 12 jaar en jonger aangehouden.  De kinderen hadden zich voornamelijk schuldig gemaakt aan winkeldiefstal en vernieling,1
1422,"51 artikelen sinds 02 juli 2015 Het Openbaar Ministerie acht twee agenten die betrokken waren bij de arrestatie van Mitch Henriquez schuldig, maar vindt dat ze geen straf verdienen.  De nabestaanden zijn geschokt",1
1429,"Regeringspartij PvdA vindt dat er een volkenrechtelijk mandaat nodig is voordat Nederland militair meedoet aan internationale actie in Syrië tegen terreurbeweging Islamitische Staat (IS).  Coalitiegenoot VVD heeft dat ook het liefste, maar lijkt op grond van humanitaire nood eerder akkoord te gaan met deelname aan militair ingrijpen in Syrië",1
1434,Er zijn voldoende aanwijzingen dat voormalig Volkswagen-topman Martin Winterkorn eerder op de hoogte was van de emissiefraude binnen het concern dan hij altijd heeft beweerd.  Dat stellen de openbare aanklagers in Braunschweig die onderzoek doen naar de zaak,1
1437,Wetenschappers zijn er in geslaagd een methode te ontwikkelen om de laagste temperaturen die er is op Aarde te meten.  De resultaten hiervan kunnen gebruikt worden in het onderzoek naar eigenschappen van materie en in de Kwantum-mechanica,1
1442,"Beveiligingsbranche genegeerd bij terreuralarm De beveiligingsbranche telt 33 duizend werknemers, maar wordt door de overheid buiten de terreuralarmering gehouden.  'Wij weten niet meer dan burgers",1
1447,Europese Commissie: bondsregels beperken commerciële ruimte voor schaatsers 'buitensporig' Sportfederaties mogen topsporters niet langer verbieden deel te nemen aan evenementen die door anderen zijn georganiseerd.  Het beperkt de beroepsvrijheid van de sporter en is in strijd met Europese concurrentieregels,1
1452,"'Veel meer besmettingen in Mexico' AMSTERDAM In Mexico zijn tot eind april 6- tot 32 duizend mensen besmet geraakt met het Mexico-virus, blijkt uit modelberekeningen. ",1
1457,Nieuws ‘Klets’-zaak beveiliging Wilders Advocaat oud-beveiliger Faris K. : ‘Het valt allemaal wel mee met deze politiemol’ Was Faris K,1
1462,"Zuid-Afrika wil uit Internationaal Strafhof stappen Zuid-Afrika is van plan uit het Internationaal Strafhof te stappen, dit meldt viceminister Obed Bapela zondag.  De Zuid-Afrikaanse regering staat onder druk nadat het eerder dit jaar de Soedanese president Hassan al-Bashir tegen de wens van het hof in toestemming gaf om het land te verlaten",1
1467,Surinaamse oppositie vreest noodgreep Bouterse om strafeis te voorkomen De Surinaamse president Desi Bouterse wil koste wat kost voorkomen dat de militaire aanklager op 30 juni met een strafeis tegen hem komt voor zijn aandeel in de Decembermoorden van 1982.  Bouterse sprak dinsdag van een 'constitutionele crisis' nu het proces tegen hem weer wordt hervat,1
1477,"Stieven Ramdharie 12 juli 2019, 19:55 Het gouverneurs-en parlementsgebouw van Mississippi in de hoofdstad Jackson.  Beeld AP De Republikein, die gouverneur van Mississippi wil worden, is als de dood dat er verhalen de ronde zullen doen dat hij vreemdgaat",1
1482,Er hebben zich geen nieuwe gegadigden gemeld om de nieuwe schaatstempel in Nederland te bouwen sinds de gunning aan de Almeerse Icedôme in juni werd teruggetrokken.  Schaatsbond KNSB hoopt dat de overgebleven kanshebbers Thialf en TranSportium gaan samenwerken,1
1487,"Volkskrant Ochtend: Menzis vergoedt behandeling depressies op basis van resultaten | Dit zijn de Brexit-pijnpunten Goedemorgen.  Zorgverzekeraar Menzis gaat de kosten voor de behandeling van depressies en angsten vergoeden op basis van de behaalde resultaten, en niet langer op grond van het aantal behandelingen",1
1492,"Geen plezierjacht meer in natuurplan PvdA, D66 en GroenLinks Als het aan PvdA, D66 en GroenLinks ligt, stopt de plezierjacht op wilde eend, fazant, patrijs, haas, konijn en houtduif.  In hun gezamenlijke plan Mooi Nederland stellen de partijen maandag dat er alleen dieren mogen geworden gevangen of gedood om natuurschade te bestrijden of te voorkomen dat er bijvoorbeeld teveel zwijnen in een gebied leven",1
1497,Brons voor Dekker op 50 vlinder in Tokio Ondanks een onrustige nacht vanwege een aardbeving heeft Inge Dekker zondag een bronzen medaille veroverd bij de wereldbekerwedstrijden kortebaan in Tokio.  Inge Dekker,1
1512,"Ik probeer tegen beter weten in de stemming er een beetje in te houden Ionica Smeets 20 maart 2020, 15:00 Ik droomde dat ik een paar honderd jaar eerder was geboren en naar de brandstapel werd afgevoerd als heks.  Tegen beter weten in probeerde ik in mijn droom de stemming er een beetje in te houden en zei: ‘Wel lekker weer voor een wandelingetje, hè",1
1517,Burgemeester Wolfsen: 'Kortingen onverantwoord' De maatregelen - en dan vooral de bezuinigingen - uit de Miljoenennota hebben nogal wat gevolgen voor de grote steden.  Hoe zijn de plannen daar ontvangen,1
1522,"Raadsel rond mysterieuze tunnel Toronto opgelost De vraag waarom er in een dichtbebost stukje Toronto in het geheim een 10 meter lange, ruime tunnel vakkundig was aangelegd, is eindelijk beantwoord.  Volgens Canadese media is de in januari toevallig ontdekte tunnel niet het werk van terroristen of liefhebbers van loopgravenoorlogen, maar van een bouwvakker die een geheim plekje voor zichzelf wilde",1
1532,"'Uitgebreide EU geniet meer status in wereld' 'De uitbreiding van de Europese Unie betekent een historisch keerpunt voor Europa.  Het is een kans die moet worden gegrepen in het belang van haar veiligheid, economie, cultuur en haar status in de wereld",1
1539,Ruim driekwart van de Nederlanders wil de hypotheekrente aanpakken of afschaffen.  Dat blijkt uit onderzoek van EenVandaag onder 25,1
1542,"Raad voor Cultuur: stop verkoop museumwerken om geldtekort De verkoop van museale stukken om financiële redenen moet worden gestopt, vindt de Raad voor Cultuur",1
1548,Bij een schietpartij op de parkeerplaats van een Van der Valk-hotel in Houten zijn gisteravond twee mannen omgekomen.  Gasten van het hotel waren getuige van het gebeuren,1
1552,"Analyse Pensioenhervorming Gijs Herderscheê 27 maart 2019, 19:40 Wouter Koolmees, minister van Sociale Zaken en Werkgelegenheid (links) op bezoek bij PvdA-Kamerlid Gijs van Dijk (midden) en Lodewijk Asscher (rechts).  Beeld Raymond Rutting / De Volkskrant Op uitnodiging van Asscher spraken de twee drie kwartier over de beoogde pensioenhervorming",1
1557,"updateVOLENDAM - Het Don Bosco College in Volendam handhaaft een verbod op het dragen van hoofddoekjes, ondanks een uitspraak van de Commissie Gelijke Behandeling (CGB).  Dat hebben de rector van de school en het bestuur van de stichting Katholiek Onderwijs Volendam (SKOV) woensdag besloten, zo lieten zij weten",1
1562,"CDA: elke omroep eigen actualiteitenrubriek Elke publieke omroeporganisatie moet weer een eigen actualiteitenrubriek kunnen krijgen, net als ",1
1567,"Haarlem, maandag: een klant staat voor een dichte deur van V&D.  Het warenhuis blijft voorlopig dicht",1
1572,We kunnen niet zonder waterschap Zelfs Napoleon begreep dat hij niet aan onze waterschappen moest komen.  Ze moeten alleen hun oubollige imago zien kwijt te raken en zich profileren als innovatieve overheid,1
1577,"14 augustus 2018, 16:12 Branweermannen kijken toe hoe de pagara's, lange linten met zware rotjes, in de centrum ",1
1582,"'En zo komt het dus dat coauteurs zich laten verrassen door frauderende wetenschappers' Als zelfs apen auteur kunnen zijn van een wetenschappelijk artikel, draait auteurschap meer om erkenning dan om verantwoordelijkheid.  Is dat wenselijk, vraagt Koen Beumer van SciencePalooza",1
1587,Waterdamp ontdekt in atmosfeer van 'kleine' exoplaneet Astronomen hebben waterdamp ontdekt in de atmosfeer van een exoplaneet die maar vier keer zo groot is als de aarde.  Daarmee is 'HAT P-11b' de kleinste planeet buiten ons zonnestelsel waarbij dit is gelukt,1
1591,"achtergrondhuawei Op zoek naar de klokkenluider die beweert dat techgigant Huawei spioneert Groot-Brittannië weert sinds deze week apparatuur van het Chinese Huawei uit het mobiele netwerk, uit angst voor spionage.  Ook een anonieme klokkenluider beweerde dat de techgigant data onderschept",1
1596,"1 juli 2014, 18:41 Leider Abu Bakr al-Baghdadi Beeld AFP Baghdadi deed dat in een audioboodschap van bijna 20 minuten die dinsdag op internet verscheen.  Hij riep moslimstrijders op om wraak te nemen vanwege misstanden tegen moslims wereldwijd",1
1601,"AnalyseVerbouwing Roland Garros Robèrt Misset 28 mei 2019, 20:07 In de botanische tuin op Roland Garros wandel je dinsdagochtend gevoelsmatig door een regenwoud, met uitzicht op de nieuwe Court Simonne Matthieu waar de Italianen Fognini en Seppi elkaar bestoken met forehands en backhands.  De zondag geopende tennisbaan tussen vier kassen in de Serres D’Auteuil is het pronkstuk van een ecologische revolutie op het grandslamtoernooi in Parijs",1
1606,Sven Kramer en Naomi van As (in verwachting) Beeld - Wordt een kind van een topsportpaar vanzelf ook een kampioen.  Anders gezegd: groeit de baby van Sven Kramer en Naomi van As uit tot een geboren winnaar,1
1612,Facebook vraagt nog even geduld van zijn gebruikers.  De komende dagen zal het bedrijf berichten rondsturen,1
1616,"Ellen Provoost 25 augustus 2012, 8:17 De justitie onderzoekt ook of de bank inbreuk heeft gemaakt op de economische sancties tegen landen als Iran, Soedan en Noord-Korea.  De zwaarte van de beschuldigingen kan er volgens de krant toe leiden dat HSBC zeker 1 miljard dollar moet betalen voor een schikking met de Amerikaanse autoriteiten",1
