,Unnamed: 0,text,text_count
126,620,Zet dít eens op de cover De covers van Nature en Science zijn zelden artistiek.  Nederlandse fysici boden een cartoon aan Nature aan,1
127,627,Diafragma's De ING-bank in Kortrijk pakt uit met een grote tentoonstelling van de eigen collectie met werk van topfotografen.  Sebastião Salgado doet zijn - fenomenale - kunstje op maar liefst veertien foto's van mensen die als mieren ,1
128,630,"In La isla mínima, dat in Spanje maar liefst tien Goya’s ontving, de belangrijkste filmprijzen, zoekt hij het wat verder weg.  Niet alleen geografisch, maar ook chronologisch",1
129,635,"Hockeyers naar finale door winst op Australiërs Wakker geschud door de benauwde ontsnapping, dinsdag door toedoen van Groot-Brittannië, hebben de Nederlandse hockeyers hun ware gezicht laten zien.  In de halve finales van het olympisch hockeytoernooi dompelde de ploeg van bondscoach Maurits Hendriks gastland Australië in rouw",1
130,641,Schuim & as.  Gesprek met hoofdconservator Susan Legêne van het Tropenmuseum in Amsterdam over het belang van ritme in een mensenleven,1
131,645,"Passages uit het eindraport; 'Daarmee heeft zij dit dus niet geweten' Uit het eindrapport, hoofdstuk 6, Het meningsverschil Sorgdrager-Blok: “Tijdens de verhoren van de commmissie heeft de kwestie zich ook toegespitst op de vraag of ook procureur-generaal Sorgdrager, in functie vanaf 1 januari 1994, van de doorlating van cocaïne geweten heeft.  Blok kan zich herinneren dat hij de doorlating met Sorgdrager besproken heeft",1
133,655,Gebutste Fazio gaat toch maar niet naar Manchester Het had vandaag hét plaatje uit Manchester moeten worden: de door iedereen met de nek aangekeken Italiaanse bankpresident Antonio Fazio die zijn opwachting kwam maken bij zijn Europese collega-bankpresidenten en de ministers van Financiën uit de EU.  Dit gezelschap houdt vandaag en morgen in de Noord-Engelse stad zijn halfjaarlijkse informele bijeenkomst om in ontspannen sfeer – want informeel – de toestand in de wereld te bespreken,1
134,660,"Flierefluitend voor de leeuwen Jeroen moest erg wennen aan „dat burgerlijke”, maar Linda drong aan.  Met succes",1
135,665,"Eurofilm viert moeizaam feest De European Film Awards willen maar geen feestje worden, ondanks veel enthousiasme en prijzen.  Kauwboy was de beste ontdekking van 2012 en Carice van Houten mocht op Malta een prijs overhandigen",1
136,671,"'Circa twee miljoen mensen in tijdnood' DEN HAAG, 5 NOV.  Ongeveer twee miljoen Nederlanders hebben moeite hun dag in te delen",1
137,675,"Data-analyse klinkt saai, maar het is een machtig instrument.  Zo kan het er bijvoorbeeld voor zorgen dat een Londense politiechef precies weet waar Britten naar het bootje van hun koningin gaan kijken",1
138,680,"De Russische Centrale Bank heeft een flinke rel veroorzaakt met een speciale muntenreeks met afbeeldingen van Europese hoofdsteden die, aldus de bank, „door de Sovjettroepen zijn bevrijd van de Duits-fascistische bezetters”.  Op de vijftien jubileummunten die vorige week in omloop kwamen, prijken afbeeldingen van Berlijn en Wenen, Kiev, Minsk, Warschau, Praag, Boekarest, Chisinau en de hoofdsteden van de Baltische staten",1
139,685,"“Adriaan van Dis, wat een nummer, wat een fantast. ” Zo begint de bijdrage van pater Dik Kooloos in het novembernummer van het blad Bijeen",1
140,690,CES 2015: Mercedes pimpt de robotauto van Google Techredacteur Marc Hijink doet dagelijks verslag vanaf gadgetbeurs CES in Las Vegas.  Ruim 150,1
141,695,Luieren in de wereld van Solero De traditionele strandtent verdwijnt.  Heineken en Ola sponsoren niet langer alleen de parasol maar kopen de hele zaak op,1
142,700,`Reactie sociale partners zwaar overtrokken' De sociale partners beslissen vandaag of ze het dinsdag gestaakte overleg met het kabinet over de sociale zekerheid zullen hervatten.  Vanochtend zagen ze daar vooralsnog geen reden toe,1
143,705,Gezondheid Op cursus samen met collega’s en het vooruitzicht van waardebonnen – vier op de tien deelnemers stopten daardoor met roken.  Stoppen met roken gaat veel beter met een financiële beloning,1
144,710,Ook de identiteit van de eerste agent die geheime opsporingsinformatie verkocht aan de onderwereld is bekend.  De identiteit van de eerste agent is ook bekend,1
145,715,"Bibi is boos Scheidend VVD-Kamerlid Bibi de Vries schreef een boos boek over haar jaren als vice-fractievoorzitter.  Een straatvechter, een olifant in een porseleinkast, geen kaas gegeten van sociale financiële en economische vraagstukken",1
146,720,Hof: NAM moet smartengeld betalen Gaswinning Groningen Het hof gaat deels mee in de eerdere uitspraak dat de NAM moet betalen voor aangetast woongenot en psychisch leed door de gevolgen van de gaswinning.  Een huis in Stedum in 2016 dat niet meer bewoond mag worden omdat het te veel is beschadigd door aardbevingen,1
148,725,"PTT moet kortingen afschaffen ROTTERDAM, 24 FEBR.  PTT Telecom moet een groot deel van zijn kortingsregelingen voor grote klanten afschaffen",1
150,735,"Onvolledige weergave incidenten Srebrenica “Doorrijden”, zei de kapitein toen gewapende moslims een Nederlands pantservoertuig probeerden tegen te houden.  Alweer een incident dat volgens de ",1
151,742,"De andere wereld van zondagmiddag.  Michel Collon, auteur van het boek Blufpoker, Joegoslavië en de komende oorlogen geeft zijn visie op de huidige grensconflichten in Macedonië",1
152,745,Zondag vaardigde president Morsi per presidentieel decreet uit dat de ontbinding ongedaan werd gemaakt.  Hij riep daarbij de parlementsleden op weer bijeen te komen totdat weer een nieuw parlement gekozen kan worden,1
153,750,"Internationale luchthaven Bali weer open, geen vertragingen voor KLM Uitbarsting van Mount Raung op Oost-Java.  Door aswolken is het vliegverkeer op Bali ernstig verstoord",1
154,755,Netwerk.  Onder andere over de schrijnende toestanden in psychiatrische inrichtingen in Servië en de crisis in de PvdA,1
155,760,Brendan Dassey blijft toch vastzitten Dassey zit samen met zijn oom Steven Avery vast voor de moord op Teresa Halbach.  Het proces kwam wereldwijd onder de aandacht door de documentairereeks Making a Murderer,1
156,765,Eurocommissaris Barnier presenteert vandaag een plan dat het Europese bankensysteem moet hervormen.  Foto AFP / John Thys Eurocommissaris Michel Barnier van Interne Markt en Financiële Dienstverlening presenteert vanmiddag een nieuw bankenplan van de Europese Commissie dat het Europese bankensysteem de komende jaren moet hervormen,1
157,770,"Moslims als cartooneske barbaren portretteren mag wel Afgelopen weekeinde besloot Sooreh Hera dat ze haar fotoserie Adam en Ewald, zevendedagsgeliefden niet in het Gemeentemuseum Den Haag wil ophangen.  Als museumdirecteur Wim van Krimpen haar meest provocerende beelden uit die serie niet wilde tonen, ",1
158,775,"Volgens producent Hans Pos van Shooting Star Filmcompany gaat het om één doos met zes à zeven filmblikken, de oogst van één opnamedag.  ",1
159,780,"Een donkere, akelige gestalte achter je Een robot kan het gevoel van de aanwezigheid van geesten oproepen.  Dat komt door conflicterende signalen in het brein",1
160,785,"""Wie Sparta financieel gezond maakt verdient een standbeeld'; ""Op Spangen zit je goed, daar heb je de beste leermeesters'; ""Sponsor mag zich niet bemoeien met het bestuursbeleid' De 63-jarige FLOOR BOUWER treedt in november af als voorzitter van Sparta.  Vanaf 1988 leidde hij de voetbalclub van Spangen",1
161,790,"Wereld Op Lucht Terwijl de koers van World Online afgelopen vrijdag op de Amsterdamse beurs in elkaar plofte, spraken de Europese regeringsleiders in Lissabon euforisch over de nieuwe vergezichten van de Interneteconomie.  De beursgang van het eerste Internet-bedrijf in Nederland werd een bittere teleurstelling voor beleggers die gehoopt hadden op een vluggertje",1
162,795,"Red het web Internetvrijheid Het internet staat op een keerpunt, schrijft www-uitvinder Tim Berners-Lee: het zal zijn potentieel ten goede verwezenlijken, of het zal ons naar een digitale dystopie leiden.  Mijn ouders waren wiskundigen",1
163,800,Het Internationaal Monetair Fonds (IMF) denkt opnieuw meer geld nodig te hebben.  Maar voorstellen om het fonds via de uitgifte van obligaties een beroep te laten doen op particuliere beleggers hebben veel weg van een wanhoopszet,1
165,810,Elektrische en hybride auto’s sjouwen honderden kilo’s aan accu’s mee.  Dat maakt de auto’s zwaarder en dus minder zuinig,1
166,815,"Volgens Powell is dat in het belang van de Verenigde Staten én de internationale coalitie, die steeds vaker aandringt op een snelle oplossing van het conflict.  De voorzitter van de chefs van staven van de Amerikaanse strijdkrachten, generaal Myers, is veel terughoudender",1
167,820,In zijn mondpropje schuilt nu ook het weeskind.  Een gevoel van emotionele onherbergzaamheid was Ronald Koeman altijd al fysiek bestorven,1
168,825,Voorzichtig optimisme Noord-Korea De onderhandelingen over beëindiging van het Noord-Koreaanse nucleaire programma worden mogelijk nog deze maand hervat.  Maar diplomaten waarschuwen dat Noord-Korea’s nieuwe status van kernmacht toenadering er niet gemakkelijker op heeft gemaakt,1
169,830,"Cendres et sang (Fanny Ardant, 2008, F/ROE/P).  Onzeker regiedebuut van actrice Ardant over familievetes en bloedwraak in een boerengemeenschap in Roemenië",1
170,835,Chinese ploeg gearriveerd De Chinese olympische ploeg is vandaag gearriveerd in Sydney.  De door blessures en dopinggeruchten met liefst 27 sporters (vooral atleten) en enkele ,1
171,845,"De laatste dansnomaden Een groep jonge Russen stuwden na de Russische Revolutie in het westen de danskunst voort.  Het was een hecht gezelschap van ontheemden, zoals blijkt uit een boek en een documentaire",1
172,850,Geen geld voor poëziekalender Nog 365 maal scheuren en er komt na 29 jaar een einde aan een klein literair instituut.  Uitgeverij Meulenhoff stopt met de Dagkalender van de poëzie,1
173,855,Een schaalmodel van een hogesnelheidstrein (tgv) van Alstom Foto Gonzalo Fuentes / Reuters Het Duitse bedrijf Siemens en het Franse Alstom zijn volgens Duitse en Franse media dicht bij een akkoord over het samenvoegen van hun treinactiviteiten.  De bouwers van de Duitse hogesnelheidstrein ICE en de Franse TGV hopen samen sterker te staan in de groeiende concurrentie met China,1
174,860,"Drinkwaterwinning uit zeewater gaat het best met geulen op strand Ontziltingsinstallatie nabij Almería in Zuid-Spanje.  foto afp (Files) This file picture taken on April 22, 2008 shows fresh water pumped into a reservoir after being treated at a desalination plant in Carboneras, near Almeria, southern Spain",1
175,865,"Onder hypnose van dj Mills De danscultuur laat zich niet zo gemakkelijk in beeld vangen.  In menige kast liggen de videobanden te verstoffen die in de jaren negentig verschenen van `raves', met niet veel meer dan beelden van dansfeesten vol hossende en uit hun dak gaande partygangers",1
176,870,"‘Tijd heelt niks,” zei Oscar Timmers in een interview in 1983.  Het zinnetje bevat eigenlijk de kern van zijn leven en van zijn literaire werk",1
177,875,"Ruslands opiniepeiler Joeri Levada, gisteren overleden, was eerste opiniepeiler en baken van betrouwbaarheid in een land van leugens, verdomde leugens en statistieken.  Joeri Levada noemde zichzelf een typische ‘zestiger’, de tragische generatie die zich liet inspireren door de destalinisatie onder partijleider Nikita Chroesjtsjov",1
178,880,"Alleen AZ komt door eerste ronde UEFA-Cuptoernooi Vier van de vijf Nederlandse clubs in het UEFA-Cuptoernooi zijn gisteravond in de eerste ronde uitgeschakeld.  Behalve Ajax kunnen ook FC Twente, FC Groningen en Heerenveen zich vanaf vandaag geheel richten op het nationale programma",1
179,885,Sterke Zweden zijn buurmannen de baas De olympische ijshockey- finale was een Noord-Europees onderonsje.  Zweden won de gouden medaille door een 3-2 zege op Finland,1
180,890,"Het gaat goed, dat kan nooit lang duren Veel Europeanen denken ten onrechte dat na een goed 2006 de groei in 2007 zal tegenvallen, vindt Melvyn Krauss.  Maar om inflatie tegen te gaan, zijn wel structurele hervormingen nodig",1
182,900,"Jongmans en Vriesde bereiken moeiteloos halve finale 800 meter ATHENE, 6 AUG.  Stella Jongmans heeft vanochtend bij de WK atletiek in Athene de halve finales van de 800 meter bereikt",1
183,905,"In januari heb ik nogal wat togadragers bezeerd met een stukje waar ‘Strafzittingen zijn te vaak toneelstukjes’ boven stond.  Althans, ik mocht sindsdien een keer of drie bij bijeenkomsten met rechters en advocaten verdere uitleg komen geven",1
184,910,"Geert Corstens was president van de Hoge Raad.  Als een politicus wordt vervolgd voor iets anders dan een delict dat zich geheel in de privésfeer heeft afgespeeld, krijgt het proces een politiek karakter, hoe je het ook wendt of keert",1
185,915,Scholen maken het verschil Amsterdamse leraren verdienen meer dan hun collega’s in Almere.  Toch krijgen docenten in beide regio’s een extraatje van onderwijsminister Plasterk,1
186,920,"Thailand: Anand weer waarnemend premier BANGKOK, 11 JUNI.  De diplomaat-zakenman Anand Panyarachun is gisteren opnieuw tot interim-premier van Thailand benoemd",1
187,925,"Libanese christelijke partij is doelwit bomaanslag BEIROET, 21 DEC.  Een zware bomaanslag op het hoofdkwartier van Libanons grootste christelijke partij, de Falange, in Oost-Beiroet heeft gisteren drie mensen het leven gekost",1
188,930,Gebruiksklaar (niet laten uitlekken) Het is een verplicht nummertje voor iedere columnist.  Vroeg of laat moet het gebeuren,1
189,935,"Onder geldmannen en bureaucraatjes; Nederlandsetoneelgezelschappen op tournee in Indie In de eerste helft van deze eeuw maakten veel toneelgezelschappen uit Nederland een reis naar het toenmalige Nederlands-Indie, vervuld van het ideaal om er de Muze te brengen.  De Indische samenleving reageerde lang niet altijd welwillend op de rondreizende artiesten",1
190,940,"In het artikel van Reinjan Mulder, Vertalingen en subsidies, (Boeken, 20/9/96) staan nogal wat onjuistheden.  De honorering van literaire vertalers laat bijvoorbeeld nog steeds te wensen over",1
191,945,"Krab met eigen zwembadje in de boom In het regenwoud in het zuiden van India staan hoge bomen met sprookjesachtige namen.  Daar groeit de Ceylonkaneel, waarvan je de lekkerste kaneelstokjes van de wereld maakt",1
193,955,"Een vervolg op Breaking Bad en andere series en films van week 41 Online demand Een overzicht van de series en films die op Netflix, Videoland en elders ",1
194,960,Veel profvoetballers in Nederland leiden een weinig glamoureus leven.  Voetballen voor een onkostenvergoeding is geen uitzondering,1
196,965,"Als je bijna 50 bent zoals ik, ben je flink gehersenspoeld met het idee dat vrouwen en mannen onherstelbaar van elkaar verschillen.  Zo leerden we van de tv-serie The A-team in de jaren tachtig dat vrouwen hulpeloos zijn en mannen van een paar kliko’s en wat vogelpoep een operationele tank kunnen bouwen; zagen we in de jaren negentig in de serie Sex and the City dat het levensdoel van vrouwen het huwelijk is (met een man uiteraard) en lazen we aan het begin van deze eeuw in populair-wetenschappelijke boeken dat de breinen van vrouwen en mannen zó anders zijn, dat ze net zo goed van verschillende planeten hadden kunnen komen: de vrouwen van Venus (liefde) wel te verstaan, en de mannen van Mars (oorlog) – and never the twain shall meet",1
197,970,"`Lef' is een frisse, sympathieke komedie Tijdens de 19-jarige geschiedenis van het Nederlands Filmfestival werden meerdere malen debuutfilms van ongesubsidieerde, onafhankelijke producties ter plekke ontdekt, zoals Zusje van Robert-Jan Westdijk of Lüger van Theo van Gogh.  Dit jaar zou Ron Termaats Lef in die categorie kunnen vallen, geproduceerd volgens de vennoten-constructie van Zusje, en genomineerd (met The Delivery en Abeltje) voor de Grolsch-publieksprijs",1
198,975,Trippend richting het hiernamaals De Franse Gaspar Noé maakte met Enter the Void een ambitieuze drugsfilm.  Na een prikkelend begin verzandt de film in een sufmakende loomheid,1
199,980,"Andere aandelen profiteerden van teruggelopen renteverwachtingen, nadat de `kerninflatie' over juli slechts 2,2 procent bleek te bedragen.  Het is daardoor volgens analisten minder aannemelijk geworden dat de Bank of England doorgaat met haar serie renteverhogingen",1
200,985,"CDA wil minder sex en meer moraal Het CDA vindt dat het kabinet te weinig morele grenzen stelt.  ,,Nederland wordt teveel een land waar alles moet kunnen'', zei fractieleider De Hoop Scheffer vanmorgen bij de algemene beschouwingen in de Tweede Kamer",1
201,990,"Wie was de echte Will.  Het blijft ongelofelijk, in ieder geval een nooit opdrogende bron van verwondering, zoveel nieuwe boeken als er ieder jaar verschijnen over Shakespeare en het toneel waar hij in werkte",1
202,995,"De albumtour van dj Koze’s laatste wapenfeit ‘Knock Knock’ bleek zondagavond een dj-set en geen live-optreden.  Was je over die initiële teleurstelling heen, dan moest je ook nog even geduld hebben als bezoeker want Stefan Kozalla’s set kwam traag op gang",1
203,1000,Natte festivalgangers vrijdag bij de opening van het driedaagse Pinkpop in Zuid-Limburg.  Er waren optredens van onder meer de Britse rockgroep Muse (linksonder) en Paloma Faith (rechtsonder),1
205,1010,"Loongroei schept kabinetsprobleem Het kabinet hoeft niet per definitie te bezuinigen als het grootste deel van de afgesproken besparingen in het pakket crisismaatregelen niet lukt.  Dat bleek gisteravond uit antwoorden van minister Bos (Financiën, PvdA) in een Kamerdebat over de Voorjaarsnota, de bijgestelde begroting voor het lopende jaar",1
207,1015,"Dat God als man aangeduid wordt is bijbels gezien niet logisch.  In Genesis 1:27 staat immers: ,,En God schiep de mens als zijn beeld; als het beeld van God schiep Hij hem; man en vrouw schiep Hij hen",1
208,1020,"Opnieuw gijzeling door Abu Sayyaf Rebellen van de moslimextremistische groepering Abu Sayyaf hebben in het zuiden van de Filippijnen opnieuw mensen gegijzeld.  Het gaat om acht Filippijnen die op het eiland Jolo gevangen zijn genomen door de mannen van de eenarmige Radulan Sahiron, een van de vijf leiders van Abu Sayyaf",1
209,1025,Tish (KiKi Layne) met haar vader Joseph (Colman Domingo) in ‘If Beale Street Could Talk’.  Liefde en romantiek als frame om racisme aan te kaarten Interview Regisseur Barry Jenkins schreef het scenario voor ‘If Beale Street Could Talk’ in cafeetjes in Berlijn,1
210,1030,"Als nieuwe minister van Wonen, Wijken en Integratie brengt Van der Laan een bezoek aan de Haagse Stationsbuurt en Rivierenbuurt in november 2008.  Ed van Oudenaarden/ANP Minister Van der Laan tijdens een Kamerdebat over activiteiten van de Marokkaanse inlichtingendienst in Nederland",1
211,1035,Oud-marinier Albert Hoeben is in het Limburgse Stramproy overleden (foto uit 2010).  Foto ANP / Koen van Weel Oud-militair Albert Hoeben is op 94-jarige leeftijd in Stramproy overleden,1
212,1040,Op dienstreis liggen kosten exact vast Nederland heeft een groot buitenland.  Het was in de vijftiger jaren voor het tweede kabinet-Drees reden met twee ministers van buitenlandse zaken te opereren (de partijloze Jan Willem Beijen en de KVP'er Joseph Luns),1
213,1045,Hemelbestormers uit Vancouver Het Canadese bedrijf Ballard heeft de ambitie marktleider te worden in schone automotoren.  Het ziet in de brandstofcel het potentieel om uit te groeien van een onderzoekslaboratorium tot een multinational,1
214,1050,"Poetins rijkdom is gehalveerd Een lapje grond van anderhalve vierkante kilometer bij Moskou, 230 aandelen in een lokale bank, ruim een ton euro aan spaargeld, een appartement van 78 vierkante meter in Sint Petersburg, een oplegger en twee klassieke Russische auto’s uit de jaren zestig, geërfd van zijn vader.  Dat is alles wat Vladimir ",1
215,1055,"Twee Europese titels amazone Cornelissen Dressuuramazone Adelinde Cornelissen heeft gisteren haar tweede gouden medaille gewonnen op de EK in Rotterdam.  Ze was in het Kralingse Bos in de individuele kür op muziek met een score van 88,839 procent veruit de beste",1
216,1060,"Neanderthaler was blank met rood haar, maar met ander gen Neanderthalers hadden hoogstwaarschijnlijk een blanke huid en rossig haar.  Dit blijkt uit Neanderthal-DNA dat is gevonden in twee botten van deze ongeveer 30",1
217,1065,Van den Ende verhoogt prijzen niet Het bedrijf van Joop van den Ende zal de btw-verhoging op kaartjes voor musicals in de eigen theaters en de grote reizende musical niet doorberekenen aan het publiek.  Daarmee gaat het in tegen de trend bij podia om de belastingverhoging van 6 naar 19 procent wel door te berekenen in de kaartjes,1
218,1070,"Rescuers and relatives stop a woman from committing suicide by jumping off a building in Zhanjiang, Guangdong province August 14, 2012.  The woman was rescued as she tried to commit suicide after killing her nephew following a family dispute, local media reported",1
219,1075,"Het laatste walvisschip komt aan in de haven van Shimonoseki.  Foto Jiji Press / AFP De Japanse walvisvloot heeft dit jaar 333 dwergvinvissen gevangen, inclusief enkele zwangere vrouwtjes",1
220,1080,"Als een Ferrari: luxueus en comfortabel Doordat Haagse politici ambivalente en gebrekkige informatie over Europa verstrekken, lopen burgers niet warm voor de Europese Unie.  „Den Haag wil niet dat we van Brussel houden” Het is deze ambivalentie die Nederlandse politici „continu over de mensen heen storten”, waardoor Lenssen gelooft dat de Nederlandse politiek de macht eigenlijk niet wil delen met de Europese Unie „Den Haag wil niet dat we van Brussel houden”, zegt hij",1
221,1085,PKK: `gevaarlijkste groep' in Duitsland Haar straffe organisatie maakt de PKK tot gevaarlijkste extremistische bedreiging in Duitsland.  Er is een gewapende harde kern van zo'n 6,1
222,1090,"Portretten van Andy Warhol.  20 okt t/m 24 nov in Galerie Wouter van Leeuwen, Hazenstraat 27, Amsterdam",1
223,1095,Te veel uren schrijven De meeste zakenbankiers zijn het stadium voorbij dat ze hun concurrenten ellende toewensen.  Dat komt doordat niemand is ontkomen aan de smet van belangenverstrengeling of het inzakken van de adviesmarkt,1
224,1100,"Dertig dagen offline Het modelabel van Joline Jolink, dat vooral via haar webshop wordt verkocht, bestaat vijf jaar.  Ze viert het met een tijdelijke winkel in Amsterdam",1
225,1105,Complexe opera `Raaff' sterk en intrigerend Verwondering over het verschijnsel `opera' is dit jaar het gemakkelijk herkenbare `geheime thema' in de muziekprogrammering van het Holland Festival.  Gesualdo considered as a murderer van Luca Francesconi was muziektheater over de vraag waarom componisten toch behoefte hebben aan een zichtbare handeling bij hun muziek,1
226,1110,"Action boekte over 2018 een recordomzet van 4,2 miljard euro.  Foto Pieterjan Luyten Waar veel winkelketens in de detailhandel het zwaar hebben, heeft Action over 2018 fors meer omzet geboekt dan een jaar eerder",1
227,1115,"Rusland stopt lozing van kernafval in zee bij Japan TOKIO, 21 OKT.  Rusland heeft onder sterke internationale druk bakzeil gehaald en afgezien van zijn voornemen een tweede lading radioactief afval te lozen in de Zee van Japan",1
228,1120,"Cultuurfilosoof: Kamer is naar binnen gekeerde wereld Maandag werd een nakende kabinetscrisis over de inkomensverhoudingen ternauwernood afgewend, gisteren debatteerde de Kamer erover.  Cultuurfilosoof Paul Kuypers over de taal en de gedragingen van bestuurders in tijden van politieke crisis en publieke apathie",1
229,1125,"Vijf Turkse extremisten aangehouden DEN HAAG, 8 DEC.  De politie heeft begin deze week in Rotterdam vijf Turkse mannen aangehouden die worden verdacht van afpersing in de Turkse gemeenschap",1
230,1130,"Wijnaendts beschuldigt leger; Den Haag stelt sancties tegen Serviërs voor DEN HAAG-ZAGREB-PARIJS, 30 AUG.  Nederland zal zijn partners in de Europese Gemeenschap op een extra vergadering aanstaande dinsdag voorstellen politieke en economische maatregelen tegen Servië te treffen als het blijft weigeren EG-waarnemers toe te laten tot de conflictgebieden in Kroatië",1
231,1135,"Vrij koude nachten Tot en met woensdag verlopen de nachten vrij koud met kans op een klein beetje vorst in het binnenland, maar overdag wordt het ver boven nul.  Dankzij de nabijheid van een hogedrukgebied is het op de meeste dagen droog",1
232,1140,"Mager verslag van Indië-herdenking in de krant Op 15 augustus 1945 vond de capitulatie van Japan plaats.  Dat betekende het einde van de oorlog in Indië voor ons die onder Japanse bezetting hadden geleefd, in kampen en daarbuiten",1
233,1145,"Burgemeesters aan bevolking: samen gaan we het fiksen Crisiscommunicatie Meerdere burgemeesters schreven de afgelopen dagen hun inwoners een brief.  ‘Verlies elkaar niet uit het oog’, is de boodschap",1
234,1150,"Zaterdagavond dacht SGP-Kamerlid Elbert Dijkgraaf een belastingdruk van maar liefst 98,6 procent op het spoor te zijn.  Een paar dagen langer studeren op de kabinetsplannen resulteerde in een lagere maar nog altijd aanzienlijke belastingdruk van 85 procent",1
235,1155,Opereren en detoxen met uitzicht op een Alp Zwitserse huisartsen rekenen af per minuut.  Onze correspondenten beschrijven deze zomer eigenaardigheden van de gezondheidszorg in hun land,1
238,1165,"LEYLA ZANA; Koningin der Koerden ANKARA, 10 NOV.  Leyla Zana is het symbool van de Koerdische strijd voor politieke vrijheid en culturele identiteit binnen Turkije",1
239,1170,"Het NHM is geschiedenis Met het Nationaal Historisch Museum ging het net als met een paar andere reusachtige projecten.  Geestdriftig verzonnen, veel bijval gekregen, een plan kreeg vorm, er ontstond een tegenplan, discussies werden onoverzichtelijk en langzamerhand verloor dit magnifieke project zijn geloofwaardigheid",1
