,Unnamed: 0,text,text_count
365,1795,"Geschil CDA en VVD over EU-uitbreiding Tussen coalitiepartners CDA en VVD is onenigheid ontstaan over een mogelijke Nederlandse blokkade tegen de toetreding in 2007 van Roemenië en Bulgarije tot de Europese Unie.  Het CDA wil de ratificatie van het desbetreffende toetredingsverdrag, die nog voor kerstmis dit jaar zou moeten plaatsvinden, uitstellen",1
366,1800,ALS MOEDERS HUN KINDEREN LATEN STERVEN Death without Weeping.  The Violence of Everyday Life in Brazil door Nancy Scheper-Hughes 614 blz,1
367,1805,"""We moeten anarchie in het onderwijs tolereren'; Kamerleden moeten tien jaar lang hun mond houden, vindt voorzitter Gevers van UvA Na het uitbrengen van haar advies over de toekomst van het leraarschap, is de commissie Van Es met haar rapport de boer op gegaan.  Gisteren organiseerde ze een conferentie in Den Haag, met onder meer minister Ritzen (onderwijs), premier Lubbers, voorzitter Rinnooy Kan van het VNO, en vice-voorzitter Adelmund van het FNV",1
368,1810,"Abu Dhabi schiet Dubai te hulp An Emirati man follows the stock market activity at the Dubai Financial Market in the Gulf emirate on December 14, 2009.  Dubai's stock market rose 10",1
371,1825,"Er woedt een grote schoonmaak onder besloten vastgoedfondsen, bleek vorige week.  Eenentwintig grote aanbieders, waaronder Bouwfonds REIM en Annexum, hebben gezamenlijk normen opgesteld voor een deugdelijke bedrijfsvoering, en laten prospectussen voor nieuwe fondsen toetsen door een onafhankelijke stichting",1
372,1830,"Werkgevers wijzen nullijn voor 1995 af DEN HAAG, 26 APRIL.  Het Nederlands Christelijk Werkgeversverbond (NCW) wijst een centraal akkoord met de vakbeweging over een nullijn voor 1995 af",1
373,1835,"Herontdekking van de wereld Voor de publieke omroep is het misschien een idee eens een documentaire aan de eerste oliecrisis te wijden, en aan de eerste autoloze zondag in de vaderlandse geschiedenis, op 4 november 1973 en de verwikkelingen die daaraan vooraf gingen en die erop volgden.  Waarom",1
374,1840,"Het opzwepende geluid van de Caribische brassband staat in schril contrast met het grauwe herfstweer buiten, maar in de ontvangsthal van hoofdkantoor Zilveren Kruis Achmea zorgt het voor de nodige sfeer.  Meer dan honderd mensen, onder wie medewerkers en patiënten van het failliete MC Slotervaartziekenhuis, zijn maandagmiddag naar Leiden afgereisd om verhaal te halen bij de zorgverzekeraar",1
375,1845,"Willem-Alexander leed aan ziekte van Besnier-Boeck Prins Willem-Alexander (31) heeft de ziekte van Besnier-Boeck gehad.  Dat heeft Eef Brouwers, directeur van de Rijksvoorlichtingsdienst, bevestigd",1
376,1850,"Northwest op zoek naar 300 miljoen dollar NEW YORK, 18 NOV.  Het Amerikaanse Northwest Airlines, waarin KLM een economisch belang van 20 procent heeft, is op zoek naar een lening van 300 miljoen dollar om een dreigend bankroet af te wenden",1
377,1855,President Taiwan trekt conclusie uit nederlaag De vertrekkende Taiwanese president Lee Teng-hui is vandaag afgetreden als voorzitter van de Kwomintang (KMT).  Lee heeft daarmee de verantwoordelijkheid genomen voor de historische nederlaag van de KMT in de presidentsverkiezingen van vorige week,1
379,1865,"Man voor marmer Als je maar oud genoeg wordt, raak je vanzelf vergeten, althans door het grote publiek.  Op het laatst ben je nog maar een stipje aan de horizon, dat pas wordt opgemerkt als het er opeens niet meer is",1
381,1875,De aanval kwam na een lange dag vasten Hoofdaanklager Ocampo pakt nu alle grote partijen in het conflict in Darfur aan.  De rechters moeten nu beslissen of er voldoende bewijs is voor een strafproces,1
382,1880,"Vertrouwen ondernemers in economie naar laagste peil in 2,5 jaar Het vertrouwen van Nederlandse ondernemers in de economie heeft het laagste niveau in tweeënhalf jaar bereikt.  Ondernemers zagen in juli vooral minder orders binnenkomen",1
383,1885,NRC-avond 100 jaar Bauhaus: invloeden en mythes Naar aanleiding van de tentoonstelling nederland – bauhaus,1
386,1905,"Participatiesamenleving.  Nee, de oude verzorgingsstaat De troonrede klinkt als van Mars, maar komt neer op de oude Venus",1
388,1915,"De Nederlandse kunstenares Erzsébet Baerveldt vereenzelvigt zich in haar werk sinds een aantal jaren met met de Hongaarse gravin Erzsébet Báthory (1560-1614).  Van deze gravin, die tijdens haar leven een nogal kwalijke reputatie genoot, bestaat slechts één schilderij dat samen met alle mythes rond Báthory voor Baerveldt het uitgangspunt voor bijna al haar werk vormt",1
389,1920,De Haagse Stemming Vandaag praat de Tweede Kamer over de uitbreiding van het geboorteverlof.  Schrijf je in om deze politieke nieuwsbrief per mail te ontvangen,1
390,1925,'Je moet vroeg met snooker beginnen' Zonder pak speel ik beter.  Die strik die knelt en kriebelt nogal,1
391,1930,Pianist die de draak uit zijn instrument wilde drijven Pianist Alexis Weissenberg oogstte tijdens zijn loopbaan zowel lof als kritiek.  In WO II ontkwam hij aan het kamp toen hij Schubert speelde,1
392,1935,"Ze zijn er in soorten en maten, theatershows waarin hedendaagse dans een pact sluit met hedendaags circus.  In No Sweat, van de Britse Generating Company, leeft een groep vrouwen zich uit op ‘aerial techniques’, waaronder varianten op tissu en trapeze",1
393,1940,Offensief met gerbera's en rozen Mexico wil de wereld gaan veroveren met bloemen.  Met Nederlandse technologie wordt de aanval ingezet op de dominante positie van `Aalsmeer',1
394,1945,Hoekstra belooft in te grijpen na nieuwe kritiek op accountants Jaarrekeningen Het controlewerk door accountants is nog steeds onder de maat.  Minister Hoekstra wil ‘fundamentele’ maatregelen nemen,1
395,1950,"Staatsoliebedrijf is schuldig aan ontploffing Guadalajara MEXICO-STAD, 27 APRIL.  De reeks gasontploffingen in de riolering van de Mexicaanse stad Guadalajara, waarbij vorige week ten minste 200 mensen om het leven kwamen, is te wijten aan een lekkage in een opslagtank met benzine van de Mexicaanse staatsoliemaatschappij Petróleos de México (Pemex)",1
397,1960,Pillendoos stuurt sms als patiënt pil vergeet Een beetje ‘Big Brother’ is het wel: de elektronische pillendoos.  Die stuurt je een sms als je vergeten bent je pillen in te nemen,1
398,1965,Groeien in online veiligheid Cloud computing en computerveiligheid zijn snelgroeiende markten.  Maar het vertrouwen in de cloud kreeg een tik door de uitval bij Amazon en anderen,1
399,1970,In België is de huisarts altijd te bellen Nederlandse huisartsen verdienen twee keer zo veel als hun Belgische collega`s.  Reden: minder patiënten,1
400,1975,Vorige week woensdag is in zijn woonplaats St.  Michielsgestel Jan Carel Elias graaf van Lynden (90) overleden,1
401,1980,Indiase minister wil wet vernoemen naar slachtoffer verkrachting Indiase vrouwen marcheren vandaag op weg naar het monument van Ghandi om de dood van de verkrachte studente medicijnen te herdenken.  Foto AP / Dar Yasin Indiase vrouwen marcheren vandaag op weg naar het monument van Ghandi om de dood van de verkrachte studente medicijnen te herdenken,1
402,1985,"India is een olifant die aan het ontwaken is, roepen ministers vaak wanneer het om de Indiase economie gaat.  Ook de Indiase minister van handel en industrie, Murasoli Maran, die de afgelopen dagen in Nederland was om investeerders voor zijn land te interesseren, bedient zich graag van die metafoor",1
403,1990,"Gemeente Den Haag onderzoekt intercitylijn naar Brussel AMSTERDAM - Een informatiebord boven het perron op station Amsterdam Centraal kondigt het vertrek aan van de Fyra, de nieuwe hogesnelheidstrein die Brussel-Zuid verbindt met Amsterdam.  De Fyra rijdt voorlopig dagelijks tien keer tussen beide stations, met haltes in Brussel-Centraal, Antwerpen, Rotterdam en Schiphol",1
404,1995,"Huntelaar blijft achter in Madrid Terwijl de selectie van Real Madrid gisteren de eerste training afwerkte in Ierland, stond Klaas Jan Huntelaar eenzaam op het veld in ",1
