,Unnamed: 0,text,text_count
0,0,Biënnale van Venetië 2017 Vijf kunstenaars hopen het Nederlands Biënnalepaviljoen in te richten.  Bijna allemaal laten ze het publiek actief meedoen,1
1,5,"Beelden detoneren in barok plezierbos Oude Warande Op zonnige dagen wordt de Oude Warande, een park net buiten Tilburg, overspoeld door dagjesmensen.  Er wordt gepicknickt op de grasvelden, honden nemen een duik in de vennetjes en kinderen leren fietsen op de rechte paden die het park doorkruisen",1
2,10,"'Bompakketje' Namibië was veiligheidstest Een verdacht pakketje dat onderweg was naar Duitsland en woensdag werd gevonden op een vliegveld in Namibië, was een nepbom bedoeld om de veiligheid van de luchthaven te testen.  Het ",1
3,15,Hamas mag in Rusland op bezoek komen .  Tot ontsteltenis van Israël heeft de Russische president Poetin gisteren aangekondigd de moslimfundamentalistische organisatie Hamas te zullen uitnodigen voor besprekingen in Moskou,1
4,20,Helft van de daders aanslagen heeft crimineel verleden Foto Emilio Morenatti/AP Barcelona is de laatst getroffen stad in een reeks terroristische aanslagen.  Sympathisanten van Islamtische Staat pleegden alleen al in de afgelopen 12 maanden veertien aanslagen in Europese steden,1
5,25,De 32-jarige man die de politie gisteravond heeft opgepakt in verband met de schietpartij en bomaanslag in Noorwegen wordt in verband gebracht met rechtsextremisme en publiceerde op internet veelvuldig kritisch over de islam.  Dat melden Noorse media,1
6,31,Een 29-jarige arrestant uit Den Haag is gisteravond op weg naar het politiebureau overleden.  De man werd onwel terwijl hij geboeid op de achterbank van de politieauto lag en overleed daar,1
7,35,Zelfrijdende auto’s De Duitse auto-industrie reageerde traag op de omwentelingen in de sector.  Samenwerking moet leiden tot een inhaalslag,1
8,40,"Wegener: nog geen winst met tv-zenders APELDOORN, 19 MAART.  Mediabedrijf Wegener Arcade verwacht dat de nieuwe televisiezenders TV10 Gold en The Music Factory dit jaar nog niet zullen bijdragen aan de resultaten van het concern",1
9,45,"Vangnet Nederland De sociale zekerheid in Nederland is een kostbare verworvenheid.  Letterlijk én figuurlijk, zo blijkt uit de inzendingen voor de essayprijs- vraag die deze krant samen met de Stichting Sociale Zekerheid 2001 organiseerde",1
10,50,"De Achterpagina bezoekt bijzondere kleedkamers.  Vandaag het mooiste voetbalstadion van Nederland, De Kuip in Rotterdam, thuishaven van Feyenoord",1
11,55,Van koffie tot heroïne Screenshot '100 Years Of Drugs In America: From Coffee To Heroin' Van koffie tot heroïne: in drie minuten zet dit filmpje de verslavingen van Amerikanen in de afgelopen 100 jaar op een rij.  Het begint braaf in de Verenigde Staten: in 1912 klaagt de Amerikaanse overheid Coca Cola aan voor het toevoegen van cafeïne aan hun dranken,1
12,60,"Identiteit Laat biologie niet je identiteit bepalen, schrijft Sophie Rutenfrans.  Immers, je cyclus bepaalt niet wie je bent",1
13,65,"Een paar weken geleden, op één van de eerste zomerdagen, maakten mijn dochter en ik een tochtje door de stad op een waterfiets.  Vertrekkend vanaf het waterfietsstation tegenover het Américain, passeerden wij de duiven die onder de brug bij de Leidsegracht zaten te broeden",1
14,70,KPN laat Duitse markt schieten KPN verdient miljarden met de verkoop van het Duitse dochterbedrijf E-Plus.  De koper Telefónica moet de strijd nu aangaan met grote Duitse concurrenten,1
15,75,Opnieuw strijd om Eksit – al is de poptempel al 34 jaar dicht Over het fameuze Rotterdamse jongerencentrum (1970-1981) is een historiografische controverse ontbrand door het boek Eksit van journalist Kees Vermeer.  De Sex Pistols op 14 december 1977 tijdens een historisch en volledig uitverkocht optreden in Eksit,1
16,80,Aidsvoorlichting voor vrachtwagenchauffeurs; Verhalenbundel van allochtone schrijvers Het land in mij.  Nieuwe verhalen van jonge schrijvers op de grens van twee werelden,1
18,90,"Een paar dagen nadat de dappere Amerikanen Spencer Stone, Anthony Sadler en Alek Skarlatos, en de Brit Chris Norman in de Thalys naar Parijs een zwaar bewapende terreurboef hadden bedwongen, verschenen er op de televisie beelden van zo’n trein die op het Centraal Station op het punt stond te vertrekken.  Worden de passagiers daar nu ook elektronisch bekeken, jasje uittrekken, broekriem afdoen, poortje door, laptop openen, enz",1
19,95,Zware gevechten PKK en Turkse leger in N-Irak Rebellen van de Koerdische Arbeiderspartij PKK en het Turkse leger hebben afgelopen weekeinde zware gevechten geleverd in Noord-Irak.  De PKK zegt zaterdag een Turkse gevechtshelikopter te hebben neergeschoten bij de Iraaks-Turkse grens,1
20,100,"Chiracs economisch beleid loopt steeds verder vast PARIJS, 5 NOV.  De Franse president Chirac hoorde gisteren aan de Rivièra welwillend het pleidooi van de Spaanse premier Aznar aan om mee te kunnen doen met de eerste ploeg landen die in 1999 de Economische en Monetaire Unie binnengaat",1
21,105,"Oranje kiest voor aanval tegen Denen Bondscoach Frank Rijkaard brengt vanavond in de oefeninterland tegen Denemarken een zeer offensief elftal in het veld.  In de spits keert Nederlands duurste voetballer aller tijden, Jerrel Hasselbaink, terug",1
23,115,"Stayer De Jong toont vormbehoud tijdens gedevalueerde strijd GRONINGEN, 12 FEBR.  Rintje Ritsma, Gianni Romme en Bob de Jong zijn afgelopen weekeinde in Groningen op de NK afstanden kampioen op respectievelijk de 1",1
24,120,Zomaar een nieuwsbericht van deze maand: Hillary Clinton bleek een privé-adres te hebben gebruikt voor e-mails over onder andere de aanval op de Amerikaanse ambassade in Benghazi in 2011.  Een commissie eiste de openbaarmaking van die mails,1
25,125,"Lener van laatste instantie zoekt nieuwe rol Het Internationaal Monetair Fonds heeft een nieuwe vijand: marginalisering.  In de sterk veranderde wereldeconomie moet het IMF op zoek naar een nieuwe rol, nu minder landen een beroep doen op het fonds",1
26,130,"Kerry: wel steun VS aan Irak, maar geen troepen De Amerikaanse minister van Buitenlandse Zaken John Kerry spreekt met de pers na een ontmoeting met de Palestijnse president Mahmoud Abbas Foto AP/ Brendan Smialowski De Verenigde Staten zullen Irak steunen in zijn gevecht tegen de militanten gelieerd aan Al-Qaeda die momenteel de macht hebben gegrepen in steden in het westen van het land, maar zullen geen troepen sturen.  “Het is hun gevecht”, zei de Amerikaanse minister van Buitenlandse Zaken John Kerry vanochtend in reactie op de gebeurtenissen, meldt persbureau AP",1
27,135,"Zuid-Korea beschuldigt noorden van moorden SEOUL, 9 OKT.  Het Zuidkoreaanse ministerie van Defensie heeft Noord-Korea beschuldigd verantwoordelijk te zijn voor de dood van drie mensen in een oostelijk berggebied in het land",1
28,140,"Vroeger werd gedacht dat onze hersenen vooral rijpen voor de geboorte en in de eerste levensmaanden.  Maar niets is minder waar, zegt ontwikkelingspsycholoog dr",1
29,146,Britse luchtmachtpiloot overlijdt na crash bij vliegshow Hulpverleningsauto's waren vanmiddag op weg naar de plek van de crash bij Bournemouth.  Foto AP ,1
30,150,"Socialer kabinet, maar niet radicaal Het nieuwe kabinet wil veel gaan verspijkeren in de staatshuishouding.  Met veel aandacht voor oude wijken, zorg en onderwijs",1
31,155,Forum Barcelona voor vrede etcetera Het zomerfestival Forum 2004 in Barcelona moet een cultureel spektakel worden.  Maar stadspromotie en stadsontwikkeling overheersen,1
32,160,"Schikking is dankbare munitie De Nederlandse justitie heeft haar onderzoek naar Ahold afgesloten.  Het juridische gevecht wordt scherper, de afstand tussen ex-bestuurders en bedrijf groter",1
33,165,"Nu valt het wel mee met de uniformiteit van die sleetse parade.  Het recentste jaarboek is zelfs een kleine revolutie, want voor het eerst is het nieuwe traditionalisme, dat Nederland heeft overspoeld, sterk vertegenwoordigd",1
36,180,"Verzekeraar ASR wil uitvoeringsinstelling ROTTERDAM, 19 AUG.  De middelgrote verzekeraar ASR (voorheen Stad Rotterdam) is van plan een eigen uitvoeringsinstelling (uvi) voor werknemersverenigingen op te richten",1
37,185,Internationale waarnemers hebben op een nieuwe locatie uraniumdeeltjes aangetroffen in Iran.  Israël en de VS zeggen al langer dat Teheran zich niet aan de afspraken van het atoomakkoord houdt,1
40,200,"Uitglijder OM-topman in mediahype Harm Brouwer, de baas van het openbaar ministerie, deed in een tv-interview curieuze uitspraken.  Daar komt hij van terug: „Ik ben eerlijk en zeg ronduit: de fout lag bij mij",1
41,205,"In iedereen schuilt een Lucifer Misschien is de verbeelding van ‘de banaliteit van het kwaad’ wel de grootste uitdaging van de literatuur.  Maar dat het raadsel van het kwaad wordt opgelost, daarvoor hoeft niemand bang te zijn, stelt Arnold Heumakers vast na lezing van ‘Ästhetik des Bösen’",1
42,210,`Laat eigen net voor publieke omroepen los' Programma's van publieke omroepen moeten voortaan op alle drie de netten kunnen worden uitgezonden.  Omroepen hebben dan geen eigen net meer,1
43,215,In Greendale gebeurt nooit wat Vorig jaar maakte Neil Young een veelgeroemd conceptalbum over het fictieve dorpje Greendale.  De muziek heeft hij nu van film voorzien,1
45,225,"Berlusconi moet aartsrivaal betalen De Italiaanse premier Silvio Berlusconi moet een schadevergoeding van 560 miljoen euro betalen aan zijn zakelijke aartsrivaal Carlo De Benedetti.  De rechtbank in Milaan bevestigde daarmee dat de Italiaanse premier in 1991 een rechter heeft omgekocht, om zich Mondadori toe te eigenen, de grootste uitgeverij Italië",1
46,230,"Een meerderheid van de burgers in de wereld heeft geen vertrouwen in politieke leiders.  Dit blijkt uit de Gallup-enquête `De stem van het volk', die is uitgevoerd in opdracht van het Wereld Economisch Forum",1
47,235,De olympische lobby kent geen grenzen In Kopenhagen wordt morgen besloten welke stad de Olympische Spelen van 2016 mag organiseren.  Chicago is favoriet,1
48,240,"Clinton had bloedprop achter rechteroor, zal ‘volledig herstellen’ Clinton in juli van dit jaar.  Foto AFP / Karen Bleier De bloedprop die gevonden is bij Hillary Clinton zit tussen haar hersenen en schedel, achter het rechteroor",1
49,245,"Het was een slecht jaar voor de Europese banken, maar gelukkig ook weer niet zo heel slecht.  Geen enkele beursgenoteerde bank viel om, hoewel twee Duitse banken, Schmidt Bank en Bankgesellschaft Berlin, op de rand van de afgrond stonden",1
51,255,"Wat rechercheurs niet lukte, kreeg tolk voor elkaar (Gerectificeerd) Een politietolk werkte mee aan grote onderzoeken naar Turkse georganiseerde misdaad.  Zelfs nadat hij door de AIVD was bestempeld als onbetrouwbaar",1
52,260,"Doden door Zweedse band Het gebruik van de Zweedse band (vastbinden) in de gehandicaptenzorg is ,, beneden de maat''",1
53,265,"Goed hoor, dat je hardloopt.  Maar je baas wordt gek van de blessures Ziekteverzuim is te makkelijk in Nederland, zo vindt Kamerlid Anoushka Schut-Welkzijn (VVD)",1
54,270,Duitsland Binnen een week werden bij de Duitse natuurorganisatie Nabu 20. 000 dode of zieke pimpelmezen geregistreerd,1
55,275,"Banken benaderen klanten actief om hypotheek open te breken Om te voorkomen dat klanten weglopen, bieden banken klanten actief aan om de rente op hun hypotheek te verlagen.  Dat melden diverse hypotheekverstrekkers desgevraagd",1
56,280,"Adviesraad kraakt energiebeleid Rijk Het Nederlandse energiebeleid faalt door een gebrek aan visie bij de overheid.  De situatie is zorgelijk, zo stelt de Raad voor Ruimtelijk, Milieu- en Natuuronderzoek (RMNO)",1
58,286,"AZ en Ajax verkleinen achterstand AZ is dankzij een gemakkelijke overwinning op FC Twente dit weekeinde twee punten ingelopen op lijstaanvoerder PSV, dat gelijkspeelde bij Feyenoord.  De Alkmaarse voetbalploeg, tweede in de competitie, wist zoals zo vaak dit seizoen ",1
59,290,Endemol lijft weer tv-maker in VS in Endemol breidt opnieuw uit in de Verenigde Staten.  Het Nederlandse mediabedrijf nam gisteren Authentic Entertainment over,1
60,295,"De chaos op de grond zal er niet meteen door verdwijnen, maar al bij al stemt de resolutie tot enig optimisme.  Ze biedt het Iraakse volk de mogelijkheid een staat op te bouwen, vermindert de overheersende invloed van de Amerikaanse militairen en geeft de internationale troepenmacht de gelegenheid zich sterker dan voorheen te ontplooien als de vredes- en ordehandhavers die ze behoren te zijn",1
61,300,"Alle zeilers met een kite Katja Roose (31), kitesurfster, nummer één van de wereldranglijst course racing, dat over vier jaar olympisch is: Kitesurfen is in de toekomst alleen maar belangrijker.  Ik denk zelfs dat het grootste deel van de zeilklassen dan is overgegaan op kites",1
62,305,"Soms denk ik nog wel eens aan Joop Waasdorp en de tijd dat hij regelmatig café Scheltema bezocht, toen het nog een journalistencafé was en de Nieuwezijds Voorburgwal de Fleetstreet van Amsterdam.  Het was een leuke, dwarse man, wars van elke politieke correctheid, die dan ook, geheel tegen de tijdgeest in, op een dag besloot op de Boerenpartij te gaan stemmen",1
63,310,Taboe op discriminatie MINDERHEDENBELEID heet nu “investeren in een interculturele samenleving”.  Zo wil het nieuwe regeerakkoord het tenminste,1
64,315,Twee genocideverdachten toch uitgeleverd aan Rwanda De uitleveringszaak sleept al jaren voort.  Nu worden de twee aan Rwanda overgedragen,1
65,320,"Duurzaamheid KLM adverteert veel over de eigen duurzaamheid, met het gebruik van biobrandstof als één van de pijlers.  In werkelijkheid is ",1
66,325,"Nieuwe toepassingen kloontechniek De techniek van het klonen ontwikkelt zich snel.  Biotechbedrijven zijn opgetogen, maar de techniek veroorzaakt veel opschudding",1
67,330,Vliegramp Athene kost 121 inzittenden het leven Alle 121 inzittenden zijn om het leven gekomen bij een crash van een Cyprisch vliegtuig in Griekenland.  Luchtvaartdeskundigen puzzelen over de mogelijke oorzaak van de crash waarbij gistermiddag een Cyprisch verkeersvliegtuig neerstortte en in brand vloog,1
68,335,Macron ook bovenaan in definitieve uitslag Het is nu zeker dat de En Marche. -leider op 7 mei met Marine Le Pen gaat strijden om het presidentschap,1
69,340,"Het lijden van het Hazara-volk BAMIAN - In het midden van Afghanistan woont het Hazara-volk, een bevolkingsgroep van Mongoolse afstamming die zwaar te lijden heeft onder de burgeroorlog die Afghanistan teistert.  Maar door de slechte toegankelijkheid van het door hoge bergketens omgeven gebied, dringt maar weinig van hun ontberingen naar de buitenwereld door",1
70,345,Hasna El Maroudi (19) en haar moeder voelen zich niet langer veilig.  De bekorte jongerencolumn van Spunk,1
71,350,De Haagse Stemming Vandaag is dag 181 van de formatie.  Schrijf je in om de Haagse Stemming elke dag als nieuwsbrief te ontvangen,1
72,355,"Oekraïne wijst wapenstilstand af Zwangere vrouwen in een schuilkelder van een ziekenhuis in Donetsk, in het oosten van Oekraïne, waar hevig wordt gevochten.  Foto AFP Het Oekraïense leger heeft een voorstel voor een wapenstilstand van de separatisten gisteren afgewezen",1
73,360,"Het Amerikaanse leger en Irak betwisten de omvang van het geweld in het land.  De Amerikanen ontkenden gisteren dat juli de dodelijkste maand in Irak in ruim twee jaar was, zoals Bagdad had verklaard",1
74,365,"Unilever in oorlog om wasmiddelen in Turkije ISTANBUL, 20 JUNI.  Er woedt een wasmiddelen-oorlog in Turkije",1
75,370,Geloof is sport De Ronde van Frankrijk kent maar één geletruiwinnaar.  Toch bereiden 180 wielrenners zich voor op die wekenlange fietstocht,1
76,375,"Grote kaalslag in Molière's komedie 'De ingebeelde zieke'; Leukdoenerij met overgave Voorstelling: De ingebeelde zieke door Het Gevolg, vanaf 8 jaar.  Tekst naar Molière en regie: Ignace Cornelissen",1
78,385,Luis Suárez is terug na zijn maandenlange schorsing wegens bijten.  Foto AP In zijn tienerjaren in Montevideo rende hij eens vijftig meter het veld over om de scheids een kopstoot te geven,1
79,390,Het rechterschap is meer dan een baan: het kruipt onder je huid Zit er ook een rechter in u.  Strafrechter Jacco Janssen ontdekt op de voetbaltribune dat hij anders naar een incident kijkt dan de andere supporters,1
80,395,HILVERSUM.  De muziekensembles van het Muziekcentrum van de Omroep (MCO) mogen in Hilversum gevestigd blijven,1
81,400,"Koopkrachtverlies toch meer dan verwacht - ook lagere inkomens worden getroffen DEN HAAG - Door alle bezuinigingen hebben de burgers steeds minder geld te besteden.  ANP XTRA LEX VAN LIESHOUT Foto ANP / Lex van Lieshout Niet alleen hoge inkomens, maar ook sommige groepen met lagere inkomens gaan er door het regeerakkoord op achteruit",1
83,411,"Cannes, Sarko, Wolfo en een antihomofobiedag 1 Donderdag is Hemelvaartsdag.  Jezus voer nadat hij niet meer dood was ten hemel en wij hebben een dagje vrij",1
84,415,Vaticaan sticht bisdommen in Rusland De rooms-katholieke kerk heeft gisteren aangekondigd vier Russische bisdommen op te richten.  De Russisch-orthodoxe kerk reageert woedend en dreigt de betrekkingen met het Vaticaan op te schorten,1
86,425,Arcams ruimtelijke oase aan het IJ Ze zijn zeldzaam: bouwwerken die de liefdevolle concentratie prijsgeven waarmee zij zijn ontworpen.  Het nieuwe onderkomen van het Architectuur Centrum Amsterdam (Arcam) is zo'n bouwwerk,1
88,435,"Niet doen, zegt Marcel Warnaar, wetenschappelijk medewerker bij het Nationaal Instituut voor Budgetvoorlichtig (Nibud).  „Een lening kan de vriendschap in de weg gaan staan",1
89,440,"Betogingen Venezuela om nieuwe schoolwet Duizenden Venezolanen hebben zaterdag in de hoofdstad Caracas met twee afzonderlijke betogingen zowel voor als tegen een eerder deze maand ingevoerde nieuwe onderwijswet gedemonstreerd.  De oproerpolitie zette traangas, waterkannonen en rubberkogels in tegen de tegenbetogers",1
90,445,"Slopen, bouwen, spreiden In steden door heel het land worden de komende jaren massaal goedkope woningen gesloopt en vervangen door duurdere.  Het lijkt het laatste redmiddel voor de steden, die hun middenklasse zien vertrekken",1
91,450,"KPN verhoogt ambitie voor schuldafbouw KPN scherpt zijn doelstelling aan om de schulden van het bedrijf te verminderen.  Het telecombedrijf streeft ernaar om de schuld eind dit jaar terug te brengen tot 13,9 miljard euro in plaats van 14,5 miljard",1
92,455,Onder de drie miljoen Turken in Duitsland groeien de spanningen.  Duitse politici willen niet dat de Turkse binnenlandse strijd overslaat,1
93,460,Opwarming aarde is geen aanjager klimaatoorlogen De oorlog in Soedan is geen klimaatoorlog maar een etnisch-religieus conflict waarin toegang tot oliebronnen een belangrijke rol speelt.  Foto AP Terug bij af,1
94,465,"Mooie actie.  Maar het kan geen kwaad dat Leon de Winter erop gewezen heeft dat ook (of juist) in Nederland de wereld gewoon doordraait wanneer er mensen 'als beesten' worden afgemaakt (NRC Handelsblad, 25 oktober)",1
95,470,"De coronamaatregelen mogen dan tot steeds meer chagrijn leiden, Jan Rotmans houdt de moed erin.  De crisis is een blessing in disguise, zei de hoogleraar duurzaamheid en transities deze week in Trouw",1
96,475,"Advocaten Amsterdam dreigen met prikacties AMSTERDAM, 9 mei - De Amsterdamse advocaten zullen prikacties houden als het ministerie van justitie niet voor 1 september toezegt dat de vergoedingen in de gefinancierde rechtshulp zullen worden verhoogd.  Volgens de deken van de orde van advocaten in het arrondissement Amsterdam - waar 1",1
97,480,Eén nieuw nummer is wat mager voor Zweedse Ghost Het Zweedse Ghost was donderdag uitstekend in Amsterdam.  Maar het optreden was helaas vrijwel identiek aan eerdere ,1
98,485,Een glimp van een beschaving Na negentig jaar is het ‘Mesopotamische woordenboek’ voltooid.  Het telt Engelstalige beschrijvingen van 28,1
99,490,"Dat betoogt Geoffrey Robertson, auteur van Crimes Against Humanity (uitgeverij Penguin), vandaag in de Britse krant The Independent.  De wetenschap dat de operatie in het Pakistaanse huis van de Al Qaeda-leider was bedoeld ",1
100,495,"Afgelopen donderdag mij enigszins verbolgen uitgelaten over het feit dat wijn nog geen tenminste houdbaar tot-datum kent of een ‘bij voorkeur te drinken voor’ advies.  En dat terwijl het gros van de wijnen op dronk in de schappen beland en niet gebaat is bij langdurig stof happen in wijnrekken, kruipruimtes of kelders",1
101,500,"Sneller straffen ja, maar liever na vonnis De bewindslieden op Justitie verkennen de rechtsgrenzen.  Kan de rechter al optreden voordat hij vonnist",1
102,505,"Politie slaat terug met civiele procedure Een kaakslag, een gebroken neus, een hoofdwond en flinke frustratie.  Dat is de meest recente oogst van de Rotterdamse politie",1
103,510,"Caption: FILE - In this Nov.  21, 2011 file picture taken with a fisheye lens, flames from a fire set alight in a container by activists of the Frankfurt Occupy movement are seen in front of the European Central Bank and a sculpture of the euro symbol in Frankfurt, Germany",1
104,515,"Agent die schiet is toch anders dan een burger die schiet Hoe streng moet de rechter zijn tegen een agent die een beroepsfout maakt, waardoor net geen dodelijk slachtoffer viel.  De rechter in Maastricht veroordeelde vrijdag een lid van een arrestatie-eenheid tot twee jaar cel en een schadevergoeding",1
105,520,"De EU is verdeeld, nu ook in conflict Georgië De EU-landen kwamen gisteren in Brussel bijeen voor spoedoverleg over de crisis tussen Rusland en Georgië.  Moeilijk: hoe om te gaan met het machtige Rusland",1
106,525,"Jean-Auguste-Dominique Ingres zag het schilderen van portretten, als een minder genre — historische taferelen was waar men beroemd mee diende te worden.  Zijn portretten, nu te zien in het Metropolitan Museum, laten dan ook zien tot welke hoogte hij steeg als hij niet 100 procent op zijn hoede was en zijn best deed",1
107,530,Donald Trumps Kremlin-connecties Relatie VS-Rusland De FBI onderzoekt de banden van Trumps entourage met Rusland en de Russische inmenging in de Amerikaanse verkiezingen.  Hoe lopen de lijnen tussen Trumps inner circle en die van Poetin,1
108,535,"De `sitcom about nothing', verzonnen door Jerry Seinfeld en Larry Davids vertelt het semi-autobiografische verhaal van de stand-up comedian Jerry Seinfeld en zijn vrienden: ex-minnares Elaine Benes (Julia Louis-Dreyfus), de blunderende Cosmo Kramer (Michael Richards) met ",1
109,540,"Kleindochter Christine Koenigs van de beroemde kunstverzamelaar Franz Koenigs wil dat directeur Sjarel Ex van Museum Boijmans van Beuningen per direct twee tekeningen van Jeroen Bosch van de muur haalt.  Dat schrijft zij in een boze brief aan Ex en curator Jonathan Bober van de National Gallery of Art in Washington, waar ze nu hangen",1
110,545,"VS voeren druk op Iran verder op De Amerikaanse regering heeft gisteren nieuwe, harde strafmaatregelen tegen Iran, Iraanse banken en de Iraanse strijdkrachten afgekondigd.  Washington beschuldigt een onderdeel van de Iraanse Revolutionaire Garde ervan terrorisme te ondersteunen",1
111,550,Kabinet met D66 en ChristenUnie onmogelijk of slechts “onwenselijk”.  De Haagse Stemming Vandaag is dag 64 van de formatie,1
112,555,Yara (Wies Fest) and Philippe (Egbert-Jan Weeber) zijn twee naar zingeving zoekende millennials.  Regie: Hanna van Niekerk,1
113,560,"De stemming is verre van uitbundig op Temper The Wind To The Shorn Lamb, de tweede cd van de Vlissingse groep This Beautiful Mess.  De kale boom in een mistig landschap op de hoes staat model voor de sfeervolle, herfstige en van melancholie druipende muziek",1
114,565,"Recessie bedreigt herverkiezing Bush WASHINGTON, 19 OKT.  Het loopt tegen verkiezingstijd en niemand heeft geld",1
116,575,"Geen gedwee typje ,,Momentje, ik leg even de hoorn neer, er worden bloemen gebracht'', zegt juriste Medy van der Laan (34).  De telefoon staat niet stil",1
117,580,"Regisseur Michael Cimino (Deer Hunter) overleden Cimino (77) won vijf Oscars met zijn film The Deer Hunter, maar kon het succes in zijn carrière niet meer oppakken na het geflopte Heaven’s Gate.  Archiefbeeld van Cimino uit 2012 Foto: Gabriel Bouys / AFP Regisseur Michael Cimino, bekend van films als The Deer Hunter en Heaven’s Gate, ",1
119,585,"‘U wist dat Shell toestemming voor de deal nodig had. ’ Corruptiezaak De eerste verdachte in de corruptiezaak rond een Nigeriaans olieveld waar Shell bij betrokken is, werd stevig verhoord door de Italiaanse aanklager Fabio de Pasquale",1
120,590,"Kinderbijslag intact Een meerderheid in de Tweede Kamer ziet niets in het voorstel van staatssecretaris Van Hoof (Sociale Zaken, VVD) om ouders van schoolverlaters te korten op de kinderbijslag.  Dat bleek gisteren tijdens het wekelijkse vragenuur in de Kamer",1
121,595,"Bij een bloedbad in het noorden van Mexico zijn maandag zeker zes kinderen en drie vrouwen op brute wijze vermoord.  De slachtoffers maken allen deel uit van een bekende mormoonse sekte die oorspronkelijk uit de VS komt, maar al decennia aan de Mexicaanse kant van de grens woont",1
122,600,"De komende dagen zal het ’s ochtends vaak nevelig en mistig zijn, maar breekt vooral in de middag de zon af en toe door.  ",1
123,605,40 banen weg bij ANWB-winkels vanwege reorganisatie De winkels en ondersteunende diensten draaien zo’n 25 miljoen euro verlies.  Daarom wil ANWB de snijden in de personeelskosten,1
124,610,Presidentskandidaat Bob Dole wil 'gewoon' zijn land dienen; Een machinist zonder programma Na een reeks mislukkingen krijgt de republikein Robert J. Dole (72) dit jaar zijn laatste kans op het Witte Huis,1
125,615,"Twee nominaties NRC voor journalistieke prijs De Loep NRC is samen met de NOS en Nieuwsuur genomineerd voor De Loep, de prijs voor de beste onderzoeksjournalistiek van Nederland en Vlaanderen.  De Vereniging voor Onderzoeksjournalisten reikt De Loep jaarlijks uit",1
