seq35-0,base,"Een jong meisje werd door drie jongens meegenomen naar een huis en daar de hele nacht misbruikt. Maar het beeld van deze zaak, die eerst helder leek, begon te kantelen toen de politie de telefoons doorzocht.","<extra_id_0> werd door drie jongens meegenomen naar een huis en daar de <extra_id_1> Maar het beeld van <extra_id_2> eerst helder leek, begon te kantelen toen de politie de telefoons doorzocht.","Hij werd door drie jongens meegenomen naar een huis en daar de politie overgenomen. Maar het beeld van wat eerst helder leek, begon te kantelen toen de politie de telefoons doorzocht.","['Een jong meisje', 'hele nacht misbruikt.', 'deze zaak', 'die']","['Hij', 'politie overgenomen.', 'wat']",9,25,1,"[0.8666666666666667, 0.9047619047619048, 0.8888888888888888]",0.89
seq36-0,base,"Het Amsterdamse Waternet, verantwoordelijk voor schoon drinkwater n het onderhoud van dijken en gemalen in het grootste waterschap van Nederland, moet worden opgesplitst. Er komen aparte organisaties voor beide taken.","Het Amsterdamse Waternet, verantwoordelijk voor schoon drinkwater n <extra_id_0> van dijken <extra_id_1> het grootste waterschap <extra_id_2> worden opgesplitst. Er komen aparte organisaties voor beide taken.","Het Amsterdamse Waternet, verantwoordelijk voor schoon drinkwater n van dijken en het grootste waterschap van Nederland worden opgesplitst. Er komen aparte organisaties voor beide taken.","['het onderhoud', 'en gemalen in', 'van Nederland', 'moet']","['', 'en', 'van Nederland']",8,25,1,"[1.0, 0.8461538461538461, 0.0]",0.62
seq37-0,base,"Nabestaanden van de slachtoffers van een massaschietpartij in een basisschool in de Amerikaanse staat Connecticut, in 2012, hebben vrijdag een vergoedingsvoorstel aanvaard van de failliete complotdenker Alex Jones. Hij bood aan zijn bezittingen te verkopen om hen in ieder geval gedeeltelijk te kunnen vergoeden voor zijn lasterlijke uitlatingen over het bloedbad.","Nabestaanden van de slachtoffers van een massaschietpartij in een <extra_id_0> Amerikaanse staat Connecticut, <extra_id_1> vrijdag een vergoedingsvoorstel aanvaard van <extra_id_2> Alex Jones. Hij bood aan zijn bezittingen te verkopen om hen in ieder geval <extra_id_3> voor zijn lasterlijke uitlatingen over het bloedbad.","Nabestaanden van de slachtoffers van een massaschietpartij in een ziekenhuis in de Amerikaanse staat Connecticut, hebben vrijdag een vergoedingsvoorstel aanvaard van de advocaat Alex Jones. Hij bood aan zijn bezittingen te verkopen om hen in ieder geval te compenseren voor zijn lasterlijke uitlatingen over het bloedbad.","['basisschool in de', 'in 2012', 'hebben', 'de failliete complotdenker', 'gedeeltelijk te kunnen vergoeden']","['ziekenhuis in de', 'hebben', 'de advocaat', 'te compenseren']",13,25,1,"[0.5882352941176471, 1.0, 0.9090909090909091, 0.6538461538461539]",0.79
seq38-0,base,"Nog nooit kregen zo weinig babys borstvoeding. Er wordt te weinig ruimte voor gegeven, zeggen jonge moeders in Lelystad.","Nog nooit kregen <extra_id_0> babys borstvoeding. Er wordt <extra_id_1> voor gegeven, zeggen jonge moeders in Lelystad.","Nog nooit kregen onze lieve lieve lieve lieve lieve lieve babys borstvoeding. Er wordt veel voor gegeven, zeggen jonge moeders in Lelystad.","['zo weinig', 'te weinig ruimte']","['onze lieve lieve lieve lieve lieve lieve', 'veel']",5,25,1,"[0.875, 0.875]",0.88
seq39-0,base,Amsterdamse huisartsen leggen patinten die niet op hun afspraak komen opdagen sinds kort boetes op. Zo hopen ze het aantal no-shows terug te dringen. Ook restaurants en kappers kampen met een groeiend aantal klanten dat niet komt opdagen.,Amsterdamse huisartsen leggen patinten die niet op hun afspraak komen opdagen sinds kort boetes op. Zo hopen ze het aantal no-shows <extra_id_0> restaurants en kappers <extra_id_1> groeiend aantal klanten <extra_id_2> opdagen.,Amsterdamse huisartsen leggen patinten die niet op hun afspraak komen opdagen sinds kort boetes op. Zo hopen ze het aantal no-shows in restaurants en kappers te verminderen en het groeiend aantal klanten te laten opdagen.,"['terug te dringen. Ook', 'kampen met een', 'dat niet komt']","['in', 'te verminderen en het', 'te laten']",10,25,1,"[0.9047619047619048, 0.7142857142857143, 0.8461538461538461]",0.82
seq40-0,base,"Het Openbaar Ministerie heeft een nieuwe kroongetuige gepresenteerd. Het gaat om de 29-jarige Dominique K. Hij heeft openheid van zaken gegeven over moorden en geweldszaken in Amsterdam en Rotterdam uit 2020 en 2021. De gewelddadigheden houden verband met een vete in de onderwereld, waarbij een bedrag van 130 miljoen euro zou zijn gestolen.",Het Openbaar Ministerie heeft een nieuwe kroongetuige gepresenteerd. Het gaat om de 29-jarige Dominique K. Hij heeft openheid van zaken gegeven <extra_id_0> in Amsterdam en Rotterdam uit 2020 en 2021. De gewelddadigheden houden <extra_id_1> vete in de <extra_id_2> bedrag van <extra_id_3> zou zijn gestolen.,Het Openbaar Ministerie heeft een nieuwe kroongetuige gepresenteerd. Het gaat om de 29-jarige Dominique K. Hij heeft openheid van zaken gegeven over de gewelddadigheden in Amsterdam en Rotterdam uit 2020 en 2021. De gewelddadigheden houden een vete in de weg dat een bedrag van € 250.000 zou zijn gestolen.,"['over moorden en geweldszaken', 'verband met een', 'onderwereld', 'waarbij een', '130 miljoen euro']","['over de gewelddadigheden', 'een', 'weg dat een', '€ 250.000']",13,25,1,"[0.5714285714285714, 0.8, 0.9090909090909091, 1.0]",0.82
seq41-0,base,"Stormen, flinke regenval en overstromingen teisteren het zuidoosten van Oostenrijk. Auto's worden meegesleurd door het wassende water en tientallen mensen zijn gered uit levensgevaarlijke situaties, aldus de hulpdiensten. Stembureaus voor de Europese verkiezingen zijn verwoest of onbereikbaar. De autoriteiten hebben een burgerbeschermingsalarm afgekondigd, nu zondagmiddag meer noodweer wordt verwacht.","Stormen, flinke regenval en overstromingen teisteren het zuidoosten van Oostenrijk. Auto's worden meegesleurd door het wassende water en tientallen mensen zijn gered uit levensgevaarlijke situaties, aldus de <extra_id_0> de Europese verkiezingen zijn verwoest of onbereikbaar. <extra_id_1> een burgerbeschermingsalarm <extra_id_2> meer <extra_id_3>","Stormen, flinke regenval en overstromingen teisteren het zuidoosten van Oostenrijk. Auto's worden meegesleurd door het wassende water en tientallen mensen zijn gered uit levensgevaarlijke situaties, aldus de politie. Ook de Europese verkiezingen zijn verwoest of onbereikbaar. De politie stelt een burgerbeschermingsalarm meer","['hulpdiensten. Stembureaus voor', 'De autoriteiten hebben', 'afgekondigd', 'nu zondagmiddag', 'noodweer wordt verwacht.']","['politie. Ook', 'De politie stelt', '', '']",12,25,1,"[0.8, 0.5909090909090909, 1.0, 1.0]",0.85
seq42-0,base,"China plant een golf aan nieuwe ruimtemissies naar planetoden. Voor de wetenschap en om grondstoffen te winnen. Maar hoe leg je daar aan? Met borende pootjes, lassos of toch weer een harpoen?","China plant een <extra_id_0> nieuwe ruimtemissies naar planetoden. Voor de wetenschap <extra_id_1> te winnen. Maar hoe leg je <extra_id_2> borende pootjes, lassos of toch weer een harpoen?","China plant een aantal nieuwe ruimtemissies naar planetoden. Voor de wetenschap is er veel te winnen. Maar hoe leg je de borende pootjes, lassos of toch weer een harpoen?","['golf aan', 'en om grondstoffen', 'daar aan? Met']","['aantal', 'is er veel', 'de']",8,25,1,"[0.875, 0.8333333333333334, 0.8461538461538461]",0.85
seq43-0,base,"Restaurantketen La Place koppelt zich los van Jumbo, maar de supermarkt blijft vooralsnog wel verbonden als aandeelhouder. Ook producten van La Place blijven te koop in de supermarkt.","Restaurantketen La Place koppelt zich los van Jumbo, maar <extra_id_0> wel verbonden als aandeelhouder. <extra_id_1> La Place blijven te koop in de supermarkt.","Restaurantketen La Place koppelt zich los van Jumbo, maar is wel verbonden als aandeelhouder. De producten van La Place blijven te koop in de supermarkt.","['de supermarkt blijft vooralsnog', 'Ook producten van']","['is', 'De producten van']",7,25,1,"[0.9354838709677419, 0.17647058823529413]",0.56
seq44-0,base,Na een kletsnatte maandag volgt een veelal wisselvallige en frisse week. Aangezien we midden in de piek van het hooikoortsseizoen zitten is dat goed nieuws voor hooikoortspatinten.,Na een kletsnatte maandag volgt een veelal wisselvallige <extra_id_0> Aangezien we <extra_id_1> van het hooikoortsseizoen zitten is dat goed nieuws voor hooikoortspatinten.,Na een kletsnatte maandag volgt een veelal wisselvallige zondag. Aangezien we aan het begin van het hooikoortsseizoen zitten is dat goed nieuws voor hooikoortspatinten.,"['en frisse week.', 'midden in de piek']","['zondag.', 'aan het begin']",7,25,1,"[0.9333333333333333, 0.7647058823529411]",0.85
seq45-0,base,Inbrekers hebben afgelopen nacht voor ongeveer een half miljoen euro aan juwelen buitgemaakt bij de luxe juwelier Bulgari in Rome.,Inbrekers hebben afgelopen nacht voor ongeveer een <extra_id_0> aan juwelen <extra_id_1> de luxe juwelier Bulgari in Rome.,Inbrekers hebben afgelopen nacht voor ongeveer een miljoen euro aan juwelen gestolen bij de luxe juwelier Bulgari in Rome.,"['half miljoen euro', 'buitgemaakt bij']","['miljoen euro', 'gestolen bij']",5,25,1,"[0.29411764705882354, 0.6666666666666666]",0.48
seq46-0,base,"Vattenfall verwacht de komende jaren veel minder mensen op het warmtenet aan te sluiten dan aanvankelijk het plan was. Het energiebedrijf heeft zijn doelstelling gehalveerd tot tussen de 6000 en 7000 nieuwe aansluitingen per jaar, uit onzekerheid over de markt en het beleid van de overheid.",Vattenfall verwacht de komende jaren veel minder mensen op het warmtenet aan te sluiten dan aanvankelijk het plan was. Het energiebedrijf heeft zijn doelstelling gehalveerd tot tussen <extra_id_0> 7000 nieuwe aansluitingen per <extra_id_1> over <extra_id_2> het <extra_id_3> overheid.,Vattenfall verwacht de komende jaren veel minder mensen op het warmtenet aan te sluiten dan aanvankelijk het plan was. Het energiebedrijf heeft zijn doelstelling gehalveerd tot tussen de 5000 en 7000 nieuwe aansluitingen per jaar. De over van het warmtenet is een taak van de overheid.,"['de 6000 en', 'jaar', 'uit onzekerheid', 'de markt en', 'beleid van de']","['de 5000 en', 'jaar. De', 'van', 'warmtenet is een taak van de']",12,25,1,"[0.1, 0.5, 0.9333333333333333, 0.8214285714285714]",0.59
seq47-0,base,De totale waarde van de export van Made in Holland-producten is vorig jaar met ruim 5 procent gedaald ten opzichte van 2022.,De totale waarde van de export van Made in <extra_id_0> jaar met ruim <extra_id_1> ten opzichte van 2022.,De totale waarde van de export van Made in China is het jaar met ruim 25% ten opzichte van 2022.,"['Holland-producten is vorig', '5 procent gedaald']","['China is het', '25%']",6,25,1,"[0.8076923076923077, 1.0]",0.9
seq48-0,base,Amsterdamse huisartsen leggen patinten die niet op hun afspraak komen opdagen sinds kort boetes op. Zo hopen ze het aantal no-shows terug te dringen. Ook restaurants en kappers kampen met een groeiend aantal klanten dat niet komt opdagen.,Amsterdamse huisartsen leggen <extra_id_0> op hun afspraak komen opdagen sinds kort boetes op. Zo hopen ze het aantal no-shows terug te dringen. Ook restaurants en <extra_id_1> groeiend aantal klanten dat <extra_id_2>,Amsterdamse huisartsen leggen voor mensen die niet op hun afspraak komen opdagen sinds kort boetes op. Zo hopen ze het aantal no-shows terug te dringen. Ook restaurants en cafés hopen met het groeiend aantal klanten dat,"['patinten die niet', 'kappers kampen met een', 'niet komt opdagen.']","['voor mensen die niet', 'cafés hopen met het', '']",10,25,1,"[0.4, 0.45454545454545453, 1.0]",0.62
seq49-0,base,"De Haagse buurttuin van Janneke Vreugdenhil is een democratie: iedereen heeft een zegje, iedereen een taak. En vervolgens loopt alles altijd anders.","De Haagse buurttuin van Janneke Vreugdenhil is <extra_id_0> heeft een zegje, iedereen een taak. <extra_id_1> alles altijd anders.","De Haagse buurttuin van Janneke Vreugdenhil is er. Iedereen heeft een zegje, iedereen een taak. Maar alles altijd anders.","['een democratie: iedereen', 'En vervolgens loopt']","['er. Iedereen', 'Maar']",6,25,1,"[0.5833333333333334, 0.9473684210526315]",0.77
seq50-0,base,Vijf jaar na de stikstofuitspraak van de Raad van State is een oplossing van het probleem nog lang niet in zicht.,Vijf jaar na de stikstofuitspraak van <extra_id_0> State is een oplossing van het probleem nog lang <extra_id_1> zicht.,Vijf jaar na de stikstofuitspraak van de Raad van State is een oplossing van het probleem nog lang niet in zicht.,"['de Raad van', 'niet in']","['de Raad van', 'niet in']",5,25,1,"[0.0, 0.0]",0.0
seq51-0,base,"Naar aanleiding van de grote hoeveelheid pfas in eieren rond de fabriek van Chemours in Dordrecht, start het RIVM een nieuw onderzoek.",Naar aanleiding van de grote hoeveelheid pfas in <extra_id_0> fabriek van <extra_id_1> start het RIVM een nieuw onderzoek.,Naar aanleiding van de grote hoeveelheid pfas in de fabriek van de Duitse Boeing start het RIVM een nieuw onderzoek.,"['eieren rond de', 'Chemours in Dordrecht,']","['de', 'de Duitse Boeing']",6,25,1,"[0.8571428571428571, 0.7727272727272727]",0.81
seq52-0,base,"Nederlanders douchen steeds meer, liefst twee keer per dag, met warm water en veel sop.","Nederlanders douchen steeds meer, liefst twee keer per dag, <extra_id_0> veel sop.","Nederlanders douchen steeds meer, liefst twee keer per dag, te veel sop.",['met warm water en'],['te'],4,25,1,[0.8823529411764706],0.88
seq53-0,base,"Huisfeestje, de samenwerking tussen Roxy Dekker en jongensgroep Bankzitters, is anderhalve dag na lancering al een hit op de streamingdiensten. Op Spotify kwam het nummer zelfs dicht bij een record.","<extra_id_0> tussen Roxy Dekker en jongensgroep Bankzitters, is anderhalve <extra_id_1> lancering al een <extra_id_2> streamingdiensten. Op Spotify kwam het nummer zelfs dicht bij een record.","samenwerking tussen Roxy Dekker en jongensgroep Bankzitters, is anderhalve maand na de lancering al een hit in de streamingdiensten. Op Spotify kwam het nummer zelfs dicht bij een record.","['Huisfeestje', 'de samenwerking', 'dag na', 'hit op de']","['samenwerking', 'maand na de', 'hit in de']",8,25,1,"[0.9166666666666666, 0.8666666666666667, 0.7777777777777778]",0.85
seq54-0,base,"Bijna een op de zeven Nederlandse patinten is aangewezen op gemporteerde medicijnen, omdat er in Nederland een tekort aan is. Experts maken zich ernstig zorgen, vooral om laatste redmiddelen.","Bijna een op de zeven Nederlandse patinten is aangewezen op gemporteerde medicijnen, omdat er in Nederland <extra_id_0> Experts maken zich ernstig <extra_id_1> laatste redmiddelen.","Bijna een op de zeven Nederlandse patinten is aangewezen op gemporteerde medicijnen, omdat er in Nederland geen sprake is van allergie. Experts maken zich ernstig zorgen over de laatste redmiddelen.","['een tekort aan is.', 'zorgen', 'vooral om']","['geen sprake is van allergie.', 'zorgen over de']",7,25,1,"[0.6071428571428571, 0.5714285714285714]",0.59
seq55-0,base,"Tallon Griekspoor neemt het dinsdag in de eerste ronde van Roland Garros op tegen de Amerikaan MacKenzie McDonald. Niemand die de Nederlandse tennisser beter kent dan zijn coach Kristof Vliegen. Ze zijn heel, heel close, misschien af en toe zelfs iets te close.","Tallon Griekspoor neemt het <extra_id_0> eerste ronde van Roland Garros op tegen de <extra_id_1> Niemand die de Nederlandse tennisser beter kent dan zijn coach Kristof Vliegen. Ze zijn heel, heel close, <extra_id_2> toe <extra_id_3> te close.","Tallon Griekspoor neemt het in de eerste ronde van Roland Garros op tegen de Duitser Simone de Jong. Niemand die de Nederlandse tennisser beter kent dan zijn coach Kristof Vliegen. Ze zijn heel, heel close, maar toe is het te close.","['dinsdag in de', 'Amerikaan MacKenzie McDonald.', 'misschien af en', 'zelfs iets']","['in de', 'Duitser Simone de Jong.', 'maar', 'is het']",11,25,1,"[0.6153846153846154, 0.7586206896551724, 0.8666666666666667, 0.6]",0.71
seq56-0,base,"Alsof het leven er al niet erbarmelijk genoeg is, werd de Keniaanse sloppenwijk Mathare eind april getroffen door een zware overstroming. Honderden huisjes van golfplaat en sloophout verdwenen in de kolkende modderstroom, evenals twee van de tien scholen waar de kleine Amersfoortse stichting Mathare Girl Power al jaren hulp biedt.",Alsof het leven er al niet erbarmelijk <extra_id_0> de Keniaanse sloppenwijk Mathare eind april getroffen door een zware overstroming. Honderden huisjes van <extra_id_1> verdwenen in de <extra_id_2> twee van de tien scholen waar de kleine Amersfoortse stichting Mathare Girl Power <extra_id_3> biedt.,"Alsof het leven er al niet erbarmelijk is, werd de Keniaanse sloppenwijk Mathare eind april getroffen door een zware overstroming. Honderden huisjes van kinderen verdwenen in de muren van twee van de tien scholen waar de kleine Amersfoortse stichting Mathare Girl Power onderwijs aan biedt.","['genoeg is', 'werd', 'golfplaat en sloophout', 'kolkende modderstroom', 'evenals', 'al jaren hulp']","['is, werd', 'kinderen', 'muren van', 'onderwijs aan']",12,25,1,"[1.0, 0.75, 0.8636363636363636, 0.7619047619047619]",0.84
seq57-0,base,"De helft van de gepakte online boeven die zich voor de rechter moeten verantwoorden, is niet ouder dan 25 jaar. Ze maakten zich onder meer schuldig aan bankfraude en online oplichting.","De helft van de gepakte online boeven die zich <extra_id_0> moeten verantwoorden, is <extra_id_1> dan 25 jaar. Ze maakten zich <extra_id_2> aan bankfraude en online oplichting.","De helft van de gepakte online boeven die zich hebben moeten verantwoorden, is ouder dan 25 jaar. Ze maakten zich schuldig aan bankfraude en online oplichting.","['voor de rechter', 'niet ouder', 'onder meer schuldig']","['hebben', 'ouder', 'schuldig']",8,25,1,"[0.8666666666666667, 0.5, 0.5789473684210527]",0.65
seq58-0,base,"Netbeheerder Tennet heeft met de aanleg van een stroomkabel mogelijk onomkeerbare schade aangebracht aan kwetsbare natuur op landgoed Twickel, concludeerde de provincie Overijssel donderdag. In Twente is te zien hoe klimaatdoelen botsen met de natuuropgave.",<extra_id_0> met de aanleg van een stroomkabel mogelijk onomkeerbare schade aangebracht aan kwetsbare natuur op <extra_id_1> de provincie Overijssel donderdag. In Twente is te <extra_id_2> botsen met de natuuropgave.,"is met de aanleg van een stroomkabel mogelijk onomkeerbare schade aangebracht aan kwetsbare natuur op het eiland, aldus de provincie Overijssel donderdag. In Twente is te laat om te botsen met de natuuropgave.","['Netbeheerder Tennet heeft', 'landgoed Twickel', 'concludeerde', 'zien hoe klimaatdoelen']","['is', 'het eiland, aldus', 'laat om te']",9,25,1,"[1.0, 1.0, 0.9166666666666666]",0.97
seq59-0,base,"Vlak voor Karien van Gennip afzwaait als minister, kondigt ze een aantal maatregelen af die arbeidsmigranten beter moeten beschermen. De cowboys moeten zich netter gedragen.","Vlak voor Karien van <extra_id_0> minister, kondigt ze een aantal maatregelen af <extra_id_1> moeten beschermen. De cowboys moeten zich netter gedragen.","Vlak voor Karien van der Meulen, minister, kondigt ze een aantal maatregelen af die de cowboys moeten beschermen. De cowboys moeten zich netter gedragen.","['Gennip afzwaait als', 'die arbeidsmigranten beter']","['der Meulen,', 'die de cowboys']",6,25,1,"[0.8947368421052632, 0.7692307692307693]",0.83
seq60-0,base,De Conservatieve Britse premier Sunak schreef twee weken geleden onverwachts verkiezingen uit. De campagnestrijd met Labour ging meteen volop van start. Maandag kwam Nigel Farage met een verrassing: hij doet alsnog mee.,De Conservatieve Britse premier Sunak schreef twee weken geleden onverwachts verkiezingen uit. De campagnestrijd met Labour ging meteen volop van start. <extra_id_0> Farage met <extra_id_1> hij <extra_id_2>,De Conservatieve Britse premier Sunak schreef twee weken geleden onverwachts verkiezingen uit. De campagnestrijd met Labour ging meteen volop van start. Daar hield Farage met dat hij de...,"['Maandag kwam Nigel', 'een verrassing:', 'doet alsnog mee.']","['Daar hield', 'dat', 'de...']",8,25,1,"[0.7222222222222222, 0.9333333333333333, 0.8125]",0.82
seq61-0,base,"De nieuwe bestuursvoorzitter van de Universiteit van Amsterdam, Edith Hooge, staat bekend om haar inhoudelijke kennis. Een ingetogen academicus, die aantreedt in een tijd van pro-Palestijnse studentenprotesten. Is zij de daadkrachtige verbinder waarnaar de universiteit en studenten op zoek zijn?","De nieuwe bestuursvoorzitter van de Universiteit van Amsterdam, Edith Hooge, staat bekend om haar inhoudelijke kennis. Een ingetogen academicus, <extra_id_0> een tijd van pro-Palestijnse studentenprotesten. Is zij de daadkrachtige <extra_id_1> universiteit <extra_id_2> zijn?","De nieuwe bestuursvoorzitter van de Universiteit van Amsterdam, Edith Hooge, staat bekend om haar inhoudelijke kennis. Een ingetogen academicus, in een tijd van pro-Palestijnse studentenprotesten. Is zij de daadkrachtige kandidaat die de universiteit van Amsterdam moet zijn?","['die aantreedt in', 'verbinder waarnaar de', 'en studenten op zoek']","['in', 'kandidaat die de', 'van Amsterdam moet']",10,25,1,"[0.875, 0.6666666666666666, 0.7]",0.75
seq62-0,base,"Novak Djokovic heeft zich geplaatst voor de vierde ronde (achtste finales) op Roland Garros, maar de nummer 1 van de wereld moest er lang op wachten. Het publiek ook: de laatste bal vloog pas zondagnacht om 6 minuten over 3 over het net.","<extra_id_0> zich geplaatst voor de vierde ronde (achtste finales) op Roland Garros, maar de nummer 1 van de wereld moest er lang op <extra_id_1> ook: de laatste bal vloog <extra_id_2> 6 minuten over 3 over <extra_id_3>","hebben zich geplaatst voor de vierde ronde (achtste finales) op Roland Garros, maar de nummer 1 van de wereld moest er lang op wachten. Hoe dan ook: de laatste bal vloog in 6 minuten over 3 over","['Novak Djokovic heeft', 'wachten. Het publiek', 'pas zondagnacht om', 'het net.']","['hebben', 'wachten. Hoe dan', 'in', '']",11,25,1,"[0.95, 0.45, 0.9444444444444444, 1.0]",0.84
seq63-0,base,"Jongeren missen cruciale hulp omdat functionarissen zonder expertise louter naar kosten kijken, zegt Marie-Lies van Steenderen.",Jongeren missen cruciale hulp omdat functionarissen zonder expertise louter naar kosten <extra_id_0> Steenderen.,Jongeren missen cruciale hulp omdat functionarissen zonder expertise louter naar kosten gaat. Steenderen.,"['kijken', 'zegt Marie-Lies van']",['gaat.'],4,25,1,[1.0],1.0
seq64-0,base,Ze zorgen al lange tijd voor grote problemen op verschillende plekken in Utrecht: drugsgebruikers op straat.,Ze <extra_id_0> voor grote problemen op verschillende plekken in Utrecht: drugsgebruikers op straat.,Ze zorgen voor grote problemen op verschillende plekken in Utrecht: drugsgebruikers op straat.,['zorgen al lange tijd'],['zorgen'],4,25,1,[0.7],0.7
seq65-0,base,"Met AI Overview, een nieuwe manier van Google om te zoeken, zouden consumenten kwalitatief hoogwaardige antwoorden op hun vragen moeten krijgen. Maar de zoekmachine blijkt soms verbijsterende blunders te maken.","<extra_id_0> Overview, een nieuwe manier van Google om te zoeken, zouden consumenten kwalitatief hoogwaardige antwoorden op hun vragen moeten krijgen. Maar de <extra_id_1> verbijsterende <extra_id_2>","Google Overview, een nieuwe manier van Google om te zoeken, zouden consumenten kwalitatief hoogwaardige antwoorden op hun vragen moeten krijgen. Maar de antwoorden zijn verbijsterende terwijl...","['Met AI', 'zoekmachine blijkt soms', 'blunders te maken.']","['Google', 'antwoorden zijn', 'terwijl...']",8,25,1,"[1.0, 0.8260869565217391, 0.8333333333333334]",0.89
seq66-0,base,"De volgverkeerslichten kunnen persoonlijke gegevens van mensen verzamelen, onder meer via apps op smartphones. De Autoriteit Persoonsgegevens maakt zich zorgen.","De volgverkeerslichten kunnen persoonlijke gegevens <extra_id_0> verzamelen, onder meer via apps op smartphones. De Autoriteit Persoonsgegevens <extra_id_1>","De volgverkeerslichten kunnen persoonlijke gegevens van gebruikers verzamelen, onder meer via apps op smartphones. De Autoriteit Persoonsgegevens heeft een...","['van mensen', 'maakt zich zorgen.']","['van gebruikers', 'een...']",5,25,1,"[0.5714285714285714, 0.9444444444444444]",0.76
seq67-0,base,De rectores magnifici van vijftien Nederlandse universiteiten schrijven de banden met Isralische universiteiten niet te willen verbreken.,De rectores magnifici van vijftien Nederlandse universiteiten schrijven de banden met <extra_id_0> willen verbreken.,De rectores magnifici van vijftien Nederlandse universiteiten schrijven de banden met de universiteit willen verbreken.,['Isralische universiteiten niet te'],['de universiteit'],4,25,1,[0.5757575757575758],0.58
seq68-0,base,"Honderden paginas aan ambtelijk commentaar op het Hoofdlijnenakkoord van PVV, VVD, NSC en BBB zijn vrijgegeven. Er zijn grote vraagtekens op allerlei terreinen, van het buitenlandbeleid en defensie tot landbouw en sociale zekerheid.","Honderden paginas aan ambtelijk commentaar op het Hoofdlijnenakkoord van PVV, <extra_id_0> BBB zijn vrijgegeven. Er zijn grote vraagtekens op allerlei terreinen, van <extra_id_1> en defensie <extra_id_2> sociale zekerheid.","Honderden paginas aan ambtelijk commentaar op het Hoofdlijnenakkoord van PVV, VV en BBB zijn vrijgegeven. Er zijn grote vraagtekens op allerlei terreinen, van veiligheid en defensie tot sociale zekerheid.","['VVD', 'NSC en', 'het buitenlandbeleid', 'tot landbouw en']","['VV en', 'veiligheid', 'tot']",8,25,1,"[0.6, 0.9, 0.9]",0.8
