seq122-0,small,De knapste koppen van Nederland vertellen deze zomer over ontwikkelingen in hun vakgebied in de Zomeruniversiteit. Vandaag deel,De knapste koppen <extra_id_0> deze zomer <extra_id_1> in hun vakgebied in de Zomeruniversiteit. Vandaag deel,De knapste koppen van de universiteit deze zomer werken in hun vakgebied in de Zomeruniversiteit. Vandaag deel,"['van Nederland vertellen', 'over ontwikkelingen']","['van de universiteit', 'werken']",5,30.0,7,"[0.5652173913043478, 0.7368421052631579]",0.65
seq123-0,small,"De 44-jarige advocaat Derk Wiersum die vanochtend vlak voor zijn huis in Amsterdam is geliquideerd, is ten minste twee keer onder vuur genomen door een jongen met een hoodie. Dat zegt een buurtbewoner die vlakbij de plaats delict woont.","De 44-jarige advocaat Derk <extra_id_0> vlak voor zijn huis in Amsterdam is geliquideerd, is ten minste twee keer onder vuur genomen door een jongen met <extra_id_1> zegt een <extra_id_2> de <extra_id_3>","De 44-jarige advocaat Derk die vlak voor zijn huis in Amsterdam is geliquideerd, is ten minste twee keer onder vuur genomen door een jongen met een zoon, zegt een van de rechter.","['Wiersum die vanochtend', 'een hoodie. Dat', 'buurtbewoner die vlakbij', 'plaats delict woont.']","['die', 'een zoon,', 'van', 'rechter.']",12,30.0,7,"[0.8636363636363636, 0.6, 0.9166666666666666, 0.85]",0.81
seq124-0,small,Angela de Jong is al jaren fan van Boer zoekt Vrouw en schrijft elke week een column over de aflevering van zondagavond.,Angela de Jong is al <extra_id_0> zoekt Vrouw en schrijft elke <extra_id_1> over de aflevering van zondagavond.,Angela de Jong is al snel zoekt Vrouw en schrijft elke dag over de aflevering van zondagavond.,"['jaren fan van Boer', 'week een column']","['snel', 'dag']",7,30.0,7,"[0.8888888888888888, 1.0]",0.94
seq125-0,small,"i Het Formule 1-seizoen telt dit jaar 21 grands prix, n meer dan vorig jaar, en de starttijden van veel races zijn veranderd. In dit overzicht ziet u precies wanneer u de wekker moet zetten of juist lekker uitgebreid kan lunchen.","<extra_id_0> 1-seizoen telt dit jaar 21 grands prix, n meer dan vorig jaar, en de starttijden van veel <extra_id_1> In dit overzicht ziet u precies wanneer u de wekker moet <extra_id_2> lekker <extra_id_3>","Het 1-seizoen telt dit jaar 21 grands prix, n meer dan vorig jaar, en de starttijden van veel wedstrijden. In dit overzicht ziet u precies wanneer u de wekker moet maken en hoe het lekker wordt.","['i Het Formule', 'races zijn veranderd.', 'zetten of juist', 'uitgebreid kan lunchen.']","['Het', 'wedstrijden.', 'maken en hoe het', 'wordt.']",12,30.0,7,"[0.7692307692307693, 0.7142857142857143, 0.6875, 0.8695652173913043]",0.76
seq126-0,small,Fotograaf Daniella van Bergen en verslaggever Anouk Mentink lopen wekelijks iemand tegen het lijf. Deze week is dat,Fotograaf Daniella van Bergen en <extra_id_0> lopen wekelijks <extra_id_1> het lijf. Deze week is dat,Fotograaf Daniella van Bergen en fotograaf Caroline van Bergen lopen wekelijks verandering tegen het lijf. Deze week is dat,"['verslaggever Anouk Mentink', 'iemand tegen']","['fotograaf Caroline van Bergen', 'verandering tegen']",5,30.0,7,"[0.8275862068965517, 0.4117647058823529]",0.62
seq127-0,small,geen Boefjes. Daar voor in de plaats de serie Moordzaken. Sander Sonnemans blikt terug op de meest indrukwekkende zaken.,geen Boefjes. <extra_id_0> de plaats de serie Moordzaken. Sander Sonnemans blikt <extra_id_1> meest indrukwekkende zaken.,geen Boefjes. Een de plaats de serie Moordzaken. Sander Sonnemans blikt over de meest indrukwekkende zaken.,"['Daar voor in', 'terug op de']","['Een', 'over de']",6,30.0,7,"[0.9166666666666666, 0.6363636363636364]",0.78
seq128-0,small,"de Nederlandse horeca. De opluchting is groot, bij zowel ondernemers als klanten. Maar draaien op halve kracht door de beperkingen heeft een prijs. Koninklijke Horeca Nederland sluit niet uit dat er op den duur betaald moet worden om op het terras te mogen zitten, of dat de drankjes duurder worden.","de Nederlandse horeca. De opluchting is groot, bij zowel ondernemers als klanten. Maar draaien op halve kracht <extra_id_0> heeft een prijs. Koninklijke Horeca Nederland sluit niet uit <extra_id_1> den duur betaald moet <extra_id_2> het terras te <extra_id_3> dat <extra_id_4> worden.","de Nederlandse horeca. De opluchting is groot, bij zowel ondernemers als klanten. Maar draaien op halve kracht Het heeft een prijs. Koninklijke Horeca Nederland sluit niet uit dat er op den duur betaald moet worden om het terras te gaan en dat moet worden.","['door de beperkingen', 'dat er op', 'worden om op', 'mogen zitten', 'of', 'de drankjes duurder']","['Het', 'dat er op', 'worden om', 'gaan en', 'moet']",15,30.0,7,"[0.9473684210526315, 0.0, 0.25, 0.6666666666666666, 0.75]",0.52
seq129-0,small,In de rubriek Van Wieg tot Graf vertellen wij het verhaal achter een familiebericht. Vandaag:,In de rubriek Van Wieg tot Graf vertellen wij <extra_id_0> familiebericht. Vandaag:,In de rubriek Van Wieg tot Graf vertellen wij ons een familiebericht. Vandaag:,['het verhaal achter een'],['ons een'],4,30.0,7,[0.8181818181818182],0.82
seq130-0,small,"</a> <a href=""https://twitter.com/hashtag/Amsterdam?src=hash&amp;ref_src=twsrc%5Etfw"">#Amsterdam</a> via <a href=""https://twitter.com/Politie?ref_src=twsrc%5Etfw"">@Politie</a>","</a> <a href=""https://twitter.com/hashtag/Amsterdam?src=hash&amp;ref_src=twsrc%5Etfw"">#Amsterdam</a> via <extra_id_0>","</a> <a href=""https://twitter.com/hashtag/Amsterdam?src=hash&amp;ref_src=twsrc%5Etfw"">#Amsterdam</a> via Twitter","['<a href=""https://twitter.com/Politie?ref_src=twsrc%5Etfw"">@Politie</a>']",['Twitter'],2,30.0,7,[0.9142857142857143],0.91
seq131-0,small,Columnist Lia Thorborg schrijft elke zaterdag een column over het leven in Gouda. Vandaag schrijft ze over,Columnist Lia Thorborg schrijft elke <extra_id_0> over het leven <extra_id_1> Vandaag schrijft ze over,Columnist Lia Thorborg schrijft elke dag over het leven Vandaag schrijft ze over,"['zaterdag een column', 'in Gouda.']","['dag', '']",5,30.0,7,"[0.8421052631578947, 1.0]",0.92
seq132-0,small,Onze album- en serierecensies zijn terug. In deze aflevering van de rubriek Kijk- en Luistertips het beste van de afgelopen tijd.,Onze album- en serierecensies zijn terug. In deze aflevering <extra_id_0> Kijk- en Luistertips <extra_id_1> de afgelopen tijd.,Onze album- en serierecensies zijn terug. In deze aflevering staan Kijk- en Luistertips voor de afgelopen tijd.,"['van de rubriek', 'het beste van']","['staan', 'voor']",6,30.0,7,"[1.0, 1.0]",1.0
seq133-0,small,In deze sportloze periode bellen we dagelijks met een jarige prominent uit de sportwereld. Door het coronavirus is het toch een heel andere verjaardag dan normaal. Vandaag:,In <extra_id_0> bellen we dagelijks met een jarige prominent uit <extra_id_1> het coronavirus <extra_id_2> toch een heel andere verjaardag dan normaal. Vandaag:,In bellen we dagelijks met een jarige prominent uit de buurt. Met het coronavirus krijgen we toch een heel andere verjaardag dan normaal. Vandaag:,"['deze sportloze periode', 'de sportwereld. Door', 'is het']","['', 'de buurt. Met', 'krijgen we']",8,30.0,7,"[1.0, 0.65, 0.8]",0.82
seq134-0,small,"ianGP</a> <a href=""https://twitter.com/hashtag/F1?src=hash&amp;ref_src=twsrc%5Etfw"">#F1</a> <a href=""https://t.co/","ianGP</a> <a href=""https://twitter.com/hashtag/F1?src=hash&amp;ref_src=twsrc%5Etfw"">#F1</a> <extra_id_0>","ianGP</a> <a href=""https://twitter.com/hashtag/F1?src=hash&amp;ref_src=twsrc%5Etfw"">#F1</a> ianGP","['<a href=""https://t.co/']",['ianGP'],2,30.0,7,[0.9545454545454546],0.95
seq135-0,small,De Nederlandse economie blijft op stoom. De totale omvang van de economie nam in het derde kwartaal wederom toe. Volgens het Centraal Bureau voor de Statistiek (CBS) moet Nederland het de laatste tijd vooral hebben van de consum,<extra_id_0> blijft op stoom. De totale omvang van de economie nam in het derde kwartaal wederom toe. Volgens het Centraal Bureau voor de Statistiek (CBS) <extra_id_1> de <extra_id_2> hebben van <extra_id_3>,economie blijft op stoom. De totale omvang van de economie nam in het derde kwartaal wederom toe. Volgens het Centraal Bureau voor de Statistiek (CBS) zou de economie zich bewust hebben van de economie,"['De Nederlandse economie', 'moet Nederland het', 'laatste tijd vooral', 'de consum']","['economie', 'zou', 'economie zich bewust', 'economie']",11,30.0,7,"[0.6521739130434783, 0.9444444444444444, 0.8, 0.6666666666666666]",0.77
seq136-0,small,"Korte updates van de sterren op Facebook, Twitter, en Instagram - wij smullen ervan. In de rubriek Regiobytes struint de redactie het web voor je af voor de gekste, mooiste en opvallendste posts van BNers en celebrities","Korte updates van de <extra_id_0> Twitter, en Instagram - wij smullen ervan. In de rubriek Regiobytes <extra_id_1> redactie <extra_id_2> je af voor de gekste, mooiste en opvallendste <extra_id_3> en celebrities","Korte updates van de nieuwe trends op Twitter, en Instagram - wij smullen ervan. In de rubriek Regiobytes redactie wissel je af voor de gekste, mooiste en opvallendste trends en celebrities","['sterren op Facebook,', 'struint de', 'het web voor', 'posts van BNers']","['nieuwe trends op', '', 'wissel', 'trends']",11,30.0,7,"[0.8, 1.0, 0.9166666666666666, 0.8]",0.88
seq137-0,small," Utrecht staat vierde, Heerenveen achtste  Advocaat bezig aan goede serie bij Utrecht  Scheidsrechter is Van de Graaf","Utrecht staat vierde, Heerenveen achtste Advocaat bezig aan goede <extra_id_0> Scheidsrechter is Van <extra_id_1>","Utrecht staat vierde, Heerenveen achtste Advocaat bezig aan goede doelen. Scheidsrechter is Van der Valk","['serie bij Utrecht', 'de Graaf']","['doelen.', 'Valk']",5,30.0,7,"[0.8823529411764706, 0.875]",0.88
seq138-0,small,In de rubriek Van wieg tot graf vertellen we het verhaal achter een familiebericht. Deze keer het levensverhaal van,In de rubriek <extra_id_0> graf vertellen we het verhaal achter een familiebericht. Deze keer <extra_id_1>,In de rubriek Het graf vertellen we het verhaal achter een familiebericht. Deze keer,"['Van wieg tot', 'het levensverhaal van']","['Het', '']",6,30.0,7,"[0.8333333333333334, 1.0]",0.92
seq139-0,small,"Hoewel de sport steeds meer wordt opgestart, houdt het coronavirus een ijzeren greep op de sportwereld.","Hoewel de sport steeds meer wordt opgestart, houdt <extra_id_0> ijzeren <extra_id_1> de sportwereld.","Hoewel de sport steeds meer wordt opgestart, houdt de ijzeren koers in de sportwereld.","['het coronavirus een', 'greep op']","['de', 'koers in']",5,30.0,7,"[0.9473684210526315, 0.75]",0.85
seq140-0,small,"De zware jongens halen de voorpagina's, de boefjes niet. Serena Hofman doet elke week verslag van een doodnormale rechtszaak.","De zware jongens halen de voorpagina's, de boefjes <extra_id_0> doet <extra_id_1> van een doodnormale rechtszaak.","De zware jongens halen de voorpagina's, de boefjes en de jongens doet het van een doodnormale rechtszaak.","['niet. Serena Hofman', 'elke week verslag']","['en de jongens', 'het']",6,30.0,7,"[0.7368421052631579, 0.9411764705882353]",0.84
seq141-0,small,In Gelukkig kunnen we nog... geven verschillende (bekende) Nederlanders vanuit eigen expertise in vlog-vorm tips over wat je in deze thuiswerk-situatie nog wl kunt doen.,In Gelukkig kunnen we nog... geven verschillende (bekende) <extra_id_0> eigen <extra_id_1> tips <extra_id_2> in deze thuiswerk-situatie nog wl kunt doen.,In Gelukkig kunnen we nog... geven verschillende (bekende) tips eigen tips hoe je in deze thuiswerk-situatie nog wl kunt doen.,"['Nederlanders vanuit', 'expertise in vlog-vorm', 'over wat je']","['tips', '', 'hoe je']",8,30.0,7,"[0.9473684210526315, 1.0, 0.6363636363636364]",0.86
seq142-0,small,Het AD brengt iedere week op donderdag recensies van films die in premire gaan. Deze keer: het drama,Het AD brengt iedere <extra_id_0> recensies van films die in premire <extra_id_1> keer: het drama,Het AD brengt iedere recensies van films die in premire gaan. Dit keer: het drama,"['week op donderdag', 'gaan. Deze']","['', 'gaan. Dit']",5,30.0,7,"[1.0, 0.3]",0.65
seq143-0,small,"Nu mensen meer en meer via internet bestellen, verschijnen ze steeds vaker in het straatbeeld: bezorgers. In deze serie geeft Ryan Poll acht bezorgers in het Groene Hart een gezicht. Vandaag:","Nu mensen meer en meer via internet bestellen, verschijnen ze steeds vaker in het straatbeeld: bezorgers. <extra_id_0> geeft <extra_id_1> bezorgers in het <extra_id_2> gezicht. Vandaag:","Nu mensen meer en meer via internet bestellen, verschijnen ze steeds vaker in het straatbeeld: bezorgers. Het geeft zich bezorgers in het eerste gezicht. Vandaag:","['In deze serie', 'Ryan Poll acht', 'Groene Hart een']","['Het', 'zich', 'eerste']",9,30.0,7,"[0.9230769230769231, 0.8571428571428571, 0.7333333333333333]",0.84
seq144-0,small,"Elke week recenseert het AD Utrechts Nieuwsblad een van de vele restaurants in de provincie Utrecht. Marco Bosmans beoordeelt het restaurant aan de hand van het voor-, hoofd- en nagerecht, de bediening, sfeer en prijs-kwaliteit. Deze week eet hij bij","Elke week recenseert het AD Utrechts Nieuwsblad <extra_id_0> vele restaurants in de provincie Utrecht. Marco Bosmans beoordeelt het restaurant aan de hand van het <extra_id_1> nagerecht, de bediening, <extra_id_2> Deze week <extra_id_3>","Elke week recenseert het AD Utrechts Nieuwsblad de vele restaurants in de provincie Utrecht. Marco Bosmans beoordeelt het restaurant aan de hand van het gerecht, het nagerecht, de bediening, de bediening. Deze week recenseert het AD Utrechts Nieuwsblad","['een van de', 'voor-', 'hoofd- en', 'sfeer en prijs-kwaliteit.', 'eet hij bij']","['de', 'gerecht, het', 'de bediening.', 'Nieuwsblad']",12,30.0,7,"[0.8, 1.0, 0.8461538461538461, 0.88]",0.88
seq145-0,small,De winterse transfercarrousel draait alweer op volle toeren. In TransferTalk houden we alle geruchten en voltooide transfers van deze maand bij. Mis niets in deze rubriek.,De winterse transfercarrousel draait alweer op volle <extra_id_0> houden we alle geruchten <extra_id_1> transfers van <extra_id_2> Mis niets in deze rubriek.,De winterse transfercarrousel draait alweer op volle kracht. Nu houden we alle geruchten over transfers van onze maatschappij. Mis niets in deze rubriek.,"['toeren. In TransferTalk', 'en voltooide', 'deze maand bij.']","['kracht. Nu', 'over', 'onze maatschappij.']",8,30.0,7,"[0.9130434782608695, 0.9166666666666666, 0.5]",0.78
seq146-0,small,De nieuwsberichten over het coronavirus volgen elkaar in een rap tempo op. De Stentor zet dagelijks de belangrijkste gebeurtenissen op een rij. Met vandaag,De nieuwsberichten over het coronavirus volgen elkaar in een rap tempo op. <extra_id_0> de belangrijkste gebeurtenissen op een <extra_id_1>,De nieuwsberichten over het coronavirus volgen elkaar in een rap tempo op. De cijfers tonen de belangrijkste gebeurtenissen op een rij,"['De Stentor zet dagelijks', 'rij. Met vandaag']","['De cijfers tonen', 'rij']",7,30.0,7,"[0.75, 0.8125]",0.78
seq147-0,small,". Een deel van het havengebied is weggevaagd, het dodental loopt in rap tempo op en de ziekenhuizen zitten overvol.","<extra_id_0> van het havengebied is weggevaagd, <extra_id_1> in rap tempo op en de ziekenhuizen zitten overvol.","Het gebied van het havengebied is weggevaagd, het gebied komt in rap tempo op en de ziekenhuizen zitten overvol.","['. Een deel', 'het dodental loopt']","['Het gebied', 'het gebied komt']",6,30.0,7,"[0.8, 0.5555555555555556]",0.68
seq148-0,small,Deze zomer publiceren we in de late uurtjes op deze site onze best gelezen artikelen van dit jaar. Dit artikel verscheen eerder op,Deze zomer publiceren we in de late uurtjes <extra_id_0> best gelezen artikelen van dit jaar. Dit artikel <extra_id_1>,Deze zomer publiceren we in de late uurtjes de best gelezen artikelen van dit jaar. Dit artikel is gemaakt door Andr,"['op deze site onze', 'verscheen eerder op']","['de', 'Andr']",7,30.0,7,"[0.8823529411764706, 0.8421052631578947]",0.86
seq149-0,small,een 'vette vis' binnen? Een selectie van onwerkelijke speculaties tot concrete aanbiedingen in een dagelijkse rubriek: TransferTalk.,een 'vette vis' binnen? Een selectie van onwerkelijke <extra_id_0> aanbiedingen <extra_id_1> dagelijkse rubriek: TransferTalk.,een 'vette vis' binnen? Een selectie van onwerkelijke nieuwe aanbiedingen in de dagelijkse rubriek: TransferTalk.,"['speculaties tot concrete', 'in een']","['nieuwe', 'in de']",5,30.0,7,"[0.875, 0.3333333333333333]",0.6
seq150-0,small,"Journalist Sammy Shawky schrijft over de leukste, nieuwste, gekste en meest trendy winkels in de regio Utrecht. Vandaag:","Journalist Sammy Shawky <extra_id_0> leukste, nieuwste, gekste en meest trendy winkels <extra_id_1> regio Utrecht. Vandaag:","Journalist Sammy Shawky de leukste, nieuwste, gekste en meest trendy winkels in de regio Utrecht. Vandaag:","['schrijft over de', 'in de']","['de', 'in de']",5,30.0,7,"[0.875, 0.0]",0.44
seq151-0,small,"Korte updates van de sterren op Facebook, Twitter, Instagram en Snapchat: wij smullen ervan. In de rubriek Showbytes struint de showredactie het web voor je af voor de gekste, mooiste en opvallendste posts van BN'ers en celebrities. Dit artikel wordt gedurende de dag vernieuwd. 1","Korte updates <extra_id_0> sterren op Facebook, Twitter, Instagram en Snapchat: wij smullen ervan. In de rubriek Showbytes struint de showredactie het web voor <extra_id_1> de <extra_id_2> opvallendste posts van BN'ers <extra_id_3> artikel wordt gedurende <extra_id_4> 1","Korte updates van 5 sterren op Facebook, Twitter, Instagram en Snapchat: wij smullen ervan. In de rubriek Showbytes struint de showredactie het web voor een van de meest opvallendste posts van BN'ers Dit artikel wordt gedurende de 1","['van de', 'je af voor', 'gekste', 'mooiste en', 'en celebrities. Dit', 'de dag vernieuwd.']","['van 5', 'een van', 'meest', 'Dit', 'de']",14,30.0,7,"[0.3333333333333333, 0.7, 0.5, 0.8, 0.9473684210526315]",0.66
seq152-0,small,"Pieter Hulst en Gijs Groenteman ontleden teksten van Nederlandstalige hits. Ze geven antwoorden op prangende vragen die de nummers oproepen. Komen ze er zelf niet uit, dan roepen ze de hulp in van de wetenschap. Vandaag","Pieter Hulst en Gijs Groenteman ontleden teksten van Nederlandstalige hits. Ze geven antwoorden op prangende vragen die de nummers oproepen. Komen ze <extra_id_0> uit, <extra_id_1> ze <extra_id_2> van <extra_id_3>","Pieter Hulst en Gijs Groenteman ontleden teksten van Nederlandstalige hits. Ze geven antwoorden op prangende vragen die de nummers oproepen. Komen ze ervan uit, dan komen ze teksten van de teksten.","['er zelf niet', 'dan roepen', 'de hulp in', 'de wetenschap. Vandaag']","['ervan', 'dan komen', 'teksten', 'teksten.']",11,30.0,7,"[0.75, 0.3, 0.8, 0.7727272727272727]",0.66
seq153-0,small,In aanloop naar 75 jaar bevrijding blikt deze krant terug op gebeurtenissen uit de laatste maanden van de oorlog. Vandaag deel,<extra_id_0> 75 jaar bevrijding blikt deze krant terug op gebeurtenissen uit de laatste maanden <extra_id_1> Vandaag deel,75 jaar bevrijding blikt deze krant terug op gebeurtenissen uit de laatste maanden Vandaag deel,"['In aanloop naar', 'van de oorlog.']","['', '']",6,30.0,7,"[1.0, 1.0]",1.0
seq154-0,small,Het kabinet heeft in verband met het coronavirus drastische maatregelen genomen. Dit heeft ook gevolgen voor de regio Rivierenland. Volg de ontwikkelingen in de regio in ons blog. In ons dossier vind je alle artikelen over het coronavirus in de regio Rivierenland. Mist u iets? Tip de redactie: rl.redactie@ad.nl. 1,Het kabinet heeft <extra_id_0> het coronavirus drastische maatregelen genomen. Dit heeft ook gevolgen voor de regio Rivierenland. Volg de ontwikkelingen <extra_id_1> in ons blog. In ons dossier <extra_id_2> artikelen over het coronavirus in de <extra_id_3> u iets? <extra_id_4> rl.redactie@ad.nl. 1,Het kabinet heeft voor het coronavirus drastische maatregelen genomen. Dit heeft ook gevolgen voor de regio Rivierenland. Volg de ontwikkelingen hier in ons blog. In ons dossier vindt u artikelen over het coronavirus in de krant. Heeft u iets? Mail dan rl.redactie@ad.nl. 1,"['in verband met', 'in de regio', 'vind je alle', 'regio Rivierenland. Mist', 'Tip de redactie:']","['voor', 'hier', 'vindt u', 'krant. Heeft', 'Mail dan']",15,30.0,7,"[0.9285714285714286, 0.8181818181818182, 0.5833333333333334, 0.7916666666666666, 0.8125]",0.79
seq155-0,small,"Het voetbal in alle grote competities ligt dan wel stil, maar ondanks deze idiote periode gaan de zaken en vooral de transfergeruchten gewoon door. In TransferTalk houden we alle geruchten bij.","Het voetbal in <extra_id_0> ligt dan wel stil, maar ondanks deze idiote periode gaan de zaken en <extra_id_1> gewoon door. In TransferTalk <extra_id_2> geruchten bij.","Het voetbal in de VS ligt dan wel stil, maar ondanks deze idiote periode gaan de zaken en dingen gewoon door. In TransferTalk staan er geruchten bij.","['alle grote competities', 'vooral de transfergeruchten', 'houden we alle']","['de VS', 'dingen', 'staan er']",9,30.0,7,"[0.9090909090909091, 0.8148148148148148, 0.7857142857142857]",0.84
seq156-0,small,Journalist Monica Beek (42) schrijft wekelijks voor Magazine over haar leven. Ze woont samen met haar dochters van 11 en 8 en heeft een vriend.,Journalist <extra_id_0> schrijft wekelijks voor Magazine over haar leven. Ze woont samen met <extra_id_1> van 11 <extra_id_2> heeft een vriend.,Journalist schrijft wekelijks voor Magazine over haar leven. Ze woont samen met een van 11 jaar en heeft een vriend.,"['Monica Beek (42)', 'haar dochters', 'en 8 en']","['', 'een', 'jaar en']",8,30.0,7,"[1.0, 0.9230769230769231, 0.5714285714285714]",0.83
seq157-0,small,Turkije stopt de komende vijf dagen met de opmars in Syri. De Turkse president Recep Erdogan en de Amerikaanse vicepresident Mike Pence zijn,Turkije stopt de komende vijf dagen met de opmars in Syri. De <extra_id_0> Erdogan <extra_id_1> Mike Pence zijn,Turkije stopt de komende vijf dagen met de opmars in Syri. De plannen van Erdogan en Mike Pence zijn,"['Turkse president Recep', 'en de Amerikaanse vicepresident']","['plannen van', 'en']",7,30.0,7,"[0.8181818181818182, 0.9354838709677419]",0.88
seq158-0,small,De transfermarkt is halverwege weer een rumoerige periode. Nog ruim zes weken draait de carrousel op volle toeren. Mis in onze rubriek TransferTalk niets van alle geruchten en voltooide transfers.,De transfermarkt is halverwege weer een rumoerige periode. Nog ruim zes weken draait de carrousel op volle <extra_id_0> onze rubriek TransferTalk <extra_id_1> geruchten <extra_id_2>,De transfermarkt is halverwege weer een rumoerige periode. Nog ruim zes weken draait de carrousel op volle vaart. Lees onze rubriek TransferTalk geruchten,"['toeren. Mis in', 'niets van alle', 'en voltooide transfers.']","['vaart. Lees', '', '']",9,30.0,7,"[0.7857142857142857, 1.0, 1.0]",0.93
seq159-0,small,station scoort zwaar ondermaats en bungelt onderaan de lijst van stations in Nederland die goed scoren op het gebied van punctualiteit.,station scoort zwaar ondermaats en bungelt onderaan de lijst van stations in Nederland <extra_id_0> op <extra_id_1> punctualiteit.,station scoort zwaar ondermaats en bungelt onderaan de lijst van stations in Nederland Dit gaat op weg naar punctualiteit.,"['die goed scoren', 'het gebied van']","['Dit gaat', 'weg naar']",6,30.0,7,"[0.8, 0.7857142857142857]",0.79
seq160-0,small,"De Chinese geheime dienst is betrokken bij het hacken van overheidsinstanties en bedrijven in Nederland. APT10, een hackersgroep gelinkt aan het Chinese ministerie voor Staatsveiligheid, wordt verantwoordelijk gehouden voor vele hackpogingen in een aantal westerse landen, waaronder Nederland.","De <extra_id_0> is betrokken bij het hacken van overheidsinstanties en bedrijven <extra_id_1> APT10, een hackersgroep gelinkt aan het Chinese ministerie voor Staatsveiligheid, wordt verantwoordelijk gehouden voor vele <extra_id_2> aantal <extra_id_3> Nederland.","De organisatie is betrokken bij het hacken van overheidsinstanties en bedrijven APT10, een hackersgroep gelinkt aan het Chinese ministerie voor Staatsveiligheid, wordt verantwoordelijk gehouden voor vele bedrijven en een aantal bedrijven in Nederland.","['Chinese geheime dienst', 'in Nederland.', 'hackpogingen in een', 'westerse landen', 'waaronder']","['organisatie', '', 'bedrijven en een', 'bedrijven in']",11,30.0,7,"[0.8181818181818182, 1.0, 0.5263157894736842, 0.7333333333333333]",0.77
seq161-0,small,"De Rotterdamse trouwstoetmepper. Shahid B. (26) moet anderhalf jaar de cel in, waarvan een half jaar voorwaardelijk voor de poging tot zware mishandeling van politieman Ge","De Rotterdamse trouwstoetmepper. Shahid B. (26) <extra_id_0> de cel in, waarvan een <extra_id_1> voor de poging tot <extra_id_2> van politieman Ge","De Rotterdamse trouwstoetmepper. Shahid B. (26) gaat de cel in, waarvan een jongen voor de poging tot dood van politieman Ge","['moet anderhalf jaar', 'half jaar voorwaardelijk', 'zware mishandeling']","['gaat', 'jongen', 'dood']",8,30.0,7,"[0.8947368421052632, 0.875, 0.9444444444444444]",0.9
seq162-0,small,In de rubriek Sportbytes houden we in de gaten wat bekende sporters meemaken n delen op sociale media. Dit artikel wordt gedurende de dag vernieuwd.,In <extra_id_0> Sportbytes houden we in de gaten wat bekende sporters <extra_id_1> op sociale media. Dit artikel <extra_id_2> dag vernieuwd.,In de categorie Sportbytes houden we in de gaten wat bekende sporters sporten op sociale media. Dit artikel is elke dag vernieuwd.,"['de rubriek', 'meemaken n delen', 'wordt gedurende de']","['de categorie', 'sporten', 'is elke']",8,30.0,7,"[0.5833333333333334, 0.875, 0.8333333333333334]",0.76
