Schrijver Henk van Straten stapt elke week in de auto bij een min of meer bekende Nederlander. Een enkele keer neemt hij de tram. Deze week:,Schrijver <extra_id_0> elke week in de auto bij een min of meer bekende Nederlander. Een enkele keer neemt hij de tram. Deze week:,['Henk van Straten stapt'],4,7
Aan een nieuwe woning toe? Of wil je juist gunstig verkopen? Bekijk hier hoeveel het modale huis in jouw woonplaats kostte in het,Aan een nieuwe woning toe? Of wil je juist gunstig verkopen? Bekijk hier hoeveel het <extra_id_0> jouw woonplaats kostte in het,['modale huis in'],3,7
' (+) Welke rol speelt afkomst in Nederland? Dat onderzoekt Robert Vuijsje in een reeks interviews.,' (+) Welke rol speelt afkomst in Nederland? Dat onderzoekt <extra_id_0> in een reeks interviews.,['Robert Vuijsje'],2,7
"Berichten verspreiden zich dankzij internet vaak razendsnel, of ze nu kloppen of niet. De Volkskrant gaat op zoek naar hele en halve onwaarheden en probeert de zin van de onzin te scheiden.","Berichten verspreiden zich dankzij internet vaak razendsnel, of ze <extra_id_0> De Volkskrant gaat op zoek naar hele en halve onwaarheden en probeert de zin van de onzin te scheiden.",['nu kloppen of niet.'],5,7
ste aflevering van een serie over honderd belangrijke Nederlanders van deze eeuw. De volgorde is chronologisch (op basis van geboortedatum). Onder het kopje Gepasseerd staan de namen van tijdgenoten die de tophonderd niet hebben bereikt.,ste aflevering van een serie over honderd belangrijke Nederlanders van deze eeuw. De volgorde is chronologisch (op basis van geboortedatum). Onder het kopje Gepasseerd staan <extra_id_0> die de tophonderd niet hebben bereikt.,['de namen van tijdgenoten'],5,7
en Jeanne Prisser bericht over wat zich afspeelt in de voorhoede van de beeldende kunst. Deze week:,en Jeanne Prisser bericht <extra_id_0> afspeelt in de voorhoede van de beeldende kunst. Deze week:,['over wat zich'],3,7
"0 van de dagelijkse 4 Uur Nieuwsbreak. In deze rubriek nemen we iedere dag met een interessant, bekend persoon het nieuws van de dag door.",0 van de dagelijkse 4 Uur Nieuwsbreak. In deze rubriek nemen we iedere <extra_id_0> bekend persoon het nieuws van de dag door.,"['dag met een interessant,']",4,7
"oud-gevechtsvlieger Dieter Dengler ontmoette, wist hij meteen dat hij een film over hem zou maken. Het werden er twee:","oud-gevechtsvlieger Dieter Dengler ontmoette, <extra_id_0> dat hij een film over hem zou maken. Het werden er twee:",['wist hij meteen'],3,7
"Berichten verspreiden zich vaak razendsnel, of ze nu kloppen of niet. Wij proberen de zin van de onzin te scheiden. Vandaag:","Berichten verspreiden zich vaak razendsnel, of ze nu kloppen of niet. Wij proberen de zin van de onzin <extra_id_0>",['te scheiden. Vandaag:'],3,7
"i; di t/m zo 11-17u. Tel. 013-5438300 (www.depont.nl). Utrecht, Centraal Museum (Nicolaaskerkhof 10):",i; di t/m zo 11-17u. Tel. 013-5438300 <extra_id_0> Centraal Museum (Nicolaaskerkhof 10):,"['(www.depont.nl). Utrecht,']",2,7
"Omdat in de zomer de onbedwingbare behoefte ontstaat het water in te gaan, van pierenbad tot diepzee, peilt","Omdat in de zomer de onbedwingbare behoefte ontstaat het water in <extra_id_0> pierenbad tot diepzee, peilt","['te gaan, van']",3,7
"XXste Eeuw, kunst uit de twintigste eeuw met werken van Toorop en Mondriaan, Andy Warhol en Donald Judd tot Jrg Immendorf","XXste Eeuw, kunst uit de twintigste eeuw met werken van Toorop en <extra_id_0> en Donald Judd tot Jrg Immendorf","['Mondriaan, Andy Warhol']",3,7
Jaarlijks publiceren Nederlandse wetenschappers 172 duizend onderzoeken. In deze rubriek een greep uit die onderzoeken die bijna onopgemerkt waren gebleven.,Jaarlijks publiceren Nederlandse wetenschappers <extra_id_0> In deze rubriek een greep uit die onderzoeken die bijna onopgemerkt waren gebleven.,['172 duizend onderzoeken.'],3,7
"; dagelijks 10-17u do vr tot 21u. Tel. 020-5516500 (www.foam.nl). Den Haag, Fotomuseum (Stadhouderslaan 43):","; dagelijks 10-17u do <extra_id_0> 21u. Tel. 020-5516500 (www.foam.nl). Den Haag, Fotomuseum (Stadhouderslaan 43):",['vr tot'],2,7
. Breaking the Waves (Lars von Trier). Hartverscheurend melodrama in een Schotse kustplaats. Grillige Deense regisseur speelt met emoties in verhaal van onvoorwaardelijke liefde.,. Breaking the Waves (Lars <extra_id_0> in een Schotse kustplaats. Grillige Deense regisseur speelt met emoties in verhaal van onvoorwaardelijke liefde.,['von Trier). Hartverscheurend melodrama'],4,7
"scherpste observaties vanaf het Binnenhof, waargenomen en opgetekend door de verslaggevers van onze parlementaire redactie.","scherpste observaties vanaf het Binnenhof, waargenomen en opgetekend door de verslaggevers <extra_id_0> parlementaire redactie.",['van onze'],2,7
"Berichten verspreiden zich vaak razendsnel, of ze nu kloppen of niet. Wij proberen de zin van de onzin te scheiden. Deze week:",Berichten verspreiden zich vaak <extra_id_0> nu kloppen of niet. Wij proberen de zin van de onzin te scheiden. Deze week:,"['razendsnel, of ze']",3,7
". Over het meisje dat zo graag vies wil zijn, naar het boek van Annie M.G. Schmidt en Fiep Westendorp.",". Over het meisje <extra_id_0> vies wil zijn, naar het boek van Annie M.G. Schmidt en Fiep Westendorp.",['dat zo graag'],3,7
"). Nesjomme van Het Internationaal Danstheater is een rondgang door de Joodse dans- en muziekcultuur, dans rond klezmer en kippensoep. Met 22 dansers, een orkest en Heddy Lester in de hoofdrol. Vanavond in","). Nesjomme van Het Internationaal Danstheater is een rondgang door de Joodse dans- en muziekcultuur, dans rond klezmer en kippensoep. Met 22 dansers, een orkest en Heddy Lester in de <extra_id_0>",['hoofdrol. Vanavond in'],5,7
"Rotterdam, Boijmans Van Beuningen (010-4419400): De collectie. Duitse kunst van Kiefer tot Henning, dwarsdoorsnede van na-oorlogse Duitse schilderkunst","<extra_id_0> Beuningen (010-4419400): De collectie. Duitse kunst van Kiefer tot Henning, dwarsdoorsnede van na-oorlogse Duitse schilderkunst","['Rotterdam, Boijmans Van']",3,7
De rubriek Beeldvormers onderzoekt hoe een foto onze kijk op de werkelijkheid bepaalt. Deze week: de,De rubriek Beeldvormers onderzoekt hoe een foto onze kijk <extra_id_0> werkelijkheid bepaalt. Deze week: de,['op de'],2,7
en Je gaat het pas zien als je het doorhebt.* Wieteke van Zeil over opmerkelijke en veelbetekenende bijzaken in de beeldende kunst. Deze week:,<extra_id_0> pas zien als je het doorhebt.* Wieteke van Zeil over opmerkelijke en veelbetekenende bijzaken in de beeldende kunst. Deze week:,['en Je gaat het'],4,7
Wat houdt de literaire wereld in het buitenland bezig? Onze correspondenten houden het bij. Deze week Patrick van IJzendoorn over,Wat houdt de literaire wereld in het buitenland <extra_id_0> houden het bij. Deze week Patrick van IJzendoorn over,['bezig? Onze correspondenten'],3,7
"In maart wordt voor de negende keer de Volkskrant Beeldende Kunst Prijs uitgereikt aan jong talent (van na 1980). De Volkskrant presenteert alvast de vijf kanshebbers, wier werk vanaf vrijdag in Schiedam te zien is. In dit profiel:","<extra_id_0> voor de negende keer de Volkskrant Beeldende Kunst Prijs uitgereikt aan jong <extra_id_1> 1980). De Volkskrant presenteert alvast de vijf kanshebbers, wier werk vanaf vrijdag in Schiedam te zien is. In dit profiel:","['In maart wordt', 'talent (van na']",6,7
In De andere kant wordt wekelijks een actuele kwestie ondersteboven gehouden of binnenstebuiten gekeerd. De,In De andere kant wordt wekelijks een actuele kwestie ondersteboven <extra_id_0> binnenstebuiten gekeerd. De,['gehouden of'],2,7
"8 van de dagelijkse 4 Uur Nieuwsbreak. In deze rubriek nemen we iedere dag met een interessant, bekend persoon het nieuws van de dag door.","<extra_id_0> 4 Uur Nieuwsbreak. In deze rubriek nemen we iedere dag met een interessant, bekend persoon het nieuws van de dag door.",['8 van de dagelijkse'],4,7
"Opvoeden kan een mijnenveld zijn. Zoveel meningen, zoveel twijfel. Anna van den Breemer schrijft elke w","Opvoeden kan een <extra_id_0> Zoveel meningen, zoveel twijfel. Anna van den Breemer schrijft elke w",['mijnenveld zijn.'],2,7
van de dagelijkse 4 uur Nieuwsbreak. In deze rubriek nemen we met een interessant persoon het nieuws van de dag door.,van <extra_id_0> uur Nieuwsbreak. In deze rubriek nemen we met een interessant persoon het nieuws van de dag door.,['de dagelijkse 4'],3,7
(vier sterren) De Volkskrant luistert naar (nieuwe) podcasts en bespreekt er elke week een. Vandaag:,(vier sterren) De Volkskrant luistert naar (nieuwe) podcasts en bespreekt <extra_id_0> week een. Vandaag:,['er elke'],2,7
"Nederland leidt in de zomer een heel ander leven; werk en school maken plaats voor serieuze ontspanning. De Volkskrant onderzoekt in elke provincie hoe dat verloopt. We marsjeren, naar een gedicht van de Vlaming Paul van Ostaijen, d","Nederland leidt in de zomer een heel ander leven; werk <extra_id_0> plaats voor serieuze ontspanning. <extra_id_1> in elke provincie hoe dat verloopt. We marsjeren, naar een gedicht van de Vlaming Paul van Ostaijen, d","['en school maken', 'De Volkskrant onderzoekt']",6,7
"kunst, pozie, kalligrafie, muziek, kleding en dans tonen de culturele diversiteit van Iran. Rondleidingen op wo","kunst, pozie, kalligrafie, muziek, kleding en dans tonen de culturele <extra_id_0> Iran. Rondleidingen op wo",['diversiteit van'],2,7
a gefingeerd. Ook genterviewd worden over liefde en lust? Mail een korte toelichting naar lust@volkskrant.nl,<extra_id_0> Ook genterviewd worden over liefde en lust? Mail een korte toelichting naar lust@volkskrant.nl,['a gefingeerd.'],2,7
"en  Klopt dit wel? Berichten verspreiden zich vaak razendsnel, of ze nu kloppen of niet. Wij proberen de zin van de onzin te scheiden. Vandaag:","en Klopt dit wel? Berichten verspreiden zich vaak razendsnel, of ze nu kloppen of niet. Wij proberen de zin <extra_id_0> scheiden. Vandaag:",['van de onzin te'],4,7
Dagkoersen is de politieke nieuwsbrief van de Volkskrant. Vragen of opmerkingen? Mail naar haag@volkskrant.nl. Deze nieuwsbrief,Dagkoersen <extra_id_0> politieke nieuwsbrief van de Volkskrant. Vragen of opmerkingen? Mail naar haag@volkskrant.nl. Deze nieuwsbrief,['is de'],2,7
"Zonder muziek, maar met het minimalistische geluidsdecor en de briljante montage, ontstonden een paar van de spannendste scnes uit h","Zonder muziek, maar met <extra_id_0> en de briljante montage, ontstonden een paar van de spannendste scnes uit h",['het minimalistische geluidsdecor'],3,7
Iedere week beantwoordt de Volkskrant een beloningsvraag van een lezer in de rubriek Verdien ik wel genoeg. Deze week de,Iedere week beantwoordt <extra_id_0> beloningsvraag van een lezer in de rubriek Verdien ik wel genoeg. Deze week de,['de Volkskrant een'],3,7
"). Sonata, choreografie van Stephen Shropshire door Station Zuid. Jussi Nousiainen danst zes solos op muziek van Bach en Anne Parlevliet, live begeleid door de pianiste Anny Tseng.","). Sonata, choreografie <extra_id_0> Station Zuid. Jussi Nousiainen danst zes solos op muziek van Bach en Anne Parlevliet, live begeleid door de pianiste Anny Tseng.",['van Stephen Shropshire door'],4,7
"- Klopt dit wel? Berichten verspreiden zich vaak razendsnel, of ze nu kloppen of niet. Wij proberen de zin van de onzin te scheiden. Vandaag:","- Klopt dit wel? <extra_id_0> razendsnel, of ze nu kloppen of niet. Wij proberen de zin van de onzin te scheiden. Vandaag:",['Berichten verspreiden zich vaak'],4,7
Elke dag tipt de redactie van de Volkskrant de beste programma's en films op televisie. Dit moet u,Elke dag tipt de redactie van de Volkskrant de beste programma's en films op televisie. <extra_id_0>,['Dit moet u'],3,7
"Armand Bouten (1893-1965), t/m 1 maart; di t/m zo 10-17u vr tot 22u. Tel. 0900-8212132. www.groningermuseum.nl","Armand Bouten (1893-1965), t/m <extra_id_0> di t/m zo 10-17u vr tot 22u. Tel. 0900-8212132. www.groningermuseum.nl",['1 maart;'],2,7
". Maria Stuart van Schiller door het Nationale Toneel, met Mirjam Stolwijk als de strijdlustige Schotse koningin en Will van Kralingen als",". Maria Stuart <extra_id_0> het Nationale Toneel, met Mirjam Stolwijk als de strijdlustige Schotse koningin en Will van Kralingen als",['van Schiller door'],3,7
"de aandacht drie uur lang vasthoudt met smakelijke dialogen, galgenhumor en fabuleus georkestreerd geweld.","de aandacht drie uur lang <extra_id_0> smakelijke dialogen, galgenhumor en fabuleus georkestreerd geweld.",['vasthoudt met'],2,7
Wat zullen we eens eten vanavond? Elke dag in de Volkskrant een verrassend en smakelijk recept. Vandaag:,Wat zullen we eens eten vanavond? <extra_id_0> de Volkskrant een verrassend en smakelijk recept. Vandaag:,['Elke dag in'],3,7
Welke rol speelt afkomst in Nederland? Dat onderzoekt de Volkskrant in een reeks interviews. Ondernemer,Welke rol speelt afkomst in <extra_id_0> onderzoekt de Volkskrant in een reeks interviews. Ondernemer,['Nederland? Dat'],2,7
dat een ja-stem 'een keuze voor verandering en omvorming van het bestuurssysteem' is. Welke veranderingen bedoelt hij hiermee,dat een ja-stem 'een keuze voor verandering en omvorming van het bestuurssysteem' is. Welke veranderingen <extra_id_0>,['bedoelt hij hiermee'],3,7
In De andere kant wordt wekelijks een actuele kwestie ondersteboven gehouden of binnenstebuiten gekeerd. Vandaag:,In De andere kant wordt wekelijks een actuele kwestie ondersteboven gehouden of <extra_id_0> Vandaag:,['binnenstebuiten gekeerd.'],2,7
". Als lijsttrekker van de Single Issue Partij blogt journalist, radiomaker en ervaringsdeskundige Maartje Duin over hun leven.",. Als lijsttrekker van de Single Issue <extra_id_0> radiomaker en ervaringsdeskundige Maartje Duin over hun leven.,"['Partij blogt journalist,']",3,7
| De Volkskrant Jeanne Prisser bericht over wat zich afspeelt in de voorhoede van de beeldende kunst. Deze week:,| De Volkskrant <extra_id_0> over wat zich afspeelt in de voorhoede van de beeldende kunst. Deze week:,['Jeanne Prisser bericht'],3,7
Dagkoersen is de politieke nieuwsbrief van de Volkskrant. Onze politieke redactie neemt u elke middag rond 17.00 uur mee naar het Binnenhof. De Haagse vierkante kilometer is een snelkookpan waarin een tweet in de ochtend kan uitgroeien tot een Kamerdebat in de middag en een crisis in de avond. U leest het in Dagkoersen.,Dagkoersen <extra_id_0> van de Volkskrant. Onze politieke redactie neemt u elke middag rond 17.00 uur mee naar het Binnenhof. De Haagse vierkante kilometer is een snelkookpan <extra_id_1> de ochtend kan uitgroeien tot een Kamerdebat in de middag en een crisis in de avond. U leest het in Dagkoersen.,"['is de politieke nieuwsbrief', 'waarin een tweet in']",8,7
"de vluchtelingencrisis in Europa. Wie zijn die vluchtelingen, wat zijn de gevolgen van hun komst en hoe kan het anders?","de vluchtelingencrisis in Europa. Wie zijn die vluchtelingen, wat <extra_id_0> van hun komst en hoe kan het anders?",['zijn de gevolgen'],3,6
Nederlandse commando's van het KCT (Korps Commando Troepen) tijdens een patrouille richting de stad,Nederlandse commando's van het <extra_id_0> Commando Troepen) tijdens een patrouille richting de stad,['KCT (Korps'],2,6
Donald Trump heeft vrijdag niet de vereiste driemaandelijke presidentile handtekening gezet onder het nucleaire akkoord met Iran.,Donald Trump heeft vrijdag niet de vereiste driemaandelijke presidentile handtekening <extra_id_0> nucleaire akkoord met Iran.,['gezet onder het'],3,6
"voor iedereen die een relatie heeft, er eentje heeft gehad of graag zou willen. Regie: Jrgen Tjon A Fon. Muziek: Jay.Soul & Perquisite. V",voor iedereen die <extra_id_0> eentje heeft gehad of graag zou willen. Regie: Jrgen Tjon A Fon. Muziek: Jay.Soul & Perquisite. V,"['een relatie heeft, er']",4,6
). Ciske de Rat met Danny de Munk als de volwassen Cis die terugblikt op zijn roerige leven. Vanavond t/m,). Ciske de Rat met Danny <extra_id_0> de volwassen Cis die terugblikt op zijn roerige leven. Vanavond t/m,['de Munk als'],3,6
"), Lucas van Esch (artdirector V), Erik d'Ailly, Thijs Balder, Joke Buijs, Annemieke Jansen, Koos Jeremiasse,","), Lucas van <extra_id_0> V), Erik d'Ailly, Thijs Balder, Joke Buijs, Annemieke Jansen, Koos Jeremiasse,",['Esch (artdirector'],2,6
"Amsterdam, Van Gogh Museum (020-5705252): Dreams of nature, symbolistisch landschap met zeventig werken van Van Gogh, Munch tot Kandinksy, t/m 17/6","Amsterdam, Van Gogh Museum (020-5705252): Dreams of nature, symbolistisch landschap met zeventig werken van Van <extra_id_0> Kandinksy, t/m 17/6","['Gogh, Munch tot']",3,6
"circa vijftig schilderijen en dertig tekeningen van Willem Maris (1844-1910), t/m 9/4; De Ouborg Prijs 2011,","circa vijftig schilderijen en dertig tekeningen van Willem Maris (1844-1910), <extra_id_0> De Ouborg Prijs 2011,",['t/m 9/4;'],2,6
"Jouw perspectief!?, abstract grote getallen teruggebracht naar menselijke maat in visualisaties, t/m 18/3","Jouw perspectief!?, abstract grote getallen <extra_id_0> menselijke maat in visualisaties, t/m 18/3",['teruggebracht naar'],2,6
Wekelijks selecteert de Volkskrant films die u niet mag missen. En een aantal die u met gerust hart kunt overslaan. Deze week:,Wekelijks selecteert de Volkskrant <extra_id_0> niet mag missen. En een aantal die u met gerust hart kunt overslaan. Deze week:,['films die u'],3,6
Een omslag kan een boek maken of breken. Zes ontwerpers over hun vak en het geheim van een goede cover. Vandaag:,<extra_id_0> een boek maken of breken. Zes ontwerpers over hun vak en het geheim van een goede cover. Vandaag:,['Een omslag kan'],3,6
"Never Mind That Noise You Heard, recente videos en installaties van kunstenaarsduo Allora & Calzadilla","Never Mind That Noise You Heard, recente videos en installaties van <extra_id_0> & Calzadilla",['kunstenaarsduo Allora'],2,6
". Amsterdam, Museum het Rembrandthuis (Jodenbreestraat 4): Vrouwenlevens tussen kunst en wetenschap,",". <extra_id_0> het Rembrandthuis (Jodenbreestraat 4): Vrouwenlevens tussen kunst en wetenschap,","['Amsterdam, Museum']",2,6
Zo'n driehonderd mensen demonstreren met witte paraplu's bij het Grensdetentiecentrum om aandacht te vragen voor vluchtelingen die na aankomst op Schiphol gelijk in detentie worden gezet,Zo'n driehonderd mensen demonstreren met witte <extra_id_0> om aandacht te vragen voor vluchtelingen die na aankomst op Schiphol gelijk in detentie worden gezet,"[""paraplu's bij het Grensdetentiecentrum""]",4,6
Hoe kan het dat deze grote vervuiler bij alle internationale klimaatakkoorden altijd buiten schot blijft?,Hoe kan het dat <extra_id_0> vervuiler bij alle internationale klimaatakkoorden altijd buiten schot blijft?,['deze grote'],2,6
". Liaisons dangereuses van Christopher Hampton naar het boek van Choderlos de Laclos, met Ariane Schluter en Gijs Scholten van Aschat als het perverse paar dat een gevaarlijk spel speelt. Johan Doesburg regisseert deze voorstelling van het Nationale Toneel. Vanavond",". Liaisons dangereuses van Christopher Hampton naar het <extra_id_0> de Laclos, met Ariane Schluter en Gijs Scholten van Aschat als het perverse paar <extra_id_1> spel speelt. Johan Doesburg regisseert deze voorstelling van het Nationale Toneel. Vanavond","['boek van Choderlos', 'dat een gevaarlijk']",6,6
"Route 66 is een roadmusical, bedacht door Harry Kies en geschreven door Dick van den Heuvel en Stan Lapinski.","<extra_id_0> een roadmusical, bedacht door Harry Kies en geschreven door Dick van den Heuvel en Stan Lapinski.",['Route 66 is'],3,6
"). Bloedband, muziektheater over de schoonheid van het alledaagse en het geluk dat voor het grijpen ligt. Door Orkater, met muziek van Beppe Costa en tekst van Leopold Witte en Geert Lageveen. V","). Bloedband, muziektheater over de schoonheid van het alledaagse en het geluk dat voor het grijpen ligt. Door Orkater, met muziek van Beppe Costa en tekst van <extra_id_0> Lageveen. V",['Leopold Witte en Geert'],5,6
"In Pyeongchang hebben meer landen hun Kramer; een man, vrouw of ploeg die het als zijn plicht beschouwt om te winnen in de sport van zijn geboorteland. Niet de strijd telt, maar de triomf. Die ambitie wordt vaak versterkt door de verwachtingen in eigen land.","In Pyeongchang hebben <extra_id_0> een man, vrouw of ploeg die het als zijn plicht beschouwt om te winnen in de sport van zijn geboorteland. Niet de strijd telt, <extra_id_1> Die ambitie wordt vaak versterkt door de verwachtingen in eigen land.","['meer landen hun Kramer;', 'maar de triomf.']",7,6
de keer de Volkskrant Top 200 van invloedrijkste Nederlanders. Hoe wordt die ranglijst samengesteld?,de keer de Volkskrant Top 200 van invloedrijkste <extra_id_0> wordt die ranglijst samengesteld?,['Nederlanders. Hoe'],2,6
". Colette, solo van Jose Ruiter over de beroemde en ooit omstreden Franse schrijfster Colette (1873-1954), die een intense relatie had met haar moeder en haar eigen dochter aan",". Colette, solo van Jose Ruiter over de beroemde en ooit omstreden Franse schrijfster Colette (1873-1954), die <extra_id_0> met haar moeder en haar eigen dochter aan",['een intense relatie had'],4,6
"uit werken die de choreografen Marco Goecke, Georg Reischl, Stephen Shropshire, Andr Gingras, Jaakko Toivonen en Ed Wubbe eerder voor","uit werken die de choreografen Marco Goecke, Georg Reischl, Stephen Shropshire, Andr <extra_id_0> en Ed Wubbe eerder voor","['Gingras, Jaakko Toivonen']",3,6
"Iklimler (Nuri Bilge Ceylan). Turkse variatie op Scnes uit een huwelijk. Terwijl de seizoenen voorbijgaan, focust","Iklimler <extra_id_0> Ceylan). Turkse variatie op Scnes uit een huwelijk. Terwijl de seizoenen voorbijgaan, focust",['(Nuri Bilge'],2,6
Je gaat het pas zien als je het doorhebt. Wieteke van Zeil over opmerkelijke en veelbetekenende bijzaken in de beeldende kunst. Deze week:,Je <extra_id_0> zien als je het doorhebt. Wieteke van Zeil over opmerkelijke en veelbetekenende bijzaken in de beeldende kunst. Deze week:,['gaat het pas'],3,6
"Sander Donkers ging er altijd gedachteloos vanuit dat hij veel gemeen heeft met actrice Anousha Nzume, die hij al kent van toen ze nog Anna heette. Niet echt, blijkt als hij haar spreek","Sander Donkers ging er altijd gedachteloos vanuit dat hij veel gemeen heeft <extra_id_0> die hij al kent van toen ze nog Anna heette. Niet echt, blijkt als hij haar spreek","['met actrice Anousha Nzume,']",5,6
"| De Volkskrant Kookboekenmaker, kok en illustrator Yvette van Boven maakt elke week een gerecht in de oven. Deze week:","| De Volkskrant Kookboekenmaker, <extra_id_0> Yvette van Boven maakt elke week een gerecht in de oven. Deze week:",['kok en illustrator'],3,6
". Ze zijn terughoudend met schokkende beelden: in plaats daarvan zie je vooral de sprekers achter de computer, blauw flikkerend licht op hun gezicht, de ogen aan het scherm gekleefd.",". Ze zijn terughoudend met schokkende beelden: in plaats daarvan zie je vooral de sprekers achter de computer, blauw <extra_id_0> gezicht, de ogen aan het scherm gekleefd.",['flikkerend licht op hun'],4,6
"Amsterdam, Joods Historisch Museum (Nieuwe Amstelstraat 1): Art of the State, hedendaagse fotografie en videokunst van zestien Isralische kunstenaars; voorts De Blauwe Schuit, voorstudies van Hendrik Werkman (1882-1945) v","Amsterdam, Joods Historisch Museum (Nieuwe Amstelstraat 1): Art of the State, hedendaagse fotografie en videokunst van zestien Isralische kunstenaars; voorts De Blauwe Schuit, voorstudies <extra_id_0> v",['van Hendrik Werkman (1882-1945)'],4,6
"Blik test autos, signaleert opvallende autozaken en doet daarvan elke twee weken verslag. Vandaag de","Blik test autos, signaleert opvallende autozaken en doet <extra_id_0> twee weken verslag. Vandaag de",['daarvan elke'],2,6
voorstelling uit 2004. Het doorleefde danserslichaam van Jacob Flier en de jonge mimespeelster Schweigman ontmoeten elkaar op muziek van,<extra_id_0> Het doorleefde danserslichaam van Jacob Flier en de jonge mimespeelster Schweigman ontmoeten elkaar op muziek van,['voorstelling uit 2004.'],3,6
De vraag lijkt simpel: wilt u dat Nederland een online-surveillancestaat wordt? Maar zo simpel is het niet.,De vraag lijkt simpel: wilt u dat Nederland <extra_id_0> Maar zo simpel is het niet.,['een online-surveillancestaat wordt?'],3,6
". Bonnefantenmuseum: Rondom Drer schetst met vijftig tekeningen en zo'n driehonderd prenten een beeld van de periode uit de Renaissance waarin tekenaar en graficus Albrecht Drer een sleutelrol speelde, t/m 11 juni;",". Bonnefantenmuseum: <extra_id_0> vijftig tekeningen en zo'n driehonderd prenten een beeld van de periode uit de Renaissance waarin tekenaar en graficus Albrecht Drer een sleutelrol speelde, t/m 11 juni;",['Rondom Drer schetst met'],5,6
"(David Fincher). De maker van Se7en en Fight Club richt zich op een waar gebeurde moordzaak in Amerika die nooit werd opgelost. Niet de moordenaar speelt de hoofdrol, maar de mannen die hem proberen te ontmaskeren.","(David Fincher). <extra_id_0> en Fight Club richt zich op een waar gebeurde moordzaak in Amerika die nooit werd opgelost. Niet de moordenaar speelt de hoofdrol, maar de mannen die hem proberen te ontmaskeren.",['De maker van Se7en'],5,6
r De rubriek Beeldvormers onderzoekt hoe een foto onze kijk op de werkelijkheid bepaalt. Deze week:,r De rubriek Beeldvormers onderzoekt hoe een foto onze <extra_id_0> de werkelijkheid bepaalt. Deze week:,['kijk op'],2,6
"Wat kwam er de laatste dagen weer voor moois bij in het cultuuraanbod? De Volkskrant-specialisten kiezen hun favorieten, van een","Wat kwam er de laatste <extra_id_0> moois bij in het cultuuraanbod? De Volkskrant-specialisten kiezen hun favorieten, van een",['dagen weer voor'],3,6
