"London to Brighton (Paul Andrew Williams). Knap debuut van Engelse regisseur is een gangsterfilm zonder flauwe grappen of ironie. In plaats daarvan presenteert Williams gangsters als enge zielepoten, even angstaanjagend als meelijwekkend. Hoofdpersonen zijn twee meisjes, die in de prostitutie werken. Ook is er nog een pedofiele slechterik. (in","London to <extra_id_0> Knap debuut van Engelse regisseur is een gangsterfilm zonder flauwe grappen of ironie. In plaats daarvan presenteert Williams gangsters als enge zielepoten, even angstaanjagend als meelijwekkend. Hoofdpersonen zijn twee meisjes, die in de <extra_id_1> is er nog een pedofiele slechterik. (in","['Brighton (Paul Andrew Williams).', 'prostitutie werken. Ook']",7,6
Wekelijks selecteert de Volkskrant nieuwe films die u volgens de filmrecensenten niet mag missen. En,Wekelijks selecteert de Volkskrant nieuwe films die u volgens de filmrecensenten <extra_id_0> missen. En,['niet mag'],2,6
Arjan Peters volgt het WK Voetbal en doet daar dagelijks verslag van. Hij kijkt alle wedstrijden en in de rust leest hij een boek. Vandaag aflevering,Arjan Peters <extra_id_0> en doet daar dagelijks verslag van. Hij kijkt alle wedstrijden en in de rust leest hij een boek. Vandaag aflevering,['volgt het WK Voetbal'],4,6
"In deze rubriek worden kunstwerken belicht die te koop zijn bij galeries, veilingen en op internet. Deze week","In deze rubriek worden kunstwerken belicht die te koop zijn bij galeries, veilingen en <extra_id_0> week",['op internet. Deze'],3,6
"Elke dag publiceren het RIVM, de ziekenhuizen, wereldgezondheidsorganisatie WHO en allerlei landen cijfers over de uitbraak van het coronavirus. Maar welke cijfers zijn belangrijk? En hoe moeten we ernaar kijken?","Elke dag publiceren het RIVM, de ziekenhuizen, wereldgezondheidsorganisatie WHO en allerlei landen cijfers over de uitbraak van het coronavirus. Maar welke <extra_id_0> hoe moeten we ernaar kijken?",['cijfers zijn belangrijk? En'],4,6
"The odd couple, komedie van Neil Simon, vertaald door Peter Lusse en in regie van Bruun Kuijt. Twee mannen die bij hun vrouw weg zijn","The odd couple, komedie van <extra_id_0> Peter Lusse en in regie van Bruun Kuijt. Twee mannen die bij hun vrouw weg zijn","['Neil Simon, vertaald door']",4,6
muzikale theatershow over het leven van Ramses Shaffy van Dick van den Heuvel (script) en Peter de Baan (regie) met in de hoofdrollen,muzikale theatershow over <extra_id_0> Ramses Shaffy van Dick van den Heuvel (script) en Peter de Baan (regie) met in de hoofdrollen,['het leven van'],3,6
"Of je nu thuisblijft of zin hebt om eropuit te gaan, wij selecteren de beste tips voor het weekend van",Of je nu thuisblijft of zin hebt om eropuit te <extra_id_0> de beste tips voor het weekend van,"['gaan, wij selecteren']",3,6
"Amsterdam, Museum het Rembrandthuis (Jodenbreestraat 4): Jacob Backer (1608/9-1651). Rembrandts tegenpool,","Amsterdam, Museum het Rembrandthuis (Jodenbreestraat 4): Jacob Backer <extra_id_0> tegenpool,",['(1608/9-1651). Rembrandts'],2,6
"e Woestyne (1881-1947) en Valerius de Saedeleer (1867-1941), t/m 1 februari; dagelijks 10-17u. Tel. 0226-351111.",e Woestyne (1881-1947) en Valerius de <extra_id_0> t/m 1 februari; dagelijks 10-17u. Tel. 0226-351111.,"['Saedeleer (1867-1941),']",2,6
"; voorts The IKOB Collection, ruimtelijke werken, video, fotos, schilderijen en tekeningen van Guillaume Bijl, The Cracking Art Group, Wolfgang Nestler","; voorts The IKOB Collection, ruimtelijke werken, video, fotos, schilderijen en tekeningen van <extra_id_0> Cracking Art Group, Wolfgang Nestler","['Guillaume Bijl, The']",3,6
"video-installaties, fotos en sculpturen van 19 kunstenaars o.a. Gert Jan Kocken, Luc Delahaye en Thomas Demand","video-installaties, fotos en <extra_id_0> 19 kunstenaars o.a. Gert Jan Kocken, Luc Delahaye en Thomas Demand",['sculpturen van'],2,6
"Nu de gemeenten meer te zeggen krijgen, worden ook de verschillen groter. Een korte serie. Aflevering","Nu de gemeenten meer <extra_id_0> krijgen, worden ook de verschillen groter. Een korte serie. Aflevering",['te zeggen'],2,6
naar de gelijknamige roman van David Garnett over de kunst van het liefhebben en het liefhebben van de kunst.,naar de gelijknamige roman van David <extra_id_0> kunst van het liefhebben en het liefhebben van de kunst.,['Garnett over de'],3,6
"Ingmar Bergman over de zin van theater en kunst in ons leven en in onze samenleving. Met Gijs Scholten van Aschat, Karina Smulders","Ingmar Bergman over de zin van theater en kunst in ons leven en in onze <extra_id_0> Scholten van Aschat, Karina Smulders",['samenleving. Met Gijs'],3,6
Hoe overtuig je? Communicatie-expert Lars Duursma van internationaal trainingsbureau Debatrix geeft iedere week een tip. Overtuigtip 1,Hoe overtuig je? Communicatie-expert Lars Duursma van internationaal trainingsbureau Debatrix geeft iedere week een <extra_id_0>,['tip. Overtuigtip 1'],3,6
Conceptmaker Scato van Opstall bespreekt om de week geslaagde en minder geslaagde communicatiepogingen van merken en instanties.,Conceptmaker Scato van Opstall bespreekt om de week geslaagde en <extra_id_0> van merken en instanties.,['minder geslaagde communicatiepogingen'],3,6
agelijks moet n minister uit het demissionaire kabinet-Rutte plaatsmaken voor een nieuwkomer (of zichzelf opvolgen). De politiek redacteuren van Volkskrant.nl werpen zich op als jury en zullen uit uw inzendingen de best onderbouwde keuze selecteren.,agelijks moet n minister uit het demissionaire kabinet-Rutte plaatsmaken voor <extra_id_0> opvolgen). De politiek redacteuren van Volkskrant.nl werpen zich op als jury en zullen uit uw inzendingen de best onderbouwde keuze selecteren.,['een nieuwkomer (of zichzelf'],5,6
",installaties, videoprojecties, sculpturen, schilderijen en tekeningen uit18 jaar Binnale in Istanbul, t/m 29 januari",",installaties, videoprojecties, sculpturen, schilderijen en tekeningen uit18 jaar Binnale in <extra_id_0> 29 januari","['Istanbul, t/m']",2,6
Het hoofd van de Turkse kiesraad heeft het ja-kamp zondagavond tot winnaar verklaard van het referendum over de grondwetswijziging.,Het <extra_id_0> Turkse kiesraad heeft het ja-kamp zondagavond tot winnaar verklaard van het referendum over de grondwetswijziging.,['hoofd van de'],3,6
r In het nieuwe normaal spreekt Gijs Groenteman zijn gasten over hoe het ze daarin vergaat. Deze keer,r In <extra_id_0> spreekt Gijs Groenteman zijn gasten over hoe het ze daarin vergaat. Deze keer,['het nieuwe normaal'],3,6
"Umoja, de Zuid-Afrikaanse musicalshow waarin 45 dansers, zangers en muzikanten een overzicht geven van de muziekgeschiedenis in Zuid-Afrika","Umoja, de Zuid-Afrikaanse musicalshow waarin 45 dansers, zangers <extra_id_0> overzicht geven van de muziekgeschiedenis in Zuid-Afrika",['en muzikanten een'],3,6
". Turks Fruit, met Antonie Kamerling en Jelka van Houten als liefdespaar, op muziek van Tekstra en Merkies.",". Turks Fruit, <extra_id_0> en Jelka van Houten als liefdespaar, op muziek van Tekstra en Merkies.",['met Antonie Kamerling'],3,6
"es. De verhalen en hun illustraties zitten boordevol aanwijzingen die u leiden naar een plaats in Nederland, waar een schat is verstopt","es. De verhalen en hun illustraties zitten boordevol aanwijzingen die u leiden <extra_id_0> in Nederland, waar een schat is verstopt",['naar een plaats'],3,6
"Omdat ook de naoorlogse Nederlandse popcultuur een geschiedschrijving verdient: 100 voorwerpen uitgekozen, belicht en verklaard. Een lijst die lekker langzaam groeit. Aflevering","Omdat ook de naoorlogse Nederlandse popcultuur een geschiedschrijving <extra_id_0> uitgekozen, belicht en verklaard. Een lijst die lekker langzaam groeit. Aflevering",['verdient: 100 voorwerpen'],3,6
Volkskrantfotograaf Klaas Jan van der Weij (64) doet dit jaar voor de 23ste keer verslag van de Tour de France. Hoe gaat hij daar te werk? Hij legt het uit,Volkskrantfotograaf Klaas Jan van der Weij (64) doet dit jaar voor de 23ste keer verslag van de Tour de France. Hoe gaat hij daar <extra_id_0> het uit,['te werk? Hij legt'],4,6
".nl Eindhoven, Van Abbemuseum (040-2381000): ...and Europe will be stunned, videotrilogie van Yael Bartana","<extra_id_0> Van Abbemuseum (040-2381000): ...and Europe will be stunned, videotrilogie van Yael Bartana","['.nl Eindhoven,']",2,6
".nl Nijmegen, Het Valkhof (024-36088059): Waarom godinnen zo mooi zijn, liefde en schoonheid in de oude culturen","<extra_id_0> Valkhof (024-36088059): Waarom godinnen zo mooi zijn, liefde en schoonheid in de oude culturen","['.nl Nijmegen, Het']",3,6
".nl Rotterdam, Kunsthal (010-4400301): Kan en Abel, Sam Peeters (stripcollectief Lamelos) tekent het",".nl Rotterdam, Kunsthal (010-4400301): Kan en <extra_id_0> Peeters (stripcollectief Lamelos) tekent het","['Abel, Sam']",2,6
"New York Times Magazine Photographs, weerspiegelt en onderzoekt de aard van zowel de fotografie als het gedrukte tijdschrift, t/m 30/5","New York Times Magazine Photographs, weerspiegelt en onderzoekt de aard <extra_id_0> fotografie als het gedrukte tijdschrift, t/m 30/5",['van zowel de'],3,6
met de aanhouding van zeven mannen mogelijk een grote terroristische aanslag in Nederland voorkomen. Volgens het O,met de aanhouding van zeven mannen mogelijk een grote terroristische aanslag in Nederland voorkomen. <extra_id_0>,['Volgens het O'],3,6
"Het lijkt wel of iedereen elkaar de tent uit vecht, vooral op sociale media. Maar wat gebeurt er als je tegenpolen en andersdenkenden bij elkaar zet? Dat onderzoeken we deze zomer. Vandaag:","Het <extra_id_0> elkaar de tent uit vecht, vooral op sociale media. Maar wat gebeurt er als je tegenpolen en andersdenkenden bij elkaar zet? Dat onderzoeken we deze zomer. Vandaag:",['lijkt wel of iedereen'],5,6
t is pas genieten We genieten wat af met z'n allen. Jan Dirk van der Burg reist door Nederland en legt het allemaal vast.,<extra_id_0> We genieten wat af met z'n allen. Jan Dirk van der Burg reist door Nederland en legt het allemaal vast.,['t is pas genieten'],4,6
"gevaccineerd tegen difterie, tetanus, polio (DTP), bof, mazelen en rodehond (BMR) tijdens een vaccinatiedag in","gevaccineerd tegen difterie, tetanus, polio (DTP), bof, mazelen en rodehond <extra_id_0> een vaccinatiedag in",['(BMR) tijdens'],2,6
"schilderkunst, kunstnijverheid en beeldhouwkunst uit het Rijksmuseum en Dordrechts Museum, tot medio 2006","schilderkunst, kunstnijverheid en beeldhouwkunst uit <extra_id_0> en Dordrechts Museum, tot medio 2006",['het Rijksmuseum'],2,6
"; di t/m zo 11-17u. Tel. 053-4358675 (www.rijksmuseum-twenthe.nl). Groningen, Groninger Museum (Museumeiland):","; di <extra_id_0> 11-17u. Tel. 053-4358675 (www.rijksmuseum-twenthe.nl). Groningen, Groninger Museum (Museumeiland):",['t/m zo'],2,6
".nl Schiedam, Stedelijk Museum (010-2463666): Collectie Piet en Ida Sanders. Een leven met kunst, honderd werken uit de priv",".nl Schiedam, Stedelijk Museum (010-2463666): <extra_id_0> Ida Sanders. Een leven met kunst, honderd werken uit de priv",['Collectie Piet en'],3,6
. De pianist naar het boek van W. Szpilman over de Pools-Joodse pianist die het getto van Warschau weet te overleven.,. <extra_id_0> het boek van W. Szpilman over de Pools-Joodse pianist die het getto van Warschau weet te overleven.,['De pianist naar'],3,6
"). As You Like It, Shakespeares komedie over de liefde door het Nationale Toneel, in regie van Gerardjan Rijnders. Met","). As You Like It, Shakespeares komedie <extra_id_0> door het Nationale Toneel, in regie van Gerardjan Rijnders. Met",['over de liefde'],3,6
Ministers Wopke Hoekstra van Financin en Cora van Nieuwenhuizen van Infrastructuur en Waterstaat,Ministers Wopke Hoekstra van Financin en Cora van <extra_id_0> Infrastructuur en Waterstaat,['Nieuwenhuizen van'],2,6
Wat maak je mee in de Nederlandse asielopvang? Door de ogen van de Palestijns-Syrische Mohannad (39) en zijn gezin volgen we het dagelijks leven in de,Wat maak je mee in de Nederlandse asielopvang? Door de ogen van de Palestijns-Syrische Mohannad (39) en zijn gezin volgen <extra_id_0> in de,['we het dagelijks leven'],4,6
"Pieter Gerrit Kroeger, CDA-historicus, CDA-lid en hoofdredacteur van ScienceGuide.nl. Schreef onder meer","Pieter Gerrit Kroeger, <extra_id_0> en hoofdredacteur van ScienceGuide.nl. Schreef onder meer","['CDA-historicus, CDA-lid']",2,6
". Toen de CDA-fractie in Provinciale Staten van Limburg het vertrouwen opzegde in coalitiepartner PVV, zei Kroeger in de uitzending van Pauw en Witteman van 20 april dat nu ook het gedoogkabinet zou vallen",". Toen de CDA-fractie in Provinciale Staten van Limburg het vertrouwen opzegde in coalitiepartner PVV, zei Kroeger in de uitzending van Pauw en Witteman <extra_id_0> nu ook het gedoogkabinet zou vallen",['van 20 april dat'],5,6
"Ibrahim Wijbenga is raadslid voor het CDA in Eindhoven. Hij was een van de initiatiefnemers tot het Meldpunt Overlast PVV (MOP), gelanceerd als antwoord op de PVV-'kliklijn' voor overlast van Midden- en Oost-Europeanen:","Ibrahim Wijbenga is raadslid voor het CDA in Eindhoven. Hij was een van de initiatiefnemers tot het Meldpunt Overlast PVV (MOP), gelanceerd als antwoord op de PVV-'kliklijn' voor overlast van <extra_id_0>",['Midden- en Oost-Europeanen:'],5,6
m En weer is een verrader van Anne Frank ontmaskerd: was het dan toch Ans van ... Is zij de verrader van Anne Frank?,m En weer is een verrader van Anne Frank <extra_id_0> toch Ans van ... Is zij de verrader van Anne Frank?,['ontmaskerd: was het dan'],4,6
"mma rondom Robert de Niro heeft samengesteld. Raging Bull gaat over de opkomst en ondergang van bokser Jake LaMotta, fabuleus neergezet door De Niro, die er een Oscar mee won. (","mma rondom Robert de Niro heeft samengesteld. Raging Bull gaat over de opkomst en ondergang van bokser <extra_id_0> door De Niro, die er een Oscar mee won. (","['Jake LaMotta, fabuleus neergezet']",5,6
"Er zijn mensen die willen dat we hem op Schiphol direct in de boeien slaan, maar we hebben het hier over een minister van een N","Er zijn mensen die willen <extra_id_0> Schiphol direct in de boeien slaan, maar we hebben het hier over een minister van een N",['dat we hem op'],4,6
interviewt voor V Nederlanders over de rol die afkomst speelt in hun leven. Hij spreekt onder anderen nog met,interviewt voor V Nederlanders over de rol die afkomst speelt in hun leven. Hij <extra_id_0> nog met,['spreekt onder anderen'],3,6
januari; wo vr 10.30-17u di do 10.30-20.30u za 10-15u zo 13-17u. Tel. 043-3505626 (www.centreceramique.nl).,januari; wo <extra_id_0> di do 10.30-20.30u za 10-15u zo 13-17u. Tel. 043-3505626 (www.centreceramique.nl).,['vr 10.30-17u'],2,6
"; Absolute Truth, commentaar op communicatiemiddelen door Remy Jungerman in Buro Leeuwarden, t/m 4 januari;","; Absolute Truth, commentaar op communicatiemiddelen <extra_id_0> Jungerman in Buro Leeuwarden, t/m 4 januari;",['door Remy'],2,6
"s Experiments, aquarel en print van Joseph Mallord William Turner (17751851), t/m 30 april 2012. Tel. 00.44.20.78878000","s Experiments, aquarel en print van Joseph <extra_id_0> (17751851), t/m 30 april 2012. Tel. 00.44.20.78878000",['Mallord William Turner'],3,6
"Wie elk jaar van energieleverancier verandert, profiteert steeds opnieuw van de mooiste aanbiedingen. En wie dat niet doet, betaalt feitelijk dus te veel","Wie elk jaar van energieleverancier verandert, profiteert steeds opnieuw van de mooiste aanbiedingen. En wie dat niet doet, betaalt <extra_id_0> veel",['feitelijk dus te'],3,6
het debat in de Tweede Kamer over het optreden van de Belastingdienst in de affaire rond kinderopvangtoeslagen. Beeld,het debat in de Tweede Kamer over het optreden van de <extra_id_0> affaire rond kinderopvangtoeslagen. Beeld,['Belastingdienst in de'],3,6
"Terwijl in Amerika het getouwtrek om het klimaatakkoord zijn ontknoping nadert, besluiten Europa en China tot hechtere samenwerking.","Terwijl in Amerika het getouwtrek om het klimaatakkoord zijn ontknoping nadert, besluiten Europa en <extra_id_0> samenwerking.",['China tot hechtere'],3,6
is in 2016 een basis gelegd voor een klimaatneutrale wereldeconomie (+). Daar verandert geen Trump iets aan.,is in 2016 een basis <extra_id_0> klimaatneutrale wereldeconomie (+). Daar verandert geen Trump iets aan.,['gelegd voor een'],3,6
"treurige, oude filmjournalist die heimelijk verliefd is op het Lolita-achtige kassameisje van de vervallen bioscoop tegenover zijn Amsterdamse bovenwoning.","treurige, oude filmjournalist die heimelijk verliefd is op het Lolita-achtige kassameisje van de vervallen bioscoop tegenover <extra_id_0>",['zijn Amsterdamse bovenwoning.'],3,6
"euro via treesforall.nl of fairclimatefund.nl. Meer informatie op klimaatwijsopvakantie.nl, milieucentraal.nl/vakantievervoer","euro via treesforall.nl <extra_id_0> Meer informatie op klimaatwijsopvakantie.nl, milieucentraal.nl/vakantievervoer",['of fairclimatefund.nl.'],2,6
"l Coward door Joop van den Ende Theaterproducties. Een schrijver, zijn vrouw en een ex-geliefde op zoek naar wie ze werkelijk zijn.","l Coward door Joop van den Ende Theaterproducties. Een schrijver, zijn vrouw en een <extra_id_0> naar wie ze werkelijk zijn.",['ex-geliefde op zoek'],3,6
". Met thema-zaterdagen, gratis koffie, gratis workshops en ontmoetingen met kunstenaars en museummedewerkers. Tel. 020-5732737.",". <extra_id_0> gratis koffie, gratis workshops en ontmoetingen met kunstenaars en museummedewerkers. Tel. 020-5732737.","['Met thema-zaterdagen,']",2,6
"): Rembrandt, een jongensdroom, 17de-eeuwse Hollandse en Vlaamse meesters waaronder Rembrandt, Frans Hals, Adriaan Coorte, Judith Leyster","): Rembrandt, een jongensdroom, 17de-eeuwse Hollandse <extra_id_0> waaronder Rembrandt, Frans Hals, Adriaan Coorte, Judith Leyster",['en Vlaamse meesters'],3,6
"Den Haag, Museum voor Communicatie (Zeestraat 82): Ding dong, overzicht van zestig jaar kinderpostzegels, met werk van kunstenaars, fotografen en illustratoren onder wie Cas Oorthuys, Dick Bruna en Fiep Westendorp, naast het ontwerpproces en de besteding van de opbrengsten","Den Haag, Museum <extra_id_0> 82): Ding dong, overzicht van zestig jaar kinderpostzegels, met werk van kunstenaars, fotografen en illustratoren onder <extra_id_1> Dick Bruna en Fiep Westendorp, naast het ontwerpproces en de besteding van de opbrengsten","['voor Communicatie (Zeestraat', 'wie Cas Oorthuys,']",6,6
Waarom was het zo eenvoudig voor hackers om in te breken in de computers van de Britse gezondheidszorg? Dat is de vraag die de Britse regering en de top van de Nationale Gezondheidszorg moeten beantwoorden.,Waarom was het zo eenvoudig voor hackers om in te breken in de computers van de Britse gezondheidszorg? <extra_id_0> die de Britse regering en de top van de Nationale Gezondheidszorg moeten beantwoorden.,['Dat is de vraag'],5,6
". In het Museum voor Moderne Kunst een overzicht van de magisch-realistische schilder Carel Willink, waarop ook zijn minder bekend werk uit de jaren twintig te zien is",". In het Museum voor Moderne Kunst een overzicht van de magisch-realistische schilder Carel Willink, waarop ook zijn minder bekend werk uit de jaren twintig <extra_id_0>",['te zien is'],4,6
". Anatevka, of Fiddler on the roof, met Henk Poort als de Russisch-joodse melkboer Tevje, die op zoek moet naar geschikte kandidaten voor zijn drie huwbare dochters, en bedreigd wordt door de pogroms. Ook met Doris Baaten, Bea Meulman en Harry Slinger.",". Anatevka, of Fiddler on the roof, met Henk Poort als de Russisch-joodse melkboer Tevje, die op zoek moet naar geschikte kandidaten voor zijn drie huwbare dochters, en bedreigd wordt door <extra_id_0> met Doris Baaten, <extra_id_1> Harry Slinger.","['de pogroms. Ook', 'Bea Meulman en']",6,6
. Man van La Mancha door OpusOne met Peter Faber als Don Quichot en Marjolein Teepen als zijn droomvrouw Dulcinea. Van,. <extra_id_0> Mancha door OpusOne met Peter Faber als Don Quichot en Marjolein Teepen als zijn droomvrouw Dulcinea. Van,['Man van La'],3,6
The Last King of Scotland (Kevin Macdonald). Boekverfilming waarin de kijker Idi Amin leert kennen door de ogen van een opportunistische Schotse arts. Forest Whitaker is fenomenaal als,The Last King of Scotland (Kevin Macdonald). Boekverfilming waarin de kijker Idi Amin leert kennen door de ogen van <extra_id_0> Forest Whitaker is fenomenaal als,['een opportunistische Schotse arts.'],4,6
"di t/m vr 10-17u za zo 12-17u. Tel. 024-3608805 (www.museumhetvalkhof.nl). Oss, Museum Jan Cunen (Molenstraat","di t/m vr 10-17u <extra_id_0> 12-17u. Tel. 024-3608805 (www.museumhetvalkhof.nl). Oss, Museum Jan Cunen (Molenstraat",['za zo'],2,6
"i; di t/m zo 10-17u. Tel. 0318-591241 (www.kmm.nl). Rotterdam, Boijmans Van Beuningen (Museumpark 18-20):",i; di t/m zo 10-17u. Tel. 0318-591241 (www.kmm.nl). <extra_id_0> Van Beuningen (Museumpark 18-20):,"['Rotterdam, Boijmans']",2,6
"di t/m vr 10-17u; za zo 11-17u. Tel. 026-3512341 (www.mmkarnhem.nl). Den Bosch, Noordbrabants Museum (Verwersstraat 41):","di t/m vr 10-17u; za zo 11-17u. Tel. 026-3512341 <extra_id_0> Bosch, Noordbrabants Museum (Verwersstraat 41):",['(www.mmkarnhem.nl). Den'],2,6
"; di t/m zo 11-17u. Tel. 070-3585857 (www.beeldenaanzee.nl). Schiedam, Stedelijk Museum (Hoogstraat 112):","; <extra_id_0> zo 11-17u. Tel. 070-3585857 (www.beeldenaanzee.nl). Schiedam, Stedelijk Museum (Hoogstraat 112):",['di t/m'],2,6
; wo t/m za 12-17u do 12-21u en eerste zo v/d maand 12-17u. Tel. 078-6314689. (www.cbkdordrecht.nl).,; wo t/m za 12-17u do 12-21u en <extra_id_0> v/d maand 12-17u. Tel. 078-6314689. (www.cbkdordrecht.nl).,['eerste zo'],2,6
"'Als president wilde ik deze informatie delen met Rusland, waar ik het volste recht toe had', verdedigde de president zich","'Als president wilde ik deze informatie <extra_id_0> waar ik het volste recht toe had', verdedigde de president zich","['delen met Rusland,']",3,6
"Amsterdam, Eye Filmmuseum: Stanley Kubrick: The Exhibition, over de invloedrijke regisseur Stanley Kubrick (1928-1999), maker van Lolita, 2001","Amsterdam, Eye Filmmuseum: Stanley Kubrick: The Exhibition, over de invloedrijke <extra_id_0> (1928-1999), maker van Lolita, 2001",['regisseur Stanley Kubrick'],3,6
"Making City, scenario's voor een andere manier van organiseren van leven in de stad, t/m 12/8; Smart Cities - Parallel Cases 2, 23 ontwerp- en onderzoeksprojecten van studenten tonen hun visie op het maken van de stad, t/m 12/8","Making City, scenario's voor een andere manier van organiseren van leven in de stad, t/m <extra_id_0> - Parallel Cases 2, 23 ontwerp- en onderzoeksprojecten van studenten tonen hun visie op het maken <extra_id_1> t/m 12/8","['12/8; Smart Cities', 'van de stad,']",6,6
"Utrecht, tuin Fort Hoofddijk in Uithof: Airpressure, grote opgeblazen sculpturen van Paul McCarthy,","Utrecht, tuin Fort Hoofddijk in <extra_id_0> grote opgeblazen sculpturen van Paul McCarthy,","['Uithof: Airpressure,']",2,6
Gedurende de Ronde van Itali schrijft Volkskok Onno Kleyn elke etappedag over het eten uit de streek waar het peloton zich ophoudt. Met een recept uiteraard. Vandaag,Gedurende <extra_id_0> schrijft Volkskok Onno Kleyn elke etappedag over het eten uit de streek waar het peloton zich ophoudt. Met een recept uiteraard. Vandaag,['de Ronde van Itali'],4,6
"). Kale bomen ruisen niet, naar een tekst van Magne van den Berg, in regie van Jetse Batelaan. Twee vrouwen (Jos Kuijpers en Ria Marks) proberen elkaar heel te houden met de juiste woorden. Vanavond","). Kale bomen <extra_id_0> tekst van Magne van den Berg, in regie van Jetse Batelaan. Twee vrouwen (Jos Kuijpers en Ria Marks) proberen elkaar heel te houden met de juiste woorden. Vanavond","['ruisen niet, naar een']",5,6
", dansconcert op muziek van Stravinsky en Bach, van Beppie Blankert en Bianca van Dillen. Uitgevoerd door zes dansers en de musici Gerard Bouwhuis en Cees van Zeeland.",", dansconcert op muziek van Stravinsky en Bach, van Beppie Blankert en Bianca van Dillen. Uitgevoerd <extra_id_0> de musici Gerard Bouwhuis en Cees van Zeeland.",['door zes dansers en'],4,6
"Oost - West: Japan en japonisme, Japanse prenten uit de verzameling van Vincent en Theo van Gogh, t/m 15/1. vangoghmuseum.nl","Oost <extra_id_0> en japonisme, Japanse prenten uit de verzameling van Vincent en Theo van Gogh, t/m 15/1. vangoghmuseum.nl",['- West: Japan'],3,6
f over een varit-artiest die wordt ontdekt door het serieuze toneel. Een productie van het Onafhankelijk Toneel in regie van Mirjam Koen.,f over een varit-artiest die <extra_id_0> het serieuze toneel. Een productie van het Onafhankelijk Toneel in regie van Mirjam Koen.,['wordt ontdekt door'],3,6
Lee snijdt heen en weer tussen de superieur gecontroleerde actie in de bank en het zenuwachtige gedoe op straat,Lee snijdt heen en weer tussen de superieur gecontroleerde actie in de bank en <extra_id_0> op straat,['het zenuwachtige gedoe'],3,6
"de vierhoeksverhouding tussen drie jeugdvrienden en de zus van een van hen. Als de drie vrienden een Isralische soldaat doodschieten, wordt alleen Omar opgepakt. De keuze die hij vervolgens krijgt, is even simpel als onmogelijk: zijn vrienden verraden of onheil afroepen o","de vierhoeksverhouding tussen drie jeugdvrienden en de zus van een van hen. Als de drie vrienden een Isralische soldaat doodschieten, wordt alleen <extra_id_0> keuze die hij vervolgens krijgt, is even simpel als onmogelijk: <extra_id_1> of onheil afroepen o","['Omar opgepakt. De', 'zijn vrienden verraden']",6,6
"heatergroep Max. gaat over grote dromen, zoals Peter Pan die had, bijvoorbeeld om te kunnen vliegen. Tekst en regie: Moniek Merkx.","heatergroep Max. gaat over grote dromen, zoals Peter Pan die had, bijvoorbeeld om te kunnen vliegen. Tekst <extra_id_0> Merkx.",['en regie: Moniek'],3,6
DI-RECT doet Tommy is een door Jos Thie geregisseerd concert over het doofstomme en blinde joch Tommy. De vertaling is van Jan Rot. V,DI-RECT doet Tommy is een door Jos Thie geregisseerd concert over het doofstomme en blinde joch Tommy. De <extra_id_0> Rot. V,['vertaling is van Jan'],4,6
