". Cabaret door De Graaf & Cornelissen Producties is een reizende musical met Sven Ratzke als master of ceremony en Ellen Evers als Sally Bowles, de nachtclubzangeres. Regie: Paul van Ewijk. V",". Cabaret door De Graaf <extra_id_0> een reizende musical met Sven Ratzke als master of ceremony en Ellen Evers als Sally Bowles, de nachtclubzangeres. Regie: Paul van Ewijk. V",['& Cornelissen Producties is'],5,6
"). Hera, musical van Flip Broekman, Jan Boerstoel en Martin van Dijk over de perikelen in een rencarnatiekliniek. Als Zeus er vandoor gaat met een aardse vrouw, laat zijn goddelijke echtgenote Hera t er niet bij zitten.","). Hera, musical van Flip Broekman, Jan Boerstoel en Martin van Dijk over de perikelen in een <extra_id_0> er vandoor gaat met een aardse vrouw, laat zijn goddelijke echtgenote <extra_id_1> niet bij zitten.","['rencarnatiekliniek. Als Zeus', 'Hera t er']",6,6
"Volkskrant.nl zet elke zondag de leukste, handigste en meest informatieve apps voor u op een rijtje. Deze week: een","Volkskrant.nl <extra_id_0> de leukste, handigste en meest informatieve apps voor u op een rijtje. Deze week: een",['zet elke zondag'],3,6
"Meesterwerken uit het Shanghai Museum, objecten uit de Chinese bronstijd van de 18de eeuw v.Chr. tot begin van onze jaartelling, t/m 28 september;","Meesterwerken uit het Shanghai Museum, objecten uit de <extra_id_0> de 18de eeuw v.Chr. tot begin van onze jaartelling, t/m 28 september;",['Chinese bronstijd van'],3,6
"Tily Buij en Gerard Groenewoud, t/m 31 december; di t/m zo 11-17u. Tel. 058-2555500 (www.friesmuseum.nl).","Tily Buij en Gerard Groenewoud, t/m 31 <extra_id_0> t/m zo 11-17u. Tel. 058-2555500 (www.friesmuseum.nl).",['december; di'],2,6
"; dagelijks 11-17u. Tel. 020-5732911 (www.stedelijk.nl). Arnhem, Museum voor Moderne Kunst (Utrechtseweg 87):","; dagelijks 11-17u. Tel. <extra_id_0> Arnhem, Museum voor Moderne Kunst (Utrechtseweg 87):",['020-5732911 (www.stedelijk.nl).'],2,6
"ontmoet een vrouw haar favoriete schrijver in een treincoup. Er ontstaat een ongemakkelijke situatie, waar beiden geen raad mee weten.",ontmoet een vrouw haar favoriete schrijver in een treincoup. Er ontstaat <extra_id_0> waar beiden geen raad mee weten.,"['een ongemakkelijke situatie,']",3,6
"het Nederlands Kamerkoor o.l.v. Eric Ericson met Olsson, Jolivet, Jennefelt, Ravel en Daniel-Lesur.","het Nederlands Kamerkoor o.l.v. <extra_id_0> met Olsson, Jolivet, Jennefelt, Ravel en Daniel-Lesur.",['Eric Ericson'],2,6
"Peter Pluymaekers regisseerde Trainspotting, Irvine Welsh' hartekreet over de jeugd zonder toekomst in de ranzige buurten van de grote stad, bewerkt door Harry Gibson. Met Danil Boissevain, Roef Ragas, Tjitske Reidinga en Ad Knippels. V","Peter Pluymaekers regisseerde Trainspotting, Irvine Welsh' hartekreet over de jeugd zonder toekomst in de ranzige buurten van de grote stad, bewerkt door Harry Gibson. Met Danil Boissevain, Roef <extra_id_0> Ad Knippels. V","['Ragas, Tjitske Reidinga en']",5,6
"Commissaris van de koning Jacques Tichelaar is een geprezen voorvechter van de Drentse zaak. Een bestuurder die tot het randje gaat. En, zo blijkt uit onderzoek van Dagblad van het Noorden en de Volkskrant: daaroverheen.","Commissaris van de koning Jacques Tichelaar <extra_id_0> van de Drentse zaak. Een bestuurder die tot het randje gaat. En, zo blijkt uit onderzoek van Dagblad van het Noorden en de Volkskrant: daaroverheen.",['is een geprezen voorvechter'],5,6
". Alles is goed, mimevoorstelling van Gienke Deuten over de evolutie: is de mens beland in de dementerende eindfase van zijn bestaan? Door Maureen Teeuwen, Willem de Wolf, Mijke Werkema e.a.",". Alles is goed, mimevoorstelling van Gienke Deuten over <extra_id_0> mens beland in de dementerende eindfase van zijn bestaan? Door Maureen Teeuwen, Willem de Wolf, Mijke Werkema e.a.",['de evolutie: is de'],5,6
". The Wall van beeldend theatermaakster en poppenspeelster Ulrike Quade gaat over historische figuren met een sterk geloof in hun missie: Meinhof, Gring en Medea.",". The Wall van <extra_id_0> Ulrike Quade gaat over historische figuren met een sterk geloof in hun missie: Meinhof, Gring en Medea.",['beeldend theatermaakster en poppenspeelster'],4,6
". De Dikke Van Dale, portret van een Zeeuwse, kinderrijke dorpsonderwijzer die de grondslag legde voor het beroemde woordenboek. Een reprise van Zeelandia. Vanavond",". De Dikke Van Dale, portret van een Zeeuwse, kinderrijke dorpsonderwijzer die de grondslag legde <extra_id_0> Een reprise van Zeelandia. Vanavond",['voor het beroemde woordenboek.'],4,6
"). Zum Wohl door Suver Nuver speelt in Oostenrijk, het land van Freud, Fritzl, Hitler en Sissi. Afscheidsvoorstelling.","<extra_id_0> door Suver Nuver speelt in Oostenrijk, het land van Freud, Fritzl, Hitler en Sissi. Afscheidsvoorstelling.",['). Zum Wohl'],3,6
". Said and Done is een choreografie van Lightfoot Len, en een voorstelling van Nederlands Dans Theater II, die uit nog twee premires bestaat: Gods and Dogs van Kylin en Nichts van Goecke.",". Said and Done is een choreografie van Lightfoot Len, en een voorstelling van Nederlands Dans Theater II, die uit <extra_id_0> Gods and Dogs van Kylin en Nichts van Goecke.",['nog twee premires bestaat:'],5,6
". Giubileo, jubileumvoorstelling van Dansgroep Krisztina de Chtel met choreografien van De Chtel, Stephen Shropshire en Michel",". Giubileo, jubileumvoorstelling van Dansgroep Krisztina de Chtel met choreografien van De Chtel, Stephen <extra_id_0>",['Shropshire en Michel'],3,6
"). Ben Hur, jubileumvoorstelling van De Ploeg, met gastacteurs Beppie Melissen, Erik van Muiswinkel en Sophie van Winden. Het beroemde verhaal van vriendschap, verraad, liefde in Jeruzalem, rond het begin van de jaartelling. V","). Ben Hur, jubileumvoorstelling van De Ploeg, met gastacteurs Beppie Melissen, Erik van Muiswinkel <extra_id_0> Het beroemde verhaal van vriendschap, verraad, liefde in Jeruzalem, rond het begin van de jaartelling. V",['en Sophie van Winden.'],5,6
"Impressionisme: sensatie & inspiratie, schilderijen van impressionistische kunstenaars onder wie Monet, Renoir, Sisley, Pissarro, Delacroix,","Impressionisme: sensatie <extra_id_0> schilderijen van impressionistische kunstenaars onder wie Monet, Renoir, Sisley, Pissarro, Delacroix,","['& inspiratie,']",2,6
"De Ploeg - Eigen Collectie, selectie werk van De Ploeg-leden, t/m 3/3. groningermuseum.nl Haarlem,","De Ploeg - Eigen Collectie, selectie werk van De <extra_id_0> 3/3. groningermuseum.nl Haarlem,","['Ploeg-leden, t/m']",2,6
"The Lost Bishop, houtskooltekeningen op groot formaat van Rinus Van de Velde, t/m 2/9; Unisono 25: Aukje Koks. Preludes, schilderwerken van Aukje Koks, t/m 2/9","The Lost Bishop, houtskooltekeningen op groot formaat van Rinus <extra_id_0> 2/9; Unisono 25: Aukje Koks. Preludes, schilderwerken van Aukje Koks, t/m 2/9","['Van de Velde, t/m']",4,6
"Arnhem, Museum voor Moderne Kunst (026-3512341): Provisional space, schilderkunst van Kees Goudzwaard","Arnhem, Museum voor Moderne Kunst (026-3512341): Provisional space, <extra_id_0> Kees Goudzwaard",['schilderkunst van'],2,6
", t/m 16/1; overzicht met ruim 130 schilderijen en werken op papier van Edvard Munch (1863-1944), t/m 20/2. kunsthal.nl",", t/m 16/1; overzicht met ruim <extra_id_0> werken op papier van Edvard Munch (1863-1944), t/m 20/2. kunsthal.nl",['130 schilderijen en'],3,6
"een militaire basis van het Syrische leger aangevallen, als reactie op de gifgasaanval dinsdag in Khan Sheikhoun, waarbij tientallen mensen om het leven kwamen.","een militaire basis van het <extra_id_0> reactie op de gifgasaanval dinsdag in Khan Sheikhoun, waarbij tientallen mensen om het leven kwamen.","['Syrische leger aangevallen, als']",4,6
" Klopt dit wel? Berichten verspreiden zich vaak razendsnel, of ze nu kloppen of niet. Wij proberen de zin van de onzin te scheiden. Vandaag:",Klopt dit wel? Berichten verspreiden zich <extra_id_0> nu kloppen of niet. Wij proberen de zin van de onzin te scheiden. Vandaag:,"['vaak razendsnel, of ze']",4,6
"Wat kwam er de laatste dagen weer voor moois bij in het cultuuraanbod? De V-specialisten kiezen hun favorieten, van een","Wat kwam er de laatste dagen weer voor moois bij <extra_id_0> De V-specialisten kiezen hun favorieten, van een",['in het cultuuraanbod?'],3,6
De Flexibele Opiniemaker verdedigt wekelijks een opinie waar op dat moment behoefte aan is. Ditmaal:,De Flexibele <extra_id_0> wekelijks een opinie waar op dat moment behoefte aan is. Ditmaal:,['Opiniemaker verdedigt'],2,6
"porin getrainde geheim agent die, net als Bourne, door zijn organisatie buitenspel moet worden gezet.","porin getrainde geheim agent die, net als Bourne, <extra_id_0> organisatie buitenspel moet worden gezet.",['door zijn'],2,6
"naar Bridget Riley, naast haar vroegste werk, t/m 6/1; Happy Days, Haagse culturele leven in de jaren vijftig, t/m 20/1;","naar Bridget Riley, naast haar <extra_id_0> 6/1; Happy Days, Haagse culturele leven in de jaren vijftig, t/m 20/1;","['vroegste werk, t/m']",3,6
", t/m 1/9; Het ideaal als werkelijkheid, landschappen uit het Mauritshuis en Rijksmuseum Twenthe, t/m 1/9 2013",", t/m 1/9; Het ideaal als werkelijkheid, landschappen uit <extra_id_0> Rijksmuseum Twenthe, t/m 1/9 2013",['het Mauritshuis en'],3,6
. Robert Vuijsje interviewt voor de Volkskrant Nederlanders over de rol die afkomst speelt in hun leven. Hij spreekt onder anderen nog met,. Robert Vuijsje interviewt voor de Volkskrant Nederlanders over de rol die <extra_id_0> hun leven. Hij spreekt onder anderen nog met,['afkomst speelt in'],3,6
e Maakbare Wereld bouwen vier handige knutselaars elke week een apparaat dat het leven veraangenaamt. Met huis-,e Maakbare <extra_id_0> handige knutselaars elke week een apparaat dat het leven veraangenaamt. Met huis-,['Wereld bouwen vier'],3,6
"Staging silence, potische video van Hans Op de Beeck, t/m 17/6; De grote ontdekking, sculpturen van Alexander Calder, t/m 28/5. ****; Pophouse!, kunstwerken van Evelyne Janssen","Staging <extra_id_0> Hans Op de Beeck, t/m 17/6; De grote ontdekking, sculpturen van Alexander Calder, t/m 28/5. ****; Pophouse!, kunstwerken van Evelyne Janssen","['silence, potische video van']",4,6
"Flandres (Bruno Dumont). Een simpele boerenzoon wordt naar een oorlog gestuurd, in een land dat lijkt op Irak of Afghanistan. Flandres is geen protest tegen de oorlog;","Flandres (Bruno Dumont). Een simpele boerenzoon wordt naar een oorlog gestuurd, in een land dat lijkt op Irak of Afghanistan. Flandres is <extra_id_0> oorlog;",['geen protest tegen de'],4,6
n | De Volkskrant Denkfouten in het hedendaags ontwerp gefileerd door innovatie-expert (en cabaretier) Jasper van Kuijk. Deze week:,n | De Volkskrant Denkfouten in het hedendaags ontwerp gefileerd door innovatie-expert <extra_id_0> van Kuijk. Deze week:,['(en cabaretier) Jasper'],3,6
Wielerverslaggevers Iwan Tol en Pieter Sabel reizen mee in de wielerkaravaan en doen elke dag een voorspelling. Vandaag Pieter Sabel over de,Wielerverslaggevers Iwan Tol <extra_id_0> reizen mee in de wielerkaravaan en doen elke dag een voorspelling. Vandaag Pieter Sabel over de,['en Pieter Sabel'],3,6
"i; di t/m zo 11-17u. Tel. 0592-377773 (www.drentsmuseum.nl). Den Bosch, Stedelijk Museum (Magistratenlaan 100):",i; di t/m zo 11-17u. Tel. 0592-377773 (www.drentsmuseum.nl). Den <extra_id_0> Museum (Magistratenlaan 100):,"['Bosch, Stedelijk']",2,6
CPNB Bestseller 60 Jet Steinz bekijkt wekelijks de CPNB Bestseller 60 en vindt daar iets van. Vandaag:,CPNB Bestseller 60 <extra_id_0> wekelijks de CPNB Bestseller 60 en vindt daar iets van. Vandaag:,['Jet Steinz bekijkt'],3,6
"nemen ze ons mee op hun (geestelijke) omzwervingen door de werkkamer, zoals Xavier de Maistre dat deed in","nemen ze <extra_id_0> hun (geestelijke) omzwervingen door de werkkamer, zoals Xavier de Maistre dat deed in",['ons mee op'],3,6
Van neurochirurg tot kinderarts: in deze serie vertellen artsen en zorgwerkers over die ene patint die hun kijk op het vak ingrijpend veranderde.,Van neurochirurg tot kinderarts: in deze serie vertellen artsen en zorgwerkers over <extra_id_0> die hun kijk op het vak ingrijpend veranderde.,['die ene patint'],3,6
. Aan een rijk gedekte dis speelt Willems zes topindustrilen. Naar teksten van Pier Paolo Pasolini,. Aan een rijk gedekte dis speelt Willems zes topindustrilen. Naar teksten van <extra_id_0> Pasolini,['Pier Paolo'],2,6
". Ubu van Alfred Jarry door Firma Rieks Swarte. 'Graaf u in , zet u schrap en hamster!' Een ruw plaatje uit de wereldgeschiedenis. Regie: Rieks Swarte.",". Ubu van <extra_id_0> Rieks Swarte. 'Graaf u in , zet u schrap en hamster!' Een ruw plaatje uit de wereldgeschiedenis. Regie: Rieks Swarte.",['Alfred Jarry door Firma'],4,6
"; wo t/m za en eerste zo v/d maand 12-17.30u. Tel. 020-3209242 (www.adkactuelekunst.nl). Amsterdam,","; wo t/m <extra_id_0> eerste zo v/d maand 12-17.30u. Tel. 020-3209242 (www.adkactuelekunst.nl). Amsterdam,",['za en'],2,6
"Arnhem, Museum voor Moderne Kunst (026-3512341): In de schaduw van morgen. Neorealisme in Nederland, reprise van expositie uit 1960","Arnhem, Museum voor Moderne Kunst (026-3512341): In de schaduw van morgen. Neorealisme <extra_id_0> van expositie uit 1960","['in Nederland, reprise']",3,6
"stappen op Amsterdam Centraal Station in de koninklijke trein richting Lech, waar zij de komende week hun jaarlijkse skivakantie gaan houden","stappen op Amsterdam Centraal Station <extra_id_0> trein richting Lech, waar zij de komende week hun jaarlijkse skivakantie gaan houden",['in de koninklijke'],3,6
Anna van den Breemer schrijft elke woensdag over een alledaags opvoedkundig probleem waarvoor ze een oplossing zoekt.,Anna van den Breemer schrijft elke woensdag over een alledaags opvoedkundig <extra_id_0> een oplossing zoekt.,['probleem waarvoor ze'],3,6
ReceptWat zullen we eens eten vanavond? Iedere dag in de Volkskrant een verrassend recept. Vandaag:,ReceptWat zullen we eens eten <extra_id_0> dag in de Volkskrant een verrassend recept. Vandaag:,['vanavond? Iedere'],2,6
"Amsterdam, Allard Pierson Museum (020-5252556) en Leiden, Rijksmuseum van Oudheden (071-5163163): Etrusken. Vrouwen van Aanzien - Mannen met Macht,","<extra_id_0> Museum (020-5252556) en Leiden, Rijksmuseum van Oudheden (071-5163163): Etrusken. Vrouwen van Aanzien - Mannen met Macht,","['Amsterdam, Allard Pierson']",3,6
"****; Unisono 24: Lucid Dreaming, installatie met vier filmperformances en portretten uit de periode 2007 tot 2011 van de Amerikaanse Nina Yuen, t/m 26/2","****; Unisono 24: Lucid Dreaming, installatie met vier filmperformances en portretten uit de <extra_id_0> van de Amerikaanse Nina Yuen, t/m 26/2",['periode 2007 tot 2011'],4,6
"Next to normal, musical over een op het erste gezicht doodnormale vrouw, echtgenote en moeder die om probeert te gaan met een ingrijpende gebeurtenis en de impact daarvan op haar gezin. Met o.a. SimoneKleinsma, Freek Bartels","Next to normal, musical over een op het erste <extra_id_0> en moeder die om probeert te gaan met een ingrijpende gebeurtenis en de impact daarvan op haar gezin. Met o.a. SimoneKleinsma, Freek Bartels","['gezicht doodnormale vrouw, echtgenote']",5,6
"gebeurde geschiedenis over de hoofdredacteur van de Franse Elle, die nadat hij is getroffen door een beroerte alleen zijn linkerooglid nog kan bewegen.","gebeurde geschiedenis over de hoofdredacteur van de Franse Elle, die <extra_id_0> getroffen door een beroerte alleen zijn linkerooglid nog kan bewegen.",['nadat hij is'],3,6
"Pay-Uun Hiu, Tallina van den Hoed, Marcus Huibers, Onno Kleyn, Loethe Olthuis, Marie Louise Schipper en Sake Slootweg doen beurtelings suggesties voor de dagelijkse dis. Vandaag:","Pay-Uun Hiu, Tallina van den <extra_id_0> Kleyn, Loethe Olthuis, Marie Louise Schipper en Sake Slootweg doen beurtelings suggesties voor de dagelijkse dis. Vandaag:","['Hoed, Marcus Huibers, Onno']",4,6
". De manier waarop hij zijn macht consolideert en uitbreidt, wordt verbonden aan flashbacks naar de",". De manier waarop hij zijn <extra_id_0> en uitbreidt, wordt verbonden aan flashbacks naar de",['macht consolideert'],2,6
Problemen met bedrijven en overheidsdiensten? Op=op gaat elke zaterdag op zoek naar antwoorden. Vandaag:,Problemen met <extra_id_0> overheidsdiensten? Op=op gaat elke zaterdag op zoek naar antwoorden. Vandaag:,['bedrijven en'],2,6
"Turks-Cypriotische modeontwerper Hussein Chalayan, t/m 4 september; di t/m zo 10-17u. Tel. 0900-8212132 (w","Turks-Cypriotische modeontwerper Hussein Chalayan, t/m 4 september; di <extra_id_0> 10-17u. Tel. 0900-8212132 (w",['t/m zo'],2,6
"voorziet een nieuwe wereld, maar heeft ook een waarschuwing: niet te snel, straks struikelen we over onze eigen voeten","voorziet <extra_id_0> maar heeft ook een waarschuwing: niet te snel, straks struikelen we over onze eigen voeten","['een nieuwe wereld,']",3,6
Olaf Tempelman bericht tot aan de Tweede Kamerverkiezingen van 15 maart vanuit Vught over de stand van het land. Aflevering 1,Olaf Tempelman bericht tot aan de Tweede <extra_id_0> maart vanuit Vught over de stand van het land. Aflevering 1,['Kamerverkiezingen van 15'],3,6
Hoe overtuig je? Communicatie-expert Lars Duursma van internationaal trainingsbureau Debatrix geeft iedere week een tip. Deze week:,Hoe overtuig je? Communicatie-expert Lars Duursma <extra_id_0> Debatrix geeft iedere week een tip. Deze week:,['van internationaal trainingsbureau'],3,6
Zit u op mobiel en is de video niet te zien? Klik dan op deze link: https://www.youtube.com/watch?v=,<extra_id_0> mobiel en is de video niet te zien? Klik dan op deze link: https://www.youtube.com/watch?v=,['Zit u op'],3,6
"). Kopenhagen van Michael Frayn gaat over de ontmoeting tussen twee wetenschappers tijdens W.O. II, de halfjoodse Niels Bohr en de Duitser Werner Heisenberg. Door het Nationale Toneel in regie van Peter Tuinman. Met Bram van der Vlugt, Stefan de Walle en Liz Snoijink. Vanavond t/m","). Kopenhagen van Michael Frayn gaat over de ontmoeting tussen <extra_id_0> Niels Bohr en de Duitser Werner Heisenberg. Door het Nationale Toneel in regie van Peter Tuinman. Met Bram van der Vlugt, Stefan de Walle en Liz Snoijink. Vanavond t/m","['twee wetenschappers tijdens W.O. II, de halfjoodse']",7,6
"' Zoveel nieuws in 2014, zoveel aangrijpende beelden: de Krim, Oekrane, MH-17, Gaza. Maar welke foto's intrigeerden het meest? Elf Volkskrantfotografen kiezen hun fotomoment van het jaar. Vandaag aflevering","' Zoveel nieuws in 2014, zoveel aangrijpende beelden: de Krim, Oekrane, MH-17, Gaza. Maar welke foto's intrigeerden het meest? Elf Volkskrantfotografen kiezen hun fotomoment van <extra_id_0>",['het jaar. Vandaag aflevering'],4,6
"een indringende en ten slotte aangrijpende vertelling over de botsing van culturen, morele oordelen en familieverhoudingen.","een indringende <extra_id_0> slotte aangrijpende vertelling over de botsing van culturen, morele oordelen en familieverhoudingen.",['en ten'],2,6
"United 93 (Paul Greengrass). De Brit Paul Greengrass ontvouwt het verhaal van het vierde vliegtuig van 11 september 2001, dat in Pennsylvania neerstortte. De film ademt in alles uit de werkelijkheid","United 93 (Paul Greengrass). De Brit Paul Greengrass ontvouwt het verhaal van <extra_id_0> 11 september 2001, dat in Pennsylvania neerstortte. De film ademt in alles uit de werkelijkheid",['het vierde vliegtuig van'],5,6
"My Secret Garden, installatie van de Belgische kunstenaar Arne Quinze met licht- en geluidscomposities van het duo Danny Mommens en Els Pynnoo, t/m 2/9; Aanwinst,","My Secret Garden, installatie van de Belgische kunstenaar Arne Quinze met licht- en geluidscomposities van het <extra_id_0> Els Pynnoo, t/m 2/9; Aanwinst,",['duo Danny Mommens en'],4,6
"Rotterdam, NAI (010-4401200): Dwarsdesign, spraakmakende projecten van Ai Weiwei, Urbanus, To meet you, Ma Ke, Rem Koolhaas/ OMA","Rotterdam, NAI (010-4401200): Dwarsdesign, spraakmakende projecten van Ai Weiwei, Urbanus, To meet you, <extra_id_0> Koolhaas/ OMA","['Ma Ke, Rem']",3,6
"Het nieuwe ambacht, ontwerpen van de Nederlandse modeontwerpster Iris van Herpen en haar inspiraties",Het nieuwe <extra_id_0> van de Nederlandse modeontwerpster Iris van Herpen en haar inspiraties,"['ambacht, ontwerpen']",2,6
Eten we in 2050 kweekvlees of krekels? Wat zijn de spannende initiatieven op het gebied van voedsel? En hoe draag je zelf bij aan een betere wereld? Het zijn onderwerpen die,Eten we in 2050 kweekvlees of krekels? Wat zijn de spannende initiatieven op het gebied van voedsel? En hoe draag je zelf bij aan een betere wereld? Het <extra_id_0>,['zijn onderwerpen die'],5,6
"Still Life (Jia Zhang-ke). Jia, chroniqueur van hedendaags China, toont in zijn vijfde speelfilm de achterkant van een land op drift.","Still Life (Jia Zhang-ke). Jia, chroniqueur van hedendaags China, toont in zijn vijfde speelfilm de achterkant <extra_id_0> op drift.",['van een land'],3,6
"van Jan Veldman door De Citadel. Regie: Frederieke Vermeulen. Een jongen komt terecht in het verleden, bij een joods echtpaar in 1935. Hij ziet de dreiging waaronder zij le",van Jan Veldman door De Citadel. Regie: Frederieke Vermeulen. Een jongen komt terecht <extra_id_0> een joods echtpaar in 1935. Hij ziet de dreiging waaronder zij le,"['in het verleden, bij']",4,6
Rembrandt woonde de eerste 25 jaar van zijn leven in Leiden. Onno Blom werkt aan een biografie van die jaren en,Rembrandt woonde de eerste 25 jaar van zijn leven in Leiden. Onno Blom <extra_id_0> biografie van die jaren en,['werkt aan een'],3,6
. De Volkskrant deed hard z'n best om al die beweringen live te controleren en te voorzien van duiding.,. De <extra_id_0> z'n best om al die beweringen live te controleren en te voorzien van duiding.,['Volkskrant deed hard'],3,6
"Maastricht, Bonnefantenmuseum (043-3290190): De verzameling Van Herck, terracotta's uit de 17de en 18de eeuw,","<extra_id_0> (043-3290190): De verzameling Van Herck, terracotta's uit de 17de en 18de eeuw,","['Maastricht, Bonnefantenmuseum']",2,6
"Rotterdam, Nederlands Fotomuseum (010-2030405): New Topographics, moderne landschapsfotografie uit 1975","Rotterdam, Nederlands Fotomuseum (010-2030405): New <extra_id_0> landschapsfotografie uit 1975","['Topographics, moderne']",2,6
Vooral op sociale media lijkt het soms wel of niemand meer met iemand overweg kan. De Volkskrant zet,Vooral op sociale media lijkt het soms wel of niemand <extra_id_0> overweg kan. De Volkskrant zet,['meer met iemand'],3,6
".nl Otterlo, Krller-Mller Museum (0318-591241): Hortus/Corpus, sculpturen, tekeningen en films en",".nl Otterlo, Krller-Mller Museum <extra_id_0> sculpturen, tekeningen en films en","['(0318-591241): Hortus/Corpus,']",2,6
n? Anna van den Breemer schrijft elke week over een alledaags opvoedkundig probleem waarvoor ze een oplossing zoekt. Deze week:,n? Anna van den Breemer schrijft elke week over een alledaags <extra_id_0> ze een oplossing zoekt. Deze week:,['opvoedkundig probleem waarvoor'],3,6
".nl Eindhoven, Van Abbemuseum (Bilderdijklaan 10): Heartland, kunst en cultuur van de Heartlands",".nl Eindhoven, Van <extra_id_0> 10): Heartland, kunst en cultuur van de Heartlands",['Abbemuseum (Bilderdijklaan'],2,6
"Nijmegen, Het Valkhof (Kelfkensbos 59): Luxe en decadentie, leven aan de Romeinse Goudkust, luxe bezittingen","Nijmegen, Het Valkhof (Kelfkensbos 59): <extra_id_0> decadentie, leven aan de Romeinse Goudkust, luxe bezittingen",['Luxe en'],2,6
). Ifigeneia in Aulis van Euripides door Toneelgroep Amsterdam i.s.m. Opera Studio Nederland. Met Roeland Fernhout en Tijn Docter als Agamemnon en Menelaos en Chris Nietvelt als Klytaimestra die haar dochter Ifigene,). Ifigeneia in Aulis van Euripides door Toneelgroep Amsterdam i.s.m. Opera Studio Nederland. <extra_id_0> Tijn Docter als Agamemnon en Menelaos en Chris Nietvelt als Klytaimestra die haar dochter Ifigene,['Met Roeland Fernhout en'],5,6
"t drie dansstukken op muziek van Strawinsky: Balletscnes van Hans van Manen, Symphony in Three Movements van Nils Christe en een wereldpremire van Gisela Rocha.","t drie dansstukken op muziek van Strawinsky: Balletscnes van Hans van Manen, Symphony in Three Movements van <extra_id_0> wereldpremire van Gisela Rocha.",['Nils Christe en een'],4,6
"Maastricht, Bonnefantenmuseum (043-3290190): Different Impressions, Changing Traditions, moderne en hedendaagse kunst uit de collectie van de Centrale Bank van Turkije,","Maastricht, Bonnefantenmuseum (043-3290190): Different Impressions, Changing Traditions, moderne en hedendaagse kunst uit de collectie van de Centrale <extra_id_0>","['Bank van Turkije,']",3,6
"Sarah Izat (26) werkt met hart en ziel bij de Rotterdamse politie. Dus wanneer haar werkgever haar de functie van buitengewoon opsporingsambtenaar in het vooruitzicht stelt, gaat zij daar gretig op in. Alleen, haar hoofddoek moet af. Izat stapte naar het College voor de Rechten van de Mens","Sarah Izat (26) werkt met hart <extra_id_0> Rotterdamse <extra_id_1> haar werkgever haar de functie van buitengewoon opsporingsambtenaar in het vooruitzicht stelt, gaat zij daar gretig op in. Alleen, haar hoofddoek moet af. Izat stapte naar het College voor de Rechten van de Mens","['en ziel bij de', 'politie. Dus wanneer']",7,6
"illustraties van Martijn van der Linden, t/m 1/7. coda-apeldoorn.nl Arnhem, Museum voor Moderne Kunst (026-3512341):","illustraties van Martijn van der Linden, t/m 1/7. coda-apeldoorn.nl Arnhem, <extra_id_0> Moderne Kunst (026-3512341):",['Museum voor'],2,6
t tijdens het debat in de Eerste Kamer over het initiatiefvoorstel om een actief donorregistratiesysteem in te voeren.,t tijdens het <extra_id_0> Eerste Kamer over het initiatiefvoorstel om een actief donorregistratiesysteem in te voeren.,['debat in de'],3,6
