Sequence id,Model size,Input sequence (ground truth),Input sequence (masked),Model output sequence,Masked tokens,Filled tokens,Number of masked tokens,Masking percentage,Duplicate count,Levenshtein distances,Levenshtein distance (avg)
seq0-0,small,Na een kletsnatte maandag volgt een veelal wisselvallige en frisse week. Aangezien we midden in de piek van het hooikoortsseizoen zitten is dat goed nieuws voor hooikoortspatinten.,Na een kletsnatte maandag volgt een veelal wisselvallige en frisse <extra_id_0> we midden in de piek <extra_id_1> zitten is dat goed nieuws voor hooikoortspatinten.,Na een kletsnatte maandag volgt een veelal wisselvallige en frisse sfeer. Als we midden in de piek zitten is dat goed nieuws voor hooikoortspatinten.,"['week. Aangezien', 'van het hooikoortsseizoen']","['sfeer. Als', '']",5,20,1,"[0.7333333333333333, 1.0]",0.87
seq1-0,small,"Was aan de lijn is een levend kunstwerk. De was heeft een vaste volgorde, groot bij groot, soort bij soort, sok bij sok, kleur bij kleur. Daarbinnen kan alles. Een jurk in de wind heeft het drukdrukdruk, een overall spartelt of hij wordt gekieteld, een laken speelt spookje. Wasgoed heeft lust tot leven.","Was aan de lijn is een levend kunstwerk. <extra_id_0> een vaste volgorde, groot bij groot, soort bij soort, <extra_id_1> sok, kleur bij kleur. Daarbinnen kan alles. Een jurk in <extra_id_2> het drukdrukdruk, een overall spartelt of hij wordt gekieteld, een laken speelt spookje. <extra_id_3> tot leven.","Was aan de lijn is een levend kunstwerk. In een vaste volgorde, groot bij groot, soort bij soort, sok bij sok, kleur bij kleur. Daarbinnen kan alles. Een jurk in de lijn maakt het drukdrukdruk, een overall spartelt of hij wordt gekieteld, een laken speelt spookje. Hij komt tot leven.","['De was heeft', 'sok bij', 'de wind heeft', 'Wasgoed heeft lust']","['In', 'sok bij', 'de lijn maakt', 'Hij komt']",11,20,1,"[1.0, 0.0, 0.5384615384615384, 0.8888888888888888]",0.61
seq2-0,small,"Sinds Raemon Sluiter de Oekraense Elina Svitolina coacht, heeft zijn baan een andere betekenis. Voor ons geldt: wij ontkomen er niet aan, de oorlog en de verdere wereld is dagelijkse realiteit.","Sinds Raemon Sluiter de Oekraense Elina Svitolina coacht, heeft zijn baan <extra_id_0> Voor ons geldt: wij ontkomen er niet aan, de oorlog en de verdere <extra_id_1> realiteit.","Sinds Raemon Sluiter de Oekraense Elina Svitolina coacht, heeft zijn baan verloren. Voor ons geldt: wij ontkomen er niet aan, de oorlog en de verdere politieke realiteit.","['een andere betekenis.', 'wereld is dagelijkse']","['verloren.', 'politieke']",6,20,1,"[0.7619047619047619, 0.75]",0.76
seq3-0,small,"Was aan de lijn is een levend kunstwerk. De was heeft een vaste volgorde, groot bij groot, soort bij soort, sok bij sok, kleur bij kleur.","Was aan de lijn is een levend kunstwerk. De was heeft een vaste volgorde, groot bij <extra_id_0> soort, sok bij <extra_id_1> bij kleur.","Was aan de lijn is een levend kunstwerk. De was heeft een vaste volgorde, groot bij kleur en soort, sok bij kleur en donker bij kleur.","['groot', 'soort bij', 'sok', 'kleur']","['kleur en', 'kleur en donker']",5,20,1,"[0.875, 0.8666666666666667]",0.87
seq4-0,small,"Vanaf deze zomer kan er gesurft worden in een gracht, in hartje Rotterdam. Al kwam Rif010 niet zonder slag of stoot tot stand.","Vanaf deze zomer kan er gesurft <extra_id_0> gracht, in hartje Rotterdam. Al kwam Rif010 niet <extra_id_1> of stoot tot stand.","Vanaf deze zomer kan er gesurft worden met gracht, in hartje Rotterdam. Al kwam Rif010 niet kwam de rook of stoot tot stand.","['worden in een', 'zonder slag']","['worden met', 'kwam de rook']",5,20,1,"[0.38461538461538464, 0.8333333333333334]",0.61
seq5-0,small,"Theo Heuft, oprichter van Yab Yum, de roemruchte Amsterdamse seksclub in een 17e-eeuws grachtenpand, is op 89-jarige leeftijd overleden.","Theo Heuft, oprichter van Yab Yum, de roemruchte Amsterdamse seksclub in een 17e-eeuws grachtenpand, is <extra_id_0>","Theo Heuft, oprichter van Yab Yum, de roemruchte Amsterdamse seksclub in een 17e-eeuws grachtenpand, is bekend.",['op 89-jarige leeftijd overleden.'],['bekend.'],4,20,1,[0.875],0.88
seq6-0,small,"OpenAI, het bedrijf achter ChatGPT, schort een AI-stem op die sterk aan de stem van actrice Scarlett Johansson doet denken.","OpenAI, het <extra_id_0> een AI-stem op die sterk aan de stem van actrice Scarlett Johansson doet denken.","OpenAI, het zich een AI-stem op die sterk aan de stem van actrice Scarlett Johansson doet denken.","['bedrijf achter ChatGPT', 'schort']",['zich'],4,20,1,[0.8636363636363636],0.86
seq7-0,small,"Voor het eerst sinds hij twee jaar geleden de troon besteeg, kunnen Britten de hand leggen op een papieren koning Charles III van het Verenigd Koninkrijk.","Voor het eerst sinds hij twee jaar geleden de troon besteeg, kunnen <extra_id_0> hand leggen op een papieren koning Charles <extra_id_1> Verenigd Koninkrijk.","Voor het eerst sinds hij twee jaar geleden de troon besteeg, kunnen we hand leggen op een papieren koning Charles in het Verenigd Koninkrijk.","['Britten de', 'III van het']","['we', 'in het']",5,20,1,"[0.9, 0.5454545454545454]",0.72
seq8-0,small,"Film- en serieliefhebbers zijn steeds meer geld kwijt aan streamingdiensten als Netflix, Videoland en Disney Plus. Nu de diensten een plek op de Nederlandse markt veroverd hebben, zoeken ze naar andere manieren om hun inkomsten op te krikken.","Film- en serieliefhebbers zijn steeds meer geld kwijt aan streamingdiensten als Netflix, Videoland en Disney Plus. Nu de diensten een plek op de <extra_id_0> hebben, <extra_id_1> naar andere manieren om hun <extra_id_2> krikken.","Film- en serieliefhebbers zijn steeds meer geld kwijt aan streamingdiensten als Netflix, Videoland en Disney Plus. Nu de diensten een plek op de markt hebben, kijk je naar andere manieren om hun geld te krikken.","['Nederlandse markt veroverd', 'zoeken ze', 'inkomsten op te']","['markt', 'kijk je', 'geld te']",8,20,1,"[0.8076923076923077, 0.6666666666666666, 0.7333333333333333]",0.74
seq9-0,small,"De formerende partijen hebben een akkoord bereikt over de verdeling van de ministerposten in het kabinet-Schoof. Dat laat PVV-leider Geert Wilders dinsdag weten: We zijn eruit. Goed nieuws, de rest horen jullie later. Naar verwachting begint formateur Richard van Zwol nog deze week met het ontvangen van de kandidaat-bewindslieden.","De formerende partijen hebben een akkoord bereikt over de verdeling van de ministerposten in het kabinet-Schoof. Dat laat PVV-leider <extra_id_0> weten: We zijn eruit. Goed nieuws, de rest horen jullie later. Naar verwachting begint formateur Richard <extra_id_1> deze week <extra_id_2> de kandidaat-bewindslieden.","De formerende partijen hebben een akkoord bereikt over de verdeling van de ministerposten in het kabinet-Schoof. Dat laat PVV-leider Gerard van der Velden weten: We zijn eruit. Goed nieuws, de rest horen jullie later. Naar verwachting begint formateur Richard van der Velden deze week met de kandidaat-bewindslieden.","['Geert Wilders dinsdag', 'van Zwol nog', 'met het ontvangen van']","['Gerard van der Velden', 'van der Velden', 'met']",10,20,1,"[0.6666666666666666, 0.7142857142857143, 0.8571428571428571]",0.75
seq10-0,small,"Ze zorgen al lange tijd voor grote problemen op verschillende plekken in Utrecht: drugsgebruikers op straat. Vorig jaar zorgden zon 120 verslaafden op het Lucasbolwerk voor overlast, maar nadat daar maatregelen werden genomen, verplaatste de groep zich naar Park Lepelenburg.","Ze zorgen al lange tijd voor grote problemen op verschillende plekken in Utrecht: drugsgebruikers op straat. Vorig jaar zorgden zon 120 <extra_id_0> het Lucasbolwerk voor overlast, maar nadat daar maatregelen werden <extra_id_1> groep zich <extra_id_2>","Ze zorgen al lange tijd voor grote problemen op verschillende plekken in Utrecht: drugsgebruikers op straat. Vorig jaar zorgden zon 120 mensen in het Lucasbolwerk voor overlast, maar nadat daar maatregelen werden genomen, liet de groep zich beperken.","['verslaafden op', 'genomen', 'verplaatste de', 'naar Park Lepelenburg.']","['mensen in', 'genomen, liet de', 'beperken.']",8,20,1,"[0.6428571428571429, 0.5625, 0.7857142857142857]",0.66
seq11-0,small,"Het campagneteam van de Amerikaanse president Joe Biden heeft een nieuwe vacature: een meme-manager, die moet zorgen dat filmpjes en fotos die Biden aantrekkelijk maken voor jongeren viraal gaan.","Het campagneteam van de Amerikaanse president Joe Biden heeft een nieuwe vacature: een meme-manager, die moet zorgen dat <extra_id_0> die <extra_id_1> voor jongeren viraal gaan.","Het campagneteam van de Amerikaanse president Joe Biden heeft een nieuwe vacature: een meme-manager, die moet zorgen dat mensen die campagne voor jongeren viraal gaan.","['filmpjes en fotos', 'Biden aantrekkelijk maken']","['mensen', 'campagne']",6,20,1,"[0.7647058823529411, 0.88]",0.82
seq12-0,small,"Hoe weet je of je bij de groep hoort die te veel betaalt voor een zorgverzekering? Meer dan de helft van de Nederlanders betaalt namelijk onnodig veel, blijkt uit onderzoek. Wat kun je hier tegen doen? Vijf veelgestelde vragen en antwoorden. ,,Veel mensen kiezen voor gemak en komen dan op een dure polis uit.",Hoe weet je of je bij de groep hoort die te veel betaalt voor een <extra_id_0> de helft van de Nederlanders betaalt namelijk <extra_id_1> uit <extra_id_2> je hier tegen doen? Vijf veelgestelde vragen en antwoorden. <extra_id_3> kiezen voor gemak en komen dan op een dure polis uit.,Hoe weet je of je bij de groep hoort die te veel betaalt voor een bedrag? Ongeveer de helft van de Nederlanders betaalt namelijk te veel uit Wat kan je hier tegen doen? Vijf veelgestelde vragen en antwoorden. We kiezen voor gemak en komen dan op een dure polis uit.,"['zorgverzekering? Meer dan', 'onnodig veel', 'blijkt', 'onderzoek. Wat kun', ',,Veel mensen']","['bedrag? Ongeveer', 'te veel', 'Wat kan', 'We']",11,20,1,"[0.76, 0.5833333333333334, 0.8571428571428571, 0.9444444444444444]",0.79
seq13-0,small,"OpenAI, het bedrijf achter ChatGPT, schort een AI-stem op die sterk aan de stem van actrice Scarlett Johansson doet denken. Het bedrijf lijkt iets te veel inspiratie te hebben geput uit de film Her, waarvoor Johansson de stem van computersysteem Samantha insprak.","OpenAI, het bedrijf achter ChatGPT, schort een AI-stem op die sterk <extra_id_0> stem van actrice Scarlett Johansson <extra_id_1> bedrijf lijkt iets te veel inspiratie te hebben <extra_id_2> film Her, waarvoor Johansson de stem van computersysteem Samantha insprak.","OpenAI, het bedrijf achter ChatGPT, schort een AI-stem op die sterk de stem van actrice Scarlett Johansson insprak. Het bedrijf lijkt iets te veel inspiratie te hebben voor film Her, waarvoor Johansson de stem van computersysteem Samantha insprak.","['aan de', 'doet denken. Het', 'geput uit de']","['de', 'insprak. Het', 'voor']",8,20,1,"[0.6666666666666666, 0.625, 1.0]",0.76
seq14-0,small,"De voorgenomen verhoging van de belasting toegevoegde waarde (btw) op cultuur, recreatie, boeken en periodieken maakt veel los bij de lezers. Vooral de hogere belasting op sportclubs en sportscholen roept veel vragen op. Economieredacteur Peet Vogels geeft antwoord.","De voorgenomen verhoging van de belasting toegevoegde waarde (btw) op cultuur, recreatie, boeken en periodieken maakt veel los bij de lezers. Vooral de hogere <extra_id_0> sportclubs <extra_id_1> veel vragen <extra_id_2> Vogels geeft antwoord.","De voorgenomen verhoging van de belasting toegevoegde waarde (btw) op cultuur, recreatie, boeken en periodieken maakt veel los bij de lezers. Vooral de hogere clubs en sportclubs hebben veel vragen Vogels geeft antwoord.","['belasting op', 'en sportscholen roept', 'op. Economieredacteur Peet']","['clubs en', 'hebben', '']",8,20,1,"[0.8333333333333334, 0.8571428571428571, 1.0]",0.9
seq15-0,small,"Sinds Raemon Sluiter de Oekraense Elina Svitolina coacht, heeft zijn baan een andere betekenis. Voor ons geldt: wij ontkomen er niet aan, de oorlog en de verdere wereld is dagelijkse realiteit.","Sinds Raemon Sluiter de Oekraense Elina Svitolina coacht, heeft zijn baan een <extra_id_0> ons geldt: wij <extra_id_1> aan, de oorlog en de verdere wereld is dagelijkse realiteit.","Sinds Raemon Sluiter de Oekraense Elina Svitolina coacht, heeft zijn baan een nieuwe visie gegeven. Het is wat voor ons geldt: wij gaan aan, de oorlog en de verdere wereld is dagelijkse realiteit.","['andere betekenis. Voor', 'ontkomen er niet']","['nieuwe visie gegeven. Het is wat voor', 'gaan']",6,20,1,"[0.6486486486486487, 0.9375]",0.79
seq16-0,small,"De Amerikaanse regering start een aantal mededingingsonderzoeken naar OpenAI, Nvidia en Microsoft vanwege mogelijk te vergaande dominantie van de markt van kunstmatige intelligentie (AI). Dat meldt de Amerikaanse krant The New York Times donderdag.","De Amerikaanse regering start een aantal mededingingsonderzoeken naar OpenAI, Nvidia en Microsoft vanwege mogelijk te vergaande dominantie <extra_id_0> kunstmatige intelligentie (AI). <extra_id_1> Amerikaanse krant The New York Times donderdag.","De Amerikaanse regering start een aantal mededingingsonderzoeken naar OpenAI, Nvidia en Microsoft vanwege mogelijk te vergaande dominantie in kunstmatige intelligentie (AI). Dat meldt Amerikaanse krant The New York Times donderdag.","['van de markt van', 'Dat meldt de']","['in', 'Dat meldt']",7,20,1,"[0.9375, 0.25]",0.59
seq17-0,small,"De pro-Palestijnse demonstrant die bij een protest op de Amsterdamse Roeterseilandcampus op televisieschermen insloeg, heeft een gevangenisstraf van 2 maanden gekregen, waarvan 1 maand voorwaardelijk.","De pro-Palestijnse demonstrant die bij een protest op de Amsterdamse Roeterseilandcampus op televisieschermen insloeg, heeft een <extra_id_0> 2 maanden gekregen, waarvan <extra_id_1>","De pro-Palestijnse demonstrant die bij een protest op de Amsterdamse Roeterseilandcampus op televisieschermen insloeg, heeft een eindejaarsdag vandaag 2 maanden gekregen, waarvan","['gevangenisstraf van', '1 maand voorwaardelijk.']","['eindejaarsdag vandaag', '']",5,20,1,"[0.7142857142857143, 1.0]",0.86
seq18-0,small,"Wie wint Ronald Garros? Novak Djokovic, Jannik Sinner en Carlos Alcaraz zijn niet in vorm, om over Rafael Nadal maar te zwijgen. Mooie kans voor Daniil Medvedev, alleen houdt hij niet van gravel.","Wie wint Ronald Garros? Novak Djokovic, Jannik Sinner en Carlos Alcaraz zijn niet in <extra_id_0> Rafael Nadal maar te zwijgen. Mooie kans <extra_id_1> houdt hij niet van gravel.","Wie wint Ronald Garros? Novak Djokovic, Jannik Sinner en Carlos Alcaraz zijn niet in de buurt van Rafael Nadal maar te zwijgen. Mooie kans maar houdt hij niet van gravel.","['vorm', 'om over', 'voor Daniil Medvedev', 'alleen']","['de buurt van', 'maar']",7,20,1,"[0.9166666666666666, 0.7142857142857143]",0.82
seq19-0,small,Onder de Nederlandse bevolking is weinig steun voor Israls oorlog in Gaza. Slechts eenvijfde van de bevolking vindt dat de Isralische bombardementen in Gaza nodig zijn om Hamas uit te schakelen.,Onder de Nederlandse <extra_id_0> steun voor Israls oorlog in Gaza. Slechts eenvijfde van de bevolking vindt dat <extra_id_1> in Gaza nodig zijn om Hamas uit te schakelen.,Onder de Nederlandse regering moet steun voor Israls oorlog in Gaza. Slechts eenvijfde van de bevolking vindt dat er plannen in Gaza nodig zijn om Hamas uit te schakelen.,"['bevolking is weinig', 'de Isralische bombardementen']","['regering moet', 'er plannen']",6,20,1,"[0.6842105263157895, 0.75]",0.72
seq20-0,small,In duizenden boeken over drugshandelaar Janus van Wesenbeeck moeten fotos worden zwartgemaakt. De afgelopen jaren kwam Van Wesenbeeck onder de aandacht vanwege de Netflix-hitserie Undercover.,In duizenden boeken over drugshandelaar Janus van Wesenbeeck moeten fotos worden zwartgemaakt. De afgelopen jaren kwam Van Wesenbeeck onder <extra_id_0> de <extra_id_1>,In duizenden boeken over drugshandelaar Janus van Wesenbeeck moeten fotos worden zwartgemaakt. De afgelopen jaren kwam Van Wesenbeeck onder druk op de zaak.,"['de aandacht vanwege', 'Netflix-hitserie Undercover.']","['druk op', 'zaak.']",5,20,1,"[0.8947368421052632, 0.9642857142857143]",0.93
seq21-0,small,Ook in het Caribische deel van het Nederlands Koninkrijk is GroenLinks-PvdA de grote winnaar geworden bij de Europese Parlementsverkiezingen.,Ook in het Caribische deel van het Nederlands Koninkrijk is <extra_id_0> geworden bij de Europese Parlementsverkiezingen.,Ook in het Caribische deel van het Nederlands Koninkrijk is het geval geworden bij de Europese Parlementsverkiezingen.,['GroenLinks-PvdA de grote winnaar'],['het geval'],4,20,1,[0.84375],0.84
seq22-0,small,"De terugroepactie van bakfietsfabrikant Babboe verloopt uiterst moeizaam. Van de 22.000 onveilige bakfietsen zijn er slechts 6000 opgehaald, waarvan ruim de helft in ons land. Pas 500 gedupeerde eigenaren ontvingen een nieuw exemplaar. Nog tienduizenden inspecties aan mogelijk onveilige bakfietsen moeten worden uitgevoerd. Babboe erkent alle problemen.","<extra_id_0> bakfietsfabrikant Babboe verloopt uiterst moeizaam. Van de 22.000 onveilige bakfietsen zijn er slechts 6000 opgehaald, waarvan ruim de helft in ons land. Pas 500 gedupeerde eigenaren ontvingen een nieuw <extra_id_1> inspecties aan mogelijk onveilige bakfietsen moeten worden <extra_id_2> alle problemen.","De werkzaamheden van bakfietsfabrikant Babboe verloopt uiterst moeizaam. Van de 22.000 onveilige bakfietsen zijn er slechts 6000 opgehaald, waarvan ruim de helft in ons land. Pas 500 gedupeerde eigenaren ontvingen een nieuw besluit. De inspecties aan mogelijk onveilige bakfietsen moeten worden opgelost met alle problemen.","['De terugroepactie van', 'exemplaar. Nog tienduizenden', 'uitgevoerd. Babboe erkent']","['De werkzaamheden van', 'besluit. De', 'opgelost met']",9,20,1,"[0.5714285714285714, 0.8214285714285714, 0.76]",0.72
seq23-0,small,Niet eerder werden er in Nederland zo veel drugslabs ontmanteld als vorig jaar. Voor de Engelse drugsonderzoeker Steve Rolles is het opnieuw een aanwijzing dat het drugsbeleid radicaal op de schop moet.,Niet <extra_id_0> in Nederland zo veel drugslabs ontmanteld als vorig jaar. Voor de Engelse drugsonderzoeker Steve <extra_id_1> opnieuw een aanwijzing dat het drugsbeleid radicaal op de schop moet.,Niet alleen in Nederland zo veel drugslabs ontmanteld als vorig jaar. Voor de Engelse drugsonderzoeker Steve Cameron is het opnieuw een aanwijzing dat het drugsbeleid radicaal op de schop moet.,"['eerder werden er', 'Rolles is het']","['alleen', 'Cameron is het']",6,20,1,"[0.8125, 0.5]",0.66
seq24-0,small,Na uit de hand gelopen protesten werd de campus van de Universiteit van Amsterdam voor twee dagen ten dele gesloten. Nu lijkt de rust terug te keren.,Na uit <extra_id_0> gelopen <extra_id_1> campus van de Universiteit van Amsterdam voor twee dagen ten dele gesloten. Nu lijkt de rust terug te keren.,Na uit gelopen is de campus van de Universiteit van Amsterdam voor twee dagen ten dele gesloten. Nu lijkt de rust terug te keren.,"['de hand', 'protesten werd de']","['', 'is de']",5,20,1,"[1.0, 0.7647058823529411]",0.88
seq25-0,small,"Het COA, dat kampt met een structureel tekort aan opvangplekken, is zeer te spreken over de stap naar voren van Arnhem.","Het COA, dat <extra_id_0> tekort aan opvangplekken, is zeer te spreken over de stap naar voren van Arnhem.","Het COA, dat meldt een tekort aan opvangplekken, is zeer te spreken over de stap naar voren van Arnhem.",['kampt met een structureel'],['meldt een'],4,20,1,[0.76],0.76
seq26-0,small,Na een kletsnatte maandag volgt een veelal wisselvallige en frisse week. Aangezien we midden in de piek van het hooikoortsseizoen zitten is dat goed nieuws voor hooikoortspatinten.,Na een kletsnatte maandag volgt een veelal wisselvallige en frisse week. <extra_id_0> midden in de piek van het <extra_id_1> dat goed nieuws voor hooikoortspatinten.,Na een kletsnatte maandag volgt een veelal wisselvallige en frisse week. En midden in de piek van het seizoen is dat goed nieuws voor hooikoortspatinten.,"['Aangezien we', 'hooikoortsseizoen zitten is']","['En', 'seizoen is']",5,20,1,"[0.9166666666666666, 0.6296296296296297]",0.77
seq27-0,small,"Fabrikanten halen geneesmiddelen van de Nederlandse markt, waardoor er steeds minder alternatieven beschikbaar zijn om de aanhoudende medicijntekorten op te lossen. Dat blijkt uit onderzoek van de NOS.","Fabrikanten halen geneesmiddelen van de Nederlandse markt, <extra_id_0> minder alternatieven beschikbaar <extra_id_1> aanhoudende medicijntekorten op te lossen. Dat blijkt uit onderzoek van de NOS.","Fabrikanten halen geneesmiddelen van de Nederlandse markt, om minder alternatieven beschikbaar te stellen om aanhoudende medicijntekorten op te lossen. Dat blijkt uit onderzoek van de NOS.","['waardoor er steeds', 'zijn om de']","['om', 'te stellen om']",6,20,1,"[0.9444444444444444, 0.9230769230769231]",0.93
seq28-0,small,"Dubbele seksuele moraal is achterhaald, laat vrouwen ook kinderen hebben bij verschillende mensen","Dubbele seksuele moraal is achterhaald, laat vrouwen ook <extra_id_0> verschillende mensen","Dubbele seksuele moraal is achterhaald, laat vrouwen ook berichten van verschillende mensen",['kinderen hebben bij'],['berichten van'],3,20,1,[0.6842105263157895],0.68
seq29-0,small,"Kabosu, de Japanse Shiba Inu wier beeltenis de wereld overging als meme, is vrijdagochtend overleden. De hond was het symbool van de als grap bedoelde cryptomunt dogecoin, waarvan het totaal aantal munten in 2021 ruim 80 miljard euro waard was.","Kabosu, de Japanse Shiba Inu wier beeltenis de wereld overging als <extra_id_0> vrijdagochtend overleden. De hond was het symbool van de als grap bedoelde cryptomunt <extra_id_1> totaal <extra_id_2> 2021 ruim 80 miljard euro waard was.","Kabosu, de Japanse Shiba Inu wier beeltenis de wereld overging als hij vrijdagochtend overleden. De hond was het symbool van de als grap bedoelde cryptomunt die in totaal in 2021 ruim 80 miljard euro waard was.","['meme', 'is', 'dogecoin', 'waarvan het', 'aantal munten in']","['hij', 'die in', 'in']",8,20,1,"[1.0, 0.8333333333333334, 0.75]",0.86
seq30-0,small,Het Openbaar Ministerie heeft een nieuwe kroongetuige gepresenteerd. Het gaat om de 29-jarige Dominique K.,Het Openbaar Ministerie heeft een nieuwe kroongetuige gepresenteerd. Het gaat om <extra_id_0> K.,Het Openbaar Ministerie heeft een nieuwe kroongetuige gepresenteerd. Het gaat om een K.,['de 29-jarige Dominique'],['een'],3,20,1,[0.8636363636363636],0.86
seq31-0,small,Daan en het ongelijk van de rommelmarktheks Uren samen spelen is verruild voor me-time op eigen kamers. Daan Rot schrijft in weekendmagazine Mezza wekelijks over zijn persoonlijk leven,Daan en het ongelijk van de rommelmarktheks Uren samen spelen <extra_id_0> me-time op eigen <extra_id_1> schrijft in weekendmagazine Mezza wekelijks over zijn persoonlijk leven,Daan en het ongelijk van de rommelmarktheks Uren samen spelen en me-time op eigen schrijft in weekendmagazine Mezza wekelijks over zijn persoonlijk leven,"['is verruild voor', 'kamers. Daan Rot']","['en', '']",6,20,1,"[0.9375, 1.0]",0.97
seq32-0,small,Het Eindhovense KMWE ziet als toeleverancier van het snelgroeiende ASML de orders binnenstromen. Al levert dat ook een probleem op: technisch personeel ligt niet voor het oprapen.,Het Eindhovense KMWE ziet als toeleverancier van het snelgroeiende ASML de orders binnenstromen. <extra_id_0> dat <extra_id_1> op: technisch personeel ligt niet voor het oprapen.,Het Eindhovense KMWE ziet als toeleverancier van het snelgroeiende ASML de orders binnenstromen. Maar dat valt op: technisch personeel ligt niet voor het oprapen.,"['Al levert', 'ook een probleem']","['Maar', 'valt']",5,20,1,"[0.8888888888888888, 0.9375]",0.91
seq33-0,small,Vijf jaar geleden trad de Europese Commissie onder leiding van Ursula von der Leyen aan. Het werd een periode van grote crises en onverwachte gebeurtenissen die een ferme reactie vereisten. Hoe deed de Commissie het?,Vijf jaar geleden trad de Europese Commissie onder leiding van Ursula von der Leyen aan. Het werd een periode van grote crises <extra_id_0> die een ferme reactie vereisten. Hoe <extra_id_1>,Vijf jaar geleden trad de Europese Commissie onder leiding van Ursula von der Leyen aan. Het werd een periode van grote crises die een ferme reactie vereisten. Hoe moeten we toch toch?,"['en onverwachte gebeurtenissen', 'deed de Commissie het?']","['', 'toch?']",7,20,1,"[1.0, 0.8636363636363636]",0.93
seq34-0,small,Cees Dekker | hoogleraar biofysica Hoe is het leven ontstaan? Synthetische cellen maken dat inzichtelijk. Als je zoiets zelf bouwt ga je begrijpen hoe het werkt.,Cees Dekker | hoogleraar biofysica <extra_id_0> het leven ontstaan? Synthetische cellen maken dat inzichtelijk. Als je zoiets zelf bouwt <extra_id_1> hoe het werkt.,Cees Dekker | hoogleraar biofysica Hoe is het leven ontstaan? Synthetische cellen maken dat inzichtelijk. Als je zoiets zelf bouwt zie je hoe het werkt.,"['Hoe is', 'ga je begrijpen']","['Hoe is', 'zie je']",5,20,1,"[0.0, 0.7333333333333333]",0.37
seq35-0,small,"Een jong meisje werd door drie jongens meegenomen naar een huis en daar de hele nacht misbruikt. Maar het beeld van deze zaak, die eerst helder leek, begon te kantelen toen de politie de telefoons doorzocht.","Een jong meisje werd door drie jongens <extra_id_0> en daar de hele nacht misbruikt. <extra_id_1> van deze zaak, die eerst helder leek, begon te kantelen toen de politie de telefoons doorzocht.","Een jong meisje werd door drie jongens daar en daar de hele nacht misbruikt. De zaak van deze zaak, die eerst helder leek, begon te kantelen toen de politie de telefoons doorzocht.","['meegenomen naar een huis', 'Maar het beeld']","['daar', 'De zaak']",7,20,1,"[0.875, 0.8571428571428571]",0.87
