Sequence id,Model size,Input sequence (ground truth),Input sequence (masked),Model output sequence,Masked tokens,Filled tokens,Number of masked tokens,Masking percentage,Duplicate count,Levenshtein distances,Levenshtein distance (avg)
seq0-0,large,Na een kletsnatte maandag volgt een veelal wisselvallige en frisse week. Aangezien we midden in de piek van het hooikoortsseizoen zitten is dat goed nieuws voor hooikoortspatinten.,Na een kletsnatte maandag volgt een veelal wisselvallige en frisse week. Aangezien we midden in de piek van het hooikoortsseizoen zitten is <extra_id_0> hooikoortspatinten.,Na een kletsnatte maandag volgt een veelal wisselvallige en frisse week. Aangezien we midden in de piek van het hooikoortsseizoen zitten is het tijd voor hooikoortspatinten.,['dat goed nieuws voor'],['het tijd voor'],4,15,1,[0.6],0.6
seq1-0,large,"Was aan de lijn is een levend kunstwerk. De was heeft een vaste volgorde, groot bij groot, soort bij soort, sok bij sok, kleur bij kleur. Daarbinnen kan alles. Een jurk in de wind heeft het drukdrukdruk, een overall spartelt of hij wordt gekieteld, een laken speelt spookje. Wasgoed heeft lust tot leven.","Was aan de lijn is een levend kunstwerk. De was heeft <extra_id_0> groot bij groot, soort bij soort, sok bij sok, kleur bij kleur. Daarbinnen kan alles. Een <extra_id_1> wind heeft het drukdrukdruk, een overall spartelt of <extra_id_2> gekieteld, een laken speelt spookje. Wasgoed heeft lust tot leven.","Was aan de lijn is een levend kunstwerk. De was heeft zichzelf gevormd, groot bij groot, soort bij soort, sok bij sok, kleur bij kleur. Daarbinnen kan alles. Een broek gaat rollen, een wind heeft het drukdrukdruk, een overall spartelt of wordt gekieteld, een laken speelt spookje. Wasgoed heeft lust tot leven.","['een vaste volgorde,', 'jurk in de', 'hij wordt']","['zichzelf gevormd,', 'broek gaat rollen, een', 'wordt']",8,15,1,"[0.7894736842105263, 0.7727272727272727, 0.4444444444444444]",0.67
seq2-0,large,"Sinds Raemon Sluiter de Oekraense Elina Svitolina coacht, heeft zijn baan een andere betekenis. Voor ons geldt: wij ontkomen er niet aan, de oorlog en de verdere wereld is dagelijkse realiteit.","Sinds Raemon Sluiter de Oekraense Elina Svitolina coacht, heeft zijn baan een andere betekenis. Voor ons geldt: wij ontkomen er niet aan, de <extra_id_0> verdere wereld <extra_id_1> realiteit.","Sinds Raemon Sluiter de Oekraense Elina Svitolina coacht, heeft zijn baan een andere betekenis. Voor ons geldt: wij ontkomen er niet aan, de competitie is een verdere wereld realiteit.","['oorlog en de', 'is dagelijkse']","['competitie is een', '']",5,15,1,"[0.7647058823529411, 1.0]",0.88
seq3-0,large,"Was aan de lijn is een levend kunstwerk. De was heeft een vaste volgorde, groot bij groot, soort bij soort, sok bij sok, kleur bij kleur.","Was aan de lijn is een levend kunstwerk. De was heeft <extra_id_0> bij groot, soort bij soort, sok bij sok, kleur bij kleur.","Was aan de lijn is een levend kunstwerk. De was heeft altijd een vorm, klein bij groot, soort bij soort, sok bij sok, kleur bij kleur.","['een vaste volgorde', 'groot']","['altijd een vorm, klein']",4,15,1,[0.7727272727272727],0.77
seq4-0,large,"Vanaf deze zomer kan er gesurft worden in een gracht, in hartje Rotterdam. Al kwam Rif010 niet zonder slag of stoot tot stand.","Vanaf deze zomer kan er gesurft worden in een gracht, in hartje Rotterdam. Al kwam Rif010 niet zonder <extra_id_0> tot stand.","Vanaf deze zomer kan er gesurft worden in een gracht, in hartje Rotterdam. Al kwam Rif010 niet zonder problemen tot stand.",['slag of stoot'],['problemen'],3,15,1,[0.9230769230769231],0.92
seq5-0,large,"Theo Heuft, oprichter van Yab Yum, de roemruchte Amsterdamse seksclub in een 17e-eeuws grachtenpand, is op 89-jarige leeftijd overleden.","Theo Heuft, oprichter van Yab Yum, de roemruchte Amsterdamse <extra_id_0> 17e-eeuws grachtenpand, is op 89-jarige leeftijd overleden.","Theo Heuft, oprichter van Yab Yum, de roemruchte Amsterdamse zaak in een 17e-eeuws grachtenpand, is op 89-jarige leeftijd overleden.",['seksclub in een'],['zaak in een'],3,15,1,[0.5333333333333333],0.53
seq6-0,large,"OpenAI, het bedrijf achter ChatGPT, schort een AI-stem op die sterk aan de stem van actrice Scarlett Johansson doet denken.","OpenAI, het bedrijf achter ChatGPT, schort een AI-stem op die sterk aan <extra_id_0> actrice Scarlett Johansson doet denken.","OpenAI, het bedrijf achter ChatGPT, schort een AI-stem op die sterk aan de actrice Scarlett Johansson doet denken.",['de stem van'],['de'],3,15,1,[0.8181818181818182],0.82
seq7-0,large,"Voor het eerst sinds hij twee jaar geleden de troon besteeg, kunnen Britten de hand leggen op een papieren koning Charles III van het Verenigd Koninkrijk.","Voor het eerst sinds hij twee jaar geleden de troon besteeg, kunnen Britten de <extra_id_0> papieren koning Charles III van het Verenigd Koninkrijk.","Voor het eerst sinds hij twee jaar geleden de troon besteeg, kunnen Britten de koning halen. Hij is de papieren koning Charles III van het Verenigd Koninkrijk.",['hand leggen op een'],['koning halen. Hij is de'],4,15,1,[0.7391304347826086],0.74
seq8-0,large,"Film- en serieliefhebbers zijn steeds meer geld kwijt aan streamingdiensten als Netflix, Videoland en Disney Plus. Nu de diensten een plek op de Nederlandse markt veroverd hebben, zoeken ze naar andere manieren om hun inkomsten op te krikken.","Film- en serieliefhebbers zijn steeds meer geld kwijt aan streamingdiensten als Netflix, Videoland en Disney Plus. <extra_id_0> een plek op de Nederlandse markt veroverd hebben, zoeken ze naar andere <extra_id_1> inkomsten op te krikken.","Film- en serieliefhebbers zijn steeds meer geld kwijt aan streamingdiensten als Netflix, Videoland en Disney Plus. Nu die een plek op de Nederlandse markt veroverd hebben, zoeken ze naar andere manieren om hun inkomsten op te krikken.","['Nu de diensten', 'manieren om hun']","['Nu die', 'manieren om hun']",6,15,1,"[0.5714285714285714, 0.0]",0.29
seq9-0,large,"De formerende partijen hebben een akkoord bereikt over de verdeling van de ministerposten in het kabinet-Schoof. Dat laat PVV-leider Geert Wilders dinsdag weten: We zijn eruit. Goed nieuws, de rest horen jullie later. Naar verwachting begint formateur Richard van Zwol nog deze week met het ontvangen van de kandidaat-bewindslieden.",De formerende partijen hebben een akkoord bereikt over de verdeling van de ministerposten in het kabinet-Schoof. Dat laat PVV-leider Geert Wilders dinsdag weten: We zijn eruit. <extra_id_0> rest horen <extra_id_1> begint formateur Richard van Zwol nog deze week met het ontvangen van de kandidaat-bewindslieden.,De formerende partijen hebben een akkoord bereikt over de verdeling van de ministerposten in het kabinet-Schoof. Dat laat PVV-leider Geert Wilders dinsdag weten: We zijn eruit. De rest horen we. Volgens Wilders begint formateur Richard van Zwol nog deze week met het ontvangen van de kandidaat-bewindslieden.,"['Goed nieuws', 'de', 'jullie later. Naar verwachting']","['De', 'we. Volgens Wilders']",7,15,1,"[0.9090909090909091, 0.8947368421052632]",0.9
seq10-0,large,"Ze zorgen al lange tijd voor grote problemen op verschillende plekken in Utrecht: drugsgebruikers op straat. Vorig jaar zorgden zon 120 verslaafden op het Lucasbolwerk voor overlast, maar nadat daar maatregelen werden genomen, verplaatste de groep zich naar Park Lepelenburg.","<extra_id_0> lange tijd voor grote problemen op verschillende plekken in Utrecht: drugsgebruikers op straat. Vorig jaar zorgden zon 120 verslaafden op het Lucasbolwerk voor overlast, maar nadat daar maatregelen werden genomen, verplaatste de groep <extra_id_1> Lepelenburg.","zorgde lange tijd voor grote problemen op verschillende plekken in Utrecht: drugsgebruikers op straat. Vorig jaar zorgden zon 120 verslaafden op het Lucasbolwerk voor overlast, maar nadat daar maatregelen werden genomen, verplaatste de groep zich naar Lepelenburg.","['Ze zorgen al', 'zich naar Park']","['zorgde', 'zich naar']",6,15,1,"[0.6666666666666666, 0.35714285714285715]",0.51
seq11-0,large,"Het campagneteam van de Amerikaanse president Joe Biden heeft een nieuwe vacature: een meme-manager, die moet zorgen dat filmpjes en fotos die Biden aantrekkelijk maken voor jongeren viraal gaan.","Het campagneteam van de Amerikaanse president Joe Biden heeft een nieuwe vacature: een meme-manager, die moet zorgen dat filmpjes <extra_id_0> aantrekkelijk maken voor jongeren viraal gaan.","Het campagneteam van de Amerikaanse president Joe Biden heeft een nieuwe vacature: een meme-manager, die moet zorgen dat filmpjes die hem aantrekkelijk maken voor jongeren viraal gaan.",['en fotos die Biden'],['die hem'],4,15,1,[0.7222222222222222],0.72
seq12-0,large,"Hoe weet je of je bij de groep hoort die te veel betaalt voor een zorgverzekering? Meer dan de helft van de Nederlanders betaalt namelijk onnodig veel, blijkt uit onderzoek. Wat kun je hier tegen doen? Vijf veelgestelde vragen en antwoorden. ,,Veel mensen kiezen voor gemak en komen dan op een dure polis uit.","Hoe weet je of je <extra_id_0> groep hoort die te veel betaalt voor een zorgverzekering? Meer dan de helft van de Nederlanders betaalt namelijk onnodig veel, blijkt uit onderzoek. Wat kun je <extra_id_1> Vijf veelgestelde vragen <extra_id_2> mensen kiezen voor gemak en komen dan op een dure polis uit.","Hoe weet je of je bij de groep hoort die te veel betaalt voor een zorgverzekering? Meer dan de helft van de Nederlanders betaalt namelijk onnodig veel, blijkt uit onderzoek. Wat kun je hieraan doen? Vijf veelgestelde vragen Veel mensen kiezen voor gemak en komen dan op een dure polis uit.","['bij de', 'hier tegen doen?', 'en antwoorden. ,,Veel']","['bij de', 'hieraan doen?', 'Veel']",8,15,1,"[0.0, 0.3125, 0.8095238095238095]",0.37
seq13-0,large,"OpenAI, het bedrijf achter ChatGPT, schort een AI-stem op die sterk aan de stem van actrice Scarlett Johansson doet denken. Het bedrijf lijkt iets te veel inspiratie te hebben geput uit de film Her, waarvoor Johansson de stem van computersysteem Samantha insprak.","OpenAI, het bedrijf achter ChatGPT, schort een AI-stem op die sterk aan de stem van actrice Scarlett Johansson doet denken. Het bedrijf lijkt iets <extra_id_0> te hebben geput uit de film Her, waarvoor <extra_id_1> van computersysteem Samantha insprak.","OpenAI, het bedrijf achter ChatGPT, schort een AI-stem op die sterk aan de stem van actrice Scarlett Johansson doet denken. Het bedrijf lijkt iets uit te hebben geput uit de film Her, waarvoor Johansson de stem van computersysteem Samantha insprak.","['te veel inspiratie', 'Johansson de stem']","['uit', 'Johansson de stem']",6,15,1,"[0.8888888888888888, 0.0]",0.44
seq14-0,large,"De voorgenomen verhoging van de belasting toegevoegde waarde (btw) op cultuur, recreatie, boeken en periodieken maakt veel los bij de lezers. Vooral de hogere belasting op sportclubs en sportscholen roept veel vragen op. Economieredacteur Peet Vogels geeft antwoord.","De voorgenomen verhoging van de belasting toegevoegde waarde (btw) op cultuur, recreatie, boeken en periodieken maakt veel los bij de lezers. Vooral de hogere <extra_id_0> en sportscholen roept <extra_id_1> Economieredacteur Peet Vogels geeft antwoord.","De voorgenomen verhoging van de belasting toegevoegde waarde (btw) op cultuur, recreatie, boeken en periodieken maakt veel los bij de lezers. Vooral de hogere btw op scholen en sportscholen roept vragen op. Economieredacteur Peet Vogels geeft antwoord.","['belasting op sportclubs', 'veel vragen op.']","['btw op scholen', 'vragen op.']",6,15,1,"[0.6521739130434783, 0.3333333333333333]",0.49
seq15-0,large,"Sinds Raemon Sluiter de Oekraense Elina Svitolina coacht, heeft zijn baan een andere betekenis. Voor ons geldt: wij ontkomen er niet aan, de oorlog en de verdere wereld is dagelijkse realiteit.","Sinds Raemon Sluiter de Oekraense Elina Svitolina coacht, heeft zijn baan een andere betekenis. Voor ons geldt: wij ontkomen er niet aan, de <extra_id_0> de <extra_id_1> dagelijkse realiteit.","Sinds Raemon Sluiter de Oekraense Elina Svitolina coacht, heeft zijn baan een andere betekenis. Voor ons geldt: wij ontkomen er niet aan, de competitie is de enige dagelijkse realiteit.","['oorlog en', 'verdere wereld is']","['competitie is', 'enige']",5,15,1,"[0.8461538461538461, 0.8823529411764706]",0.86
seq16-0,large,"De Amerikaanse regering start een aantal mededingingsonderzoeken naar OpenAI, Nvidia en Microsoft vanwege mogelijk te vergaande dominantie van de markt van kunstmatige intelligentie (AI). Dat meldt de Amerikaanse krant The New York Times donderdag.","De Amerikaanse regering start een aantal mededingingsonderzoeken naar OpenAI, Nvidia en Microsoft vanwege mogelijk te vergaande <extra_id_0> markt van kunstmatige intelligentie <extra_id_1> meldt de Amerikaanse krant The New York Times donderdag.","De Amerikaanse regering start een aantal mededingingsonderzoeken naar OpenAI, Nvidia en Microsoft vanwege mogelijk te vergaande concurrentie in de markt van kunstmatige intelligentie Dat meldt de Amerikaanse krant The New York Times donderdag.","['dominantie van de', '(AI). Dat']","['concurrentie in de', 'Dat']",5,15,1,"[0.5, 0.6666666666666666]",0.58
seq17-0,large,"De pro-Palestijnse demonstrant die bij een protest op de Amsterdamse Roeterseilandcampus op televisieschermen insloeg, heeft een gevangenisstraf van 2 maanden gekregen, waarvan 1 maand voorwaardelijk.","De pro-Palestijnse demonstrant die bij een protest op de <extra_id_0> insloeg, heeft een gevangenisstraf van 2 maanden gekregen, waarvan 1 maand voorwaardelijk.","De pro-Palestijnse demonstrant die bij een protest op de rechter insloeg, heeft een gevangenisstraf van 2 maanden gekregen, waarvan 1 maand voorwaardelijk.",['Amsterdamse Roeterseilandcampus op televisieschermen'],['rechter'],4,15,1,[0.8846153846153846],0.88
seq18-0,large,"Wie wint Ronald Garros? Novak Djokovic, Jannik Sinner en Carlos Alcaraz zijn niet in vorm, om over Rafael Nadal maar te zwijgen. Mooie kans voor Daniil Medvedev, alleen houdt hij niet van gravel.","Wie wint Ronald Garros? Novak Djokovic, Jannik Sinner en Carlos Alcaraz <extra_id_0> vorm, om over Rafael Nadal maar te zwijgen. Mooie kans voor Daniil Medvedev, alleen houdt hij niet <extra_id_1>","Wie wint Ronald Garros? Novak Djokovic, Jannik Sinner en Carlos Alcaraz in vorm, om over Rafael Nadal maar te zwijgen. Mooie kans voor Daniil Medvedev, alleen houdt hij niet van winnen..","['zijn niet in', 'van gravel.']","['in', 'winnen..']",5,15,1,"[0.8333333333333334, 0.8181818181818182]",0.83
seq19-0,large,Onder de Nederlandse bevolking is weinig steun voor Israls oorlog in Gaza. Slechts eenvijfde van de bevolking vindt dat de Isralische bombardementen in Gaza nodig zijn om Hamas uit te schakelen.,Onder de Nederlandse bevolking is weinig steun voor Israls oorlog in Gaza. Slechts eenvijfde van de bevolking vindt dat de <extra_id_0> in Gaza nodig zijn om Hamas <extra_id_1>,Onder de Nederlandse bevolking is weinig steun voor Israls oorlog in Gaza. Slechts eenvijfde van de bevolking vindt dat de acties in Gaza nodig zijn om Hamas te verslaan.,"['Isralische bombardementen', 'uit te schakelen.']","['acties', 'verslaan.']",5,15,1,"[0.88, 0.7058823529411765]",0.79
seq20-0,large,In duizenden boeken over drugshandelaar Janus van Wesenbeeck moeten fotos worden zwartgemaakt. De afgelopen jaren kwam Van Wesenbeeck onder de aandacht vanwege de Netflix-hitserie Undercover.,In duizenden boeken over <extra_id_0> moeten fotos worden zwartgemaakt. De afgelopen jaren kwam Van Wesenbeeck onder de aandacht vanwege de Netflix-hitserie Undercover.,In duizenden boeken over de geschiedenis moeten fotos worden zwartgemaakt. De afgelopen jaren kwam Van Wesenbeeck onder de aandacht vanwege de Netflix-hitserie Undercover.,['drugshandelaar Janus van Wesenbeeck'],['de geschiedenis'],4,15,1,[0.8],0.8
seq21-0,large,Ook in het Caribische deel van het Nederlands Koninkrijk is GroenLinks-PvdA de grote winnaar geworden bij de Europese Parlementsverkiezingen.,Ook in het Caribische deel van <extra_id_0> is GroenLinks-PvdA de grote winnaar geworden bij de Europese Parlementsverkiezingen.,Ook in het Caribische deel van de EU is GroenLinks-PvdA de grote winnaar geworden bij de Europese Parlementsverkiezingen.,['het Nederlands Koninkrijk'],['de EU'],3,15,1,[0.88],0.88
seq22-0,large,"De terugroepactie van bakfietsfabrikant Babboe verloopt uiterst moeizaam. Van de 22.000 onveilige bakfietsen zijn er slechts 6000 opgehaald, waarvan ruim de helft in ons land. Pas 500 gedupeerde eigenaren ontvingen een nieuw exemplaar. Nog tienduizenden inspecties aan mogelijk onveilige bakfietsen moeten worden uitgevoerd. Babboe erkent alle problemen.","De terugroepactie van bakfietsfabrikant Babboe verloopt uiterst moeizaam. Van de 22.000 onveilige bakfietsen zijn er slechts 6000 opgehaald, waarvan ruim de helft in ons land. Pas 500 gedupeerde eigenaren ontvingen een nieuw exemplaar. Nog tienduizenden inspecties aan <extra_id_0> moeten worden uitgevoerd. <extra_id_1>","De terugroepactie van bakfietsfabrikant Babboe verloopt uiterst moeizaam. Van de 22.000 onveilige bakfietsen zijn er slechts 6000 opgehaald, waarvan ruim de helft in ons land. Pas 500 gedupeerde eigenaren ontvingen een nieuw exemplaar. Nog tienduizenden inspecties aan de fietsen moeten worden uitgevoerd. (ANP)","['mogelijk onveilige bakfietsen', 'Babboe erkent alle problemen.']","['de fietsen', '(ANP)']",7,15,1,"[0.6896551724137931, 1.0]",0.84
seq23-0,large,Niet eerder werden er in Nederland zo veel drugslabs ontmanteld als vorig jaar. Voor de Engelse drugsonderzoeker Steve Rolles is het opnieuw een aanwijzing dat het drugsbeleid radicaal op de schop moet.,Niet eerder werden er in Nederland zo veel drugslabs ontmanteld als vorig jaar. Voor de Engelse drugsonderzoeker Steve Rolles is het opnieuw een aanwijzing dat <extra_id_0> op <extra_id_1> moet.,Niet eerder werden er in Nederland zo veel drugslabs ontmanteld als vorig jaar. Voor de Engelse drugsonderzoeker Steve Rolles is het opnieuw een aanwijzing dat Nederland op de hoogte moet.,"['het drugsbeleid radicaal', 'de schop']","['Nederland', 'de hoogte']",5,15,1,"[0.7916666666666666, 0.6666666666666666]",0.73
seq24-0,large,Na uit de hand gelopen protesten werd de campus van de Universiteit van Amsterdam voor twee dagen ten dele gesloten. Nu lijkt de rust terug te keren.,Na uit de hand <extra_id_0> campus van de Universiteit van Amsterdam voor twee dagen ten dele gesloten. Nu lijkt de rust terug te keren.,Na uit de hand gelopen problemen was de campus van de Universiteit van Amsterdam voor twee dagen ten dele gesloten. Nu lijkt de rust terug te keren.,['gelopen protesten werd de'],['gelopen problemen was de'],4,15,1,[0.28],0.28
seq25-0,large,"Het COA, dat kampt met een structureel tekort aan opvangplekken, is zeer te spreken over de stap naar voren van Arnhem.","Het COA, dat kampt met <extra_id_0> aan opvangplekken, is zeer te spreken over de stap naar voren van Arnhem.","Het COA, dat kampt met een tekort aan opvangplekken, is zeer te spreken over de stap naar voren van Arnhem.",['een structureel tekort'],['een tekort'],3,15,1,[0.5454545454545454],0.55
seq26-0,large,Na een kletsnatte maandag volgt een veelal wisselvallige en frisse week. Aangezien we midden in de piek van het hooikoortsseizoen zitten is dat goed nieuws voor hooikoortspatinten.,Na een kletsnatte maandag volgt een veelal wisselvallige en <extra_id_0> midden in de piek van het hooikoortsseizoen zitten is dat goed nieuws voor hooikoortspatinten.,Na een kletsnatte maandag volgt een veelal wisselvallige en aangezien we midden in de piek van het hooikoortsseizoen zitten is dat goed nieuws voor hooikoortspatinten.,['frisse week. Aangezien we'],['aangezien we'],4,15,1,[0.56],0.56
seq27-0,large,"Fabrikanten halen geneesmiddelen van de Nederlandse markt, waardoor er steeds minder alternatieven beschikbaar zijn om de aanhoudende medicijntekorten op te lossen. Dat blijkt uit onderzoek van de NOS.","Fabrikanten halen <extra_id_0> markt, waardoor er steeds minder alternatieven beschikbaar zijn om de aanhoudende medicijntekorten op te lossen. Dat blijkt uit onderzoek van de NOS.","Fabrikanten halen steeds meer medicijnen op de markt, waardoor er steeds minder alternatieven beschikbaar zijn om de aanhoudende medicijntekorten op te lossen. Dat blijkt uit onderzoek van de NOS.",['geneesmiddelen van de Nederlandse'],['steeds meer medicijnen op de'],4,15,1,[0.7575757575757576],0.76
seq28-0,large,"Dubbele seksuele moraal is achterhaald, laat vrouwen ook kinderen hebben bij verschillende mensen","Dubbele seksuele moraal is achterhaald, laat vrouwen <extra_id_0> hebben bij verschillende mensen","Dubbele seksuele moraal is achterhaald, laat vrouwen zich beter horen en gevoel hebben bij verschillende mensen",['ook kinderen'],['zich beter horen en gevoel'],2,15,1,[0.8461538461538461],0.85
seq29-0,large,"Kabosu, de Japanse Shiba Inu wier beeltenis de wereld overging als meme, is vrijdagochtend overleden. De hond was het symbool van de als grap bedoelde cryptomunt dogecoin, waarvan het totaal aantal munten in 2021 ruim 80 miljard euro waard was.","Kabosu, de Japanse Shiba Inu <extra_id_0> wereld overging als meme, is vrijdagochtend overleden. De hond was het symbool van de als grap bedoelde cryptomunt dogecoin, waarvan het totaal aantal munten in 2021 ruim 80 <extra_id_1> was.","Kabosu, de Japanse Shiba Inu die de wereld overging als meme, is vrijdagochtend overleden. De hond was het symbool van de als grap bedoelde cryptomunt dogecoin, waarvan het totaal aantal munten in 2021 ruim 80 miljoen was.","['wier beeltenis de', 'miljard euro waard']","['die de', 'miljoen']",6,15,1,"[0.7058823529411765, 0.7222222222222222]",0.71
seq30-0,large,Het Openbaar Ministerie heeft een nieuwe kroongetuige gepresenteerd. Het gaat om de 29-jarige Dominique K.,Het Openbaar Ministerie heeft een nieuwe kroongetuige gepresenteerd. <extra_id_0> om de 29-jarige Dominique K.,Het Openbaar Ministerie heeft een nieuwe kroongetuige gepresenteerd. Het gaat om de 29-jarige Dominique K.,['Het gaat'],['Het gaat'],2,15,1,[0.0],0.0
seq31-0,large,Daan en het ongelijk van de rommelmarktheks Uren samen spelen is verruild voor me-time op eigen kamers. Daan Rot schrijft in weekendmagazine Mezza wekelijks over zijn persoonlijk leven,Daan en het ongelijk van de rommelmarktheks Uren samen spelen is verruild voor me-time op eigen kamers. Daan Rot schrijft in weekendmagazine Mezza wekelijks <extra_id_0>,Daan en het ongelijk van de rommelmarktheks Uren samen spelen is verruild voor me-time op eigen kamers. Daan Rot schrijft in weekendmagazine Mezza wekelijks over zijn nieuwe...,['over zijn persoonlijk leven'],['nieuwe...'],4,15,1,[0.8888888888888888],0.89
seq32-0,large,Het Eindhovense KMWE ziet als toeleverancier van het snelgroeiende ASML de orders binnenstromen. Al levert dat ook een probleem op: technisch personeel ligt niet voor het oprapen.,Het Eindhovense KMWE ziet als toeleverancier van het snelgroeiende ASML de orders binnenstromen. Al levert dat ook een <extra_id_0> ligt niet voor het oprapen.,Het Eindhovense KMWE ziet als toeleverancier van het snelgroeiende ASML de orders binnenstromen. Al levert dat ook een hoop winst op. De winst ligt niet voor het oprapen.,['probleem op: technisch personeel'],['hoop winst op. De winst'],4,15,1,[0.78125],0.78
seq33-0,large,Vijf jaar geleden trad de Europese Commissie onder leiding van Ursula von der Leyen aan. Het werd een periode van grote crises en onverwachte gebeurtenissen die een ferme reactie vereisten. Hoe deed de Commissie het?,Vijf jaar geleden trad de Europese Commissie onder leiding van Ursula von <extra_id_0> aan. Het werd een periode van grote crises <extra_id_1> die een ferme reactie vereisten. Hoe deed de Commissie het?,Vijf jaar geleden trad de Europese Commissie onder leiding van Ursula von der Leyen aan. Het werd een periode van grote crises die een ferme reactie vereisten. Hoe deed de Commissie het?,"['der Leyen', 'en onverwachte gebeurtenissen']","['der Leyen', '']",5,15,1,"[0.0, 1.0]",0.5
seq34-0,large,Cees Dekker | hoogleraar biofysica Hoe is het leven ontstaan? Synthetische cellen maken dat inzichtelijk. Als je zoiets zelf bouwt ga je begrijpen hoe het werkt.,Cees Dekker | hoogleraar biofysica Hoe is het leven ontstaan? Synthetische cellen maken dat inzichtelijk. Als <extra_id_0> ga je begrijpen hoe het werkt.,Cees Dekker | hoogleraar biofysica Hoe is het leven ontstaan? Synthetische cellen maken dat inzichtelijk. Als je ze ziet ga je begrijpen hoe het werkt.,['je zoiets zelf bouwt'],['je ze ziet'],4,15,1,[0.6],0.6
seq35-0,large,"Een jong meisje werd door drie jongens meegenomen naar een huis en daar de hele nacht misbruikt. Maar het beeld van deze zaak, die eerst helder leek, begon te kantelen toen de politie de telefoons doorzocht.","Een jong meisje werd <extra_id_0> meegenomen naar een huis en daar de hele nacht misbruikt. Maar het beeld van deze zaak, die eerst helder leek, <extra_id_1> kantelen toen de politie de telefoons doorzocht.","Een jong meisje werd door een meisje meegenomen naar een huis en daar de hele nacht misbruikt. Maar het beeld van deze zaak, die eerst helder leek, ging kantelen toen de politie de telefoons doorzocht.","['door drie jongens', 'begon te']","['door een meisje', 'ging']",5,15,1,"[0.6470588235294118, 0.75]",0.7
