seq36-0,large,"Het Amsterdamse Waternet, verantwoordelijk voor schoon drinkwater n het onderhoud van dijken en gemalen in het grootste waterschap van Nederland, moet worden opgesplitst. Er komen aparte organisaties voor beide taken.","Het Amsterdamse Waternet, verantwoordelijk voor schoon drinkwater n het onderhoud van dijken en gemalen in het grootste waterschap van Nederland, moet <extra_id_0> aparte organisaties voor beide taken.","Het Amsterdamse Waternet, verantwoordelijk voor schoon drinkwater n het onderhoud van dijken en gemalen in het grootste waterschap van Nederland, moet gaan werken met aparte organisaties voor beide taken.",['worden opgesplitst. Er komen'],['gaan werken met'],4,15,1,[0.7857142857142857],0.79
seq37-0,large,"Nabestaanden van de slachtoffers van een massaschietpartij in een basisschool in de Amerikaanse staat Connecticut, in 2012, hebben vrijdag een vergoedingsvoorstel aanvaard van de failliete complotdenker Alex Jones. Hij bood aan zijn bezittingen te verkopen om hen in ieder geval gedeeltelijk te kunnen vergoeden voor zijn lasterlijke uitlatingen over het bloedbad.",Nabestaanden van de slachtoffers van een massaschietpartij in een basisschool in de Amerikaanse staat <extra_id_0> hebben vrijdag een vergoedingsvoorstel aanvaard van de failliete complotdenker Alex Jones. Hij bood aan zijn bezittingen te verkopen om hen in ieder geval gedeeltelijk te kunnen vergoeden <extra_id_1> lasterlijke uitlatingen <extra_id_2>,Nabestaanden van de slachtoffers van een massaschietpartij in een basisschool in de Amerikaanse staat Oklahoma hebben vrijdag een vergoedingsvoorstel aanvaard van de failliete complotdenker Alex Jones. Hij bood aan zijn bezittingen te verkopen om hen in ieder geval gedeeltelijk te kunnen vergoeden voor zijn lasterlijke uitlatingen tegen de slachtoffers.,"['Connecticut', 'in 2012,', 'voor zijn', 'over het bloedbad.']","['Oklahoma', 'voor zijn', 'slachtoffers.']",8,15,1,"[1.0, 1.0, 0.9230769230769231]",0.97
seq38-0,large,"Nog nooit kregen zo weinig babys borstvoeding. Er wordt te weinig ruimte voor gegeven, zeggen jonge moeders in Lelystad.",Nog nooit kregen zo weinig babys borstvoeding. Er wordt te weinig ruimte <extra_id_0> jonge moeders in Lelystad.,Nog nooit kregen zo weinig babys borstvoeding. Er wordt te weinig ruimte voor jonge moeders in Lelystad.,"['voor gegeven', 'zeggen']",['voor'],3,15,1,[0.6666666666666666],0.67
seq39-0,large,Amsterdamse huisartsen leggen patinten die niet op hun afspraak komen opdagen sinds kort boetes op. Zo hopen ze het aantal no-shows terug te dringen. Ook restaurants en kappers kampen met een groeiend aantal klanten dat niet komt opdagen.,Amsterdamse huisartsen leggen patinten die niet op hun afspraak komen opdagen sinds kort boetes op. Zo hopen ze het aantal no-shows terug te <extra_id_0> en kappers kampen met een groeiend <extra_id_1> niet komt opdagen.,Amsterdamse huisartsen leggen patinten die niet op hun afspraak komen opdagen sinds kort boetes op. Zo hopen ze het aantal no-shows terug te dringen. Ook schoonheidsspecialisten en kappers kampen met een groeiend aantal klanten dat niet komt opdagen.,"['dringen. Ook restaurants', 'aantal klanten dat']","['dringen. Ook schoonheidsspecialisten', 'aantal klanten dat']",6,15,1,"[0.5277777777777778, 0.0]",0.26
seq40-0,large,"Het Openbaar Ministerie heeft een nieuwe kroongetuige gepresenteerd. Het gaat om de 29-jarige Dominique K. Hij heeft openheid van zaken gegeven over moorden en geweldszaken in Amsterdam en Rotterdam uit 2020 en 2021. De gewelddadigheden houden verband met een vete in de onderwereld, waarbij een bedrag van 130 miljoen euro zou zijn gestolen.","Het Openbaar Ministerie heeft <extra_id_0> gepresenteerd. Het gaat om de 29-jarige Dominique K. Hij heeft openheid van <extra_id_1> over moorden en geweldszaken in Amsterdam en <extra_id_2> en 2021. De gewelddadigheden houden verband met een vete in de onderwereld, waarbij een bedrag van 130 miljoen euro zou zijn gestolen.","Het Openbaar Ministerie heeft een nieuwe zaak gepresenteerd. Het gaat om de 29-jarige Dominique K. Hij heeft openheid van zaken moeten vragen over moorden en geweldszaken in Amsterdam en Rotterdam tussen 2016 en 2021. De gewelddadigheden houden verband met een vete in de onderwereld, waarbij een bedrag van 130 miljoen euro zou zijn gestolen.","['een nieuwe kroongetuige', 'zaken gegeven', 'Rotterdam uit 2020']","['een nieuwe zaak', 'zaken moeten vragen', 'Rotterdam tussen 2016']",8,15,1,"[0.5217391304347826, 0.42105263157894735, 0.3333333333333333]",0.43
seq41-0,large,"Stormen, flinke regenval en overstromingen teisteren het zuidoosten van Oostenrijk. Auto's worden meegesleurd door het wassende water en tientallen mensen zijn gered uit levensgevaarlijke situaties, aldus de hulpdiensten. Stembureaus voor de Europese verkiezingen zijn verwoest of onbereikbaar. De autoriteiten hebben een burgerbeschermingsalarm afgekondigd, nu zondagmiddag meer noodweer wordt verwacht.","Stormen, flinke regenval en overstromingen teisteren het zuidoosten van Oostenrijk. Auto's worden meegesleurd door het <extra_id_0> tientallen mensen zijn gered uit levensgevaarlijke situaties, aldus de hulpdiensten. <extra_id_1> verkiezingen zijn verwoest of onbereikbaar. De autoriteiten hebben een burgerbeschermingsalarm afgekondigd, nu zondagmiddag meer noodweer wordt verwacht.","Stormen, flinke regenval en overstromingen teisteren het zuidoosten van Oostenrijk. Auto's worden meegesleurd door het water, tientallen mensen zijn gered uit levensgevaarlijke situaties, aldus de hulpdiensten. Ook plaatsen voor verkiezingen zijn verwoest of onbereikbaar. De autoriteiten hebben een burgerbeschermingsalarm afgekondigd, nu zondagmiddag meer noodweer wordt verwacht.","['wassende water en', 'Stembureaus voor de Europese']","['water,', 'Ook plaatsen voor']",7,15,1,"[0.7058823529411765, 0.8214285714285714]",0.76
seq42-0,large,"China plant een golf aan nieuwe ruimtemissies naar planetoden. Voor de wetenschap en om grondstoffen te winnen. Maar hoe leg je daar aan? Met borende pootjes, lassos of toch weer een harpoen?","China plant een golf aan nieuwe ruimtemissies naar planetoden. Voor de wetenschap en om grondstoffen te winnen. <extra_id_0> leg je daar aan? Met borende pootjes, lassos of toch <extra_id_1>","China plant een golf aan nieuwe ruimtemissies naar planetoden. Voor de wetenschap en om grondstoffen te winnen. Hoe leg je daar aan? Met borende pootjes, lassos of toch met een drone?","['Maar hoe', 'weer een harpoen?']","['Hoe', 'drone?']",5,15,1,"[0.75, 0.7647058823529411]",0.76
seq43-0,large,"Restaurantketen La Place koppelt zich los van Jumbo, maar de supermarkt blijft vooralsnog wel verbonden als aandeelhouder. Ook producten van La Place blijven te koop in de supermarkt.","Restaurantketen La Place koppelt zich los van Jumbo, maar de supermarkt blijft vooralsnog wel verbonden als aandeelhouder. Ook producten <extra_id_0> te koop in de supermarkt.","Restaurantketen La Place koppelt zich los van Jumbo, maar de supermarkt blijft vooralsnog wel verbonden als aandeelhouder. Ook producten van La Place zijn te koop in de supermarkt.",['van La Place blijven'],['van La Place zijn'],4,15,1,[0.2],0.2
seq44-0,large,Na een kletsnatte maandag volgt een veelal wisselvallige en frisse week. Aangezien we midden in de piek van het hooikoortsseizoen zitten is dat goed nieuws voor hooikoortspatinten.,Na een kletsnatte maandag volgt een veelal wisselvallige en frisse week. Aangezien we midden in de piek van het hooikoortsseizoen zitten is <extra_id_0> hooikoortspatinten.,Na een kletsnatte maandag volgt een veelal wisselvallige en frisse week. Aangezien we midden in de piek van het hooikoortsseizoen zitten is het tijd voor hooikoortspatinten.,['dat goed nieuws voor'],['het tijd voor'],4,15,1,[0.6],0.6
seq45-0,large,Inbrekers hebben afgelopen nacht voor ongeveer een half miljoen euro aan juwelen buitgemaakt bij de luxe juwelier Bulgari in Rome.,Inbrekers hebben afgelopen nacht voor ongeveer een <extra_id_0> aan juwelen buitgemaakt bij de luxe juwelier Bulgari in Rome.,Inbrekers hebben afgelopen nacht voor ongeveer een miljoen euro aan juwelen buitgemaakt bij de luxe juwelier Bulgari in Rome.,['half miljoen euro'],['miljoen euro'],3,15,1,[0.29411764705882354],0.29
seq46-0,large,"Vattenfall verwacht de komende jaren veel minder mensen op het warmtenet aan te sluiten dan aanvankelijk het plan was. Het energiebedrijf heeft zijn doelstelling gehalveerd tot tussen de 6000 en 7000 nieuwe aansluitingen per jaar, uit onzekerheid over de markt en het beleid van de overheid.","Vattenfall verwacht de komende jaren veel minder mensen op het warmtenet aan te sluiten dan aanvankelijk het plan was. Het energiebedrijf heeft zijn <extra_id_0> de 6000 en 7000 nieuwe aansluitingen per jaar, uit <extra_id_1> markt en het beleid van de overheid.","Vattenfall verwacht de komende jaren veel minder mensen op het warmtenet aan te sluiten dan aanvankelijk het plan was. Het energiebedrijf heeft zijn prognose, tussen de 6000 en 7000 nieuwe aansluitingen per jaar, uit door de markt en het beleid van de overheid.","['doelstelling gehalveerd tot tussen', 'onzekerheid over de']","['prognose, tussen', 'door de']",7,15,1,"[0.7352941176470589, 0.6842105263157895]",0.71
seq47-0,large,De totale waarde van de export van Made in Holland-producten is vorig jaar met ruim 5 procent gedaald ten opzichte van 2022.,De totale <extra_id_0> export van Made in Holland-producten is vorig jaar met ruim 5 procent gedaald ten opzichte van 2022.,De totale Nederlandse export van Made in Holland-producten is vorig jaar met ruim 5 procent gedaald ten opzichte van 2022.,['waarde van de'],['Nederlandse'],3,15,1,[0.6153846153846154],0.62
seq48-0,large,Amsterdamse huisartsen leggen patinten die niet op hun afspraak komen opdagen sinds kort boetes op. Zo hopen ze het aantal no-shows terug te dringen. Ook restaurants en kappers kampen met een groeiend aantal klanten dat niet komt opdagen.,Amsterdamse huisartsen leggen patinten die niet op <extra_id_0> opdagen sinds kort boetes op. Zo hopen ze het aantal no-shows terug te dringen. <extra_id_1> kappers kampen met een groeiend aantal klanten dat niet komt opdagen.,Amsterdamse huisartsen leggen patinten die niet op hun spreekuur komen opdagen sinds kort boetes op. Zo hopen ze het aantal no-shows terug te dringen. Ook kappers kampen met een groeiend aantal klanten dat niet komt opdagen.,"['hun afspraak komen', 'Ook restaurants en']","['hun spreekuur komen', 'Ook']",6,15,1,"[0.3684210526315789, 0.8333333333333334]",0.6
seq49-0,large,"De Haagse buurttuin van Janneke Vreugdenhil is een democratie: iedereen heeft een zegje, iedereen een taak. En vervolgens loopt alles altijd anders.",De Haagse buurttuin van Janneke Vreugdenhil is een democratie: iedereen heeft een <extra_id_0> taak. En vervolgens loopt alles altijd anders.,De Haagse buurttuin van Janneke Vreugdenhil is een democratie: iedereen heeft een vrije taak. En vervolgens loopt alles altijd anders.,"['zegje', 'iedereen een']",['vrije'],3,15,1,[0.6],0.6
seq50-0,large,Vijf jaar na de stikstofuitspraak van de Raad van State is een oplossing van het probleem nog lang niet in zicht.,Vijf jaar na de stikstofuitspraak van de Raad van State is een oplossing <extra_id_0> nog lang niet in zicht.,Vijf jaar na de stikstofuitspraak van de Raad van State is een oplossing voor de problemen nog lang niet in zicht.,['van het probleem'],['voor de problemen'],3,15,1,[0.4117647058823529],0.41
seq51-0,large,"Naar aanleiding van de grote hoeveelheid pfas in eieren rond de fabriek van Chemours in Dordrecht, start het RIVM een nieuw onderzoek.","Naar aanleiding van de grote hoeveelheid pfas in eieren rond de <extra_id_0> in Dordrecht, start het RIVM een nieuw onderzoek.","Naar aanleiding van de grote hoeveelheid pfas in eieren rond de slacht in Dordrecht, start het RIVM een nieuw onderzoek.",['fabriek van Chemours'],['slacht'],3,15,1,[0.9],0.9
seq52-0,large,"Nederlanders douchen steeds meer, liefst twee keer per dag, met warm water en veel sop.","<extra_id_0> steeds meer, liefst twee keer per dag, met warm water en veel sop.","En steeds meer, liefst twee keer per dag, met warm water en veel sop.",['Nederlanders douchen'],['En'],2,15,1,[0.95],0.95
seq53-0,large,"Huisfeestje, de samenwerking tussen Roxy Dekker en jongensgroep Bankzitters, is anderhalve dag na lancering al een hit op de streamingdiensten. Op Spotify kwam het nummer zelfs dicht bij een record.","Huisfeestje, de samenwerking tussen Roxy <extra_id_0> is anderhalve dag na lancering al een hit op de streamingdiensten. Op Spotify kwam het nummer zelfs dicht bij een record.","Huisfeestje, de samenwerking tussen Roxy en Calvin Harris, is anderhalve dag na lancering al een hit op de streamingdiensten. Op Spotify kwam het nummer zelfs dicht bij een record.","['Dekker en jongensgroep Bankzitters,']","['en Calvin Harris,']",4,15,1,[0.7428571428571429],0.74
seq54-0,large,"Bijna een op de zeven Nederlandse patinten is aangewezen op gemporteerde medicijnen, omdat er in Nederland een tekort aan is. Experts maken zich ernstig zorgen, vooral om laatste redmiddelen.","Bijna een op de zeven Nederlandse patinten is aangewezen op gemporteerde medicijnen, omdat <extra_id_0> tekort aan is. Experts maken zich ernstig zorgen, vooral om laatste redmiddelen.","Bijna een op de zeven Nederlandse patinten is aangewezen op gemporteerde medicijnen, omdat er in de apotheek een tekort aan is. Experts maken zich ernstig zorgen, vooral om laatste redmiddelen.",['er in Nederland een'],['er in de apotheek een'],4,15,1,[0.47619047619047616],0.48
seq55-0,large,"Tallon Griekspoor neemt het dinsdag in de eerste ronde van Roland Garros op tegen de Amerikaan MacKenzie McDonald. Niemand die de Nederlandse tennisser beter kent dan zijn coach Kristof Vliegen. Ze zijn heel, heel close, misschien af en toe zelfs iets te close.","Tallon Griekspoor neemt het dinsdag in de <extra_id_0> Roland Garros op tegen de Amerikaan MacKenzie McDonald. Niemand die de <extra_id_1> kent dan zijn coach Kristof Vliegen. Ze zijn heel, heel close, misschien af en toe zelfs iets te close.","Tallon Griekspoor neemt het dinsdag in de finale van Roland Garros op tegen de Amerikaan MacKenzie McDonald. Niemand die de mannen beter kent dan zijn coach Kristof Vliegen. Ze zijn heel, heel close, misschien af en toe zelfs iets te close.","['eerste ronde van', 'Nederlandse tennisser beter']","['finale van', 'mannen beter']",6,15,1,"[0.6875, 0.6296296296296297]",0.66
seq56-0,large,"Alsof het leven er al niet erbarmelijk genoeg is, werd de Keniaanse sloppenwijk Mathare eind april getroffen door een zware overstroming. Honderden huisjes van golfplaat en sloophout verdwenen in de kolkende modderstroom, evenals twee van de tien scholen waar de kleine Amersfoortse stichting Mathare Girl Power al jaren hulp biedt.","Alsof het leven er al <extra_id_0> genoeg is, werd de Keniaanse <extra_id_1> april getroffen door een zware overstroming. Honderden huisjes van golfplaat en sloophout verdwenen in de kolkende modderstroom, evenals <extra_id_2> tien scholen waar de kleine Amersfoortse stichting Mathare Girl Power al jaren hulp biedt.","Alsof het leven er al niet genoeg is, werd de Keniaanse stad Mathare in april getroffen door een zware overstroming. Honderden huisjes van golfplaat en sloophout verdwenen in de kolkende modderstroom, evenals de tien scholen waar de kleine Amersfoortse stichting Mathare Girl Power al jaren hulp biedt.","['niet erbarmelijk', 'sloppenwijk Mathare eind', 'twee van de']","['niet', 'stad Mathare in', 'de']",8,15,1,"[0.75, 0.5, 0.8181818181818182]",0.69
seq57-0,large,"De helft van de gepakte online boeven die zich voor de rechter moeten verantwoorden, is niet ouder dan 25 jaar. Ze maakten zich onder meer schuldig aan bankfraude en online oplichting.","De helft van de gepakte online boeven die zich voor de rechter moeten verantwoorden, is niet ouder dan 25 jaar. Ze maakten <extra_id_0> meer schuldig <extra_id_1> online oplichting.","De helft van de gepakte online boeven die zich voor de rechter moeten verantwoorden, is niet ouder dan 25 jaar. Ze maakten zich in de afgelopen jaren meer schuldig aan online oplichting.","['zich onder', 'aan bankfraude en']","['zich in de afgelopen jaren', 'aan']",5,15,1,"[0.6538461538461539, 0.8235294117647058]",0.74
seq58-0,large,"Netbeheerder Tennet heeft met de aanleg van een stroomkabel mogelijk onomkeerbare schade aangebracht aan kwetsbare natuur op landgoed Twickel, concludeerde de provincie Overijssel donderdag. In Twente is te zien hoe klimaatdoelen botsen met de natuuropgave.","Netbeheerder Tennet <extra_id_0> de aanleg van een stroomkabel mogelijk onomkeerbare schade aangebracht aan kwetsbare natuur op landgoed Twickel, concludeerde de provincie Overijssel donderdag. In Twente is te zien <extra_id_1> met de natuuropgave.","Netbeheerder Tennet is door de aanleg van een stroomkabel mogelijk onomkeerbare schade aangebracht aan kwetsbare natuur op landgoed Twickel, concludeerde de provincie Overijssel donderdag. In Twente is te zien dat de werkzaamheden hebben te maken met de natuuropgave.","['heeft met', 'hoe klimaatdoelen botsen']","['is door', 'dat de werkzaamheden hebben te maken']",5,15,1,"[1.0, 0.6944444444444444]",0.85
seq59-0,large,"Vlak voor Karien van Gennip afzwaait als minister, kondigt ze een aantal maatregelen af die arbeidsmigranten beter moeten beschermen. De cowboys moeten zich netter gedragen.","Vlak voor Karien van Gennip afzwaait als minister, kondigt ze een aantal maatregelen af <extra_id_0> beschermen. De cowboys moeten zich netter gedragen.","Vlak voor Karien van Gennip afzwaait als minister, kondigt ze een aantal maatregelen af om de cowboys te beschermen. De cowboys moeten zich netter gedragen.",['die arbeidsmigranten beter moeten'],['om de cowboys te'],4,15,1,[0.8181818181818182],0.82
seq60-0,large,De Conservatieve Britse premier Sunak schreef twee weken geleden onverwachts verkiezingen uit. De campagnestrijd met Labour ging meteen volop van start. Maandag kwam Nigel Farage met een verrassing: hij doet alsnog mee.,De Conservatieve Britse premier Sunak schreef twee weken <extra_id_0> verkiezingen <extra_id_1> met Labour ging meteen volop van start. Maandag kwam Nigel Farage met een verrassing: hij doet alsnog mee.,De Conservatieve Britse premier Sunak schreef twee weken geleden de verkiezingen uit. De strijd met Labour ging meteen volop van start. Maandag kwam Nigel Farage met een verrassing: hij doet alsnog mee.,"['geleden onverwachts', 'uit. De campagnestrijd']","['geleden de', 'uit. De strijd']",5,15,1,"[0.5263157894736842, 0.36363636363636365]",0.44
seq61-0,large,"De nieuwe bestuursvoorzitter van de Universiteit van Amsterdam, Edith Hooge, staat bekend om haar inhoudelijke kennis. Een ingetogen academicus, die aantreedt in een tijd van pro-Palestijnse studentenprotesten. Is zij de daadkrachtige verbinder waarnaar de universiteit en studenten op zoek zijn?","De nieuwe bestuursvoorzitter van de Universiteit van Amsterdam, Edith Hooge, staat bekend om haar inhoudelijke kennis. Een ingetogen academicus, die aantreedt in een tijd van pro-Palestijnse studentenprotesten. Is <extra_id_0> verbinder waarnaar de universiteit <extra_id_1> zoek zijn?","De nieuwe bestuursvoorzitter van de Universiteit van Amsterdam, Edith Hooge, staat bekend om haar inhoudelijke kennis. Een ingetogen academicus, die aantreedt in een tijd van pro-Palestijnse studentenprotesten. Is zij de verbinder waarnaar de universiteit op zoek zijn?","['zij de daadkrachtige', 'en studenten op']","['zij de', 'op']",6,15,1,"[0.7, 0.8666666666666667]",0.78
seq62-0,large,"Novak Djokovic heeft zich geplaatst voor de vierde ronde (achtste finales) op Roland Garros, maar de nummer 1 van de wereld moest er lang op wachten. Het publiek ook: de laatste bal vloog pas zondagnacht om 6 minuten over 3 over het net.",Novak Djokovic heeft zich geplaatst voor de vierde ronde (achtste finales) op <extra_id_0> de nummer 1 van de wereld moest er lang op wachten. Het publiek ook: de laatste bal vloog pas zondagnacht om 6 minuten <extra_id_1> het net.,Novak Djokovic heeft zich geplaatst voor de vierde ronde (achtste finales) op de Australian Open. Maar de nummer 1 van de wereld moest er lang op wachten. Het publiek ook: de laatste bal vloog pas zondagnacht om 6 minuten op het net.,"['Roland Garros', 'maar', 'over 3 over']","['de Australian Open. Maar', 'op']",6,15,1,"[0.8333333333333334, 1.0]",0.92
seq63-0,large,"Jongeren missen cruciale hulp omdat functionarissen zonder expertise louter naar kosten kijken, zegt Marie-Lies van Steenderen.","<extra_id_0> cruciale hulp omdat functionarissen zonder expertise louter naar kosten kijken, zegt Marie-Lies van Steenderen.","Het is cruciale hulp omdat functionarissen zonder expertise louter naar kosten kijken, zegt Marie-Lies van Steenderen.",['Jongeren missen'],['Het is'],2,15,1,[0.7333333333333333],0.73
seq64-0,large,Ze zorgen al lange tijd voor grote problemen op verschillende plekken in Utrecht: drugsgebruikers op straat.,Ze zorgen al lange <extra_id_0> grote problemen op verschillende plekken in Utrecht: drugsgebruikers op straat.,Ze zorgen al lange tijd voor grote problemen op verschillende plekken in Utrecht: drugsgebruikers op straat.,['tijd voor'],['tijd voor'],2,15,1,[0.0],0.0
seq65-0,large,"Met AI Overview, een nieuwe manier van Google om te zoeken, zouden consumenten kwalitatief hoogwaardige antwoorden op hun vragen moeten krijgen. Maar de zoekmachine blijkt soms verbijsterende blunders te maken.","Met AI Overview, een nieuwe manier van Google om te zoeken, zouden consumenten kwalitatief hoogwaardige antwoorden op hun vragen moeten krijgen. Maar de zoekmachine blijkt soms <extra_id_0>","Met AI Overview, een nieuwe manier van Google om te zoeken, zouden consumenten kwalitatief hoogwaardige antwoorden op hun vragen moeten krijgen. Maar de zoekmachine blijkt soms te moeilijk.",['verbijsterende blunders te maken.'],['moeilijk.'],4,15,1,[0.8787878787878788],0.88
seq66-0,large,"De volgverkeerslichten kunnen persoonlijke gegevens van mensen verzamelen, onder meer via apps op smartphones. De Autoriteit Persoonsgegevens maakt zich zorgen.","De volgverkeerslichten kunnen persoonlijke <extra_id_0> verzamelen, onder meer via apps op smartphones. De Autoriteit Persoonsgegevens maakt zich zorgen.","De volgverkeerslichten kunnen persoonlijke gegevens verzamelen, onder meer via apps op smartphones. De Autoriteit Persoonsgegevens maakt zich zorgen.",['gegevens van mensen'],['gegevens'],3,15,1,[0.5789473684210527],0.58
seq67-0,large,De rectores magnifici van vijftien Nederlandse universiteiten schrijven de banden met Isralische universiteiten niet te willen verbreken.,De rectores magnifici van vijftien <extra_id_0> de banden met Isralische universiteiten niet te willen verbreken.,De rectores magnifici van vijftien universiteiten de banden met Isralische universiteiten niet te willen verbreken.,['Nederlandse universiteiten schrijven'],['universiteiten'],3,15,1,[0.6111111111111112],0.61
seq68-0,large,"Honderden paginas aan ambtelijk commentaar op het Hoofdlijnenakkoord van PVV, VVD, NSC en BBB zijn vrijgegeven. Er zijn grote vraagtekens op allerlei terreinen, van het buitenlandbeleid en defensie tot landbouw en sociale zekerheid.","Honderden paginas aan ambtelijk commentaar op <extra_id_0> van PVV, VVD, NSC en BBB zijn vrijgegeven. Er zijn <extra_id_1> allerlei terreinen, van het buitenlandbeleid en defensie tot landbouw en sociale zekerheid.","Honderden paginas aan ambtelijk commentaar op stukken van PVV, VVD, NSC en BBB zijn vrijgegeven. Er zijn analyses op allerlei terreinen, van het buitenlandbeleid en defensie tot landbouw en sociale zekerheid.","['het Hoofdlijnenakkoord', 'grote vraagtekens op']","['stukken', 'analyses op']",5,15,1,"[0.8636363636363636, 0.7]",0.78
seq69-0,large,Duitsland Voor de vierde keer dit jaar bezocht de Duitse kanselier Olaf Scholz een overstromingsgebied. De verwoestende overstromingen in Beieren en Baden-Wrttemberg roepen bij sommigen de vraag op of Duitsland te passief reageert op dergelijke rampen.,Duitsland Voor de vierde keer dit jaar bezocht de Duitse kanselier <extra_id_0> overstromingsgebied. De verwoestende overstromingen in Beieren en Baden-Wrttemberg roepen bij sommigen de vraag op of Duitsland te passief <extra_id_1> dergelijke rampen.,Duitsland Voor de vierde keer dit jaar bezocht de Duitse kanselier het overstromingsgebied. De verwoestende overstromingen in Beieren en Baden-Wrttemberg roepen bij sommigen de vraag op of Duitsland te passief is bij dergelijke rampen.,"['Olaf Scholz een', 'reageert op']","['het', 'is bij']",5,15,1,"[0.8666666666666667, 1.0]",0.93
seq70-0,large,Ionica Smeets beantwoordt lezersvragen met wiskunde. Deze keer: valt te voorspellen hoe lang je nog leeft als je zes jaar geleden de diagnose uitgezaaide prostaatkanker hebt gekregen?,Ionica Smeets beantwoordt lezersvragen met wiskunde. Deze keer: valt te voorspellen hoe lang je nog leeft <extra_id_0> geleden de diagnose uitgezaaide prostaatkanker hebt gekregen?,Ionica Smeets beantwoordt lezersvragen met wiskunde. Deze keer: valt te voorspellen hoe lang je nog leeft als je een jaar geleden de diagnose uitgezaaide prostaatkanker hebt gekregen?,['als je zes jaar'],['als je een jaar'],4,15,1,[0.13333333333333333],0.13
seq71-0,large,Nergens in Nederland komt zoveel huiselijk geweld voor als in Rotterdam. Wie zijn de verdachten? Deze site keek mee in de rechtbank en sprak een rechter die al honderden gewelddadige mannen in de ogen keek.,Nergens in Nederland komt zoveel huiselijk geweld voor <extra_id_0> Rotterdam. Wie zijn de verdachten? Deze site keek mee in de rechtbank en sprak een rechter <extra_id_1> gewelddadige mannen in de ogen keek.,Nergens in Nederland komt zoveel huiselijk geweld voor als in Rotterdam. Wie zijn de verdachten? Deze site keek mee in de rechtbank en sprak een rechter die de gewelddadige mannen in de ogen keek.,"['als in', 'die al honderden']","['als in', 'die de']",5,15,1,"[0.0, 0.625]",0.31
