Sequence id,Model size,Input sequence (ground truth),Input sequence (masked),Model output sequence,Masked tokens,Filled tokens,Number of masked tokens,Masking percentage,Duplicate count,Levenshtein distances,Levenshtein distance (avg)
seq0-0,xl,.  Thijmen Geluk SalarisHoeveel verdien je? Dat vragen we elke week aan een Nederlander. Vandaag:,. Thijmen Geluk SalarisHoeveel verdien je? Dat vragen we <extra_id_0> aan een Nederlander. Vandaag:,. Thijmen Geluk SalarisHoeveel verdien je? Dat vragen we gemiddeld aan een Nederlander. Vandaag:,['elke week'],['gemiddeld'],2,15,19,[0.8888888888888888],0.89
seq1-0,xl,Meld je aan voor de AD sportnieuwsbrief en ontvang dagelijks een overzicht van het belangrijkste sportnieuws,Meld je aan voor <extra_id_0> sportnieuwsbrief en ontvang dagelijks een overzicht van het belangrijkste sportnieuws,Meld je aan voor de sportnieuwsbrief en ontvang dagelijks een overzicht van het belangrijkste sportnieuws,['de AD'],['de'],2,15,16,[0.6],0.6
seq2-0,xl,Fotograaf Nico Brons en verslaggever Wichard Maassen nemen wekelijks een kijkje achter het nieuws. Vandaag:,Fotograaf Nico Brons en verslaggever Wichard Maassen nemen wekelijks een kijkje achter <extra_id_0> Vandaag:,Fotograaf Nico Brons en verslaggever Wichard Maassen nemen wekelijks een kijkje achter de schermen. Vandaag:,['het nieuws.'],['de schermen.'],2,15,16,[0.75],0.75
seq3-0,xl,"Tip van de BaasWie beter dan de baas weet hoe het werkt op de werkvloer. Hoe je opvalt, wanneer je om meer loon vraagt en wat helpt om verder te komen. Zij geven hn beste tips. Vandaag:","Tip van de BaasWie <extra_id_0> baas weet hoe het werkt op de werkvloer. Hoe je opvalt, wanneer je om meer loon vraagt en wat helpt om verder te komen. Zij geven <extra_id_1> Vandaag:","Tip van de BaasWie is de baas? De baas weet hoe het werkt op de werkvloer. Hoe je opvalt, wanneer je om meer loon vraagt en wat helpt om verder te komen. Zij geven tips. Vandaag:","['beter dan de', 'hn beste tips.']","['is de baas? De', 'tips.']",6,15,14,"[0.7142857142857143, 0.6428571428571429]",0.68
seq4-0,xl,David en Arjan van 365dagensuccesvol.nl hebben n doel: Nederland het gelukkigste land van de wereld maken.,David en Arjan van 365dagensuccesvol.nl hebben n doel: Nederland het gelukkigste <extra_id_0> de wereld maken.,David en Arjan van 365dagensuccesvol.nl hebben n doel: Nederland het gelukkigste land van de wereld maken.,['land van'],['land van'],2,15,14,[0.0],0.0
seq5-0,xl,"De Nations League, de nieuwe Europese competitie voor landenteams, is de derde competitieronde ingegaan. Dit is het programma in League A en League B van deze en volgende week. Ook vermelden we hier komende week alle uitslagen, de stand n het programma van de belangrijkste oefeninterlands.","De Nations League, de nieuwe Europese competitie voor landenteams, is de derde competitieronde ingegaan. Dit is het programma in <extra_id_0> League B van deze en volgende week. Ook vermelden we hier komende week alle uitslagen, de stand n het programma <extra_id_1>","De Nations League, de nieuwe Europese competitie voor landenteams, is de derde competitieronde ingegaan. Dit is het programma in Nations League B van deze en volgende week. Ook vermelden we hier komende week alle uitslagen, de stand n het programma van de volgende ronde.","['League A en', 'van de belangrijkste oefeninterlands.']","['Nations', 'ronde.']",7,15,14,"[0.9090909090909091, 0.8648648648648649]",0.89
seq6-0,xl,"Het seizoen 2017-2018 is nog niet eens afgelopen, maar de voetbalwereld kijkt al volop naar het nieuwe seizoen. In onze TransferTalk houden we komende zomer alle geruchten en voltooide transfers bij.","Het seizoen 2017-2018 is nog niet eens afgelopen, maar de voetbalwereld <extra_id_0> het nieuwe seizoen. In onze TransferTalk houden we komende zomer alle geruchten en voltooide transfers bij.","Het seizoen 2017-2018 is nog niet eens afgelopen, maar de voetbalwereld is al begonnen aan de voorbereidingen voor het nieuwe seizoen. In onze TransferTalk houden we komende zomer alle geruchten en voltooide transfers bij.",['kijkt al volop naar'],['is al begonnen aan de voorbereidingen voor'],5,15,13,[0.8333333333333334],0.83
seq7-0,xl,"De beeldredactie ziet dagelijks duizenden nieuwsfotos. In deze rubriek worden de opvallendste, mooiste of meest bijzondere fotos geselecteerd. Klik op een van de beelden om deze te vergroten en er doorheen te bladeren. 1","De beeldredactie ziet dagelijks duizenden nieuwsfotos. In deze rubriek worden de opvallendste, mooiste of meest bijzondere fotos geselecteerd. Klik op een van de beelden om deze <extra_id_0> doorheen te bladeren. 1","De beeldredactie ziet dagelijks duizenden nieuwsfotos. In deze rubriek worden de opvallendste, mooiste of meest bijzondere fotos geselecteerd. Klik op een van de beelden om deze te bekijken of om er doorheen te bladeren. 1",['te vergroten en er'],['te bekijken of om er'],5,15,12,[0.55],0.55
seq8-0,xl,"Wijsheid komt met de jaren. Omdat acteur Joost Prinsen (77) een eind op weg is, beantwoordt hij uw vragen.","Wijsheid komt met de <extra_id_0> Joost Prinsen (77) een eind op weg is, beantwoordt hij uw vragen.","Wijsheid komt met de jaren. Nu Joost Prinsen (77) een eind op weg is, beantwoordt hij uw vragen.",['jaren. Omdat acteur'],['jaren. Nu'],3,15,12,[0.5789473684210527],0.58
seq9-0,xl,"De transfermarkt draait op volle toeren, maar veel clubs hebben al meerdere aanwinsten al binnen. In dit overzicht houden we alle inkomende en uitgaande transfers van de eredivisieclubs van deze zomer bij.","De transfermarkt draait op volle toeren, <extra_id_0> al meerdere aanwinsten al binnen. In dit overzicht houden we alle inkomende en uitgaande transfers van de eredivisieclubs van deze zomer bij.","De transfermarkt draait op volle toeren, en de clubs hebben al meerdere aanwinsten al binnen. In dit overzicht houden we alle inkomende en uitgaande transfers van de eredivisieclubs van deze zomer bij.",['maar veel clubs hebben'],['en de clubs hebben'],5,15,12,[0.3181818181818182],0.32
seq10-0,xl,"De eerste race van het seizoen zit er op, maar wanneer mogen we ons weer verheugen op Max Verstappen en co? Bekijk hieronder de F1-kalender en zie gelijk hoe laat de wekker gezet moet worden.","De eerste race <extra_id_0> er op, maar wanneer mogen we ons weer verheugen op Max Verstappen en co? Bekijk hieronder de F1-kalender en zie gelijk hoe laat de wekker gezet moet worden.","De eerste race van het nieuwe seizoen zit er op, maar wanneer mogen we ons weer verheugen op Max Verstappen en co? Bekijk hieronder de F1-kalender en zie gelijk hoe laat de wekker gezet moet worden.",['van het seizoen zit'],['van het nieuwe seizoen zit'],5,15,12,[0.2692307692307692],0.27
seq11-0,xl,"BN'er@homeNederland zit voorlopig vooral thuis en veel BNers dus ook. Wat lezen, luisteren of kijken zij om de dag door te komen? Vandaag geeft","BN'er@homeNederland zit voorlopig vooral thuis en veel BNers dus ook. Wat lezen, <extra_id_0> om de dag door te komen? Vandaag geeft","BN'er@homeNederland zit voorlopig vooral thuis en veel BNers dus ook. Wat lezen, wat doen ze om de dag door te komen? Vandaag geeft",['luisteren of kijken zij'],['wat doen ze'],4,15,11,[0.7391304347826086],0.74
seq12-0,xl,Het kabinet heeft in verband met het coronavirus drastische maatregelen genomen. Dit heeft ook gevolgen voor de Drechtsteden. Volg de ontwikkelingen in de regio in ons blog. In ons dossier vind je alle artikelen over het coronavirus in de Drechtsteden. Mist u iets? Tip de redactie: dd.redactie@ad.nl. 1,Het kabinet heeft in verband met het coronavirus drastische maatregelen genomen. <extra_id_0> voor de Drechtsteden. Volg de ontwikkelingen in de regio in ons blog. <extra_id_1> vind je alle artikelen over het coronavirus in de Drechtsteden. Mist u iets? Tip de redactie: dd.redactie@ad.nl. 1,Het kabinet heeft in verband met het coronavirus drastische maatregelen genomen. Ook voor de Drechtsteden. Volg de ontwikkelingen in de regio in ons blog. Hier vind je alle artikelen over het coronavirus in de Drechtsteden. Mist u iets? Tip de redactie: dd.redactie@ad.nl. 1,"['Dit heeft ook gevolgen', 'In ons dossier']","['Ook', 'Hier']",7,15,11,"[0.9090909090909091, 0.7857142857142857]",0.85
seq13-0,xl,"Deze zomer staat in het teken van onze Buitenkansjes! Speel elke dag mee voor nieuwe cadeaus. Van een Stella e-bike (t.w.v  2499,-) tot aan VVV cadeaukaarten, vouchers voor Fletcher Hotels of het e-book van Saskia Noort, je wilt niets missen.","Deze zomer staat in het teken van onze Buitenkansjes! Speel <extra_id_0> voor nieuwe cadeaus. Van een Stella e-bike (t.w.v 2499,-) tot aan VVV <extra_id_1> Fletcher Hotels of het e-book van Saskia Noort, je wilt niets missen.","Deze zomer staat in het teken van onze Buitenkansjes! Speel mee en maak kans voor nieuwe cadeaus. Van een Stella e-bike (t.w.v 2499,-) tot aan VVV Fletcher Hotels of het e-book van Saskia Noort, je wilt niets missen.","['elke dag mee', 'cadeaukaarten', 'vouchers voor']","['mee en maak kans', '']",6,15,11,"[0.6875, 1.0]",0.84
seq14-0,xl,. Meld je aan voor de AD sportnieuwsbrief en ontvang dagelijks een overzicht van het belangrijkste sportnieuws,. Meld je <extra_id_0> AD sportnieuwsbrief en ontvang dagelijks een overzicht van het belangrijkste sportnieuws,. Meld je aan voor de AD sportnieuwsbrief en ontvang dagelijks een overzicht van het belangrijkste sportnieuws,['aan voor de'],['aan voor de'],3,15,11,[0.0],0.0
seq15-0,xl,"Korte updates van de sterren op Facebook, Twitter, en Instagram - wij smullen ervan. In de rubriek Regiobytes struint de redactie het web voor je af voor de gekste, mooiste en opvallendste posts van BNers en celebritys.","Korte updates van de sterren op Facebook, Twitter, en Instagram - wij smullen ervan. In de rubriek Regiobytes struint de redactie het web voor je af voor de gekste, <extra_id_0> posts van <extra_id_1>","Korte updates van de sterren op Facebook, Twitter, en Instagram - wij smullen ervan. In de rubriek Regiobytes struint de redactie het web voor je af voor de gekste, leukste en leukste posts van de dag.","['mooiste en opvallendste', 'BNers en celebritys.']","['leukste en leukste', 'dag.']",6,15,11,"[0.4782608695652174, 0.95]",0.71
seq16-0,xl,.  Maartje Brockbernd VAN DE STRAATFotograaf Maartje Brockbernd en verslaggever Robin Nanninga lopen wekelijks iemand tegen het lijf. Deze keer kwamen ze,. Maartje Brockbernd VAN DE STRAATFotograaf Maartje Brockbernd en verslaggever Robin Nanninga lopen wekelijks iemand <extra_id_0> Deze keer kwamen ze,. Maartje Brockbernd VAN DE STRAATFotograaf Maartje Brockbernd en verslaggever Robin Nanninga lopen wekelijks iemand op straat voorbij. Deze keer kwamen ze,['tegen het lijf.'],['op straat voorbij.'],3,15,11,[0.7777777777777778],0.78
seq17-0,xl,Zorgverleners op de intensive care staan in de frontlinie om het coronavirus te bestrijden. Michael Frank (53) is intensivist op de ic van het Albert Schweitzer ziekenhuis in Dordrecht en geeft dagelijks een inkijkje in zijn werk. Deel 1,Zorgverleners op de intensive care staan in de frontlinie om <extra_id_0> bestrijden. Michael Frank (53) is intensivist op de ic van het Albert Schweitzer ziekenhuis in Dordrecht en geeft dagelijks een <extra_id_1> werk. Deel 1,Zorgverleners op de intensive care staan in de frontlinie om het coronavirus te bestrijden. Michael Frank (53) is intensivist op de ic van het Albert Schweitzer ziekenhuis in Dordrecht en geeft dagelijks een kijkje in zijn werk. Deel 1,"['het coronavirus te', 'inkijkje in zijn']","['het coronavirus te', 'kijkje in zijn']",6,15,11,"[0.0, 0.125]",0.06
seq18-0,xl,"De beeldredactie ziet dagelijks duizenden nieuwsfotos. In deze rubriek worden de opvallendste, mooiste of meest bijzondere fotos geselecteerd. Klik op een van de beelden om deze te vergroten en er doorheen te bladeren.","De beeldredactie ziet dagelijks duizenden <extra_id_0> worden de opvallendste, mooiste of meest bijzondere fotos geselecteerd. Klik op een van de beelden om deze te vergroten en er doorheen te bladeren.","De beeldredactie ziet dagelijks duizenden beelden. Uit deze beelden worden de opvallendste, mooiste of meest bijzondere fotos geselecteerd. Klik op een van de beelden om deze te vergroten en er doorheen te bladeren.",['nieuwsfotos. In deze rubriek'],['beelden. Uit deze beelden'],5,15,10,[0.6785714285714286],0.68
seq19-0,xl,Het WK dendert in volle vaart door. Vandaag staan er opnieuw drie wedstrijden op het programma. Uiteraard zijn deze duels in een apart liveblog te volgen. Hier brengen we je op de hoogte van al het overige WK-nieuws.,Het WK dendert in volle vaart door. Vandaag staan er opnieuw drie wedstrijden op het programma. Uiteraard zijn deze duels in een apart <extra_id_0> Hier brengen <extra_id_1> de hoogte van al het overige WK-nieuws.,Het WK dendert in volle vaart door. Vandaag staan er opnieuw drie wedstrijden op het programma. Uiteraard zijn deze duels in een apart overzicht te volgen. Hier brengen we je op de hoogte van al het overige WK-nieuws.,"['liveblog te volgen.', 'we je op']","['overzicht te volgen.', 'we je op']",6,15,10,"[0.4, 0.0]",0.2
seq20-0,xl,. We houden je op de hoogte in ons liveblog. De gebeurtenissen van de afgelopen dagen lees je hier terug.,. We houden je op de hoogte <extra_id_0> De gebeurtenissen van de afgelopen dagen lees je hier terug.,. We houden je op de hoogte De gebeurtenissen van de afgelopen dagen lees je hier terug.,['in ons liveblog.'],[''],3,15,10,[1.0],1.0
seq21-0,xl,In de rubriek En nu ik! worden bekenden en onbekenden uit het Groene Hart geportretteerd. Vandaag:,In de rubriek En nu ik! worden bekenden <extra_id_0> uit het Groene Hart geportretteerd. Vandaag:,In de rubriek En nu ik! worden bekenden en onbekenden uit het Groene Hart geportretteerd. Vandaag:,['en onbekenden'],['en onbekenden'],2,15,10,[0.0],0.0
seq22-0,xl,Veel sporters berichten graag over hun bezigheden buiten de velden en zalen. In de rubriek Sportbytes kijken we wat bekende sporters meemaken en delen op social media. Dit artikel wordt gedurende de dag vernieuwd.,<extra_id_0> over hun bezigheden buiten de velden en zalen. In de rubriek Sportbytes kijken we wat bekende sporters meemaken en delen op social media. Dit artikel wordt gedurende de dag vernieuwd.,we over hun bezigheden buiten de velden en zalen. In de rubriek Sportbytes kijken we wat bekende sporters meemaken en delen op social media. Dit artikel wordt gedurende de dag vernieuwd.,['Veel sporters berichten graag'],['we'],5,15,10,[0.9655172413793104],0.97
seq23-0,xl,In de rubriek Sportbytes houden we in de gaten wat bekende sporters meemaken n delen op sociale media. Dit artikel wordt gedurende de dag vernieuwd.,In de rubriek Sportbytes houden we in de gaten wat bekende <extra_id_0> op sociale media. Dit artikel wordt gedurende de dag vernieuwd.,In de rubriek Sportbytes houden we in de gaten wat bekende sporters doen op sociale media. Dit artikel wordt gedurende de dag vernieuwd.,['sporters meemaken n delen'],['sporters doen'],4,15,10,[0.52],0.52
seq24-0,xl,Hoe goed heb jij deze week het nieuws uit Utrecht gevolgd? Speel de quiz en test je kennis met 7 vragen.,Hoe goed heb jij deze <extra_id_0> uit Utrecht gevolgd? Speel de quiz en test je kennis met 7 vragen.,Hoe goed heb jij deze bekende acteurs uit Utrecht gevolgd? Speel de quiz en test je kennis met 7 vragen.,['week het nieuws'],['bekende acteurs'],3,15,10,[0.6666666666666666],0.67
seq25-0,xl,"<a href=""https://twitter.com/RWSverkeersinfo?ref_src=twsrc%5Etfw"">@RWSverkeersinfo</a> <a href=""https://t.co/","<a href=""https://twitter.com/RWSverkeersinfo?ref_src=twsrc%5Etfw"">@RWSverkeersinfo</a> <a href=""https://t.co/","<a href=""https://twitter.com/RWSverkeersinfo?ref_src=twsrc%5Etfw"">@RWSverkeersinfo</a> <a href=""https://t.co/",[''],[],1,15,10,[],
seq26-0,xl,". <a href=""https://t.co/axyyfHaEPO"">https://t.co/axyyfHaEPO</a> <a href=""https://twitter.com/hashtag/",". <a href=""https://t.co/axyyfHaEPO"">https://t.co/axyyfHaEPO</a> <a href=""https://twitter.com/hashtag/",". <a href=""https://t.co/axyyfHaEPO"">https://t.co/axyyfHaEPO</a> <a href=""https://twitter.com/hashtag/",[''],[],1,15,10,[],
seq27-0,xl,"in <a href=""https://twitter.com/hashtag/Amsterdam?src=hash&amp;ref_src=twsrc%5Etfw"">#Amsterdam</a>","in <a href=""https://twitter.com/hashtag/Amsterdam?src=hash&amp;ref_src=twsrc%5Etfw"">#Amsterdam</a>","in <a href=""https://twitter.com/hashtag/Amsterdam?src=hash&amp;ref_src=twsrc%5Etfw"">#Amsterdam</a>",[''],[],1,15,10,[],
seq28-0,xl,"<a href=""https://twitter.com/hashtag/F1?src=hash&amp;ref_src=twsrc%5Etfw"">#F1</a> <a href=""https://t.co/","<a href=""https://twitter.com/hashtag/F1?src=hash&amp;ref_src=twsrc%5Etfw"">#F1</a> <a href=""https://t.co/","<a href=""https://twitter.com/hashtag/F1?src=hash&amp;ref_src=twsrc%5Etfw"">#F1</a> <a href=""https://t.co/",[''],[],1,15,10,[],
seq29-0,xl,Fotograaf Maartje Brockbernd en verslaggever Robin Nanninga lopen wekelijks iemand tegen het lijf. Deze keer kwamen ze,Fotograaf Maartje Brockbernd en verslaggever Robin Nanninga lopen wekelijks iemand tegen het lijf. Deze <extra_id_0>,Fotograaf Maartje Brockbernd en verslaggever Robin Nanninga lopen wekelijks iemand tegen het lijf. Deze week: een...,['keer kwamen ze'],['een...'],3,15,10,[0.7857142857142857],0.79
seq30-0,xl,"<a href=""https://twitter.com/hashtag/dwdd?src=hash&amp;ref_src=twsrc%5Etfw"">#dwdd</a> <a href=""https://t","<a href=""https://twitter.com/hashtag/dwdd?src=hash&amp;ref_src=twsrc%5Etfw"">#dwdd</a> <a href=""https://t","<a href=""https://twitter.com/hashtag/dwdd?src=hash&amp;ref_src=twsrc%5Etfw"">#dwdd</a> <a href=""https://t",[''],[],1,15,10,[],
seq31-0,xl,In Delftse mysteries geven we antwoorden op voor de hand liggende vragen. Waarom staat de Oude Kerk zo scheef en wa,In Delftse mysteries geven we antwoorden op voor de hand liggende vragen. Waarom staat de <extra_id_0> scheef en wa,In Delftse mysteries geven we antwoorden op voor de hand liggende vragen. Waarom staat de gevel van de molen scheef en wa,['Oude Kerk zo'],['gevel van de molen'],3,15,9,[0.7777777777777778],0.78
seq32-0,xl,Vrijwel elke dag staat de sportwereld bol van de evenementen en wordt het lastig om nog bij te houden wat cht interessant is. Daarom zetten wij dagelijks op een rijtje welke evenementen speciale aandacht verdienen.,Vrijwel elke dag staat de sportwereld bol van de evenementen en wordt het lastig om nog bij te houden wat cht interessant is. Daarom zetten wij dagelijks op een rijtje welke evenementen <extra_id_0>,Vrijwel elke dag staat de sportwereld bol van de evenementen en wordt het lastig om nog bij te houden wat cht interessant is. Daarom zetten wij dagelijks op een rijtje welke evenementen er dit weekend zijn.,['speciale aandacht verdienen.'],['zijn.'],5,15,9,[0.8928571428571429],0.89
seq33-0,xl,Op het tweede gezichtFotograaf Nico Brons en verslaggever Wichard Maassen nemen wekelijks een kijkje achter het nieuws. Vandaag:,Op het tweede gezichtFotograaf Nico Brons en verslaggever Wichard Maassen nemen wekelijks een kijkje achter <extra_id_0>,Op het tweede gezichtFotograaf Nico Brons en verslaggever Wichard Maassen nemen wekelijks een kijkje achter de schermen.,['het nieuws. Vandaag:'],['schermen.'],3,15,9,[0.9],0.9
seq34-0,xl,"In deze serie zoeken we BNers op die eens in de schijnwerpers stonden, maar nu verdwenen zijn van het podium. Vandaag:","In deze serie zoeken <extra_id_0> die eens in de schijnwerpers stonden, maar nu verdwenen zijn van het podium. Vandaag:","In deze serie zoeken we naar acteurs die eens in de schijnwerpers stonden, maar nu verdwenen zijn van het podium. Vandaag:",['we BNers op'],['we naar acteurs'],3,15,9,[0.7333333333333333],0.73
seq35-0,xl,"Het voetbal ligt op Duitsland na in alle grote competities nog stil, maar ondanks de coronacrisis gaan de zaken en vooral de transfergeruchten gewoon door. In TransferTalk houden we alle geruchten bij. Lees hier al het transfernieuws van de voorbije dagen en weken terug. 18-05","Het voetbal ligt op Duitsland na in <extra_id_0> stil, maar ondanks de <extra_id_1> zaken en vooral de transfergeruchten gewoon door. In TransferTalk houden we alle geruchten bij. Lees hier al het transfernieuws van de voorbije dagen en weken terug. 18-05","Het voetbal ligt op Duitsland na in stil, maar ondanks de maatregelen gaan de zaken en vooral de transfergeruchten gewoon door. In TransferTalk houden we alle geruchten bij. Lees hier al het transfernieuws van de voorbije dagen en weken terug. 18-05","['alle grote competities nog', 'coronacrisis gaan de']","['', 'maatregelen gaan de']",7,15,9,"[1.0, 0.6]",0.8
seq36-0,xl,maffia-kopstuk Omar L. te laten ontsnappen. Die poging is mislukt. De politie heeft vier mannen opgepakt die mogelijk betrokken zijn bij de uitbraakpoging.,maffia-kopstuk Omar <extra_id_0> ontsnappen. Die poging is mislukt. De politie heeft vier mannen opgepakt die mogelijk betrokken zijn bij de uitbraakpoging.,maffia-kopstuk Omar al-Bakr te ontsnappen. Die poging is mislukt. De politie heeft vier mannen opgepakt die mogelijk betrokken zijn bij de uitbraakpoging.,['L. te laten'],['al-Bakr te'],3,15,9,[0.8181818181818182],0.82
seq37-0,xl,"Wie beter dan de baas weet hoe het werkt op de werkvloer. Hoe je opvalt, wanneer je om meer loon vraagt en wat helpt om verder te komen. Zij geven hn beste tips. Vandaag:",Wie beter dan de baas weet hoe het werkt op de werkvloer. Hoe je <extra_id_0> meer loon vraagt en wat helpt om verder te komen. Zij geven hn beste tips. Vandaag:,"Wie beter dan de baas weet hoe het werkt op de werkvloer. Hoe je beter kunt werken, hoe je meer loon vraagt en wat helpt om verder te komen. Zij geven hn beste tips. Vandaag:","['opvalt', 'wanneer je om']","['beter kunt werken, hoe je']",5,15,9,[0.96],0.96
seq38-0,xl,"De zware jongens halen de voorpaginas, de boefjes niet. Sander Sonnemans doet elke week verslag van een doodnormale Rotterdamse rechtszaak.","De zware jongens halen de voorpaginas, de boefjes niet. Sander Sonnemans doet elke week verslag <extra_id_0> Rotterdamse rechtszaak.","De zware jongens halen de voorpaginas, de boefjes niet. Sander Sonnemans doet elke week verslag uit een Rotterdamse rechtszaak.",['van een doodnormale'],['uit een'],3,15,9,[0.7894736842105263],0.79
seq39-0,xl,Ben je er niet aan toegekomen om al het nieuws uit Rotterdam en omstreken vandaag te volgen? Dit is het nieuws van,Ben je er niet aan toegekomen om al het nieuws uit Rotterdam en omstreken vandaag te volgen? Dit is <extra_id_0>,Ben je er niet aan toegekomen om al het nieuws uit Rotterdam en omstreken vandaag te volgen? Dit is je kans!,['het nieuws van'],['kans!'],3,15,9,[0.8571428571428571],0.86
seq40-0,xl,Kamp Amersfoort was in de oorlog voor velen een helse plek. Wie waren zij en wat overkwam hen? In deel,Kamp Amersfoort was <extra_id_0> voor velen een helse plek. Wie waren zij en wat overkwam hen? In deel,Kamp Amersfoort was eens voor velen een helse plek. Wie waren zij en wat overkwam hen? In deel,['in de oorlog'],['eens'],3,15,9,[0.9166666666666666],0.92
seq41-0,xl,David en Arjan (r.) van geluksplatform 365 Dagen Succesvol delen hun lessen voor een leuker leven.,David en Arjan (r.) van geluksplatform 365 Dagen Succesvol delen hun <extra_id_0> een leuker leven.,David en Arjan (r.) van geluksplatform 365 Dagen Succesvol delen hun tips voor een leuker leven.,['lessen voor'],['tips voor'],2,15,9,[0.45454545454545453],0.45
seq42-0,xl,over de voortgang van de coronacrisis. Het kabinet krijgt ruime steun van de bevolking voor de aanpak van het virus.,over de voortgang van de coronacrisis. Het kabinet <extra_id_0> van de bevolking voor de aanpak van het virus.,over de voortgang van de coronacrisis. Het kabinet vraagt de hulp van de bevolking voor de aanpak van het virus.,['krijgt ruime steun'],['vraagt de hulp'],3,15,9,[0.6666666666666666],0.67
seq43-0,xl,"Nijeveen de grootste cocanewasserij in Nederland ooit ontmanteld. In het drugslab werd cocane geproduceerd vanuit zogenoemd dragersmateriaal, zoals kleding. De politie heeft zeventien verdachten aangehouden.","Nijeveen de grootste cocanewasserij in Nederland ooit ontmanteld. In het drugslab werd cocane geproduceerd vanuit zogenoemd dragersmateriaal, zoals kleding. De <extra_id_0> aangehouden.","Nijeveen de grootste cocanewasserij in Nederland ooit ontmanteld. In het drugslab werd cocane geproduceerd vanuit zogenoemd dragersmateriaal, zoals kleding. De daders zijn aangehouden.",['politie heeft zeventien verdachten'],['daders zijn'],4,15,9,[0.8529411764705882],0.85
seq44-0,xl,In de rubriek Van wieg tot graf vertellen we het verhaal achter een familiebericht. Deze keer het levensverhaal van,In de rubriek Van wieg <extra_id_0> we het verhaal achter een familiebericht. Deze keer het levensverhaal van,In de rubriek Van wieg tot wieg vertellen we het verhaal achter een familiebericht. Deze keer het levensverhaal van,['tot graf vertellen'],['tot wieg vertellen'],3,15,9,[0.2222222222222222],0.22
seq45-0,xl,"maakt elke dag vele afwegingen om de krant, site en app zo goed mogelijk te maken. Hoofdredacteur Paul van den Bosch zal deze journalistieke keuzes op regelmatige basis toelichten op deze plek. Vandaag:",maakt elke dag vele <extra_id_0> site en app zo goed mogelijk te maken. Hoofdredacteur Paul van den Bosch zal deze journalistieke keuzes op regelmatige basis toelichten op deze plek. Vandaag:,maakt elke dag vele keuzes om de site en app zo goed mogelijk te maken. Hoofdredacteur Paul van den Bosch zal deze journalistieke keuzes op regelmatige basis toelichten op deze plek. Vandaag:,"['afwegingen om de krant,']",['keuzes om de'],5,15,9,[0.6521739130434783],0.65
seq46-0,xl,"Hans van der Beek doet elke dag verslag van feesten, presentaties en andere belangrijke bijeenkomsten in Amsterdam. Vandaag:","Hans van der Beek <extra_id_0> verslag van feesten, presentaties en andere belangrijke bijeenkomsten in Amsterdam. Vandaag:","Hans van der Beek doet verslag van feesten, presentaties en andere belangrijke bijeenkomsten in Amsterdam. Vandaag:",['doet elke dag'],['doet'],3,15,9,[0.6923076923076923],0.69
