seq256-0,xl,Het kabinet heeft in verband met het coronavirus drastische maatregelen genomen. Dit heeft ook gevolgen voor de Drechtsteden. Volg de ontwikkelingen in de regio in ons blog. In ons dossier vind je alle artikelen over het coronavirus in de Drechtsteden. Mist u iets? Tip de redactie: dd.redactie@ad.nl. 2,Het kabinet heeft in verband met het coronavirus drastische maatregelen genomen. Dit heeft ook gevolgen voor de <extra_id_0> ontwikkelingen in de regio in ons blog. In ons dossier vind <extra_id_1> het coronavirus in de Drechtsteden. Mist u iets? Tip de redactie: dd.redactie@ad.nl. 2,Het kabinet heeft in verband met het coronavirus drastische maatregelen genomen. Dit heeft ook gevolgen voor de Drechtsteden. Lees over de ontwikkelingen in de regio in ons blog. In ons dossier vind u alle berichten over het coronavirus in de Drechtsteden. Mist u iets? Tip de redactie: dd.redactie@ad.nl. 2,"['Drechtsteden. Volg de', 'je alle artikelen over']","['Drechtsteden. Lees over de', 'u alle berichten over']",7,15,6,"[0.3076923076923077, 0.36363636363636365]",0.34
seq257-0,xl,r alle Gelderse lijsttrekkers voor. Op de roltrap in de grote hal van Arnhem Centraal krijgt ieder politiek kopstuk ruim n minuut de tijd om zichzelf en hun partij zo goed mogelijk te verkopen. In aflevering 1,r alle Gelderse lijsttrekkers <extra_id_0> roltrap in de grote hal van Arnhem Centraal krijgt ieder <extra_id_1> n minuut de tijd om zichzelf en hun partij zo goed mogelijk te verkopen. In aflevering 1,r alle Gelderse lijsttrekkers Via een roltrap in de grote hal van Arnhem Centraal krijgt ieder lijsttrekker n minuut de tijd om zichzelf en hun partij zo goed mogelijk te verkopen. In aflevering 1,"['voor. Op de', 'politiek kopstuk ruim']","['Via een', 'lijsttrekker']",6,15,6,"[0.9090909090909091, 0.8095238095238095]",0.86
seq258-0,xl,"Eurosport had hem graag geruisloos zien verdwijnen maar Frank Kramer ging met een knal. Zijn laatste hilarische uitzending met gedichten, liedjes en beschouwingen maakte de 71-jarige voetbalcommentator/trainer/presentator tot held van Twitter.",Eurosport had hem graag geruisloos zien verdwijnen maar Frank Kramer ging met een knal. Zijn laatste hilarische uitzending <extra_id_0> beschouwingen maakte de 71-jarige voetbalcommentator/trainer/presentator tot held van Twitter.,Eurosport had hem graag geruisloos zien verdwijnen maar Frank Kramer ging met een knal. Zijn laatste hilarische uitzending en beschouwingen maakte de 71-jarige voetbalcommentator/trainer/presentator tot held van Twitter.,"['met gedichten', 'liedjes en']",['en'],5,15,6,[0.8461538461538461],0.85
seq259-0,xl,"Sara, de twee jaar oude dochter van Emine en Bram Verbrugge, heeft de zeldzame spierziekte MDC1A waarvoor geen behandeling bestaat. Vader Bram doet verslag. Vandaag deel","Sara, de twee jaar oude dochter van Emine en Bram Verbrugge, heeft de zeldzame spierziekte MDC1A waarvoor geen behandeling bestaat. Vader <extra_id_0> deel","Sara, de twee jaar oude dochter van Emine en Bram Verbrugge, heeft de zeldzame spierziekte MDC1A waarvoor geen behandeling bestaat. Vader Bram Verbrugge deel",['Bram doet verslag. Vandaag'],['Bram Verbrugge'],4,15,6,[0.6923076923076923],0.69
seq260-0,xl,Fotograaf Daniella van Bergen en verslaggever Anouk Mentink lopen wekelijks iemand tegen het lijf. Deze week spraken zij voor de rubriek Van De Straat met,Fotograaf Daniella <extra_id_0> Anouk Mentink lopen wekelijks iemand tegen het lijf. Deze week spraken zij voor de rubriek Van De Straat met,Fotograaf Daniella van der Wal en fotograaf Anouk Mentink lopen wekelijks iemand tegen het lijf. Deze week spraken zij voor de rubriek Van De Straat met,['van Bergen en verslaggever'],['van der Wal en fotograaf'],4,15,6,[0.6153846153846154],0.62
seq261-0,xl,". Het agentschap baseert die inschatting op de gesprekken die het voerde met partijen die met een vaccin bezig zijn, gecombineerd met ervaringen uit het verleden.",". Het agentschap baseert die inschatting op de gesprekken die het voerde met partijen <extra_id_0> bezig zijn, gecombineerd met ervaringen uit het verleden.",". Het agentschap baseert die inschatting op de gesprekken die het voerde met partijen die met de zaak bezig zijn, gecombineerd met ervaringen uit het verleden.",['die met een vaccin'],['die met de zaak'],4,15,6,[0.3888888888888889],0.39
seq262-0,xl,"De Griekse hoofdstad Athene is vandaag getroffen door een aardbeving met een magnitude van 5,2 op de schaal van Richter.","De Griekse hoofdstad Athene is vandaag getroffen door een aardbeving met een magnitude van 5,2 op <extra_id_0> Richter.","De Griekse hoofdstad Athene is vandaag getroffen door een aardbeving met een magnitude van 5,2 op de schaal van Richter.",['de schaal van'],['de schaal van'],3,15,6,[0.0],0.0
seq263-0,xl,"Korte maar hevige buien hebben schade veroorzaakt aan druivenplanten in wijnvelden bij Bordeaux. Vooral wijnvelden rond Blaye en Bourg maar ook enkele in de Haut-Mdoc zijn getroffen, melden Franse media.","Korte maar hevige buien hebben schade veroorzaakt aan druivenplanten <extra_id_0> Vooral wijnvelden rond Blaye en Bourg maar ook enkele in de Haut-Mdoc zijn getroffen, melden Franse media.","Korte maar hevige buien hebben schade veroorzaakt aan druivenplanten Vooral wijnvelden rond Blaye en Bourg maar ook enkele in de Haut-Mdoc zijn getroffen, melden Franse media.",['in wijnvelden bij Bordeaux.'],[''],4,15,6,[1.0],1.0
seq264-0,xl," De wedstrijd staat onder leiding van de Griek Tasos Sidiropoulos  PSV won afgelopen weekend overtuigend van ADO Den Haag (0-7), FC Barcelona","De wedstrijd staat onder leiding van <extra_id_0> Sidiropoulos PSV won afgelopen weekend overtuigend van ADO Den Haag (0-7), FC Barcelona","De wedstrijd staat onder leiding van de Griek Dimitrios Sidiropoulos PSV won afgelopen weekend overtuigend van ADO Den Haag (0-7), FC Barcelona",['de Griek Tasos'],['de Griek Dimitrios'],3,15,6,[0.3888888888888889],0.39
seq265-0,xl,Journaliste Lisanne van Sadelhoff schrijft elke week over haar leven in de stad Utrecht. Dit keer over,Journaliste Lisanne van Sadelhoff schrijft elke week over haar leven in de <extra_id_0> keer over,Journaliste Lisanne van Sadelhoff schrijft elke week over haar leven in de stad. Dit keer over,['stad Utrecht. Dit'],['stad. Dit'],3,15,6,[0.47058823529411764],0.47
seq266-0,xl,"De eerste tientallen boeren zijn vrijdagochtend gearriveerd op de Dam in Amsterdam. Daarvoor trokken ze, vooral tijdens het laatste deel van de rit, toeterend door de hoofdstad. ,,Met name het laatste stuk hebben we Amsterdam wel wakker gemaakt, zegt een woordvoerder van organisator Agractie Nederland.","De eerste tientallen boeren zijn vrijdagochtend gearriveerd op de Dam in Amsterdam. Daarvoor trokken ze, vooral tijdens het laatste deel van de rit, <extra_id_0> hoofdstad. ,,Met name het laatste stuk hebben we Amsterdam wel wakker gemaakt, zegt een woordvoerder <extra_id_1>","De eerste tientallen boeren zijn vrijdagochtend gearriveerd op de Dam in Amsterdam. Daarvoor trokken ze, vooral tijdens het laatste deel van de rit, door de hoofdstad. ,,Met name het laatste stuk hebben we Amsterdam wel wakker gemaakt, zegt een woordvoerder van de boerenorganisatie.","['toeterend door de', 'van organisator Agractie Nederland.']","['door de', 'boerenorganisatie.']",7,15,6,"[0.5882352941176471, 0.7142857142857143]",0.65
seq267-0,xl,Ook na de coronapiek blijven we buiten anderhalve meter afstand houden. Dat denkt bijna twee derde van de deelnemers aan een peiling over het leven na corona. In,Ook na de coronapiek blijven we buiten anderhalve meter afstand houden. Dat denkt bijna twee derde <extra_id_0> een peiling over het leven na corona. In,Ook na de coronapiek blijven we buiten anderhalve meter afstand houden. Dat denkt bijna twee derde van de Nederlanders in een peiling over het leven na corona. In,['van de deelnemers aan'],['van de Nederlanders in'],4,15,6,[0.36363636363636365],0.36
seq268-0,xl,"ervaringsdeskundigen, experts en commentatoren over deze stelling en andere thema's die ons land na de pandemie bepalen.","ervaringsdeskundigen, experts en commentatoren over deze stelling en andere thema's die ons land na <extra_id_0>","ervaringsdeskundigen, experts en commentatoren over deze stelling en andere thema's die ons land na de crisis...",['de pandemie bepalen.'],['crisis...'],3,15,6,[0.9],0.9
seq269-0,xl,ag op zeer korte termijn laten testen bij een GGD in de buurt. Via een nieuw gratis landelijk telefoonnummer kan een afspraak voor de volgende dag worden gemaakt.,<extra_id_0> termijn laten testen bij een GGD in de buurt. Via een nieuw gratis landelijk telefoonnummer kan een afspraak voor de volgende dag worden gemaakt.,op korte termijn laten testen bij een GGD in de buurt. Via een nieuw gratis landelijk telefoonnummer kan een afspraak voor de volgende dag worden gemaakt.,['ag op zeer korte'],['op korte'],4,15,6,[0.5],0.5
seq270-0,xl,Een 34-jarige vrouw is in de nacht van zaterdag op zondag in Ter Aar onder verdachte omstandigheden om het leven gekomen. Haar 46-jarige partner is aangehouden. Hij wordt verhoord over zijn mogelijke betrokkenheid bij de dood van zijn vrouw. De drie dochters van het gezin zijn tijdelijk elders opgevangen.,Een 34-jarige vrouw is in de nacht van zaterdag op zondag in Ter Aar <extra_id_0> om het leven gekomen. Haar 46-jarige partner is aangehouden. Hij wordt verhoord over zijn mogelijke betrokkenheid bij de dood van zijn <extra_id_1> van het gezin zijn tijdelijk elders opgevangen.,Een 34-jarige vrouw is in de nacht van zaterdag op zondag in Ter Aar door haar partner om het leven gekomen. Haar 46-jarige partner is aangehouden. Hij wordt verhoord over zijn mogelijke betrokkenheid bij de dood van zijn vrouw. De kinderen van het gezin zijn tijdelijk elders opgevangen.,"['onder verdachte omstandigheden', 'vrouw. De drie dochters']","['door haar partner', 'vrouw. De kinderen']",7,15,6,"[0.7666666666666667, 0.43478260869565216]",0.6
seq271-0,xl,.  Maartje Brockbernd VAN DE STRAATFotograaf Maartje Brockbernd en verslaggever Robin Nanninga lopen wekelijks iemand tegen het lijf. Deze keer kwamen ze,. <extra_id_0> DE STRAATFotograaf Maartje Brockbernd en verslaggever Robin Nanninga lopen wekelijks iemand tegen het lijf. Deze keer kwamen ze,. OP DE STRAATFotograaf Maartje Brockbernd en verslaggever Robin Nanninga lopen wekelijks iemand tegen het lijf. Deze keer kwamen ze,['Maartje Brockbernd VAN'],['OP'],3,15,6,[1.0],1.0
seq272-0,xl,Geraakt door coronaIn een serie verhalen vertellen mensen hoe zij worden geraakt door de coronacrisis. Vandaag:,<extra_id_0> coronaIn een serie verhalen vertellen mensen hoe zij worden geraakt door de coronacrisis. Vandaag:,- NPO Radio 1 Verhalen over coronaIn een serie verhalen vertellen mensen hoe zij worden geraakt door de coronacrisis. Vandaag:,['Geraakt door'],['- NPO Radio 1 Verhalen over'],2,15,6,[0.8148148148148148],0.81
seq273-0,xl,vandaag vanuit de regio naar Den Haag om te protesteren tegen de stikstofmaatregelen van het kabinet. Verslaggever Ilse van Driel g,<extra_id_0> regio naar Den Haag om te protesteren tegen de stikstofmaatregelen van het kabinet. Verslaggever Ilse van Driel g,uit de regio naar Den Haag om te protesteren tegen de stikstofmaatregelen van het kabinet. Verslaggever Ilse van Driel g,['vandaag vanuit de'],['uit de'],3,15,6,[0.6470588235294118],0.65
seq274-0,xl,) is uit de race gestapt bij de Democraten voor het presidentschap van de Verenigde Staten. Hij maakte dat van,) is uit de race gestapt bij de Democraten voor het presidentschap van de <extra_id_0> maakte dat van,) is uit de race gestapt bij de Democraten voor het presidentschap van de VS. Hij maakte dat van,['Verenigde Staten. Hij'],['VS. Hij'],3,15,6,[0.6666666666666666],0.67
seq275-0,xl,Columniste en journaliste Marieke Dubbelman schrijft op maandag en zaterdag over zaken in Utrecht of de regio die haar zijn opgevallen. Dit keer over de,Columniste en journaliste Marieke Dubbelman schrijft op maandag en zaterdag over <extra_id_0> de regio die haar zijn opgevallen. Dit keer over de,Columniste en journaliste Marieke Dubbelman schrijft op maandag en zaterdag over zaken in de regio die haar zijn opgevallen. Dit keer over de,['zaken in Utrecht of'],['zaken in'],4,15,6,[0.5789473684210527],0.58
seq276-0,xl,"opgepakt bij het Belgische festival Tomorrowland en verblijft momenteel in een Vlaamse cel, meldt de Gazet van Antwerpen. Volgens de krant had de actrice verschillende soorten drugs bij zich en werd er tijdens een huiszoeking op haar verblijfadres nog meer gevonden. Haar advocaat spreekt van een zeer fout gelopen experiment.",opgepakt bij het Belgische festival Tomorrowland en verblijft momenteel in een Vlaamse <extra_id_0> van <extra_id_1> had de actrice verschillende soorten drugs bij zich en werd er tijdens een huiszoeking op haar verblijfadres nog meer gevonden. Haar advocaat spreekt van een zeer fout gelopen experiment.,opgepakt bij het Belgische festival Tomorrowland en verblijft momenteel in een Vlaamse gevangenis. Naar verluidt van de politie had de actrice verschillende soorten drugs bij zich en werd er tijdens een huiszoeking op haar verblijfadres nog meer gevonden. Haar advocaat spreekt van een zeer fout gelopen experiment.,"['cel', 'meldt de Gazet', 'Antwerpen. Volgens de krant']","['gevangenis. Naar verluidt', 'de politie']",8,15,6,"[0.92, 0.7857142857142857]",0.85
seq277-0,xl,Leo van der Velde schrijft wekelijks een brief aan kleindochter Rachel (6) waarin hij haar vertelt over het Den Haag van toen.,Leo van der Velde schrijft wekelijks <extra_id_0> kleindochter Rachel (6) waarin hij haar vertelt over het Den Haag van toen.,Leo van der Velde schrijft wekelijks een brief aan zijn kleindochter Rachel (6) waarin hij haar vertelt over het Den Haag van toen.,['een brief aan'],['een brief aan zijn'],3,15,6,[0.2777777777777778],0.28
seq278-0,xl,"De Turn on the Lights lichtshow, die ieder jaar door de Bijenkorf wordt georganiseerd als startschot van het feestseizoen, gaat niet door.","De Turn on the Lights lichtshow, die ieder jaar door de Bijenkorf <extra_id_0> startschot van het feestseizoen, gaat niet door.","De Turn on the Lights lichtshow, die ieder jaar door de Bijenkorf loopt als startschot van het feestseizoen, gaat niet door.",['wordt georganiseerd als'],['loopt als'],3,15,6,[0.7391304347826086],0.74
seq279-0,xl,Gezond op de ZaakWerken kan behoorlijk ongezond zijn. Wat klopt er van alle beweringen over gezond werken? Vandaag:,Gezond op de <extra_id_0> ongezond zijn. Wat klopt er van alle beweringen over gezond werken? Vandaag:,Gezond op de werkvloer? Werken kan ongezond zijn. Wat klopt er van alle beweringen over gezond werken? Vandaag:,['ZaakWerken kan behoorlijk'],['werkvloer? Werken kan'],3,15,6,[0.8],0.8
seq280-0,xl,. Op sommige plekken wordt een winterdek van enkele centimeters voorspeld. De KNMI heeft code geel afgekondigd vanaf acht uur,<extra_id_0> plekken wordt een winterdek van enkele centimeters voorspeld. De KNMI heeft code geel afgekondigd vanaf acht uur,op enkele plekken wordt een winterdek van enkele centimeters voorspeld. De KNMI heeft code geel afgekondigd vanaf acht uur,['. Op sommige'],['op enkele'],3,15,6,[0.75],0.75
seq281-0,xl,Niek Druijff (42) verruilt het Nederlandse platteland voor Singapore. Als huisman tussen de expats schrijft hij wekelijks over zijn belevenissen. Vandaag:,Niek Druijff (42) verruilt <extra_id_0> voor Singapore. Als huisman tussen de expats schrijft hij wekelijks over zijn belevenissen. Vandaag:,Niek Druijff (42) verruilt Amsterdam voor Singapore. Als huisman tussen de expats schrijft hij wekelijks over zijn belevenissen. Vandaag:,['het Nederlandse platteland'],['Amsterdam'],3,15,6,[0.8461538461538461],0.85
seq282-0,xl,oktober De geallieerde troepen deden er 75 jaar geleden ruim een maand over om de bezetter uit West-Brabant te verdrijven. Hoe verliep die weg naar de bevrijding? Deze kroniek in 36 delen beschrijft het van dag tot dag. Vandaag het,oktober De geallieerde troepen deden er 75 jaar geleden ruim een maand over om de bezetter uit West-Brabant te verdrijven. Hoe <extra_id_0> naar de bevrijding? <extra_id_1> 36 delen beschrijft het van dag tot dag. Vandaag het,oktober De geallieerde troepen deden er 75 jaar geleden ruim een maand over om de bezetter uit West-Brabant te verdrijven. Hoe ging dat naar de bevrijding? Deze serie in 36 delen beschrijft het van dag tot dag. Vandaag het,"['verliep die weg', 'Deze kroniek in']","['ging dat', 'Deze serie in']",6,15,6,"[0.8, 0.3333333333333333]",0.57
seq283-0,xl,meldingen gedaan van mensen die zijn overleden aan het coronavirus. Het totaal aantal overleden patinten komt daarmee op 1,meldingen gedaan van mensen die zijn overleden aan het coronavirus. Het totaal aantal overleden patinten <extra_id_0> 1,meldingen gedaan van mensen die zijn overleden aan het coronavirus. Het totaal aantal overleden patinten is 1,['komt daarmee op'],['is'],3,15,6,[1.0],1.0
seq284-0,xl,april Het kabinet heeft in verband met het coronavirus drastische maatregelen genomen. Dit heeft ook gevolgen voor de Drechtsteden. Volg de ontwikkelingen in de regio in ons blog. In ons dossier vind je alle artikelen over het coronavirus in de Drechtsteden. Mist u iets? Tip de redactie: dd.redactie@ad.nl. 0,april Het kabinet heeft in verband met het <extra_id_0> genomen. Dit heeft ook gevolgen voor de Drechtsteden. Volg de ontwikkelingen in de <extra_id_1> In ons dossier vind je alle artikelen over het coronavirus in de Drechtsteden. Mist u iets? Tip de redactie: dd.redactie@ad.nl. 0,april Het kabinet heeft in verband met het coronavirus maatregelen genomen. Dit heeft ook gevolgen voor de Drechtsteden. Volg de ontwikkelingen in de regio. In ons dossier vind je alle artikelen over het coronavirus in de Drechtsteden. Mist u iets? Tip de redactie: dd.redactie@ad.nl. 0,"['coronavirus drastische maatregelen', 'regio in ons blog.']","['coronavirus maatregelen', 'regio.']",7,15,6,"[0.3235294117647059, 0.6666666666666666]",0.5
seq285-0,xl,"Wie komt, wie gaat? Wordt de hele selectie verbouwd of volstaat een gerichte aankoop? Kortom, hoe heet wordt de transferzomer bij de eredivisieclubs. Dit artikel wordt in de loop van de dag aangevuld. Vandaag","Wie komt, wie gaat? Wordt de hele selectie verbouwd of volstaat een gerichte aankoop? <extra_id_0> de transferzomer bij de eredivisieclubs. Dit artikel wordt in de loop van de dag aangevuld. Vandaag","Wie komt, wie gaat? Wordt de hele selectie verbouwd of volstaat een gerichte aankoop? Een overzicht van de transferzomer bij de eredivisieclubs. Dit artikel wordt in de loop van de dag aangevuld. Vandaag","['Kortom', 'hoe heet wordt']",['Een overzicht van'],5,15,6,[0.8235294117647058],0.82
seq286-0,xl,in een kletsnat Utrecht het Centraal Militair Hospitaal op De Uithof heropend. Het pand werd de afgelopen twee jaar verbouwd en uitgebreid.,in een kletsnat Utrecht het Centraal Militair <extra_id_0> Uithof heropend. Het pand werd de afgelopen twee jaar verbouwd en uitgebreid.,in een kletsnat Utrecht het Centraal Militair Depot op de Uithof heropend. Het pand werd de afgelopen twee jaar verbouwd en uitgebreid.,['Hospitaal op De'],['Depot op de'],3,15,6,[0.5333333333333333],0.53
seq287-0,xl,"Wijsheid komt met de jaren. Omdat acteur Joost Prinsen (76) een eind op weg is, beantwoordt hij uw vragen.","Wijsheid komt met de jaren. Omdat acteur Joost Prinsen (76) een eind op weg is, <extra_id_0> vragen.","Wijsheid komt met de jaren. Omdat acteur Joost Prinsen (76) een eind op weg is, stelt hij zichzelf wat vragen.",['beantwoordt hij uw'],['stelt hij zichzelf wat'],3,15,6,[0.8636363636363636],0.86
seq288-0,xl,". Er zouden vier gewonden zijn. Ook zou er zijn gevochten. De bestuurder van de auto is aangehouden, samen met een tweede verdachte, een vrouw.",". Er zouden vier gewonden zijn. Ook zou er zijn <extra_id_0> de auto is aangehouden, samen met een tweede verdachte, een vrouw.",". Er zouden vier gewonden zijn. Ook zou er zijn dat de bestuurder van de auto is aangehouden, samen met een tweede verdachte, een vrouw.",['gevochten. De bestuurder van'],['dat de bestuurder van'],4,15,6,[0.35714285714285715],0.36
seq289-0,xl,In het Huisdierenziekenhuis in Honselersdijk is de kattenziekte vastgesteld bij een Britse korthaar. Katteneigenaren moeten oppassen voor deze,In <extra_id_0> Honselersdijk is de kattenziekte vastgesteld bij een Britse korthaar. Katteneigenaren moeten oppassen voor deze,In de gemeente Honselersdijk is de kattenziekte vastgesteld bij een Britse korthaar. Katteneigenaren moeten oppassen voor deze,['het Huisdierenziekenhuis in'],['de gemeente'],3,15,6,[0.7777777777777778],0.78
seq290-0,xl,Een witgoudenrandje in deze coronatijden. Het aspergeseizoen is weer gestart. Ook in de verswinkels bij de kwekerijen staat veiligheid op n.,Een witgoudenrandje in deze coronatijden. Het aspergeseizoen is weer gestart. Ook in de verswinkels <extra_id_0> staat veiligheid op n.,Een witgoudenrandje in deze coronatijden. Het aspergeseizoen is weer gestart. Ook in de verswinkels en aspergebakkerijen staat veiligheid op n.,['bij de kwekerijen'],['en aspergebakkerijen'],3,15,6,[0.6],0.6
seq291-0,xl,"In online serie Premire deelt filmkenner Dennis Alink wekelijks de beste film- en serietips voor de bioscoop, televisie en video on demand. Met deze week","<extra_id_0> deelt filmkenner Dennis Alink wekelijks de beste film- en serietips voor de bioscoop, televisie en video on demand. Met deze week","deelt filmkenner Dennis Alink wekelijks de beste film- en serietips voor de bioscoop, televisie en video on demand. Met deze week",['In online serie Premire'],[''],4,15,6,[1.0],1.0
seq292-0,xl,Cabaretier en muzikant Kiki Schippers schrijft elke zaterdag een column over het leven in Woerden. Vandaag schrijft ze over h,Cabaretier en muzikant Kiki Schippers schrijft elke zaterdag een column <extra_id_0> in Woerden. Vandaag schrijft ze over h,Cabaretier en muzikant Kiki Schippers schrijft elke zaterdag een column in de Volkskrant in Woerden. Vandaag schrijft ze over h,['over het leven'],['in de Volkskrant'],3,15,6,[0.875],0.88
seq293-0,xl,De 67-jarige vader Gerrit-Jan van D. die negen jaar lang met zes kinderen in totale afzondering leefde op een boerderij in Ruinerwold,De 67-jarige vader <extra_id_0> die negen jaar lang met zes kinderen in totale afzondering leefde op een boerderij in Ruinerwold,De 67-jarige vader die negen jaar lang met zes kinderen in totale afzondering leefde op een boerderij in Ruinerwold,['Gerrit-Jan van D.'],[''],3,15,6,[1.0],1.0
seq294-0,xl,zijn twee handgranaten gevonden. Het pakketje was vastgemaakt aan de witte rolluiken van de zaak. De,zijn twee handgranaten gevonden. Het pakketje was vastgemaakt aan de <extra_id_0> van de zaak. De,zijn twee handgranaten gevonden. Het pakketje was vastgemaakt aan de muur van de zaak. De,['witte rolluiken'],['muur'],2,15,6,[0.9333333333333333],0.93
seq295-0,xl,"</a> <a href=""https://twitter.com/hashtag/brand?src=hash&amp;ref_src=twsrc%5Etfw"">#brand</a> <a href=""https://t.co/","</a> <a href=""https://twitter.com/hashtag/brand?src=hash&amp;ref_src=twsrc%5Etfw"">#brand</a> <a href=""https://t.co/","</a> <a href=""https://twitter.com/hashtag/brand?src=hash&amp;ref_src=twsrc%5Etfw"">#brand</a> <a href=""https://t.co/",[''],[],1,15,6,[],
seq296-0,xl,rond 20.10 uur bevrijd uit zijn benarde positie. Het kind is in zorgwekkende toestand naar een ziekenhuis gebracht.,rond <extra_id_0> uit zijn benarde positie. Het kind is in zorgwekkende toestand naar een ziekenhuis gebracht.,rond uit zijn benarde positie. Het kind is in zorgwekkende toestand naar een ziekenhuis gebracht.,['20.10 uur bevrijd'],[''],3,15,6,[1.0],1.0
seq297-0,xl,"eskundigen die vermeende insulinemoordenaar Rahiied A. (22) hebben onderzocht, adviseren de jonge Rotterdammer tbs met dwangverpleging op te leggen. Dat heeft het Openbaar Ministerie (OM) zojuist tijdens een pro forma-","eskundigen die vermeende insulinemoordenaar Rahiied A. (22) hebben onderzocht, adviseren de jonge Rotterdammer tbs met dwangverpleging op te leggen. Dat heeft het Openbaar Ministerie (OM) <extra_id_0> forma-","eskundigen die vermeende insulinemoordenaar Rahiied A. (22) hebben onderzocht, adviseren de jonge Rotterdammer tbs met dwangverpleging op te leggen. Dat heeft het Openbaar Ministerie (OM) maandag laten weten. De forma-",['zojuist tijdens een pro'],['maandag laten weten. De'],4,15,6,[0.782608695652174],0.78
seq298-0,xl,heeft een boete van 2 miljoen euro gekregen van de Autoriteit Financile Marken (AFM). De toezichthouder verwijt de bank bepaalde informatie niet tijdig openbaar gemaakt te hebben.,heeft een boete <extra_id_0> gekregen van de Autoriteit Financile Marken (AFM). De toezichthouder verwijt de bank bepaalde informatie niet tijdig openbaar gemaakt te hebben.,heeft een boete van 25.000 euro gekregen van de Autoriteit Financile Marken (AFM). De toezichthouder verwijt de bank bepaalde informatie niet tijdig openbaar gemaakt te hebben.,['van 2 miljoen euro'],['van 25.000 euro'],4,15,6,[0.4444444444444444],0.44
seq299-0,xl,"De Stint mag in de huidige vorm niet meer terug op de openbare weg. Dat schrijft minister Cora van Nieuwenhuizen (Infrastructuur) vandaag aan de Tweede Kamer. Uit het onderzoek van TNO, dat vanmorgen wordt gepresenteerd, blijkt dat de elektrische bolderkar niet veilig genoeg is voor personenvervoer.","<extra_id_0> de huidige vorm <extra_id_1> op de openbare weg. Dat schrijft minister Cora van Nieuwenhuizen (Infrastructuur) vandaag aan de Tweede Kamer. Uit het onderzoek van TNO, dat vanmorgen wordt gepresenteerd, blijkt dat de elektrische bolderkar niet veilig genoeg is voor personenvervoer.","in de huidige vorm van personenvervoer op de openbare weg. Dat schrijft minister Cora van Nieuwenhuizen (Infrastructuur) vandaag aan de Tweede Kamer. Uit het onderzoek van TNO, dat vanmorgen wordt gepresenteerd, blijkt dat de elektrische bolderkar niet veilig genoeg is voor personenvervoer.","['De Stint mag in', 'niet meer terug']","['in', 'van personenvervoer']",7,15,6,"[0.8666666666666667, 0.7368421052631579]",0.8
