seq425-0,xl,"We worden overstelpt met nieuw aanbod van series en films, maar kunnen lang niet alles bekijken. Deze week duiken we naar de bodem van de on","<extra_id_0> nieuw aanbod van series en films, maar kunnen lang niet alles bekijken. Deze week duiken we naar de bodem van de on","weken nieuw aanbod van series en films, maar kunnen lang niet alles bekijken. Deze week duiken we naar de bodem van de on",['We worden overstelpt met'],['weken'],4,15,6,[0.875],0.88
seq426-0,xl,' Meld je aan voor de AD sportnieuwsbrief en ontvang dagelijks een overzicht van het belangrijkste sportnieuws,' Meld je aan voor de AD sportnieuwsbrief <extra_id_0> een overzicht van het belangrijkste sportnieuws,' Meld je aan voor de AD sportnieuwsbrief en ontvang wekelijks een overzicht van het belangrijkste sportnieuws,['en ontvang dagelijks'],['en ontvang wekelijks'],3,15,6,[0.15],0.15
seq427-0,xl,In de rubriek Van Wieg tot Graf vertellen we het verhaal achter een familiebericht. Deze keer het levensverhaal van,In <extra_id_0> Wieg tot Graf vertellen we het verhaal achter een familiebericht. Deze keer het levensverhaal van,In Van Wieg tot Graf vertellen we het verhaal achter een familiebericht. Deze keer het levensverhaal van,['de rubriek Van'],['Van'],3,15,6,[0.7857142857142857],0.79
seq428-0,xl,"lockquote class=""twitter-tweet"" data-partner=""tweetdeck""><p lang=""nl"" dir=""ltr""><a href=""https://twitter.com/","lockquote class=""twitter-tweet"" data-partner=""tweetdeck""><p <extra_id_0> dir=""ltr""><a href=""https://twitter.com/","lockquote class=""twitter-tweet"" data-partner=""tweetdeck""><p dir=""ltr""><a href=""https://twitter.com/","['lang=""nl""']",[''],1,15,6,[1.0],1.0
seq429-0,xl,"Dit pinksterweekend gaat menig Nederlander naar een vakantie- of bungalowpark. Door alle onzekerheid rond vakanties in het buitenland, stromen ook voor de zomermaanden de boekingen al binnen. Het is wel anders vakantie vieren in coronatijd. Een reportage vanuit Oostkapelle.",Dit pinksterweekend <extra_id_0> naar een vakantie- of bungalowpark. Door alle onzekerheid rond vakanties <extra_id_1> stromen ook voor de zomermaanden de boekingen al binnen. Het is wel anders vakantie vieren in coronatijd. Een reportage vanuit Oostkapelle.,Dit pinksterweekend gaat men massaal naar een vakantie- of bungalowpark. Door alle onzekerheid rond vakanties en reizen stromen ook voor de zomermaanden de boekingen al binnen. Het is wel anders vakantie vieren in coronatijd. Een reportage vanuit Oostkapelle.,"['gaat menig Nederlander', 'in het buitenland,']","['gaat men massaal', 'en reizen']",6,15,6,"[0.5454545454545454, 0.6666666666666666]",0.61
seq430-0,xl,"Als alles volgens planning loopt, gaat de metro tussen Hoek van Holland en Schiedam Centrum vanaf maandag 30 september rijden. De ombouw van trein- naar metrospoor liep maar liefst twee jaar vertraging op. Deze krant blikt","Als alles volgens planning loopt, gaat de <extra_id_0> Holland en Schiedam Centrum vanaf maandag 30 september rijden. De ombouw van trein- naar metrospoor liep maar liefst twee jaar vertraging op. Deze krant blikt","Als alles volgens planning loopt, gaat de trein tussen Rotterdam Holland en Schiedam Centrum vanaf maandag 30 september rijden. De ombouw van trein- naar metrospoor liep maar liefst twee jaar vertraging op. Deze krant blikt",['metro tussen Hoek van'],['trein tussen Rotterdam'],5,15,6,[0.5454545454545454],0.55
seq431-0,xl,"Het is altijd leuk om binnen te kijken bij andere huizen, op zoek naar inspiratie voor de eigen inrichting. In de videoserie Eigen huis en tuin van... gaat","Het is altijd leuk <extra_id_0> bij andere huizen, op zoek naar inspiratie voor de eigen inrichting. In de videoserie Eigen huis en tuin van... gaat","Het is altijd leuk om te kijken bij andere huizen, op zoek naar inspiratie voor de eigen inrichting. In de videoserie Eigen huis en tuin van... gaat",['om binnen te kijken'],['om te kijken'],4,15,6,[0.3684210526315789],0.37
seq432-0,xl,Er is onvoldoende reden om het voltallige bestuur van het islamitische Cornelius Haga Lyceum weg te sturen,Er is onvoldoende reden om het voltallige bestuur van het <extra_id_0> Lyceum weg te sturen,Er is onvoldoende reden om het voltallige bestuur van het Fries Lyceum weg te sturen,['islamitische Cornelius Haga'],['Fries'],3,15,6,[0.8888888888888888],0.89
seq433-0,xl,Het coronavirus houdt de sportwereld in zijn greep. Volg in dit liveblog alle ontwikkelingen rond het corona-gerelateerde sportnieuws van vandaag. 0,Het coronavirus houdt de sportwereld in zijn greep. Volg <extra_id_0> alle ontwikkelingen rond het corona-gerelateerde sportnieuws van vandaag. 0,Het coronavirus houdt de sportwereld in zijn greep. Volg hier alle ontwikkelingen rond het corona-gerelateerde sportnieuws van vandaag. 0,['in dit liveblog'],['hier'],3,15,6,[0.8666666666666667],0.87
seq434-0,xl,"De bazen die eerder aan bod kwamen: Fons Jurgens (Efteling) Frits van Eerd (Jumbo), Atilay Uslu (Corendon), Hennie van der Most (horeca-ondernemer), Jaap Wassink (Coca-Cola), Bas Beerens (WeTransfer), Wilbert Mutsaers (Spotify), Gillian Tans (Booking.com), Marjan van Loon (Shell), Duncan Stutterheim (ID&T), Niels Bontje (Iglo), Koen Regout (Koninklijke Verkade), Marcel Molenaar (LinkedIn), Michiel Muller (Picnic) , Alex van Hooff (Burgers Zoo), Dries van der Vossen (Event Hotels), Sabi Tolou (SendCloud), Eppo Kuipers (Lean Consultancy Group), Maike Nieuwenhuys (detacheerder USG)","De bazen die <extra_id_0> (Efteling) Frits van Eerd (Jumbo), Atilay Uslu (Corendon), Hennie van der Most <extra_id_1> (Coca-Cola), Bas Beerens (WeTransfer), Wilbert Mutsaers (Spotify), Gillian Tans (Booking.com), Marjan van Loon (Shell), Duncan Stutterheim (ID&T), Niels Bontje (Iglo), Koen <extra_id_2> Marcel Molenaar (LinkedIn), Michiel Muller (Picnic) , Alex van Hooff (Burgers Zoo), Dries van der Vossen (Event Hotels), Sabi Tolou (SendCloud), Eppo Kuipers (Lean Consultancy Group), Maike Nieuwenhuys (detacheerder USG)","De bazen die werken bij bedrijven: Niels Bontje (Efteling) Frits van Eerd (Jumbo), Atilay Uslu (Corendon), Hennie van der Most (Coca-Cola), Bas Beerens (WeTransfer), Wilbert Mutsaers (Spotify), Gillian Tans (Booking.com), Marjan van Loon (Shell), Duncan Stutterheim (ID&T), Niels Bontje (Iglo), Koen van der Meer (Airbnb), Marcel Molenaar (LinkedIn), Michiel Muller (Picnic) , Alex van Hooff (Burgers Zoo), Dries van der Vossen (Event Hotels), Sabi Tolou (SendCloud), Eppo Kuipers (Lean Consultancy Group), Maike Nieuwenhuys (detacheerder USG)","['eerder aan bod kwamen: Fons Jurgens', '(horeca-ondernemer)', 'Jaap Wassink', 'Regout (Koninklijke Verkade),']","['werken bij bedrijven: Niels Bontje', '', 'van der Meer (Airbnb),']",12,15,6,"[0.6571428571428571, 1.0, 0.8181818181818182]",0.83
seq435-0,xl,"De Europese porno-industrie heeft haar opnames grotendeels stilgelegd nadat op de Spaanse nieuwssite El Nacional.Cat op 14 februari het bericht verscheen dat Nacho Vidal, een bekende Catalaanse pornoacteur, besmet was geraakt met het hiv-virus. Actrices en acteurs met wie hij recent samenwerkte, worden eerst getest voordat de activiteiten kunnen worden hervat.","<extra_id_0> haar opnames <extra_id_1> de Spaanse nieuwssite El Nacional.Cat op 14 februari het bericht verscheen dat Nacho Vidal, een bekende Catalaanse pornoacteur, besmet was geraakt met het hiv-virus. Actrices en acteurs met wie hij recent samenwerkte, worden eerst getest voordat de activiteiten kunnen worden hervat.","met haar opnames Dit nadat op de Spaanse nieuwssite El Nacional.Cat op 14 februari het bericht verscheen dat Nacho Vidal, een bekende Catalaanse pornoacteur, besmet was geraakt met het hiv-virus. Actrices en acteurs met wie hij recent samenwerkte, worden eerst getest voordat de activiteiten kunnen worden hervat.","['De Europese porno-industrie heeft', 'grotendeels stilgelegd nadat op']","['met', 'Dit nadat op']",8,15,6,"[0.9393939393939394, 0.6774193548387096]",0.81
seq436-0,xl,"Goed drinken, dat is bij de hitte van de komende dagen het devies. Maar wt je drinkt, kan nogal een verschil maken voor het klimaat. Zo is de klimaatimpact van cappuccino een veelvoud van die van thee, sap of een biertje.","Goed drinken, dat is bij de hitte van de komende dagen het devies. Maar wt je drinkt, kan nogal een verschil maken voor het <extra_id_0> de klimaatimpact van cappuccino een veelvoud <extra_id_1> thee, sap of een biertje.","Goed drinken, dat is bij de hitte van de komende dagen het devies. Maar wt je drinkt, kan nogal een verschil maken voor het klimaat. Zo is de klimaatimpact van cappuccino een veelvoud van die van thee, sap of een biertje.","['klimaat. Zo is', 'van die van']","['klimaat. Zo is', 'van die van']",6,15,6,"[0.0, 0.0]",0.0
seq437-0,xl,"Gepaste afstand bewaren, sociaal contact vermijden en binnen zitten. De coronamaatregelen laten speeltuintjes ongebruikt en onze straten angstvallig leeg achter. In de serie Stilte in beeld vliegen we elke dag over een stille plaats. Vandaag een vlucht over",Gepaste <extra_id_0> contact vermijden en binnen zitten. De coronamaatregelen laten speeltuintjes ongebruikt en onze straten angstvallig <extra_id_1> de serie Stilte in beeld vliegen we elke dag over een stille plaats. Vandaag een vlucht over,"Gepaste maatregelen, contact vermijden en binnen zitten. De coronamaatregelen laten speeltuintjes ongebruikt en onze straten angstvallig stil. In de serie Stilte in beeld vliegen we elke dag over een stille plaats. Vandaag een vlucht over","['afstand bewaren', 'sociaal', 'leeg achter. In']","['maatregelen,', 'stil. In']",6,15,6,"[0.8, 0.875]",0.84
seq438-0,xl,"De Chinese stad Wuhan, waar de eerste besmetting met het coronavirus werd vastgesteld, sluit zijn luchthaven en treinstations voor uitgaande reizigers. Dat meldden staatsmedia woensdag. Ook het lokale openbaar vervoer gaat plat.","De Chinese stad Wuhan, waar de eerste besmetting met het <extra_id_0> zijn luchthaven en treinstations voor uitgaande reizigers. Dat meldden staatsmedia woensdag. Ook het lokale openbaar vervoer gaat plat.","De Chinese stad Wuhan, waar de eerste besmetting met het coronavirus werd gevonden, sluit zijn luchthaven en treinstations voor uitgaande reizigers. Dat meldden staatsmedia woensdag. Ook het lokale openbaar vervoer gaat plat.","['coronavirus werd vastgesteld', 'sluit']","['coronavirus werd gevonden, sluit']",5,15,6,[0.40625],0.41
seq439-0,xl,De transfermarkt is nog tot en met 31 januari geopend. Mis tot die tijd niets van alle geruchten en voltooide transfers in onze dagelijkse rubriek TransferTalk.,<extra_id_0> tot en met 31 januari geopend. Mis tot die tijd niets van alle geruchten en voltooide transfers in onze dagelijkse rubriek TransferTalk.,De transfermarkt is tot en met 31 januari geopend. Mis tot die tijd niets van alle geruchten en voltooide transfers in onze dagelijkse rubriek TransferTalk.,['De transfermarkt is nog'],['De transfermarkt is'],4,15,6,[0.17391304347826086],0.17
seq440-0,xl,Frenkie de Jong (21) sluit zich vanaf 1 juli aan in de rijke traditie van Nederlandse voetballers bij FC Barcelona. De middenvelder heeft voor vijf jaar getekend bij de Spaanse grootmacht. Met Messi spelen wordt heel speciaal voor mij.,Frenkie de Jong <extra_id_0> aan in de rijke traditie van Nederlandse voetballers bij FC Barcelona. De middenvelder heeft voor vijf jaar getekend bij de Spaanse grootmacht. Met Messi spelen wordt heel speciaal voor mij.,Frenkie de Jong sluit zich aan in de rijke traditie van Nederlandse voetballers bij FC Barcelona. De middenvelder heeft voor vijf jaar getekend bij de Spaanse grootmacht. Met Messi spelen wordt heel speciaal voor mij.,['(21) sluit zich vanaf 1 juli'],['sluit zich'],6,15,6,[0.6428571428571429],0.64
seq441-0,xl,"Minister Ingrid van Engelshoven (onderwijs, D66) grijpt hard in na uitspraken van de rector van de Islamitische Universiteit Rotterdam. Deze keer zou hij hebben gezegd dat Glenisten volgens de islam de doodstraf verdienen. Na vele provocaties lijkt Ahmed Akgndz zijn hand te hebben overspeeld.","Minister Ingrid van Engelshoven (onderwijs, D66) grijpt hard in na uitspraken van de rector van de Islamitische Universiteit Rotterdam. Deze keer zou hij hebben gezegd dat Glenisten <extra_id_0> doodstraf <extra_id_1> provocaties lijkt Ahmed Akgndz zijn hand te hebben overspeeld.","Minister Ingrid van Engelshoven (onderwijs, D66) grijpt hard in na uitspraken van de rector van de Islamitische Universiteit Rotterdam. Deze keer zou hij hebben gezegd dat Glenisten de doodstraf verdienen. Met zijn provocaties lijkt Ahmed Akgndz zijn hand te hebben overspeeld.","['volgens de islam de', 'verdienen. Na vele']","['de', 'verdienen. Met zijn']",7,15,6,"[0.8947368421052632, 0.3684210526315789]",0.63
seq442-0,xl,De Turkse politie in Istanboel heeft vanochtend de Nederlandse correspondent Ans Boersma (30) het land uitgezet.,De Turkse politie in Istanboel heeft vanochtend de <extra_id_0> Ans Boersma (30) het land uitgezet.,De Turkse politie in Istanboel heeft vanochtend de Nederlandse Ans Boersma (30) het land uitgezet.,['Nederlandse correspondent'],['Nederlandse'],2,15,6,[0.56],0.56
seq443-0,xl,"in <a href=""https://twitter.com/hashtag/Maastricht?src=hash&amp;ref_src=twsrc%5Etfw"">#Maastricht</a>","in <a href=""https://twitter.com/hashtag/Maastricht?src=hash&amp;ref_src=twsrc%5Etfw"">#Maastricht</a>","in <a href=""https://twitter.com/hashtag/Maastricht?src=hash&amp;ref_src=twsrc%5Etfw"">#Maastricht</a>",[''],[],1,15,6,[],
seq444-0,xl,"De politie in Groningen heeft, naar aanleiding van de incidenten rond het boerenprotest van gisteren, twee nieuwe aanhoudingen verricht. Het gaat daarbij om","De politie in Groningen heeft, naar aanleiding van de incidenten rond het boerenprotest van <extra_id_0> aanhoudingen verricht. Het gaat daarbij om","De politie in Groningen heeft, naar aanleiding van de incidenten rond het boerenprotest van afgelopen weekend, diverse aanhoudingen verricht. Het gaat daarbij om","['gisteren', 'twee nieuwe']","['afgelopen weekend, diverse']",3,15,6,[0.8461538461538461],0.85
seq445-0,xl,"</a> <a href=""https://twitter.com/hashtag/eindelijk?src=hash&amp;ref_src=twsrc%5Etfw"">#eindelijk</a> <a href=""https://t","</a> <a href=""https://twitter.com/hashtag/eindelijk?src=hash&amp;ref_src=twsrc%5Etfw"">#eindelijk</a> <a href=""https://t","</a> <a href=""https://twitter.com/hashtag/eindelijk?src=hash&amp;ref_src=twsrc%5Etfw"">#eindelijk</a> <a href=""https://t",[''],[],1,15,6,[],
seq446-0,xl,Het is zomer...En wat is er dan leuker dan het maken van mooie fotos en die te delen met de rest van de wereld?!,Het is zomer...En wat is er dan leuker dan het maken van mooie fotos <extra_id_0> met de rest van de wereld?!,Het is zomer...En wat is er dan leuker dan het maken van mooie fotos en het delen met de rest van de wereld?!,['en die te delen'],['en het delen'],4,15,6,[0.26666666666666666],0.27
seq447-0,xl,"De scootmobiel is momenteel niet veilig genoeg, blijkt uit een groot nieuw onderzoek. De manier van remmen en de stabiliteit van het karretje laten te wensen over en dat kan leiden tot",De scootmobiel is momenteel <extra_id_0> uit een groot nieuw onderzoek. De manier van remmen en de stabiliteit van het karretje laten te wensen over en dat kan leiden tot,De scootmobiel is momenteel het onderwerp uit een groot nieuw onderzoek. De manier van remmen en de stabiliteit van het karretje laten te wensen over en dat kan leiden tot,"['niet veilig genoeg', 'blijkt']",['het onderwerp'],5,15,6,[0.7777777777777778],0.78
seq448-0,xl,"In meer dan honderd Nederlandse gemeenten stijgt het aantal inbraken in de zomermaanden. In middelgrote steden als Delft, Leeuwarden en Lelystad neemt de kans op inbraak zelfs met tientallen procenten toe, blijkt uit een analyse","In meer <extra_id_0> stijgt het aantal inbraken in de zomermaanden. In middelgrote steden als Delft, Leeuwarden en Lelystad neemt de kans op inbraak zelfs met tientallen procenten toe, blijkt uit een analyse","In meer dan twintig steden stijgt het aantal inbraken in de zomermaanden. In middelgrote steden als Delft, Leeuwarden en Lelystad neemt de kans op inbraak zelfs met tientallen procenten toe, blijkt uit een analyse",['dan honderd Nederlandse gemeenten'],['dan twintig steden'],5,15,6,[0.7272727272727273],0.73
seq449-0,xl,"Traditionele beroepen, van molenaar tot beroepsvisser en van glasblazer tot mandenvlechter. In de regio zijn ze er nog volop, maar is er anno 2019","Traditionele beroepen, van molenaar tot <extra_id_0> tot mandenvlechter. In de regio zijn ze er nog volop, maar is er anno 2019","Traditionele beroepen, van molenaar tot bakker, van bakker tot mandenvlechter. In de regio zijn ze er nog volop, maar is er anno 2019",['beroepsvisser en van glasblazer'],"['bakker, van bakker']",4,15,6,[0.6451612903225806],0.65
seq450-0,xl,"Waar zijn ze gebleven? Een BNer die de schijnwerpers achter zich heeft gelaten, praat u in deze rubriek bij. Vandaag:","Waar zijn ze gebleven? Een BNer die de schijnwerpers achter zich heeft gelaten, praat u in <extra_id_0> Vandaag:","Waar zijn ze gebleven? Een BNer die de schijnwerpers achter zich heeft gelaten, praat u in de oren. Vandaag:",['deze rubriek bij.'],['de oren.'],3,15,6,[0.6470588235294118],0.65
seq451-0,xl,Op reis in Europa vliegen Nederlanders meestal naar het zonnige Zuiden. Wij niet. Wij pakken deze zomer de bus naar het Oosten. Vandaag deel,Op reis in Europa vliegen Nederlanders meestal naar het zonnige Zuiden. Wij niet. Wij pakken deze zomer de bus <extra_id_0> deel,Op reis in Europa vliegen Nederlanders meestal naar het zonnige Zuiden. Wij niet. Wij pakken deze zomer de bus deel,['naar het Oosten. Vandaag'],[''],4,15,6,[1.0],1.0
seq452-0,xl,"Van leerkrachten en zorgmedewerkers tot netwerkbeheerders, vakkenvullers en vuilnismannen, ze hebben in deze coronacrisis ineens allemaal een vitaal beroep: een baan die de samenleving draaiende houdt in barre tijden. Wie zijn deze onmisbare mensen? De PZC belicht hen de komende tijd. Vandaag:","Van leerkrachten en zorgmedewerkers tot netwerkbeheerders, <extra_id_0> ze hebben in deze coronacrisis ineens allemaal een vitaal beroep: een baan die de samenleving draaiende houdt in barre tijden. Wie zijn deze onmisbare <extra_id_1> belicht hen de komende tijd. Vandaag:","Van leerkrachten en zorgmedewerkers tot netwerkbeheerders, verpleegkundigen en laboranten, ze hebben in deze coronacrisis ineens allemaal een vitaal beroep: een baan die de samenleving draaiende houdt in barre tijden. Wie zijn deze onmisbare professionals? De EO belicht hen de komende tijd. Vandaag:","['vakkenvullers en vuilnismannen,', 'mensen? De PZC']","['verpleegkundigen en laboranten,', 'professionals? De EO']",6,15,6,"[0.6774193548387096, 0.65]",0.66
seq453-0,xl,"Deze vrouw had geen inkomsten, maar wel drie woningen, twee autos en dure horloges. Nu heeft ze de FIOD","Deze vrouw had geen inkomsten, <extra_id_0> woningen, twee autos en dure horloges. Nu heeft ze de FIOD","Deze vrouw had geen inkomsten, maar had wel twee woningen, twee autos en dure horloges. Nu heeft ze de FIOD",['maar wel drie'],['maar had wel twee'],3,15,6,[0.4117647058823529],0.41
seq454-0,xl,"Het college van b en w, dat hiervan op de hoogte is gesteld, benadrukt juist dat k uit het onderzoek blijkt dat bewoners de verkeersveiligheid in de wijk een kleine voldoende geven.","Het college van b en <extra_id_0> de hoogte is gesteld, benadrukt juist dat k uit het onderzoek blijkt dat bewoners de verkeersveiligheid in de wijk een kleine voldoende geven.","Het college van b en w, dat van het onderzoek op de hoogte is gesteld, benadrukt juist dat k uit het onderzoek blijkt dat bewoners de verkeersveiligheid in de wijk een kleine voldoende geven.","['w', 'dat hiervan op']","['w, dat van het onderzoek op']",5,15,6,[0.9629629629629629],0.96
seq455-0,xl,"gewonden gevallen, onder wie een jonge jongen. Het incident gebeurde waarschijnlijk nadat er ruzie was ontstaan omdat de organisatie","gewonden gevallen, onder wie een jonge jongen. Het incident gebeurde waarschijnlijk <extra_id_0> was ontstaan omdat de organisatie","gewonden gevallen, onder wie een jonge jongen. Het incident gebeurde waarschijnlijk nadat er onrust was ontstaan omdat de organisatie",['nadat er ruzie'],['nadat er onrust'],3,15,6,[0.3333333333333333],0.33
seq456-0,xl,"wilde annuleren. De 21-jarige bestuurder van de auto is aangehouden, samen met een tweede verdachte","wilde annuleren. <extra_id_0> bestuurder van de auto is aangehouden, samen met een tweede verdachte","wilde annuleren. De bestuurder van de auto is aangehouden, samen met een tweede verdachte",['De 21-jarige'],['De'],2,15,6,[0.8333333333333334],0.83
seq457-0,xl,"<a href=""https://twitter.com/hashtag/mafs?src=hash&amp;ref_src=twsrc%5Etfw"">#mafs</a> <a href=""https://t","<a href=""https://twitter.com/hashtag/mafs?src=hash&amp;ref_src=twsrc%5Etfw"">#mafs</a> <a href=""https://t","<a href=""https://twitter.com/hashtag/mafs?src=hash&amp;ref_src=twsrc%5Etfw"">#mafs</a> <a href=""https://t",[''],[],1,15,6,[],
seq458-0,xl,"Het MH17-onderzoeksteam doet een nieuwe getuigenoproep in het strafrechtelijk onderzoek. Het Joint Investigation Team (JIT) zoekt informatie over politieke en militaire topfunctionarissen uit Rusland, die mogelijk opdracht hebben gegeven tot het neerhalen van het toestel.",Het MH17-onderzoeksteam doet een nieuwe getuigenoproep in het strafrechtelijk onderzoek. Het Joint Investigation Team (JIT) zoekt informatie over politieke en militaire topfunctionarissen uit <extra_id_0> hebben gegeven tot het neerhalen van het toestel.,Het MH17-onderzoeksteam doet een nieuwe getuigenoproep in het strafrechtelijk onderzoek. Het Joint Investigation Team (JIT) zoekt informatie over politieke en militaire topfunctionarissen uit Rusland die opdracht hebben gegeven tot het neerhalen van het toestel.,"['Rusland', 'die mogelijk opdracht']",['Rusland die opdracht'],5,15,6,[0.65],0.65
seq459-0,xl,"Korte updates van de sterren op sociale media  wij smullen ervan. In de rubriek Showbytes struint de showredactie het web af voor de gekste, mooiste en opvallendste posts van bekend Nederland. Dit artikel wordt gedurende de dag vernieuwd.","Korte updates van de sterren op sociale media <extra_id_0> In de rubriek Showbytes struint de <extra_id_1> af voor de gekste, mooiste en opvallendste posts van bekend Nederland. Dit artikel wordt gedurende de dag vernieuwd.","Korte updates van de sterren op sociale media In de rubriek Showbytes struint de redactie de sociale media af voor de gekste, mooiste en opvallendste posts van bekend Nederland. Dit artikel wordt gedurende de dag vernieuwd.","['wij smullen ervan.', 'showredactie het web']","['', 'redactie de sociale media']",6,15,6,"[1.0, 0.68]",0.84
seq460-0,xl,"<a href=""https://twitter.com/hashtag/sneeuw?src=hash&amp;ref_src=twsrc%5Etfw"">#sneeuw</a> <a href=""https://t","<a href=""https://twitter.com/hashtag/sneeuw?src=hash&amp;ref_src=twsrc%5Etfw"">#sneeuw</a> <a href=""https://t","<a href=""https://twitter.com/hashtag/sneeuw?src=hash&amp;ref_src=twsrc%5Etfw"">#sneeuw</a> <a href=""https://t",[''],[],1,15,6,[],
seq461-0,xl,"ondernemers zoeken hun weg op de nieuwe 1,5 meter werkvloer. Sommigen hebben hun terrassen aangepast, anderen blijven - ook nu nog - bezorgen.","ondernemers zoeken hun weg op de nieuwe 1,5 meter werkvloer. Sommigen hebben hun terrassen aangepast, anderen <extra_id_0> nu nog - bezorgen.","ondernemers zoeken hun weg op de nieuwe 1,5 meter werkvloer. Sommigen hebben hun terrassen aangepast, anderen laten - nu nog - bezorgen.",['blijven - ook'],['laten -'],3,15,6,[0.6153846153846154],0.62
seq462-0,xl,Veenendaler Alfred Slomp winkelt met God in de supermarkt. Hij denkt bij elk artikel dat hij in zijn boodschappenmandje laadt aan hoe dat wel of niet bijdraagt aan een betere wereld. Hij geeft daar ook workshops over.,Veenendaler Alfred Slomp winkelt met God in de supermarkt. Hij denkt bij elk artikel dat hij <extra_id_0> laadt aan hoe dat wel <extra_id_1> aan een betere wereld. Hij geeft daar ook workshops over.,Veenendaler Alfred Slomp winkelt met God in de supermarkt. Hij denkt bij elk artikel dat hij koopt en laadt aan hoe dat wel bijdraagt aan een betere wereld. Hij geeft daar ook workshops over.,"['in zijn boodschappenmandje', 'of niet bijdraagt']","['koopt en', 'bijdraagt']",6,15,6,"[0.8461538461538461, 0.47058823529411764]",0.66
seq463-0,xl,Er komt vooralsnog geen uitzetstop voor asielkinderen. Dat zegt VVD-fractieleider Klaas Dijkhoff na het wekelijkse coalitieoverleg. ChristenUnie en D66 spraken zich uit voor zo,Er komt vooralsnog geen uitzetstop voor asielkinderen. <extra_id_0> Dijkhoff na het wekelijkse coalitieoverleg. ChristenUnie en D66 spraken zich uit voor zo,Er komt vooralsnog geen uitzetstop voor asielkinderen. Dat zei minister Dijkhoff na het wekelijkse coalitieoverleg. ChristenUnie en D66 spraken zich uit voor zo,['Dat zegt VVD-fractieleider Klaas'],['Dat zei minister'],4,15,6,[0.6875],0.69
seq464-0,xl,". <a href=""https://twitter.com/hashtag/file?src=hash&amp;ref_src=twsrc%5Etfw"">#file</a> <a href=""https://t",". <a href=""https://twitter.com/hashtag/file?src=hash&amp;ref_src=twsrc%5Etfw"">#file</a> <a href=""https://t",". <a href=""https://twitter.com/hashtag/file?src=hash&amp;ref_src=twsrc%5Etfw"">#file</a> <a href=""https://t",[''],[],1,15,6,[],
seq465-0,xl,"5 Schrijver, journalist en columnist Jerry Goossens schrijft van dinsdag tot en met zaterdag over wat hem opvalt in de stad Utrecht. Dit keer over het","5 Schrijver, journalist en columnist Jerry Goossens schrijft van dinsdag tot en met zaterdag over wat hem <extra_id_0> Utrecht. Dit keer over het","5 Schrijver, journalist en columnist Jerry Goossens schrijft van dinsdag tot en met zaterdag over wat hem bezighoudt in Utrecht. Dit keer over het",['opvalt in de stad'],['bezighoudt in'],4,15,6,[0.8823529411764706],0.88
