seq36-0,base,"In de steden duiken cokelabs op in appartementen, garageboxen of zelfs boven een kinderdagverblijf. Midden in de dichtbevolkte wijken, zoals in Rotterdam waar een flat explodeerde.","In de steden duiken cokelabs op in appartementen, garageboxen of zelfs boven een kinderdagverblijf. Midden in de <extra_id_0> zoals in <extra_id_1> flat explodeerde.","In de steden duiken cokelabs op in appartementen, garageboxen of zelfs boven een kinderdagverblijf. Midden in de stad, zoals in de flat explodeerde.","['dichtbevolkte wijken,', 'Rotterdam waar een']","['stad,', 'de']",5,20,1,"[0.9047619047619048, 0.8888888888888888]",0.9
seq37-0,base,Eerder deze maand kondigde French Gates aan dat ze de Bill & Melinda Gates Foundation (BMGF) ging verlaten.,Eerder deze maand kondigde French Gates aan dat ze <extra_id_0> Gates Foundation (BMGF) ging verlaten.,Eerder deze maand kondigde French Gates aan dat ze de Boston Gates Foundation (BMGF) ging verlaten.,['de Bill & Melinda'],['de Boston'],4,20,1,[0.7058823529411765],0.71
seq38-0,base,"Stoelen, banken, pallets, fietsen  de barricades die zijn opgeworpen door de demonstranten die het universiteitsgebouw in de Amsterdamse binnenstad hebben bezet, blijken weinig partij voor de ME.","Stoelen, banken, pallets, fietsen de <extra_id_0> opgeworpen door de demonstranten <extra_id_1> universiteitsgebouw in de Amsterdamse binnenstad hebben bezet, blijken weinig partij voor de ME.","Stoelen, banken, pallets, fietsen de wapens opgeworpen door de demonstranten die het universiteitsgebouw in de Amsterdamse binnenstad hebben bezet, blijken weinig partij voor de ME.","['barricades die zijn', 'die het']","['wapens', 'die het']",5,20,1,"[0.8947368421052632, 0.0]",0.45
seq39-0,base,"Wonen in een comfortabel verwarmd huis van steen met een pannendak: dat was voor het gros van de mensen in het verleden een utopie. Het zag er wellicht romantisch uit zon lieflijk huisje, maar er werd bittere armoede geleden.",Wonen in een comfortabel verwarmd huis van steen met een pannendak: dat was voor het gros van de mensen in het verleden <extra_id_0> Het zag er wellicht romantisch uit zon <extra_id_1> er werd <extra_id_2>,Wonen in een comfortabel verwarmd huis van steen met een pannendak: dat was voor het gros van de mensen in het verleden een droom. Het zag er wellicht romantisch uit zon er werd een...,"['een utopie.', 'lieflijk huisje', 'maar', 'bittere armoede geleden.']","['een droom.', '', 'een...']",8,20,1,"[0.45454545454545453, 1.0, 1.0]",0.82
seq40-0,base,"Griekenland stuurt asielzoekers die al aan land zijn terug de zee op en laat hen achter in rubberbootjes, hebben ngos en journalisten gedocumenteerd.","Griekenland stuurt asielzoekers die al aan land zijn terug de zee op en laat hen <extra_id_0> rubberbootjes, hebben <extra_id_1> gedocumenteerd.","Griekenland stuurt asielzoekers die al aan land zijn terug de zee op en laat hen liggen in rubberbootjes, hebben ze gedocumenteerd.","['achter in', 'ngos en journalisten']","['liggen in', 'ze']",5,20,1,"[0.5555555555555556, 0.95]",0.75
seq41-0,base,De elfde editie van de Willem IV Rally was een groot succes. Dat meldt Arne Verwoert van de organisatie. Dit jaar is er ruim 11.500 euro opgehaald voor het Ronald McDonald Huis Sophia Rotterdam.,De elfde editie <extra_id_0> IV Rally was een groot succes. Dat meldt Arne Verwoert van de organisatie. Dit jaar is er ruim 11.500 euro opgehaald voor het <extra_id_1> Rotterdam.,De elfde editie van de IV Rally was een groot succes. Dat meldt Arne Verwoert van de organisatie. Dit jaar is er ruim 11.500 euro opgehaald voor het evenement in Rotterdam.,"['van de Willem', 'Ronald McDonald Huis Sophia']","['van de', 'evenement in']",7,20,1,"[0.5384615384615384, 0.8888888888888888]",0.71
seq42-0,base,Een groep hardnekkige verslaafden heeft het toiletgebouw in een Utrechts park gekaapt en daar hun eigen drugshol ingericht. Ze omzeilen zo ongestoord en onbestraft het verbod om drugs op straat te gebruiken.,Een groep hardnekkige verslaafden heeft het toiletgebouw in een Utrechts park gekaapt en daar <extra_id_0> ingericht. Ze omzeilen zo ongestoord en onbestraft het verbod om <extra_id_1> te gebruiken.,Een groep hardnekkige verslaafden heeft het toiletgebouw in een Utrechts park gekaapt en daar een toilet ingericht. Ze omzeilen zo ongestoord en onbestraft het verbod om toiletten te gebruiken.,"['hun eigen drugshol', 'drugs op straat']","['een toilet', 'toiletten']",6,20,1,"[0.7777777777777778, 0.8666666666666667]",0.82
seq43-0,base,Cees Dekker | hoogleraar biofysica Hoe is het leven ontstaan? Synthetische cellen maken dat inzichtelijk. Als je zoiets zelf bouwt ga je begrijpen hoe het werkt.,Cees Dekker | hoogleraar biofysica Hoe is het leven ontstaan? Synthetische cellen maken dat inzichtelijk. Als je zoiets zelf bouwt <extra_id_0> hoe <extra_id_1>,Cees Dekker | hoogleraar biofysica Hoe is het leven ontstaan? Synthetische cellen maken dat inzichtelijk. Als je zoiets zelf bouwt hoe komt het er vandaan?,"['ga je begrijpen', 'het werkt.']","['', 'vandaan?']",5,20,1,"[1.0, 1.0]",1.0
seq44-0,base,De herdenking van de landing van de geallieerden in Normandi roept vragen op over waar het Westen anno 2024 staat.,De herdenking van de landing van de geallieerden in Normandi roept vragen op over waar het <extra_id_0>,De herdenking van de landing van de geallieerden in Normandi roept vragen op over waar het schip ligt.,['Westen anno 2024 staat.'],['ligt.'],4,20,1,[0.9130434782608695],0.91
seq45-0,base,Politiek verslaggever Hans van Soest schrijft wekelijks over Haagse zaken die ons allemaal aangaan. In deze aflevering: Nog altijd is er geen regeling voor zware beroepen.,Politiek verslaggever Hans van Soest <extra_id_0> Haagse zaken die ons allemaal aangaan. In deze aflevering: Nog altijd is <extra_id_1> regeling voor zware beroepen.,Politiek verslaggever Hans van Soest over de Haagse zaken die ons allemaal aangaan. In deze aflevering: Nog altijd is er een regeling voor zware beroepen.,"['schrijft wekelijks over', 'er geen']","['over de', 'er een']",5,20,1,"[0.8695652173913043, 0.14285714285714285]",0.51
seq46-0,base,Na eerdere problemen rond de vergunning mag de bouw van een boorplatform in de Noordzee worden hervat. Milieuorganisaties hadden een rechtszaak aangespannen om de bouw tegen te houden.,Na eerdere <extra_id_0> vergunning mag de bouw van een boorplatform in de Noordzee <extra_id_1> hadden een rechtszaak aangespannen om de bouw tegen te houden.,Na eerdere vragen over vergunning mag de bouw van een boorplatform in de Noordzee stoppen. De gemeenten hadden een rechtszaak aangespannen om de bouw tegen te houden.,"['problemen rond de', 'worden hervat. Milieuorganisaties']","['vragen over', 'stoppen. De gemeenten']",6,20,1,"[0.7058823529411765, 0.7575757575757576]",0.73
seq47-0,base,Daan en het ongelijk van de rommelmarktheks Uren samen spelen is verruild voor me-time op eigen kamers. Daan Rot schrijft in weekendmagazine Mezza wekelijks over zijn persoonlijk leven,Daan en het ongelijk van de rommelmarktheks Uren samen spelen is verruild voor me-time op eigen kamers. Daan Rot schrijft <extra_id_0> wekelijks <extra_id_1> leven,Daan en het ongelijk van de rommelmarktheks Uren samen spelen is verruild voor me-time op eigen kamers. Daan Rot schrijft over wekelijks gebeurtenissen in zijn leven,"['in weekendmagazine Mezza', 'over zijn persoonlijk']","['over', 'gebeurtenissen in zijn']",6,20,1,"[0.9583333333333334, 0.8181818181818182]",0.89
seq48-0,base,Inwoners van het Friese Waadhoeke hebben tot maandochtend moeten wachten op de verkiezingsuitslag van de Europese verkiezingen. Die lag veilig opgeborgen in een kluis in het gemeentehuis waar in het weekend een tijdslot op zit.,Inwoners van het Friese Waadhoeke hebben tot maandochtend moeten wachten op de verkiezingsuitslag van de Europese <extra_id_0> veilig opgeborgen in <extra_id_1> gemeentehuis waar in het weekend een tijdslot op zit.,Inwoners van het Friese Waadhoeke hebben tot maandochtend moeten wachten op de verkiezingsuitslag van de Europese verkiezingen. Ze zijn veilig opgeborgen in het gemeentehuis waar in het weekend een tijdslot op zit.,"['verkiezingen. Die lag', 'een kluis in het']","['verkiezingen. Ze zijn', 'het']",7,20,1,"[0.2857142857142857, 0.8125]",0.55
seq49-0,base,Een beruchte hackersgroep stelt gevoelige informatie van in totaal 560 miljoen klanten van Ticketmaster te hebben gestolen. De groep eist omgerekend zon 460 duizend euro losgeld van het Amerikaanse kaartverkoopbedrijf.,Een beruchte hackersgroep stelt gevoelige informatie van in totaal <extra_id_0> van Ticketmaster te hebben gestolen. De groep eist omgerekend zon 460 duizend euro losgeld van <extra_id_1>,Een beruchte hackersgroep stelt gevoelige informatie van in totaal 20.000 euro van Ticketmaster te hebben gestolen. De groep eist omgerekend zon 460 duizend euro losgeld van de stichting.,"['560 miljoen klanten', 'het Amerikaanse kaartverkoopbedrijf.']","['20.000 euro', 'stichting.']",6,20,1,"[0.8947368421052632, 0.8611111111111112]",0.88
seq50-0,base,"Honderden paginas aan ambtelijk commentaar op het Hoofdlijnenakkoord van PVV, VVD, NSC en BBB zijn vrijgegeven. Er zijn grote vraagtekens op allerlei terreinen, van het buitenlandbeleid en defensie tot landbouw en sociale zekerheid.","Honderden paginas aan ambtelijk commentaar op het Hoofdlijnenakkoord van PVV, VVD, NSC en BBB zijn vrijgegeven. Er zijn grote <extra_id_0> terreinen, <extra_id_1> defensie tot landbouw en sociale zekerheid.","Honderden paginas aan ambtelijk commentaar op het Hoofdlijnenakkoord van PVV, VVD, NSC en BBB zijn vrijgegeven. Er zijn grote vraagstukken op verschillende terreinen, van defensie tot landbouw en sociale zekerheid.","['vraagtekens op allerlei', 'van het buitenlandbeleid en']","['vraagstukken op verschillende', 'van']",7,20,1,"[0.4827586206896552, 0.8888888888888888]",0.69
seq51-0,base,"Naar aanleiding van de grote hoeveelheid pfas in eieren rond de fabriek van Chemours in Dordrecht, start het RIVM een nieuw onderzoek.","Naar aanleiding van <extra_id_0> in eieren rond de fabriek van Chemours in Dordrecht, start het RIVM een nieuw onderzoek.","Naar aanleiding van het onderzoek in eieren rond de fabriek van Chemours in Dordrecht, start het RIVM een nieuw onderzoek.",['de grote hoeveelheid pfas'],['het onderzoek'],4,20,1,[0.76],0.76
seq52-0,base,De gemeente Voorne aan Zee wil dat er over de huisvesting van arbeidsmigranten goede afspraken komen.,De <extra_id_0> Zee wil dat er over de huisvesting van arbeidsmigranten goede afspraken komen.,De Koning aan Zee wil dat er over de huisvesting van arbeidsmigranten goede afspraken komen.,['gemeente Voorne aan'],['Koning aan'],3,20,1,[0.6842105263157895],0.68
seq53-0,base,Aan het veluweplein in Den Haag zijn zondagochtend drie personen aangehouden na een crash met een gesloten motor. De kruising was langere tijd afgesloten vanwege politieonderzoek.,Aan het veluweplein in Den Haag zijn zondagochtend drie personen aangehouden na een crash <extra_id_0> motor. De kruising was langere tijd afgesloten <extra_id_1>,Aan het veluweplein in Den Haag zijn zondagochtend drie personen aangehouden na een crash van een motor. De kruising was langere tijd afgesloten De...,"['met een gesloten', 'vanwege politieonderzoek.']","['van een', 'De...']",5,20,1,"[0.6875, 0.92]",0.8
seq54-0,base,"Door middel van misleiding kunnen legers zich groter maken dan ze zijn. Het concept was bij het Westen wat uit de gratie geraakt, maar is door de oorlog in Oekrane weer terug.","Door middel van misleiding kunnen legers zich groter maken dan ze zijn. Het concept was <extra_id_0> wat uit de gratie geraakt, maar is door de oorlog <extra_id_1> terug.","Door middel van misleiding kunnen legers zich groter maken dan ze zijn. Het concept was al wat uit de gratie geraakt, maar is door de oorlog weer terug.","['bij het Westen', 'in Oekrane weer']","['al', 'weer']",6,20,1,"[1.0, 0.7333333333333333]",0.87
seq55-0,base,"Eerder deze maand kondigde French Gates aan dat ze de Bill & Melinda Gates Foundation (BMGF) ging verlaten. Ze zei al dat ze actief wilde blijven als filantroop, maar dat ze later zou aankondigen op welke manier.","Eerder deze maand kondigde French Gates aan dat ze de Bill & Melinda Gates Foundation (BMGF) ging verlaten. Ze zei al <extra_id_0> wilde blijven als filantroop, maar <extra_id_1> aankondigen op welke manier.","Eerder deze maand kondigde French Gates aan dat ze de Bill & Melinda Gates Foundation (BMGF) ging verlaten. Ze zei al dat ze wilde blijven als filantroop, maar ze wilde niet aankondigen op welke manier.","['dat ze actief', 'dat ze later zou']","['dat ze', 'ze wilde niet']",7,20,1,"[0.5384615384615384, 0.8125]",0.68
seq56-0,base,Een groep hardnekkige verslaafden heeft het toiletgebouw in een Utrechts park gekaapt en daar hun eigen drugshol ingericht. Ze omzeilen zo ongestoord en onbestraft het verbod om drugs op straat te gebruiken. Normale bezoekers van het park worden door de verslaafden geweerd bij het toilet.,Een groep <extra_id_0> het toiletgebouw in een Utrechts park gekaapt en daar hun eigen drugshol ingericht. Ze omzeilen zo ongestoord en onbestraft <extra_id_1> drugs op straat te gebruiken. Normale bezoekers <extra_id_2> worden door de verslaafden geweerd bij het toilet.,Een groep jongeren heeft het toiletgebouw in een Utrechts park gekaapt en daar hun eigen drugshol ingericht. Ze omzeilen zo ongestoord en onbestraft de verplichting om drugs op straat te gebruiken. Normale bezoekers van het park worden door de verslaafden geweerd bij het toilet.,"['hardnekkige verslaafden heeft', 'het verbod om', 'van het park']","['jongeren heeft', 'de verplichting om', 'van het park']",9,20,1,"[0.5862068965517241, 0.6111111111111112, 0.0]",0.4
seq57-0,base,"Door middel van misleiding kunnen legers zich groter maken dan ze zijn. Het concept was bij het Westen wat uit de gratie geraakt, maar is door de oorlog in Oekrane weer terug.",Door middel van misleiding kunnen legers zich groter maken dan ze zijn. Het concept was <extra_id_0> wat uit de <extra_id_1> is door de oorlog in Oekrane weer terug.,Door middel van misleiding kunnen legers zich groter maken dan ze zijn. Het concept was echter wat uit de geschiedenis is door de oorlog in Oekrane weer terug.,"['bij het Westen', 'gratie geraakt', 'maar']","['echter', 'geschiedenis']",6,20,1,"[0.7857142857142857, 0.7857142857142857]",0.79
seq58-0,base,"Een nieuwbouwwoning die in een ochtendje op zijn plek wordt gezet. Met vloerverwarming, badkamer en al. n voor een scherpe prijs.","Een nieuwbouwwoning die in een ochtendje op zijn plek wordt gezet. Met vloerverwarming, badkamer <extra_id_0> een scherpe prijs.","Een nieuwbouwwoning die in een ochtendje op zijn plek wordt gezet. Met vloerverwarming, badkamer en keuken voor een scherpe prijs.",['en al. n voor'],['en keuken voor'],4,20,1,[0.35714285714285715],0.36
seq59-0,base,"Dubbele seksuele moraal is achterhaald, laat vrouwen ook kinderen hebben bij verschillende mensen",Dubbele seksuele <extra_id_0> laat vrouwen ook kinderen hebben bij verschillende mensen,Dubbele seksuele omgang laat vrouwen ook kinderen hebben bij verschillende mensen,"['moraal is achterhaald,']",['omgang'],3,20,1,[0.9090909090909091],0.91
seq60-0,base,"Bij het St. Antonius Ziekenhuis in Nieuwegein stortte een deel van een parkeergarage in. Het ongeval doet denken aan een soortgelijk incident in Eindhoven, zeven jaar geleden. Volgens experts schiet het toezicht in de bouwsector tekort: er is een vacum waar het op constructiecontroles aankomt.",Bij het St. Antonius Ziekenhuis in Nieuwegein stortte een deel van een parkeergarage in. Het ongeval doet denken aan een soortgelijk <extra_id_0> zeven jaar geleden. Volgens experts schiet het toezicht in de <extra_id_1> is een vacum waar <extra_id_2> aankomt.,Bij het St. Antonius Ziekenhuis in Nieuwegein stortte een deel van een parkeergarage in. Het ongeval doet denken aan een soortgelijk ongeluk zeven jaar geleden. Volgens experts schiet het toezicht in de steigers en is een vacum waar het op aankomt.,"['incident in Eindhoven,', 'bouwsector tekort: er', 'het op constructiecontroles']","['ongeluk', 'steigers en', 'het op']",9,20,1,"[0.9090909090909091, 0.7142857142857143, 0.7777777777777778]",0.8
seq61-0,base,"Het Amsterdamse Waternet, verantwoordelijk voor schoon drinkwater n het onderhoud van dijken en gemalen in het grootste waterschap van Nederland, moet worden opgesplitst. Er komen aparte organisaties voor beide taken.","Het Amsterdamse Waternet, verantwoordelijk voor schoon drinkwater n het onderhoud van dijken en gemalen in <extra_id_0> van Nederland, moet worden opgesplitst. Er komen aparte organisaties <extra_id_1>","Het Amsterdamse Waternet, verantwoordelijk voor schoon drinkwater n het onderhoud van dijken en gemalen in de rest van Nederland, moet worden opgesplitst. Er komen aparte organisaties aan de orde.","['het grootste waterschap', 'voor beide taken.']","['de rest', 'orde.']",6,20,1,"[0.782608695652174, 0.7058823529411765]",0.74
seq62-0,base,Op de laatste dag van de competitie heeft het door problemen geteisterde Vitesse goed nieuws te melden. Supporters hebben bijna 2 miljoen euro ingezameld met een crowdfundingsactie.,Op de laatste dag van de competitie heeft het door problemen geteisterde <extra_id_0> te melden. Supporters hebben bijna 2 miljoen euro ingezameld met <extra_id_1>,Op de laatste dag van de competitie heeft het door problemen geteisterde veld niets te melden. Supporters hebben bijna 2 miljoen euro ingezameld met de...,"['Vitesse goed nieuws', 'een crowdfundingsactie.']","['veld niets', 'de...']",5,20,1,"[0.631578947368421, 0.9130434782608695]",0.77
seq63-0,base,Deze donderdagmiddag neemt de Europese Centrale Bank 99 procent zeker een besluit waar de financile markten al maanden smachtend naar uitkijken: een renteverlaging.,Deze donderdagmiddag neemt de Europese Centrale Bank 99 procent zeker <extra_id_0> waar de financile <extra_id_1> smachtend naar uitkijken: een renteverlaging.,Deze donderdagmiddag neemt de Europese Centrale Bank 99 procent zeker van de koers waar de financile smachtend naar uitkijken: een renteverlaging.,"['een besluit', 'markten al maanden']","['van de koers', '']",5,20,1,"[0.75, 1.0]",0.88
seq64-0,base,"Novak Djokovic heeft zich geplaatst voor de vierde ronde (achtste finales) op Roland Garros, maar de nummer 1 van de wereld moest er lang op wachten. Het publiek ook: de laatste bal vloog pas zondagnacht om 6 minuten over 3 over het net.",Novak Djokovic heeft zich geplaatst <extra_id_0> ronde (achtste finales) <extra_id_1> maar <extra_id_2> van de wereld moest er lang op wachten. Het publiek ook: de laatste bal vloog pas zondagnacht om 6 minuten over 3 over het net.,"Novak Djokovic heeft zich geplaatst voor de eerste ronde (achtste finales) van de wereld, maar de rest van de wereld moest er lang op wachten. Het publiek ook: de laatste bal vloog pas zondagnacht om 6 minuten over 3 over het net.","['voor de vierde', 'op Roland Garros,', 'de nummer 1']","['voor de eerste', 'van de wereld,', 'de rest']",9,20,1,"[0.2857142857142857, 0.7647058823529411, 0.6363636363636364]",0.56
seq65-0,base,Een groep hardnekkige verslaafden heeft het toiletgebouw in een Utrechts park gekaapt en daar hun eigen drugshol ingericht. Ze omzeilen zo ongestoord en onbestraft het verbod om drugs op straat te gebruiken. Normale bezoekers van het park worden door de verslaafden geweerd bij het toilet.,Een groep hardnekkige verslaafden heeft het toiletgebouw in een Utrechts park gekaapt en daar hun eigen drugshol ingericht. Ze omzeilen zo ongestoord en onbestraft het verbod om drugs op straat <extra_id_0> bezoekers <extra_id_1> worden door de verslaafden geweerd <extra_id_2>,Een groep hardnekkige verslaafden heeft het toiletgebouw in een Utrechts park gekaapt en daar hun eigen drugshol ingericht. Ze omzeilen zo ongestoord en onbestraft het verbod om drugs op straat te zetten. De bezoekers van het park worden door de verslaafden geweerd,"['te gebruiken. Normale', 'van het park', 'bij het toilet.']","['te zetten. De', 'van het park', '']",9,20,1,"[0.5714285714285714, 0.0, 1.0]",0.52
seq66-0,base,"OpenAI, het bedrijf achter ChatGPT, schort een AI-stem op die sterk aan de stem van actrice Scarlett Johansson doet denken. Het bedrijf lijkt iets te veel inspiratie te hebben geput uit de film Her, waarvoor Johansson de stem van computersysteem Samantha insprak.","OpenAI, het bedrijf achter ChatGPT, schort een AI-stem op die sterk aan de stem van <extra_id_0> Johansson doet denken. Het bedrijf lijkt iets te veel inspiratie te hebben geput uit de film Her, <extra_id_1> stem van <extra_id_2>","OpenAI, het bedrijf achter ChatGPT, schort een AI-stem op die sterk aan de stem van Scarlett Johansson doet denken. Het bedrijf lijkt iets te veel inspiratie te hebben geput uit de film Her, waarin de stem van Scarlett...","['actrice Scarlett', 'waarvoor Johansson de', 'computersysteem Samantha insprak.']","['Scarlett', 'waarin de', 'Scarlett...']",8,20,1,"[0.5, 0.6190476190476191, 0.8787878787878788]",0.67
seq67-0,base,"De volgverkeerslichten kunnen persoonlijke gegevens van mensen verzamelen, onder meer via apps op smartphones. De Autoriteit Persoonsgegevens maakt zich zorgen.","De volgverkeerslichten kunnen persoonlijke gegevens van mensen verzamelen, onder meer via apps op smartphones. De Autoriteit <extra_id_0>","De volgverkeerslichten kunnen persoonlijke gegevens van mensen verzamelen, onder meer via apps op smartphones. De Autoriteit Persoonsgegevens",['Persoonsgegevens maakt zich zorgen.'],['Persoonsgegevens'],4,20,1,[0.5428571428571428],0.54
seq68-0,base,Miljoenen Afghanen leven onder de armoedegrens. Buitenlandse donoren bieden weinig hulp omdat de Taliban vrouwenrechten drastisch beperkten. Vermindering van de internationale hulp zal dezelfde Afghaanse vrouwen die we hopen te steunen alleen maar meer laten lijden.,Miljoenen Afghanen leven onder de armoedegrens. Buitenlandse donoren bieden <extra_id_0> de <extra_id_1> Vermindering van de internationale hulp zal dezelfde Afghaanse vrouwen die we hopen te steunen alleen maar meer laten lijden.,Miljoenen Afghanen leven onder de armoedegrens. Buitenlandse donoren bieden alleen de beste steun. Vermindering van de internationale hulp zal dezelfde Afghaanse vrouwen die we hopen te steunen alleen maar meer laten lijden.,"['weinig hulp omdat', 'Taliban vrouwenrechten drastisch beperkten.']","['alleen', 'beste steun.']",7,20,1,"[0.9411764705882353, 0.7674418604651163]",0.85
seq69-0,base,"Na de dood van de achttienjarige Ryan al Najjar kregen De Telegraaf en Leeuwarder Courant mails namens de vader, waarin de moord werd bekend.",Na de dood van de achttienjarige Ryan al Najjar kregen De Telegraaf <extra_id_0> Courant mails <extra_id_1> waarin de moord werd bekend.,Na de dood van de achttienjarige Ryan al Najjar kregen De Telegraaf en de Leiden Courant mails waarin de moord werd bekend.,"['en Leeuwarder', 'namens de vader,']","['en de Leiden', '']",5,20,1,"[0.5384615384615384, 1.0]",0.77
seq70-0,base,"Hoewel Donald Trumps veroordeling uniek is in de geschiedenis, geldt dat niet voor het onderliggende schandaal: een buitenechtelijke affaire.","Hoewel Donald Trumps veroordeling uniek is in de geschiedenis, geldt dat niet <extra_id_0> een buitenechtelijke affaire.","Hoewel Donald Trumps veroordeling uniek is in de geschiedenis, geldt dat niet voor een buitenechtelijke affaire.",['voor het onderliggende schandaal:'],['voor'],4,20,1,[0.8787878787878788],0.88
seq71-0,base,"Het hoofdlijnenakkoord van het kabinet-in-wording begint met een gedicht. Nederland is een prachtig land./ Een land om trots op te zijn. En zo gaat het nog een beetje door, totdat er onverwacht een lange zin volgt.",Het hoofdlijnenakkoord van het kabinet-in-wording begint met een gedicht. Nederland is een <extra_id_0> land om trots op te zijn. En zo gaat het <extra_id_1> totdat er onverwacht een lange zin volgt.,"Het hoofdlijnenakkoord van het kabinet-in-wording begint met een gedicht. Nederland is een land om trots op te zijn, een land om trots op te zijn. En zo gaat het totdat er onverwacht een lange zin volgt.","['prachtig land./ Een', 'nog een beetje door,']","['land om trots op te zijn, een', '']",7,20,1,"[0.8275862068965517, 1.0]",0.91
seq72-0,base,Tijdens de eerste twee dagen van festival Best Kept Secret was het de New Yorkse St.,Tijdens de eerste twee dagen van festival Best Kept Secret was het <extra_id_0> St.,Tijdens de eerste twee dagen van festival Best Kept Secret was het bezoek van St.,['de New Yorkse'],['bezoek van'],3,20,1,[0.7692307692307693],0.77
seq73-0,base,Verwachtingen voor een staakt-het-vuren zijn dit weekend flink getemperd. Ultrarechtse leden van de Isralische regering dreigen met opstappen als Isral instemt met voorstel van de VS.,Verwachtingen voor een staakt-het-vuren zijn dit weekend flink getemperd. Ultrarechtse <extra_id_0> de Isralische regering dreigen <extra_id_1> Isral instemt met voorstel van de VS.,Verwachtingen voor een staakt-het-vuren zijn dit weekend flink getemperd. Ultrarechtse maatregelen van de Isralische regering dreigen zich te verspreiden als Isral instemt met voorstel van de VS.,"['leden van', 'met opstappen als']","['maatregelen van', 'zich te verspreiden als']",5,20,1,"[0.5333333333333333, 0.6086956521739131]",0.57
